index,url,valid,domain,title,description,image,published,archive,content,quote,language,keyword
https://www.focus.de/auto/viele-achten-nicht-drauf-dieses-kleine-symbol-muessen-winterreifen-ab-1-oktober-haben_id_260354489.html,https://www.focus.de/auto/viele-achten-nicht-drauf-dieses-kleine-symbol-muessen-winterreifen-ab-1-oktober-haben_id_260354489.html,0,www.focus.de,Viele achten nicht drauf - Dieses kleine Symbol müssen Winterreifen ab 1. Oktober haben,"Wer seine alten Winterreifen auch in diesem Winter wieder verwenden will, muss genau hinschauen. Alte Reifen haben ihre Zulassung verloren. An diesem Symbol erkennen Sie, ob Ihr Winterreifen noch gültig ist",https://p6.focus.de/img/auto/id_260341722/m-s-winterreifen-ohne-alpinezeichen-ab-sofort-unzulaessig.jpg?im=Crop%3D%280%2C60%2C1920%2C960%29%3BResize%3D%281200%2C627%29&impolicy=perceptual&quality=mediumHigh&hash=62126c524cb79f8346c7bab67e55198305406f404eade14c6c8adea531717a0d,2024-10-01T04:00:00Z,https://web.archive.org/web/20241001073806/https://www.focus.de/auto/viele-achten-nicht-drauf-dieses-kleine-symbol-muessen-winterreifen-ab-1-oktober-haben_id_260354489.html,"Wer seine alten Winterreifen auch in diesem Winter wieder verwenden will, muss genau hinschauen. Alte Reifen haben ihre Zulassung verloren. An diesem Symbol erkennen Sie, ob Ihr Winterreifen noch gül… [+1698 chars]",,de,'Winter'
https://www.stern.de/gesellschaft/regional/berlin-brandenburg/wetter--regen-und-wolken-in-berlin-und-brandenburg---teils-gewitter-35108700.html,https://www.stern.de/gesellschaft/regional/berlin-brandenburg/wetter--regen-und-wolken-in-berlin-und-brandenburg---teils-gewitter-35108700.html,0,www.stern.de,Wetter: Regen und Wolken in Berlin und Brandenburg - teils Gewitter,"Berlin/Potsdam (bb) - Auf Regen, viele Wolken und einzelne Gewitter müssen sich die Menschen in Berlin und Brandenburg einstellen. Der Himmel ist zunächst",https://image.stern.de/35108702/t/hS/v1/w1440/r1.7778/-/01--nm2gp7lqgkv20axw800h600jpeg---835d5da85ed278a0.jpg,2024-10-01T04:15:38Z,https://web.archive.org/web/20241001052121/https://www.stern.de/gesellschaft/regional/berlin-brandenburg/wetter--regen-und-wolken-in-berlin-und-brandenburg---teils-gewitter-35108700.html,"In Berlin und Brandenburg wird der Tag regnerisch. Auch einzelne Gewitter kündigt der Deutsche Wetterdienst an.
Auf Regen, viele Wolken und einzelne Gewitter müssen sich die Menschen in Berlin und B… [+680 chars]",,de,'Gewitter'
https://www.zeit.de/news/2024-10/01/regen-und-wolken-in-berlin-und-brandenburg-teils-gewitter,https://www.zeit.de/news/2024-10/01/regen-und-wolken-in-berlin-und-brandenburg-teils-gewitter,0,www.zeit.de,Wetter: Regen und Wolken in Berlin und Brandenburg - teils Gewitter,Hier finden Sie Informationen zu dem Thema „Wetter“. Lesen Sie jetzt „Regen und Wolken in Berlin und Brandenburg - teils Gewitter“.,https://img.zeit.de/news/2024-10/01/regen-und-wolken-in-berlin-und-brandenburg-teils-gewitter-image-group/wide__1300x731,2024-10-01T04:15:38Z,https://web.archive.org/web/20241004084701/https://www.zeit.de/news/2024-10/01/regen-und-wolken-in-berlin-und-brandenburg-teils-gewitter,"Auf Regen, viele Wolken und einzelne Gewitter müssen sich die Menschen in Berlin und Brandenburg einstellen. Der Himmel ist zunächst bedeckt und Regen zieht von Südwest nach Nordost, wie der Deutsche… [+557 chars]",,de,'Gewitter'
https://www.tagesspiegel.de/berlin/wetter-regen-und-wolken-in-berlin-und-brandenburg-teils-gewitter-12465164.html,https://www.tagesspiegel.de/berlin/wetter-regen-und-wolken-in-berlin-und-brandenburg-teils-gewitter-12465164.html,0,www.tagesspiegel.de,Wetter: Regen und Wolken in Berlin und Brandenburg - teils Gewitter,In Berlin und Brandenburg wird der Tag regnerisch. Auch einzelne Gewitter kündigt der Deutsche Wetterdienst an.,https://www.tagesspiegel.de/images/12465161/alternates/BASE_16_9_W1400/1727756206000/regnerisches-wetter-in-brandenburg.jpeg,2024-10-01T04:16:46Z,https://web.archive.org/web/20241002014146/https://www.tagesspiegel.de/berlin/wetter-regen-und-wolken-in-berlin-und-brandenburg-teils-gewitter-12465164.html,"Auf Regen, viele Wolken und einzelne Gewitter müssen sich die Menschen in Berlin und Brandenburg einstellen. Der Himmel ist zunächst bedeckt und Regen zieht von Südwest nach Nordost, wie der Deutsche… [+652 chars]",,de,'Gewitter'
https://www.tagesschau.de/wirtschaft/verbraucher/autoreifen-schneeflocke-symbol-100.html,https://www.tagesschau.de/wirtschaft/verbraucher/autoreifen-schneeflocke-symbol-100.html,0,www.tagesschau.de,Ab 1. Oktober: Neue Regeln für Autoreifen bei Eis und Schnee,"Autoreifen für Schnee und Eis müssen ab heute mit dem sogenannten Alpine-Symbol gekennzeichnet sein. Wer mit bestimmten älteren Reifen unterwegs ist, riskiert ein Bußgeld. Von Jens Eberl.",https://images.tagesschau.de/image/79208574-d155-46f7-8f66-a78fe6d91eaa/AAABkkL7Hcc/AAABkZLhkrw/16x9-1280/allwetterreifen-102.jpg,2024-10-01T04:34:51Z,https://web.archive.org/web/20241001044330/https://www.tagesschau.de/wirtschaft/verbraucher/autoreifen-schneeflocke-symbol-100.html,"Stand: 01.10.2024 06:34 Uhr
Autoreifen für Schnee und Eis müssen ab heute mit dem sogenannten Alpine-Symbol gekennzeichnet sein. Wer mit bestimmten älteren Reifen unterwegs ist, riskiert ein Bußgeld… [+4208 chars]",,de,'Schnee'
https://www.morgenpost.de/berlin/article407374942/jetzt-erfasst-der-herbst-berlin-mit-voller-wucht.html,https://www.morgenpost.de/berlin/article407374942/jetzt-erfasst-der-herbst-berlin-mit-voller-wucht.html,0,www.morgenpost.de,Jetzt erfasst der Herbst Berlin mit voller Wucht,"Kühle Temperaturen, viel Regen – und örtlich sogar Gewitter: Der Oktober startet in Berlin alles andere als golden. Die Vorhersage.",https://img.sparknews.funkemedien.de/407374941/407374941_1727758601_v16_9_1600.jpeg,2024-10-01T04:56:34Z,https://web.archive.org/web/20241001053949/https://www.morgenpost.de/berlin/article407374942/jetzt-erfasst-der-herbst-berlin-mit-voller-wucht.html,"Berlin. Kühle Temperaturen, viel Regen und örtlich sogar Gewitter: Der Oktober startet in Berlin alles andere als golden. Die Vorhersage.
Der Herbst ist da und erfasst Berlin heute und in den nächst… [+2472 chars]",,de,'Gewitter'
https://www.stern.de/gesellschaft/regional/sachsen/wetter--regnerische-aussichten-fuer-sachsen-35108736.html,https://www.stern.de/gesellschaft/regional/sachsen/wetter--regnerische-aussichten-fuer-sachsen-35108736.html,0,www.stern.de,Wetter: Regnerische Aussichten für Sachsen,Den Regenschirm sollte man nicht zu Hause lassen: Regen und unbeständiges Wetter setzen sich bei herbstlichen Temperaturen bis zum Ende der Woche hin fort. Auch einzelne Gewitter sind möglich.,https://image.stern.de/35108738/t/HF/v1/w1440/r1.7778/-/01--cr26k5urrbv13axw800h600jpeg---7688a9b6ff590ff4.jpg,2024-10-01T04:56:36Z,https://web.archive.org/web/20241001052313/https://www.stern.de/gesellschaft/regional/sachsen/wetter--regnerische-aussichten-fuer-sachsen-35108736.html,"Den Regenschirm sollte man nicht zu Hause lassen: Regen und unbeständiges Wetter setzen sich bei herbstlichen Temperaturen bis zum Ende der Woche hin fort. Auch einzelne Gewitter sind möglich.
Die M… [+838 chars]",,de,'Gewitter'
https://www.n-tv.de/ratgeber/So-fahren-Sie-sicherer-bei-Nebel-article25256529.html,https://www.n-tv.de/ratgeber/So-fahren-Sie-sicherer-bei-Nebel-article25256529.html,0,www.n-tv.de,Weiße Wand: So fahren Sie sicherer bei Nebel,"Sie können es nicht mehr hören, wie golden und sonnig der Herbst doch ist? Bitte sehr: Er ist auch oft nasskalt und nebelig. Und Nebel ist gefährlich für Autofahrer – so kommen Sie sicherer durch.",https://bilder3.n-tv.de/img/incoming/crop23612690/4931329018-cImg_16_9-w1200/Mystische-Stimmung-aber-auch-gefahrlich-Bei-schlechten-Lichtverhaltnissen-kommt-es-auf-eine-funktionierende-Lichtanlage-und-beste-Sicht-durch-die-Autoscheiben-an.jpg,2024-10-01T05:09:29Z,https://web.archive.org/web/20241001052115/https://www.n-tv.de/ratgeber/So-fahren-Sie-sicherer-bei-Nebel-article25256529.html,"Sie können es nicht mehr hören, wie golden und sonnig der Herbst doch ist? Bitte sehr: Er ist auch oft nasskalt und nebelig. Und Nebel ist gefährlich für Autofahrer so kommen Sie sicherer durch.
Vor… [+1749 chars]",,de,'Herbst'
https://www.stern.de/gesellschaft/regional/sachsen-anhalt/wetter--unbestaendige-aussichten--regen--sturm-und-gewitter-35108772.html,https://www.stern.de/gesellschaft/regional/sachsen-anhalt/wetter--unbestaendige-aussichten--regen--sturm-und-gewitter-35108772.html,0,www.stern.de,"Wetter: Unbeständige Aussichten: Regen, Sturm und Gewitter",Das herbstliche Schmuddelwetter mit viel Regen setzt sich bis zum Ende der Woche hin fort. Also heißt es für den Freistaat: Mantel und Schirm nicht vergessen.,https://image.stern.de/35108774/t/tn/v1/w1440/r1.7778/-/01--5jdycs5oxxv19axw800h600jpeg---b9142c61d96b0ec0.jpg,2024-10-01T05:25:50Z,https://web.archive.org/web/20241001054939/https://www.stern.de/gesellschaft/regional/sachsen-anhalt/wetter--unbestaendige-aussichten--regen--sturm-und-gewitter-35108772.html,"Das herbstliche Schmuddelwetter mit viel Regen setzt sich bis zum Ende der Woche hin fort. Also heißt es für den Freistaat: Mantel und Schirm nicht vergessen.
Regen, Sturmböen sowie einzelne Gewitte… [+1078 chars]",,de,'Gewitter'
https://www.zeit.de/news/2024-10/01/unbestaendige-aussichten-regen-sturm-und-gewitter,https://www.zeit.de/news/2024-10/01/unbestaendige-aussichten-regen-sturm-und-gewitter,0,www.zeit.de,"Wetter: Unbeständige Aussichten: Regen, Sturm und Gewitter","Hier finden Sie Informationen zu dem Thema „Wetter“. Lesen Sie jetzt „Unbeständige Aussichten: Regen, Sturm und Gewitter“.",https://img.zeit.de/news/2024-10/01/unbestaendige-aussichten-regen-sturm-und-gewitter-image-group/wide__1300x731,2024-10-01T05:25:50Z,https://web.archive.org/web/20241002090938/https://www.zeit.de/news/2024-10/01/unbestaendige-aussichten-regen-sturm-und-gewitter,"Regen, Sturmböen sowie einzelne Gewitter dominieren das Wetter der nächsten Tage. Ein Tief über der südlichen Nordsee bringt nach Angaben des Deutschen Wetterdienstes (DWD) unbeständiges Wetter für d… [+1603 chars]",,de,'Gewitter'
https://www.stern.de/auto/neue-reifen-regeln--fuer-diese-pneus-gelten-ab-oktober-strafen-35040150.html,https://www.stern.de/auto/neue-reifen-regeln--fuer-diese-pneus-gelten-ab-oktober-strafen-35040150.html,0,www.stern.de,Mobilität: Ab dem 1. Oktober drohen Strafen: Diese Autoreifen sollten Sie nicht mehr fahren,"Besitzer von alten Reifen aufgepasst: Ende September ist die Übergangsfrist für Pneus mit einer bestimmten Kennzeichnung ausgelaufen. Wer im Winter erwischt wird, muss zahlen.",https://image.stern.de/35040148/t/iI/v4/w1440/r1.7778/-/reifen-winterreifen-m-s.jpg,2024-10-01T05:57:00Z,https://web.archive.org/web/20241001060550/https://www.stern.de/auto/neue-reifen-regeln--fuer-diese-pneus-gelten-ab-oktober-strafen-35040150.html,"Ein vollständiges Verbot, wie viele Medien schreiben, ist es nicht. Aber: Wer ab dem 1. Oktober mit Reifen unterwegs ist, auf denen lediglich das ""M+S""-Symbol zu finden ist, muss ganz genau aufs Wett… [+3145 chars]",,de,'Winter'
https://www.stern.de/gesellschaft/regional/thueringen/wetter--herbstliches-schmuddelwetter-truebt-die-aussichten-35108856.html,https://www.stern.de/gesellschaft/regional/thueringen/wetter--herbstliches-schmuddelwetter-truebt-die-aussichten-35108856.html,0,www.stern.de,Wetter: Herbstliches Schmuddelwetter trübt die Aussichten,Erfurt (th) - Im Verlauf der Woche erwartet die Menschen in Thüringen herbstliches Schmuddelwetter mit viel Regen. Ein Tief über der südlichen Nordsee ist,https://image.stern.de/35108858/t/-t/v1/w1440/r1.7778/-/01--qjgkrsjoxfv15axw800h600jpeg---f5d404444332af54.jpg,2024-10-01T06:30:24Z,https://web.archive.org/web/20241001070419/https://www.stern.de/gesellschaft/regional/thueringen/wetter--herbstliches-schmuddelwetter-truebt-die-aussichten-35108856.html,"Der Oktober bringt im Verlauf dieser Woche wechselhafte Aussichten: Die Menschen erwartet mitunter viel Regen bei herbstlichen Temperaturen.
Im Verlauf der Woche erwartet die Menschen in Thüringen h… [+872 chars]",,de,'Herbst'
https://www.zeit.de/news/2024-10/01/herbstliches-schmuddelwetter-truebt-die-aussichten,https://www.zeit.de/news/2024-10/01/herbstliches-schmuddelwetter-truebt-die-aussichten,0,www.zeit.de,Wetter: Herbstliches Schmuddelwetter trübt die Aussichten,Hier finden Sie Informationen zu dem Thema „Wetter“. Lesen Sie jetzt „Herbstliches Schmuddelwetter trübt die Aussichten“.,https://img.zeit.de/news/2024-10/01/herbstliches-schmuddelwetter-truebt-die-aussichten-image-group/wide__1300x731,2024-10-01T06:30:24Z,,Im Verlauf der Woche erwartet die Menschen in Thüringen herbstliches Schmuddelwetter mit viel Regen. Ein Tief über der südlichen Nordsee ist laut dem Deutschen Wetterdienst (DWD) Grund für das wechse… [+1438 chars],,de,'Gewitter'
https://science.orf.at/stories/3226934/,https://science.orf.at/stories/3226934/,0,science.orf.at,Gewitter in Städten heftiger als auf dem Land,"In Städten sind Gewitter heftiger und häufiger als in ländlichen Gebieten. Das zeigen Forschende der Universität Lausanne in einer neuen Studie. Je größer eine Stadt, desto größer ist der Effekt. Zudem verändert sich in Städten die räumliche Verteilung von Re…",https://ibs.orf.at/science?image=https%3A%2F%2Ftubestatic.orf.at%2Fmims%2F2024%2F40%2F29%2Fcrops%2Fw%3D1200%2Ch%3D627%2Cq%3D75%2F2371912_master_905629_blitze_in_niedersachsen_2.jpg%3Fs%3D382921c690bf6e56d3aec6d8bd7c621b02647e2b,2024-10-01T07:37:42Z,https://web.archive.org/web/20241001083822/https://science.orf.at/stories/3226934/,"Während die Niederschläge bei Gewittern auf dem Land in der Regel gleichmäßig verteilt sind, fallen sie in den Städten oft konzentriert auf kleine Gebiete. Das erhöht die Gefahr für Überschwemmungen.… [+1364 chars]",,de,'Gewitter'
https://www.n-tv.de/ratgeber/Diese-Reifen-sind-ab-heute-keine-Winterreifen-mehr-article25262916.html,https://www.n-tv.de/ratgeber/Diese-Reifen-sind-ab-heute-keine-Winterreifen-mehr-article25262916.html,0,www.n-tv.de,Vorsicht Bußgeld droht: Diese Reifen sind ab heute keine Winterreifen mehr,"So langsam könnte es frostig werden - womit nun auch bei vielen ein Reifenwechsel ansteht. Gut, wenn dann der Wagen dann die passenden ""Winterschuhe"" trägt. Aber Obacht, denn bestimmte Pneus gelten ab heute als ungeeignet.",https://bilder3.n-tv.de/img/incoming/crop23581334/1131328228-cImg_16_9-w1200/267521176.jpg,2024-10-01T07:49:38Z,https://web.archive.org/web/20241001082446/https://www.n-tv.de/ratgeber/Diese-Reifen-sind-ab-heute-keine-Winterreifen-mehr-article25262916.html,"So langsam könnte es frostig werden - womit nun auch bei vielen ein Reifenwechsel ansteht. Gut, wenn dann der Wagen die passenden ""Winterschuhe"" trägt. Aber Obacht, denn bestimmte Pneus gelten ab heu… [+2363 chars]",,de,'Schnee'
https://www.tagesspiegel.de/wissen/wegen-saharastaub-und-hohen-temperaturen-ruckgang-der-schweizer-gletscher-setzt-sich-fort-12466016.html,https://www.tagesspiegel.de/wissen/wegen-saharastaub-und-hohen-temperaturen-ruckgang-der-schweizer-gletscher-setzt-sich-fort-12466016.html,0,www.tagesspiegel.de,Wegen Saharastaub und hohen Temperaturen: Rückgang der Schweizer Gletscher setzt sich fort,"Durch warme Sommermonate und Saharastaub ist das Volumen der Schweizer Gletscher in diesem Jahr um 2,5 Prozent zurückgegangen. „Der August verzeichnete gar den größten Eisverlust seit Messbeginn“, wie Experten berichten.",https://www.tagesspiegel.de/images/12466040/alternates/BASE_16_9_W1400/1727769890000/gletscher-in-der-schweiz.jpeg,2024-10-01T08:29:13Z,https://web.archive.org/web/20241001091722/https://www.tagesspiegel.de/wissen/wegen-saharastaub-und-hohen-temperaturen-ruckgang-der-schweizer-gletscher-setzt-sich-fort-12466016.html,"Selbst der viele Schnee im vergangenen Winter hat den Schweizer Gletschern nur wenig genutzt: Weil es im Juli und August sehr warm war und zudem Saharastaub auf den Bergen niederging, ist das Volumen… [+2631 chars]",,de,'Sommer'
https://www.zeit.de/wissen/umwelt/2024-10/schweiz-gletscher-messungen-volumen-schnee-sommer,https://www.zeit.de/wissen/umwelt/2024-10/schweiz-gletscher-messungen-volumen-schnee-sommer,0,www.zeit.de,Schweiz: Volumen der Schweizer Gletscher schwindet deutlich,Auf viel Schnee im Winter folgten in der Schweiz heiße Sommermonate. Messungen zeigen: Das vergangene Jahr war für die Schweizer Gletscher ein Jahr der Extreme.,https://img.zeit.de/2024-10/schweizer-gletscher-schwinden-deutlich-bild/wide__1300x731,2024-10-01T08:36:36Z,https://web.archive.org/web/20241002021942/https://www.zeit.de/wissen/umwelt/2024-10/schweiz-gletscher-messungen-volumen-schnee-sommer,Das Volumen der Schweizer Gletscher ist erneut zurückgegangen. Das geht aus einem Bericht der Schweizerischen Kommission für Kryosphärenbeobachtung der Akademie der Naturwissenschaften Schweiz hervor… [+1328 chars],,de,'Schnee'
https://science.orf.at/stories/3226936/,https://science.orf.at/stories/3226936/,0,science.orf.at,Schweizer Gletscher schwinden erneut deutlich,"Selbst der viele Schnee im vergangenen Winter hat den Schweizer Gletschern nur wenig genutzt: Weil es im Juli und August sehr warm war und zudem Saharastaub auf den Bergen niederging, ist das Volumen der Gletscher in diesem Jahr um 2,5 Prozent zurückgegangen,…",https://ibs.orf.at/science?image=https%3A%2F%2Ftubestatic.orf.at%2Fmojo%2F1_4_1%2Fstoryserver%2Ftube%2Fscience%2Fimages%2Fog-fallback.jpg%3Fs%3D9468ebfda8d575e29237d4fe069891178635d8e1,2024-10-01T09:00:35Z,https://web.archive.org/web/20241001102636/https://science.orf.at/stories/3226936/,"Nach dem starken Schneefall im Winter 2023/24 sah es zunächst gut aus, teilte die Akademie mit, die sich auf Daten des Schweizer Gletschermessnetzes (Glamos) bezieht. Besonders oberhalb von 2.200 Met… [+1034 chars]",,de,'Winter'
https://www.tagesschau.de/wissen/klima/schweiz-gletscherschmelze-100.html,https://www.tagesschau.de/wissen/klima/schweiz-gletscherschmelze-100.html,0,www.tagesschau.de,Gletscher der Schweizer Alpen schmelzen trotz viel Schnee weiter,"Im vergangenen Winter fiel in den Alpen mehr Schnee als in den Vorjahren. Wirklich erholen konnten sich die Schweizer Gletscher dennoch nicht, wie Daten zeigen. Demnach schwanden sie trotzdem um weitere 2,5 Prozent.",https://images.tagesschau.de/image/6a606c96-db82-4f39-be08-21455b1efbf8/AAABkkcfY60/AAABkZLhkrw/16x9-1280/rhonegletscher-118.jpg,2024-10-01T09:56:20Z,https://web.archive.org/web/20241001102845/https://www.tagesschau.de/wissen/klima/schweiz-gletscherschmelze-100.html,"Stand: 01.10.2024 11:56 Uhr
Im vergangenen Winter fiel in den Alpen mehr Schnee als in den Vorjahren. Wirklich erholen konnten sich die Schweizer Gletscher dennoch nicht, wie Daten zeigen. Demnach s… [+2246 chars]",,de,'Schnee'
https://www.stern.de/gesellschaft/regional/mecklenburg-vorpommern/feierlichkeiten--hansestadt-stralsund-laedt-zum-landeserntedankfest-35110184.html,https://www.stern.de/gesellschaft/regional/mecklenburg-vorpommern/feierlichkeiten--hansestadt-stralsund-laedt-zum-landeserntedankfest-35110184.html,0,www.stern.de,Feierlichkeiten: Hansestadt Stralsund lädt zum Landeserntedankfest,"Der Großteil der Ernte ist eingebracht. Zeit für die Bauern in MV, Bilanz zu ziehen. Mit Stralsund richtet ein Ort das Landeserntedankfest aus, den man nicht zuerst mit Landwirtschaft verbindet.",https://image.stern.de/35110186/t/3d/v1/w1440/r1.7778/-/01--ek2z3jixriv48axw800h600jpeg---9f620b7296f35ef7.jpg,2024-10-01T11:30:11Z,https://web.archive.org/web/20241001115358/https://www.stern.de/gesellschaft/regional/mecklenburg-vorpommern/feierlichkeiten--hansestadt-stralsund-laedt-zum-landeserntedankfest-35110184.html,"Der Großteil der Ernte ist eingebracht. Zeit für die Bauern in MV, Bilanz zu ziehen. Mit Stralsund richtet ein Ort das Landeserntedankfest aus, den man nicht zuerst mit Landwirtschaft verbindet.
Die… [+2268 chars]",,de,'Ernte'
https://www.freitag.de/autoren/der-freitag/eisiges-vergnuegen-zehn-fakten-ueber-schlittschuhe,https://www.freitag.de/autoren/der-freitag/eisiges-vergnuegen-zehn-fakten-ueber-schlittschuhe,0,www.freitag.de,Glatteis | Eisiges Vergnügen: Zehn Fakten über Schlittschuhe,"Zum Tag der Einheit zeigt das ZDF „Kati – Eine Kür, die bleibt“. Katarina Witt war der erste gesamtdeutsche Superstar und ließ selbst Wessis heimlich davon träumen, Ossi zu sein. Was sonst noch so geht auf dem Eis? Unser Wochenlexikon Awie AngstEs soll Mensch…",https://www.freitag.de/autoren/der-freitag/eisiges-vergnuegen-zehn-fakten-ueber-schlittschuhe/@@images/image/great,2024-10-01T12:00:00Z,,"A
wie Angst
Es soll Menschen geben, die gerne Schlittschuh laufen. Nicht jedem geht es so. Als kleines Kind schickte mich in den 80ern meine Mutter zum Schlittschuhunterricht nach Herne. Noch immer… [+9364 chars]",,de,'Glatteis'
https://www.stern.de/familie/spinat-anbauen--warum-die-aussaat-noch-bis-oktober-moeglich-ist-35100430.html,https://www.stern.de/familie/spinat-anbauen--warum-die-aussaat-noch-bis-oktober-moeglich-ist-35100430.html,0,www.stern.de,Aussaat bis Oktober: Vitaminreiches Herbstgemüse: Darum können Sie jetzt noch Spinat anbauen,"Da Spinat auch bei kühleren Temperaturen gedeiht, eignet er sich für die Aussaat im Herbst. Was Sie beim Anbau, der Pflege und der Ernte beachten müssen, wird im Folgenden erläutert.",https://image.stern.de/35100432/t/6q/v2/w1440/r1.7778/-/spinat-anbauen.jpg,2024-10-01T13:07:00Z,https://web.archive.org/web/20241001132602/https://www.stern.de/familie/spinat-anbauen--warum-die-aussaat-noch-bis-oktober-moeglich-ist-35100430.html,"Reich an Vitaminen und Beta-Carotin, ist Spinat ein beliebtes Gemüse. Ob im Salat, als Beilage oder im Smoothie aus den Blättern lassen sich allerhand Rezeptideen umsetzen. Damit Sie das frische Grün… [+2870 chars]",,de,'Herbst'
https://www.n-tv.de/wissen/Kalter-Winter-hielt-Gletschersterben-nicht-auf-article25263016.html,https://www.n-tv.de/wissen/Kalter-Winter-hielt-Gletschersterben-nicht-auf-article25263016.html,0,www.n-tv.de,Messungen in der Schweiz: Kalter Winter hielt Gletschersterben nicht auf,"Die Schneemassen im vergangenen Winter helfen den Schweizer Gletschern nur wenig. Das Volumen des Eises verkleinert sich weiter, wie Messungen zeigen. Woran das liegt, erklärt die zuständige Behörde in der Schweiz.",https://bilder4.n-tv.de/img/incoming/crop25263055/0611326293-cImg_16_9-w1200/477588784.jpg,2024-10-01T13:18:04Z,https://web.archive.org/web/20241001163958/https://www.n-tv.de/wissen/Kalter-Winter-hielt-Gletschersterben-nicht-auf-article25263016.html,"Die Schneemassen im vergangenen Winter helfen den Schweizer Gletschern nur wenig. Das Volumen des Eises verkleinert sich weiter, wie Messungen zeigen. Woran das liegt, erklärt die zuständige Behörde … [+1639 chars]",,de,'Winter'
https://salzburg.orf.at/stories/3275459/,https://salzburg.orf.at/stories/3275459/,0,salzburg.orf.at,Zirkus: Winterfest mit vier Österreich-Premieren,Beim Zirkusfestival Winterfest im Salzburger Volksgarten gibt es heuer vier Österreich-Premieren von internationalen Compagnien. Auch vier heimische Zirkuskünstler zeigen unter dem Titel „Circus Vision“ ihre aktuellen Arbeiten. Das Festival dauert von 27. Nov…,https://ibs.orf.at/sbg?image=https%3A%2F%2Foekastatic.orf.at%2Fmims%2F2024%2F40%2F04%2Fcrops%2Fw%3D1200%2Ch%3D627%2Cq%3D75%2F2372409_master_905804_winterfest.jpg%3Fs%3D28cf352880d3836c97523001fe09eb16d04793a9,2024-10-01T14:04:12Z,https://web.archive.org/web/20241001141949/https://salzburg.orf.at/stories/3275459/,"Das Salzburger Winterfest biete auch heuer wieder ein außergewöhnliches Programm, sagte Robert Seguin, Geschäftsführer und künstlerischer Leiter des Festivals am Dienstag bei einem Pressegespräch. Vo… [+2151 chars]",,de,'Winter'
https://oe3.orf.at/stories/3043893/,https://oe3.orf.at/stories/3043893/,0,oe3.orf.at,Der Schneepflug-Europameister ist Österreicher,<ul><li>Zum zweiten Mal hat die EM der besten Schneepflug-Fahrer stattgefunden</li><li>John Meierhofer krönte sich zum Sieger</li><li>Er hat sich gegen 26 Teams aus neun Ländern durchgesetzt</li></ul>,https://tubestatic.orf.at/static/images/site/tube/20241040/schneepflug-titel.6018150.jpg,2024-10-01T14:14:00Z,https://web.archive.org/web/20241001185615/https://oe3.orf.at/stories/3043893/,<ul><li>Zum zweiten Mal hat die EM der besten Schneepflug-Fahrer stattgefunden</li><li>John Meierhofer krönte sich zum Sieger</li><li>Er hat sich gegen 26 Teams aus neun Ländern durchgesetzt</li></ul… [+1053 chars],,de,'Schnee'
https://www.nzz.ch/panorama/trotz-dem-vielen-schnee-im-winter-auch-2024-schrumpfen-die-schweizer-gletscher-weiter-ld.1850919,https://www.nzz.ch/panorama/trotz-dem-vielen-schnee-im-winter-auch-2024-schrumpfen-die-schweizer-gletscher-weiter-ld.1850919,0,www.nzz.ch,Trotz dem vielen Schnee im Winter: Auch 2024 schrumpfen die Schweizer Gletscher weiter,Erholende Jahre für die Gletscher wurden zur Seltenheit. Denn die Sommermonate sind wegen des Klimawandels zu heiss geworden.,"https://img.nzz.ch/2024/10/01/fc84ed9a-9266-40e1-80d4-70f5db0f4a45.jpeg?width=1200&height=675&fit=bounds&quality=75&auto=webp&crop=7201,4051,x0,y693&wmark=nzz",2024-10-01T15:24:31Z,https://web.archive.org/web/20241001155833/https://www.nzz.ch/panorama/trotz-dem-vielen-schnee-im-winter-auch-2024-schrumpfen-die-schweizer-gletscher-weiter-ld.1850919,"Mit dem Schrumpfen des Rhonegletschers wird der Gletschersee immer grösser.
Die Schweizer Gletscher sind diesen Sommer um 2,5 Prozent geschrumpft. Das melden Glaziologen des Schweizerischen Gletsche… [+2900 chars]",,de,'Sommer'
