index,url,valid,domain,title,description,image,published,archive,content,quote,language,keyword
https://www.faz.net/aktuell/gesellschaft/gesundheit/janosch-dahmen-masken-im-herbst-im-gesundheitswesen-sinnvoll-19142805.html,https://www.faz.net/aktuell/gesellschaft/gesundheit/janosch-dahmen-masken-im-herbst-im-gesundheitswesen-sinnvoll-19142805.html,0,www.faz.net,Grünen-Gesundheitspolitiker empfiehlt im Herbst Masken im Gesundheitswesen,"In Krankenhäusern, Praxen und Altenheimen könnten Schutzmasken bald wieder sinnvoll sein, sagt Janosch Dahmen. Der Grünen-Gesundheitspolitiker verweist auf steigende Infektionszahlen bei Grippe und Covid-19.",https://media0.faz.net/ppmedia/aktuell/4084923106/1.9142836/facebook_teaser/intensivfachpflegerinnen.jpg,2023-09-01T01:45:14Z,https://web.archive.org/web/20230903014717/https://www.faz.net/aktuell/gesellschaft/gesundheit/janosch-dahmen-masken-im-herbst-im-gesundheitswesen-sinnvoll-19142805.html,"Der gesundheitspolitische Sprecher der Grünen-Bundestagsfraktion, Janosch Dahmen, hat empfohlen, im Herbst in bestimmten Situationen wieder Masken zu tragen. Um sich vor akuten Atemwegserkrankungen z… [+1637 chars]",,de,'Herbst'
https://www.stern.de/gesellschaft/regional/sachsen/wetter--wieder-steigende-temperaturen-am-wochenende-in-sachsen-33786462.html,https://www.stern.de/gesellschaft/regional/sachsen/wetter--wieder-steigende-temperaturen-am-wochenende-in-sachsen-33786462.html,0,www.stern.de,Wetter: Wieder steigende Temperaturen am Wochenende in Sachsen,"Mit langsam wieder steigenden Temperaturen kehrt der Sommer am Wochenende noch einmal nach Sachsen zurück. Zudem lässt der Regen nach, wie der Deutsche Wetterdienst in Leipzig mitteilte. Demnach ist es am Freitag bei maximal 17 bis 21 Grad noch stark bewölkt …",https://image.stern.de/33786464/t/8B/v1/w1440/r1.7778/-/01--urnnewsmldpacom200901012309019934877v3w800h600l258t717r1538b1570jpeg---0fa1f49f0aa126f9.jpg,2023-09-01T04:47:17Z,https://web.archive.org/web/20230902235316/https://www.stern.de/gesellschaft/regional/sachsen/wetter--wieder-steigende-temperaturen-am-wochenende-in-sachsen-33786462.html,"Mit langsam wieder steigenden Temperaturen kehrt der Sommer am Wochenende noch einmal nach Sachsen zurück. Zudem lässt der Regen nach, wie der Deutsche Wetterdienst in Leipzig mitteilte. Demnach ist … [+726 chars]",,de,'Gewitter'
https://www.stern.de/gesellschaft/regional/nordrhein-westfalen/vorhersage--wetter-in-nordrhein-westfalen-bleibt-wechselhaft-33786470.html,https://www.stern.de/gesellschaft/regional/nordrhein-westfalen/vorhersage--wetter-in-nordrhein-westfalen-bleibt-wechselhaft-33786470.html,0,www.stern.de,Vorhersage: Wetter in Nordrhein-Westfalen bleibt wechselhaft,"In Nordrhein-Westfalen bleibt das Wetter über das Wochenende wechselhaft. Am Freitag gebe es Schauer, vereinzelt seien auch Gewitter gering wahrscheinlich, teilte der Deutsche Wetterdienst (DWD) mit. Die Höchsttemperaturen liegen zwischen 17 und 21 Grad, in H…",https://image.stern.de/33786472/t/g2/v1/w1440/r1.7778/-/01--urnnewsmldpacom200901012309019934905v3w800h600l640t425r1920b1278jpeg---a458b14da81807f5.jpg,2023-09-01T04:53:49Z,https://web.archive.org/web/20230901051533/https://www.stern.de/gesellschaft/regional/nordrhein-westfalen/vorhersage--wetter-in-nordrhein-westfalen-bleibt-wechselhaft-33786470.html,"In Nordrhein-Westfalen bleibt das Wetter über das Wochenende wechselhaft. Am Freitag gebe es Schauer, vereinzelt seien auch Gewitter gering wahrscheinlich, teilte der Deutsche Wetterdienst (DWD) mit.… [+996 chars]",,de,'Gewitter'
https://www.focus.de/panorama/wetter-aktuell/wetter-in-deutschland-auf-herbstliches-wetter-folgt-zum-wochenende-der-spaetsommer_id_54933749.html,https://www.focus.de/panorama/wetter-aktuell/wetter-in-deutschland-auf-herbstliches-wetter-folgt-zum-wochenende-der-spaetsommer_id_54933749.html,0,www.focus.de,Wetter im Ticker - Auf herbstliches Wetter folgt am Wochenende der Spätsommer,Nach mehreren Tagen mit schwerem Unwetter in weiten Teilen Süddeutschlands folgt nun deutschlandweit noch einmal der Spätsommer. Über das Wochenende werden Temperaturen bis zu 30 Grad erwartet. Lesen Sie alle News im Ticker.,https://p6.focus.de/img/fotos/id_12492900/urn-newsml-dpa-com-20090101-201001-99-781682-large-4-3.jpg?im=Crop%3D%280%2C100%2C800%2C400%29%3BResize%3D%281200%2C627%29&impolicy=perceptual&quality=mediumHigh&hash=e9d732d97b045bf38dad7ea20cec4670bf3b635b584cc5d8e68077b429d3475a,2023-09-01T04:55:55Z,https://web.archive.org/web/20230903000800/https://www.focus.de/panorama/wetter-aktuell/wetter-in-deutschland-auf-herbstliches-wetter-folgt-zum-wochenende-der-spaetsommer_id_54933749.html,Nach mehreren Tagen mit schwerem Unwetter in weiten Teilen Süddeutschlands folgt nun deutschlandweit noch einmal der Spätsommer. Über das Wochenende werden Temperaturen bis zu 30 Grad erwartet. Lesen… [+10599 chars],,de,'Herbst'
https://www.stern.de/gesellschaft/regional/rheinland-pfalz-saarland/vorhersage--wechselhaftes-wetter-in-rheinland-pfalz-und-dem-saarland-33786508.html,https://www.stern.de/gesellschaft/regional/rheinland-pfalz-saarland/vorhersage--wechselhaftes-wetter-in-rheinland-pfalz-und-dem-saarland-33786508.html,0,www.stern.de,Vorhersage: Wechselhaftes Wetter in Rheinland-Pfalz und dem Saarland,"In Rheinland-Pfalz und im Saarland müssen sich die Menschen auf wechselhaftes Wetter einstellen. Am Freitag gebe es in den beiden Bundesländern Regen, vereinzelt seien auch Gewitter gering wahrscheinlich, teilte der Deutsche Wetterdienst (DWD) mit. Die Temper…",https://image.stern.de/33786510/t/RQ/v1/w1440/r1.7778/-/01--urnnewsmldpacom200901012309019934924v3w800h600l389t542r2001b1653jpeg---6918a38bc524cb79.jpg,2023-09-01T04:56:16Z,https://web.archive.org/web/20230903003420/https://www.stern.de/gesellschaft/regional/rheinland-pfalz-saarland/vorhersage--wechselhaftes-wetter-in-rheinland-pfalz-und-dem-saarland-33786508.html,"In Rheinland-Pfalz und im Saarland müssen sich die Menschen auf wechselhaftes Wetter einstellen. Am Freitag gebe es in den beiden Bundesländern Regen, vereinzelt seien auch Gewitter gering wahrschein… [+1141 chars]",,de,'Gewitter'
https://www.zeit.de/2023/37/eckart-strate-spiekeroog-duenensingen,https://www.zeit.de/2023/37/eckart-strate-spiekeroog-duenensingen,0,www.zeit.de,Eckart Strate auf Spiekeroog: Seine Bühne: Eine Düne,"Eckart Strate verbringt seit Jahren den Sommer und Herbst auf Spiekeroog – und singt. Warum? Lange Geschichte, aber echt interessant.",,2023-09-01T05:14:27Z,https://web.archive.org/web/20230902093106/https://www.zeit.de/2023/37/eckart-strate-spiekeroog-duenensingen,"When browsing with ads:
We collect personal data and also transmit it to third-party providers
 that help us improve and finance our digital content. Some of the information stored on your device, … [+821 chars]",,de,'Sommer'
https://www.stern.de/gesellschaft/regional/hessen/vorhersage--wetter-in-hessen-uebers-wochenende-wechselhaft-33786534.html,https://www.stern.de/gesellschaft/regional/hessen/vorhersage--wetter-in-hessen-uebers-wochenende-wechselhaft-33786534.html,0,www.stern.de,Vorhersage: Wetter in Hessen übers Wochenende wechselhaft,"Den Menschen in Hessen steht in den kommenden Tagen wechselhaftes Wetter bevor. Am Freitag gebe es Regen, vereinzelt seien auch Gewitter gering wahrscheinlich, teilte der Deutsche Wetterdienst (DWD) mit. Die Temperaturen liegen demnach bei Höchstwerten von 18…",https://image.stern.de/33786536/t/uQ/v1/w1440/r1.7778/-/01--urnnewsmldpacom200901012309019935159v3w800h600l640t425r1920b1275jpeg---9d4afaa7820524c6.jpg,2023-09-01T05:22:16Z,https://web.archive.org/web/20230907123051/https://www.stern.de/gesellschaft/regional/hessen/vorhersage--wetter-in-hessen-uebers-wochenende-wechselhaft-33786534.html,"Den Menschen in Hessen steht in den kommenden Tagen wechselhaftes Wetter bevor. Am Freitag gebe es Regen, vereinzelt seien auch Gewitter gering wahrscheinlich, teilte der Deutsche Wetterdienst (DWD) … [+1024 chars]",,de,'Gewitter'
https://kaernten.orf.at/stories/3222244/,https://kaernten.orf.at/stories/3222244/,0,kaernten.orf.at,Meistgeklickt im August,"Die kaernten.ORF.at-Beiträge, die die Leserinnen und Leser im August am meisten interessierten, waren die Folgen der verheerenden Regenfälle und Gewitter im August. Muren, Hangrutschungen und Überschwemmungen wurden ausgelöst, ein Radfahrer wurde von den Flut…",https://ibs.orf.at/ktn?image=https%3A%2F%2Foekastatic.orf.at%2Fmims%2F2023%2F31%2F98%2Fcrops%2Fw%3D1200%2Ch%3D627%2Cq%3D75%2F1890225_master_708598_unwetter_bleiburg_matha5.jpg%3Fs%3D1faf0a2f490c258a79d3c51ad30fd6b5d31c2fe3,2023-09-01T05:38:21Z,https://web.archive.org/web/20230902011845/https://kaernten.orf.at/stories/3222244/,"Anfang August, in der Nacht auf Freitag, den 4. August gab es heftige Regenfälle in den Unterkärntner Bezirken, Wolfsberg, Völkermarkt und in Klagenfurt-Land. Etliche Zivilschutzwarnungen werden ausg… [+1754 chars]",,de,'Gewitter'
https://www.welt.de/politik/deutschland/article247230702/Wegen-Covid-19-Gruenen-Politiker-Dahmen-empfiehlt-Tragen-von-Schutzmasken-im-Herbst.html,https://www.welt.de/politik/deutschland/article247230702/Wegen-Covid-19-Gruenen-Politiker-Dahmen-empfiehlt-Tragen-von-Schutzmasken-im-Herbst.html,0,www.welt.de,Grünen-Politiker Dahmen empfiehlt Tragen von Schutzmasken im Herbst,"Im Herbst könnten Kliniken erneut unter Druck geraten, warnt Gesundheitsexperte Janosch Dahmen. Er empfiehlt deshalb FFP2-Masken für Bewohner, Patienten und Beschäftigte von Altenheimen und Kliniken. Ab Mitte September ist zudem ein neuer Corona-Impfstoff ver…",https://img.welt.de/img/politik/deutschland/mobile247230708/0721352907-ci16x9-w1200/Janosch-Dahmen.jpg,2023-09-01T05:42:48Z,,"Der gesundheitspolitische Sprecher der Grünen-Bundestagsfraktion, Janosch Dahmen, hat empfohlen, im Herbst wieder Masken zu tragen. Um sich vor akuten Atemwegserkrankungen zu schützen, kann es auch i… [+2954 chars]",,de,'Herbst'
https://www.stern.de/familie/winterharte-balkonpflanzen--diese-sorten-eignen-sich-fuer-draussen-9491084.html,https://www.stern.de/familie/winterharte-balkonpflanzen--diese-sorten-eignen-sich-fuer-draussen-9491084.html,0,www.stern.de,Dekorativ und pflegeleicht: Balkonpflanzen für Herbst und Winter: Diese Gewächsen vertragen kalte Temperaturen,"So schön Balkonpflanzen auch sind, so haben die meisten von ihnen leider ein Verfallsdatum: Wenn die Temperaturen sinken, finden sich in vielen Blumenkübeln nur noch welke Pflanzenreste bis zum nächsten Frühjahr. Dabei gibt es winterharte Pflanzen, die den Ba…",https://image.stern.de/9491086/t/8-/v3/w1440/r1.7778/-/balkonpflanzen-winterhart.jpg,2023-09-01T05:45:00Z,,"Damit empfindliche Pflanzen im Herbst und Winter nicht eingehen, können sie übergangsweise ins Haus geholt und an einem kühlen Ort gelagert werden. Wer jedoch nicht den Platz dafür hat oder seinen Ba… [+5069 chars]",,de,'Herbst'
https://taz.de/Duerre-in-Syrien/!5920711/,https://taz.de/Duerre-in-Syrien/!5920711/,0,taz.de,Dürre in Syrien: Die Kinder tragen die Wasserlast,In Syrien macht Trockenheit den Menschen zu schaffen und Krankheiten breiten sich aus. Tägliches Wasserholen prägt besonders das Leben der Kleinsten.,https://taz.de/picture/6138217/948/33393653-1.jpeg,2023-09-01T06:12:00Z,https://web.archive.org/web/20230901161058/https://taz.de/Duerre-in-Syrien/!5920711/,"In Syrien macht Trockenheit den Menschen zu schaffen und Krankheiten breiten sich aus. Tägliches Wasserholen prägt besonders das Leben der Kleinsten.
Tagein, tagaus Wasser nach Hause bringen teilwei… [+6621 chars]",,de,'Dürre'
https://www.zeit.de/news/2023-09/01/apfelbauern-erwarten-sehr-spritzige-und-suess-saeuerliche-aepfel,https://www.zeit.de/news/2023-09/01/apfelbauern-erwarten-sehr-spritzige-und-suess-saeuerliche-aepfel,0,www.zeit.de,Ernte: Apfelbauern erwarten sehr spritzige und süß-säuerliche Äpfel,,,2023-09-01T07:35:01Z,,"When browsing with ads:
We collect personal data and also transmit it to third-party providers
 that help us improve and finance our digital content. Some of the information stored on your device, … [+821 chars]",,de,'Ernte'
https://www.stern.de/gesellschaft/regional/sachsen-anhalt/ernte--apfelbauern-erwarten-sehr-spritzige-und-suess-saeuerliche-aepfel-33786882.html,https://www.stern.de/gesellschaft/regional/sachsen-anhalt/ernte--apfelbauern-erwarten-sehr-spritzige-und-suess-saeuerliche-aepfel-33786882.html,0,www.stern.de,Ernte: Apfelbauern erwarten sehr spritzige und süß-säuerliche Äpfel,"Die Obstbauern in Sachsen-Anhalt erwarten in diesem Jahr zwar keine überdurchschnittliche Erntemenge, dafür aber spritzige und süß-säuerliche Äpfel. Wegen der feuchten Witterung im Juli und August würden gute Fruchtgrößen erwartet, teilte der Landesverband Sä…",https://image.stern.de/33786884/t/S4/v1/w1440/r1.7778/-/01--urnnewsmldpacom200901012309019936171v3w800h600l640t379r1920b1140jpeg---a14362146a564af4.jpg,2023-09-01T07:35:01Z,https://web.archive.org/web/20230903021614/https://www.stern.de/gesellschaft/regional/sachsen-anhalt/ernte--apfelbauern-erwarten-sehr-spritzige-und-suess-saeuerliche-aepfel-33786882.html,"Die Obstbauern in Sachsen-Anhalt erwarten in diesem Jahr zwar keine überdurchschnittliche Erntemenge, dafür aber spritzige und süß-säuerliche Äpfel. Wegen der feuchten Witterung im Juli und August wü… [+1580 chars]",,de,'Ernte'
https://www.nzz.ch/wirtschaft/expertengruppe-fasst-die-ubs-mit-samthandschuhen-an-ld.1754148,https://www.nzz.ch/wirtschaft/expertengruppe-fasst-die-ubs-mit-samthandschuhen-an-ld.1754148,0,www.nzz.ch,"Der Notfallplan für die Credit Suisse hätte funktioniert, glaubt die Expertengruppe des Bundes – und fasst die UBS mit Samthandschuhen an",Bei einer künftigen Krise der UBS soll die Finanzmarktaufsicht früher mit drastischen Mitteln eingreifen können. Die Nationalbank soll zudem mit Liquiditätshilfen flexibler werden. Verschärfte Kapitalvorgaben drängen sich dagegen nicht auf. Das sagt die vom B…,"https://img.nzz.ch/2023/05/16/c26a0512-073f-466b-a24a-b6c9115a4bef.jpeg?width=1200&height=674&fit=bound&quality=75&auto=webp&crop=3556,1998,x268,y240&wmark=nzz",2023-09-01T08:30:00Z,https://web.archive.org/web/20230901120336/https://www.nzz.ch/wirtschaft/expertengruppe-fasst-die-ubs-mit-samthandschuhen-an-ld.1754148,"Eine Expertengruppe empfiehlt Reformen für die künftige Grossbankenregulierung.
Wie soll die Schweiz mit ihrer letzten verbliebenen globalen Grossbank umgehen? Könnte der Staat die Bewältigung einer… [+10984 chars]",,de,'Laub'
https://www.stern.de/gesellschaft/regional/bayern/wetter--regen--gewitter-und-sonne-im-wechsel-am-wochenende-in-bayern-33787692.html,https://www.stern.de/gesellschaft/regional/bayern/wetter--regen--gewitter-und-sonne-im-wechsel-am-wochenende-in-bayern-33787692.html,0,www.stern.de,"Wetter: Regen, Gewitter und Sonne im Wechsel am Wochenende in Bayern","Eine Mischung aus Regen, Sonne und einzelnen Gewittern erwartet die Menschen in Bayern am Wochenende. Am Freitagabend könne es lokal Gewitter mit Starkregen, Hagel und Sturmböen mit bis zu 70 Stundenkilometern geben, teilte der Deutsche Wetterdienst (DWD) am …",https://image.stern.de/33787694/t/ct/v1/w1440/r1.7778/-/01--urnnewsmldpacom200901012309019938371v2w800h600l1573t335r3956b3070jpeg---bab24ecc155ee5d9.jpg,2023-09-01T10:23:59Z,https://web.archive.org/web/20230903041208/https://www.stern.de/gesellschaft/regional/bayern/wetter--regen--gewitter-und-sonne-im-wechsel-am-wochenende-in-bayern-33787692.html,"Eine Mischung aus Regen, Sonne und einzelnen Gewittern erwartet die Menschen in Bayern am Wochenende. Am Freitagabend könne es lokal Gewitter mit Starkregen, Hagel und Sturmböen mit bis zu 70 Stunden… [+1062 chars]",,de,'Gewitter'
https://www.zeit.de/news/2023-09/01/regen-gewitter-und-sonne-im-wechsel-am-wochenende-in-bayern,https://www.zeit.de/news/2023-09/01/regen-gewitter-und-sonne-im-wechsel-am-wochenende-in-bayern,0,www.zeit.de,"Wetter: Regen, Gewitter und Sonne im Wechsel am Wochenende in Bayern",,,2023-09-01T10:23:59Z,,"When browsing with ads:
We collect personal data and also transmit it to third-party providers
 that help us improve and finance our digital content. Some of the information stored on your device, … [+821 chars]",,de,'Gewitter'
https://www.faz.net/aktuell/politik/ausland/klimawandel-warum-das-wasser-in-nordafrika-knapp-wird-19131539.html,https://www.faz.net/aktuell/politik/ausland/klimawandel-warum-das-wasser-in-nordafrika-knapp-wird-19131539.html,0,www.faz.net,Klimawandel in Nordafrika: Dem Maghreb geht das Wasser aus,"Wegen hoher Temperaturen, Dürre und Wassermangels leiden Landwirtschaft und Tourismus in Marokko und Tunesien. In Nordafrika müssen immer mehr Menschen auf dem Land ihre Wohnorte verlassen.",https://media0.faz.net/ppmedia/aktuell/gesellschaft/2385993439/1.9131612/facebook_teaser_fplus/maenner-gehen-im-nordwesten.jpg,2023-09-01T10:49:12Z,,"Ein Temperaturrekord folgt auf den nächsten, 50,4 Grad waren es unlängst in der Nähe von Agadir in Marokko die höchste Temperatur, die bisher in dem nordafrikanischen Land gemessen wurde. Kurz zuvor … [+757 chars]",,de,'Dürre'
https://www.tagesspiegel.de/berlin/bezirke/open-air-labor-der-stauden-und-graser-berlin-sucht-die-grunanlage-der-zukunft-10404883.html,https://www.tagesspiegel.de/berlin/bezirke/open-air-labor-der-stauden-und-graser-berlin-sucht-die-grunanlage-der-zukunft-10404883.html,0,www.tagesspiegel.de,Open-Air-Labor der Stauden und Gräser: Berlin sucht die Grünanlage der Zukunft,"Sie soll Dürre und Hitze, Regengüssen und Hundeurin widerstehen: Auf dem Johanneskirchplatz in Lichterfelde forschen Experten nach der optimalen klimaresistenten Bepflanzung.",https://www.tagesspiegel.de/berlin/images/jkplvga-grossbeeren-20230725-2jpg/alternates/BASE_16_9_W1400/jkplvga-grossbeeren-20230725-2jpg.jpeg,2023-09-01T14:55:59Z,,"David Zimmerling, 35, kraucht regelmäßig über den Johanneskirchplatz an der Ringstraße in Lichterfelde-West: Dort hat die Lehr- und Versuchsanstalt für Gartenbau und Arboristik aus Großbeeren im Rahm… [+135 chars]",,de,'Dürre'
https://www.tagesschau.de/inland/fraport-beinah-absturz-100.html,https://www.tagesschau.de/inland/fraport-beinah-absturz-100.html,0,www.tagesschau.de,Flugunfalluntersuchung: Beinahe-Absturz am Frankfurter Flughafen,"Bei einem schweren Gewitter im Juni ist es laut Bundesstelle für Flugunfalluntersuchung fast zu einem Flugzeugabsturz gekommen. Erst wenige Hundert Meter über dem Boden gelang es den Piloten, einen Aufprall zu verhindern.",https://images.tagesschau.de/image/7c6a7682-e8ee-4d0c-8f62-53047c666e5c/AAABilFH6P4/AAABibBxqrQ/16x9-1280/fraport-logo-103.jpg,2023-09-01T15:06:16Z,,"Stand: 01.09.2023 17:06 Uhr
Bei einem schweren Gewitter im Juni ist es laut Bundesstelle für Flugunfalluntersuchung fast zu einem Flugzeugabsturz gekommen. Erst wenige Hundert Meter über dem Boden g… [+1795 chars]",,de,'Gewitter'
https://www.nzz.ch/wirtschaft/frankreich-zahlt-winzern-200-millionen-euro-um-wein-zu-vernichten-ld.1753957,https://www.nzz.ch/wirtschaft/frankreich-zahlt-winzern-200-millionen-euro-um-wein-zu-vernichten-ld.1753957,0,www.nzz.ch,Franzosen trinken immer weniger Wein – jetzt wird ein Teil der Ernte vernichtet,Die Betriebe produzieren zu viel Wein. Denn die Franzosen konsumieren häufiger Bier als früher. Nun greift der Staat zu radikalen Mitteln. Und erste Bauern stellen auf den Anbau von Oliven um.,"https://img.nzz.ch/2023/09/01/8ab9293c-39cf-4ef0-8267-9dd793212798.jpeg?width=1200&height=674&fit=bound&quality=75&auto=webp&crop=4724,2654,x0,y249&wmark=nzz",2023-09-02T03:30:00Z,https://web.archive.org/web/20230902102135/https://www.nzz.ch/wirtschaft/frankreich-zahlt-winzern-200-millionen-euro-um-wein-zu-vernichten-ld.1753957,"Im Bordelais produzieren die Winzer zu viel Wein, für den sie zu wenig Geld erhalten.
Im Bordelais haben manche Weinbauern schon im August mit der Traubenernte begonnen. Thomas Solans aber setzt nic… [+6476 chars]",,de,'Ernte'
https://www.morgenpost.de/wirtschaft/article239344589/Raupe-frisst-Lavendel-Verband-sieht-enorme-Einbussen.html,https://www.morgenpost.de/wirtschaft/article239344589/Raupe-frisst-Lavendel-Verband-sieht-enorme-Einbussen.html,0,www.morgenpost.de,Umwelt: Raupe frisst Lavendel: Verband sieht enorme Einbußen,"Statt violett zu strahlen, sahen Frankreichs Lavendelfelder in diesem Sommer in Teilen grau aus: Eine Raupe, die mit dem Wind nach Europa gelangt sein soll, hat sich an den Pflanzen satt gefressen.",https://img.morgenpost.de/img/wirtschaft/crop239344587/83826060-w820-cv16_9-q85/Lavendel.jpg,2023-09-02T04:03:24Z,https://web.archive.org/web/20230903012259/https://www.morgenpost.de/wirtschaft/article239344589/Raupe-frisst-Lavendel-Verband-sieht-enorme-Einbussen.html,"Manosque. Eine Raupe hat Frankreichs Lavendelbauern in diesem Jahr möglicherweise Ernteverluste in Millionenhöhe beschert. 
Es gibt Dutzende und Aberdutzende Hektar, die nicht abgeerntet wurden, wei… [+2813 chars]",,de,'Ernte'
https://www.zeit.de/politik/deutschland/2023-09/energiepreise-winter-preisbremse-verbraucher,https://www.zeit.de/politik/deutschland/2023-09/energiepreise-winter-preisbremse-verbraucher,0,www.zeit.de,Energiepresie: Verbraucherschützer fordern längere Laufzeit der Energiepreisbremsen,Der Verbraucherzentrale Bundesverband fürchtet höhere Energiepreise im Winter. Die Strom- und Gaspreisbremse solle daher bis mindestens Ostern 2024 verlängert werden.,,2023-09-02T06:36:26Z,,"When browsing with ads:
We collect personal data and also transmit it to third-party providers
 that help us improve and finance our digital content. Some of the information stored on your device, … [+821 chars]",,de,'Winter'
https://www.stern.de/gesellschaft/regional/hessen/foerderung--hochwasserschutz-nach-ahrtal-flut-deutlich-erhoeht-33789790.html,https://www.stern.de/gesellschaft/regional/hessen/foerderung--hochwasserschutz-nach-ahrtal-flut-deutlich-erhoeht-33789790.html,0,www.stern.de,Förderung: Hochwasserschutz nach Ahrtal-Flut deutlich erhöht,Bei Starkregen können plötzlich auftretende Wassermassen ganze Dörfer verwüsten. Die Katastrophe im Ahrtal hat dies den Menschen vor Augen geführt. In Hessen versuchen viele Kommunen sich gegen Gefahren zu rüsten.,https://image.stern.de/33789792/t/uv/v1/w1440/r1.7778/-/02--urnnewsmldpacom200901012309029948644v3w800h600l658t0r1936b853jpeg---233fa90352d43e4f.jpg,2023-09-02T07:10:52Z,,Bei Starkregen können plötzlich auftretende Wassermassen ganze Dörfer verwüsten. Die Katastrophe im Ahrtal hat dies den Menschen vor Augen geführt. In Hessen versuchen viele Kommunen sich gegen Gefah… [+1825 chars],,de,'Hochwasser'
https://www.handelsblatt.com/unternehmen/industrie/autoindustrie-bei-vw-stockt-nach-dem-hochwasser-in-slowenien-die-produktion/29369030.html,https://www.handelsblatt.com/unternehmen/industrie/autoindustrie-bei-vw-stockt-nach-dem-hochwasser-in-slowenien-die-produktion/29369030.html,0,www.handelsblatt.com,"Autoindustrie: Schichten streichen, Kurzarbeit prüfen: Bei VW stockt nach dem Hochwasser in Slowenien die Produktion","Das Hochwasser in Slowenien hat Auswirkungen auf die Produktion von VW. Grund ist ein Zulieferer für ein wichtiges Motorenteil, das inzwischen nur eingeschränkt lieferbar ist.",https://www.handelsblatt.com/images/produktion-bei-vw-in-emden/29369060/2-format2003.jpg,2023-09-02T09:00:00Z,,"Düsseldorf Wegen fehlender Motorteile könnten dem Volkswagen-Konzern in den kommenden Wochen längere Unterbrechungen in der Produktion ins Haus stehen. Grund ist ein Zulieferer in Slowenien, der seit… [+5254 chars]",,de,'Hochwasser'
https://www.zeit.de/sport/2023-09/fussball-premier-league-transfer-summe-zwei-milliarden,https://www.zeit.de/sport/2023-09/fussball-premier-league-transfer-summe-zwei-milliarden,0,www.zeit.de,Fußball: Premier League gibt erstmals mehr als zwei Milliarden Pfund aus,"Die 20 englischen Erstligaclubs haben diesen Sommer so viel für Transfers bezahlt wie noch nie. Deutschland, Italien, Spanien und Frankreich gaben zusammen kaum mehr aus.",,2023-09-02T10:00:05Z,,"When browsing with ads:
We collect personal data and also transmit it to third-party providers
 that help us improve and finance our digital content. Some of the information stored on your device, … [+821 chars]",,de,'Sommer'
https://www.morgenpost.de/ratgeber/article239344957/hurrikans-europa-meteorologe-warnung.html,https://www.morgenpost.de/ratgeber/article239344957/hurrikans-europa-meteorologe-warnung.html,0,www.morgenpost.de,Unwetter: Meteorologe: Gefahr durch Hurrikans steigt auch in Europa,"Hochwasser, Sturmschäden, Verwüstung – Warmes Meerwasser befeuert die Hurrikan-Saison. Meteorologe warnt: Das Risiko steigt auch für Europa.",https://img.morgenpost.de/img/ratgeber/crop239344955/9742602214-w820-cv16_9-q85/b01faba2-48bd-11ee-8f8c-0cd164afafc3.jpg,2023-09-02T11:29:42Z,,Offenbach. Die Oberflächentemperaturen des Wassers im Atlantik und im Pazifik sind seit Monaten außergewöhnlich hoch. Sie befeuern die Hurrikan-Saison. Insbesondere der Nordatlantik ist so warm wie n… [+4241 chars],,de,'Hochwasser'
https://www.zeit.de/news/2023-09/02/reifeprozess-im-herbst-dardai-sucht-wieder-fuehrungsspieler,https://www.zeit.de/news/2023-09/02/reifeprozess-im-herbst-dardai-sucht-wieder-fuehrungsspieler,0,www.zeit.de,Hertha BSC: Reifeprozess im Herbst: Dardai sucht wieder Führungsspieler,,,2023-09-02T14:50:07Z,https://web.archive.org/web/20230905012146/https://www.zeit.de/news/2023-09/02/reifeprozess-im-herbst-dardai-sucht-wieder-fuehrungsspieler,"When browsing with ads:
We collect personal data and also transmit it to third-party providers
 that help us improve and finance our digital content. Some of the information stored on your device, … [+821 chars]",,de,'Herbst'
