index,published,keyword,domain,language,valid,title,description,url,image,archive,content,quote
1120faa7bca1b2b227a9f772a958e975,2025-11-01T02:30:14Z,'Skigebiete',www.zeit.de,de,0.0,Preise steigen leicht: Skigebiete in Hessen rüsten für den Winterbetrieb auf,Hier finden Sie Informationen zu dem Thema „Preise steigen leicht“. Lesen Sie jetzt „Skigebiete in Hessen rüsten für den Winterbetrieb auf“.,https://www.zeit.de/news/2025-11/01/skigebiete-in-hessen-ruesten-fuer-den-winterbetrieb-auf,https://img.zeit.de/news/2025-11/01/skigebiete-in-hessen-ruesten-fuer-den-winterbetrieb-auf-image-group/wide__1300x731,,"Noch ist Rodeln, Wandern und Biken angesagt in Hessens Skigebieten. Doch die Vorbereitungen auf die Wintersaison laufen bereits auf Hochtouren. Im größten Wintersportgebiet des Landes in Willingen (L… [+3337 chars]",
eb57a02a99ef2eff1ddaf1e34482f5f9,2025-11-01T02:30:14Z,'Skigebiete',www.stern.de,de,0.0,Preise steigen leicht: Skigebiete in Hessen rüsten für den Winterbetrieb auf,In Hessens Skigebieten laufen die Vorbereitungen für die Wintersaison. Was in Willingen und auf der Wasserkuppe jetzt schon alles für den Start getan wird.,https://www.stern.de/gesellschaft/regional/hessen/preise-steigen-leicht--skigebiete-in-hessen-ruesten-fuer-den-winterbetrieb-auf-36179836.html,https://image.stern.de/36179838/t/G2/v1/w1440/r1.7778/-/01--q4kmtakko5v9axs2048jpeg---d623c13d71e23829.jpg,,"Kopiere den aktuellen Link
Zur Merkliste hinzufügen
In Hessens Skigebieten laufen die Vorbereitungen für die Wintersaison. Was in Willingen und auf der Wasserkuppe jetzt schon alles für den Start g… [+3769 chars]",
c5a1abac4781aba129aa90538b95202b,2025-11-01T04:00:29Z,'Winterdienst',www.stern.de,de,0.0,Wetter: November startet mild - aber der Winterdienst ist startklar,"Noch ist das Wetter wenig winterlich, doch Räumfahrzeuge und Salzhallen sind vorbereitet. Offiziell startet am 1. November die Winterdienst-Saison bei Straßenmeistereien.",https://www.stern.de/gesellschaft/regional/berlin-brandenburg/wetter--november-startet-mild---aber-der-winterdienst-ist-startklar-36180018.html,https://image.stern.de/36180020/t/5D/v1/w1440/r1.7778/-/01--nfhnzkts2yv16axs2048jpeg---ce1ab77b26a3e61a.jpg,,"Kopiere den aktuellen Link
Zur Merkliste hinzufügen
Noch ist das Wetter wenig winterlich, doch Räumfahrzeuge und Salzhallen sind vorbereitet. Offiziell startet am 1. November die Winterdienst-Saiso… [+929 chars]",
4b30aea84aeb66fc745ce2a653d9490b,2025-11-01T04:00:29Z,'Winterdienst',www.zeit.de,de,0.0,Wetter: November startet mild - aber der Winterdienst ist startklar,Hier finden Sie Informationen zu dem Thema „Wetter“. Lesen Sie jetzt „November startet mild - aber der Winterdienst ist startklar“.,https://www.zeit.de/news/2025-11/01/november-startet-mild-aber-der-winterdienst-ist-startklar,https://img.zeit.de/news/2025-11/01/november-startet-mild-aber-der-winterdienst-ist-startklar-image-group/wide__1300x731,,"Noch sind Schnee und Eis laut Wetterdienst nicht in Sicht, doch die Straßenmeistereien sind bereits auf den Winterdienst vorbereitet. Offiziell beginnt am 1. November die Wintersaison, wie die Autoba… [+743 chars]",
d49bf22b08ce6a9902199a4c5013af51,2025-11-01T04:01:47Z,'Winterdienst',www.tagesspiegel.de,de,0.0,Sonniger Start: November startet mild – aber der Winterdienst ist startklar,"Noch ist das Wetter wenig winterlich, doch Räumfahrzeuge und Salzhallen sind vorbereitet. Offiziell startet am 1. November die Winterdienst-Saison bei Straßenmeistereien.",https://www.tagesspiegel.de/potsdam/brandenburg/sonniger-start-november-startet-mild--aber-der-winterdienst-ist-startklar-14720771.html,https://www.tagesspiegel.de/images/14720768/alternates/BASE_16_9_W1400/1761969706000/salzlagerhalle-des-landesbetriebs-stra-enwesen.jpeg,,"Noch sind Schnee und Eis laut Wetterdienst nicht in Sicht, doch die Straßenmeistereien sind bereits auf den Winterdienst vorbereitet. Offiziell beginnt am 1. November die Wintersaison, wie die Autoba… [+707 chars]",
cc31d5238df157f2c8b3eda44142bf1e,2025-11-02T08:36:06Z,'Frost',www.zeit.de,de,0.0,"Wetter: Kaltfront bringt Wolken, Schauer und kurze Gewitter","Hier finden Sie Informationen zu dem Thema „Wetter“. Lesen Sie jetzt „Kaltfront bringt Wolken, Schauer und kurze Gewitter“.",https://www.zeit.de/news/2025-11/02/kaltfront-bringt-wolken-schauer-und-kurze-gewitter,https://img.zeit.de/news/2025-11/02/kaltfront-bringt-wolken-schauer-und-kurze-gewitter-image-group/wide__1300x731,,"Rückseitig einer Kaltfront stellt sich am Sonntag in Hessen wechselhaftes Schauerwetter ein. Im Tagesverlauf sind kurze Gewitter möglich, wie der Deutsche Wetterdienst (DWD) mitteilte.
Es bleibt mei… [+1249 chars]",
6546a91956b73c1a4335509197fac0e6,2025-11-02T08:36:06Z,'Kaltfront',www.stern.de,de,1.0,"Wetter: Kaltfront bringt Wolken, Schauer und kurze Gewitter",Offenbach (lhe) - Rückseitig einer Kaltfront stellt sich am Sonntag in Hessen wechselhaftes Schauerwetter ein. Im Tagesverlauf sind kurze Gewitter,https://www.stern.de/gesellschaft/regional/hessen/wetter--kaltfront-bringt-wolken--schauer-und-kurze-gewitter-36181670.html,https://image.stern.de/36181672/t/Mg/v1/w1440/r1.7778/-/02--ma7os65j33v6axs2048jpeg---dec8c84c16a79e9a.jpg,,"Kopiere den aktuellen Link
Zur Merkliste hinzufügen
Eine Kaltfront sorgt für unbeständiges Wetter in Hessen. Im Süden können einzelne Gewitter auftreten. Die Temperaturen bleiben mild.
Rückseitig … [+1397 chars]",
fab65fb7302c0a2f4f891068dd521087,2025-11-02T08:48:55Z,'Frost',www.zeit.de,de,0.0,Kaltfront: Schauer und Gewitter in Rheinland-Pfalz und im Saarland,Hier finden Sie Informationen zu dem Thema „Kaltfront“. Lesen Sie jetzt „Schauer und Gewitter in Rheinland-Pfalz und im Saarland“.,https://www.zeit.de/news/2025-11/02/schauer-und-gewitter-in-rheinland-pfalz-und-im-saarland,https://img.zeit.de/news/2025-11/02/schauer-und-gewitter-in-rheinland-pfalz-und-im-saarland-image-group/wide__1300x731,,"Eine Kaltfront sorgt in Rheinland-Pfalz und im Saarland am Sonntag für wechselhaftes Schauerwetter. Laut Deutschem Wetterdienst (DWD) bleibt es meist stark bewölkt, nur im Norden lockert die Bewölkun… [+1300 chars]",
0d0246189c0ca538a08676f9b1d2cd83,2025-11-02T08:48:55Z,'Kaltfront',www.stern.de,de,1.0,Kaltfront: Schauer und Gewitter in Rheinland-Pfalz und im Saarland,Am Sonntag zeigt sich das Wetter in Rheinland-Pfalz und im Saarland wechselhaft. Neben Schauern und vereinzelten Gewittern sind auch kurze Auflockerungen möglich. Zum Wochenstart wird es ruhiger.,https://www.stern.de/gesellschaft/regional/rheinland-pfalz-saarland/kaltfront--schauer-und-gewitter-in-rheinland-pfalz-und-im-saarland-36181700.html,https://image.stern.de/36181702/t/1V/v1/w1440/r1.7778/-/02--jgxipx5zbtv7axs2048jpeg---db5830441ac74376.jpg,,"Kopiere den aktuellen Link
Zur Merkliste hinzufügen
Am Sonntag zeigt sich das Wetter in Rheinland-Pfalz und im Saarland wechselhaft. Neben Schauern und vereinzelten Gewittern sind auch kurze Aufloc… [+1772 chars]",
7e0f0b14b32591276c0e53dbb1b84bf8,2025-11-03T09:33:30Z,'Schnee',www.tagesspiegel.de,de,1.0,Wer will schon im Schnee Urlaub machen?: Zum Beispiel dieser französische Fotograf,Sind Winterferien überhaupt Urlaub oder doch nur Überlebenstraining auf technisch hohem Niveau? Die Bilder von Christophe Jacrot helfen bei der Wahrheitsfindung.,https://www.tagesspiegel.de/gesellschaft/reise/wer-will-schon-im-schnee-urlaub-machen-zum-beispiel-dieser-franzosische-fotograf-14582738.html,https://www.tagesspiegel.de/images/14582705/alternates/BASE_16_9_W1400/1761815336000/p-171-photo-christophe-jacrot-winterland-teneues-2025-helleren-norway.jpeg,http://web.archive.org/web/20251105152825/https://www.tagesspiegel.de/gesellschaft/reise/wer-will-schon-im-schnee-urlaub-machen-zum-beispiel-dieser-franzosische-fotograf-14582738.html,"Es lässt sich nicht leugnen: Der Winter steht vor der Tür. Die Temperaturen sinken, die Berliner Sonne schaltet in ihren Kellermodus. Sechs Monate Grauzeit stehen bevor, unterbrochen vielleicht von e… [+6104 chars]",
f4e9d4ac835a9cd0e029fca01dbbe2aa,2025-11-03T11:29:00Z,'Wintereinbruch',www.stern.de,de,1.0,"Kalte Jahreszeit: Den Garten winterfest machen: So überdauern Ihre Pflanzen Frost, Eis und Schnee","Nicht nur Pflanzen, sondern auch Gartenmöbel leiden im Winter. Wenn Sie im Frühjahr keine bösen Überraschungen erleben wollen, sollten Sie Ihren Garten zeitnah winterfest machen.",https://www.stern.de/familie/den-garten-winterfest-machen--so-schuetzen-sie-pflanzen---moebel-9021214.html,https://image.stern.de/9021216/t/I1/v6/w1440/r1.7778/-/garten-winterfest-machen-neu.jpg,,"Kopiere den aktuellen Link
Zur Merkliste hinzufügen
Nicht nur Pflanzen, sondern auch Gartenmöbel leiden im Winter. Wenn Sie im Frühjahr keine bösen Überraschungen erleben wollen, sollten Sie Ihren … [+7664 chars]",
e252438941b67b35e54ad1634e99d6b3,2025-11-03T12:05:24Z,'Skigebiete',www.stern.de,de,1.0,Schneemangel wegen Klimawandels: Skigebiet Céüze baut Skilifte ab,Wegen Schneemangels infolge des Klimawandels entscheiden sich immer mehr Skigebiete in niedrigeren Höhenlagen für einen Neuanfang: Im ehemaligen Skigebiet Céüze in den französischen Alpen beginnt am Dienstag der Abbau der seit Jahren nicht mehr genutzten Skil…,https://www.stern.de/news/schneemangel-wegen-klimawandels--skigebiet-c%C3%A9ueze-baut-skilifte-ab-36184096.html,https://image.stern.de/36184098/t/M0/v1/w1440/r1.7778/-/03--skilifte-bei-schneemangel-im-jura---bd9b99925e31ce5d.jpg,,"Kopiere den aktuellen Link
Zur Merkliste hinzufügen
Wegen Schneemangels infolge des Klimawandels entscheiden sich immer mehr Skigebiete in niedrigeren Höhenlagen für einen Neuanfang: Im ehemaligen … [+1715 chars]",
965ad33c6284d89c18cff70b97c8c9bd,2025-11-03T12:43:28Z,'Schnee Klimawandel',www.n-tv.de,de,1.0,Klimawandel raubt den Schnee: Französisches Skigebiet Céüze baut alle Skilifte ab,In den 1930er-Jahren nimmt das französische Skigebiet Céüze seinen Betrieb auf. Doch an Skifahren ist in dem Ort schon lange nicht mehr zu denken. Es fehlt schlicht der Schnee. Am Dienstag macht das Skigebiet daher Nägel mit Köpfen und stellt sich neu auf.,https://www.n-tv.de/panorama/Franzoesisches-Skigebiet-Ceueze-baut-alle-Skilifte-ab-article26137568.html,https://www.n-tv.de/img/incoming/crop26137596/0881322235-cImg_16_9-w1200/469540363.jpg,http://web.archive.org/web/20251104210050/https://www.n-tv.de/panorama/Franzoesisches-Skigebiet-Ceueze-baut-alle-Skilifte-ab-article26137568.html,In den 1930er-Jahren nimmt das französische Skigebiet Céüze seinen Betrieb auf. Doch an Skifahren ist in dem Ort schon lange nicht mehr zu denken. Es fehlt schlicht der Schnee. Am Dienstag macht das … [+1966 chars],
4876e0e3905db1489e37bef2f5e7c52d,2025-11-03T16:48:25Z,'Schnee',www.focus.de,de,1.0,"""Immer unsicherere Schneelage"": Französisches Skigebiet baut die Lifte ab",Wegen Schneemangels infolge des Klimawandels entscheiden sich immer mehr Skigebiete in niedrigeren Höhenlagen für einen Neuanfang - auch im französischen Céüze.,https://www.focus.de/panorama/welt/immer-unsicherere-schneelage-franzoesisches-skigebiet-baut-die-lifte-ab_aa01e915-a7d3-4431-af6c-595351f85b19.html,https://quadro.burda-forward.de/ctf/b22c62c6-1e36-4a00-b41e-693abc29913d.c2c8d5eb-d74d-4ff0-bd75-695d000d49e5.jpg?im=RegionOfInterestCrop%3D%281200%2C630%29%2CregionOfInterest%3D%282557%2C1520%29&hash=a99c7650079ddaf26f6fbaee9b8eafa39298931e78404e2b0f4b7576e85f1b68,,"Im ehemaligen Skigebiet Céüze in den französischen Alpen beginnt am Dienstag der Abbau der seit Jahren nicht mehr genutzten Skilifte. ""Die Entscheidung ist lange gereift"", sagte Michel Ricou-Charles,… [+1541 chars]",
13813ae746b71de755dffe086bb3cf8f,2025-11-03T18:58:33Z,'Schnee',www.morgenpost.de,de,1.0,Kein Schnee mehr wegen Klimawandel: Skigebiet in Frankreich macht dicht,Schneemangel zwingt ein Skigebiet in den Alpen zu radikalen Maßnahmen: Am Dienstag beginnt der Abbau der Skilifte. Doch es gibt einen Plan B.,https://www.morgenpost.de/panorama/article410370747/kein-schnee-mehr-wegen-klimawandel-skigebiet-in-frankreich-macht-dicht.html,https://img.sparknews.funkemedien.de/408331776/408331776_1740047509_v16_9_1600.jpeg,http://web.archive.org/web/20251108102059/https://www.morgenpost.de/panorama/article410370747/kein-schnee-mehr-wegen-klimawandel-skigebiet-in-frankreich-macht-dicht.html,"Angesichts des Schneemangels, der durch den Klimawandel verstärkt wird, wagen immer mehr Skigebiete in niedrigeren Höhenlagen einen Neuanfang. So beginnt im ehemaligen Skigebiet Céüze in den französi… [+1921 chars]",
34dd5d5b3cd9d314df74a82f50b5dac4,2025-11-04T05:08:53Z,'Frost',www.stern.de,de,1.0,Nächtlicher Frost möglich: Mildes Herbstwetter in Berlin und Brandenburg,"Potsdam/Berlin - Ruhiges Herbstwetter können die Menschen in Berlin und Brandenburg in den kommenden Tagen genießen. Der Dienstag startet bewölkt,",https://www.stern.de/gesellschaft/regional/berlin-brandenburg/naechtlicher-frost-moeglich--mildes-herbstwetter-in-berlin-und-brandenburg-36186178.html,https://image.stern.de/36186180/t/Cp/v1/w1440/r1.7778/-/04--eil35oltndv10axs2048jpeg---f8e5b66a20946e1b.jpg,,"Kopiere den aktuellen Link
Zur Merkliste hinzufügen
Sonne, Wolken und milde Temperaturen: Die kommenden Tage bringen angenehmes Herbstwetter nach Berlin und Brandenburg. Nachts kann es Frost geben.… [+758 chars]",
b2b44d95d0f261661ff90754a5d10c35,2025-11-04T05:08:53Z,'Frost',www.zeit.de,de,1.0,Nächtlicher Frost möglich: Mildes Herbstwetter in Berlin und Brandenburg,Hier finden Sie Informationen zu dem Thema „Nächtlicher Frost möglich“. Lesen Sie jetzt „Mildes Herbstwetter in Berlin und Brandenburg“.,https://www.zeit.de/news/2025-11/04/mildes-herbstwetter-in-berlin-und-brandenburg,https://img.zeit.de/news/2025-11/04/mildes-herbstwetter-in-berlin-und-brandenburg-image-group/wide__1300x731,,"Ruhiges Herbstwetter können die Menschen in Berlin und Brandenburg in den kommenden Tagen genießen. Der Dienstag startet bewölkt, heitert aber im Verlauf zunehmend auf, wie der Deutsche Wetterdienst … [+597 chars]",
a23e56c6341ff9175dc1e51052f0a482,2025-11-04T05:09:59Z,'Frost',www.tagesspiegel.de,de,1.0,Nächtlicher Frost möglich: Mildes Herbstwetter in Berlin und Brandenburg,"Sonne, Wolken und milde Temperaturen: Die kommenden Tage bringen angenehmes Herbstwetter nach Berlin und Brandenburg. Nachts kann es Frost geben.",https://www.tagesspiegel.de/berlin/nachtlicher-frost-moglich-mildes-herbstwetter-in-berlin-und-brandenburg-14744237.html,https://www.tagesspiegel.de/images/14744234/alternates/BASE_16_9_W1400/1762232999000/herbst-in-berlin.jpeg,,"Ruhiges Herbstwetter können die Menschen in Berlin und Brandenburg in den kommenden Tagen genießen. Der Dienstag startet bewölkt, heitert aber im Verlauf zunehmend auf, wie der Deutsche Wetterdienst … [+651 chars]",
da12e077157fb91e969ba4e466957ad4,2025-11-04T06:57:37Z,'Frost',www.stern.de,de,1.0,Wetter-Vorhersage: Sonne und milde Temperaturen - bis 17 Grad möglich,"So lässt sich der Herbst genießen: Tagsüber schickt die Sonne wärmende Sonnenstrahlen, von Schmuddelwetter keine Spur. Nachts wird es jedoch kalt, leichter Frost ist möglich.",https://www.stern.de/gesellschaft/regional/rheinland-pfalz-saarland/wetter-vorhersage--sonne-und-milde-temperaturen---bis-17-grad-moeglich-36186288.html,https://image.stern.de/36186290/t/98/v1/w1440/r1.7778/-/04--gvqzjfpfq5v6axs2048jpeg---143ab0a59280e1c7.jpg,http://web.archive.org/web/20251106060038/https://www.stern.de/gesellschaft/regional/rheinland-pfalz-saarland/wetter-vorhersage--sonne-und-milde-temperaturen---bis-17-grad-moeglich-36186288.html,"Kopiere den aktuellen Link
Zur Merkliste hinzufügen
So lässt sich der Herbst genießen: Tagsüber schickt die Sonne wärmende Sonnenstrahlen, von Schmuddelwetter keine Spur. Nachts wird es jedoch kalt… [+693 chars]",
d6454c8a3436d1ea3144d51cde15718d,2025-11-04T10:00:00Z,'Schnee',www.nzz.ch,de,1.0,"Tropennächte, Starkregen, weniger Schnee: Neue Szenarien zeigen, wie stark der Klimawandel die Schweiz verändert","Die Klimaszenarien zeigen in grösserem Detail als zuvor, wie die Erderwärmung das Land beeinflusst. Neben der Hitze dürften vor allem Veränderungen beim Niederschlag für Probleme sorgen.",https://www.nzz.ch/wissenschaft/schweizer-klimaszenarien-2025-temperaturanstieg-und-folgen-ld.1909399,"https://img.nzz.ch/2025/11/04/d064ec31-1a6e-4522-8b71-d27e6db5665d.png?width=1200&height=675&fit=bounds&quality=75&auto=webp&crop=1201,676,x0,y113&wmark=nzz",http://web.archive.org/web/20251107034409/https://www.nzz.ch/wissenschaft/schweizer-klimaszenarien-2025-temperaturanstieg-und-folgen-ld.1909399,Selbst im November laden in diesen Tagen Temperaturen bis 15 Grad zum Flanieren ein. Auch dem Laien schwant: Solche Wetterbedingungen sind dank dem Klimawandel wahrscheinlicher geworden. Wie sich das… [+5891 chars],
0291aaebe8127f5a83428b2e801bf21d,2025-11-04T11:32:11Z,'Schnee',www.focus.de,de,1.0,"""Lift nur drei Tage im Betrieb"": Skigebiet steht nach Insolvenz vor dem Aus",Weder Kunstschnee noch ein Alternativplan für den Sommer konnten einem Skigebiet aus der Krise retten. Nun musste die Königsberg-Hollenstein Skilifte GmbH Insolvenz anmelden.,https://www.focus.de/panorama/welt/lift-nur-drei-tage-im-betrieb-skigebiet-steht-nach-insolvenz-vor-dem-aus_2bc9957c-c044-43f2-bd46-346c214dbc45.html,https://quadro.burda-forward.de/ctf/77862fac-fdfd-4d3c-b929-4500d48ae114.d73ef55d-5210-4d2c-ac49-0dd2eefcb00c.jpg?im=RegionOfInterestCrop%3D%281200%2C630%29%2CregionOfInterest%3D%28541%2C690%29&hash=1bd2092db19b755674e32ac1e5c60f8020d0095615b55e221ef5a49a6e13c043,,"Am Montag hat die Königsberg-Hollenstein Skilifte GmbH beim Landesgericht St. Pölten ein Insolvenzverfahren eingeleitet. Der ""Kurier"" berichtet darüber. Der Betrieb verwaltet sechs Schlepplifte und r… [+2990 chars]",
76fc34fc10cd70d650a2cdc6f4d9249f,2025-11-04T14:37:53Z,'Frost',www.welt.de,de,1.0,"Wie Winzer versuchen, den Wein zu retten","Weltweit kämpfen Weinbauern zunehmend mit Trockenheit, Hitze und Frost. Damit der Wein in Deutschland auch in Zukunft schmeckt, arbeiten Forscher an einer neuen Herstellungsmethode. Vorbild können Winzer in Chile sein. Besuch auf einem Weingut.",https://www.welt.de/wissenschaft/article690328991118a64696446d9e/wein-in-gefahr-frueher-war-die-reihenfolge-klar-heute-reift-alles-durcheinander.html,https://images.welt.de/690328991118a64696446d9e/dfed45e45a9143506c37fd3bb41cfa1b/ci16x9-w1200/gettyimages-526617701-jpg,http://web.archive.org/web/20251106055632/https://www.welt.de/wissenschaft/article690328991118a64696446d9e/wein-in-gefahr-frueher-war-die-reihenfolge-klar-heute-reift-alles-durcheinander.html,"Weltweit kämpfen Weinbauern zunehmend mit Trockenheit, Hitze und Frost. Damit der Wein in Deutschland auch in Zukunft schmeckt, arbeiten Forscher an einer neuen Herstellungsmethode. Vorbild können Wi… [+9400 chars]",
bdfb728dc0fc2fabfdecb534383e6f97,2025-11-04T16:00:16Z,'Frost',www.zeit.de,de,1.0,"Kriminalität: Soko ""Frost"" greift zu: Razzia nach Schüssen in Ludwigsburg","Hier finden Sie Informationen zu dem Thema „Kriminalität“. Lesen Sie jetzt „Soko ""Frost"" greift zu: Razzia nach Schüssen in Ludwigsburg“.",https://www.zeit.de/news/2025-11/04/soko-frost-greift-zu-razzia-nach-schuessen-in-ludwigsburg,https://img.zeit.de/news/2025-11/04/soko-frost-greift-zu-razzia-nach-schuessen-in-ludwigsburg-image-group/wide__1300x731,http://web.archive.org/web/20251106055517/https://www.zeit.de/news/2025-11/04/soko-frost-greift-zu-razzia-nach-schuessen-in-ludwigsburg,Nach einem Fahrzeugbrand in Bietigheim-Bissingen und Schüssen in Ludwigsburg hat die Polizei bei einer großangelegten Razzia mehrere junge Männer festgenommen. Am frühen Morgen wurden die Wohnungen v… [+1585 chars],
56f6e6d1a72b5bb710de8b840e4d1531,2025-11-04T16:00:16Z,'Frost',www.stern.de,de,1.0,"Kriminalität: Soko ""Frost"" greift zu: Razzia nach Schüssen in Ludwigsburg",Ludwigsburg (lsw) - Nach einem Fahrzeugbrand in Bietigheim-Bissingen und Schüssen in Ludwigsburg hat die Polizei bei einer großangelegten Razzia mehrere,https://www.stern.de/gesellschaft/regional/baden-wuerttemberg/kriminalitaet--soko--frost--greift-zu--razzia-nach-schuessen-in-ludwigsburg-36188828.html,https://image.stern.de/36188830/t/Oo/v1/w1440/r1.7778/-/04--pj5rm7xtkcv4axs2048jpeg---1620e844b587f351.jpg,,"Kopiere den aktuellen Link
Zur Merkliste hinzufügen
Nach einer Schießerei und einem brennenden Auto im Frühjahr hat die Polizei zugeschlagen: Die Soko ""Frost"" nimmt mehrere junge Männer fest.
Nach… [+1740 chars]",
2bc21af070d09503eb0664d1cb713d3a,2025-11-04T18:09:07Z,'Skigebiete',www.focus.de,de,1.0,Die günstigsten Skigebiete Europas: Hier sparen Sie dieses Jahr bares Geld!,Eine neue Analyse zeigt die günstigsten Skigebiete Europas. Drei französische Regionen bieten Pistenspaß für weniger als 50 Euro pro Tag.,https://www.focus.de/panorama/welt/die-guenstigsten-skigebiete-europas-hier-sparen-sie-dieses-jahr-bares-geld_3f926a15-75f7-4c71-a72d-08ae8b9835b7.html,https://quadro.burda-forward.de/ctf/8507684b-9b9c-46b7-91b1-716b68416ad1.d7e4bb86-55ff-4753-b844-ddea8afe6db9.jpg?im=RegionOfInterestCrop%3D%281200%2C630%29%2CregionOfInterest%3D%282189%2C1979%29&hash=26acc92001659219e5a25fc27fb57df42cbacdb39991d6469a0351510b5e8363,http://web.archive.org/web/20251109025111/https://www.focus.de/panorama/welt/die-guenstigsten-skigebiete-europas-hier-sparen-sie-dieses-jahr-bares-geld_3f926a15-75f7-4c71-a72d-08ae8b9835b7.html,"Die Buchungsplattform Holidu hat eine umfassende Analyse der europäischen Skigebiete mit mehr als 20 Pistenkilometern durchgeführt. Ziel der Untersuchung war es, Wintersportlern eine transparente Übe… [+2447 chars]",
be1b703a9c3f845500eec611dfba2bb1,2025-11-05T05:29:56Z,'Bodenfrost',www.tagesspiegel.de,de,1.0,Es bleibt trocken: Mildes Herbstwetter mit bis zu 16 Grad in Berlin und Brandenburg,"In Berlin und Brandenburg bleibt es trocken, zeitweise kann sich die Sonne zeigen. In den Nächten kommt es zu Bodenfrost.",https://www.tagesspiegel.de/berlin/es-bleibt-trocken-mildes-herbstwetter-mit-bis-zu-16-grad-in-berlin-und-brandenburg-14758670.html,https://www.tagesspiegel.de/images/14758667/alternates/BASE_16_9_W1400/1762326150000/herbststimmung-in-brandenburg.jpeg,,In den kommenden Tagen bleibt es mild und trocken in Berlin und Brandenburg. Laut Deutschem Wetterdienst (DWD) wird es heute bewölkt und die Höchsttemperaturen steigen auf 13 bis 16 Grad. Es werde he… [+1148 chars],
3f7cbdeb5e791fd2bd3332b13610e51f,2025-11-05T05:29:56Z,'Bodenfrost',www.tagesspiegel.de,de,1.0,Wetter: Mildes Herbstwetter,"Tagsüber zweistellige Temperaturen, nachts Bodenfrost - mit Regen ist in Berlin und Brandenburg nicht zu rechnen.",https://www.tagesspiegel.de/berlin/wetter-mildes-herbstwetter-14758670.html,https://www.tagesspiegel.de/images/14758667/alternates/BASE_16_9_W1400/1762320596000/herbststimmung-in-brandenburg.jpeg,,In den kommenden Tagen bleibt es mild und trocken in Berlin und Brandenburg. Laut Deutschem Wetterdienst (DWD) wird es heute bewölkt und die Höchsttemperaturen steigen auf 13 bis 16 Grad. In der Nach… [+605 chars],
5a2601b09b796a6fa4fc13465b384a86,2025-11-05T05:35:34Z,'Bodenfrost',www.stern.de,de,1.0,Wetter: Mildes Herbstwetter bringt Sonne und Frost nach NRW,"Sonnige Tage, frostige Nächte: Das Herbstwetter in NRW bringt milde Temperaturen und vereinzelt Bodenfrost. Was der Deutsche Wetterdienst für die nächsten Tage vorhersagt.",https://www.stern.de/gesellschaft/regional/nordrhein-westfalen/wetter--mildes-herbstwetter-bringt-sonne-und-frost-nach-nrw-36189808.html,https://image.stern.de/36189810/t/Ch/v1/w1440/r1.7778/-/05--k5lyxekfa2v5axs2048jpeg---672d1146320b35de.jpg,http://web.archive.org/web/20251106060315/https://www.stern.de/gesellschaft/regional/nordrhein-westfalen/wetter--mildes-herbstwetter-bringt-sonne-und-frost-nach-nrw-36189808.html,"Kopiere den aktuellen Link
Zur Merkliste hinzufügen
Sonnige Tage, frostige Nächte: Das Herbstwetter in NRW bringt milde Temperaturen und vereinzelt Bodenfrost. Was der Deutsche Wetterdienst für die… [+948 chars]",
f80de0e84f6fa9305a784427bb7d1097,2025-11-05T05:35:34Z,'Frost',www.zeit.de,de,1.0,Wetter: Mildes Herbstwetter bringt Sonne und Frost nach NRW,Hier finden Sie Informationen zu dem Thema „Wetter“. Lesen Sie jetzt „Mildes Herbstwetter bringt Sonne und Frost nach NRW“.,https://www.zeit.de/news/2025-11/05/mildes-herbstwetter-bringt-sonne-und-frost-nach-nrw,https://img.zeit.de/news/2025-11/05/mildes-herbstwetter-bringt-sonne-und-frost-nach-nrw-image-group/wide__1300x731,http://web.archive.org/web/20251111011735/https://www.zeit.de/news/2025-11/05/mildes-herbstwetter-bringt-sonne-und-frost-nach-nrw,"Das Herbstwetter zeigt sich in Nordrhein-Westfalen zur Wochenmitte von seiner ruhigen und milden Seite. Am Mittwoch werden Temperaturen zwischen 15 und 20 Grad erwartet, wie der Deutsche Wetterdienst… [+761 chars]",
05428b3e6604d4c89cf014e1f45a2707,2025-11-05T06:41:01Z,'Skigebiete',www.bild.de,de,1.0,Millionen-Deal mit bekannter Familie - Wintersport-Stadt verkauft komplettes Skigebiet,"Mehr als 2,5 Mio. Übernachtungen verzeichnet die Region pro Jahr. Die schneereichen Skigebiete sind besonders beliebt. Eins wurde jetzt verkauft.",https://www.bild.de/news/inland/wintersport-stadt-verkauft-komplettes-skigebiet-an-bekannte-familie-6909eb09ef57a9036f0abf66,"https://images.bild.de/6909eb09ef57a9036f0abf66/688e99f1b7b4804b54b360c0b5eed819,da3182ae?w=1280",,"Oberwiesenthal (Sachsen) Weit mehr als 2,5 Millionen Übernachtungen verzeichnet das Erzgebirge pro Jahr. Im Winter sind die schneereichen, hoch gelegenen Regionen besonders beliebt. Jetzt wurde das g… [+2064 chars]",
