index,url,valid,domain,title,description,image,published,archive,content,quote,language,keyword
https://ooe.orf.at/stories/3275065/,https://ooe.orf.at/stories/3275065/,0,ooe.orf.at,Wein: Trockenheit führte zu Ernteeinbußen,"Beim Wein bringt der Jahrgang 2024 weniger Flaschen, dafür dürfte der Inhalt besonders kräftig und aromatisch werden. Die  Ernte der Weintrauben ist wegen der Trockenheit in Oberösterreich um etwa 20 bis 30 Prozent geringer ausgefallen. Die Winzerinnen und Wi…",https://ibs.orf.at/ooe?image=https%3A%2F%2Foekastatic.orf.at%2Fmims%2F2024%2F39%2F60%2Fcrops%2Fw%3D1200%2Ch%3D627%2Cq%3D75%2F2367854_master_903860_weinlese5.jpg%3Fs%3Ddd38e713654970b5450a357cf94058e5d0a89fd3,2024-10-01T15:30:00Z,https://web.archive.org/web/20241001162457/https://ooe.orf.at/stories/3275065/,Der Wein des Jahrgangs 2024 entsteht gerade in den Gärfässern der Weinbauern. 40 Winzerinnen und Winzer gibt es in Oberösterreich. Sie führten gemeinsam mit Helferinnen und Helfern in den vergangenen… [+2749 chars],,de,'Ernte'
https://salzburg.orf.at/stories/3275493/,https://salzburg.orf.at/stories/3275493/,0,salzburg.orf.at,Rudolfshütte niederschlagsreichster Ort Österreichs,Der heurige September war in Österreich der niederschlagsreichste Monat der Messgeschichte. Und am meisten Regen oder Schnee fiel dabei bei der Messstelle Rudolfshütte bei Uttendorf (Pinzgau) – mit insgesamt 510 Millimetern Niederschlag im Verlauf des Monats.,https://ibs.orf.at/sbg?image=https%3A%2F%2Foekastatic.orf.at%2Fmims%2F2024%2F30%2F72%2Fcrops%2Fw%3D1200%2Ch%3D627%2Cq%3D75%2F2286783_master_870472_rudolfshuette.jpg%3Fs%3D277694db15b5622b9b38693607898fc29a0f33d5,2024-10-01T16:17:48Z,https://web.archive.org/web/20241001172353/https://salzburg.orf.at/stories/3275493/,"Mit diesem Messwert steht das Berghotel in 2.317 Metern Seehöhe, das Ende September zusperrte, sogar noch vor den niederösterreichischen Starkregengebieten: So fielen in St. Pölten und Langenlebarn l… [+1279 chars]",,de,'Schnee'
https://www.brigitte.de/aktuell/winterreifen--ohne-dieses-symbol-gibt-es-bei-schnee-jetzt-ein-bussgeld-13883056.html,https://www.brigitte.de/aktuell/winterreifen--ohne-dieses-symbol-gibt-es-bei-schnee-jetzt-ein-bussgeld-13883056.html,0,www.brigitte.de,Winterreifen: Ohne dieses Symbol gibt es bei Schnee jetzt ein Bußgeld,Bußgeld droht: Seit dem 1. Oktober müssen Autoreifen im Winter das neue Bergsymbol zeigen. Die Aufschrift M+S gilt nicht mehr.,https://image.brigitte.de/13883058/t/Sj/v1/w1440/r1.7778/-/01--ohne-dieses-symbol-gibt-es-bei-schnee-jetzt-ein-bussgeld---1-1---spoton-article-1076462.jpg,2024-10-01T17:24:00Z,https://web.archive.org/web/20241001180316/https://www.brigitte.de/aktuell/winterreifen--ohne-dieses-symbol-gibt-es-bei-schnee-jetzt-ein-bussgeld-13883056.html,"Bußgeld droht: Seit dem 1. Oktober müssen Autoreifen im Winter das neue Bergsymbol zeigen. Die Aufschrift M+S gilt nicht mehr.
Von O bis O, von Oktober bis Ostern sollte man laut altem Merkspruch da… [+1385 chars]",,de,'Winter'
https://www.focus.de/wissen/m-s-symbol-genuegt-jetzt-nicht-mehr-winterreifen-dieses-kennzeichen-benoetigen-sie-ab-oktober_id_260359788.html,https://www.focus.de/wissen/m-s-symbol-genuegt-jetzt-nicht-mehr-winterreifen-dieses-kennzeichen-benoetigen-sie-ab-oktober_id_260359788.html,0,www.focus.de,M+S-Symbol genügt jetzt nicht mehr - Winterreifen: Dieses Kennzeichen benötigen Sie ab Oktober!,Eine Neuerung zum Oktober: Schluss mit der Kennzeichnung M+S. Winterreifen brauchen nun das Alpine-Symbol. Bei Missachtung droht ein Bußgeld.,https://p6.focus.de/img/wissen/id_260359787/winterreifen-dieses-kennzeichen-benoetigen-sie-ab-oktober-.jpg?im=Crop%3D%280%2C125%2C1000%2C500%29%3BResize%3D%281200%2C627%29&impolicy=perceptual&quality=mediumHigh&hash=191cef642d70dd0c4b5dbe4885b431804d291e5d70370ccd11e5c1bf51952a79,2024-10-01T17:35:07Z,https://web.archive.org/web/20241001175243/https://www.focus.de/wissen/m-s-symbol-genuegt-jetzt-nicht-mehr-winterreifen-dieses-kennzeichen-benoetigen-sie-ab-oktober_id_260359788.html,"""Von O bis O"", also von Oktober bis Ostern, soll man laut der alten Weisheit sein Fahrzeug in den Wintermodus versetzen. Just zum Beginn des O-Monats gibt es eine Neuerung bei den Winterreifen. Ab 1.… [+1257 chars]",,de,'Schnee'
https://www.tagesspiegel.de/berlin/wettervorhersage-regnerisches-wetter-in-berlin-und-brandenburg-12471923.html,https://www.tagesspiegel.de/berlin/wettervorhersage-regnerisches-wetter-in-berlin-und-brandenburg-12471923.html,0,www.tagesspiegel.de,Wettervorhersage: Regnerisches Wetter in Berlin und Brandenburg,Auch am Mittwoch bringt der Herbst viele Wolken und Regen nach Berlin und Brandenburg. An manchen Orten könnte es auch Gewitter geben.,https://www.tagesspiegel.de/images/12471920/alternates/BASE_16_9_W1400/1727841374000/regen-zum-wochenstart.jpeg,2024-10-02T03:56:14Z,https://web.archive.org/web/20241002040102/https://www.tagesspiegel.de/berlin/wettervorhersage-regnerisches-wetter-in-berlin-und-brandenburg-12471923.html,"Viele teils regnerische Wolken ziehen am Mittwoch über Berlin und Brandenburg auf. Am Nachmittag kann es vom Elbe-Elster-Kreis bis in die Niederlausitz auch zu kräftigen, teils gewittrigen Schauern k… [+613 chars]",,de,'Herbst'
https://www.stern.de/gesellschaft/regional/sachsen/wettervorhersage--regen-und-einzelne-gewitter-in-sachsen-35112284.html,https://www.stern.de/gesellschaft/regional/sachsen/wettervorhersage--regen-und-einzelne-gewitter-in-sachsen-35112284.html,0,www.stern.de,Wettervorhersage: Regen und einzelne Gewitter in Sachsen,Auch zur Mitte der Woche bleiben Regen und Wolken im Freistaat bestimmend. Die herbstlich kühlen Aussichten verändern sich dabei in den nächsten Tagen kaum.,https://image.stern.de/35112286/t/Ar/v1/w1440/r1.7778/-/02--eeq77c5wwyv15axw800h600jpeg---b11370eb4060815b.jpg,2024-10-02T04:34:15Z,https://web.archive.org/web/20241002052456/https://www.stern.de/gesellschaft/regional/sachsen/wettervorhersage--regen-und-einzelne-gewitter-in-sachsen-35112284.html,"Auch zur Mitte der Woche bleiben Regen und Wolken im Freistaat bestimmend. Die herbstlich kühlen Aussichten verändern sich dabei in den nächsten Tagen kaum.
Viele Schauer und einzelne Gewitter ziehe… [+780 chars]",,de,'Herbst'
https://www.stern.de/gesellschaft/regional/thueringen/wetter--regen-und-einzelne-gewitter-in-thueringen-35112296.html,https://www.stern.de/gesellschaft/regional/thueringen/wetter--regen-und-einzelne-gewitter-in-thueringen-35112296.html,0,www.stern.de,Wetter: Regen und einzelne Gewitter in Thüringen,"Erfurt (th) - Auf kräftige Schauer, begleitet von einzelnen, kurzen Gewittern können sich die Menschen vor allem am Nachmittag in Thüringen einstellen.",https://image.stern.de/35112298/t/BE/v1/w1440/r1.7778/-/02--ykznwdehdsv16axw800h600jpeg---ad9e2f2c4ceb6feb.jpg,2024-10-02T04:57:58Z,https://web.archive.org/web/20241002051903/https://www.stern.de/gesellschaft/regional/thueringen/wetter--regen-und-einzelne-gewitter-in-thueringen-35112296.html,"Auch zur Wochenmitte hält sich das herbstlich-kühle Schmuddelwetter im Freistaat. Dabei kann örtlich Starkregen fallen.
Auf kräftige Schauer, begleitet von einzelnen, kurzen Gewittern können sich di… [+648 chars]",,de,'Gewitter'
https://www.zeit.de/news/2024-10/02/regen-und-einzelne-gewitter-in-thueringen,https://www.zeit.de/news/2024-10/02/regen-und-einzelne-gewitter-in-thueringen,0,www.zeit.de,Wetter: Regen und einzelne Gewitter in Thüringen,Hier finden Sie Informationen zu dem Thema „Wetter“. Lesen Sie jetzt „Regen und einzelne Gewitter in Thüringen“.,https://img.zeit.de/news/2024-10/02/regen-und-einzelne-gewitter-in-thueringen-image-group/wide__1300x731,2024-10-02T04:57:58Z,,"Auf kräftige Schauer, begleitet von einzelnen, kurzen Gewittern können sich die Menschen vor allem am Nachmittag in Thüringen einstellen. Das sei auf den Einfluss eines Tiefdruckgebietes zurückzuführ… [+517 chars]",,de,'Gewitter'
https://www.morgenpost.de/berlin/article407382906/wetter-in-berlin-viele-wolken-regen-und-mancherorts-gewitter.html,https://www.morgenpost.de/berlin/article407382906/wetter-in-berlin-viele-wolken-regen-und-mancherorts-gewitter.html,0,www.morgenpost.de,Wetter in Berlin: Viele Wolken und Regen – Gewitter möglich,Auch am Mittwoch bringt der Herbst viele Wolken und Regen nach Berlin und Brandenburg. Die Vorhersage für die kommenden Tage.,https://img.sparknews.funkemedien.de/407382913/407382913_1727847144_v16_9_1600.jpeg,2024-10-02T05:32:24Z,https://web.archive.org/web/20241002065312/https://www.morgenpost.de/berlin/article407382906/wetter-in-berlin-viele-wolken-regen-und-mancherorts-gewitter.html,"Berlin. Auch am Mittwoch bringt der Herbst viele Wolken und Regen nach Berlin und Brandenburg. Die Vorhersage für die kommenden Tage.
Viele, teils regnerische Wolken ziehen am Mittwoch über Berlin u… [+2405 chars]",,de,'Herbst'
https://www.stern.de/gesellschaft/regional/sachsen-anhalt/wetter--regen-und-einzelne-gewitter-in-sachsen-anhalt-erwartet-35112328.html,https://www.stern.de/gesellschaft/regional/sachsen-anhalt/wetter--regen-und-einzelne-gewitter-in-sachsen-anhalt-erwartet-35112328.html,0,www.stern.de,Wetter: Regen und einzelne Gewitter in Sachsen-Anhalt erwartet,Auch zur Mitte der ersten Woche der Herbstferien dominieren Wolken und Schauer. Erst am Freitag lockern die Wolken auf - pünktlich zum Wochenende.,https://image.stern.de/35112330/t/oh/v1/w1440/r1.7778/-/02--tye7of7iz5v17axw800h600jpeg---39a64b19266fcfe6.jpg,2024-10-02T05:47:52Z,https://web.archive.org/web/20241002060934/https://www.stern.de/gesellschaft/regional/sachsen-anhalt/wetter--regen-und-einzelne-gewitter-in-sachsen-anhalt-erwartet-35112328.html,"Auch zur Mitte der ersten Woche der Herbstferien dominieren Wolken und Schauer. Erst am Freitag lockern die Wolken auf - pünktlich zum Wochenende.
Mit viel Regen sowie einzelnen Gewittern wartet der… [+728 chars]",,de,'Gewitter'
https://www.n-tv.de/ratgeber/Heizen-mit-Holz-Darauf-sollten-Sie-jetzt-achten-article25238226.html,https://www.n-tv.de/ratgeber/Heizen-mit-Holz-Darauf-sollten-Sie-jetzt-achten-article25238226.html,0,www.n-tv.de,Kaminöfen richtig anfeuern: Heizen mit Holz: Darauf sollten Sie jetzt achten,"Bald kommt die Herbstkälte zurück und der Ofen wird wieder angefeuert. Zeit, zu prüfen, ob das Brennholz für den Herbst auch wirklich trocken ist.",https://bilder3.n-tv.de/img/incoming/crop20109522/5921322518-cImg_16_9-w1200/imago52448082h.jpg,2024-10-02T08:28:40Z,https://web.archive.org/web/20241002085556/https://www.n-tv.de/ratgeber/Heizen-mit-Holz-Darauf-sollten-Sie-jetzt-achten-article25238226.html,"Bald kommt die Herbstkälte zurück und der Ofen wird wieder angefeuert. Zeit, zu prüfen, ob das Brennholz für den Herbst auch wirklich trocken ist.
Im Herbst und Winter kommen die holzbefeuerten Kami… [+2097 chars]",,de,'Herbst'
https://www.focus.de/wissen/natur/meteorologie/schneefallgrenze-sinkt-unwetter-alarm-in-europa-5b-tief-bringt-regen-auch-nach-deutschland_id_260361095.html,https://www.focus.de/wissen/natur/meteorologie/schneefallgrenze-sinkt-unwetter-alarm-in-europa-5b-tief-bringt-regen-auch-nach-deutschland_id_260361095.html,0,www.focus.de,"Schneefallgrenze sinkt, Regen kommt - Unwetter-Alarm in Europa! 5b-Tief wirkt sich auch merklich auf Deutschland aus","Das große Hochwasser in Europa ist kaum vorüber, da droht bereits die nächste Unwetterlage. Ein neues 5b-Tief formiert sich über dem Golf von Genua. Auch Deutschland wird das zu spüren bekommen.",https://p6.focus.de/img/fotos/id_260361091/yb-tief-250.png?im=Crop%3D%280%2C60%2C1920%2C960%29%3BResize%3D%281200%2C627%29&impolicy=perceptual&quality=mediumHigh&hash=47dda3cd2e11019ea28959af24c68ace8c679541fa069d7c140f6c7f4cf29d84,2024-10-02T09:19:26Z,https://web.archive.org/web/20241002103715/https://www.focus.de/wissen/natur/meteorologie/schneefallgrenze-sinkt-unwetter-alarm-in-europa-5b-tief-bringt-regen-auch-nach-deutschland_id_260361095.html,"Das große Hochwasser in Europa ist kaum vorüber, da droht bereits die nächste Unwetterlage. Ein neues 5b-Tief formiert sich über dem Golf von Genua. Auch Deutschland wird das zu spüren bekommen.Das T… [+1561 chars]",,de,'Schnee'
https://www.sueddeutsche.de/wissen/gletscherschmelze-schnee-schweiz-klimawandel-gletschern-li.3123622,https://www.sueddeutsche.de/wissen/gletscherschmelze-schnee-schweiz-klimawandel-gletschern-li.3123622,0,www.sueddeutsche.de,"Klimakrise: Forscher dachten, viel Schnee schütze die Gletscher – falsch gedacht!","Obwohl die Schweizer Gletscher im Frühling ungewöhnlich viel Schnee hatten, haben sie in diesem Jahr trotzdem 2,5 Prozent an Eis verloren. Der Rückgang der Gletscherzungen und ihr Zerfall gehen im Zuge des Klimawandels unvermindert weiter.",https://www.sueddeutsche.de/2024/10/02/88c41ae5-246f-4deb-8347-21ab0bd20cd4.jpeg?q=60&fm=webp&width=1200&rect=0%2C156%2C3000%2C1687,2024-10-02T09:26:50Z,https://web.archive.org/web/20241002130215/https://www.sueddeutsche.de/wissen/gletscherschmelze-schnee-schweiz-klimawandel-gletschern-li.3123622,Trotz ungewöhnlich viel Niederschlag im Frühjahr blieb die erhoffte Verschnaufpause für die Gletscher aus. Sind Jahre ohne Eisverlust überhaupt noch möglich?Alles deutete auf ein gutes Gletscherjahr … [+560 chars],,de,'Frühling'
https://www.sueddeutsche.de/projekte/artikel/stil/herbst-garten-balkon-tipps-e717523/,https://www.sueddeutsche.de/projekte/artikel/stil/herbst-garten-balkon-tipps-e717523/,0,www.sueddeutsche.de,Garten im Herbst: Was vom Sommer übrig bleibt,Mit dem Herbst endet die Hochsaison im Freien. Was jetzt an den Beeten und auf dem Balkon zu tun ist. Fünf Tipps fürs Gärtnern im Oktober.,"https://www.sueddeutsche.de/projekte/artikel/stil/herbst-garten-balkon-tipps-e717523/7e3c2633c25b32b79a45644d91b4345573296e7ec5b6bb6361393dc66582e285_w2400_h1256_r158,0,3264,1708_oszplus_q70.jpg",2024-10-02T13:27:00Z,https://web.archive.org/web/20241002144102/https://www.sueddeutsche.de/projekte/artikel/stil/herbst-garten-balkon-tipps-e717523/,"„Schön bist du, Kind des Mondes, nicht der Sonne“, heißt es in einem Gedicht von Eduard Mörike über die bleiche Christrose. Helleborus niger ist eine der Pflanzen, die zur Hochform auflaufen, wenn an… [+1250 chars]",,de,'Herbst'
https://www.tagesspiegel.de/wissen/gammablitz-und-donner-mit-dem-spionageflugzeug-zum-strahlungsausbruch-12473942.html,https://www.tagesspiegel.de/wissen/gammablitz-und-donner-mit-dem-spionageflugzeug-zum-strahlungsausbruch-12473942.html,0,www.tagesspiegel.de,Gammablitz und Donner: Mit dem Spionageflugzeug zum Strahlungsausbruch,"Energiereiche Gammastrahlung entsteht nicht nur in den Tiefen des Weltraums, sondern auch ganz erdnah. Viel häufiger als bekannt flackern bei Gewitter Blitze, die das menschliche Auge gar nicht wahrnimmt.",https://www.tagesspiegel.de/images/12473435/alternates/BASE_16_9_W1400/1727861383000/illustration-of-the-aircraft-campaign-the-purple-radiation-from-the-thundercloud-are-visualization-of-the-gamma-ray-glows.jpeg,2024-10-02T13:49:21Z,https://web.archive.org/web/20241002155612/https://www.tagesspiegel.de/wissen/gammablitz-und-donner-mit-dem-spionageflugzeug-zum-strahlungsausbruch-12473942.html,"Bereits in den 1990er Jahren zeichneten Beobachtungssatelliten auf Erdumlaufbahnen unerwartete Messwerte von unten auf: Eigentlich sollten sie Gammastrahlung einfangen, die sich bisweilen im Weltraum… [+3821 chars]",,de,'Gewitter'
https://www.sueddeutsche.de/stil/herbst-laub-fegen-mieter-vermieter-recht-lux.5iDCdxS68db2qV2voSRvrK,https://www.sueddeutsche.de/stil/herbst-laub-fegen-mieter-vermieter-recht-lux.5iDCdxS68db2qV2voSRvrK,0,www.sueddeutsche.de,Rechtskolumne: Wer muss das Laub wegräumen?,"Im Herbst rieseln oft viele Blätter auf einmal zu Boden. Wann Eigentümer und Mieter sie entfernen müssen – und was zu tun ist, wenn sie vom Nachbarn herüberwehen.",https://www.sueddeutsche.de/2024/09/30/35941825-4cb7-4470-baa1-cc20441d2b21.jpeg?q=60&fm=webp&width=1200&rect=0%2C65%2C3843%2C2162,2024-10-02T14:00:22Z,https://web.archive.org/web/20241002152242/https://www.sueddeutsche.de/stil/herbst-laub-fegen-mieter-vermieter-recht-lux.5iDCdxS68db2qV2voSRvrK,"Er ist wieder da, der güldene Herbst mit seiner Farbenpracht. Rilke, Goethe, Heine, Hoffmann von Fallersleben große Dichter haben ihn gepriesen, mal euphorisch, mal melancholisch. Aber, nun ja, jedes… [+3274 chars]",,de,'Laub'
https://www.n-tv.de/panorama/Urban-bringt-kleinen-Altweibersommer-20-Grad-Marke-wackelt-article25267055.html,https://www.n-tv.de/panorama/Urban-bringt-kleinen-Altweibersommer-20-Grad-Marke-wackelt-article25267055.html,0,www.n-tv.de,"Wie golden wird der Oktober?: ""Urban"" bringt kleinen Altweibersommer - 20-Grad-Marke wackelt","In den kommenden Tagen wird das Doppel-Tief über Deutschland schwächer. Es wird zunehmend heiterer und wieder etwas milder. Für das Wochenende stellt ntv-Meteorologe Björn Alexander einen ""Glanz vom Altweibersommer"" in Aussicht. Die neue Woche könnte dann wie…",https://bilder1.n-tv.de/img/incoming/crop25267060/4671323739-cImg_16_9-w1200/485928806.jpg,2024-10-02T14:53:28Z,https://web.archive.org/web/20241002153811/https://www.n-tv.de/panorama/Urban-bringt-kleinen-Altweibersommer-20-Grad-Marke-wackelt-article25267055.html,"In den kommenden Tagen wird das Doppel-Tief über Deutschland schwächer. Es wird zunehmend heiterer und wieder etwas milder. Für das Wochenende stellt ntv-Meteorologe Björn Alexander einen ""Glanz vom … [+4840 chars]",,de,'Gewitter'
https://science.orf.at/stories/3226938/,https://science.orf.at/stories/3226938/,0,science.orf.at,Tropische Gewitter erzeugen oft Radioaktivität,In großen tropischen Gewitterzellen tritt radioaktive Gammastrahlung häufiger auf als bisher angenommen. Das zeigen gleich zwei aktuelle Studien. Sie liefern auch neue Hinweise auf die nach wie vor nicht zur Gänze verstandene Entstehung von Blitzen.,https://ibs.orf.at/science?image=https%3A%2F%2Ftubestatic.orf.at%2Fmims%2F2024%2F40%2F32%2Fcrops%2Fw%3D1200%2Ch%3D627%2Cq%3D75%2F2371916_master_905632_tropical_thunderstorm.jpg%3Fs%3Dba6d1919e5c053366a570767306a96756863247f,2024-10-02T15:19:51Z,https://web.archive.org/web/20241002180822/https://science.orf.at/stories/3226938/,"Bei Gewittern passiert viel mehr, als wir gedacht hätten, sagt Steven Cummer von der Duke University in Durham. Er ist Koautor von zwei soeben im Fachjournal Nature veröffentlichten Studien, die sich… [+6095 chars]",,de,'Gewitter'
https://www.kicker.de/so-kommen-autofahrer-sicher-durch-den-herbst-1056182/artikel,https://www.kicker.de/so-kommen-autofahrer-sicher-durch-den-herbst-1056182/artikel,0,www.kicker.de,So kommen Autofahrer sicher durch den Herbst,"Der Herbst zieht ins Land. Damit ändern sich auch die Bedingungen im Straßenverkehr. Blätterbedeckte Fahrbahnen, erste Straßenglätte und Nebel sind nur einige Faktoren, die jetzt das Unfallrisiko erhöhen. Dem kann man aber vorbeugen.",https://derivates.kicker.de/image/upload/c_crop%2Cx_0%2Cy_105%2Cw_4000%2Ch_2250/w_1200%2Cq_auto/v1/2024/10/02/8a281e21-1b73-4a64-95da-dd25b171b21c.jpeg,2024-10-02T18:11:11Z,https://web.archive.org/web/20241002185602/https://www.kicker.de/so-kommen-autofahrer-sicher-durch-den-herbst-1056182/artikel,"Der Herbst zieht ins Land. Damit ändern sich auch die Bedingungen im Straßenverkehr. Blätterbedeckte Fahrbahnen, erste Straßenglätte und Nebel sind nur einige Faktoren, die jetzt das Unfallrisiko erh… [+7079 chars]",,de,'Herbst'
https://www.stern.de/gesellschaft/regional/bayern/landwirtschaft--kartoffelanbauer-erwarten-durchschnittliche-ertraege-35115094.html,https://www.stern.de/gesellschaft/regional/bayern/landwirtschaft--kartoffelanbauer-erwarten-durchschnittliche-ertraege-35115094.html,0,www.stern.de,Landwirtschaft: Kartoffelanbauer erwarten durchschnittliche Erträge,München (lby) - Bayerns Kartoffelanbauer fahren in diesem Jahr eine durchschnittliche Ernte ein. Zu schaffen machte ihnen vor allem eine Pflanzenkrankheit,https://image.stern.de/35115096/t/8f/v1/w1440/r1.7778/-/03--62tbbxoefpv7axw800h600jpeg---683b3d509a67655f.jpg,2024-10-03T02:00:40Z,https://web.archive.org/web/20241003035755/https://www.stern.de/gesellschaft/regional/bayern/landwirtschaft--kartoffelanbauer-erwarten-durchschnittliche-ertraege-35115094.html,"Salzkartoffeln, Pommes, Klöße, Chips: Kartoffeln lassen sich zu vielen Produkten verarbeiten. Das Anbaujahr bot Herausforderungen für Bayerns Landwirte.
Bayerns Kartoffelanbauer fahren in diesem Jah… [+1308 chars]",,de,'Ernte'
https://www.stern.de/gesellschaft/regional/bayern/erntebilanz-in-bayern--tonnenweise-getreide--kartoffeln--obst-35115100.html,https://www.stern.de/gesellschaft/regional/bayern/erntebilanz-in-bayern--tonnenweise-getreide--kartoffeln--obst-35115100.html,0,www.stern.de,"Erntebilanz in Bayern: Tonnenweise Getreide, Kartoffeln, Obst","Getreide, Kartoffeln, Obst - wie lief das Jahr für Bayerns Landwirte? Und mit wie vielen Lebensmitteln könnten sich die Bayern theoretisch selbst versorgen?",https://image.stern.de/35115102/t/B7/v1/w1440/r1.7778/-/03--34imwehzaqv4axw800h600jpeg---59b6bdcb40037a52.jpg,2024-10-03T02:30:37Z,https://web.archive.org/web/20241003030428/https://www.stern.de/gesellschaft/regional/bayern/erntebilanz-in-bayern--tonnenweise-getreide--kartoffeln--obst-35115100.html,"Getreide, Kartoffeln, Obst - wie lief das Jahr für Bayerns Landwirte? Und mit wie vielen Lebensmitteln könnten sich die Bayern theoretisch selbst versorgen?
Die Ernte in den meisten Sparten der Land… [+3863 chars]",,de,'Ernte'
https://www.zeit.de/news/2024-10/03/tonnenweise-getreide-kartoffeln-obst,https://www.zeit.de/news/2024-10/03/tonnenweise-getreide-kartoffeln-obst,0,www.zeit.de,"Erntebilanz in Bayern: Tonnenweise Getreide, Kartoffeln, Obst","Hier finden Sie Informationen zu dem Thema „Erntebilanz in Bayern“. Lesen Sie jetzt „Tonnenweise Getreide, Kartoffeln, Obst“.",https://img.zeit.de/news/2024-10/03/tonnenweise-getreide-kartoffeln-obst-image-group/wide__1300x731,2024-10-03T02:30:37Z,https://web.archive.org/web/20241003025142/https://www.zeit.de/news/2024-10/03/tonnenweise-getreide-kartoffeln-obst,"Die Ernte in den meisten Sparten der Landwirtschaft in Bayern ist abgeschlossen - Zeit für eine Bilanz kurz vor dem Erntedankfest, das die beiden großen Kirchen, aber auch zahlreiche landwirtschaftli… [+4688 chars]",,de,'Ernte'
https://www.zeit.de/news/2024-10/03/um-die-80-biber-am-oderdeich-geschossen,https://www.zeit.de/news/2024-10/03/um-die-80-biber-am-oderdeich-geschossen,0,www.zeit.de,Nach dem Hochwasser: Um die 80 Biber am Oderdeich geschossen,Hier finden Sie Informationen zu dem Thema „Nach dem Hochwasser“. Lesen Sie jetzt „Um die 80 Biber am Oderdeich geschossen“.,https://img.zeit.de/news/2024-10/03/um-die-80-biber-am-oderdeich-geschossen-image-group/wide__1300x731,2024-10-03T04:00:38Z,,"Im Zuge des Hochwassers an der Oder sind in Brandenburg um die 80 Biber erlegt worden, um die Deiche vor Schäden zu schützen. Das ergab eine Umfrage der Deutschen Presse-Agentur bei den zuständigen B… [+2586 chars]",,de,'Hochwasser'
https://www.welt.de/iconist/essen-und-trinken/plus253809932/Kuerbis-Rezept-So-gelingt-Hokkaido-mit-weissen-Bohnen.html,https://www.welt.de/iconist/essen-und-trinken/plus253809932/Kuerbis-Rezept-So-gelingt-Hokkaido-mit-weissen-Bohnen.html,0,www.welt.de,Hokkaidokürbis – die orangefarbene Perle des Herbstes,"Obwohl die Ernte gerade erst begonnen hat, ist jetzt die perfekte Zeit für Kürbis – weil er noch knackig ist. Kombiniert man ihn mit Palbohnen, entsteht ein wunderbares veganes Gericht für den Herbst. Das sich schnell zubereiten lässt.",https://img.welt.de/img/iconist/mobile253809930/8237938457-ci16x9-w1200-fnov-fpotl-fpi157750653/WS-St-Kochschule-26-22-Sept-2024Volk-7.jpg,2024-10-03T06:14:18Z,https://web.archive.org/web/20241003065434/https://www.welt.de/iconist/essen-und-trinken/plus253809932/Kuerbis-Rezept-So-gelingt-Hokkaido-mit-weissen-Bohnen.html,"Obwohl die Ernte gerade erst begonnen hat, ist jetzt die perfekte Zeit für Kürbis weil er noch knackig ist. Kombiniert man ihn mit Palbohnen, entsteht ein wunderbares veganes Gericht für den Herbst. … [+33 chars]",,de,'Ernte'
https://www.bild.de/leben-wissen/auto/wildunfaelle-so-fahren-sie-sicher-durch-den-herbst-66fd08243fca14794a65a27a,https://www.bild.de/leben-wissen/auto/wildunfaelle-so-fahren-sie-sicher-durch-den-herbst-66fd08243fca14794a65a27a,0,www.bild.de,Vorsicht in der Dämmerung - Wildunfälle! So fahren Sie sicher durch den Herbst,"Im Herbst häufen sich Wildunfälle. Hier erfahren Sie, wie Sie Unfälle vermeiden und was bei einem Zusammenstoß zu tun ist.","https://images.bild.de/66fd08243fca14794a65a27a/6ffc4b9f34be8e308d7d82075f526aff,200fdbc0?w=1280",2024-10-03T08:13:15Z,https://web.archive.org/web/20241003084836/https://www.bild.de/leben-wissen/auto/wildunfaelle-so-fahren-sie-sicher-durch-den-herbst-66fd08243fca14794a65a27a,"Der Herbst bringt nicht nur bunte Blätter, sondern auch ein erhöhtes Risiko für Wildunfälle mit sich. Besonders in den frühen Morgen- und späten Abendstunden, wenn es dämmert, sind Rehe, Wildschweine… [+2061 chars]",,de,'Herbst'
