index,url,valid,domain,title,description,image,published,archive,content,quote,language,keyword
https://www.dwdl.de/zahlenzentrale/101315/tatort_und_dschungelcamp_dominieren_am_sonntagabend/,https://www.dwdl.de/zahlenzentrale/101315/tatort_und_dschungelcamp_dominieren_am_sonntagabend/,0,www.dwdl.de,"""Tatort"" und Dschungelcamp dominieren am Sonntagabend","Während der ""Tatort"" wie gewohnt die insgesamt meistgesehene Sendung am Sonntagabend war, lag bei den Jüngeren ""Ich bin ein Star - Holt mich hier raus"" vorn. Punkten konnte zudem auch ""Frühling"" im ZDF.",https://www.dwdl.de/images/1736503256_ich-bin-ein-star---holt-mich-hier-.jpg,2025-02-03T08:10:00Z,,"Die Folge ""Herz der Dunkelheit"" des Dresdner ""Tatort""-Teams war mit im Schnitt 8,25 Millionen Zuschauerinnen und Zuschauern am Sonntag die mit Abstand meistgesehene Sendung des Tages. Der Marktanteil… [+2413 chars]",,de,'Frühling'
https://www.tagesschau.de/wirtschaft/verbraucher/bier-absatz-deutschland-100.html,https://www.tagesschau.de/wirtschaft/verbraucher/bier-absatz-deutschland-100.html,0,www.tagesschau.de,Bier-Absatz in Deutschland 2024 weiter zurückgegangen,"In Deutschland wird weniger Bier verkauft - ein Trend, der sich seit Jahren beobachten lässt. Dem Brauer-Bund zufolge ging es nach einem Hoch im Frühling bergab - trotz Fußball-EM. Als ein möglicher Grund gilt das Wetter.",https://images.tagesschau.de/image/b77619e1-698d-4cc9-88e2-660a1f3895a2/AAABlMsdcOE/AAABkZLhkrw/16x9-1280/bier-148.jpg,2025-02-03T09:21:32Z,,"Stand: 03.02.2025 10:21 Uhr
In Deutschland wird weniger Bier verkauft - ein Trend, der sich seit Jahren beobachten lässt. Dem Brauer-Bund zufolge ging es nach einem Hoch im Frühling bergab - trotz F… [+1607 chars]",,de,'Frühling'
https://www.bild.de/news/ausland/murmeltier-maessige-verwirrung-wie-wird-denn-nun-das-wetter-67a0a4dcd565ee0d2850b772,https://www.bild.de/news/ausland/murmeltier-maessige-verwirrung-wie-wird-denn-nun-das-wetter-67a0a4dcd565ee0d2850b772,0,www.bild.de,Murmeltier-mäßige Verwirrung - Wie wird denn nun das Wetter?,Bleibt der Winter oder kommt der Frühling? Nach dem Weltmurmeltier-Tag (02.02.2025) herrscht große Verwirrung. Zumindest die nächsten Tage in Deutschland...,"https://images.bild.de/67a0a4dcd565ee0d2850b772/785927bf4561456494caffacbfd97794-landscape,c724fee8?w=1280",2025-02-03T11:51:01Z,https://web.archive.org/web/20250203115241/https://www.bild.de/news/ausland/murmeltier-maessige-verwirrung-wie-wird-denn-nun-das-wetter-67a0a4dcd565ee0d2850b772,"Mehr zum Video anzeigen 
Bleibt der Winter oder kommt der Frühling? Nach dem Weltmurmeltier-Tag (02.02.2025) herrscht große Verwirrung. Zumindest die nächsten Tage in Deutschland bleibt es milde.
Q… [+66 chars]",,de,'Frühling'
https://www.pcgames.de/Netflix-Firma-259629/News/Dieser-Videospiel-Anime-geht-schon-im-Fruehling-an-den-Start-1465101/,https://www.pcgames.de/Netflix-Firma-259629/News/Dieser-Videospiel-Anime-geht-schon-im-Fruehling-an-den-Start-1465101/,0,www.pcgames.de,Es brodelt bei Netflix: Dieser Videospiel-Anime geht schon im Frühling an den Start,"Netflix bringt einen weiteren Videospiel-Anime an den Start, den alle Abonnenten bereits im Frühling streamen dürfen!",https://www.pcgames.de/screenshots/original/2025/01/Devil-May-Cry_Opening-Credits_Netflix-buffed_artwork1.jpg,2025-02-03T12:15:00Z,https://web.archive.org/web/20250203170854/https://www.pcgames.de/Netflix-Firma-259629/News/Dieser-Videospiel-Anime-geht-schon-im-Fruehling-an-den-Start-1465101/,"Wer auf der Suche nach Anime-Adaptionen beliebter Videospiel-Reihen ist, der dürfte bei Netflix mehr als fündig werden. In den letzten Jahren hat der Streaming-Anbieter gleich mehrere Projekte veröff… [+2651 chars]",,de,'Frühling'
https://www.focus.de/wissen/natur/futter-und-schutz-so-koennen-sie-igeln-voegeln-und-eichhoernchen-im-winter-helfen_873c84cb-3852-45fa-8d23-c23f40e38029.html,https://www.focus.de/wissen/natur/futter-und-schutz-so-koennen-sie-igeln-voegeln-und-eichhoernchen-im-winter-helfen_873c84cb-3852-45fa-8d23-c23f40e38029.html,0,www.focus.de,"Futter und Schutz - So können Sie Igeln, Vögeln und Eichhörnchen im Winter helfen","Bei Frost und Schnee können Sie die Wildtiere in Ihrem Garten beim Überwintern unterstützen. Dabei kommt es nicht nur auf das geeignete Futter an, sondern auch auf den richtigen Umgang mit Tieren, die Winterschlaf halten.",https://quadro.burda-forward.de/ctf/49f51d69-234c-49f9-85c4-68497b0bfef4.9abd42ba-419e-48e2-a9c8-bd23ac7fae62.jpeg?im=Resize%3D%281200%2C630%29&hash=0dc6b258399975704832399d898d277565e00c2d5a438994cc936cdd2ecacd51,2025-02-03T13:07:00Z,https://web.archive.org/web/20250206191051/https://www.focus.de/wissen/natur/futter-und-schutz-so-koennen-sie-igeln-voegeln-und-eichhoernchen-im-winter-helfen_873c84cb-3852-45fa-8d23-c23f40e38029.html,"Viele Wildtiere tummeln sich auch im Winter in den Gärten. Dort finden Igel, Eichhörnchen und Vögel Zuflucht. Doch Frost und Schnee erschweren den Gartenbewohnern die Futtersuche. Wie Sie ihnen dabei… [+7530 chars]",,de,'Schnee'
https://www.faz.net/aktuell/rhein-main/region-und-hessen/eichhoernchen-paarungszeit-im-kalten-januar-nabu-bittet-um-ruecksicht-110275169.html,https://www.faz.net/aktuell/rhein-main/region-und-hessen/eichhoernchen-paarungszeit-im-kalten-januar-nabu-bittet-um-ruecksicht-110275169.html,0,www.faz.net,Eichhörnchen im „Liebestaumel“ – Nabu bittet um Rücksicht,"Bei Eichhörnchen geht es schon im kalten Januar heiß her, ihre Paarungszeit beginnt mitten im Winter. Zu dieser Zeit lässt man die Tiere besser in Ruhe.",https://media1.faz.net/ppmedia/aktuell/163150820/1.10275265/facebook_teaser/hat-schon-fruehlingsgefuehle.jpg,2025-02-04T12:13:59Z,,"Um Eichhörnchen in der Paarungszeit nicht zu stören, brauchen die kleinen Nager in dieser Zeit besonders viel Rücksichtnahme. Wie der Naturschutzbund (Nabu) in Hessen mitteilte, solle man deswegen im… [+1183 chars]",,de,'Hasel'
https://www.stern.de/familie/pollenschutzgitter-fuer-allergiker--so-verbessern-sie-die-luftqualitaet-31855166.html,https://www.stern.de/familie/pollenschutzgitter-fuer-allergiker--so-verbessern-sie-die-luftqualitaet-31855166.html,0,www.stern.de,Fensterschutzgitter: Gut gegen Pollen: So verbessern Sie die Luftqualität in Ihrer Wohnung,"Wenn Birke und Linde, Haselnuss und Erle erwachen, beginnt die Pollenflug-Saison. Um die Luftqualität in den eigenen vier Wände zu verbessern, können Fensterschutzgitter sinnvoll sein.",https://image.stern.de/31855168/t/Cb/v3/w1440/r1.7778/-/pollenschutzgitter.jpg,2025-02-05T06:37:00Z,,"Kopiere den aktuellen Link
Wenn Birke und Linde, Haselnuss und Erle erwachen, beginnt die Pollenflug-Saison. Um die Luftqualität in den eigenen vier Wände zu verbessern, können Fensterschutzgitter s… [+4122 chars]",,de,'Erle'
https://www.stern.de/gesellschaft/regional/rheinland-pfalz-saarland/vorsicht-im-strassenverkehr--gefrierender-spruehregen-sorgt-fuer-glatte-strassen-35440510.html,https://www.stern.de/gesellschaft/regional/rheinland-pfalz-saarland/vorsicht-im-strassenverkehr--gefrierender-spruehregen-sorgt-fuer-glatte-strassen-35440510.html,0,www.stern.de,Vorsicht im Straßenverkehr: Gefrierender Sprühregen sorgt für glatte Straßen,Offenbach (lrs) - Der Deutsche Wetterdienst warnt vor Glatteis durch gefrierenden Sprühregen in Rheinland-Pfalz und dem Saarland. Der Grund: Am Mittwoch,https://image.stern.de/35440512/t/Vt/v1/w1440/r1.7778/-/05--rjjzunkoolv8axs2048jpeg---123aa3d07e83c007.jpg,2025-02-05T06:46:27Z,,"Kopiere den aktuellen Link
Eine leichte Kaltfront und Niederschlag - das bedeutet: aufpassen auf den Straßen. Der Wetterdienst weiß, wo die Gefahr besonders groß ist.
Der Deutsche Wetterdienst warn… [+609 chars]",,de,'Glatteis'
https://www.diepresse.com/19328975/wir-erleben-die-letzten-minuten-des-christentums-in-syrien,https://www.diepresse.com/19328975/wir-erleben-die-letzten-minuten-des-christentums-in-syrien,0,www.diepresse.com,„Wir erleben die letzten Minuten des Christentums in Syrien“ [premium],Ein Großteil der Christen hat das Land verlassen. Die Verbliebenen kämpfen im neuen Syrien um ihr Mitspracherecht.,https://img.diepresse.com/public/incoming/xencli-CHRISTMAS-SEASONSYRIA-DAMASCUS/alternates/DPR_SOCIAL_MAGAZIN/CHRISTMAS-SEASONSYRIA-DAMASCUS,2025-02-05T08:06:58Z,http://archive.md/20250205182526/https://www.diepresse.com/19328975/wir-erleben-die-letzten-minuten-des-christentums-in-syrien,"Ein Großteil der Christen hat das Land verlassen. Die Verbliebenen kämpfen im neuen Syrien um ihr Mitspracherecht.
Das Treffen fand Anfang Jänner statt. Anschließend hatte Hanna Jallouf, Franziskane… [+1072 chars]",,de,'Blüte'
https://www.stern.de/gesellschaft/regional/nordrhein-westfalen/verkehr--glatteis-in-nrw--a4-gesperrt--zahlreiche-unfaelle-35440454.html,https://www.stern.de/gesellschaft/regional/nordrhein-westfalen/verkehr--glatteis-in-nrw--a4-gesperrt--zahlreiche-unfaelle-35440454.html,0,www.stern.de,"Verkehr: Glatteis in NRW: A4 gesperrt, zahlreiche Unfälle",Glatteis durch gefrierenden Regen sorgt für zahlreiche Unfälle am Morgen. Die A4 wurde zwischen Overath und Engelskirchen bei Köln gesperrt. Mehrere Unfälle gab es auch bei Bielefeld und Paderborn.,https://image.stern.de/35440578/t/ej/v2/w1440/r1.7778/-/05--6xz7nuutkpv1axs2048jpeg---b3ea66d01ecf81ef.jpg,2025-02-05T08:36:09Z,,"Kopiere den aktuellen Link
Glatteis durch gefrierenden Regen sorgt für zahlreiche Unfälle am Morgen. Die A4 wurde zwischen Overath und Engelskirchen bei Köln gesperrt. Mehrere Unfälle gab es auch be… [+1177 chars]",,de,'Glatteis'
https://www.zeit.de/news/2025-02/05/medien-rb-leipzig-plant-im-sommer-wechsel-der-nummer-1,https://www.zeit.de/news/2025-02/05/medien-rb-leipzig-plant-im-sommer-wechsel-der-nummer-1,0,www.zeit.de,Bundesliga: Medien: RB Leipzig plant im Sommer Wechsel der Nummer 1,Hier finden Sie Informationen zu dem Thema „Bundesliga“. Lesen Sie jetzt „Medien: RB Leipzig plant im Sommer Wechsel der Nummer 1“.,https://img.zeit.de/news/2025-02/05/medien-rb-leipzig-plant-im-sommer-wechsel-der-nummer-1-image-group/wide__1300x731,2025-02-05T10:58:00Z,https://web.archive.org/web/20250214202911/https://www.zeit.de/news/2025-02/05/medien-rb-leipzig-plant-im-sommer-wechsel-der-nummer-1,Beerbt Maarten Vandevoordt im Sommer Peter Gulacsi als Nummer eins bei RB Leipzig? Nach Informationen der «Sport Bild» (Mittwoch) könnte es dazu kommen. Der 22 Jahre alte Belgier gilt als hochtalenti… [+708 chars],,de,'Sommer'
https://www.bild.de/regional/nordrhein-westfalen/unfaelle-und-stau-warnung-vor-glatteis-im-westen-67a322fc08bc756e749d6de7,https://www.bild.de/regional/nordrhein-westfalen/unfaelle-und-stau-warnung-vor-glatteis-im-westen-67a322fc08bc756e749d6de7,0,www.bild.de,Sprühregen gefriert - Unfälle und Staus! Warnung vor Glatteis im Westen,"Glatteis durch gefrierenden Sprühregen hat in NRW, Rheinland-Pfalz und dem Saarland zu Unfällen geführt. Auch Donnerstag soll es wieder glatt werden!","https://images.bild.de/67a322fc08bc756e749d6de7/47d47d72c54a3b464ffe0bd5bed7666e,67817c4e?w=1280",2025-02-05T11:22:45Z,https://web.archive.org/web/20250208002651/https://www.bild.de/regional/nordrhein-westfalen/unfaelle-und-stau-warnung-vor-glatteis-im-westen-67a322fc08bc756e749d6de7,"Engelskirchen (NRW) Glatteis durch gefrierenden Sprühregen hat am Morgen in Nordrhein-Westfalen, Rheinland-Pfalz und dem Saarland zu zahlreichen Unfällen geführt. Der Deutsche Wetterdienst warnt für … [+2175 chars]",,de,'Glatteis'
https://www.bild.de/regional/rheinland-pfalz/eisglaette-in-wissen-unfaelle-und-totalschaeden-67a34ef6962f9c5582b77b5b,https://www.bild.de/regional/rheinland-pfalz/eisglaette-in-wissen-unfaelle-und-totalschaeden-67a34ef6962f9c5582b77b5b,0,www.bild.de,Wissen - Glatteis verursacht sieben Unfälle,"Wissen – Der gefrierende Regen am Mittwochmorgen, 05.02.2025, sorgte für gefährliche Straßenglätte und führte zu mehreren Unfällen. ...","https://images.bild.de/67a34ef6962f9c5582b77b5b/91f518c3d9ed50581e0578b8535ceef9-landscape,4ca4ad8c?w=1280",2025-02-05T11:44:43Z,https://web.archive.org/web/20250206235842/https://www.bild.de/regional/rheinland-pfalz/eisglaette-in-wissen-unfaelle-und-totalschaeden-67a34ef6962f9c5582b77b5b,"Wissen Der gefrierende Regen am Mittwochmorgen, 05.02.2025, sorgte für gefährliche Straßenglätte und führte zu mehreren Unfällen.
Im Bereich der Polizeiwache Wissen ereigneten sich sieben wetterbedi… [+337 chars]",,de,'Glatteis'
https://www.bild.de/regional/koeln/glatteis-unfaelle-auf-a4-verletzte-und-vollsperrung-67a36407334072169a3e110d,https://www.bild.de/regional/koeln/glatteis-unfaelle-auf-a4-verletzte-und-vollsperrung-67a36407334072169a3e110d,0,www.bild.de,"A4 - Glatteis: 16 Unfälle, 10 Verletzte",Köln – Glatteis sorgte am Mittwochmorgen auf der A4 für mehr als 16 Unfälle mit insgesamt 25 Fahrzeugen. Zwischen den Anschlussstell...,"https://images.bild.de/67a36407334072169a3e110d/957bf87f14f0209aebea737d365454d8-landscape,e57ab91d?w=1280",2025-02-05T13:14:39Z,https://web.archive.org/web/20250208150142/https://www.bild.de/regional/koeln/glatteis-unfaelle-auf-a4-verletzte-und-vollsperrung-67a36407334072169a3e110d,"Köln Glatteis sorgte am Mittwochmorgen auf der A4 für mehr als 16 Unfälle mit insgesamt 25 Fahrzeugen.
Zwischen den Anschlussstellen Overath und Gummersbach wurden neun Personen leicht und eine schw… [+450 chars]",,de,'Erle'
https://www.stern.de/gesellschaft/regional/nordrhein-westfalen/ploetzlich-spiegelglatt--glatteis-in-nrw--a4-gesperrt--zahlreiche-unfaelle-35440454.html,https://www.stern.de/gesellschaft/regional/nordrhein-westfalen/ploetzlich-spiegelglatt--glatteis-in-nrw--a4-gesperrt--zahlreiche-unfaelle-35440454.html,0,www.stern.de,"Plötzlich spiegelglatt: Glatteis in NRW: A4 gesperrt, zahlreiche Unfälle",Glatteis durch gefrierenden Regen sorgt für zahlreiche Unfälle am Morgen. Die A4 wurde zwischen Overath und Engelskirchen bei Köln gesperrt. Im Kreis Olpe wird eine Mutter lebensgefährlich verletzt.,https://image.stern.de/35442312/t/2-/v1/w1440/r1.7778/-/05--2pnbfvi6elv6axs2048jpeg---2c04627cee51a6af.jpg,2025-02-05T13:21:16Z,https://web.archive.org/web/20250206213956/https://www.stern.de/gesellschaft/regional/nordrhein-westfalen/ploetzlich-spiegelglatt--glatteis-in-nrw--a4-gesperrt--zahlreiche-unfaelle-35440454.html,"Kopiere den aktuellen Link
Glatteis durch gefrierenden Regen sorgt für zahlreiche Unfälle am Morgen. Die A4 wurde zwischen Overath und Engelskirchen bei Köln gesperrt. Im Kreis Olpe wird eine Mutter… [+2127 chars]",,de,'Glatteis'
https://www.stern.de/gesellschaft/regional/rheinland-pfalz-saarland/verkehr--fuenf-verletzte-bei-glatteis-unfaellen-auf-der-autobahn-35442776.html,https://www.stern.de/gesellschaft/regional/rheinland-pfalz-saarland/verkehr--fuenf-verletzte-bei-glatteis-unfaellen-auf-der-autobahn-35442776.html,0,www.stern.de,Verkehr: Fünf Verletzte bei Glatteis-Unfällen auf der Autobahn,"Glatteis führt auf der A3 zu mehreren Unfällen, bei denen insgesamt fünf Menschen verletzt werden. Die Polizei spricht von einem niedrigen bis mittleren sechsstelligen Sachschaden.",https://image.stern.de/35442778/t/gV/v1/w1440/r1.7778/-/05--zrggryzathv2axs2048jpeg---99453c941be2cbb6.jpg,2025-02-05T14:40:14Z,,"Kopiere den aktuellen Link
Glatteis führt auf der A3 zu mehreren Unfällen, bei denen insgesamt fünf Menschen verletzt werden. Die Polizei spricht von einem niedrigen bis mittleren sechsstelligen Sac… [+1684 chars]",,de,'Glatteis'
https://www.diepresse.com/19318502/auch-fuer-kiwis-und-kiwibeeren-gilt-starker-schnitt-reiche-ernte,https://www.diepresse.com/19318502/auch-fuer-kiwis-und-kiwibeeren-gilt-starker-schnitt-reiche-ernte,0,www.diepresse.com,"Auch für Kiwis und Kiwibeeren gilt: Starker Schnitt, reiche Ernte","So wie die Tafeltrauben müssen auch Kiwis und Kiwibeeren unbedingt jetzt im Februar und nicht erst später diszipliniert und kräftig zurückgeschnitten werden, um die Pflanzen nicht durch Saftfluss und Bluten zu schwächen. Dafür gibt es später reiche Ernte.",https://img.diepresse.com/public/incoming/yeafib-Kiwibeeren/alternates/DPR_SOCIAL_NACHRICHTEN/Kiwibeeren,2025-02-06T05:01:32Z,https://web.archive.org/web/20250208001735/https://www.diepresse.com/19318502/auch-fuer-kiwis-und-kiwibeeren-gilt-starker-schnitt-reiche-ernte,"So wie die Tafeltrauben müssen auch Kiwis und Kiwibeeren unbedingt jetzt im Februar und nicht erst später diszipliniert und kräftig zurückgeschnitten werden, um die Pflanzen nicht durch Saftfluss und… [+1788 chars]",,de,'Ernte'
https://www.perlentaucher.de/efeu/2025-02-06.html,https://www.perlentaucher.de/efeu/2025-02-06.html,0,www.perlentaucher.de,EFEU - DIE KULTURRUNDSCHAU: Eruptionen aus einem skeptischen Hirn,Der Guardian lässt sich in der Tate St. Yves von den knubbeligen Würsten der britischen Surrealistin Ithell Colquhoun hypnotisieren. Die Zeit erlebt die Granden der österreichischen Literatur im Schockzustand. Für die nachtkritik wirft die ukrainische Kulturj…,https://www.perlentaucher.de/static/img/perlentaucher-logo-512x.png,2025-02-06T08:00:00Z,,"Ithell Colquhoun Scylla 1938. Foto: Tate. © Spire Healthcare, © Noise Abatement Society, © Samaritans
Aus der Gruppe der britischen Surrealisten wurde die in Indien geborene Malerin Ithell Colquhoun… [+2982 chars]",,de,'Erle'
https://www.bild.de/regional/baden-wuerttemberg/mit-auto-ueberschlagen-mann-30-stirbt-bei-autounfall-in-alfdorf-67a46477334072169a3e1899,https://www.bild.de/regional/baden-wuerttemberg/mit-auto-ueberschlagen-mann-30-stirbt-bei-autounfall-in-alfdorf-67a46477334072169a3e1899,0,www.bild.de,"Glatteis im Rems-Murr-Kreis - Auto überschlägt sich, Beifahrer (30) stirbt",Auf der Kreisstraße 1887 bei Alfdorf im Rems-Murr-Kreis (Baden-Württemberg) kam es am Mittwochabend zu einem tödlichen Autounfall. Die Polizei ermittelt.,"https://images.bild.de/67a46477334072169a3e1899/67c101e7ab1a14470ec0a74024c9bbf6,4233d6f5?w=1280",2025-02-06T09:12:33Z,https://web.archive.org/web/20250207140238/https://www.bild.de/regional/baden-wuerttemberg/mit-auto-ueberschlagen-mann-30-stirbt-bei-autounfall-in-alfdorf-67a46477334072169a3e1899,"Alfdorf (Baden-Württemberg) Ein silberner Hyundai liegt auf dem Dach, zertrümmert im Graben. Dieser Unfall endete tödlich für den 30-jährigen Beifahrer. 
Am Mittwochabend ist es bei Alfdorf im Rems-… [+1158 chars]",,de,'Glatteis'
https://www.bild.de/regional/ruhrgebiet/gelsenkirchen-pkw-kollidiert-mit-strassenbahn-fahrer-schwer-verletzt-67a4aa35094c8360edaf46f1,https://www.bild.de/regional/ruhrgebiet/gelsenkirchen-pkw-kollidiert-mit-strassenbahn-fahrer-schwer-verletzt-67a4aa35094c8360edaf46f1,0,www.bild.de,Gelsenkirchen - Straßenbahn rammt Auto: Fahrer schwer verletzt,Schwerverletzter nach Unfall auf Kurt-Schumacher-Straße in Gelsenkirchen-Buer. Dacia wird beim Abbiegen von Straßenbahn gerammt. Polizei ermittelt.,"https://images.bild.de/67a4aa35094c8360edaf46f1/957bf87f14f0209aebea737d365454d8-landscape,e57ab91d?w=1280",2025-02-06T12:28:32Z,,"Gelsenkirchen Ein schwerer Verkehrsunfall ereignete sich am 6. Februar 2025 um 8.20 Uhr auf der Kurt-Schumacher-Straße in Gelsenkirchen-Buer.
Ein 65-jähriger Autofahrer aus Oberhausen fuhr mit seine… [+933 chars]",,de,'Erle'
https://www.zeit.de/news/2025-02/06/berufungsverfahren-im-drosten-prozess-nicht-vor-sommer,https://www.zeit.de/news/2025-02/06/berufungsverfahren-im-drosten-prozess-nicht-vor-sommer,0,www.zeit.de,Prozesse: Berufungsverfahren im Drosten-Prozess nicht vor Sommer,Hier finden Sie Informationen zu dem Thema „Prozesse“. Lesen Sie jetzt „Berufungsverfahren im Drosten-Prozess nicht vor Sommer“.,https://img.zeit.de/news/2025-02/06/berufungsverfahren-im-drosten-prozess-nicht-vor-sommer-image-group/wide__1300x731,2025-02-06T14:34:18Z,https://web.archive.org/web/20250207120859/https://www.zeit.de/news/2025-02/06/berufungsverfahren-im-drosten-prozess-nicht-vor-sommer,Im Fall um ein wegen Verleumdung und Beleidigung gegen den Virologen Christian Drosten erstinstanzlich verurteilten Camper-Paars wird ein Berufungsverfahren vor dem Landgericht Neubrandenburg wohl er… [+1404 chars],,de,'Sommer'
https://www.stern.de/gesellschaft/regional/nordrhein-westfalen/jahreszeit--fruehlingsboten--kraniche-kommen-zurueck--die-hasel-blueht-35446926.html,https://www.stern.de/gesellschaft/regional/nordrhein-westfalen/jahreszeit--fruehlingsboten--kraniche-kommen-zurueck--die-hasel-blueht-35446926.html,0,www.stern.de,"Jahreszeit: Frühlingsboten: Kraniche kommen zurück, die Hasel blüht","Die Tage werden spürbar länger. In die Natur kommt Bewegung. Unter anderem blüht die Hasel. Die leuchtend gelben Kätzchen erfreuen Bienen, aber Allergiker nicht unbedingt.",https://image.stern.de/35446928/t/8I/v1/w1440/r1.7778/-/07--kzz463nlhfv8axs2048jpeg---29116c370be94e61.jpg,2025-02-07T04:00:41Z,,"Kopiere den aktuellen Link
Die Tage werden spürbar länger. In die Natur kommt Bewegung. Unter anderem blüht die Hasel. Die leuchtend gelben Kätzchen erfreuen Bienen, aber Allergiker nicht unbedingt.… [+1173 chars]",,de,'Hasel'
https://www.zeit.de/news/2025-02/07/fruehlingsboten-kraniche-kommen-zurueck-die-hasel-blueht,https://www.zeit.de/news/2025-02/07/fruehlingsboten-kraniche-kommen-zurueck-die-hasel-blueht,0,www.zeit.de,"Jahreszeit: Frühlingsboten: Kraniche kommen zurück, die Hasel blüht","Hier finden Sie Informationen zu dem Thema „Jahreszeit“. Lesen Sie jetzt „Frühlingsboten: Kraniche kommen zurück, die Hasel blüht“.",https://img.zeit.de/news/2025-02/07/fruehlingsboten-kraniche-kommen-zurueck-die-hasel-blueht-image-group/wide__1300x731,2025-02-07T04:00:41Z,,Die Vorboten des Frühlings sind unterwegs. Die ersten Schwärme von Kranichen haben Nordrhein-Westfalen bereits überflogen. In den vergangenen Tagen seien Trupps von 150 bis 200 Vögeln aus den Überwin… [+1012 chars],,de,'Frühling'
https://www.sueddeutsche.de/projekte/artikel/reise/stockholm-eislaufen-schweden-uppsala-maelarensee-sigtuna-e383710/,https://www.sueddeutsche.de/projekte/artikel/reise/stockholm-eislaufen-schweden-uppsala-maelarensee-sigtuna-e383710/,0,www.sueddeutsche.de,Einmal im Leben: Eislaufen in Stockholm,"Es geht nicht jedes Jahr, aber wenn es im Februar kalt wird, stehen die Chancen gut, dass man von Uppsala bis Stockholm mit Schlittschuhen fahren kann. 80 Kilometer Eislaufen. Ein ganz besonderes Erlebnis.","https://www.sueddeutsche.de/projekte/artikel/reise/stockholm-eislaufen-schweden-uppsala-maelarensee-sigtuna-e383710/f9f6293e03e6838531b55ce7eed2f529ee181fff166bb0d4fc0e514173b4a2eb_w2400_h1256_r140,0,2048,1072_q70.jpg",2025-02-07T08:00:00Z,,"Es geht nicht jedes Jahr, aber wenn es im Februar kalt wird, stehen die Chancen gut, dass man von Uppsala bis Stockholm mit Schlittschuhen fahren kann. 80 Kilometer auf dem Eis. Ein ganz besonderes E… [+34419 chars]",,de,'Erle'
https://www.zeit.de/news/2025-02/07/weiter-frostnaechte-aber-fruehblueher-am-start,https://www.zeit.de/news/2025-02/07/weiter-frostnaechte-aber-fruehblueher-am-start,0,www.zeit.de,"Wetter: Weiter Frostnächte, aber Frühblüher am Start","Hier finden Sie Informationen zu dem Thema „Wetter“. Lesen Sie jetzt „Weiter Frostnächte, aber Frühblüher am Start“.",https://img.zeit.de/news/2025-02/07/weiter-frostnaechte-aber-fruehblueher-am-start-image-group/wide__1300x731,2025-02-07T13:38:13Z,https://web.archive.org/web/20250208041530/https://www.zeit.de/news/2025-02/07/weiter-frostnaechte-aber-fruehblueher-am-start,"Noch hat der Winter die Natur im Griff, doch bald schlägt die Stunde der Frühblüher. Violette Krokusse und gelber Winterling starten als Frühlingsboten schon im Februar, wie der Naturschutzbund Nabu … [+822 chars]",,de,'Frühblüher'
https://www.stern.de/gesellschaft/regional/baden-wuerttemberg/wetter--weiter-frostnaechte--aber-fruehblueher-am-start-35448742.html,https://www.stern.de/gesellschaft/regional/baden-wuerttemberg/wetter--weiter-frostnaechte--aber-fruehblueher-am-start-35448742.html,0,www.stern.de,"Wetter: Weiter Frostnächte, aber Frühblüher am Start","Stuttgart (lsw) - Noch hat der Winter die Natur im Griff, doch bald schlägt die Stunde der Frühblüher. Violette Krokusse und gelber Winterling starten als",https://image.stern.de/35448744/t/4b/v1/w1440/r1.7778/-/07--l3zlnesgobv13axs2048jpeg---ada54fbebc0a941c.jpg,2025-02-07T13:38:13Z,https://web.archive.org/web/20250209070236/https://www.stern.de/gesellschaft/regional/baden-wuerttemberg/wetter--weiter-frostnaechte--aber-fruehblueher-am-start-35448742.html,"Kopiere den aktuellen Link
Noch überzieht nach kalten Nächten Eis manche Pflanze, doch bald schlägt die Stunde der Frühblüher.
Noch hat der Winter die Natur im Griff, doch bald schlägt die Stunde d… [+911 chars]",,de,'Frühblüher'
https://www.bild.de/leben-wissen/fruehling-naht-kraniche-kehren-nach-deutschland-zurueck-67a5c10b334072169a3e25ab,https://www.bild.de/leben-wissen/fruehling-naht-kraniche-kehren-nach-deutschland-zurueck-67a5c10b334072169a3e25ab,0,www.bild.de,"Störche, Hasel und erste Pollen - Hier beginnt jetzt schon der Frühling","Die ersten Kraniche und Störche sind aus ihren Überwinterungsgebieten zurückgekehrt, ein Zeichen dafür, dass der Frühling in Deutschland näher rückt.","https://images.bild.de/67a5c10b334072169a3e25ab/3bd279eaa07c3625ad4ae2b18b91e428,b437945f?w=1280",2025-02-07T14:29:46Z,https://web.archive.org/web/20250208092023/https://www.bild.de/leben-wissen/fruehling-naht-kraniche-kehren-nach-deutschland-zurueck-67a5c10b334072169a3e25ab,"Der Frühling kündigt sich in vielen Teilen Deutschlands mit den ersten Vorboten an. In Nordrhein-Westfalen sieht man bereits erste Kraniche, die aus ihrem Winter-Urlaub zurückgekehrt sind. 
In den v… [+2154 chars]",,de,'Frühling'
