index,url,valid,domain,title,description,image,published,archive,content,quote,language,keyword
https://www.stern.de/panorama/eindrucksvolle-bilder--duerre-in-griechenland-bringt-dorf-in-stausee-zum-vorschein-35038528.html,https://www.stern.de/panorama/eindrucksvolle-bilder--duerre-in-griechenland-bringt-dorf-in-stausee-zum-vorschein-35038528.html,0,www.stern.de,Eindrucksvolle Bilder: Dürre in Griechenland bringt Dorf in Stausee zum Vorschein,"Selbst in Gegenden mit sonst reichlich Wasser sieht es in Griechenland schlecht aus: Brunnen und Seen trocknen aus, Flüsse und Bäche werden zu Rinnsalen. Die Trockenheit ist schlimm wie lange nicht.",https://image.stern.de/35038530/t/BM/v1/w1440/r1.7778/-/05--nx4z5met7sv15axw800h600jpeg---e6f94654fcbce044.jpg,2024-09-05T03:00:42Z,,"Selbst in Gegenden mit sonst reichlich Wasser sieht es in Griechenland schlecht aus: Brunnen und Seen trocknen aus, Flüsse und Bäche werden zu Rinnsalen. Die Trockenheit ist schlimm wie lange nicht.… [+2382 chars]",,de,'Dürre'
https://www.zeit.de/news/2024-09/05/sommerliche-temperaturen-und-moegliche-gewitter-in-hessen,https://www.zeit.de/news/2024-09/05/sommerliche-temperaturen-und-moegliche-gewitter-in-hessen,0,www.zeit.de,Wettervorhersage: Sommerliche Temperaturen und mögliche Gewitter in Hessen,Hier finden Sie Informationen zu dem Thema „Wettervorhersage“. Lesen Sie jetzt „Sommerliche Temperaturen und mögliche Gewitter in Hessen“.,https://img.zeit.de/news/2024-09/05/sommerliche-temperaturen-und-moegliche-gewitter-in-hessen-image-group/wide__1300x731,2024-09-05T05:26:57Z,,In den kommenden Tagen drohen in Hessen immer wieder Schauer und Gewitter. Der Deutsche Wetterdienst (DWD) in Offenbach erwartet diese etwa für Südhessen am Donnerstagabend. Im Rest des Landes wird e… [+1761 chars],,de,'Sommer'
https://www.stern.de/duerre-auf-sizilien---bis-2030-wird-sich-dort-eine-art-wueste-bilden--35038884.html,https://www.stern.de/duerre-auf-sizilien---bis-2030-wird-sich-dort-eine-art-wueste-bilden--35038884.html,0,www.stern.de,Klimawandel: Wassermangel in Sizilien: Bauer muss Hälfte seiner Herde schlachten,EIne andauernde Dürre stellt Sizilien vor Herausforderungen und fordert akute Maßnahmen. Touristen trifft die Situation kaum – ganz anders als die Einheimischen.,https://image.stern.de/35040538/t/i8/v12/w1440/r1.7778/-/bildschirmfoto-2024-09-05-um-13-59-24.jpg,2024-09-05T05:28:38Z,https://web.archive.org/web/20240905174837/https://www.stern.de/duerre-auf-sizilien---bis-2030-wird-sich-dort-eine-art-wueste-bilden--35038884.html,Zugang zu allen STERN PLUS-Inhalten und Artikeln aus dem Print-Magazin,,de,'Dürre'
https://www.zeit.de/news/2024-09/05/neue-gewitter-in-rheinland-pfalz-und-dem-saarland-erwartet,https://www.zeit.de/news/2024-09/05/neue-gewitter-in-rheinland-pfalz-und-dem-saarland-erwartet,0,www.zeit.de,Wettervorhersage: Neue Gewitter in Rheinland-Pfalz und dem Saarland erwartet,Hier finden Sie Informationen zu dem Thema „Wettervorhersage“. Lesen Sie jetzt „Neue Gewitter in Rheinland-Pfalz und dem Saarland erwartet“.,https://img.zeit.de/news/2024-09/05/neue-gewitter-in-rheinland-pfalz-und-dem-saarland-erwartet-image-group/wide__1300x731,2024-09-05T05:45:56Z,,"Wolken, Gewitter aber auch Sonne: In Rheinland-Pfalz und im Saarland wird das Wetter in den kommenden Tagen eher wechselhaft. Der Deutsche Wetterdienst (DWD) in Offenbach erwartet zudem neue Gewitter… [+985 chars]",,de,'Gewitter'
https://www.faz.net/aktuell/gesellschaft/mornos-duerre-bringt-dorf-in-stausee-zum-vorschein-19964612.html,https://www.faz.net/aktuell/gesellschaft/mornos-duerre-bringt-dorf-in-stausee-zum-vorschein-19964612.html,0,www.faz.net,Dürre in Griechenland bringt Dorf in Stausee zum Vorschein,"Griechenland leidet unter dem Klimawandel, dieser Sommer ist extrem trocken. 250 Kilometer westlich von Athen ist ein Stausee so sehr geschrumpft, dass alte Ruinen und Mauern eines Dorfes zu sehen sind.",https://media0.faz.net/ppmedia/aktuell/gesellschaft/2886957694/1.9964614/facebook_teaser/ein-haus-tritt-zum-vorschein.jpg,2024-09-05T07:05:09Z,,"In Kallio lebten nur noch wenige Dutzend Menschen, als die Ortschaft Ende der 70er Jahre vor den aufgestauten Wassermassen des Flusses Mornos planmäßig geflutet wurde. Ich bin dort groß geworden, es … [+1612 chars]",,de,'Dürre'
https://www.n-tv.de/mediathek/bilderserien/panorama/Duerre-laesst-versunkenes-Dorf-wieder-auftauchen-article25204038.html,https://www.n-tv.de/mediathek/bilderserien/panorama/Duerre-laesst-versunkenes-Dorf-wieder-auftauchen-article25204038.html,0,www.n-tv.de,Wiederbegegnung mit alten Mauern: Dürre lässt versunkenes Dorf wieder auftauchen,"Vor mehr als 50 Jahren wird das Dorf Kallio in Griechenland geflutet, um den Mornos-Stausee aufzufüllen. Mit der andauernden Dürre schrumpft der See jedoch so stark, dass die Grundmauern des Ortes wieder auftauchen. Während Schaulustige staunen, sind Experten…",https://bilder1.n-tv.de/img/incoming/crop25204064/2031329326-cImg_16_9-w1200/2024-09-03T142020Z-122382022-RC2YS9AMJX03-RTRMADP-3-EUROPE-WEATHER-GREECE-DROUGHT-LAKE.jpg,2024-09-05T08:27:03Z,https://web.archive.org/web/20240905093745/https://www.n-tv.de/mediathek/bilderserien/panorama/Duerre-laesst-versunkenes-Dorf-wieder-auftauchen-article25204038.html,"... ist der riesige, von Menschenhand geschaffene Mornos-See, der fast die Hälfte der griechischen Bevölkerung mit Wasser versorgt, auf den niedrigsten Stand seit Jahrzehnten gesunken.",,de,'Dürre'
https://www.zeit.de/news/2024-09/05/schwierige-apfelernte-in-thueringen-gestartet,https://www.zeit.de/news/2024-09/05/schwierige-apfelernte-in-thueringen-gestartet,0,www.zeit.de,Nach Frostnacht: Schwierige Apfelernte in Thüringen gestartet,Hier finden Sie Informationen zu dem Thema „Nach Frostnacht“. Lesen Sie jetzt „Schwierige Apfelernte in Thüringen gestartet“.,https://img.zeit.de/news/2024-09/05/schwierige-apfelernte-in-thueringen-gestartet-image-group/wide__1300x731,2024-09-05T09:40:25Z,,"Trotz enormer Frostschäden ist die Apfelernte in Thüringen angelaufen. «Wir sind am Anfang der Ernte», sagte der Geschäftsführer von Fahner Obstbau in Gierstädt (Landkreis Gotha), Hendrik Kraft. Aktu… [+1245 chars]",,de,'Ernte'
https://www.nzz.ch/panorama/in-griechenland-herrscht-eine-der-schlimmsten-duerren-seit-30-jahren-seen-trocknen-aus-ein-versunkenes-dorf-taucht-wieder-auf-ld.1847007,https://www.nzz.ch/panorama/in-griechenland-herrscht-eine-der-schlimmsten-duerren-seit-30-jahren-seen-trocknen-aus-ein-versunkenes-dorf-taucht-wieder-auf-ld.1847007,0,www.nzz.ch,"In Griechenland herrscht eine der schlimmsten Dürren seit 30 Jahren: Seen trocknen aus, ein versunkenes Dorf taucht wieder auf","Griechenland kämpft mit einer andauernden Hitzeperiode. Experten sind alarmiert, weil in Wasserreservoiren wie dem Mornos-Stausee die Pegel drastisch sinken. Besonders die Hauptstadt Athen ist auf den See angewiesen.","https://img.nzz.ch/2024/09/05/afcd7f1f-1098-4951-a6a7-843eb1a8e356.jpeg?width=1200&height=675&fit=bounds&quality=75&auto=webp&crop=3543,1993,x0,y185&wmark=nzz",2024-09-05T10:03:27Z,http://archive.md/20240905124802/https://www.nzz.ch/panorama/in-griechenland-herrscht-eine-der-schlimmsten-duerren-seit-30-jahren-seen-trocknen-aus-ein-versunkenes-dorf-taucht-wieder-auf-ld.1847007,"Der Salzsee Pikrolimni in Nordgriechenland ist ein beliebtes Touristenziel. Ende August war er fast völlig ausgetrocknet.
Ein Sommer mit wenig Regen und hohen Temperaturen sowie ein Winter mit kaum … [+4543 chars]",,de,'Dürre'
https://www.diepresse.com/18829796/griechenland-duerre-laesst-versunkenes-dorf-in-stausee-wieder-auftauchen,https://www.diepresse.com/18829796/griechenland-duerre-laesst-versunkenes-dorf-in-stausee-wieder-auftauchen,0,www.diepresse.com,Griechenland: Dürre lässt versunkenes Dorf in Stausee wieder auftauchen,Der rund 250 Kilometer westlich von Athen gelegene Mornos-Stausee versorgt die griechische Hauptstadt seit 50 Jahren mit Wasser. Aufgrund der Dürre taucht nun ein im Stausee versunkenes Dorf wieder auf.,https://img.diepresse.com/public/incoming/ohgp4d-EUROPE-WEATHERGREECE-DROUGHT-LAKE/alternates/DPR_SOCIAL_NACHRICHTEN/EUROPE-WEATHERGREECE-DROUGHT-LAKE,2024-09-05T10:07:59Z,https://web.archive.org/web/20240905101523/https://www.diepresse.com/18829796/griechenland-duerre-laesst-versunkenes-dorf-in-stausee-wieder-auftauchen,Der rund 250 Kilometer westlich von Athen gelegene Mornos-Stausee versorgt die griechische Hauptstadt seit 50 Jahren mit Wasser. Aufgrund der Dürre taucht nun ein im Stausee versunkenes Dorf wieder a… [+2302 chars],,de,'Dürre'
https://www.diepresse.com/18831535/die-herbstlohnrunde-der-metaller-faellt-heuer-aus,https://www.diepresse.com/18831535/die-herbstlohnrunde-der-metaller-faellt-heuer-aus,0,www.diepresse.com,Die Herbstlohnrunde der Metaller fällt heuer aus [premium],"Die Lohnerhöhungen in der Metallindustrie wurden bereits voriges Jahr ausgehandelt. Die Branche verharrt in der Rezession. Die starken Lohnerhöhungen der vergangenen zwei Jahre hätten die Wettbewerbsfähigkeit verschlechtert, moniert die Branche – die Folge se…",https://img.diepresse.com/public/incoming/8l5lh2-09.06-s12-Tarifl%C3%B6hne-GK.gif/alternates/DPR_SOCIAL_NACHRICHTEN/09.06-s12-Tarifl%C3%B6hne-GK.gif,2024-09-05T14:51:01Z,,Die Lohnerhöhungen in der Metallindustrie wurden bereits voriges Jahr ausgehandelt. Die Branche verharrt in der Rezession. Die starken Lohnerhöhungen der vergangenen zwei Jahre hätten die Wettbewerbs… [+1067 chars],,de,'Herbst'
https://www.stern.de/gesellschaft/regional/mecklenburg-vorpommern/weinanbau-im-norden--weinlese-in-rattey-angelaufen---gute-qualitaet-erwartet-35041128.html,https://www.stern.de/gesellschaft/regional/mecklenburg-vorpommern/weinanbau-im-norden--weinlese-in-rattey-angelaufen---gute-qualitaet-erwartet-35041128.html,0,www.stern.de,Weinanbau im Norden: Weinlese in Rattey angelaufen - gute Qualität erwartet,Weinanbau gibt es auch im Norden. Im Südosten von MV befindet sich das nach eigenen Angaben größte Weingut Norddeutschlands. Dort geht es nach zuletzt gutem Wetter nun mit der Weinlese los.,https://image.stern.de/35041130/t/H7/v1/w1440/r1.7778/-/05--cpjrxadatbv10axw800h600jpeg---d7c5b43000d740e1.jpg,2024-09-05T15:01:33Z,,"Weinanbau gibt es auch im Norden. Im Südosten von MV befindet sich das nach eigenen Angaben größte Weingut Norddeutschlands. Dort geht es nach zuletzt gutem Wetter nun mit der Weinlese los.
In Ratte… [+1807 chars]",,de,'Weinlese'
https://www.zeit.de/news/2024-09/05/weinlese-in-rattey-angelaufen-gute-qualitaet-erwartet,https://www.zeit.de/news/2024-09/05/weinlese-in-rattey-angelaufen-gute-qualitaet-erwartet,0,www.zeit.de,Weinanbau im Norden: Weinlese in Rattey angelaufen - gute Qualität erwartet,Hier finden Sie Informationen zu dem Thema „Weinanbau im Norden“. Lesen Sie jetzt „Weinlese in Rattey angelaufen - gute Qualität erwartet“.,https://img.zeit.de/news/2024-09/05/weinlese-in-rattey-angelaufen-gute-qualitaet-erwartet-image-group/wide__1300x731,2024-09-05T15:01:33Z,,"In Rattey (Mecklenburgische Seenplatte), auf dem nach eigenen Angaben mit Abstand größten Weingut Norddeutschlands, ist die diesjährige Weinlese angelaufen. Zunächst würden die Trauben der Sorte Sola… [+1647 chars]",,de,'Weinlese'
https://www.stern.de/gesellschaft/regional/niedersachsen-bremen/landwirtschaft--gute-ernte-bei-zuckerrueben-erwartet-35041222.html,https://www.stern.de/gesellschaft/regional/niedersachsen-bremen/landwirtschaft--gute-ernte-bei-zuckerrueben-erwartet-35041222.html,0,www.stern.de,Landwirtschaft: Gute Ernte bei Zuckerrüben erwartet,Hannover (lni) - Entgegen den Erwartungen sind die diesjährigen Aussichten auf die Zuckerrübenernte in Niedersachsen gut. Mais und Kartoffeln haben,https://image.stern.de/35041224/t/Vu/v1/w1440/r1.7778/-/05--fywnqudzzvv4axw800h600jpeg---7fbf2f729420d4da.jpg,2024-09-05T15:29:58Z,,"Zuckerrüben konnten in diesem Jahr vom vielen Regen profitieren. Bei Mais und Kartoffeln sieht das anders aus.
Entgegen den Erwartungen sind die diesjährigen Aussichten auf die Zuckerrübenernte in N… [+1661 chars]",,de,'Ernte'
https://www.zeit.de/news/2024-09/05/gute-ernte-bei-zuckerrueben-erwartet,https://www.zeit.de/news/2024-09/05/gute-ernte-bei-zuckerrueben-erwartet,0,www.zeit.de,Landwirtschaft: Gute Ernte bei Zuckerrüben erwartet,Hier finden Sie Informationen zu dem Thema „Landwirtschaft“. Lesen Sie jetzt „Gute Ernte bei Zuckerrüben erwartet“.,https://img.zeit.de/news/2024-09/05/gute-ernte-bei-zuckerrueben-erwartet-image-group/wide__1300x731,2024-09-05T15:29:58Z,,"Entgegen den Erwartungen sind die diesjährigen Aussichten auf die Zuckerrübenernte in Niedersachsen gut. Mais und Kartoffeln haben derweil unter dem regnerischen Wetter gelitten, wie die Landwirtscha… [+1580 chars]",,de,'Ernte'
https://www.faz.net/aktuell/wissen/erde-klima/2024-war-heissester-sommer-in-europa-und-weltweit-19966825.html,https://www.faz.net/aktuell/wissen/erde-klima/2024-war-heissester-sommer-in-europa-und-weltweit-19966825.html,0,www.faz.net,2024 war in Europa und weltweit der heißeste Sommer,Auch das gesamte laufende Jahr wird wohl einen neuen Hitzerekord markieren. Zwar lagen in Teilen Europas die August-Temperaturen unter dem Durchschnitt. Doch die globale Erwärmung geht weiter.,https://media0.faz.net/ppmedia/aktuell/gesellschaft/1321758592/1.9966842/facebook_teaser/es-wird-im-durchschnitt.jpg,2024-09-06T02:50:06Z,,"Copernicus stützt sich auf einen Datensatz, der auf Milliarden von Messungen von Satelliten, Schiffen, Flugzeugen und Wetterstationen auf der ganzen Welt basiert.
Auch Europa erlebte den wärmsten So… [+2382 chars]",,de,'Sommer'
https://www.tagesschau.de/wissen/klima/sommer-hoechststand-temperatur-100.html,https://www.tagesschau.de/wissen/klima/sommer-hoechststand-temperatur-100.html,0,www.tagesschau.de,EU-Klimadienst misst heißesten Sommer seit Aufzeichnungsbeginn,Auch wenn im August kein neuer Temperatur-Höchststand gemessen wurde - der Sommer 2024 war so warm wie nie zuvor seit Beginn der Aufzeichnungen. Das laufende Jahr steuert ebenfalls auf einen Höchstwert zu.,https://images.tagesschau.de/image/e0297eaa-7d25-4c42-b884-7e44071763e1/AAABkaNlR1I/AAABkZLhkrw/16x9-1280/sommer-232.jpg,2024-09-06T03:16:14Z,,"Stand: 06.09.2024 05:16 Uhr
Auch wenn im August kein neuer Temperatur-Höchststand gemessen wurde - der Sommer 2024 war so warm wie nie zuvor seit Beginn der Aufzeichnungen. Das laufende Jahr steuert… [+3375 chars]",,de,'Sommer'
https://www.zeit.de/news/2024-09/06/das-juni-hochwasser-und-seine-folgen,https://www.zeit.de/news/2024-09/06/das-juni-hochwasser-und-seine-folgen,0,www.zeit.de,Hilfe nach Katastrophenflut: Das Juni-Hochwasser und seine Folgen,Hier finden Sie Informationen zu dem Thema „Hilfe nach Katastrophenflut“. Lesen Sie jetzt „Das Juni-Hochwasser und seine Folgen“.,https://img.zeit.de/news/2024-09/06/das-juni-hochwasser-und-seine-folgen-image-group/wide__1300x731,2024-09-06T03:35:35Z,,100 Tage nach der Jahrhundertflut im Süden und Osten Bayerns sind mehr als 13.500 Anträge auf Soforthilfe bei den Ministerien eingegangen. Am ersten Juni-Wochenende waren in Teilen Bayerns nach tagel… [+2170 chars],,de,'Hochwasser'
https://taz.de/Rheinmetall-entwaffnen-in-Kiel/!6031385/,https://taz.de/Rheinmetall-entwaffnen-in-Kiel/!6031385/,0,taz.de,„Rheinmetall entwaffnen“ in Kiel: Friedenscamp vor der Rüstungswerft,"In Kiel veranstaltet die Ini „Rheinmetall entwaffnen“ ihr Sommercamp. Sie ist gegen die Unterstützung der Ukraine, aber für den Kampf in Kurdistan.",https://taz.de/picture/7228198/948/n2-camp-malen-1.jpeg,2024-09-06T05:00:00Z,,"In Kiel veranstaltet die Ini Rheinmetall entwaffnen ihr Sommercamp. Sie ist gegen die Unterstützung der Ukraine, aber für den Kampf in Kurdistan.
Werbung für den Frieden: Aktivistinnen beim Plakate … [+4609 chars]",,de,'Sommer'
https://www.stern.de/auto/neue-reifen-regel--fuer-diese-pneus-gelten-ab-oktober-strafen-35040150.html,https://www.stern.de/auto/neue-reifen-regel--fuer-diese-pneus-gelten-ab-oktober-strafen-35040150.html,0,www.stern.de,Mobilität: Ab dem 1. Oktober drohen Strafen: Diese Autoreifen sollten Sie nicht mehr fahren,"Besitzer von alten Reifen aufgepasst: Ende September läuft die Übergangsfrist für Pneus mit einer bestimmten Kennzeichnung aus. Wer damit im Winter erwischt wird, muss zahlen.",https://image.stern.de/35040148/t/iI/v4/w1440/r1.7778/-/reifen-winterreifen-m-s.jpg,2024-09-06T06:05:00Z,,"Ein vollständiges Verbot, wie viele Medien schreiben, ist es nicht. Aber: Wer ab dem 1. Oktober mit Reifen unterwegs ist, auf denen lediglich das ""M+S""-Symbol zu finden ist, muss ganz genau aufs Wett… [+3145 chars]",,de,'Winter'
https://www.zeit.de/news/2024-09/06/einsaetze-wegen-unwetter-gewitter-am-wochenende,https://www.zeit.de/news/2024-09/06/einsaetze-wegen-unwetter-gewitter-am-wochenende,0,www.zeit.de,Unwettereinsätze: Einsätze wegen Unwetter - Gewitter am Wochenende,Hier finden Sie Informationen zu dem Thema „Unwettereinsätze“. Lesen Sie jetzt „Einsätze wegen Unwetter - Gewitter am Wochenende“.,https://img.zeit.de/news/2024-09/06/einsaetze-wegen-unwetter-gewitter-am-wochenende-image-group/wide__1300x731,2024-09-06T07:19:33Z,,"Nächtliche Gewitter und Starkregen haben in Teilen Baden-Württembergs für Einsätze der Feuerwehr und Polizei gesorgt. Verletzte oder größere Schäden seien bislang nicht bekannt, teilte die Polizeiprä… [+834 chars]",,de,'Gewitter'
https://www.der-postillon.com/2024/09/newsticker-2143.html,https://www.der-postillon.com/2024/09/newsticker-2143.html,0,www.der-postillon.com,Newsticker (2143),"+++ Sieht man nicht alle Tage: Wandkalender mit vereinzelt geschwärzten Daten +++
+++ Wasser, Laub, diesig: Moderatorin sorgt mit Herbstwettervorhersage für Empörung +++
+++ Hat alle im Loop gehalten: CEO von Achterbahnfirma wegen Nötigung verklagt +++
+++ Jo…",https://blogger.googleusercontent.com/img/b/R29vZ2xl/AVvXsEgzV8DDwIdKSMkhcdb428k9hS51vTfii9gW7O3uGQCXwt3Ywls192zk0otyWGuk4yO3z0uOyKoMSTS3yO_HsLLJwlp02669UW-6gQLdN8bwoBTPwSYosyt8rHmMXiXePqS5m2k2OEWxBZGcZMaMlg2RihZcW7r1b0M0v9hshEFGX9v-d7aepa8NcNtwyUHH/w1600/tickerwandkalender.jpg,2024-09-06T07:30:00Z,,"+++ Sieht man nicht alle Tage: Wandkalender mit vereinzelt geschwärzten Daten +++
+++ Wasser, Laub, diesig: Moderatorin sorgt mit Herbstwettervorhersage für Empörung +++
+++ Hat alle im Loop gehalt… [+498 chars]",,de,'Laub'
https://oe3.orf.at/stories/3043335/,https://oe3.orf.at/stories/3043335/,0,oe3.orf.at,Knoll packt an... und macht Hüte in der Steiermark,"<ul><li>Kirtage, Kirchtage, Oktoberfeste, Weinlesefeste ... im September trägt man in Österreich wieder Tracht</li><li>Dazu gehört auch eine Kopfbedeckung</li><li>Andi Knoll packt nach der Sommerpause diesmal an in einer über 100 Jahre alten Hutmanufaktur.</l…",https://tubestatic.orf.at/static/images/site/tube/20231145/oe3_knollpacktan23_bigpicture_624x351px_final.6004644.jpg,2024-09-06T08:15:00Z,,"<ul><li>Kirtage, Kirchtage, Oktoberfeste, Weinlesefeste ... im September trägt man in Österreich wieder Tracht</li><li>Dazu gehört auch eine Kopfbedeckung</li><li>Andi Knoll packt nach der Sommerpaus… [+2108 chars]",,de,'Sommer'
https://www.welt.de/gesundheit/article253370670/Gefaehrliche-Zusammenhaenge-Weniger-Fledermaeuse-mehr-Insektizide-und-der-Mensch-leidet.html,https://www.welt.de/gesundheit/article253370670/Gefaehrliche-Zusammenhaenge-Weniger-Fledermaeuse-mehr-Insektizide-und-der-Mensch-leidet.html,0,www.welt.de,Warum der Mensch auf Fledermäuse angewiesen ist,"Wenn Fledermäuse fehlen, florieren Schädlinge: Für Landwirte bedeutet das mehr Insektizide und trotzdem Ernteeinbußen. Diesen Zusammenhang stellte ein US-Umweltökonom fest, der neben den wirtschaftlichen Folgen noch auf etwas anderes stieß – ein Gesundheitsri…",https://img.welt.de/img/wissenschaft/mobile253378994/2547939467-ci16x9-w1200/GettyImages-1488855930.jpg,2024-09-06T08:32:17Z,,"Wenn Fledermäuse fehlen, florieren Schädlinge: Für Landwirte bedeutet das mehr Insektizide und trotzdem Ernteeinbußen. Diesen Zusammenhang stellte ein US-Umweltökonom fest, der neben den wirtschaftli… [+8014 chars]",,de,'Ernte'
https://www.stern.de/panorama/abschied-vom-sommer--in-der-naechsten-woche-kommt-der-herbst-35043224.html,https://www.stern.de/panorama/abschied-vom-sommer--in-der-naechsten-woche-kommt-der-herbst-35043224.html,0,www.stern.de,Abschied vom Sommer: In der nächsten Woche kommt der Herbst,"Offenbach - Jetzt kommt er also doch, der Herbst. «Sommerliebhaber sollten den Samstag unbedingt nochmals ausnutzen», rät Meteorologe Nico Bauer vom",https://image.stern.de/35043226/t/9T/v1/w1440/r1.7778/-/06--u6526qhhvev8axw800h600jpeg---e668f3f07af13a89.jpg,2024-09-06T10:46:42Z,,"Am Samstag könnte vorerst letzte warme Tag sein. In einer Region bleiben die Temperaturen aber noch etwas länger oben.
Jetzt kommt er also doch, der Herbst. ""Sommerliebhaber sollten den Samstag unbe… [+1044 chars]",,de,'Gewitter'
https://www.zeit.de/news/2024-09/06/in-der-naechsten-woche-kommt-der-herbst,https://www.zeit.de/news/2024-09/06/in-der-naechsten-woche-kommt-der-herbst,0,www.zeit.de,Abschied vom Sommer: In der nächsten Woche kommt der Herbst,Hier finden Sie Informationen zu dem Thema „Abschied vom Sommer“. Lesen Sie jetzt „In der nächsten Woche kommt der Herbst“.,https://img.zeit.de/news/2024-09/06/in-der-naechsten-woche-kommt-der-herbst-image-group/wide__1300x731,2024-09-06T10:46:42Z,,"Jetzt kommt er also doch, der Herbst. «Sommerliebhaber sollten den Samstag unbedingt nochmals ausnutzen», rät Meteorologe Nico Bauer vom Deutschen Wetterdienst. Die Temperaturen steigen erneut auf ho… [+955 chars]",,de,'Sommer'
https://www.faz.net/aktuell/politik/fraktur/fraktur-wird-merz-merkel-ohne-ironie-loben-koennen-19967681.html,https://www.faz.net/aktuell/politik/fraktur/fraktur-wird-merz-merkel-ohne-ironie-loben-koennen-19967681.html,0,www.faz.net,"Fraktur: Der beste Kanzler, den wir je hatten?","Sie glauben im Ernst, dass Lauterbach das ernst meinte? Auch an anderen Fällen sieht man, wie irreführend Ironie in der Politik sein kann.",https://media0.faz.net/ppmedia/aktuell/3283170944/1.9967680/facebook_teaser/voller-tuecke-eine-luecke-in.jpg,2024-09-06T10:47:29Z,,"Da hat Putin uns schön veräppelt
So stutzten doch sicher auch Sie erst einmal, als Putin vor laufenden Kameras bekanntgab, nicht länger seinen alten Buddy Donald unterstützen zu wollen, sondern die … [+3452 chars]",,de,'Glatteis'
https://www.zeit.de/video/2024-09/6361594418112/klimakrise-sommer-2024-war-der-heisseste-seit-beginn-der-aufzeichnungen,https://www.zeit.de/video/2024-09/6361594418112/klimakrise-sommer-2024-war-der-heisseste-seit-beginn-der-aufzeichnungen,0,www.zeit.de,Klimakrise: Sommer 2024 war der heißeste seit Beginn der Aufzeichnungen,Zwischen Juni und August lagen die Durchschnittstemperaturen weltweit auf einem neuen Rekordhoch. Damit ist der Sommer 2024 der heißeste seit Aufzeichnungsbeginn.,https://img.zeit.de/video/2024-09/6361594418112-still/wide__1300x731,2024-09-06T10:53:06Z,,"Schließen
Hier können Sie interessante Artikel speichern, um sie später zu lesen und wiederzufinden.
Sie haben bereits ein Konto?
 Hier anmelden.",,de,'Sommer'
https://www.diepresse.com/18834494/bis-zu-31-grad-am-wochenende-dann-temperatursturz,https://www.diepresse.com/18834494/bis-zu-31-grad-am-wochenende-dann-temperatursturz,0,www.diepresse.com,"Bis zu 31 Grad am Wochenende, dann Temperatursturz",Nach einem hochsommerlichen Wochenende stellt sich das Wetter am Montag markant um - auf Temperaturen um die 10 Grad.,https://img.diepresse.com/public/incoming/rq9br6-Alte-Donau-in-Wien-Old-Danube-in-Vienna/alternates/DPR_SOCIAL_NACHRICHTEN/Alte%20Donau%20in%20Wien%20%20Old%20Danube%20in%20Vienna,2024-09-06T11:25:44Z,,"Nach einem hochsommerlichen Wochenende stellt sich das Wetter am Montag markant um - auf Temperaturen um die 10 Grad. 
Das Wochenende gestaltet sich noch hochsommerlich, dann steht zu Wochenbeginn a… [+2493 chars]",,de,'Gewitter'
https://www.diepresse.com/18834989/erntedank-diversity-ball-und-eine-neue-markthalle-wien-erwacht-aus-dem-sommermodus,https://www.diepresse.com/18834989/erntedank-diversity-ball-und-eine-neue-markthalle-wien-erwacht-aus-dem-sommermodus,0,www.diepresse.com,"Erntedank, Diversity Ball und eine neue Markthalle: Wien erwacht aus dem Sommermodus","Das Wochenende in Wien ist dicht wie lang nicht mehr: Erntedank- oder Musikfestival, Feuerwehrfest, Diversity Ball und eine frisch eröffnete Markthalle: Ein Überblick.",https://img.diepresse.com/public/incoming/bxeh7t-Erntedankfest/alternates/DPR_SOCIAL_NACHRICHTEN/Erntedankfest,2024-09-06T12:47:24Z,,"Das Wochenende in Wien ist dicht wie lang nicht mehr: Erntedank- oder Musikfestival, Feuerwehrfest, Diversity Ball und eine frisch eröffnete Markthalle: Ein Überblick. 
Wien. Es ist ja nicht so, das… [+7283 chars]",,de,'Ernte'
https://www.nzz.ch/international/serbien-belgrad-bekaempft-den-protest-gegen-lithium-bergwerk-ld.1846817,https://www.nzz.ch/international/serbien-belgrad-bekaempft-den-protest-gegen-lithium-bergwerk-ld.1846817,0,www.nzz.ch,Totschweigen und schikanieren: Wie Belgrad den Protest gegen das Lithium-Bergwerk bekämpft,"Nach den heftigen Protesten im Sommer steigt die Nervosität der serbischen Regierung. Aktivisten sind Einschüchterungen, Schikanen und einem Aufruf zur Denunziation ausgesetzt.","https://img.nzz.ch/2024/09/06/c808da5e-b0cd-4531-bdfe-5420958250cb.jpeg?width=1200&height=675&fit=bounds&quality=75&auto=webp&crop=4544,2556,x0,y0&wmark=nzz",2024-09-06T13:05:34Z,,"Zehntausende protestierten am 10. August in Belgrad gegen den geplanten Lithiumabbau. Auf die Proteste folgte eine Reihe von Verhaftungen, über die in Serbien nur wenig berichtet wird.
Der jüngste P… [+6876 chars]",,de,'Sommer'
