index,url,valid,domain,title,description,image,published,archive,content,quote,language,keyword
https://www.stern.de/panorama/herbst--turbulentes-wetter-mit-viel-regen-und-wind-35121142.html,https://www.stern.de/panorama/herbst--turbulentes-wetter-mit-viel-regen-und-wind-35121142.html,0,www.stern.de,Herbst: Turbulentes Wetter mit viel Regen und Wind,Offenbach - Die neue Woche beginnt nach teils goldenem Oktoberwetter regnerisch. Von einer «turbulenten Woche» spricht Meteorologe Nico Bauer vom,https://image.stern.de/35121144/t/Nl/v1/w1440/r1.7778/-/06--p7qlaik4agv6axw800h600jpeg---cc99cb6a321209aa.jpg,2024-10-06T11:17:00Z,https://web.archive.org/web/20241006113549/https://www.stern.de/panorama/herbst--turbulentes-wetter-mit-viel-regen-und-wind-35121142.html,"Nasses, aber mildes Herbstwetter breitet sich in der kommenden Woche in Deutschland aus. Am Donnerstag wird der erste Herbststurm erwartet.
Die neue Woche beginnt nach teils goldenem Oktoberwetter r… [+1296 chars]",,de,'Herbst'
https://www.zeit.de/news/2024-10/06/turbulentes-wetter-mit-viel-regen-und-wind,https://www.zeit.de/news/2024-10/06/turbulentes-wetter-mit-viel-regen-und-wind,0,www.zeit.de,Herbst: Turbulentes Wetter mit viel Regen und Wind,Hier finden Sie Informationen zu dem Thema „Herbst“. Lesen Sie jetzt „Turbulentes Wetter mit viel Regen und Wind“.,https://img.zeit.de/news/2024-10/06/turbulentes-wetter-mit-viel-regen-und-wind-image-group/wide__1300x731,2024-10-06T11:17:00Z,,"Die neue Woche beginnt nach teils goldenem Oktoberwetter regnerisch. Von einer ""turbulenten Woche"" spricht Meteorologe Nico Bauer vom Deutschen Wetterdienst in Offenbach (DWD). Denn bald kommt auch k… [+1186 chars]",,de,'Gewitter'
https://www.tagesspiegel.de/gesellschaft/panorama/herbst-turbulentes-wetter-mit-viel-regen-und-wind-12488768.html,https://www.tagesspiegel.de/gesellschaft/panorama/herbst-turbulentes-wetter-mit-viel-regen-und-wind-12488768.html,0,www.tagesspiegel.de,Herbst: Turbulentes Wetter mit viel Regen und Wind,"Nasses, aber mildes Herbstwetter breitet sich in der kommenden Woche in Deutschland aus. Am Donnerstag wird der erste Herbststurm erwartet.",https://www.tagesspiegel.de/images/12488765/alternates/BASE_16_9_W1400/1728213480000/morgennebel-in-duisburg.jpeg,2024-10-06T11:18:00Z,https://web.archive.org/web/20241007011207/https://www.tagesspiegel.de/gesellschaft/panorama/herbst-turbulentes-wetter-mit-viel-regen-und-wind-12488768.html,Die neue Woche beginnt nach teils goldenem Oktoberwetter regnerisch. Von einer turbulenten Woche spricht Meteorologe Nico Bauer vom Deutschen Wetterdienst in Offenbach (DWD). Denn bald kommt auch krä… [+1234 chars],,de,'Herbst'
https://www.stern.de/gesellschaft/regional/mecklenburg-vorpommern/agrarwirtschaft--erntedankfest-in-stralsund---minister--gute-getreideernte-35119636.html,https://www.stern.de/gesellschaft/regional/mecklenburg-vorpommern/agrarwirtschaft--erntedankfest-in-stralsund---minister--gute-getreideernte-35119636.html,0,www.stern.de,Agrarwirtschaft: Erntedankfest in Stralsund - Minister: Gute Getreideernte,"Die Felder sind leer, zum Großteil schon bestellt für das kommende Jahr. Zum Landeserntedankfest blicken vor allem viele Pflanzenbaubetriebe in MV auf gute Erträge zurück.",https://image.stern.de/35121216/t/xA/v1/w1440/r1.7778/-/06--d2ovb66fpgv1axw800h600jpeg---62df86daa3650cdb.jpg,2024-10-06T12:07:50Z,https://web.archive.org/web/20241006122232/https://www.stern.de/gesellschaft/regional/mecklenburg-vorpommern/agrarwirtschaft--erntedankfest-in-stralsund---minister--gute-getreideernte-35119636.html,"Die Felder sind leer, zum Großteil schon bestellt für das kommende Jahr. Zum Landeserntedankfest blicken vor allem viele Pflanzenbaubetriebe in MV auf gute Erträge zurück.
Die Bauern in Mecklenburg-… [+4560 chars]",,de,'Ernte'
https://www.zeit.de/news/2024-10/06/100-000-besucher-bei-erntedank-festzug-in-fuerth,https://www.zeit.de/news/2024-10/06/100-000-besucher-bei-erntedank-festzug-in-fuerth,0,www.zeit.de,Volksfest: 100.000 Besucher bei Erntedank-Festzug in Fürth,Hier finden Sie Informationen zu dem Thema „Volksfest“. Lesen Sie jetzt „100.000 Besucher bei Erntedank-Festzug in Fürth“.,https://img.zeit.de/news/2024-10/06/100-000-besucher-bei-erntedank-festzug-in-fuerth-image-group/wide__1300x731,2024-10-06T12:22:22Z,,"Mit Blasmusik und zahlreichen liebevoll dekorierten Festwagen sind rund 90 Gruppen beim Erntedank-Festzug der Michaelis-Kirchweih durch Fürth gezogen. Etwa 100.000 Besucher zählte die Polizei, der zu… [+1760 chars]",,de,'Ernte'
https://www.faz.net/aktuell/rhein-main/mann-schiesst-in-wiesbaden-mit-schreckschusspistole-aktuelle-nachrichten-aus-frankfurt-hessen-faz-19735361.html,https://www.faz.net/aktuell/rhein-main/mann-schiesst-in-wiesbaden-mit-schreckschusspistole-aktuelle-nachrichten-aus-frankfurt-hessen-faz-19735361.html,0,www.faz.net,Aktuelle Nachrichten aus Frankfurt und Rhein-Main | FAZ,Rollerfahrer flüchtet in Wiesbaden vor der Polizei und verursacht Unfall +++ Regen und Gewitter in Hessen erwartet +++ Feuer in Kasseler Krankenhaus +++ Liveblog für Frankfurt und Hessen.,https://media0.faz.net/ppmedia/aktuell/gesellschaft/1371189973/1.10029648/facebook_teaser/der-mann-habe-damit-einen.jpg,2024-10-06T12:56:45Z,https://web.archive.org/web/20241006153621/https://www.faz.net/aktuell/rhein-main/mann-schiesst-in-wiesbaden-mit-schreckschusspistole-aktuelle-nachrichten-aus-frankfurt-hessen-faz-19735361.html,,,de,'Gewitter'
https://www.n-tv.de/panorama/Ein-ehemaliger-Hurrikan-sorgt-fuer-Herbststurm-article25272767.html,https://www.n-tv.de/panorama/Ein-ehemaliger-Hurrikan-sorgt-fuer-Herbststurm-article25272767.html,0,www.n-tv.de,Wetterwoche im Schnellcheck: Ein ehemaliger Hurrikan sorgt für Herbststurm,"Gerade wirbelt Hurrikan ""Kirk"" noch über den Atlantik, doch in der kommenden Woche mischt er auch in Deutschland das Wetter auf. Zwar verliert er auf dem Weg nach Europa an Kraft, sorgt aber noch immer für einen starken Herbststurm.",https://bilder2.n-tv.de/img/incoming/crop25272777/7041322868-cImg_16_9-w1200/486103871.jpg,2024-10-06T13:52:33Z,https://web.archive.org/web/20241006145147/https://www.n-tv.de/panorama/Ein-ehemaliger-Hurrikan-sorgt-fuer-Herbststurm-article25272767.html,"Gerade wirbelt Hurrikan ""Kirk"" noch über den Atlantik, doch in der kommenden Woche mischt er auch in Deutschland das Wetter auf. Zwar verliert er auf dem Weg nach Europa an Kraft, sorgt aber noch imm… [+2831 chars]",,de,'Herbst'
https://www.stern.de/panorama/wetter/wetter-in-deutschland--viel-regen-und-wind-in-der-neuen-woche-35121454.html,https://www.stern.de/panorama/wetter/wetter-in-deutschland--viel-regen-und-wind-in-der-neuen-woche-35121454.html,0,www.stern.de,Herbststurm im Anmarsch: Turbulentes Wetter mit viel Regen und Wind erwartet uns,"In der neuen Woche setzt sich in Deutschland nasses, aber mildes Herbstwetter durch. Am Donnerstag wird der erste Herbststurm erwartet.",https://image.stern.de/35121456/t/xq/v1/w1440/r1.7778/-/wetter-sturm-herbst.jpg,2024-10-06T14:08:00Z,https://web.archive.org/web/20241006202423/https://www.stern.de/panorama/wetter/wetter-in-deutschland--viel-regen-und-wind-in-der-neuen-woche-35121454.html,"In der neuen Woche setzt sich in Deutschland nasses, aber mildes Herbstwetter durch. Am Donnerstag wird der erste Herbststurm erwartet.
Nach teils goldenem Oktoberwetter beginnt die neue Woche regne… [+1270 chars]",,de,'Herbst'
https://www.focus.de/panorama/wetter-im-ticker-sonnenbrille-weicht-regenjacke-und-es-wird-windig_id_54933749.html,https://www.focus.de/panorama/wetter-im-ticker-sonnenbrille-weicht-regenjacke-und-es-wird-windig_id_54933749.html,0,www.focus.de,Wetter im Ticker - Jetzt kommt die Regenjackenzeit: Es wird stürmisch und windig,"Nasses, aber mildes Herbstwetter breitet sich in der kommenden Woche in Deutschland aus. Am Donnerstag wird der erste Herbststurm erwartet.",https://p6.focus.de/img/fotos/id_260370721/regenjacke-regen-wetter.jpg?im=Crop%3D%280%2C288%2C3464%2C1732%29%3BResize%3D%281200%2C627%29&impolicy=perceptual&quality=mediumHigh&hash=df51c3557b6eb68f97b1ecbf5c29c85995e57941a2e9e44a1e00739167226441,2024-10-06T14:44:07Z,https://web.archive.org/web/20241006170638/https://www.focus.de/panorama/wetter-im-ticker-sonnenbrille-weicht-regenjacke-und-es-wird-windig_id_54933749.html,"<ul><li>
Kommentare</li><li>
E-Mail</li><li>
Teilen</li><li>
Mehr</li><li>
Twitter</li><li>
Drucken</li><li>
Feedback</li><li>
Fehler meldenSie haben einen Fehler gefunden?
Bitte markieren S… [+9403 chars]",,de,'Herbst'
https://www.faz.net/aktuell/rhein-main/wandbild-zum-gedenken-der-opfer-von-hanau-wiederhergestellt-aktuelle-nachrichten-aus-frankfurt-hessen-faz-19735361.html,https://www.faz.net/aktuell/rhein-main/wandbild-zum-gedenken-der-opfer-von-hanau-wiederhergestellt-aktuelle-nachrichten-aus-frankfurt-hessen-faz-19735361.html,0,www.faz.net,Aktuelle Nachrichten aus Frankfurt und Rhein-Main | FAZ,Mann schießt in Wiesbaden mit Schreckschusspistole +++ Rollerfahrer flüchtet vor der Polizei und verursacht Unfall +++ Regen und Gewitter in Hessen erwartet +++ Liveblog für Frankfurt und Hessen.,https://media0.faz.net/ppmedia/aktuell/politik/3152890675/1.10030182/facebook_teaser/die-kuenstler-setzten-die.jpg,2024-10-06T15:35:54Z,https://web.archive.org/web/20241006172339/https://www.faz.net/aktuell/rhein-main/wandbild-zum-gedenken-der-opfer-von-hanau-wiederhergestellt-aktuelle-nachrichten-aus-frankfurt-hessen-faz-19735361.html,,,de,'Gewitter'
https://www.diepresse.com/18936993/warum-im-tullnerfeld-immer-noch-keller-ueberflutet-werden,https://www.diepresse.com/18936993/warum-im-tullnerfeld-immer-noch-keller-ueberflutet-werden,0,www.diepresse.com,Warum im Tullnerfeld immer noch Keller überflutet werden [premium],"Nach dem Hochwasser Mitte September ist der Grundwassser-Spiegel im Tullnerfeld immer noch so hoch, dass zahlreiche Keller immer wieder unter Wasser stehen. Das regelmäßige Auspumpen der Keller hilft dabei kaum.",https://img.diepresse.com/public/incoming/2fwoh9-kein-Titel/alternates/DPR_SOCIAL_NACHRICHTEN/kein%20Titel,2024-10-06T16:02:56Z,,"Nach dem Hochwasser Mitte September ist der Grundwassser-Spiegel im Tullnerfeld immer noch so hoch, dass zahlreiche Keller immer wieder unter Wasser stehen. Das regelmäßige Auspumpen der Keller hilft… [+559 chars]",,de,'Hochwasser'
https://www.bild.de/news/ausland/drama-im-urlaubsparadies-wassermassen-fordern-todesopfer-670284d2caac7a221a777c5c,https://www.bild.de/news/ausland/drama-im-urlaubsparadies-wassermassen-fordern-todesopfer-670284d2caac7a221a777c5c,0,www.bild.de,Bosnien-Herzegowina - Tote nach Hochwasser-Chaos,"Durch schwere Überschwemmungen, Hochwasser und Erdrutsche sind südlich von Sarajevo in Bosnien-Herzegowina mindestens 14 Menschen gestorben.","https://images.bild.de/670284d2caac7a221a777c5c/98a207a8b074a2d48196f79cf36e3a11,c1bc24a5?w=1280",2024-10-06T17:52:41Z,,"Mehr zum Video anzeigen 
Durch schwere Überschwemmungen, Hochwasser und Erdrutsche sind südlich von Sarajevo in Bosnien-Herzegowina mindestens 16 Menschen gestorben. Sintflutartige Regenfälle reißen… [+133 chars]",,de,'Hochwasser'
https://www.stern.de/gesellschaft/regional/rheinland-pfalz-saarland/bei-guldental--wein-erntemaschine-ueberschlaegt-sich---fahrer-verletzt-35121854.html,https://www.stern.de/gesellschaft/regional/rheinland-pfalz-saarland/bei-guldental--wein-erntemaschine-ueberschlaegt-sich---fahrer-verletzt-35121854.html,0,www.stern.de,Bei Guldental: Wein-Erntemaschine überschlägt sich - Fahrer verletzt,Bei der Lese in den Weinbergen bei Guldental kommt es zu einem Unfall. Am Steilhang überschlägt sich ein Erntefahrzeug. Der Fahrer hatte Glück im Unglück.,https://image.stern.de/35121856/t/Pw/v1/w1440/r1.7778/-/06--qyhhem355xv19axw800h600jpeg---d85610e531a29c77.jpg,2024-10-06T21:29:02Z,https://web.archive.org/web/20241006222025/https://www.stern.de/gesellschaft/regional/rheinland-pfalz-saarland/bei-guldental--wein-erntemaschine-ueberschlaegt-sich---fahrer-verletzt-35121854.html,"Bei der Lese in den Weinbergen bei Guldental kommt es zu einem Unfall. Am Steilhang überschlägt sich ein Erntefahrzeug. Der Fahrer hatte Glück im Unglück.
Während der Weinlese bei Guldental im Kreis… [+495 chars]",,de,'Weinlese'
https://www.zeit.de/news/2024-10/06/wein-erntemaschine-ueberschlaegt-sich-fahrer-verletzt,https://www.zeit.de/news/2024-10/06/wein-erntemaschine-ueberschlaegt-sich-fahrer-verletzt,0,www.zeit.de,Bei Guldental: Wein-Erntemaschine überschlägt sich - Fahrer verletzt,Hier finden Sie Informationen zu dem Thema „Bei Guldental“. Lesen Sie jetzt „Wein-Erntemaschine überschlägt sich - Fahrer verletzt“.,https://img.zeit.de/news/2024-10/06/wein-erntemaschine-ueberschlaegt-sich-fahrer-verletzt-image-group/wide__1300x731,2024-10-06T21:29:02Z,,Während der Weinlese bei Guldental im Kreis Bad Kreuznach hat sich eine Erntemaschine überschlagen. Der Trauben-Vollernter kippte nach ersten Erkenntnissen in einem Steilstück um und überschlug sich … [+330 chars],,de,'Weinlese'
https://www.stern.de/gesellschaft/regional/sachsen-anhalt/ernte--krautfaeule-bei-kartoffeln--pilzbefall-in-einigen-regionen-35121958.html,https://www.stern.de/gesellschaft/regional/sachsen-anhalt/ernte--krautfaeule-bei-kartoffeln--pilzbefall-in-einigen-regionen-35121958.html,0,www.stern.de,Ernte: Krautfäule bei Kartoffeln: Pilzbefall in einigen Regionen,Bereits im Sommer war der erste Befall mit dem schädlichen Pilz in Sachsen-Anhalt festgestellt worden. Regenfälle hatten dann das Infektionsrisiko steigen lassen. Es gibt regionale Unterschiede.,https://image.stern.de/35121960/t/OF/v1/w1440/r1.7778/-/07--3vjqx3r45tv14axw800h600jpeg---aae1f430398897f0.jpg,2024-10-07T02:00:37Z,https://web.archive.org/web/20241007025118/https://www.stern.de/gesellschaft/regional/sachsen-anhalt/ernte--krautfaeule-bei-kartoffeln--pilzbefall-in-einigen-regionen-35121958.html,"Bereits im Sommer war der erste Befall mit dem schädlichen Pilz in Sachsen-Anhalt festgestellt worden. Regenfälle hatten dann das Infektionsrisiko steigen lassen. Es gibt regionale Unterschiede.
Bei… [+1548 chars]",,de,'Ernte'
https://www.zeit.de/news/2024-10/07/krautfaeule-bei-kartoffeln-pilzbefall-in-einigen-regionen,https://www.zeit.de/news/2024-10/07/krautfaeule-bei-kartoffeln-pilzbefall-in-einigen-regionen,0,www.zeit.de,Ernte: Krautfäule bei Kartoffeln: Pilzbefall in einigen Regionen,Hier finden Sie Informationen zu dem Thema „Ernte“. Lesen Sie jetzt „Krautfäule bei Kartoffeln: Pilzbefall in einigen Regionen“.,https://img.zeit.de/news/2024-10/07/krautfaeule-bei-kartoffeln-pilzbefall-in-einigen-regionen-image-group/wide__1300x731,2024-10-07T02:00:37Z,,"Bei der Kartoffelernte sorgen sich Landwirte in einigen Regionen in Sachsen-Anhalt wegen eines Befalls mit der sogenannten Krautfäule. Diese sei in diesem Jahr regional problematisch, teilte der Land… [+2187 chars]",,de,'Ernte'
https://www.stern.de/panorama/land-unter-in-chiang-mai--fluten-in-thailand--moench-bringt-hilfsgueter-mit-elefanten-35122148.html,https://www.stern.de/panorama/land-unter-in-chiang-mai--fluten-in-thailand--moench-bringt-hilfsgueter-mit-elefanten-35122148.html,0,www.stern.de,Land unter in Chiang Mai: Fluten in Thailand: Mönch bringt Hilfsgüter mit Elefanten,Da schauten viele verdutzt: Ein Mönch hat sich mit zwei Elefanten und jeder Menge Hilfsgüter durch das Hochwasser in Chiang Mai gekämpft. Sogar Menschen im ersten Stock wurden versorgt.,https://image.stern.de/35122150/t/14/v1/w1440/r1.7778/-/07--prmduhjwpjv13axw800h600jpeg---0dec592f0d3c3e11.jpg,2024-10-07T04:18:10Z,,"Da schauten viele verdutzt: Ein Mönch hat sich mit zwei Elefanten und jeder Menge Hilfsgüter durch das Hochwasser in Chiang Mai gekämpft. Sogar Menschen im ersten Stock wurden versorgt.
Ungewöhnlich… [+1813 chars]",,de,'Hochwasser'
https://www.tagesspiegel.de/gesellschaft/panorama/land-unter-in-chiang-mai-fluten-in-thailand-monch-bringt-hilfsguter-mit-elefanten-12490727.html,https://www.tagesspiegel.de/gesellschaft/panorama/land-unter-in-chiang-mai-fluten-in-thailand-monch-bringt-hilfsguter-mit-elefanten-12490727.html,0,www.tagesspiegel.de,Land unter in Chiang Mai: Fluten in Thailand: Mönch bringt Hilfsgüter mit Elefanten,Da schauten viele verdutzt: Ein Mönch hat sich mit zwei Elefanten und jeder Menge Hilfsgüter durch das Hochwasser in Chiang Mai gekämpft. Sogar Menschen im ersten Stock wurden versorgt.,https://www.tagesspiegel.de/images/12490724/alternates/BASE_16_9_W1400/1728274765000/hochwasser-in-thailand.jpeg,2024-10-07T04:19:25Z,,Ungewöhnliche Hilfsaktion für Hochwasser-Opfer in Thailand: Ein Mönch aus einer der bekanntesten Tempelanlagen von Chiang Mai hat Hilfsgüter auf zwei Elefanten gepackt und ist auf den Dickhäutern zu … [+1709 chars],,de,'Hochwasser'
https://noe.orf.at/stories/3275923/,https://noe.orf.at/stories/3275923/,0,noe.orf.at,400 Elektrogeräte für Hochwasseropfer gesammelt,Die Hochwasserkatastrophe  hat zahlreiche Haushalte in Niederösterreich schwer getroffen. Viele Familien müssen nun dringend benötigte Haushaltsgeräte ersetzen. Bei einer Spendenaktion wurden mehr als 400 Geräte für Betroffene gesammelt.,https://ibs.orf.at/noe?image=https%3A%2F%2Foekastatic.orf.at%2Fmims%2F2021%2F17%2F43%2Fcrops%2Fw%3D1200%2Ch%3D627%2Cq%3D75%2F919786_master_322343_1_1.jpg%3Fs%3D45a1f73a83a11069c01fcc513480354a7c15ffad,2024-10-07T04:28:10Z,,"Der Sachschaden nach dem Hochwasser Mitte September ist vielerorts enorm, die Wassermassen machten auch vor Alltagsgeräten keinen Halt. Um den Betroffenen den Wiederaufbau zu erleichtern, haben Mitgl… [+827 chars]",,de,'Hochwasser'
https://www.stern.de/gesellschaft/regional/nordrhein-westfalen/wetter--mildes-herbstwetter-mit-starkregen-und-gewitter-in-hessen-35122294.html,https://www.stern.de/gesellschaft/regional/nordrhein-westfalen/wetter--mildes-herbstwetter-mit-starkregen-und-gewitter-in-hessen-35122294.html,0,www.stern.de,Wetter: Mildes Herbstwetter mit Starkregen und Gewitter in Hessen,Offenbach (lhe) - Zu Beginn der Woche erwartet die Menschen in Hessen wechselhaftes Wetter mit milden Temperaturen. Am Abend und in der Nacht auf Dienstag,https://image.stern.de/35122296/t/Ex/v1/w1440/r1.7778/-/07--mhdzol66mwv10axw800h600jpeg---f83bc5a8a9304a96.jpg,2024-10-07T06:50:42Z,,"Die Woche beginnt in Hessen mit mildem Herbstwetter. Ab dem Abend sind gebietsweise Starkregen und Gewitter zu erwarten.
Zu Beginn der Woche erwartet die Menschen in Hessen wechselhaftes Wetter mit … [+548 chars]",,de,'Gewitter'
https://www.zeit.de/news/2024-10/07/mildes-herbstwetter-mit-starkregen-und-gewitter-in-hessen,https://www.zeit.de/news/2024-10/07/mildes-herbstwetter-mit-starkregen-und-gewitter-in-hessen,0,www.zeit.de,Wetter: Mildes Herbstwetter mit Starkregen und Gewitter in Hessen,Hier finden Sie Informationen zu dem Thema „Wetter“. Lesen Sie jetzt „Mildes Herbstwetter mit Starkregen und Gewitter in Hessen“.,https://img.zeit.de/news/2024-10/07/mildes-herbstwetter-mit-starkregen-und-gewitter-in-hessen-image-group/wide__1300x731,2024-10-07T06:50:42Z,,"Zu Beginn der Woche erwartet die Menschen in Hessen wechselhaftes Wetter mit milden Temperaturen. Am Abend und in der Nacht auf Dienstag seien im Süden des Landes Starkregen und Gewitter zu erwarten,… [+417 chars]",,de,'Herbst'
https://www.stern.de/gesellschaft/regional/rheinland-pfalz-saarland/wetter--starkregen-und-gewitter-in-rheinland-pfalz-und-dem-saarland-35122852.html,https://www.stern.de/gesellschaft/regional/rheinland-pfalz-saarland/wetter--starkregen-und-gewitter-in-rheinland-pfalz-und-dem-saarland-35122852.html,0,www.stern.de,Wetter: Starkregen und Gewitter in Rheinland-Pfalz und dem Saarland,Barweiler (lrs) - Die Menschen in Rheinland-Pfalz und dem Saarland erwartet in den nächsten Tagen wechselhaftes und mildes Herbstwetter. Ab,https://image.stern.de/35122854/t/sp/v1/w1440/r1.7778/-/07--s27hebmj7qv3axw800h600jpeg---0230a3871d1d0a3b.jpg,2024-10-07T09:24:08Z,,"In Rheinland-Pfalz und dem Saarland wird das Wetter wechselhaft und mild. Gebietsweise sind Starkregen und Gewitter zu erwarten.
Die Menschen in Rheinland-Pfalz und dem Saarland erwartet in den näch… [+678 chars]",,de,'Gewitter'
https://www.zeit.de/news/2024-10/07/weingaertnergenossenschaften-mit-deutlichem-ertragsminus,https://www.zeit.de/news/2024-10/07/weingaertnergenossenschaften-mit-deutlichem-ertragsminus,0,www.zeit.de,Weinherbst in Württemberg: Weingärtnergenossenschaften mit deutlichem Ertragsminus,Hier finden Sie Informationen zu dem Thema „Weinherbst in Württemberg“. Lesen Sie jetzt „Weingärtnergenossenschaften mit deutlichem Ertragsminus“.,https://img.zeit.de/news/2024-10/07/weingaertnergenossenschaften-mit-deutlichem-ertragsminus-image-group/wide__1300x731,2024-10-07T14:49:57Z,,Die Erntemenge der württembergischen Genossenschaftswinzer ist aufgrund der Frostnächte im Frühjahr deutlich gesunken. Mit der diesjährigen Traubenqualität sind die Weingärtnerinnen und Weingärtner a… [+2771 chars],,de,'Herbst'
https://www.stern.de/gesellschaft/regional/baden-wuerttemberg/weinherbst-in-wuerttemberg--weingaertnergenossenschaften-mit-deutlichem-ertragsminus-35124238.html,https://www.stern.de/gesellschaft/regional/baden-wuerttemberg/weinherbst-in-wuerttemberg--weingaertnergenossenschaften-mit-deutlichem-ertragsminus-35124238.html,0,www.stern.de,Weinherbst in Württemberg: Weingärtnergenossenschaften mit deutlichem Ertragsminus,Der Frost hat vielen Weingärtnern in Württemberg zugesetzt. Die Erntemenge fällt daher auch deutlich geringer aus. Mit der Qualität sind die Winzer aber zufrieden. Verbraucher könnten sich freuen.,https://image.stern.de/35124240/t/6z/v1/w1440/r1.7778/-/07--l4zgxwlgmmv9axw800h600jpeg---4640a004b3fec465.jpg,2024-10-07T14:49:57Z,,"Der Frost hat vielen Weingärtnern in Württemberg zugesetzt. Die Erntemenge fällt daher auch deutlich geringer aus. Mit der Qualität sind die Winzer aber zufrieden. Verbraucher könnten sich freuen.
D… [+2180 chars]",,de,'Ernte'
https://steiermark.orf.at/stories/3276286/,https://steiermark.orf.at/stories/3276286/,0,steiermark.orf.at,Steirische Winzer erwarten „Top-Jahrgang“,"Die steirischen Winzer erwartet heuer eine „hervorragende Ernte“, zumindest was die Qualität betrifft. Mengenmäßig falle die Ernte auf Grund der Witterungsverhältnisse heuer eher kleiner aus, heißt es.",https://ibs.orf.at/stm?image=https%3A%2F%2Foekastatic.orf.at%2Fmims%2F2024%2F41%2F18%2Fcrops%2Fw%3D1200%2Ch%3D627%2Cq%3D75%2F2379384_master_908718_weinstmk_image_c_johanna-lamprecht_0015.jpg%3Fs%3D95912b8da30d94cb4a3c8d92c7856c2c1654b12f,2024-10-08T07:30:30Z,,"Die steirischen Weinbauern bewirtschaften insgesamt 5.096 Hektar Weingartenfläche, was rund elf Prozent der gesamtösterreichischen Fläche entspricht. Im Vorjahr wurden laut Statistik Austria insgesam… [+1920 chars]",,de,'Ernte'
https://learngerman.dw.com/de/weinlese-auf-die-natur-kommt-es-an/l-44067403,https://learngerman.dw.com/de/weinlese-auf-die-natur-kommt-es-an/l-44067403,0,learngerman.dw.com,Weinlese: Auf die Natur kommt es an,"Auch in einem so traditionsreichen Handwerk wie dem Weinbau nimmt die Automatisierung immer mehr zu. Dennoch bleibt man abhängig von den Launen der Natur, und oft muss die Weinlese weiterhin per Hand betrieben werden.",https://static.dw.com/image/59006597_401.jpg,2024-10-08T08:05:00Z,,"Auch in einem so traditionsreichen Handwerk wie dem Weinbau nimmt die Automatisierung immer mehr zu. Dennoch bleibt man abhängig von den Launen der Natur, und oft muss die Weinlese weiterhin per Hand… [+17 chars]",,de,'Weinlese'
https://www.focus.de/reisen/urlaubs-check/klimafreundlich-in-den-herbst-europas-schoensten-citytrips-mit-dem-zug_id_260377255.html,https://www.focus.de/reisen/urlaubs-check/klimafreundlich-in-den-herbst-europas-schoensten-citytrips-mit-dem-zug_id_260377255.html,0,www.focus.de,Klimafreundlich in den Herbst - Europas schönste Citytrips mit dem Zug,"Bequem, umweltfreundlich und stets mit einer Prise Abenteuer: Im Herbst bieten sich Citytrips mit dem Zug an — angenehme Temperaturen, weniger Touristen, günstigere Preise. Eine nachhaltige Entdeckungsreise zu fünf Städten in Europa, die gut per Bahn zu errei…",https://p6.focus.de/img/fotos/id_260377349/gettyimages-133982988.jpg?im=Crop%3D%280%2C289%2C3463%2C1731%29%3BResize%3D%281200%2C627%29&impolicy=perceptual&quality=mediumHigh&hash=7911f79ff91e55b77ae06b1f9bbf40ad034ccbdde2151b6d15e8a006576a066b,2024-10-08T14:59:12Z,https://web.archive.org/web/20241008151034/https://www.focus.de/reisen/urlaubs-check/klimafreundlich-in-den-herbst-europas-schoensten-citytrips-mit-dem-zug_id_260377255.html,"<ul><li>
Kommentare</li><li>
E-Mail</li><li>
Teilen</li><li>
Mehr</li><li>
Twitter</li><li>
Drucken</li><li>
Feedback</li><li>
Fehler meldenSie haben einen Fehler gefunden?
Bitte markieren S… [+7647 chars]",,de,'Herbst'
https://www.stern.de/familie/phacelia-gruenduengung-im-herbst--so-erholt-sich-der-boden-nach-der-ernte-35129016.html,https://www.stern.de/familie/phacelia-gruenduengung-im-herbst--so-erholt-sich-der-boden-nach-der-ernte-35129016.html,0,www.stern.de,Natürlicher Gründünger: Nach der Ernte: Wie Sie mit Phacelia die Bodenqualität verbessern,"Egal, ob im Blumen- oder Gemüsebeet: Durch den Einsatz von Phacelia zur Gründüngung können Sie den Boden dabei unterstützen, sich auf natürliche Art und Weise zu erholen.",https://image.stern.de/34991294/t/U2/v4/w1440/r1.7778/-/phacelia-gruenduengung.jpg,2024-10-09T08:00:00Z,,"Phacelia zählt zu den Raublattgewächsen. Nicht ohne Grund wird die Pflanze auch als ""Bienenfreund"" (oder Büschelschön) bezeichnet: Ihre üppigen Blüten dienen zahlreichen Insekten im Frühjahr als wich… [+3768 chars]",,de,'Aussaat'
