index,url,valid,domain,title,description,image,published,archive,content,quote,language,keyword
https://www.kino.de/film/disneys-snow-white-2025/news/toxische-disney-fans-schneewittchen-star-aeussert-sich-zum-woke-vorwurf/,https://www.kino.de/film/disneys-snow-white-2025/news/toxische-disney-fans-schneewittchen-star-aeussert-sich-zum-woke-vorwurf/,0,www.kino.de,Toxische Disney-Fans: „Schneewittchen“-Star äußert sich zum „Woke“-Vorwurf,Die kommende „Schneewittchen“-Verfilmung von Disney steht unter keinem guten Stern. Nun äußerte sich Hauptdarstellerin Rachel Zegler zur Kontroverse.,https://crops.giga.de/93/40/47/e4c9f32eca48dbdc48ff0d176e_YyAxNzgyeDEwMDIrMzg4KzMyAnJlIDE5MjAgMTA4MAM5MGU5MmFkY2ZkNg==.jpg,2024-10-03T09:40:08Z,,"Die kommende „Schneewittchen“-Verfilmung von Disney steht unter keinem guten Stern. Nun äußerte sich Hauptdarstellerin Rachel Zegler zur Kontroverse.
Mit „Schneewittchen“ steht die nächste Live-Acti… [+4391 chars]",,de,'Schnee'
https://www.stern.de/familie/rasenpflege-im-herbst--die-wichtigsten-arbeiten-im-oktober-33813404.html,https://www.stern.de/familie/rasenpflege-im-herbst--die-wichtigsten-arbeiten-im-oktober-33813404.html,0,www.stern.de,Düngen und Mähen: Rasenpflege im Herbst: So bereiten Sie Ihre Grünflächen auf den Winter vor,"Damit Ihre Wiese Herbst und Winter problemlos übersteht, liegt auf der Rasenpflege ein besonderes Augenmerk. Welche Gartenarbeiten das Gras gesünder machen, verrät Ihnen der stern.",https://image.stern.de/33813406/t/8w/v2/w1440/r1.7778/-/rasenpflege-im-herbst.jpg,2024-10-03T10:07:00Z,https://web.archive.org/web/20241003110922/https://www.stern.de/familie/rasenpflege-im-herbst--die-wichtigsten-arbeiten-im-oktober-33813404.html,"Ob Mähen, Düngen oder Vertikutieren: Es gibt verschiedene Maßnahmen, die zu einem gesunden Rasen beitragen. Welche Gartenarbeiten im Herbst anstehen und wie Sie diese am besten umsetzen, damit Ihre G… [+4068 chars]",,de,'Winter'
https://www.zeit.de/news/2024-10/04/weinlese-geht-noch-weiter-vor-allem-beim-riesling,https://www.zeit.de/news/2024-10/04/weinlese-geht-noch-weiter-vor-allem-beim-riesling,0,www.zeit.de,Agrar: Weinlese geht noch weiter - vor allem beim Riesling,Hier finden Sie Informationen zu dem Thema „Agrar“. Lesen Sie jetzt „Weinlese geht noch weiter - vor allem beim Riesling“.,https://img.zeit.de/news/2024-10/04/weinlese-geht-noch-weiter-vor-allem-beim-riesling-image-group/wide__1300x731,2024-10-04T01:30:36Z,,"Die Weinlese in Deutschland ist vielerorts noch in vollem Gange. In einigen wenigen Weinbaugebieten wie der Pfalz oder Sachsen sei die Ernte bereits weitgehend abgeschlossen, sagte Ernst Büscher vom … [+2232 chars]",,de,'Weinlese'
https://www.stern.de/gesellschaft/regional/rheinland-pfalz-saarland/agrar--weinlese-geht-noch-weiter---vor-allem-beim-riesling-35116378.html,https://www.stern.de/gesellschaft/regional/rheinland-pfalz-saarland/agrar--weinlese-geht-noch-weiter---vor-allem-beim-riesling-35116378.html,0,www.stern.de,Agrar: Weinlese geht noch weiter - vor allem beim Riesling,Das Wetter erforderte 2023 eine Turbo-Lese in wenigen Wochen. 2024 zieht es sich länger hin. Aber die Wetterkapriolen machen den Winzern auch zu schaffen.,https://image.stern.de/35116380/t/XC/v1/w1440/r1.7778/-/04--7mbl4ialqtv8axw800h600jpeg---4b25eb1a7a905a2b.jpg,2024-10-04T01:30:36Z,https://web.archive.org/web/20241004014703/https://www.stern.de/gesellschaft/regional/rheinland-pfalz-saarland/agrar--weinlese-geht-noch-weiter---vor-allem-beim-riesling-35116378.html,"Das Wetter erforderte 2023 eine Turbo-Lese in wenigen Wochen. 2024 zieht es sich länger hin. Aber die Wetterkapriolen machen den Winzern auch zu schaffen.
Die Weinlese in Deutschland ist vielerorts … [+1488 chars]",,de,'Weinlese'
https://www.focus.de/immobilien/wohnen/gartenarbeit-warum-sie-abends-kein-laub-im-garten-entfernen-sollten_id_156405371.html,https://www.focus.de/immobilien/wohnen/gartenarbeit-warum-sie-abends-kein-laub-im-garten-entfernen-sollten_id_156405371.html,0,www.focus.de,Gartenarbeit - 5.000 Euro Bußgeld – warum Sie abends kein Laub im Garten entfernen sollten,"Das Beseitigen von Laub gehört zu den jährlichen Aufgaben im Herbst. Allerdings können dabei Bußgelder von bis zu 5.000 Euro drohen. Auf folgende Punkte müssen Sie achten, wenn Sie abends im Garten Laub entfernen möchten.",https://p6.focus.de/img/fotos/id_260365434/5.000-euro-bussgeld-warum-sie-abends-kein-laub-im-garten-entfernen-sollten-1184493165.jpg?im=Crop%3D%280%2C0%2C2121%2C1060%29%3BResize%3D%281200%2C627%29&impolicy=perceptual&quality=mediumHigh&hash=0f65add1161e6104cf0c29f30a940b3b4e670af53f90f27f5ea4f6cecd93c72a,2024-10-04T06:25:29Z,,"Das Beseitigen von Laub gehört zu den jährlichen Aufgaben im Herbst. Allerdings können dabei Bußgelder von bis zu 5.000 Euro drohen. Auf folgende Punkte müssen Sie achten, wenn Sie abends im Garten L… [+3197 chars]",,de,'Laub'
https://www.zeit.de/zeit-magazin/leben/2024-10/winterpflanzen-balkon-kaelte-gartenkolumne,https://www.zeit.de/zeit-magazin/leben/2024-10/winterpflanzen-balkon-kaelte-gartenkolumne,0,www.zeit.de,Winterpflanzen: Unverwüstliches Grün,"Die Blätter fallen, aber die Stimmung unserer Autorin bleibt oben. Warum? Sie bepflanzt auch für Herbst und Winter ihren Balkon.",https://img.zeit.de/zeit-magazin/leben/2024-10/winterpflanzen-balkon-kaelte-gartenkolumne-teaser-bild/wide__1300x731,2024-10-04T12:39:57Z,https://web.archive.org/web/20241004161114/https://www.zeit.de/zeit-magazin/leben/2024-10/winterpflanzen-balkon-kaelte-gartenkolumne,"Dieser Artikel ist Teil von ZEIT am Wochenende, Ausgabe 40/2024
Kennen Sie die Keeling-Kurve? Sie zeigt den weltweiten Anstieg klimaschädlicher Emissionen, sie wird steiler, sobald auf der Nordhalbk… [+8249 chars]",,de,'Winter'
https://www.kicker.de/ruecktritt-vom-ruecktritt-schmidt-kehrt-auf-das-feld-zurueck-1056772/artikel,https://www.kicker.de/ruecktritt-vom-ruecktritt-schmidt-kehrt-auf-das-feld-zurueck-1056772/artikel,0,www.kicker.de,Rücktritt vom Rücktritt: Schmidt kehrt auf das Feld zurück,Eigentlich hatte die ehemalige deutsche Nationalspielerin Bianca Schmidt im Sommer ihr Karriereende bekanntgegeben. Nun aber die Kehrtwende: Die 36-Jährige schnürt weiterhin die Fußballschuhe für Turbine Potsdam.,https://derivates.kicker.de/image/upload/c_crop%2Cx_0%2Cy_203%2Cw_3000%2Ch_1687/w_1200%2Cq_auto/v1/2024/10/04/00ed7a10-30f0-4022-8331-63ebe33a638d.jpeg,2024-10-04T14:20:14Z,,Eigentlich hatte die ehemalige deutsche Nationalspielerin Bianca Schmidt im Sommer ihr Karriereende bekanntgegeben. Nun aber die Kehrtwende: Die 36-Jährige schnürt weiterhin die Fußballschuhe für Tur… [+2013 chars],,de,'Sommer'
https://www.tagesspiegel.de/potsdam/landeshauptstadt/schulgebaude-am-jungfernsee-zu-spat-fertig-gymnasium-muss-in-krampnitz-eroffnet-werden-12482888.html,https://www.tagesspiegel.de/potsdam/landeshauptstadt/schulgebaude-am-jungfernsee-zu-spat-fertig-gymnasium-muss-in-krampnitz-eroffnet-werden-12482888.html,0,www.tagesspiegel.de,Schulgebäude am Jungfernsee zu spät fertig: Gymnasium muss in Krampnitz eröffnet werden,Eigentlich sollte im Sommer eine neue Schule am Campus Jungfernsee öffnen. Doch das Rathaus beerdigt diese Pläne nun kurzfristig. Das Agieren sorgt für Kritik.,https://www.tagesspiegel.de/images/12336536/alternates/BASE_16_9_W1400/1725786004000/stadt-von-morgen-tag-der-offenen-tur-in-krampnitz.jpeg,2024-10-04T14:40:25Z,http://archive.md/20241005063112/https://www.tagesspiegel.de/potsdam/landeshauptstadt/schulgebaude-am-jungfernsee-zu-spat-fertig-gymnasium-muss-in-krampnitz-eroffnet-werden-12482888.html,"Die Planungen für ein neues Gymnasium im Potsdamer Norden sind über den Haufen geworfen worden. So sollte eigentlich schon im kommenden Sommer die neue Schule öffnen, am Campus Jungfernsee. Doch dara… [+203 chars]",,de,'Sommer'
https://www.zeit.de/news/2024-10/05/bauern-feiern-landeserntedankfest-in-stralsund,https://www.zeit.de/news/2024-10/05/bauern-feiern-landeserntedankfest-in-stralsund,0,www.zeit.de,Erntedankfest: Bauern feiern Landeserntedankfest in Stralsund,Hier finden Sie Informationen zu dem Thema „Erntedankfest“. Lesen Sie jetzt „Bauern feiern Landeserntedankfest in Stralsund“.,https://img.zeit.de/news/2024-10/05/bauern-feiern-landeserntedankfest-in-stralsund-image-group/wide__1300x731,2024-10-05T01:30:36Z,,"Die Bauern Mecklenburg-Vorpommerns feiern ihr Landeserntedankfest in diesem Jahr in der Stadt. Erstmals ist Stralsund an diesem Wochenende Ausrichter der Feierlichkeiten, die am Vormittag auf dem Alt… [+682 chars]",,de,'Ernte'
https://www.stern.de/gesellschaft/regional/sachsen/weinanbau--weinlese-in-sachsen-wie-erwartet---aber-gute-traubenqualitaet-35119274.html,https://www.stern.de/gesellschaft/regional/sachsen/weinanbau--weinlese-in-sachsen-wie-erwartet---aber-gute-traubenqualitaet-35119274.html,0,www.stern.de,Weinanbau: Weinlese in Sachsen wie erwartet - aber gute Traubenqualität,Spätfröste hinterließen im sächsischen Elbtal schwere Schäden in den Weinbergen. Trotz zweiter Blüte reiften wie erwartet deutlich weniger Trauben - eine Hoffnung der Winzer aber erfüllt sich.,https://image.stern.de/35119276/t/vY/v1/w1440/r1.7778/-/05--ky7ypvcvnlv5axw800h600jpeg---5cfe002ce181d35a.jpg,2024-10-05T02:45:36Z,https://web.archive.org/web/20241005025819/https://www.stern.de/gesellschaft/regional/sachsen/weinanbau--weinlese-in-sachsen-wie-erwartet---aber-gute-traubenqualitaet-35119274.html,"Spätfröste hinterließen im sächsischen Elbtal schwere Schäden in den Weinbergen. Trotz zweiter Blüte reiften wie erwartet deutlich weniger Trauben - eine Hoffnung der Winzer aber erfüllt sich.
Nach … [+2649 chars]",,de,'Weinlese'
https://www.zeit.de/news/2024-10/05/weinlese-in-sachsen-wie-erwartet-aber-gute-traubenqualitaet,https://www.zeit.de/news/2024-10/05/weinlese-in-sachsen-wie-erwartet-aber-gute-traubenqualitaet,0,www.zeit.de,Weinanbau: Weinlese in Sachsen wie erwartet - aber gute Traubenqualität,Hier finden Sie Informationen zu dem Thema „Weinanbau“. Lesen Sie jetzt „Weinlese in Sachsen wie erwartet - aber gute Traubenqualität“.,https://img.zeit.de/news/2024-10/05/weinlese-in-sachsen-wie-erwartet-aber-gute-traubenqualitaet-image-group/wide__1300x731,2024-10-05T02:45:36Z,,"Nach fast sechs Wochen endet die Weinlese im sächsischen Elbtal. «Der Großteil der Winzer ist noch im September fertig geworden», sagte Felix Hößelbarth, Vorsitzender des Weinbauverbandes Sachsen. Wi… [+3024 chars]",,de,'Weinlese'
https://www.dw.com/de/stolz-und-dankbarkeit/a-70384375,https://www.dw.com/de/stolz-und-dankbarkeit/a-70384375,0,www.dw.com,Stolz und Dankbarkeit,"Erntedank ist das Fest, um zu schauen: Was habe ich gesät und kann stolz darauf sein? Wofür danke ich Gott? Ein Beitrag der evangelischen Kirche. Was ich selbst leiste und was ich geschenkt bekomme.

„Wenn ich heute zurückblicke, erfüllt es mich mit Stolz und…",https://static.dw.com/image/70384170_6.jpg,2024-10-05T06:49:00Z,,"Was ich selbst leiste und was ich geschenkt bekomme.
Wenn ich heute zurückblicke, erfüllt es mich mit Stolz und auch ner Menge Dankbarkeit Sagt Manuel Neuer, der Fußballtorwart, als er am 21. August… [+4261 chars]",,de,'Ernte'
https://www.stern.de/gesellschaft/regional/mecklenburg-vorpommern/agrarwirtschaft--minister--gute-getreideernte---erntedankfest-in-stralsund-35119636.html,https://www.stern.de/gesellschaft/regional/mecklenburg-vorpommern/agrarwirtschaft--minister--gute-getreideernte---erntedankfest-in-stralsund-35119636.html,0,www.stern.de,Agrarwirtschaft: Minister: Gute Getreideernte - Erntedankfest in Stralsund,"Die Felder sind leer, zum Großteil schon bestellt für das kommende Jahr. Zum Landeserntedankfest können vor allem die Pflanzenbaubetriebe in Mecklenburg-Vorpommern eine positive Bilanz ziehen.",https://image.stern.de/35119638/t/WE/v1/w1440/r1.7778/-/05--aqgwt2a3dov71axw800h600jpeg---780242b2493fe49c.jpg,2024-10-05T09:12:16Z,https://web.archive.org/web/20241005093805/https://www.stern.de/gesellschaft/regional/mecklenburg-vorpommern/agrarwirtschaft--minister--gute-getreideernte---erntedankfest-in-stralsund-35119636.html,"Die Felder sind leer, zum Großteil schon bestellt für das kommende Jahr. Zum Landeserntedankfest können vor allem die Pflanzenbaubetriebe in Mecklenburg-Vorpommern eine positive Bilanz ziehen.
Die B… [+3041 chars]",,de,'Ernte'
https://www.zeit.de/news/2024-10/05/minister-gute-getreideernte-erntedankfest-in-stralsund,https://www.zeit.de/news/2024-10/05/minister-gute-getreideernte-erntedankfest-in-stralsund,0,www.zeit.de,Agrarwirtschaft: Minister: Gute Getreideernte - Erntedankfest in Stralsund,Hier finden Sie Informationen zu dem Thema „Agrarwirtschaft“. Lesen Sie jetzt „Minister: Gute Getreideernte - Erntedankfest in Stralsund“.,https://img.zeit.de/news/2024-10/05/minister-gute-getreideernte-erntedankfest-in-stralsund-image-group/wide__1300x731,2024-10-05T09:12:16Z,,Die Bauern in Mecklenburg-Vorpommern haben nach Angaben von Landwirtschaftsminister Till Backhaus (SPD) in diesem Jahr gute Ergebnisse bei der Getreideernte erzielt. Sie können auch mit den Kartoffel… [+3526 chars],,de,'Ernte'
https://www.zeit.de/zeit-magazin/2024/42/pasta-pilze-kastanien-rezept-wochenmarkt,https://www.zeit.de/zeit-magazin/2024/42/pasta-pilze-kastanien-rezept-wochenmarkt,0,www.zeit.de,Pasta mit Pilzen und Kastanien: Kastanien zum Reinkuscheln,"Minimalismus passt nicht zum Herbst. Jetzt hat man keinen Appetit auf Tellerkunst, sondern will Essen, in das man sich reinkuscheln kann. So wie diese üppige Pasta.",https://img.zeit.de/zeit-magazin/2024/42/kastanien-zum-reinkuscheln-bild-1/wide__1300x731,2024-10-05T09:23:33Z,https://web.archive.org/web/20241004214452/https://www.zeit.de/zeit-magazin/2024/42/pasta-pilze-kastanien-rezept-wochenmarkt,"Manche halten Steinpilze für heilige Wesen, die mit Irdischem wie Wurst und Kastanien nicht in Berührung kommen dürfen. Ich sehe es anders. Ich behandle Steinpilze ein bisschen grob und schmore sie i… [+523 chars]",,de,'Laub'
https://www.nzz.ch/zuerich/dietikon-wird-besser-vor-hochwasser-geschuetzt-und-die-reppisch-zugleich-wertvoller-fuer-mensch-und-natur-ld.1851653,https://www.nzz.ch/zuerich/dietikon-wird-besser-vor-hochwasser-geschuetzt-und-die-reppisch-zugleich-wertvoller-fuer-mensch-und-natur-ld.1851653,0,www.nzz.ch,Dietikon wird besser vor Hochwasser geschützt – und die Reppisch zugleich wertvoller für Mensch und Natur,Der Zufluss zur Limmat soll in einigen Jahren ökologischer sein und seine Ufer zugänglicher.,"https://img.nzz.ch/2024/10/05/bab5cdd9-185c-4096-b6d0-1432aef970d5.jpeg?width=1200&height=675&fit=bounds&quality=75&auto=webp&crop=4032,2268,x0,y0&wmark=nzz",2024-10-05T10:56:36Z,http://archive.md/20241006214130/https://www.nzz.ch/zuerich/dietikon-wird-besser-vor-hochwasser-geschuetzt-und-die-reppisch-zugleich-wertvoller-fuer-mensch-und-natur-ld.1851653,"Die Reppisch mitten in Dietikon, ein Naturraum, aber auch ein Risiko für Überschwemmungen.
Wie rasch ein Fluss und manchmal selbst ein vermeintlich harmloser Bach bei Starkregen eine zerstörerische … [+3942 chars]",,de,'Hochwasser'
https://www.diepresse.com/18931407/online-simulation-macht-deutlich-wie-hoch-wasser-steigt-und-wo-es-zu-hitzeinseln-kommt,https://www.diepresse.com/18931407/online-simulation-macht-deutlich-wie-hoch-wasser-steigt-und-wo-es-zu-hitzeinseln-kommt,0,www.diepresse.com,"Online-Simulation macht deutlich, wie hoch Wasser steigt und wo es zu Hitzeinseln kommt","Die Auswirkungen von Hitze oder Hochwasser sind an jeder Häuserecke unterschiedlich. Ein umfassendes Onlinewerkzeug soll für alle Menschen einfach und klar darstellen, welche Gefahr an Hitzetagen droht, wie hoch eine Flut steigt und ob die Luft im Stadtvierte…",https://img.diepresse.com/public/incoming/gmf9vh-kein-Titel/alternates/DPR_SOCIAL_NACHRICHTEN/kein%20Titel,2024-10-05T11:00:00Z,https://web.archive.org/web/20241005115200/https://www.diepresse.com/18931407/online-simulation-macht-deutlich-wie-hoch-wasser-steigt-und-wo-es-zu-hitzeinseln-kommt,"Die Auswirkungen von Hitze oder Hochwasser sind an jeder Häuserecke unterschiedlich. Ein umfassendes Onlinewerkzeug soll für alle Menschen einfach und klar darstellen, welche Gefahr an Hitzetagen dro… [+3497 chars]",,de,'Hochwasser'
https://www.morgenpost.de/panorama/article407403534/erschuetternde-evakuierung-in-legendaerem-park-elefanten-sterben.html,https://www.morgenpost.de/panorama/article407403534/erschuetternde-evakuierung-in-legendaerem-park-elefanten-sterben.html,0,www.morgenpost.de,Erschütternde Szenen in legendärem Park – Elefanten sterben,Das Hochwasser im Norden Thailands steigt. Im „Elephant Nature Park“ endet eine verzweifelte Rettungsaktion für einige Elefanten tödlich.,https://img.sparknews.funkemedien.de/407403436/407403436_1728133252_v16_9_1600.jpeg,2024-10-05T13:00:48Z,https://web.archive.org/web/20241005134123/https://www.morgenpost.de/panorama/article407403534/erschuetternde-evakuierung-in-legendaerem-park-elefanten-sterben.html,"Berlin. Das Hochwasser im Norden Thailands steigt. Im Elephant Nature Park endet eine verzweifelte Rettungsaktion für einige Elefanten tödlich.
Es sind dramatische Szenen, die sich am Freitag im wel… [+3479 chars]",,de,'Hochwasser'
https://www.diepresse.com/18933438/mit-dem-oebb-chef-im-tullnerfeld-in-40-jahren-habe-ich-nichts-vergleichbares-gesehen,https://www.diepresse.com/18933438/mit-dem-oebb-chef-im-tullnerfeld-in-40-jahren-habe-ich-nichts-vergleichbares-gesehen,0,www.diepresse.com,Mit dem ÖBB-Chef im Tullnerfeld: „In 40 Jahren habe ich nichts Vergleichbares gesehen“ [premium],"Auch drei Wochen nach dem Hochwasser sind die Schäden für die ÖBB noch nicht genau zu beziffern, sagt Bahnchef Andreas Matthä bei einem Besuch im Tullnerfeld. Eigentlich solle die Bahn unauffällig im Hintergrund funktionieren, so das Motto von Matthä, der and…",https://img.diepresse.com/public/incoming/y0w04g-Bahnhof-Tullnerfeld-Tullnerfeld-train-station/alternates/DPR_SOCIAL_MAGAZIN/Bahnhof%20Tullnerfeld%20%20Tullnerfeld%20train%20station,2024-10-05T14:53:54Z,http://archive.md/20241006075655/https://www.diepresse.com/18933438/mit-dem-oebb-chef-im-tullnerfeld-in-40-jahren-habe-ich-nichts-vergleichbares-gesehen,"Auch drei Wochen nach dem Hochwasser sind die Schäden für die ÖBB noch nicht genau zu beziffern, sagt Bahnchef Andreas Matthä bei einem Besuch im Tullnerfeld. Eigentlich solle die Bahn unauffällig im… [+1284 chars]",,de,'Hochwasser'
https://www.stern.de/gesellschaft/regional/hessen/landwirtschaft--bundespraesident-steinmeier-erhaelt-erntekrone-35120450.html,https://www.stern.de/gesellschaft/regional/hessen/landwirtschaft--bundespraesident-steinmeier-erhaelt-erntekrone-35120450.html,0,www.stern.de,Landwirtschaft: Bundespräsident Steinmeier erhält Erntekrone,"Deutschlands Landwirte haben die diesjährige Ernte eingebracht. Nun kommt der erste Mann im Staat in den Taunus, um eine dort gebundene Erntekrone entgegenzunehmen. Auf wen trifft er hier?",https://image.stern.de/35120452/t/rj/v1/w1440/r1.7778/-/06--6kaoqyqem4v1axw800h600jpeg---38b2fcc40330a968.jpg,2024-10-06T01:30:35Z,https://web.archive.org/web/20241006014838/https://www.stern.de/gesellschaft/regional/hessen/landwirtschaft--bundespraesident-steinmeier-erhaelt-erntekrone-35120450.html,"Deutschlands Landwirte haben die diesjährige Ernte eingebracht. Nun kommt der erste Mann im Staat in den Taunus, um eine dort gebundene Erntekrone entgegenzunehmen. Auf wen trifft er hier?
Der Herbs… [+672 chars]",,de,'Ernte'
https://noe.orf.at/stories/3276001/,https://noe.orf.at/stories/3276001/,0,noe.orf.at,Hangrutschungen fordern weiter Einsatzkräfte,"Drei Wochen nach dem verheerenden Hochwasser in Niederösterreich sind die Bezirke St. Pölten und Tulln nach wie vor Katastrophengebiet. Die Gefahr ist laut Land großteils gebannt, doch die Folgen werden für die tausenden Betroffenen noch lange Zeit zu spüren …",https://ibs.orf.at/noe?image=https%3A%2F%2Foekastatic.orf.at%2Fmims%2F2024%2F39%2F61%2Fcrops%2Fw%3D1200%2Ch%3D627%2Cq%3D75%2F2364692_master_902561_geologen_bild.jpg%3Fs%3D3b136cd3c8e1d31b2ffce156ccbe4bae7cd268b7,2024-10-06T06:03:00Z,,Vor allem Hangrutschungen im Pielachtal beschäftigen die Einsatzkräfte noch. Die Sicherung der Hänge und die weitere Wiederherstellung der Infrastruktur in den nach wie vor als Katastrophengebiet dek… [+3429 chars],,de,'Hochwasser'
https://www.zeit.de/news/2024-10/06/regen-und-gewitter-in-hessen-erwartet,https://www.zeit.de/news/2024-10/06/regen-und-gewitter-in-hessen-erwartet,0,www.zeit.de,Wetter: Regen und Gewitter in Hessen erwartet,Hier finden Sie Informationen zu dem Thema „Wetter“. Lesen Sie jetzt „Regen und Gewitter in Hessen erwartet“.,https://img.zeit.de/news/2024-10/06/regen-und-gewitter-in-hessen-erwartet-image-group/wide__1300x731,2024-10-06T10:36:49Z,,Die neue Woche bringt vor allem Wolken und Regen nach Hessen. Dem Deutschen Wetterdienst (DWD) zufolge wird der Wochenstart bei bewölktem Himmel mit Temperaturen zwischen 16 und 19 Grad recht mild. D… [+341 chars],,de,'Gewitter'
https://www.stern.de/gesellschaft/regional/hessen/wetter--regen-und-gewitter-in-hessen-erwartet-35121058.html,https://www.stern.de/gesellschaft/regional/hessen/wetter--regen-und-gewitter-in-hessen-erwartet-35121058.html,0,www.stern.de,Wetter: Regen und Gewitter in Hessen erwartet,Offenbach (lhe) - Die neue Woche bringt vor allem Wolken und Regen nach Hessen. Dem Deutschen Wetterdienst (DWD) zufolge wird der Wochenstart bei,https://image.stern.de/35121060/t/QH/v1/w1440/r1.7778/-/06--chwlnkdoitv10axw800h600jpeg---2b7f6476ee8db804.jpg,2024-10-06T10:36:49Z,,"Die neue Woche bringt noch mal milde Temperaturen nach Hessen. Aber: Neben bewölktem Himmel ist auch mit Regen und Gewittern zu rechnen.
Die neue Woche bringt vor allem Wolken und Regen nach Hessen.… [+439 chars]",,de,'Gewitter'
https://www.stern.de/gesellschaft/regional/rheinland-pfalz-saarland/wetter--zum-wochenstart-regnerisches-wetter-35121084.html,https://www.stern.de/gesellschaft/regional/rheinland-pfalz-saarland/wetter--zum-wochenstart-regnerisches-wetter-35121084.html,0,www.stern.de,Wetter: Zum Wochenstart regnerisches Wetter,Die neue Woche bringt noch mal milde Temperaturen nach Rheinland-Pfalz und ins Saarland. Aber: Neben bewölktem Himmel ist auch mit Regen und Gewittern zu rechnen.,https://image.stern.de/35121086/t/uC/v1/w1440/r1.7778/-/06--rslsyzfissv7axw800h600jpeg---7927599a49635156.jpg,2024-10-06T10:47:46Z,,"Die neue Woche bringt noch mal milde Temperaturen nach Rheinland-Pfalz und ins Saarland. Aber: Neben bewölktem Himmel ist auch mit Regen und Gewittern zu rechnen.
Zum Wochenstart erwartet Rheinland-… [+455 chars]",,de,'Gewitter'
https://www.zeit.de/news/2024-10/06/minister-und-bischoefin-wuerdigen-arbeit-der-bauern-im-land,https://www.zeit.de/news/2024-10/06/minister-und-bischoefin-wuerdigen-arbeit-der-bauern-im-land,0,www.zeit.de,Erntedank: Minister und Bischöfin würdigen Arbeit der Bauern im Land,Hier finden Sie Informationen zu dem Thema „Erntedank“. Lesen Sie jetzt „Minister und Bischöfin würdigen Arbeit der Bauern im Land“.,https://img.zeit.de/news/2024-10/06/minister-und-bischoefin-wuerdigen-arbeit-der-bauern-im-land-image-group/wide__1300x731,2024-10-06T11:10:01Z,,Anlässlich des Landeserntedankfestes in Haddeby (Kreis Schleswig-Flensburg) hat Landwirtschaftsminister Werner Schwarz den Landwirtinnen und Landwirten für ihren Einsatz gedankt. «Das Erntedankfest e… [+2832 chars],,de,'Ernte'
https://www.zeit.de/news/2024-10/06/brandenburg-wuerdigt-bauern-erntedank-in-nauen,https://www.zeit.de/news/2024-10/06/brandenburg-wuerdigt-bauern-erntedank-in-nauen,0,www.zeit.de,Landeserntedankfest: Brandenburg würdigt Bauern - Erntedank in Nauen,Hier finden Sie Informationen zu dem Thema „Landeserntedankfest“. Lesen Sie jetzt „Brandenburg würdigt Bauern - Erntedank in Nauen“.,https://img.zeit.de/news/2024-10/06/brandenburg-wuerdigt-bauern-erntedank-in-nauen-image-group/wide__1300x731,2024-10-06T11:14:17Z,,"Mit einem Landeserntedankfest hat Brandenburg die Arbeit der Landwirtinnen und Landwirte gewürdigt. Landtagspräsidentin Ulrike Liedtke warb beim Gottesdienst in der St. Jacobi-Kirche in Nauen dafür, … [+789 chars]",,de,'Ernte'
https://www.tagesspiegel.de/berlin/landeserntedankfest-brandenburg-wurdigt-bauern-erntedank-in-nauen-12488753.html,https://www.tagesspiegel.de/berlin/landeserntedankfest-brandenburg-wurdigt-bauern-erntedank-in-nauen-12488753.html,0,www.tagesspiegel.de,Landeserntedankfest: Brandenburg würdigt Bauern - Erntedank in Nauen,Die Landwirtinnen und Landwirte sichern die Versorgung mit frischen Lebensmitteln. Ihre Arbeit ist in diesem Jahr angesichts vieler Proteste wieder in den Fokus gerückt - auch zum Erntedankfest.,https://www.tagesspiegel.de/images/12488750/alternates/BASE_16_9_W1400/1728213336000/erntekronen.jpeg,2024-10-06T11:15:36Z,https://web.archive.org/web/20241007010929/https://www.tagesspiegel.de/berlin/landeserntedankfest-brandenburg-wurdigt-bauern-erntedank-in-nauen-12488753.html,"Mit einem Landeserntedankfest hat Brandenburg die Arbeit der Landwirtinnen und Landwirte gewürdigt. Landtagspräsidentin Ulrike Liedtke warb beim Gottesdienst in der St. Jacobi-Kirche in Nauen dafür, … [+839 chars]",,de,'Ernte'
