index,published,keyword,domain,language,valid,title,description,url,image,archive,content,quote
31cb9f742147c169c8e3d50f1fd2d0e5,2025-10-20T18:20:00Z,'Frost',wirres.net,de,0.0,morgenspaziergang 20.10.2025,"am abend ge­pos­tet.am mor­gen wars sehr frisch, es gab of­fen­bar ers­ten frost. 
 
 
 
 
 
am plöt­zen­see sind sie fer­tig mit der „ver­bes­se­rung“ der zaun­an­la­ge (glei­cher taun, aber et­was hö­her). am see­en­de, von dem aus ich fo­to­gra­fiert habe,…",https://wirres.net/articles/moregnspaziergang-20-10-2025,https://wirres.net/media/pages/articles/moregnspaziergang-20-10-2025/f0c0e478ff-1760983819/img_4646-1200x630-crop.jpg,,"am abend ge­pos­tet.
am mor­gen wars sehr frisch, es gab of­fen­bar ers­ten frost.
am plöt­zen­see sind sie fer­tig mit der ver­bes­se­rung der zaun­an­la­ge (glei­cher taun, aber et­was hö­her). a… [+587 chars]",
7fe720b26ebd678d4ca25bb82633dbe3,2025-10-22T02:00:30Z,'Schnee',www.stern.de,de,0.0,Wintersport: Feldberg plant Saisonstart Ende November,Todtnau (lsw) - Das große Skigebiet Feldberg im Hochschwarzwald will am 29. November die Wintersportsaison einläuten - falls der Schnee auf den Pisten,https://www.stern.de/gesellschaft/regional/baden-wuerttemberg/wintersport--feldberg-plant-saisonstart-ende-november-36151158.html,https://image.stern.de/36151160/t/9i/v1/w1440/r1.7778/-/22--nl37p3pq64v8axs2048jpeg---391bca0658d0eacd.jpg,,"Kopiere den aktuellen Link
Zur Merkliste hinzufügen
Das Skigebiet Feldberg im Schwarzwald bereitet sich für die Wintersportsaison vor. Einen Starttermin gibt es auch schon. Liegt dann genug Schnee?… [+2040 chars]",
fb3fa9eb932cf7437c59497142a6acbe,2025-10-22T05:50:53Z,'Schnee',www.zeit.de,de,0.0,Vorhersage: Herbstwetter mit Wolken und Regen - Schnee in den Hochlagen,Hier finden Sie Informationen zu dem Thema „Vorhersage“. Lesen Sie jetzt „Herbstwetter mit Wolken und Regen - Schnee in den Hochlagen“.,https://www.zeit.de/news/2025-10/22/herbstwetter-mit-wolken-und-regen-schnee-in-den-hochlagen,https://img.zeit.de/news/2025-10/22/herbstwetter-mit-wolken-und-regen-schnee-in-den-hochlagen-image-group/wide__1300x731,,"Der goldene Herbst bleibt in Bayern in den nächsten Tagen aus, stattdessen wird es stürmisch. Laut dem Deutschen Wetterdienst (DWD) bringen atlantische Tiefdruckgebiete zunächst milde, aber feuchte L… [+781 chars]",
1cffce84865d562b0e96bcd0dc3a9852,2025-10-22T09:29:22Z,'Kaltfront',www.diepresse.com,de,0.0,"Kaltfront bringt kräftige Schauer, stürmischen Wind und teilweise Schnee",Am Donnerstag zieht eine Kaltfront vom Westen her über Österreich. Auf einigen Pässen ist mit Schneefall zu rechnen.,https://www.diepresse.com/20229966/kaltfront-bringt-kraeftige-schauer-stuermischen-wind-und-teilweise,https://img.diepresse.com/public/incoming/ih0f85-imago-images-0837785790/alternates/DPR_SOCIAL_NACHRICHTEN/imago%20images%200837785790,,"Am Donnerstag zieht eine Kaltfront vom Westen her über Österreich. Auf einigen Pässen ist mit Schneefall zu rechnen.
Eine Kaltfront zieht am Donnerstag ab dem frühen Nachmittag vom Westen her durch … [+1630 chars]",
4dac4af2d875f631ccf4f1aea62c183a,2025-10-22T10:07:00Z,'Skigebiete',www.urlaubspiraten.de,de,0.0,Das kostet euch der Skipass in den beliebtesten Skigebieten ⛷️,"Auch in diesem Jahr steigen die Preise für Liftkarten in den österreichischen Skigebieten. Um nicht den Überblick zu verlieren, haben wir die Preise der beliebtesten Skigebiete für euch zusammengefasst - und geben Tipps, wir ihr vielleicht noch den ein oder a…",https://www.urlaubspiraten.de/reise-journal/skipass-preise-beliebteste-skigebiete,https://image.urlaubspiraten.de/720/image/upload/v1671103420/Impressions%20and%20Other%20Assets/shutterstock_2097414745_bkhfvr.jpg,,"KitzSki Kitzbühel/Kirchberg
Im Skigebiet KitzSki gibt es 3 verschiedene Preisstufen - je nachdem, wann ihr Ski fahren wollt. Am günstigsten ist es in der Sparsaison (bis 6.12. und ab 7.4.), gefolgt … [+2268 chars]",
b6ccdee203939ba79a56a268b0312c92,2025-10-22T12:06:20Z,'Glatteis',www.stern.de,de,0.1,Dunkelheit und Witterung: Von Ranzen bis Reifen - Darauf kommt es jetzt im Verkehr an,"Mit der Zeitumstellung wird es früher dunkel, zudem rückt der Winter näher. Was sollten Auto-, Fahrradfahrer und Fußgänger jetzt im Verkehr beachten?",https://www.stern.de/gesellschaft/regional/sachsen-anhalt/dunkelheit-und-witterung--von-ranzen-bis-reifen---darauf-kommt-es-jetzt-im-verkehr-an-36152880.html,https://image.stern.de/36152882/t/Ib/v1/w1440/r1.7778/-/22--6mswigluv2v7axs2048jpeg---ec2d6af3bb96b51f.jpg,,"Kopiere den aktuellen Link
Zur Merkliste hinzufügen
Mit der Zeitumstellung wird es früher dunkel, zudem rückt der Winter näher. Was sollten Auto-, Fahrradfahrer und Fußgänger jetzt im Verkehr beach… [+1046 chars]",
9f901831011ff65c115f66755544946c,2025-10-22T16:43:15Z,'Skigebiete',kaernten.orf.at,de,0.0,Skisaison startet Anfang Dezember,"In sechs Wochen, am 5. Dezember, wollen zumindest die größeren Kärntner Skigebiete die Wintersaison eröffnen. 55 Millionen Euro wurden in neue Lifte und Schneemaschinen investiert, hieß es von den Seilbahnbetreibern. Das schlägt sich auch in höheren Preisen f…",https://kaernten.orf.at/stories/3326919/,https://ibs.orf.at/ktn?image=https%3A%2F%2Foekastatic.orf.at%2Fmims%2F2025%2F43%2F42%2Fcrops%2Fw%3D1200%2Ch%3D627%2Cq%3D75%2F2808991_master_1084042_kh_seilbahnen_vor_saisonstart_insert_251022_00_01_11_10.jpg%3Fs%3D7b1c657b1f45796a0f25abb1d847a919d92bed97,,"69,50 Euro kostet eine Tageskarte für Erwachsene in dieser Saison in den größeren Skigebieten wie auf dem Nassfeld, dem Katschberg und auf der Gerlitzen. Der Skitag auf der Hochrindl kostet 52 Euro, … [+1851 chars]",
b08fb5dd7c9cd313408ceb8db183f842,2025-10-23T02:00:45Z,'Skigebiete',www.stern.de,de,0.0,Wintersport: Saisonstart im Blick: Was bieten Skiregionen ihren Gästen?,Wann fällt der erste Schnee – und wo lohnt sich der Ausflug auf die Piste wirklich? Der Feldberg peilt Ende November den Saisonstart an - im Allgäu sollen Anfang Dezember die Lifte laufen.,https://www.stern.de/gesellschaft/regional/baden-wuerttemberg/wintersport--saisonstart-im-blick--was-bieten-skiregionen-ihren-gaesten--36154290.html,https://image.stern.de/36154292/t/-H/v1/w1440/r1.7778/-/23--qyuf57bgpzv7axs2048jpeg---dd77a843ed8a35e2.jpg,,"Kopiere den aktuellen Link
Zur Merkliste hinzufügen
Wann fällt der erste Schnee und wo lohnt sich der Ausflug auf die Piste wirklich? Der Feldberg peilt Ende November den Saisonstart an - im Allgäu… [+4274 chars]",
1ab9657a790903628b04777b0ec0fd91,2025-10-23T04:03:09Z,'Schnee',www.zeit.de,de,1.0,Wetter: Sturm und Schnee im Anmarsch – Kaltfront trifft Südwesten,Hier finden Sie Informationen zu dem Thema „Wetter“. Lesen Sie jetzt „Sturm und Schnee im Anmarsch – Kaltfront trifft Südwesten“.,https://www.zeit.de/news/2025-10/23/sturm-und-schnee-im-anmarsch-kaltfront-trifft-suedwesten,https://img.zeit.de/news/2025-10/23/sturm-und-schnee-im-anmarsch-kaltfront-trifft-suedwesten-image-group/wide__1300x731,,"Baden-Württemberg steht ein ungemütlicher Wetterumschwung bevor. Der Deutsche Wetterdienst (DWD) rechnet im Südwesten mit schweren Sturmböen und teils kräftigem Regen. Wer draußen unterwegs ist, soll… [+1381 chars]",
eaf8d3da88c644c58785de4d4f3e2dfd,2025-10-23T04:36:43Z,'Schnee',www.zeit.de,de,0.0,"Wetterausblick: Sturm, Regen, Schnee – Bayern erwartet ungemütliche Tage","Hier finden Sie Informationen zu dem Thema „Wetterausblick“. Lesen Sie jetzt „Sturm, Regen, Schnee – Bayern erwartet ungemütliche Tage“.",https://www.zeit.de/news/2025-10/23/sturm-regen-schnee-bayern-erwartet-ungemuetliche-tage,https://img.zeit.de/news/2025-10/23/sturm-regen-schnee-bayern-erwartet-ungemuetliche-tage-image-group/wide__1300x731,,"Wer in Bayern in den kommenden Tagen draußen unterwegs ist, sollte sich auf nasses Herbstwetter einstellen und den Regenschirm besser gut festhalten. Der Deutsche Wetterdienst (DWD) sagt eine regneri… [+1717 chars]",
39f2e84dcc62e68285cbe7583fa3c386,2025-10-23T04:36:43Z,'Kaltfront',www.stern.de,de,1.0,"Wetterausblick: Sturm, Regen, Schnee – Bayern erwartet ungemütliche Tage","Der Wetterdienst rechnet mit unbeständigem Wetter in Bayern – besonders in den Bergen. Wer draußen unterwegs ist, sollte gewappnet sein. Wo Schneeflocken fallen können.",https://www.stern.de/gesellschaft/regional/bayern/wetterausblick--sturm--regen--schnee---bayern-erwartet-ungemuetliche-tage-36154476.html,https://image.stern.de/36154478/t/OG/v1/w1440/r1.7778/-/23--ufbfm2p7wdv3axs2048jpeg---35bca40b8bca3ce3.jpg,,"Kopiere den aktuellen Link
Zur Merkliste hinzufügen
Der Wetterdienst rechnet mit unbeständigem Wetter in Bayern besonders in den Bergen. Wer draußen unterwegs ist, sollte gewappnet sein. Wo Schneef… [+1899 chars]",
6631ab98d88ef68e96cf526432ad8646,2025-10-23T06:38:30Z,'Schnee',www.stern.de,de,1.0,Wetterausblick: Sturm und Schnee im Südwesten im Anmarsch – Unwetterwarnung,"Sturmböen, Regen und ein paar Schneeflocken: Im Südwesten sorgt eine Kaltfront für ungemütliches Wetter. Was der Deutsche Wetterdienst für die nächsten Tage prognostiziert.",https://www.stern.de/gesellschaft/regional/baden-wuerttemberg/wetterausblick--sturm-und-schnee-im-suedwesten-im-anmarsch---unwetterwarnung-36154426.html,https://image.stern.de/36154428/t/F5/v2/w1440/r1.7778/-/23--d4vwwlfkzvv7axs2048jpeg---aa7effa335acba7b.jpg,,"Kopiere den aktuellen Link
Zur Merkliste hinzufügen
Sturmböen, Regen und ein paar Schneeflocken: Im Südwesten sorgt eine Kaltfront für ungemütliches Wetter. Was der Deutsche Wetterdienst für die nä… [+2297 chars]",
fce9924a306a2391190aee5854b8bca1,2025-10-23T07:04:14Z,'Schnee',www.sueddeutsche.de,de,1.0,Wetter in Bayern: Erst kommt der Sturm – und dann der Schnee,Eine Kaltfront bringt stürmisches Wetter mit orkanartigen Böen nach Bayern. Danach wird es kalt. In den Bergen kann es runterflocken. Im Allgäu sind sogar bis zu 20 Zentimeter Schnee möglich.,https://www.sueddeutsche.de/bayern/wetter-bayern-sturm-orkan-schnee-li.3329350,https://www.sueddeutsche.de/2024/03/30/917e9fc5-03d6-4194-a74f-1214fd2dc472.jpeg?q=60&fm=webp&width=1200&rect=0%2C21%2C1526%2C858,,"Am Donnerstag bringt eine markante Kaltfront nicht nur teils ergiebigen Regen, sondern auch kräftigen Wind. Auf den Alpengipfeln sind den Meteorologinnen und Meteorologen zufolge schwere Sturm- bis o… [+1592 chars]",
e21debd449c051ad0b7ac509a67fd886,2025-10-23T11:18:35Z,'Schnee',www.stern.de,de,0.0,Unwetter: Orkan auf dem Feldberg - Schneefallgrenze sinkt,Unwetterwarnung im Südwesten: Der DWD misst extreme Orkanböen auf dem Feldberg. Die Polizei rückt währenddessen etliche Male aus. Wo es noch gestürmt hat und wie viel Schnee der Wetterdienst erwartet.,https://www.stern.de/gesellschaft/regional/baden-wuerttemberg/unwetter--orkan-auf-dem-feldberg---schneefallgrenze-sinkt-36155870.html,https://image.stern.de/36155872/t/cx/v1/w1440/r1.7778/-/23--oj3cw3ipp4v7axs2048jpeg---8c94952ca0db9df9.jpg,,"Kopiere den aktuellen Link
Zur Merkliste hinzufügen
Unwetterwarnung im Südwesten: Der DWD misst extreme Orkanböen auf dem Feldberg. Die Polizei rückt währenddessen etliche Male aus. Wo es noch gest… [+1530 chars]",
b0895147a5438b60d292fbd0cb92ff28,2025-10-23T11:18:35Z,'Schneefall',www.zeit.de,de,0.0,Unwetter: Orkan auf dem Feldberg - Schneefallgrenze sinkt,Hier finden Sie Informationen zu dem Thema „Unwetter“. Lesen Sie jetzt „Orkan auf dem Feldberg - Schneefallgrenze sinkt“.,https://www.zeit.de/news/2025-10/23/orkan-auf-dem-feldberg-schneefallgrenze-sinkt,https://img.zeit.de/news/2025-10/23/orkan-auf-dem-feldberg-schneefallgrenze-sinkt-image-group/wide__1300x731,,Es stürmt in Baden-Württemberg: Auf dem Feldberg hat der Deutsche Wetterdienst sogar extreme Orkanböen gemessen. Mit 157 Kilometern pro Stunde fegte der Wind über den höchsten Gipfel des Schwarzwalde… [+1314 chars],
8df21c010e10de6ef658dc9021d14843,2025-10-23T14:28:45Z,'Schnee',www.welt.de,de,0.0,Sturmtief „Joshua“ fegt über Deutschland – In diesen Regionen gelten Unwetterwarnungen,"Mit Orkanböen, Starkregen und Gewittern bringt „Joshua“ ungemütliches Herbstwetter. Der Deutsche Wetterdienst warnt vor umstürzenden Bäumen und Verkehrschaos – am Wochenende droht sogar Schnee.",https://www.welt.de/vermischtes/article68fa2b3559e2e0975070971f/wetter-sturmtief-joshua-fegt-ueber-deutschland-in-diesen-regionen-gelten-unwetterwarnungen.html,https://images.welt.de/68fa2b3559e2e0975070971f/e808c0fe2639cb45d4e3252482097ad4-master/ci16x9-w1200/dpa-com-20090101-251023-911-014888-jpg,,"Mit Orkanböen, Starkregen und Gewittern bringt Joshua ungemütliches Herbstwetter. Der Deutsche Wetterdienst warnt vor umstürzenden Bäumen und Verkehrschaos am Wochenende droht sogar Schnee.Sturm, Reg… [+3876 chars]",
c1b535662783f391317c6a60d0287220,2025-10-24T04:11:27Z,'Schnee',www.zeit.de,de,0.0,Wettervorhersage: Windig nasses Wetter im Südwesten - Schnee in Aussicht,Hier finden Sie Informationen zu dem Thema „Wettervorhersage“. Lesen Sie jetzt „Windig nasses Wetter im Südwesten - Schnee in Aussicht“.,https://www.zeit.de/news/2025-10/24/windig-nasses-wetter-im-suedwesten-schnee-in-aussicht,https://img.zeit.de/news/2025-10/24/windig-nasses-wetter-im-suedwesten-schnee-in-aussicht-image-group/wide__1300x731,,"Das stürmisch-nasse Wetter lässt im Südwesten vorerst nicht nach. Der Vorhersage des Deutschen Wetterdiensts (DWD) zufolge lohnt es sich, die dickeren Jacken hervorzuholen: Eine Kaltfront sorgt heute… [+1263 chars]",
bd2b78552ad183219f67151002ca2d87,2025-10-24T04:11:27Z,'Schnee',www.stern.de,de,0.0,Wettervorhersage: Windig nasses Wetter im Südwesten - Schnee in Aussicht,Kalte Front im Anmarsch: Im Südwesten bleibt es ungemütlich. Der Deutsche Wetterdienst sagt in höheren Lagen Schnee voraus. Welche Temperaturen werden erwartet?,https://www.stern.de/gesellschaft/regional/baden-wuerttemberg/wettervorhersage--windig-nasses-wetter-im-suedwesten---schnee-in-aussicht-36157962.html,https://image.stern.de/36157964/t/MO/v1/w1440/r1.7778/-/24--4k5ezdjrggv5axs2048jpeg---9e1640720762bcc0.jpg,,"Kopiere den aktuellen Link
Zur Merkliste hinzufügen
Kalte Front im Anmarsch: Im Südwesten bleibt es ungemütlich. Der Deutsche Wetterdienst sagt in höheren Lagen Schnee voraus. Welche Temperaturen w… [+1439 chars]",
9313f7dc14736b88a1651e00e7c9f228,2025-10-24T05:05:00Z,'Glatteis',www.stern.de,de,0.0,Glatteis: Streusalz-Alternativen: Diese Materialien sind für den privaten Gebrauch erlaubt,"Auf Straßen und Gehwegen, in der Einfahrt oder vor der Haustür ist es unerlässlich, die Rutschgefahr durch Glatteis mit Streugut zu reduzieren. Aber bitte nicht mit Salz.",https://www.stern.de/familie/streusalz-alternativen--dieses-streugut-ist-fuer-den-privaten-gebrauch-erlaubt-34377516.html,https://image.stern.de/35143494/t/FZ/v2/w1440/r1.7778/-/herbstbild.jpg,,"Kopiere den aktuellen Link
Zur Merkliste hinzufügen
Auf Straßen und Gehwegen, in der Einfahrt oder vor der Haustür ist es unerlässlich, die Rutschgefahr durch Glatteis mit Streugut zu reduzieren. A… [+4301 chars]",
8d07836a38c1d8008e2a32417b002d4b,2025-10-24T05:28:37Z,'Schnee',www.zeit.de,de,1.0,Vorhersage: Stürmisch und nass am Wochenende – teils fällt auch Schnee,Hier finden Sie Informationen zu dem Thema „Vorhersage“. Lesen Sie jetzt „Stürmisch und nass am Wochenende – teils fällt auch Schnee“.,https://www.zeit.de/news/2025-10/24/stuermisch-und-nass-am-wochenende-teils-faellt-auch-schnee,https://img.zeit.de/news/2025-10/24/stuermisch-und-nass-am-wochenende-teils-faellt-auch-schnee-image-group/wide__1300x731,http://web.archive.org/web/20251109104648/https://www.zeit.de/news/2025-10/24/stuermisch-und-nass-am-wochenende-teils-faellt-auch-schnee,"Der Wind und der Regen haben das Wetter in Bayern fest im Griff. Oberhalb von 1.000 Metern soll laut Deutschem Wetterdienst (DWD) auch Schnee fallen. Wer unterwegs ist, sollte seinen Regenschirm gut … [+1022 chars]",
4b1b76d3a7f66db6462215c4718d226b,2025-10-24T06:23:00Z,'Skigebiete',www.nzz.ch,de,0.0,DOK-FILM «NZZ FORMAT» - Schweizer Berge zum Verkauf – unser Dok-Film über Skiorte und ihre Abhängigkeit von internationalen Investoren,"Der amerikanische Skigebietsbetreiber Vail Resorts hat die Skigebiete Andermatt-Sedrun und Crans-Montana gekauft. Internationale Investoren haben weitere Schweizer Skiregionen im Blick. «NZZ Format» geht der Frage nach, wie solche Geschäfte Schweizer Skiorte …",https://www.nzz.ch/schweiz/schweizer-skigebiete-zum-verkauf-wie-vail-resorts-co-die-orte-veraendern-ld.1867172,"https://img.nzz.ch/2025/01/21/33f7d93e-2230-4820-9f69-0a1cd7526fd6.jpeg?width=1200&height=675&fit=bounds&quality=75&auto=webp&crop=1920,1080,x0,y0&wmark=nzz",,Der amerikanische Skigebietsbetreiber Vail Resorts hat die Skigebiete Andermatt-Sedrun und Crans-Montana gekauft. Internationale Investoren haben weitere Schweizer Skiregionen im Blick. «NZZ Format» … [+1517 chars],
85a977cc9a257585d3d5db564ca445b8,2025-10-24T07:00:00Z,'Glatteis',www.telepolis.de,de,0.1,Das dreifache Verschwinden des Josef Mengele,"Anatomie eines menschlichen Monsters: Kirill Serebrennikovs Film ""Das Verschwinden des Josef Mengele"" ist ein Werk von verstörender Brillanz.",https://www.telepolis.de/features/Das-dreifache-Verschwinden-des-Josef-Mengele-10845810.html,https://heise.cloudimg.io/bound/1200x1200/q85.png-lossy-85.webp-lossy-85.foil1/_www-heise-de_/imgs/18/4/9/6/2/8/9/1/79887_1-4d1fe935b36543ee.jpeg,,"Copyright Lupa Film, CG Cinema, Hype Studios
Anatomie eines menschlichen Monsters: Kirill Serebrennikovs Film ""Das Verschwinden des Josef Mengele"" ist ein Werk von verstörender Brillanz.
Ein besond… [+11297 chars]",
818c14595c04ace49fe02c456ba44fa8,2025-10-24T08:37:49Z,'Bodenfrost',www.stern.de,de,0.0,Vorhersage: Das Wochenende wird stürmisch und nass – teils fällt Schnee,München (lby) - Wind und Regen haben Bayern fest im Griff. Oberhalb von 1.000 Metern kann laut Deutschem Wetterdienst (DWD) auch Schnee fallen. Wer,https://www.stern.de/gesellschaft/regional/bayern/vorhersage--das-wochenende-wird-stuermisch-und-nass---teils-faellt-schnee-36158066.html,https://image.stern.de/36158666/t/oO/v1/w1440/r1.7778/-/24--6vgdprd5p4v3axs2048jpeg---bb9455640c9eb9d7.jpg,,"Kopiere den aktuellen Link
Zur Merkliste hinzufügen
Regen und Wind in Bayern halten an. An den Alpen und im Bayerischen Wald kann der Niederschlag auch in Weiß herabkommen.
Wind und Regen haben Ba… [+1379 chars]",
80bae224ac12a99aa1d850120ef5e612,2025-10-24T11:06:38Z,'Schnee',www.stern.de,de,0.0,Wetter: Schnee auf dem Fichtelberg in Sachsen,"Fichtelberg (sn) -Auf dem Fichtelberg bei Oberwiesenthal im Erzgebirgskreis hat es geschneit. Wie der Deutsche Wetterdienst mitteilte, fiel in der Nacht",https://www.stern.de/gesellschaft/regional/sachsen/wetter--schnee-auf-dem-fichtelberg-in-sachsen-36159410.html,https://image.stern.de/36159412/t/Vv/v1/w1440/r1.7778/-/24--ho62wsfl6cv6axs2048jpeg---716c07be038a6c30.jpg,,"Kopiere den aktuellen Link
Zur Merkliste hinzufügen
Der Fichtelberg im Erzgebirge erlebt im Oktober einen frühen Wintereinbruch: Auf dem Gipfel kommt es zu Schnee und heftigen Windböen.
Fichtelber… [+696 chars]",
b66582e30865e2aa9b45e24e5da4f20e,2025-10-24T12:53:17Z,'Glatteis',www.stern.de,de,0.0,Schulen: Distanzunterricht bei Sturm und Glatteis? Land plant Reform,In der Corona-Zeit war der Distanzunterricht phasenweise Alltag für viele Schülerinnen und Schüler. In bestimmten Situationen könnte das digitale Lernen von zu Hause aus bald wiederkehren.,https://www.stern.de/gesellschaft/regional/niedersachsen-bremen/schulen--distanzunterricht-bei-sturm-und-glatteis--land-plant-reform-36159870.html,https://image.stern.de/36159872/t/BK/v1/w1440/r1.7778/-/24--w6evklqdipv5axs2048jpeg---266d3d800d927242.jpg,,"Kopiere den aktuellen Link
Zur Merkliste hinzufügen
In der Corona-Zeit war der Distanzunterricht phasenweise Alltag für viele Schülerinnen und Schüler. In bestimmten Situationen könnte das digitale… [+1833 chars]",
4d215ac5fd7abdd207aea32824143cba,2025-10-24T12:53:17Z,'Glatteis',www.zeit.de,de,0.0,Schulen: Distanzunterricht bei Sturm und Glatteis? Land plant Reform,Hier finden Sie Informationen zu dem Thema „Schulen“. Lesen Sie jetzt „Distanzunterricht bei Sturm und Glatteis? Land plant Reform“.,https://www.zeit.de/news/2025-10/24/distanzunterricht-bei-sturm-und-glatteis-land-plant-reform,https://img.zeit.de/news/2025-10/24/distanzunterricht-bei-sturm-und-glatteis-land-plant-reform-image-group/wide__1300x731,,"Bei extremem Sturm, Glatteis oder Hitze sollen Niedersachsens Schulen künftig in den Distanzunterricht wechseln können. Das plant die rot-grüne Landesregierung im Zuge einer Reform des Schulgesetzes.… [+1629 chars]",
9176fa464a693291e91c084246552997,2025-10-25T05:25:06Z,'Frost',www.spektrum.de,de,0.0,Weltraumspiegel,"Könnte ein riesiger Spiegel im Weltall Frost fernhalten, die Ernten retten und dort Wärme spenden, wo sie gebraucht wird? ️",https://www.spektrum.de/podcast/sternengeschichten-weltraumspiegel/2292973,https://static.spektrum.de/fm/912/f1920x1080/GettyImages-182759596.jpg,,"Aber stellen wir uns mal vor, wir würden das machen wollen (und keine Sorge, ich erkläre dann später noch, warum wir das nicht wollen sollten): Wie lange würde es wirklich dauern, bis wir so einen So… [+4139 chars]",
71cf0b16509ca2b84b4228d2589019eb,2025-10-25T07:00:04Z,'Skigebiete',www.diepresse.com,de,0.0,Österreichs Rennen um die Winter-Vorherrschaft [premium],"Rund um den Weltcupauftakt in Sölden zeigt sich, wie das Land um seine Skikultur kämpft. Doch der Slalom in die schneearme und sportlich düstere Zukunft kann noch immer gemeistert werden.",https://www.diepresse.com/20228330/oesterreichs-rennen-um-die-winter-vorherrschaft,https://img.diepresse.com/public/incoming/gpq8k1-kein-Titel/alternates/DPR_SOCIAL_MAGAZIN/kein%20Titel,,"Sölden. In der Skybar des Hotels The Secret lassen sich die Sölden-Veranstalter feiern. Sie haben ihr Testimonial, den brasilianisch-norwegischen Skistar Lucas Braathen, vor die Mikrofone gebeten, da… [+5061 chars]",
adc0c0ae6d5349d123e4eabfd5eb90a8,2025-10-25T08:53:38Z,'Schnee',www.bild.de,de,0.0,"Tief „Joshua“ pustet Deutschland durch - Hier stürmt es, hier schneit es",Sturmtief Joshua bringt Wind und Schnee nach Deutschland. Die Sturmwarnung an Nord- und Ostsee bleibt bis Sonntag bestehen.,https://www.bild.de/news/wetter/tief-joshua-und-das-wochenend-wetter-hier-stuermt-es-hier-schneit-es-68fb830e4b3870d4e74df04b,"https://images.bild.de/68fb830e4b3870d4e74df04b/4f466b27afc45f0d00410604a00a1442,656973dd?w=1280",,"Goslar Wehe, wehe, wenn ich das Gewehe sehe! Der Sturm lässt Deutschland nicht los: Tief Joshua wirbelt weiter und am Samstag droht es vor allem im Harz erneut schwer zu rummsen. Der Deutsche Wetterd… [+1128 chars]",
1da79626e6f9ef0c1f091e4c94d39e82,2025-10-25T14:29:09Z,'Skigebiete',www.bild.de,de,0.0,"Oh, wie ist das SCHNEE! - Österreichs Skigebiete jubeln",Sölden (Österreich) – Mit Start der Ski-Saison präsentieren sich Teile von Österreich in einem herrlich weißen Wintertraum.,https://www.bild.de/news/wetter/oh-wie-ist-das-schnee-oesterreichs-skigebiete-jubeln-68fc76a321e3eb60b6414978,"https://images.bild.de/68fc76a321e3eb60b6414978/9a0af58707dda354b058716d49126abe,2724b917?w=1280",,Sölden (Österreich) Wie bestellt und pünktlich abgeholt: Mit Start der Ski-Saison präsentieren sich Teile von Österreich in einem weißen Winterkleid. Erst konnte über die perfekt getimte Schneepracht… [+2136 chars],
c936218abb2199bca47c599bd9bba1a0,2025-10-26T09:12:05Z,'Eisregen',snipz.de,de,0.0,"ARKOCHIC 10M LED Lichterkette Eisregen für 11,99€","Holt euch jetzt die festliche Beleuchtung mit der ARKOCHIC 10M Lichterkette Eisregen. Bei Amazon gibt es die ARKOCHIC 10M Lichterkette Eisregen für nur 11,99€ inkl. Prime-Versand. Gibt den Gutscheincode BUQEP92D in der Zahlungsabwicklung an. Aktiviert zusätzl…",https://snipz.de/2025/arkochic-10m-led-lichterkette-eisregen/,https://gadgetwelt.de/wp-content/uploads/2025/10/b0dthp24c1-1.jpg,,"Holt euch jetzt die festliche Beleuchtung mit der ARKOCHIC 10M Lichterkette Eisregen. Bei Amazon gibt es die ARKOCHIC 10M Lichterkette Eisregen für nur 11,99 inkl. Prime-Versand.
Gibt den Gutscheinc… [+870 chars]",
60ba4f45e103485b7c33ebffac46f830,2025-10-26T09:49:13Z,'Schnee',www.stern.de,de,0.0,"Wetter in Bayern: Schnee, Sturm, Sonne: Bayern erlebt wechselhaftes Wetter","Zuerst fallen Schneeflocken und Regen, dann wechselt sich die Sonne mit den Wolken ab. Nach bis zu zehn Zentimeter Neuschnee kommt zum Wochenstart die Sonne raus und heizt den Freistaat auf.",https://www.stern.de/gesellschaft/regional/bayern/wetter-in-bayern--schnee--sturm--sonne--bayern-erlebt-wechselhaftes-wetter-36162738.html,https://image.stern.de/36162740/t/AI/v1/w1440/r1.7778/-/26--n7yq5xsxufv3axs2048jpeg---8562a702a1d4614e.jpg,,"Kopiere den aktuellen Link
Zur Merkliste hinzufügen
Zuerst fallen Schneeflocken und Regen, dann wechselt sich die Sonne mit den Wolken ab. Nach bis zu zehn Zentimeter Neuschnee kommt zum Wochenstar… [+2287 chars]",
1425381865413027890a8586d14f6199,2025-10-26T11:25:27Z,'Schnee',www.stern.de,de,0.0,Wetter: Erste Flocken auf dem Brocken,Der erste Schnee der Saison ist auf dem 1.141 Meter hohen Brocken gefallen. Idyllisch ist es da oben aber gerade nicht: Bei minus zwei Grad herrschen Orkanböen.,https://www.stern.de/gesellschaft/regional/sachsen-anhalt/wetter--erste-flocken-auf-dem-brocken-36162926.html,https://image.stern.de/36162928/t/oU/v1/w1440/r1.7778/-/26--4rvv7bs5hkv3axs2048jpeg---3856fc39c941f1c8.jpg,,"Kopiere den aktuellen Link
Zur Merkliste hinzufügen
Der erste Schnee der Saison ist auf dem 1.141 Meter hohen Brocken gefallen. Idyllisch ist es da oben aber gerade nicht: Bei minus zwei Grad herrs… [+737 chars]",
