index,url,valid,domain,title,description,image,published,archive,content,quote,language,keyword
https://www.zeit.de/zeit-magazin/2023/14/haehnchen-perlgraupen-rezept-wochenmarkt,https://www.zeit.de/zeit-magazin/2023/14/haehnchen-perlgraupen-rezept-wochenmarkt,0,www.zeit.de,"Hähnchen mit Perlgraupen: Bist Du das, Frühling?","Mit dem hell leuchtenden Rhabarberrot kommt der Frühling. Auf den Tellern wird es wieder farbig. Schluss mit Cremesauce, dieses Hähnchen hat wieder feinere Begleitung.",,2023-04-01T12:05:39Z,,"When browsing with ads:
We collect personal data and also transmit it to third-party providers
 that help us improve and finance our digital content. Some of the information stored on your device, … [+732 chars]",,de,'Frühling'
https://www.n-tv.de/mediathek/videos/wetter/Schauer-ziehen-sich-langsam-nach-Sueden-zurueck-article24027981.html,https://www.n-tv.de/mediathek/videos/wetter/Schauer-ziehen-sich-langsam-nach-Sueden-zurueck-article24027981.html,0,www.n-tv.de,Nur im Rheinland zweistellig: Schauer ziehen sich langsam nach Süden zurück,"Ganz, ganz langsam verziehen sich die Schauer aus Deutschland. Am Sonntag hängen sie vor allem noch im Süden und Osten fest, bisweilen fällt hier auch Schnee. Im freundlicheren Westen kann es auch mal bis zu zehn Grad geben.",https://bilder1.n-tv.de/img/incoming/crop24027996/6401327238-cImg_16_9-w1200/imago0239794951h.jpg,2023-04-02T05:15:00Z,,,,de,'Schnee'
https://www.focus.de/panorama/wetter-aktuell/wetter-in-deutschland-im-ticker-hochwasser-im-noerdlichen-bayern-regen-laesst-langsam-nach_id_54933749.html,https://www.focus.de/panorama/wetter-aktuell/wetter-in-deutschland-im-ticker-hochwasser-im-noerdlichen-bayern-regen-laesst-langsam-nach_id_54933749.html,0,www.focus.de,Wetterlage im Ticker - Hochwasser im nördlichen Bayern - Regen lässt langsam nach,In vielen Regionen wird das Wetter am Wochenende nass und stürmisch. In weiten Teilen Deutschlands warnt der Wetterdienst vor Dauerregen und Windböen. Im nördlichen Bayern herrscht sogar Hochwasser-Gefahr. Die News im Wetter-Ticker.,https://p6.focus.de/img/fotos/id_189943027/5facfc003aa00764.jpg?im=Crop%3D%280%2C0%2C3769%2C1886%29%3BResize%3D%281200%2C627%29&hash=488e9dbf11120e41e81f5f4cbac0efe8154ccb7be6527539504b7c40cf9fd45e,2023-04-02T09:15:43Z,,In vielen Regionen wird das Wetter am Wochenende nass und stürmisch. In weiten Teilen Deutschlands warnt der Wetterdienst vor Dauerregen und Windböen. Im nördlichen Bayern herrscht sogar Hochwasser-G… [+13802 chars],,de,'Hochwasser'
https://www.stern.de/gesellschaft/regional/bayern/dwd-vorhersage--regenwetter-nimmt-langsam-ab--schneeflocken-zum-wochenbeginn-33341168.html,https://www.stern.de/gesellschaft/regional/bayern/dwd-vorhersage--regenwetter-nimmt-langsam-ab--schneeflocken-zum-wochenbeginn-33341168.html,0,www.stern.de,DWD-Vorhersage: Regenwetter nimmt langsam ab: Schneeflocken zum Wochenbeginn,Die Regenfälle der vergangenen Tage nehmen im Freistaat langsam ab - dafür werden zum Wochenbeginn erneut Schneeflocken erwartet. Der Deutsche Wetterdienst (DWD) rechnet vor allem im Norden Bayerns am Sonntag mit einer Auflockerung. Der Regen dürfte sich in d…,https://image.stern.de/33341170/t/m_/v1/w1440/r1.7778/-/02--urnnewsmldpacom2009010123040299181371v2w800h600l435t105r2202b2095jpeg---bb87352cc4355377.jpg,2023-04-02T10:04:11Z,,Die Regenfälle der vergangenen Tage nehmen im Freistaat langsam ab - dafür werden zum Wochenbeginn erneut Schneeflocken erwartet. Der Deutsche Wetterdienst (DWD) rechnet vor allem im Norden Bayerns a… [+1247 chars],,de,'Schnee'
https://www.bild.de/regional/muenchen/muenchen-aktuell/in-bayern-schneeflocken-zum-wochenbeginn-regenwetter-nimmt-langsam-ab-83420902.bild.html,https://www.bild.de/regional/muenchen/muenchen-aktuell/in-bayern-schneeflocken-zum-wochenbeginn-regenwetter-nimmt-langsam-ab-83420902.bild.html,0,www.bild.de,In Bayern – Schneeflocken zum Wochenbeginn - Regenwetter nimmt langsam ab,In der Nacht zum Montag gibt es voraussichtlich zu den Alpen hin noch längere Zeit RegenFoto: Peter Kneffel/dpa,"https://images.bild.de/64295ec14ced6b30cecd710c/de1f8fbddf6b1332e4feb3c088bf2494,a310051?w=1280",2023-04-02T11:21:22Z,,"München Die Regenfälle der vergangenen Tage nehmen im Freistaat langsam ab - dafür werden zum Wochenbeginn erneut Schneeflocken erwartet. 
Der Deutsche Wetterdienst (DWD) rechnet vor allem im Norden… [+774 chars]",,de,'Schnee'
https://www.bild.de/sport/fussball/bayern-muenchen/fc-bayern-muenchen-uli-hoeness-mit-brisanter-andeutung-zum-nagelsmann-aus-83420542.bild.html,https://www.bild.de/sport/fussball/bayern-muenchen/fc-bayern-muenchen-uli-hoeness-mit-brisanter-andeutung-zum-nagelsmann-aus-83420542.bild.html,0,www.bild.de,Kostete ihn der Ski-Urlaub den Job? - Brisante Hoeneß-Andeutung zum Nagelsmann-Aus!,"Könnte Nagelsmann noch Bayern-Trainer sein, wenn er sich anders verhalten hätte?Foto: Sport1, picture alliance / Eibner-Pressefoto","https://images.bild.de/6429583c4ced6b30cecd70f7/c9f77f1c9c69d4c03952580aec73f622,50b75d7d?w=1280",2023-04-02T11:29:43Z,,"Könnte Julian Nagelsmann (35) heute noch Bayern-Trainer sein, wenn er sich anders verhalten hätte?
Genau das behauptet Uli Hoeneß (71) jetzt! Bayerns Ex-Präsident hat sich am Sonntagvormittag im Kic… [+2909 chars]",,de,'Laub'
https://www.bild.de/video/clip/news-ausland/lebendig-begraben-snowboarder-steckt-kopfueber-im-tiefschnee-fest-83399922.bild.html,https://www.bild.de/video/clip/news-ausland/lebendig-begraben-snowboarder-steckt-kopfueber-im-tiefschnee-fest-83399922.bild.html,0,www.bild.de,Lebendig begraben - Snowboarder steckt kopfüber in Schnee-Hölle fest,"Snowboarder steckt kopfüber in Schnee-Hölle fest
 Foto: Francis Zuber/ LOCAL NEWS X /TMX
 Dauer: 02:03","https://images.bild.de/6426a47d05a8fc29b65194e0/f55734f85edfc8d255713c9b8e9a4f56,a63b2d7c?w=1280",2023-04-02T13:56:55Z,,"Sieben Tote bei Feuer-Unfall in Thüringen: Todesfahrer (45) soll betrunken gewesen sein und hatte keinen Führerschein
Sieben Tote bei Feuer-Unfall in Thüringen: Todesfahrer (45) soll betrunken gewes… [+988 chars]",,de,'Schnee'
https://www.n-tv.de/panorama/Sonne-Regen-und-kuehle-Temperaturen-bestimmen-Karwoche-article24029064.html,https://www.n-tv.de/panorama/Sonne-Regen-und-kuehle-Temperaturen-bestimmen-Karwoche-article24029064.html,0,www.n-tv.de,"Die Wetterwoche im Schnellcheck: Sonne, Regen und kühle Temperaturen bestimmen Karwoche","In der Karwoche zeigt sich der April von seiner klassischen Seite. Regen wechselt sich mit Sonne ab, die Temperaturen sind mal frostig, mal frühlingshaft mild. Vor allem an Ostern wird das Wetter in Deutschland zweigeteilt sein. Freuen dürfen sich vor allem d…",https://bilder3.n-tv.de/img/incoming/crop24029090/8671323325-cImg_16_9-w1200/402539776.jpg,2023-04-02T14:28:35Z,,"Nach dem nassen März und dem regenreichen Start in den April beschert uns ein Hoch über Nordeuropa nun ruhigeres, zunehmend trockenes und oft auch sonniges Wetter. Dass sich das noch nicht unbedingt … [+2266 chars]",,de,'Frühling'
https://www.bild.de/video/clip/news-inland/gruselprognose-fuer-deutschland-neue-kaeltewelle-schlaegt-zu-83425118.bild.html,https://www.bild.de/video/clip/news-inland/gruselprognose-fuer-deutschland-neue-kaeltewelle-schlaegt-zu-83425118.bild.html,0,www.bild.de,Gruselprognose für Ostern - Neue Kältewelle rollt über Deutschland,Frühling bis Mitte April? Fehlanzeige. Es gibt sogar Schnee an Ostern und es kommen frostige Feiertage auf uns zu.,"https://images.bild.de/64299d7fc785de3fd22374ac/103e4bb3f9b3ab81e851b0b72c74ca9d,5d78f6a8?w=1280",2023-04-02T15:28:35Z,,"Mehr zum Video anzeigen
Frühling bis Mitte April? Fehlanzeige. Es gibt sogar Schnee an Ostern und es kommen frostige Feiertage auf uns zu.
Quelle: wetter.net
 02.04.2023 - 17:30 Uhr",,de,'Frühling'
https://ooe.orf.at/stories/3201375/,https://ooe.orf.at/stories/3201375/,0,ooe.orf.at,Schwierige Skisaison vor Abschluss,"Am Montag starten die Osterferien und das ist die letzte Gelegenheit, noch einmal Skifahren zu gehen. Das Geschäft in den Ferien kann aber eine durchwachsene Saison in den Skigebieten nicht mehr retten. Wenig Schnee und die Diskussion rund um den Klimawandel …",https://ibs.orf.at/ooe?image=https%3A%2F%2Foekastatic.orf.at%2Fmims%2F2023%2F02%2F36%2Fcrops%2Fw%3D1200%2Ch%3D627%2Cq%3D75%2F1634587_master_600036_hinterstoder.jpg%3Fs%3D0c16d83b25c31c87184976c7b2a72544dacb8c58,2023-04-03T04:13:13Z,,"Die Bilder von Skigebieten, in denen kaum Schnee liegt und sich nur ein weißes Band vom Berg ins Tal erstreckt, bleiben vielen aus der heurigen Saison im Gedächtnis. Wenn man jeden Tag hört, die Sais… [+1017 chars]",,de,'Schnee'
https://orf.at/stories/3311192/,https://orf.at/stories/3311192/,0,orf.at,Winter kehrt in Karwoche zurück,"Der Winter gibt sich noch nicht geschlagen. In der Karwoche setzt sich in Österreich Luft aus dem hohen Norden Europas fest, es wird kälter als in den Weihnachtsfeiertagen. Die Nächte werden frostig, was zu Schäden in der Landwirtschaft führen kann, etwa bei …",https://ibs.orf.at/news?image=https%3A%2F%2Fassets.orf.at%2Fmims%2F2023%2F14%2F36%2Fcrops%2Fw%3D1200%2Ch%3D630%2Cq%3D75%2F1737653_master_643436_wetter_osterwoche_ap.jpg%3Fs%3Dbd4abbd8d43ff11bad85ba88464e6aa570ee83db,2023-04-03T04:14:41Z,,"Wintermantel statt Übergangsjacke, Eiskratzen statt Eisschlecken, und die Heizung muss auch noch einmal aufgedreht werden. Die Frühlingsgefühle werden in der Karwoche in die Schranken gewiesen. Die O… [+5248 chars]",,de,'Winter'
https://www.zeit.de/news/2023-04/03/schnee-frost-und-glaettegefahr-in-der-karwoche-in-sachsen,https://www.zeit.de/news/2023-04/03/schnee-frost-und-glaettegefahr-in-der-karwoche-in-sachsen,0,www.zeit.de,"Wetter: Schnee, Frost und Glättegefahr in der Karwoche in Sachsen",,,2023-04-03T04:41:10Z,,"When browsing with ads:
We collect personal data and also transmit it to third-party providers
 that help us improve and finance our digital content. Some of the information stored on your device, … [+732 chars]",,de,'Schnee'
https://www.stern.de/gesellschaft/regional/sachsen/wetter--schnee--frost-und-glaettegefahr-in-der-karwoche-in-sachsen-33342468.html,https://www.stern.de/gesellschaft/regional/sachsen/wetter--schnee--frost-und-glaettegefahr-in-der-karwoche-in-sachsen-33342468.html,0,www.stern.de,"Wetter: Schnee, Frost und Glättegefahr in der Karwoche in Sachsen","In der Karwoche wird es kalt in Sachsen. Frost, Schnee und Glätte sind in den Tagen vor Ostern möglich, wie der Deutsche Wetterdienst (DWD) mitteilte. Mit vielen Wolken und vereinzelten Schneeschauern startet die Woche. Bei leichtem Wind sind maximal fünf Gra…",https://image.stern.de/33342470/t/11/v1/w1440/r1.7778/-/03--urnnewsmldpacom2009010123040399189832v3w800h600l678t463r1796b1229jpeg---f9830087780de88f.jpg,2023-04-03T04:41:10Z,,"In der Karwoche wird es kalt in Sachsen. Frost, Schnee und Glätte sind in den Tagen vor Ostern möglich, wie der Deutsche Wetterdienst (DWD) mitteilte. Mit vielen Wolken und vereinzelten Schneeschauer… [+1399 chars]",,de,'Schnee'
https://www.stern.de/gesellschaft/regional/thueringen/wetter--wolkige-karwoche-in-thueringen-33342490.html,https://www.stern.de/gesellschaft/regional/thueringen/wetter--wolkige-karwoche-in-thueringen-33342490.html,0,www.stern.de,Wetter: Wolkige Karwoche in Thüringen,"Viele Wolken und teilweise sogar Schnee gibt es in der Karwoche in Thüringen. Trocken und größtenteils bewölkt startet die Woche, wie der Deutsche Wetterdienst (DWD) mitteilte. Zeitweise kann es aber bei bis zu sieben Grad auflockern. Nachts wird es mit Tiefs…",https://image.stern.de/33342492/t/bt/v1/w1440/r1.7778/-/03--urnnewsmldpacom2009010123040399189942v2w800h600l1807t1047r3854b2511jpeg---db13237c5875d2da.jpg,2023-04-03T05:00:47Z,,"Viele Wolken und teilweise sogar Schnee gibt es in der Karwoche in Thüringen. Trocken und größtenteils bewölkt startet die Woche, wie der Deutsche Wetterdienst (DWD) mitteilte. Zeitweise kann es aber… [+1085 chars]",,de,'Schnee'
https://www.stern.de/gesellschaft/regional/berlin-brandenburg/wetter--weiter-spaetwinterlich-in-berlin-und-brandenburg-33342574.html,https://www.stern.de/gesellschaft/regional/berlin-brandenburg/wetter--weiter-spaetwinterlich-in-berlin-und-brandenburg-33342574.html,0,www.stern.de,Wetter: Weiter spätwinterlich in Berlin und Brandenburg,"Spätwinterlich mit Schnee und Schneeregen startet die neue Woche in Berlin und Brandenburg. Nach heiterem oder auch wolkigem Beginn zieht der Himmel am Montag bei vier bis sieben Grad später immer mehr zu, wie der Deutsche Wetterdienst (DWD) in Potsdam mittei…",https://image.stern.de/33342576/t/P4/v1/w1440/r1.7778/-/03--urnnewsmldpacom2009010123040399190249v3w800h600l631t479r1911b1382jpeg---fb319271c2620421.jpg,2023-04-03T05:35:15Z,,Spätwinterlich mit Schnee und Schneeregen startet die neue Woche in Berlin und Brandenburg. Nach heiterem oder auch wolkigem Beginn zieht der Himmel am Montag bei vier bis sieben Grad später immer me… [+1162 chars],,de,'Schnee'
https://www.morgenpost.de/berlin/article238059857/Weiter-spaetwinterlich-in-Berlin-und-Brandenburg.html,https://www.morgenpost.de/berlin/article238059857/Weiter-spaetwinterlich-in-Berlin-und-Brandenburg.html,0,www.morgenpost.de,Wetter: Weiter spätwinterlich in Berlin und Brandenburg,"Spätwinterlich mit Schnee und Schneeregen startet die neue Woche in Berlin und Brandenburg. Nach heiterem oder auch wolkigem Beginn zieht der Himmel am Montag bei vier bis sieben Grad später immer mehr zu, wie der Deutsche Wetterdienst (DWD) in Potsdam mittei…",https://img.morgenpost.de/img/berlin/crop238059855/4762606433-w820-cv16_9-q85/Kalter-Morgen.jpg,2023-04-03T05:35:15Z,,Potsdam (dpa/bb). Spätwinterlich mit Schnee und Schneeregen startet die neue Woche in Berlin und Brandenburg. Nach heiterem oder auch wolkigem Beginn zieht der Himmel am Montag bei vier bis sieben Gr… [+749 chars],,de,'Schnee'
https://www.zeit.de/news/2023-04/03/weiter-hochwasser-im-norden-schnee-in-aussicht,https://www.zeit.de/news/2023-04/03/weiter-hochwasser-im-norden-schnee-in-aussicht,0,www.zeit.de,Wetter: Weiter Hochwasser im Norden: Schnee in Aussicht,,,2023-04-03T06:21:35Z,,"When browsing with ads:
We collect personal data and also transmit it to third-party providers
 that help us improve and finance our digital content. Some of the information stored on your device, … [+732 chars]",,de,'Schnee'
https://www.stern.de/gesellschaft/regional/bayern/wetter--weiter-hochwasser-im-norden--schnee-in-aussicht-33342672.html,https://www.stern.de/gesellschaft/regional/bayern/wetter--weiter-hochwasser-im-norden--schnee-in-aussicht-33342672.html,0,www.stern.de,Wetter: Weiter Hochwasser im Norden: Schnee in Aussicht,"Weiterhin warnt der Hochwassernachrichtendienst Bayern (HND) im Norden des Freistaates vor Überschwemmungen. Die Itz habe im Landkreis Bamberg und Coburg bereits die Meldestufe 3 erreicht, teilte der HND am Montag mit. Damit bestehe Überschwemmungsgefahr für …",https://image.stern.de/33342674/t/RB/v1/w1440/r1.7778/-/03--urnnewsmldpacom2009010123040399190615v3w800h600l302t514r1390b1335jpeg---2a4e19e9853b48b2.jpg,2023-04-03T06:21:35Z,,"Weiterhin warnt der Hochwassernachrichtendienst Bayern (HND) im Norden des Freistaates vor Überschwemmungen. Die Itz habe im Landkreis Bamberg und Coburg bereits die Meldestufe 3 erreicht, teilte der… [+936 chars]",,de,'Hochwasser'
https://www.dw.com/de/warten-auf-regen-die-d%C3%BCrre-in-europa-trifft-auch-den-tourismus/a-65136187,https://www.dw.com/de/warten-auf-regen-die-d%C3%BCrre-in-europa-trifft-auch-den-tourismus/a-65136187,0,www.dw.com,Warten auf Regen: Die Dürre in Europa trifft auch den Tourismus,Europaweit sind ganze Landstriche von anhaltender Trockenheit gezeichnet. Auf Urlauber kommen Einschränkungen zu - stellenweise gibt es diese sogar bereits.,https://static.dw.com/image/64928729_6.jpg,2023-04-03T08:03:00Z,,Der Gardasee ist um eine Touristenattraktion reicher: Neuerdings kann man dort zu Fuß und ohne nass zu werden die sogenannte Kanincheninsel erreichen. Unzählige Ausflügler machten davon in den zurück… [+7813 chars],,de,'Dürre'
https://www.wissenschaft.de/erde-umwelt/frostresistenz-wird-zum-vorteil-im-klimawandel/,https://www.wissenschaft.de/erde-umwelt/frostresistenz-wird-zum-vorteil-im-klimawandel/,0,www.wissenschaft.de,Frostresistenz wird zum Vorteil im Klimawandel,"Die Kombination von verfrühtem Austrieb mit eisigen Wetterkapriolen wird zu einer kniffligen Herausforderung für Pflanzen im Zuge des Klimawandels. Eine experimentelle Studie verdeutlicht dazu nun: Laubbaumarten, die sich besonders gut von Schäden durch Spätf…",https://www.wissenschaft.de/wp-content/uploads/n/e/newsimage376505.jpg,2023-04-03T08:10:10Z,,Die Kombination von verfrühtem Austrieb mit eisigen Wetterkapriolen wird zu einer kniffligen Herausforderung für Pflanzen im Zuge des Klimawandels. Eine experimentelle Studie verdeutlicht dazu nun: L… [+4982 chars],,de,'Schnee'
https://www.focus.de/kultur/leben/reise-warten-auf-regen-die-duerre-in-europa-trifft-auch-den-tourismus_id_190091542.html,https://www.focus.de/kultur/leben/reise-warten-auf-regen-die-duerre-in-europa-trifft-auch-den-tourismus_id_190091542.html,0,www.focus.de,Reise - Warten auf den Regen: Die Dürre in Europa trifft auch den Tourismus,Der Klimawandel sorgt für immer mehr Dürreperioden. Ganze Landstriche in Europa sind von der Trockenheit betroffen. Doch die Dürre trifft nicht nur Landwirtschaft und Natur - sondern schränkt auch beliebte Urlaubsziele der Touristen ein.,https://p6.focus.de/img/fotos/id_189461305/de-trockenheit-spanien-katalonien-ergreift-76059773-kopie.jpg?im=Crop%3D%280%2C50%2C1600%2C800%29%3BResize%3D%281200%2C627%29&hash=14190ca16ff3903777a008a8b7156c42c153aeb90879d3308ece504ae9b263e6,2023-04-03T08:45:03Z,,Der Klimawandel sorgt für immer mehr Dürreperioden. Ganze Landstriche in Europa sind von der Trockenheit betroffen. Doch die Dürre trifft nicht nur Landwirtschaft und Natur - sondern schränkt auch be… [+5303 chars],,de,'Dürre'
https://www.faz.net/aktuell/wissen/erde-klima/liveticker-klima-investitionen-in-erneuerbare-reichen-nicht-aus-18134531.html,https://www.faz.net/aktuell/wissen/erde-klima/liveticker-klima-investitionen-in-erneuerbare-reichen-nicht-aus-18134531.html,0,www.faz.net,Klimablog: Investitionen in Erneuerbare reichen nicht aus,So steht es um den Wald in Deutschland +++ 2022 mehr Bäume gestorben als 2021 +++ Der Klimawandel setzt Parasiten zu +++ Berge auf der ganzen Welt fast 16 Tage weniger mit Schnee bedeckt +++ alles Wichtige im F.A.Z. Klimablog „Kipppunkt“.,https://media0.faz.net/ppmedia/aktuell/politik/4131836603/1.8791578/facebook_teaser/erneuerbare-mischung.jpg,2023-04-03T11:04:50Z,https://web.archive.org/web/20230403103405/https://www.faz.net/aktuell/wissen/erde-klima/liveticker-klima-investitionen-in-erneuerbare-reichen-nicht-aus-18134531.html,"So konnte Notarnicola nachweisen, dass sich die Schneedecke von Region zu Region sehr unterschiedlich ändert. Die Schneemassen nehmen gerade in Kanada, Europa und im nördlichen asiatischen Hochgebirg… [+1521 chars]",,de,'Frühling'
https://www.zeit.de/news/2023-04/03/hochwasser-in-oberfranken-und-schnee-im-sueden-in-aussicht,https://www.zeit.de/news/2023-04/03/hochwasser-in-oberfranken-und-schnee-im-sueden-in-aussicht,0,www.zeit.de,Wetteraussichten: Hochwasser in Oberfranken und Schnee im Süden in Aussicht,,,2023-04-03T12:46:57Z,https://web.archive.org/web/20230404111608/https://www.zeit.de/news/2023-04/03/hochwasser-in-oberfranken-und-schnee-im-sueden-in-aussicht,"When browsing with ads:
We collect personal data and also transmit it to third-party providers
 that help us improve and finance our digital content. Some of the information stored on your device, … [+732 chars]",,de,'Hochwasser'
https://science.orf.at/stories/3218588/,https://science.orf.at/stories/3218588/,0,science.orf.at,Pflanzen beobachten per App,"Früher Frühling, später Herbst: Die Jahreszeiten kann man anhand sogenannter Zeigerpflanzen bestimmen, die typisch für eine bestimmte Saison sind. Wer mithelfen will, die Entwicklung der Natur in Österreich genau zu dokumentieren, kann dies nun auch mit Hilfe…",https://ibs.orf.at/science?image=https%3A%2F%2Ftubestatic.orf.at%2Fmims%2F2023%2F14%2F71%2Fcrops%2Fw%3D1200%2Ch%3D627%2Cq%3D75%2F1739829_master_644371_nk_slide02_phonel.jpg%3Fs%3D04565f0d2c197b1a341242b3326ce79dee7f333e,2023-04-04T12:06:07Z,https://web.archive.org/web/20230404124647/https://science.orf.at/stories/3218588/,"Es funktioniert ganz einfach: Man geht hinaus, öffnet die Naturkalender-App, und macht mit dem Handy ein Foto von einer Blume, einem Baum oder einem Strauch. Dann markiert man den jeweiligen Standort… [+1934 chars]",,de,'Sommer'
https://www.transfermarkt.de/trainersuche-beim-fc-basel-ancelotti-sohn-davide-hoch-im-kurs/view/news/420095,https://www.transfermarkt.de/trainersuche-beim-fc-basel-ancelotti-sohn-davide-hoch-im-kurs/view/news/420095,0,www.transfermarkt.de,Ancelotti-Sohn beim FC Basel hoch im Kurs – Soll im Sommer kommen,Beim FC Basel geht die Trainersuche in die entscheidende Phase. Die spanische Sportzeitschrift „Marca“ bringt nun einen berühmten Namen ins Spiel: Ancelotti. Dabei...,https://tmssl.akamaized.net/images/foto/big/davide-ancelotti-real-madrid-2023-1680612181-104880.jpg?lm=1680612200,2023-04-04T12:31:51Z,https://web.archive.org/web/20230404224650/http://www.transfermarkt.de/trainersuche-beim-fc-basel-ancelotti-sohn-davide-hoch-im-kurs/view/news/420095,Beim FC Basel geht die Trainersuche in die entscheidende Phase. Die spanische Sportzeitschrift „Marca“ bringt nun einen berühmten Namen ins Spiel: Ancelotti. Dabei handelt es sich aber nicht um Carlo… [+891 chars],,de,'Sommer'
https://www.welt.de/vermischtes/article244651496/Stuttgart-Querdenken-Initiator-Ballweg-unter-Auflagen-aus-U-Haft-entlassen.html,https://www.welt.de/vermischtes/article244651496/Stuttgart-Querdenken-Initiator-Ballweg-unter-Auflagen-aus-U-Haft-entlassen.html,0,www.welt.de,„Querdenken“-Initiator Ballweg unter Auflagen aus Untersuchungshaft entlassen,"Seit Sommer 2022 sitzt „Querdenken“-Gründer Michael Ballweg in Stuttgart in Untersuchungshaft. Jetzt kommt der 48-Jährige unter Auflagen frei. Die Fluchtgefahr habe sich verringert, teilt das Oberlandesgericht mit.",https://img.welt.de/img/vermischtes/mobile244651576/0651352377-ci16x9-w1200/Anklage-gegen-Querdenken-Initiator-Ballweg-erhoben.jpg,2023-04-04T12:50:36Z,https://web.archive.org/web/20230404173317/https://www.welt.de/vermischtes/article244651496/Stuttgart-Querdenken-Initiator-Ballweg-unter-Auflagen-aus-U-Haft-entlassen.html,"Nach rund neun Monaten Haft ist der Gründer und Organisator der Querdenken-Bewegung, Michael Ballweg, unter Auflagen aus der Untersuchungshaft entlassen worden. Zur Begründung teilte das Oberlandesge… [+2384 chars]",,de,'Sommer'
https://www.sueddeutsche.de/wissen/psychologie-warum-menschen-an-uebernatuerliche-kraefte-glauben-1.5781517,https://www.sueddeutsche.de/wissen/psychologie-warum-menschen-an-uebernatuerliche-kraefte-glauben-1.5781517,0,www.sueddeutsche.de,Psychologie: Warum Menschen an übernatürliche Kräfte glauben,"Götter, Geister und Hexen als Verursacher von Gewittern und Kriegen: Übernatürliche Erklärungen sind weltweit verbreitet und zeitlos, das zeigt eine neue Studie.",https://www.sueddeutsche.de/image/sz.1.5781518/1200x675?v=1680615367,2023-04-04T13:36:13Z,https://web.archive.org/web/20230404221205/https://www.sueddeutsche.de/wissen/psychologie-warum-menschen-an-uebernatuerliche-kraefte-glauben-1.5781517,"Götter, Geister und Hexen als Verursacher von Gewittern und Kriegen: Übernatürliche Erklärungen sind weltweit verbreitet und zeitlos, das zeigt eine neue Studie. Göttervater Zeus schwingt zornig sein… [+3766 chars]",,de,'Gewitter'
https://www.faz.net/aktuell/rhein-main/region-und-hessen/wie-kommunen-in-rhein-main-im-winter-energie-gespart-haben-18792681.html,https://www.faz.net/aktuell/rhein-main/region-und-hessen/wie-kommunen-in-rhein-main-im-winter-energie-gespart-haben-18792681.html,0,www.faz.net,Wie Kommunen in Rhein-Main im Winter Energie gespart haben,"Lichter aus, Temperaturen runter, hieß es in den Kommunen der Rhein-Main-Region. Die Sparziele des Krisenwinters wurden aber nicht überall erreicht.",https://media0.faz.net/ppmedia/aktuell/117451536/1.8792680/facebook_teaser/von-wegen-verdunkelung-von-der.jpg,2023-04-05T11:46:04Z,https://web.archive.org/web/20230405165812/https://www.faz.net/aktuell/rhein-main/region-und-hessen/wie-kommunen-in-rhein-main-im-winter-energie-gespart-haben-18792681.html,"Die Gaspreise fallen, die Strompreise ebenso. Offensichtlich konnte während der vergangenen Monate ausreichend Gas nach Deutschland ge­liefert und genug gespart werden, um mit dem reduzierten Angebot… [+3537 chars]",,de,'Winter'
https://www.tagesspiegel.de/kultur/liam-gillick-im-pergamonmuseum-vor-der-schliessung-im-herbst-wirds-nochmal-bunt-9613214.html,https://www.tagesspiegel.de/kultur/liam-gillick-im-pergamonmuseum-vor-der-schliessung-im-herbst-wirds-nochmal-bunt-9613214.html,0,www.tagesspiegel.de,Liam Gillick im Pergamonmuseum : Vor der Schließung im Herbst wird’s nochmal bunt,Der britische Bildhauer Liam Gillick bestrahlt die assyrischen Reliefs mit buntem Licht. Wäre das ein Weg für die Zukunft – mit allem lockerer umgehen?,https://www.tagesspiegel.de/images/germany-britain-museum-art/alternates/BASE_16_9_W1400/germany-britain-museum-art.jpeg,2023-04-05T13:19:59Z,,"Den britischen Künstler Liam Gillick bringt man erstmal nicht mit einer ernsthaften Angelegenheit, wie dem Pergamonmuseum in Verbindung. Zeitgenössische Kunst soll irritieren, verärgern, kritisieren,… [+4136 chars]",,de,'Herbst'
