index,url,valid,domain,title,description,image,published,archive,content,quote,language,keyword
https://vorarlberg.orf.at/stories/3264114/,https://vorarlberg.orf.at/stories/3264114/,0,vorarlberg.orf.at,Obst- und Gemüsebauern hadern mit Wetter,"So richtig in Schwung kommt der Sommer in Vorarlberg heuer nicht. Die ständigen Wetterwechsel stellen Gemüse- und Obstbauern vor große Herausforderungen. Während einige Pflanzen leiden, profitieren Weichtiere und Larven von den Bedingungen.",https://ibs.orf.at/vbg?image=https%3A%2F%2Foekastatic.orf.at%2Fmims%2F2024%2F27%2F48%2Fcrops%2Fw%3D1200%2Ch%3D627%2Cq%3D75%2F2269816_master_863248_downloadmedium.jpg%3Fs%3D8ca03988a894798cb20cbb7a54c53bf951f73deb,2024-07-06T17:10:32Z,,"Das Wetter wechselt im Minutentakt und bringt viele Pflanzen in Bedrängnis. Während Weichtiere und Larven sich über die Bedingungen freuen, haben Gemüse- und Obstbauern mit erheblichen Problemen zu k… [+1581 chars]",,de,'Sommer'
https://www.zeit.de/news/2024-07/07/ungewoehnlicher-sommer-noch-freie-hotelbetten-am-bodensee,https://www.zeit.de/news/2024-07/07/ungewoehnlicher-sommer-noch-freie-hotelbetten-am-bodensee,0,www.zeit.de,Touri-Flaute am Bodensee: Ungewöhnlicher Sommer: Noch freie Hotelbetten am Bodensee,Hier finden Sie Informationen zu dem Thema „Touri-Flaute am Bodensee“. Lesen Sie jetzt „Ungewöhnlicher Sommer: Noch freie Hotelbetten am Bodensee“.,https://img.zeit.de/news/2024-07/07/ungewoehnlicher-sommer-noch-freie-hotelbetten-am-bodensee-image-group/wide__1300x731,2024-07-07T02:00:39Z,,"Touristen haben dieses Jahr gute Chancen, auch spontan am Bodensee noch ein Zimmer zu bekommen. Wegen der Berichte über Hochwasser und Mücken wurden stellenweise Buchungen storniert, auch Durchreisev… [+3368 chars]",,de,'Winter'
https://www.stern.de/gesellschaft/regional/baden-wuerttemberg/touri-flaute-am-bodensee--ungewoehnlicher-sommer--noch-freie-hotelbetten-am-bodensee-34859688.html,https://www.stern.de/gesellschaft/regional/baden-wuerttemberg/touri-flaute-am-bodensee--ungewoehnlicher-sommer--noch-freie-hotelbetten-am-bodensee-34859688.html,0,www.stern.de,Touri-Flaute am Bodensee: Ungewöhnlicher Sommer: Noch freie Hotelbetten am Bodensee,"Meersburg - Touristen haben dieses Jahr gute Chancen, auch spontan am Bodensee noch ein Zimmer zu bekommen. Wegen der Berichte über Hochwasser und",https://image.stern.de/34859690/t/HT/v1/w1440/r1.7778/-/07--b4tsxqburjv5axw800h600jpeg---7196a0ee5e3ac32f.jpg,2024-07-07T02:00:39Z,,"Nach Hochwasser und Mücken hofft die Tourismusbranche auf weitere Gäste. Kapazitäten gebe es genug.
Touristen haben dieses Jahr gute Chancen, auch spontan am Bodensee noch ein Zimmer zu bekommen. We… [+2812 chars]",,de,'Sommer'
https://www.stern.de/panorama/wetter/unwetter--karten-zeigen--wo-es-heute-gewitter--sturm-und-regen-gibt-34858548.html,https://www.stern.de/panorama/wetter/unwetter--karten-zeigen--wo-es-heute-gewitter--sturm-und-regen-gibt-34858548.html,0,www.stern.de,"Wetter in Deutschland: Karten zeigen, wo es heute Gewitter, Sturm und Regen gibt","Am Sonntag wird das Wetter größtenteils wieder sommerlicher, dafür wird es in einigen Teilen Deutschlands etwas ruppig und ungemütlich. Karten zeigen die Wetterlage.",https://image.stern.de/34858580/t/hH/v3/w1440/r1.7778/-/teaser-unwetter-wetter-sonntag.jpg,2024-07-07T06:24:00Z,,"Am Sonntag wird das Wetter größtenteils wieder sommerlicher, dafür wird es in einigen Teilen Deutschlands etwas ruppig und ungemütlich. Karten zeigen die Wetterlage.
Nachdem am Samstag einige Unwett… [+1990 chars]",,de,'Gewitter'
https://kaernten.orf.at/stories/3264152/,https://kaernten.orf.at/stories/3264152/,0,kaernten.orf.at,Wanderin über Altschneefeld abgerutscht,In den Hohen Tauern ist am Samstag eine 58 Jahre alte Wanderin aus Deutschland verunglückt. Die Frau wollte mit ihrer 20 Jahre alten Tochter zur Fraganter Hütte wandern. Im Bereich des Rotwandecks rutschte die 58-Jährige auf einem Altschneefeld aus und wurde …,https://ibs.orf.at/ktn?image=https%3A%2F%2Foekastatic.orf.at%2Fmojo%2F1_4_1%2Fstoryserver%2Foeka%2Fcommon%2Fimages%2Fog-fallback-ktn.png%3Fs%3Dd1ef40bef2ffd65644b4df37900c0e4d80e97249,2024-07-07T06:59:02Z,,Die Wanderung der beiden Frauen sollte vom Naturfreundehaus Kolm-Saigurn in Salzburg zur Fraganter Hütte in der Gemeinde Flattach (Bezirk Spittal an der Drau) führen. Der Weg führte die beiden über d… [+615 chars],,de,'Schnee'
https://www.diepresse.com/18629819/regen-bringt-in-der-arktis-tod,https://www.diepresse.com/18629819/regen-bringt-in-der-arktis-tod,0,www.diepresse.com,Regen bringt in der Arktis Tod [premium],"Niederschläge, die der Erwärmung wegen nicht als Schnee niedergehen, sondern als Regen in ihn, lassen Tausende Tiere verhungern.",https://img.diepresse.com/public/incoming/1rb9s8-1338378139/alternates/DPR_SOCIAL_MAGAZIN_PAID/1338378139,2024-07-07T09:24:00Z,,"Niederschläge, die der Erwärmung wegen nicht als Schnee niedergehen, sondern als Regen in ihn, lassen Tausende Tiere verhungern.
Nur in extremen Bedingungen der arktischen Region oder an den Grenzen… [+2449 chars]",,de,'Schnee'
https://www.zeit.de/news/2024-07/07/woche-startet-mit-sonnigem-sommerwetter-bis-28-grad,https://www.zeit.de/news/2024-07/07/woche-startet-mit-sonnigem-sommerwetter-bis-28-grad,0,www.zeit.de,Vorhersage Berlin/Brandenburg: Woche startet mit sonnigem Sommerwetter - bis 28 Grad,Hier finden Sie Informationen zu dem Thema „Vorhersage Berlin/Brandenburg“. Lesen Sie jetzt „Woche startet mit sonnigem Sommerwetter - bis 28 Grad“.,https://img.zeit.de/news/2024-07/07/woche-startet-mit-sonnigem-sommerwetter-bis-28-grad-image-group/wide__1300x731,2024-07-07T09:42:44Z,,Nach Gewittern und Sturm bringt die neue Woche zunächst ruhiges Sommerwetter in Berlin und Bandenburg. Die Temperaturen liegen am Montag nach der Vorhersage des Deutschen Wetterdienstes (DWD) zwische… [+379 chars],,de,'Gewitter'
https://www.sueddeutsche.de/bayern/bayern-zwetschgen-ernte-erwartungen-imagekampagne-lux.RADdq5LWvhpcPg7obBFx2r,https://www.sueddeutsche.de/bayern/bayern-zwetschgen-ernte-erwartungen-imagekampagne-lux.RADdq5LWvhpcPg7obBFx2r,0,www.sueddeutsche.de,Landwirtschaft in Bayern: Zwetschgen-Ernte beginnt mit durchwachsenen Erwartungen,Bald gibt es ihn wieder zu kaufen: Zwetschgenkuchen. Die Nachfrage nach den blauen Früchten selbst ist jedoch zurückgegangen. Eine Imagekampagne soll das nun ändern.,https://www.sueddeutsche.de/2024/07/07/94df4e6f-f0b2-4331-81a2-40f23cca8ff1.jpeg?q=60&fm=webp&width=1200&rect=0%2C19%2C3000%2C1688,2024-07-07T10:09:33Z,,Erste frühe Sorten haben die Anbauer in Franken bereits geerntet. Von Mitte Juli an wird nach Einschätzung von Zimmermann die Ernte der Hauptsorten beginnen. Diese seien wegen des milden Winters in d… [+1972 chars],,de,'Ernte'
https://www.stern.de/gesellschaft/regional/bayern/landwirtschaft--getreidebauern-hoffen-auf-gute-ernte---aussicht-fuer-obst-mau-34859652.html,https://www.stern.de/gesellschaft/regional/bayern/landwirtschaft--getreidebauern-hoffen-auf-gute-ernte---aussicht-fuer-obst-mau-34859652.html,0,www.stern.de,Landwirtschaft: Getreidebauern hoffen auf gute Ernte - Aussicht für Obst mau,"München (lby) - Gute Getreideernte in Sicht, eine eher schlechte bei den Zwetschgen: Die Aussichten der bayerischen Landwirtschaft sind in diesen Tagen",https://image.stern.de/34860296/t/kG/v1/w1440/r1.7778/-/07--xufcwc3wpuv1axw800h600jpeg---0672ebcdb4dd404e.jpg,2024-07-07T10:25:04Z,,"Die Getreideernte könnte in diesem Jahr gut ausfallen. Weniger hoffnungsvoll sind die Obstbauern.
Gute Getreideernte in Sicht, eine eher schlechte bei den Zwetschgen: Die Aussichten der bayerischen … [+4079 chars]",,de,'Ernte'
https://www.bild.de/regional/bayern/schueler-steckten-im-schnee-fest-raeder-rettung-in-alpen-kostet-4000-euro-668a4fbb18c33d086d7bc0c3,https://www.bild.de/regional/bayern/schueler-steckten-im-schnee-fest-raeder-rettung-in-alpen-kostet-4000-euro-668a4fbb18c33d086d7bc0c3,0,www.bild.de,Schüler stecken am Berg fest - Räder-Rettung in den Alpen kostet 4000 Euro,Bayerische Schüler steckten in den Alpen mit ihren Fahrrädern im Schnee fest. Sie mussten per Hubschrauber gerettet werden. Jetzt wurden ihre Räder geborgen,"https://images.bild.de/668a4fbb18c33d086d7bc0c3/5090e142de056257a35a851f7c81826d,1ba57771?w=1280",2024-07-07T11:21:01Z,,Innsbruck (Österreich) Bayerische Schüler steckten in den Alpen mit ihren Fahrrädern im Schnee fest. Sie mussten per Hubschrauber gerettet werden. Ihre Mountainbikes blieben auf dem Berg zurück und a… [+2399 chars],,de,'Schnee'
https://www.zeit.de/news/2024-07/07/sommerliches-wetter-ab-montag-regen-in-sicht,https://www.zeit.de/news/2024-07/07/sommerliches-wetter-ab-montag-regen-in-sicht,0,www.zeit.de,Wetter: Sommerliches Wetter ab Montag - Regen in Sicht,Hier finden Sie Informationen zu dem Thema „Wetter“. Lesen Sie jetzt „Sommerliches Wetter ab Montag - Regen in Sicht“.,https://img.zeit.de/news/2024-07/07/sommerliches-wetter-ab-montag-regen-in-sicht-image-group/wide__1300x731,2024-07-07T12:45:45Z,,Zum Wochenstart können sich die Menschen im Ländle vielerorts auf sonniges Wetter freuen - doch Regen ist schon wieder in Sicht. Am Montag sollen die Temperaturen auf Höchstwerte bis zu 27 Grad steig… [+731 chars],,de,'Sommer'
https://www.zeit.de/news/2024-07/08/bauernverband-erwartet-normale-getreideernte-im-suedwesten,https://www.zeit.de/news/2024-07/08/bauernverband-erwartet-normale-getreideernte-im-suedwesten,0,www.zeit.de,Landwirtschaft: Bauernverband erwartet normale Getreideernte im Südwesten,Hier finden Sie Informationen zu dem Thema „Landwirtschaft“. Lesen Sie jetzt „Bauernverband erwartet normale Getreideernte im Südwesten“.,https://img.zeit.de/news/2024-07/08/bauernverband-erwartet-normale-getreideernte-im-suedwesten-image-group/wide__1300x731,2024-07-08T01:45:36Z,,Trotz des Hochwassers im Juni rechnet der Landesbauernverband mit einer weitgehend normalen Getreideernte in Baden-Württemberg. Aktuell gehe man von einer durchschnittlichen bis leicht überdurchschni… [+2954 chars],,de,'Ernte'
https://www.stern.de/gesellschaft/regional/baden-wuerttemberg/landwirtschaft--bauernverband-erwartet-normale-getreideernte-im-suedwesten-34861190.html,https://www.stern.de/gesellschaft/regional/baden-wuerttemberg/landwirtschaft--bauernverband-erwartet-normale-getreideernte-im-suedwesten-34861190.html,0,www.stern.de,Landwirtschaft: Bauernverband erwartet normale Getreideernte im Südwesten,Der Regen der vergangenen Wochen bleibt auch für die Landwirtschaft nicht ohne Folgen. Im Südwesten wird zwar eine weitgehend normale Ernte erwartet. Manchen Feldfrüchten setzt die Nässe aber zu.,https://image.stern.de/34861192/t/FZ/v1/w1440/r1.7778/-/08--ktqlmmquxiv8axw800h600jpeg---c598929cd0c9ae45.jpg,2024-07-08T01:45:36Z,,"Der Regen der vergangenen Wochen bleibt auch für die Landwirtschaft nicht ohne Folgen. Im Südwesten wird zwar eine weitgehend normale Ernte erwartet. Manchen Feldfrüchten setzt die Nässe aber zu.
Tr… [+2486 chars]",,de,'Ernte'
https://www.stern.de/kultur/vorschau--tv-tipps-am-montag-34861350.html,https://www.stern.de/kultur/vorschau--tv-tipps-am-montag-34861350.html,0,www.stern.de,Vorschau: TV-Tipps am Montag,"20:15 Uhr, ZDF, Unter anderen Umständen: Dämonen, Krimi
 Jana Winter (Natalia Wörner) wird von Arne Brauner (Martin Brambach) zu einem Fall gerufen: Die Frau und die Tochter von Arnes Schulfreund Axel Schreiber (Johannes Zeiler), einem Kollegen aus dem Husume…",https://image.stern.de/34861354/t/JJ/v1/w1440/r1.7778/-/08--tv-tipps-am-montag---16-9---spoton-article-1069740.jpg,2024-07-08T04:00:00Z,,"20:15 Uhr, ZDF, Unter anderen Umständen: Dämonen, Krimi
Jana Winter (Natalia Wörner) wird von Arne Brauner (Martin Brambach) zu einem Fall gerufen: Die Frau und die Tochter von Arnes Schulfreund Axe… [+2605 chars]",,de,'Winter'
https://www.transfermarkt.de/trickserei-mit-nuamah-transfer-vollendet-olympique-lyon-auf-dem-weg-zu-rekordausgaben/view/news/440311,https://www.transfermarkt.de/trickserei-mit-nuamah-transfer-vollendet-olympique-lyon-auf-dem-weg-zu-rekordausgaben/view/news/440311,0,www.transfermarkt.de,Olympique Lyon: Trickserei mit Transfer von Ernest Nuamah vollendet,"Was im letzten Sommer jeder vermuten konnte, ist nun unter Dach und Fach: Olympique Lyon hat Ernest Nuamah fest verpflichtet und die Transfer-Trickserei mit Partnerklub RWD Molenbeek vollendet. Der...",https://tmssl.akamaized.net/images/foto/big/ernest-nuamah-olympique-lyonnais-2023-24-1696227912-118146.jpg?lm=1696227930,2024-07-08T05:09:30Z,,"Was im letzten Sommer jeder vermuten konnte, ist nun unter Dach und Fach: Olympique Lyon hat Ernest Nuamah fest verpflichtet und die Transfer-Trickserei mit Partnerklub RWD Molenbeek vollendet. Der g… [+2359 chars]",,de,'Sommer'
https://www.zeit.de/news/2024-07/08/sommerlich-freundlicher-wochenstart,https://www.zeit.de/news/2024-07/08/sommerlich-freundlicher-wochenstart,0,www.zeit.de,Wetter: Sommerlich freundlicher Wochenstart,Hier finden Sie Informationen zu dem Thema „Wetter“. Lesen Sie jetzt „Sommerlich freundlicher Wochenstart“.,https://img.zeit.de/news/2024-07/08/sommerlich-freundlicher-wochenstart-image-group/wide__1300x731,2024-07-08T05:40:37Z,,Am Anfang der neuen Woche zeigt sich der Sommer in Berlin und Brandenburg von seiner besten Seite: Einen warmen und heiteren Montag erwartet der Deutsche Wetterdienst. Ein paar Wolken stehen am Himme… [+908 chars],,de,'Gewitter'
https://www.zeit.de/news/2024-07/08/hochsommerliche-temperaturen-in-baden-wuerttemberg-erwartet,https://www.zeit.de/news/2024-07/08/hochsommerliche-temperaturen-in-baden-wuerttemberg-erwartet,0,www.zeit.de,Wetter: Hochsommerliche Temperaturen in Baden-Württemberg erwartet,Hier finden Sie Informationen zu dem Thema „Wetter“. Lesen Sie jetzt „Hochsommerliche Temperaturen in Baden-Württemberg erwartet“.,https://img.zeit.de/news/2024-07/08/hochsommerliche-temperaturen-in-baden-wuerttemberg-erwartet-image-group/wide__1300x731,2024-07-08T06:59:57Z,,"Bis Mitte der Woche können sich die Menschen in Baden-Württemberg auf freundlicheres Wetter freuen. In den kommenden Tagen bleibt es größtenteils trocken, wie der Deutsche Wetterdienst mitteilte. 
H… [+1529 chars]",,de,'Sommer'
https://www.focus.de/wissen/bauernregel-hundstage-verraten-es-wann-wird-es-diesen-sommer-richtig-heiss_id_260026181.html,https://www.focus.de/wissen/bauernregel-hundstage-verraten-es-wann-wird-es-diesen-sommer-richtig-heiss_id_260026181.html,0,www.focus.de,Bauernregel - Hundstage verraten es: Wann wird es diesen Sommer richtig heiß?,"Die Hundstage 2024 stehen vor der Tür. Doch was steckt eigentlich hinter dieser Redewendung? Mit Hunden hat das Wetterphänomen wenig zu tun. Lesen Sie hier, wann die Hundstage starten und was sie bedeuten.Von FOCUS-online-Autorin Kira Welling",https://p6.focus.de/img/fotos/id_260026233/wetter.jpg?im=Crop%3D%280%2C177%2C2121%2C1060%29%3BResize%3D%281200%2C627%29&impolicy=perceptual&quality=mediumHigh&hash=6502d73de737f166efe569eed683fb7e9f3dd6b0a51f63843346a9bf5b9f563c,2024-07-08T07:39:18Z,,"Die Hundstage 2024 stehen vor der Tür. Doch was steckt eigentlich hinter dieser Redewendung? Lesen Sie hier, wann die Hundstage starten und was sie bedeuten.Im Allgemeinen wird der Begriff Hundstage,… [+2609 chars]",,de,'Ernte'
https://www.zeit.de/news/2024-07/08/endlich-sommer-doch-wetter-bald-wieder-unbestaendig,https://www.zeit.de/news/2024-07/08/endlich-sommer-doch-wetter-bald-wieder-unbestaendig,0,www.zeit.de,Wettervorhersage: Endlich Sommer - doch Wetter bald wieder unbeständig,Hier finden Sie Informationen zu dem Thema „Wettervorhersage“. Lesen Sie jetzt „Endlich Sommer - doch Wetter bald wieder unbeständig“.,https://img.zeit.de/news/2024-07/08/endlich-sommer-doch-wetter-bald-wieder-unbestaendig-image-group/wide__1300x731,2024-07-08T11:41:17Z,,"Endlich bringt der Juli etwas Hochsommer nach Deutschland. An diesem Dienstag werde in fast ganz Deutschland dank heißer nordafrikanischer Luft die 30-Grad-Marke erreicht, teilte der Deutsche Wetterd… [+1958 chars]",,de,'Sommer'
https://steiermark.orf.at/stories/3264285/,https://steiermark.orf.at/stories/3264285/,0,steiermark.orf.at,Enorme Ernteausfälle durch Extremwetter,Vor einem Monat sind zahlreiche Äcker in der Steiermark durch Starkregenfälle überflutet worden. Gemeinsam mit den Frostschäden im April spricht die Hagelversicherung mittlerweile von landwirtschaftlichen Schäden in der Höhe von 45 Mio. Euro.,https://ibs.orf.at/stm?image=https%3A%2F%2Foekastatic.orf.at%2Fmims%2F2024%2F28%2F94%2Fcrops%2Fw%3D1200%2Ch%3D627%2Cq%3D75%2F2271804_master_864094_20240708_092457.jpg%3Fs%3Dff8be04fccd370ac2f9ef1c7c592f53775940ee6,2024-07-08T12:01:00Z,,"Wir hatten heuer den wärmsten Jänner, den wärmsten Februar und den wärmsten März der Messgeschichte. Und die Apfelblüte war um drei Wochen früher als im Jahr 2023. Das Problem war dann der Kaltwetter… [+2218 chars]",,de,'Ernte'
https://www.focus.de/sport/fussball/em/gleich-zwei-nationalspieler-wollen-nach-der-em-heiraten_id_260118455.html,https://www.focus.de/sport/fussball/em/gleich-zwei-nationalspieler-wollen-nach-der-em-heiraten_id_260118455.html,0,www.focus.de,Einer schon zum zweiten Mal - Gleich zwei Nationalspieler wollen nach der EM heiraten,Der EM-Traum ist für die deutschen Fußballstars geplatzt. Warum der Sommer 2024 für zwei Nationalspieler dennoch unvergesslich wird.,https://p6.focus.de/img/fotos/id_260118893/david-und-katharina-raum-und-kai-havertz-mit-sophia-weber.jpg?im=Crop%3D%280%2C100%2C3200%2C1600%29%3BResize%3D%281200%2C627%29&impolicy=perceptual&quality=mediumHigh&hash=bfa336e54419c623d9284f4ba1447d5a4294be57e3f6cf2e50084e21631d3263,2024-07-08T12:47:58Z,,"Am Freitag, den 5. Juli, erlitt die deutsche Nationalmannschaft im Rahmen der Europameisterschaft 2024 eine herbe 2:1-Niederlage gegen die Spanier. Damit ist die Hoffnung auf einen EM-Sieg DFB-Team G… [+1602 chars]",,de,'Sommer'
https://www.welt.de/regionales/hamburg/article252413612/Luebeck-Passionierter-Start-in-den-Festivalsommer.html,https://www.welt.de/regionales/hamburg/article252413612/Luebeck-Passionierter-Start-in-den-Festivalsommer.html,0,www.welt.de,Passionierter Start in den Festivalsommer,Das Eröffnungskonzert des Schleswig-Holstein Musik Festival mit dem NDR Elbphilharmonie Orchester unter Leitung von Alan Gilbert wurde in der Musik- und Kongresshalle Lübeck im Zusammenspiel mit dem Pianisten Emanuel Ax zum Ereignis.,https://img.welt.de/img/regionales/hamburg/mobile252413956/4897936247-ci16x9-w1200/Eroeffnungskonzert-K1-Schleswig-Holstein-Musik-Festival-06-07-24.jpg,2024-07-08T13:11:37Z,,Das Eröffnungskonzert des Schleswig-Holstein Musik Festival mit dem NDR Elbphilharmonie Orchester unter Leitung von Alan Gilbert wurde in der Musik- und Kongresshalle Lübeck im Zusammenspiel mit dem … [+4034 chars],,de,'Sommer'
https://www.bild.de/news/ausland/urlauber-aufgepasst-experten-warnen-vor-super-kakerlaken-auf-mallorca-668b845e18c33d086d7bc94f,https://www.bild.de/news/ausland/urlauber-aufgepasst-experten-warnen-vor-super-kakerlaken-auf-mallorca-668b845e18c33d086d7bc94f,0,www.bild.de,Experten warnen - „Super-Kakerlaken“ erobern Mallorca,Urlauber aufgepasst: Das beliebteste Reiseland der Deutschen hat ein Problem mit „Super-Kakerlaken“. In Spanien droht eine dramatische Ausbreitung.,"https://images.bild.de/668b845e18c33d086d7bc94f/0337fef750d5d926fd5c07c73ae1a991,ea74f366?w=1280",2024-07-08T13:18:24Z,,"Urlauber aufgepasst: Das beliebteste Reiseland der Deutschen hat ein Problem mit mutierten Super-Kakerlaken. In Spanien droht eine dramatische Ausbreitung der ekelerregenden Krabbeltiere.
Die Sommer… [+1998 chars]",,de,'Sommer'
https://www.morgenpost.de/panorama/article406751222/quallenalarm-im-urlaub-studie-warnt-vor-steigender-population.html,https://www.morgenpost.de/panorama/article406751222/quallenalarm-im-urlaub-studie-warnt-vor-steigender-population.html,0,www.morgenpost.de,Quallenalarm im Urlaub? Studie warnt vor steigender Population,Urlauber an der Nord- und Ostsee stoßen häufig auf glibbrige Meeresbewohner. Laut einer Studie könnten diese in Zukunft noch mehr werden.,https://img.sparknews.funkemedien.de/406751228/406751228_1720444763_v16_9_1600.jpeg,2024-07-08T13:19:23Z,,"Berlin. Urlauber an der Nord- und Ostsee stoßen häufig auf glibbrige Meeresbewohner. Laut einer Studie könnten diese in Zukunft noch mehr werden. 
Zur Urlaubssaison zieht es viele Menschen ans Meer.… [+2976 chars]",,de,'Laub'
https://www.stern.de/digital/technik/sommer-aktion-bei-kleines-kraftwerk--bis-zu-25-prozent-sparen-34861726.html,https://www.stern.de/digital/technik/sommer-aktion-bei-kleines-kraftwerk--bis-zu-25-prozent-sparen-34861726.html,0,www.stern.de,Kleines Kraftwerk: Sonnige Sommer-Aktion? Bis zu 25 Prozent Rabatt auf Balkonkraftwerke,Die volle Ladung Sonne im Sommer in eigenen Strom verwandeln? Mit der Sommer-Aktion bei dem Anbieter Kleines Kraftwerk gibt es derzeit bis zu 25 Prozent Rabatt auf Balkonkraftwerke. Lohnen sich die Angebote?,https://image.stern.de/34861728/t/vH/v3/w1440/r1.7778/-/sommer-aktion-kk.jpg,2024-07-08T13:38:00Z,,Die volle Ladung Sonne im Sommer in eigenen Strom verwandeln? Mit der Sommer-Aktion bei dem Anbieter Kleines Kraftwerk gibt es derzeit bis zu 25 Prozent Rabatt auf Balkonkraftwerke. Lohnen sich die A… [+4122 chars],,de,'Sommer'
https://www.zeit.de/news/2024-07/08/getreideernte-in-thueringen-hat-begonnen,https://www.zeit.de/news/2024-07/08/getreideernte-in-thueringen-hat-begonnen,0,www.zeit.de,Vor allem Wintergerste: Getreideernte in Thüringen hat begonnen,Hier finden Sie Informationen zu dem Thema „Vor allem Wintergerste“. Lesen Sie jetzt „Getreideernte in Thüringen hat begonnen“.,https://img.zeit.de/news/2024-07/08/getreideernte-in-thueringen-hat-begonnen-image-group/wide__1300x731,2024-07-08T14:01:48Z,,"Thüringens Bauern bringen die Getreideernte ein. Betriebe vor allem in der Region Nordhausen, im Altenburger Land und im Unstrut Hainich-Kreis seien jetzt mit den Mähdreschern unterwegs. «Die Ernte h… [+2601 chars]",,de,'Winter'
https://www.stern.de/gesellschaft/regional/thueringen/vor-allem-wintergerste--getreideernte-in-thueringen-hat-begonnen-34863394.html,https://www.stern.de/gesellschaft/regional/thueringen/vor-allem-wintergerste--getreideernte-in-thueringen-hat-begonnen-34863394.html,0,www.stern.de,Vor allem Wintergerste: Getreideernte in Thüringen hat begonnen,"Erfurt (th) - Thüringens Bauern bringen die Getreideernte ein. Betriebe vor allem in der Region Nordhausen, im Altenburger Land und im Unstrut",https://image.stern.de/34863396/t/gi/v1/w1440/r1.7778/-/08--7k7tg57ybyv23axw800h600jpeg---528b02f1262a09a9.jpg,2024-07-08T14:01:48Z,,"Auf 370 000 Hektar in Thüringen wächst Wintergetreide. Nun sind die Mähdrescher am Start.
Thüringens Bauern bringen die Getreideernte ein. Betriebe vor allem in der Region Nordhausen, im Altenburger… [+2065 chars]",,de,'Winter'
https://www.focus.de/sport/fussball/em/em-kolumne-von-pit-gottschalk-nach-nagelsmanns-grosser-wm-ansage-habe-ich-drei-personalfragen_id_260118994.html,https://www.focus.de/sport/fussball/em/em-kolumne-von-pit-gottschalk-nach-nagelsmanns-grosser-wm-ansage-habe-ich-drei-personalfragen_id_260118994.html,0,www.focus.de,EM-Kolumne von Pit Gottschalk - Nach Nagelsmanns großer WM-Ansage habe ich drei Personalfragen,"Der Bundestrainer überraschte unseren EM-Kolumnisten mit der Ankündigung, dass Deutschland „in zwei Jahren Weltmeister wird“. Es gab keine Relativierung, keinen Konjunktiv - er hat das so gemeint. Dann muss er aber im Sommer auch harte Personalentscheidungen …",https://p6.focus.de/img/fotos/id_260119439/julian-nagelsmann.png?im=Crop%3D%280%2C13%2C1476%2C738%29%3BResize%3D%281200%2C627%29&impolicy=perceptual&quality=mediumHigh&hash=7bd1537a63afa7a5b0a4a63ad6e538040b36837e9b73efa280a9564ef16b90e3,2024-07-08T14:07:55Z,,"Der Bundestrainer überraschte unseren EM-Kolumnisten mit der Ankündigung, dass Deutschland in zwei Jahren Weltmeister wird. Es gab keine Relativierung, keinen Konjunktiv - er hat das so gemeint. Dann… [+3641 chars]",,de,'Sommer'
https://www.stern.de/gesellschaft/regional/bayern/klimawandel--hat-der-kirschanbau-in-franken-eine-zukunft--34864452.html,https://www.stern.de/gesellschaft/regional/bayern/klimawandel--hat-der-kirschanbau-in-franken-eine-zukunft--34864452.html,0,www.stern.de,Klimawandel: Hat der Kirschanbau in Franken eine Zukunft?,"Frost im Frühling, Hagel im Sommer: Die Ernte eines Jahres ist für Kirschbauern schnell ruiniert. Und wie sollen sie auf den Klimawandel reagieren, wenn Wetterextreme noch häufiger drohen?",https://image.stern.de/34864454/t/pQ/v1/w1440/r1.7778/-/09--m477lrj5nav5axw800h600jpeg---ae99aeb49b1f7d8e.jpg,2024-07-09T02:15:37Z,,"Frost im Frühling, Hagel im Sommer: Die Ernte eines Jahres ist für Kirschbauern schnell ruiniert. Und wie sollen sie auf den Klimawandel reagieren, wenn Wetterextreme noch häufiger drohen?
Der Kirsc… [+5923 chars]",,de,'Ernte'
