index,url,valid,domain,title,description,image,published,archive,content,quote,language,keyword
https://www.stern.de/gesellschaft/regional/berlin-brandenburg/waldbrandsaison--fruehling-zu-trocken---bislang-125-waldbraende-35785892.html,https://www.stern.de/gesellschaft/regional/berlin-brandenburg/waldbrandsaison--fruehling-zu-trocken---bislang-125-waldbraende-35785892.html,0,www.stern.de,Waldbrandsaison: Frühling zu trocken - Bislang 125 Waldbrände,Das Frühjahr war viel zu trocken - Brandenburg meldet bislang 125 Waldbrände. Wie schlimm entwickelt sich die Waldbrandsaison noch? Nach Pfingsten soll die Gefahr wieder steigen.,https://image.stern.de/35785894/t/wP/v1/w1440/r1.7778/-/05--dgwqmy5gkfv30axs2048jpeg---c597936b6c1fa914.jpg,2025-06-05T13:37:59Z,,"Kopiere den aktuellen Link
Zur Merkliste hinzufügen
Das Frühjahr war viel zu trocken - Brandenburg meldet bislang 125 Waldbrände. Wie schlimm entwickelt sich die Waldbrandsaison noch? Nach Pfingste… [+1663 chars]",,de,'Frühling'
https://scilogs.spektrum.de/natur-des-glaubens/der-solarwende-monat-mai-2025-zwischen-wasserkrise-und-hitzesommer/,https://scilogs.spektrum.de/natur-des-glaubens/der-solarwende-monat-mai-2025-zwischen-wasserkrise-und-hitzesommer/,0,scilogs.spektrum.de,Der Solarwende-Monat Mai 2025 zwischen Wasserkrise und Hitzesommer,"Die meisten Landkarten “lügen”, weil sie die Erdoberfläche als flach und die Flüsse und Seen als stabil darstellen. Doch in der Realität erhitzen sich die Gebirgsregionen etwa doppelt so schnell wie das Flachland, beginnen auch …",https://scilogs.spektrum.de/natur-des-glaubens/files/IMG_9535-scaled.jpeg,2025-06-05T13:47:18Z,,"Die meisten Landkarten “lügen”, weil sie die Erdoberfläche als flach und die Flüsse und Seen als stabil darstellen. Doch in der Realität erhitzen sich die Gebirgsregionen etwa doppelt so schnell wie … [+5145 chars]",,de,'Sommer'
https://www.zeit.de/news/2025-06/06/geschuetzter-schaedling-bedroht-hessische-ernte,https://www.zeit.de/news/2025-06/06/geschuetzter-schaedling-bedroht-hessische-ernte,0,www.zeit.de,Landwirtschaft: Geschützter Schädling bedroht hessische Ernte,Hier finden Sie Informationen zu dem Thema „Landwirtschaft“. Lesen Sie jetzt „Geschützter Schädling bedroht hessische Ernte“.,https://img.zeit.de/news/2025-06/06/geschuetzter-schaedling-bedroht-hessische-ernte-image-group/wide__1300x731,2025-06-06T02:15:39Z,,"Hessen hat ein Zikaden-Problem. Die Schilf-Glasflügelzikade (Pentastiridius leporinus) trägt Bakterien zu Kartoffeln, Zuckerrüben und anderen Nutzpflanzen. Die Ernteausfälle sind massiv, wie aus eine… [+5100 chars]",,de,'Ernte'
https://www.autobild.de/artikel/kfz-versicherung-bei-sturmschaeden-wer-zahlt-was--1241305.html,https://www.autobild.de/artikel/kfz-versicherung-bei-sturmschaeden-wer-zahlt-was--1241305.html,0,www.autobild.de,"Wer zahlt bei Sturm, Hagel oder Hochwasser","Sturm, Hagel und Überschwemmung: Im Sommer häufen sich die Unwetterschäden am Auto. Doch was genau zahlt die Kfz-Versicherung – und wann bleibt man auf den Kosten sitzen?",https://i.auto-bild.de/ir_img/6/6/8/0/4/7/Unwetter-in-Berlin---Ein-Kleinwagen-schwimmt-am-29-06-2017-in-Oranienburg-2869-1200x675-d1bf9d355a110133.jpg?impolicy=og_images,2025-06-06T08:58:00Z,,"Über 330 Autoversicherungen im Vergleich
Vergleichen Sie kostenlos und schließen Sie Ihre Kfz-Versicherung direkt online ab.",,de,'Hochwasser'
https://www.stern.de/gesellschaft/regional/nordrhein-westfalen/hochwasserkatastrophe-2021--untersuchungsausschuss-flut--defizite-und-versaeumnisse-35788744.html,https://www.stern.de/gesellschaft/regional/nordrhein-westfalen/hochwasserkatastrophe-2021--untersuchungsausschuss-flut--defizite-und-versaeumnisse-35788744.html,0,www.stern.de,Hochwasserkatastrophe 2021: Untersuchungsausschuss Flut: Defizite und Versäumnisse,Der NRW-Untersuchungsausschuss zur tödlichen Jahrhundertflut im Juli 2021 nähert sich seinem Ende. Ein Berichtsentwurf des sozialdemokratischen Vorsitzenden listet viele Mängel und Vorschläge auf.,https://image.stern.de/35788746/t/nh/v1/w1440/r1.7778/-/06--tgot3v5fzkv21axs2048jpeg---840177c15461722a.jpg,2025-06-06T10:56:52Z,,"Kopiere den aktuellen Link
Zur Merkliste hinzufügen
Der NRW-Untersuchungsausschuss zur tödlichen Jahrhundertflut im Juli 2021 nähert sich seinem Ende. Ein Berichtsentwurf des sozialdemokratischen V… [+2687 chars]",,de,'Hochwasser'
https://www.zeit.de/news/2025-06/06/untersuchungsausschuss-flut-defizite-und-versaeumnisse,https://www.zeit.de/news/2025-06/06/untersuchungsausschuss-flut-defizite-und-versaeumnisse,0,www.zeit.de,Hochwasserkatastrophe 2021: Untersuchungsausschuss Flut: Defizite und Versäumnisse,Hier finden Sie Informationen zu dem Thema „Hochwasserkatastrophe 2021“. Lesen Sie jetzt „Untersuchungsausschuss Flut: Defizite und Versäumnisse“.,https://img.zeit.de/news/2025-06/06/untersuchungsausschuss-flut-defizite-und-versaeumnisse-image-group/wide__1300x731,2025-06-06T10:56:52Z,,Der Untersuchungsausschuss des nordrhein-westfälischen Landtags zur Jahrhundertflut 2021 hat gravierende Ursachen für den mangelhaften Schutz der Bevölkerung zusammengetragen. In einem vom Ausschussv… [+2475 chars],,de,'Hochwasser'
https://www.morgenpost.de/berlin/article409204992/verhandlungen-mit-buendnispartnern-ohne-einsicht.html,https://www.morgenpost.de/berlin/article409204992/verhandlungen-mit-buendnispartnern-ohne-einsicht.html,0,www.morgenpost.de,Verhandlungen mit Bündnispartnern ohne Einsicht,Für Katzen ist der Frühling alles andere als eine romantische Zeit. Jörg Thadeusz über Mörder mit eckigen Ohren.,https://img.sparknews.funkemedien.de/405438422/405438422_1703852119_v16_9_1600.jpeg,2025-06-07T04:00:00Z,,Berlin. Für Katzen ist der Frühling alles andere als eine romantische Zeit. Jörg Thadeusz über Mörder mit eckigen Ohren.,,de,'Frühling'
https://www.n-tv.de/ratgeber/Olivenbaum-Sieben-Tipps-fuer-den-Urlaubstraum-im-eigenen-Garten-article25814760.html,https://www.n-tv.de/ratgeber/Olivenbaum-Sieben-Tipps-fuer-den-Urlaubstraum-im-eigenen-Garten-article25814760.html,0,www.n-tv.de,Mediterrane Pflanze: Olivenbaum: Sieben Tipps für den Urlaubstraum im eigenen Garten,Mediterranes Feeling im Garten oder auf dem Balkon gewünscht? Ein Olivenbaum gedeiht auch hierzulande gut. Aber er braucht weit mehr als nur Sonne - die Dos and Don'ts bei der Pflege.,https://www.n-tv.de/img/incoming/crop25814774/9501329522-cImg_16_9-w1200/imago761149808.jpg,2025-06-07T17:29:49Z,,"Mediterranes Feeling im Garten oder auf dem Balkon gewünscht? Ein Olivenbaum gedeiht auch hierzulande gut. Aber er braucht weit mehr als nur Sonne - die Dos and Don'ts bei der Pflege.
Wer seinen Som… [+6116 chars]",,de,'Laub'
https://www.stern.de/genuss/yuzu-highball---dieser-highball-koennte-sogar-dem-gin-tonic-den-rang-ablaufen-34609014.html,https://www.stern.de/genuss/yuzu-highball---dieser-highball-koennte-sogar-dem-gin-tonic-den-rang-ablaufen-34609014.html,0,www.stern.de,Hunter Yuzu: Dieser Highball könnte sogar dem Gin&Tonic den Rang ablaufen,"Dieser Frühling schmeckt nach Yuzu. Die Frucht der Stunde ist erfrischend, leicht herb und passt fantastisch zu Alkohol. Dieser Drink könnte den nächsten Highball-Trend auslösen.",https://image.stern.de/34609016/t/Iz/v4/w1440/r1.7778/-/yuzu-hunter-high2815.jpg,2025-06-07T18:46:00Z,,"Kopiere den aktuellen Link
Zur Merkliste hinzufügen
Dieser Frühling schmeckt nach Yuzu. Die Frucht der Stunde ist erfrischend, leicht herb und passt fantastisch zu Alkohol. Dieser Drink könnte den … [+2316 chars]",,de,'Frühling'
https://www.fitforfun.de/news/ewige-ernte-ein-gemuese-musst-du-nur-einmal-im-garten-anpflanzen-748349.html,https://www.fitforfun.de/news/ewige-ernte-ein-gemuese-musst-du-nur-einmal-im-garten-anpflanzen-748349.html,0,www.fitforfun.de,Ewige Ernte: Ein Gemüse musst du nur einmal im Garten anpflanzen,"Du möchtest ein Gemüse im Garten anpflanzen, das du unkompliziert lange ernten kannst? Dann haben wir genau das richtige für dich!","https://www.fitforfun.de/files/images/202505/1/total-einfach-ein-gemuese-musst-du-nur-einmal-im-garten-anpflanzen-und-kannst-es-ewig-ernten-636369740,753076_3x2_n.jpg",2025-06-08T08:42:00Z,,"Nicht jeder Hobbygärtner hat einen grünen Daumen. Dann ist es besonders schwierig, die Pflanzen im Garten und auf dem Balkon zum Blühen zu bringen. Wer allerdings pflegeleichte Sorten aussät, erhöht … [+470 chars]",,de,'Ernte'
https://www.nzz.ch/wirtschaft/der-roboter-soll-die-blumen-und-tomaten-pfluecken-den-bauern-gehen-die-erntehelfer-aus-ld.1886610,https://www.nzz.ch/wirtschaft/der-roboter-soll-die-blumen-und-tomaten-pfluecken-den-bauern-gehen-die-erntehelfer-aus-ld.1886610,0,www.nzz.ch,Der Roboter soll die Blumen und Tomaten pflücken: Den Bauern gehen die Erntehelfer aus,"Erntearbeit ist streng und monoton. Das sind gute Voraussetzungen, um Menschen durch Roboter zu ersetzen. In den Niederlanden passiert das bereits im kleinen Massstab. Die Forscher haben grosse Pläne.","https://img.nzz.ch/2025/06/02/581b1350-50b9-4183-afda-03b2832bb48d.jpeg?width=1200&height=675&fit=bounds&quality=75&auto=webp&crop=5760,3240,x0,y0&wmark=nzz",2025-06-09T03:30:00Z,,"Polnische Saisonarbeiter stechen in Deutschland Spargeln: eine strenge Arbeit, für die eine niederländische Firma einen Roboter entwickelt hat.
Bis zum 24. Juni ist noch Spargelsaison, eine schöne Z… [+7438 chars]",,de,'Ernte'
https://www.bild.de/leben-wissen/wissenschaft/baeume-in-not-darum-faerben-sich-die-blaetter-jetzt-schon-gelb-684696586e8f4710ff28f15f,https://www.bild.de/leben-wissen/wissenschaft/baeume-in-not-darum-faerben-sich-die-blaetter-jetzt-schon-gelb-684696586e8f4710ff28f15f,0,www.bild.de,Bäume bereits im Herbst-Modus - Warum färben sich die Blätter jetzt schon gelb?,"Gelbes Laub, kahle Äste, fallende Blätter – obwohl der Sommer nicht mal angefangen hat, sieht es an manchen Orten schon aus, als wäre der Herbst eingezogen.","https://images.bild.de/684696586e8f4710ff28f15f/e9d765efa34a9153d5c5d0deb56f64fa-landscape,da76cb8a?w=1280",2025-06-09T10:30:30Z,,"Um den TTS Player darzustellen, brauchen wir deine Zustimmung. 
 externen Inhalt aktivieren Um eingebettete Inhalte anzuzeigen, ist Ihre jederzeit widerrufliche Einwilligung (über den Schalter oder … [+2330 chars]",,de,'Herbst'
https://www.tagesschau.de/wirtschaft/ernteausfaelle-pflanzenkrankheit-100.html,https://www.tagesschau.de/wirtschaft/ernteausfaelle-pflanzenkrankheit-100.html,0,www.tagesschau.de,Pflanzenkrankheit sorgt für massive Ernteausfälle,"Erst die Zuckerrüben, nun auch Kartoffeln und anderes Gemüse: Eine Pflanzenkrankheit sorgt in Teilen Deutschlands für massive Einbußen bei der Ernte. Schuld an der Krankheit ist eine Zikaden-Art. Der Bauernverband ist in ""großer Sorge"".",https://images.tagesschau.de/image/07ba7a34-8e3c-49ba-9276-122d7dbe4824/AAABl1RPIWQ/AAABkZLhkrw/16x9-1280/ernte-138.jpg,2025-06-09T11:14:32Z,,"Stand: 09.06.2025 13:14 Uhr
Erst die Zuckerrüben, nun auch Kartoffeln und anderes Gemüse: Eine Pflanzenkrankheit sorgt in Teilen Deutschlands für massive Probleme. Schuld an der Krankheit ist eine Z… [+3036 chars]",,de,'Ernte'
https://www.morgenpost.de/ratgeber-wissen/article409220917/kartoffel-in-gefahr-neuer-schaedling-wird-zum-ernte-killer.html,https://www.morgenpost.de/ratgeber-wissen/article409220917/kartoffel-in-gefahr-neuer-schaedling-wird-zum-ernte-killer.html,0,www.morgenpost.de,Kartoffel in Gefahr? Neuer Schädling wird zum Ernte-Killer,"Winzig klein, doch verheerend: Die Schilf-Glasflügelzikade breitet sich aus – und gefährdet die Ernte. Wird Gemüse jetzt teurer?",https://img.sparknews.funkemedien.de/409219726/409219726_1749470129_v16_9_1600.jpeg,2025-06-09T11:55:23Z,,"Berlin. Winzig klein, doch verheerend: Die Schilf-Glasflügelzikade breitet sich aus und gefährdet die Ernte. Wird Gemüse jetzt teurer?
Eine unscheinbare Zikade versetzt die deutsche Landwirtschaft i… [+4304 chars]",,de,'Ernte'
https://www.morgenpost.de/panorama/article409232660/suedafrika-wird-von-schneegestoeber-ueberrascht-strassen-gesperrt.html,https://www.morgenpost.de/panorama/article409232660/suedafrika-wird-von-schneegestoeber-ueberrascht-strassen-gesperrt.html,0,www.morgenpost.de,Südafrika wird von Schneegestöber überrascht – Straßen gesperrt,Schnee gibt es in Südafrika eigentlich nur in den Bergen. Nun überraschte die weiße Masse auch in tieferen Lagen und sorgt für Chaos.,https://img.sparknews.funkemedien.de/409232663/409232663_1749595422_v16_9_1600.jpeg,2025-06-10T22:43:42Z,,"Johannesburg. Schnee gibt es in Südafrika eigentlich nur in den Bergen. Nun überraschte die weiße Masse auch in tieferen Lagen und sorgt für Chaos. 
Schnee, Stürme und Starkregen haben Teile von Süd… [+2431 chars]",,de,'Schnee'
https://www.stern.de/familie/fadenalgen-bekaempfen--effektive-methoden-und-produkte-fuer-den-teich-35802446.html,https://www.stern.de/familie/fadenalgen-bekaempfen--effektive-methoden-und-produkte-fuer-den-teich-35802446.html,0,www.stern.de,Gartenpflege: Fadenalgen bekämpfen: So wird Ihr Teich im Sommer wieder klar,"Wenn Fadenalgen den Teich überwuchern, hilft nur gezieltes Eingreifen – mit Wissen, Geduld und den richtigen Mitteln.",https://image.stern.de/35802448/t/sl/v2/w1440/r1.7778/-/fadenalgen-bekaempfen.jpg,2025-06-12T10:00:00Z,,"Kopiere den aktuellen Link
Zur Merkliste hinzufügen
Wenn Fadenalgen den Teich überwuchern, hilft nur gezieltes Eingreifen mit Wissen, Geduld und den richtigen Mitteln.
Der Gartenteich, einst ein O… [+7251 chars]",,de,'Sommer'
https://www.freitag.de/autoren/nick-reimer/waldzustandsbericht-2024-die-tage-der-fichten-sind-gezaehlt,https://www.freitag.de/autoren/nick-reimer/waldzustandsbericht-2024-die-tage-der-fichten-sind-gezaehlt,0,www.freitag.de,Waldzustandsbericht 2024: Die Tage der Fichten sind gezählt,"Der neue Bundeslandwirtschaftsminister Alois Rainer lädt in den Tegeler Forst, um die Krankenakten der deutschen Baumarten zu verlesen. Und um seine Sicht der Dinge auf die Waldnutzung zu erläutern Der Tegeler Forst ist das, was sie in Berlin unter „Wald“ ver…",https://www.freitag.de/autoren/nick-reimer/waldzustandsbericht-2024-die-tage-der-fichten-sind-gezaehlt/@@images/image/great,2025-06-12T15:41:00Z,,"Der Tegeler Forst ist das, was sie in Berlin unter „Wald“ verstehen: Die 2.169 Hektar große Fläche wird von der Autobahn A111 zerschnitten. Vor dem Forstamt Tegel donnert die nie endende Blechkolonne… [+4184 chars]",,de,'Laub'
