index,url,valid,domain,title,description,image,published,archive,content,quote,language,keyword
https://www.tagesspiegel.de/gesellschaft/panorama/kann-klirrend-kalt-werden-wo-in-deutschland-heute-schnee-glatteis-und-minusgrade-erwartet-werden-13189057.html,https://www.tagesspiegel.de/gesellschaft/panorama/kann-klirrend-kalt-werden-wo-in-deutschland-heute-schnee-glatteis-und-minusgrade-erwartet-werden-13189057.html,0,www.tagesspiegel.de,"„Kann klirrend kalt werden“: Wo in Deutschland heute Schnee, Glatteis und Minusgrade erwartet werden",Der Kampf zweier Druckgebiete beschert uns den Meteorologen zufolge in den kommenden Tagen einige Zentimeter Neuschnee. Wo es heute und morgen schneien könnte und wo Glatteis erwartet wird.,https://www.tagesspiegel.de/images/13191079/alternates/BASE_16_9_W1400/1739370041000/winter-in-niedersachsen.jpeg,2025-02-12T15:38:33Z,,"Winter im Norden, Herbst im Süden? Für die kommenden Tage erwarten die Meteorologen des Deutschen Wetterdienstes (DWD) in der Nordhälfte des Landes klirrend kaltes Winterwetter mit Schneefall, währen… [+4089 chars]",,de,'Schnee'
https://www.faz.net/aktuell/feuilleton/buecher/autoren/sir-simon-schama-wird-80-ein-historiker-der-schreibt-wie-gemalt-110292403.html,https://www.faz.net/aktuell/feuilleton/buecher/autoren/sir-simon-schama-wird-80-ein-historiker-der-schreibt-wie-gemalt-110292403.html,0,www.faz.net,"Simon Schama 80: Ein Historiker, der schreibt wie gemalt","Auf den Herbst des Mittelalters folgte ein zweiter Frühling der Kulturgeschichte, mit Vorlauf im Fernsehen: Zum achtzigsten Geburtstag von Sir Simon Schama.",https://media0.faz.net/ppmedia/aktuell/2075607368/1.10293262/facebook_teaser/als-fernsehhistoriker.jpg,2025-02-12T18:08:04Z,http://archive.md/20250213092318/https://www.faz.net/aktuell/feuilleton/buecher/autoren/sir-simon-schama-wird-80-ein-historiker-der-schreibt-wie-gemalt-110292403.html,"Das Buch aus dem Jahr 1987, das den englischen Historiker Simon Schama berühmt machte, ist ein Bravourstück. Die Interpretation der holländischen Kultur im Goldenen Zeitalter, die der Untertitel in A… [+5871 chars]",,de,'Herbst'
https://www.bild.de/leben-wissen/wissenschaft/glatteis-im-winter-wie-die-rutschigen-strassen-entstehen-675afd5f9bc4f841b20d2e5d,https://www.bild.de/leben-wissen/wissenschaft/glatteis-im-winter-wie-die-rutschigen-strassen-entstehen-675afd5f9bc4f841b20d2e5d,0,www.bild.de,Gefahr auf den Straßen - Wie entsteht eigentlich Glatteis?,"Vorsicht, Rutschgefahr! Eisige Temperaturen haben Deutschland fest im Griff. Wie Glatteis entsteht und wie gefährlich es ist, lesen Sie hier.","https://images.bild.de/675afd5f9bc4f841b20d2e5d/e0e9df87c6a5a663423b7ece010b860a,2f5d1c7b?w=1280",2025-02-12T20:23:19Z,,"Aufgepasst: Gefährlich, glatte Straßen!
Glatteis ist unsichtbar, tückisch und schnell da. Im Winter kann das einige Gefahren mit sich bringen. Doch wie entsteht Glatteis eigentlich?
Lesen Sie hier,… [+3154 chars]",,de,'Glatteis'
https://www.urlaubspiraten.de/pauschalreisen/alkyonari-by-anna-chalkidiki,https://www.urlaubspiraten.de/pauschalreisen/alkyonari-by-anna-chalkidiki,0,www.urlaubspiraten.de,Frühling auf Chalkidiki ☀️,"Ahoi Piraten! Ich erinnere mich noch ganz genau daran, wie ich vor 8 Jahren das erste Mal am Strand von Chalkidiki stand und dachte: Wow, das sieht hier ja aus wie in der Karibik, weil das Wasser SO KLAR war! Das Ganze war im April, wo das Wetter vor Ort sc…",https://image.urlaubspiraten.de/720/image/upload/v1603286924/mediavault_images/ojhxf9q1quocp6fshek0.jpg,2025-02-13T11:30:00Z,,"Ahoi Piraten! 
Ich erinnere mich noch ganz genau daran, wie ich vor 8 Jahren das erste Mal am Strand von Chalkidiki stand und dachte: Wow, das sieht hier ja aus wie in der Karibik, weil das Wasser S… [+823 chars]",,de,'Frühling'
https://www.stern.de/gesellschaft/regional/rheinland-pfalz-saarland/14--februar--welche-blumen-zum-valentinstag--35464290.html,https://www.stern.de/gesellschaft/regional/rheinland-pfalz-saarland/14--februar--welche-blumen-zum-valentinstag--35464290.html,0,www.stern.de,14. Februar: Welche Blumen zum Valentinstag?,Rote Rosen sind der Klassiker. Ungeachtet der winterlichen Jahreszeit werden zum Valentinstag gerne Blumen verschenkt. Worauf man beim Kauf achten sollte.,https://image.stern.de/35464292/t/wz/v1/w1440/r1.7778/-/13--lkb3ognxcsv9axs2048jpeg---2155415b97b2377f.jpg,2025-02-13T12:49:26Z,,"Kopiere den aktuellen Link
Zur Merkliste hinzufügen
Rote Rosen sind der Klassiker. Ungeachtet der winterlichen Jahreszeit werden zum Valentinstag gerne Blumen verschenkt. Worauf man beim Kauf achte… [+2476 chars]",,de,'Winter'
https://www.stern.de/gesellschaft/regional/niedersachsen-bremen/blumengeschaefte-machen-umsatz--florist---valentin-ist-nicht-mehr-reiner-maennergeschenktag--35464458.html,https://www.stern.de/gesellschaft/regional/niedersachsen-bremen/blumengeschaefte-machen-umsatz--florist---valentin-ist-nicht-mehr-reiner-maennergeschenktag--35464458.html,0,www.stern.de,"Blumengeschäfte machen Umsatz: Florist: ""Valentin ist nicht mehr reiner Männergeschenktag""","Am 14. Februar beschenken vor allem junge Männer ihre Liebsten mit einem Strauß Rosen oder Frühlingsblumen. Allerdings ist der Tag der Liebe im Wandel, beobachtet ein Florist.",https://image.stern.de/35464460/t/40/v1/w1440/r1.7778/-/13--psoirtn22xv5axs2048jpeg---810d91bc3914a40a.jpg,2025-02-13T13:13:55Z,,"Kopiere den aktuellen Link
Zur Merkliste hinzufügen
Am 14. Februar beschenken vor allem junge Männer ihre Liebsten mit einem Strauß Rosen oder Frühlingsblumen. Allerdings ist der Tag der Liebe im W… [+2461 chars]",,de,'Frühling'
https://www.telepolis.de/features/Vergiftete-Rosen-oder-Was-schenke-ich-zum-Valentinstag-10280672.html,https://www.telepolis.de/features/Vergiftete-Rosen-oder-Was-schenke-ich-zum-Valentinstag-10280672.html,0,www.telepolis.de,Vergiftete Rosen oder: Was schenke ich zum Valentinstag?,"Rosen mit Fairtrade-Siegel sind nicht automatisch die bessere Wahl: Viele Pestizide im Anbau, miserable Arbeitsbedingungen. Zu Schnittblumen im Winter gibt es ohnehin bessere Alternativen.",https://heise.cloudimg.io/bound/1200x1200/q85.png-lossy-85.webp-lossy-85.foil1/_www-heise-de_/imgs/18/4/8/0/0/4/5/3/rosen-herz_1-4df934fa0c5f5fc5.jpeg,2025-02-13T14:00:00Z,,"Bild Rosen: wallerichmercie / Shutterstock.com / Grafik: TP
Rosen mit Fairtrade-Siegel sind nicht automatisch die bessere Wahl: Viele Pestizide im Anbau, miserable Arbeitsbedingungen. Zu Schnittblum… [+9250 chars]",,de,'Winter'
https://kaernten.orf.at/stories/3293157/,https://kaernten.orf.at/stories/3293157/,0,kaernten.orf.at,Pollensaison startet immer früher,Vor wenigen Tagen hat der Pollenwarndienst des Landes eine erste Prognose zum Pollenflug veröffentlicht. So erreichten die Frühblüher Hasel und Grau-Erle vielerorts die volle Blühbereitschaft und können bereits große Pollenmengen freisetzen. Der Pollenflug se…,https://ibs.orf.at/ktn?image=https%3A%2F%2Foekastatic.orf.at%2Fmims%2F2025%2F07%2F20%2Fcrops%2Fw%3D1200%2Ch%3D627%2Cq%3D75%2F2520191_master_965320_kh_insert_pollensaison_2502xx_00_01_10_13.jpg%3Fs%3Dbbe46c6ecbb23e47e18dade3a80247879873db8b,2025-02-13T14:57:16Z,,"Symptome einer Pollenallergie sind unter anderem Niesreiz, eine laufende Nase, tränende Augen, Husten oder Atembeschwerden. Aktuell treten diese Beschwerden wieder vermehrt auf. Dass der Pollenflug i… [+3709 chars]",,de,'Hasel'
https://www.morgenpost.de/berlin/article408303490/berlinale-2025-eroeffnet-mit-botschaften-von-liebe-und-boykott.html,https://www.morgenpost.de/berlin/article408303490/berlinale-2025-eroeffnet-mit-botschaften-von-liebe-und-boykott.html,0,www.morgenpost.de,Berlinale eröffnet mit Botschaften von Liebe und Boykott,"Ambivalente Stimmung bei der Eröffnung der Berlinale 2025. Was die Stars und Politiker über Wahlen, Filme, Mode und den Schnee sagten.",https://img.sparknews.funkemedien.de/408303515/408303515_1739482072_v16_9_1600.jpeg,2025-02-13T21:22:25Z,,"Berlin. Ambivalente Stimmung bei der Eröffnung der Berlinale 2025. Was die Stars und Politiker über Wahlen, Filme, Mode und den Schnee sagten.
Alle, alle waren sie gekommen zur Berlinale-Eröffnung: … [+6239 chars]",,de,'Schnee'
https://www.morgenpost.de/berlin/article408305290/berlin-polizei-feuerwehr-news-blaulicht-meldungen-aktuell-1302-alexanderplatz-raub.html,https://www.morgenpost.de/berlin/article408305290/berlin-polizei-feuerwehr-news-blaulicht-meldungen-aktuell-1302-alexanderplatz-raub.html,0,www.morgenpost.de,Mann will Streit in Neukölln schlichten und wird angegriffen,"In Mitte erlitt ein Mann eine Stichverletzung, in Moabit nahmen die Polizei einen Dealer fest. Die Blaulicht-News im Blog.",https://img.sparknews.funkemedien.de/408259211/408259211_1739027132_v16_9_1600.jpeg,2025-02-14T09:48:38Z,,"Berlin. In Mitte erlitt ein Mann eine Stichverletzung, in Moabit nahmen die Polizei einen Dealer fest. Die Blaulicht-News im Blog.
<ul><li>Jugendliche auf dem Alexanderplatz bedroht und beraubt</li>… [+9681 chars]",,de,'Laub'
https://www.focus.de/politik/briefing/focus-chefredakteur-georg-meck-olaf-scholz-hat-fertig-der-mann-ist-durch_id_260721778.html,https://www.focus.de/politik/briefing/focus-chefredakteur-georg-meck-olaf-scholz-hat-fertig-der-mann-ist-durch_id_260721778.html,0,www.focus.de,"FOCUS-Chefredakteur Georg Meck - Olaf Scholz hat fertig, der Mann ist durch","""Ohne eine freie, unabhängige Presse gibt es keine Demokratie.“ Ein wahrer Satz, ein hoher Anspruch. Gesprochen hat ihn der Kanzler anlässlich des 75-jährigen Jubiläums der Deutschen Journalistenschule 2024. Schön wäre es freilich, wenn derlei Sonntagsreden a…",https://p6.focus.de/img/regional/berlin/id_260714018/kanzler-olaf-scholz-spd-will-einen-gerechten-frieden-fuer-die-ukraine-..jpg?im=Crop%3D%280%2C170%2C2048%2C1024%29%3BResize%3D%281200%2C627%29&impolicy=perceptual&quality=mediumHigh&hash=e34061655596caa768759e4d982cc45391d11ad5d1701bc804f7d6871949f73a,2025-02-14T10:47:54Z,,"""Ohne eine freie, unabhängige Presse gibt es keine Demokratie. Ein wahrer Satz, ein hoher Anspruch. Gesprochen hat ihn der Kanzler anlässlich des 75-jährigen Jubiläums der Deutschen Journalistenschul… [+2985 chars]",,de,'Erle'
https://kaernten.orf.at/stories/3293297/,https://kaernten.orf.at/stories/3293297/,0,kaernten.orf.at,Arbeiter aus Tank geborgen,"Die Feuerwehren Kühnsdorf und Peratschitzen haben am Freitag einen verletzten Arbeiter in Kohldorf bei Kühnsdorf aus einem Öltank befreit. Er hatte Reinigungsarbeiten durchgeführt, rutschte vermutlich von der Leiter und verletzte sich an der Schulter.",https://ibs.orf.at/ktn?image=https%3A%2F%2Foekastatic.orf.at%2Fmims%2F2025%2F07%2F54%2Fcrops%2Fw%3D1200%2Ch%3D627%2Cq%3D75%2F2521273_master_965754_480242096_1060097352825536_7086815749598370080_n.jpg%3Fs%3Dd718068e9c4eba954fe5a14527d1b6de61aa2fe1,2025-02-14T11:11:22Z,,"Michael Kodal von der Feuerwehr Kühnsdorf sagte gegenüber dem ORF, der Mann sei zur Reinigung in den Tank gestiegen und abgerutscht. Er konnte sich nicht mehr selbst befreien. Vorsichtig wurde der Ve… [+881 chars]",,de,'Schnee'
https://www.sueddeutsche.de/muenchen/muenchen-anschlag-auto-demo-verletzte-taeter-islamistisches-motiv-liveblog-li.3201601,https://www.sueddeutsche.de/muenchen/muenchen-anschlag-auto-demo-verletzte-taeter-islamistisches-motiv-liveblog-li.3201601,0,www.sueddeutsche.de,Ermittler sehen „islamistische Tatmotivation“ und sprechen von 36 Verletzten,"Zwei Menschen schweben in Lebensgefahr, darunter ein zweijähriges Mädchen. Gegen den 24-jährigen Tatverdächtigen aus Afghanistan soll Haftbefehl wegen Mordversuchs beantragt werden. Die neuen Erkenntnisse der Polizei.",https://www.sueddeutsche.de/2025/02/14/c46a4abe-1e13-4ed6-b670-9b5e95f125bb.jpeg?q=60&fm=webp&width=1200&rect=0%2C386%2C2254%2C1267,2025-02-14T11:12:00Z,http://archive.md/20250214111353/https://www.sueddeutsche.de/muenchen/muenchen-anschlag-auto-demo-verletzte-taeter-islamistisches-motiv-liveblog-li.3201601,"Am Freitagvormittag sind Bundespräsident Frank-Walter Steinmeier, Bayerns Ministerpräsident Markus Söder (CSU) und Münchens Oberbürgermeister Dieter Reiter (SPD) zu einem stillen Gedenken am Tatort z… [+968 chars]",,de,'Erle'
https://www.sueddeutsche.de/muenchen/freizeitmesse-free-camping-caravan-reisen-trends-tipps-li.3196567,https://www.sueddeutsche.de/muenchen/freizeitmesse-free-camping-caravan-reisen-trends-tipps-li.3196567,0,www.sueddeutsche.de,Reise- und Freizeitmesse in München: Was Besucher auf der „Free“ entdecken können,"Auf der Münchner Freizeitmesse Free bekommt man Rat für den Wohnmobil-Ausbau, den Fahrradkauf und bei der Urlaubsplanung. Es gibt aber auch Tipps, für die Erholungssuchende gar nicht weit verreisen müssen.",https://www.sueddeutsche.de/2025/02/12/d59c9b68-2f51-4241-86b8-d5ddab77eb56.jpeg?q=60&fm=webp&width=1200&rect=0%2C216%2C4000%2C2250,2025-02-14T11:48:21Z,,"Wohin die Reise 2025 geht, wissen rund ein Drittel der Deutschen laut einer Umfrage noch nicht. Genau hier kann die Messe Abhilfe leisten. Auf der Free kann man sich fünf Tage lang ausführlich zu den… [+7185 chars]",,de,'Schnee'
https://www.tagesspiegel.de/kultur/schnee-in-der-philharmonie-die-berliner-philharmoniker-erinnern-an-schonheit-und-bedrohung-der-natur-13205140.html,https://www.tagesspiegel.de/kultur/schnee-in-der-philharmonie-die-berliner-philharmoniker-erinnern-an-schonheit-und-bedrohung-der-natur-13205140.html,0,www.tagesspiegel.de,Schnee in der Philharmonie: Die Berliner Philharmoniker erinnern an Schönheit und Bedrohung der Natur,"„Paradise lost?“ fragt die diesjährige Biennale der Berliner Philharmoniker. Zum Auftaktkonzert dirigiert David Robertson Werke von Varèse, Srnka – und Beethovens Pastorale",https://www.tagesspiegel.de/images/13205191/alternates/BASE_16_9_W1400/1739534730000/david-robertson.jpeg,2025-02-14T12:38:25Z,http://archive.md/20250214143059/https://www.tagesspiegel.de/kultur/schnee-in-der-philharmonie-die-berliner-philharmoniker-erinnern-an-schonheit-und-bedrohung-der-natur-13205140.html,"Die Natur ist nicht nett es ist der Mensch, der ihr Eigenschaften zuschreibt, sie reflektiert, er- und verklärt. Anlässe, über dieses Verhältnis von Kultur und Natur nachzudenken, gab es viele am Don… [+4516 chars]",,de,'Schnee'
https://www.tagesspiegel.de/berlin/schneefrei-in-prenzlauer-berg-berliner-gymnasium-schickt-schuler-nach-hause-13205425.html,https://www.tagesspiegel.de/berlin/schneefrei-in-prenzlauer-berg-berliner-gymnasium-schickt-schuler-nach-hause-13205425.html,0,www.tagesspiegel.de,Schneefrei in Prenzlauer Berg: Berliner Gymnasium schickt Schüler nach Hause,"Der Neuschnee sorgt nicht nur im Verkehr für viele Unfälle, er stellt auch ein Gymnasium in Prenzlauer Berg vor Probleme. Am Heinrich-Schliemann-Gymnasium haben die Schüler am Freitag winterfrei.",https://www.tagesspiegel.de/images/13205470/alternates/BASE_16_9_W1400/1739536372000/symbolfoto-schnee-winter-verschneites-auto-in-friedenau-tempelhof-schoneberg-berlin-deutschland.jpeg,2025-02-14T13:07:11Z,,"Hitzefrei im Sommer, Schneefrei im Winter? In Prenzlauer Berg hat der Neuschnee den Schülern eines Gymnasiums einen unterrichtsfreien Tag beschert. Nach Informationen des Tagesspiegel wurden die Schü… [+2172 chars]",,de,'Schnee'
https://www.tagesspiegel.de/berlin/schnee-schnee-und-nochmal-schnee-das-sind-die-schonen-seiten-des-berliner-winters-13203787.html,https://www.tagesspiegel.de/berlin/schnee-schnee-und-nochmal-schnee-das-sind-die-schonen-seiten-des-berliner-winters-13203787.html,0,www.tagesspiegel.de,"Schnee, Schnee und nochmal Schnee: Das sind die schönen Seiten des Berliner Winters",Berliner Winterzauber: Eine dicke Schneedecke hüllt die Stadt ein. Die schönsten Eindrücke vom ersten (richtigen) Schnee in diesem Jahr.,https://www.tagesspiegel.de/images/13204180/alternates/BASE_16_9_W1400/1739529284000/schneegestober2025.jpeg,2025-02-14T13:07:13Z,http://archive.md/20250215095317/https://www.tagesspiegel.de/berlin/schnee-schnee-und-nochmal-schnee-das-sind-die-schonen-seiten-des-berliner-winters-13203787.html,"Was sich viele für Weihnachten gewünscht haben, wird mit etwas Verspätung im Februar doch noch wahr: Seit Donnerstagabend rieselt der Schnee leise über Berlin und hüllt die Stadt in Weiß. Der Blick a… [+3750 chars]",,de,'Schnee'
https://www.morgenpost.de/bezirke/pankow/article408308971/schnee-alarm-fuehrt-zu-schulschliessung-in-prenzlauer-berg.html,https://www.morgenpost.de/bezirke/pankow/article408308971/schnee-alarm-fuehrt-zu-schulschliessung-in-prenzlauer-berg.html,0,www.morgenpost.de,Schnee-Alarm führt zu Schulschließung in Prenzlauer Berg,"Weil nach einer verschneiten Nacht die Räumung von Schnee und Eis nicht gelang, fällt an Schulen in Prenzlauer Berg der Unterricht aus.",https://img.sparknews.funkemedien.de/408309140/408309140_1739539473_v16_9_1600.jpeg,2025-02-14T13:24:34Z,,"Berlin. Weil nach einer verschneiten Nacht die Räumung von Schnee und Eis nicht gelang, fällt an Schulen in Prenzlauer Berg der Unterricht aus.
Kein Unterricht wegen Eis und Schnee diese Ansage über… [+3335 chars]",,de,'Schnee'
https://www.stern.de/gesellschaft/regional/berlin-brandenburg/schneefall-und-glaette--weisser-zauber-ueber-brandenburg---viele-unfaelle-im-land-35468150.html,https://www.stern.de/gesellschaft/regional/berlin-brandenburg/schneefall-und-glaette--weisser-zauber-ueber-brandenburg---viele-unfaelle-im-land-35468150.html,0,www.stern.de,Schneefall und Glätte: Weißer Zauber über Brandenburg - Viele Unfälle im Land,Der Winter hat sich in Brandenburg mit viel Schnee und deutlichen Minusgraden breit gemacht. In vielen Teilen des Landes kam es zu Rutschpartien - leider auch auf den Straßen.,https://image.stern.de/35468152/t/WZ/v1/w1440/r1.7778/-/14--j64vbc3qivv4axs2048jpeg---31ea40f8414a4c17.jpg,2025-02-14T13:38:35Z,,"Kopiere den aktuellen Link
Zur Merkliste hinzufügen
Der Winter hat sich in Brandenburg mit viel Schnee und deutlichen Minusgraden breit gemacht. In vielen Teilen des Landes kam es zu Rutschpartien … [+2966 chars]",,de,'Schnee'
https://www.tagesspiegel.de/berlin/schneefall-und-glatte-weisser-zauber-uber-brandenburg-viele-unfalle-im-land-13206166.html,https://www.tagesspiegel.de/berlin/schneefall-und-glatte-weisser-zauber-uber-brandenburg-viele-unfalle-im-land-13206166.html,0,www.tagesspiegel.de,Schneefall und Glätte: Weißer Zauber über Brandenburg - Viele Unfälle im Land,Der Winter hat sich in Brandenburg mit viel Schnee und deutlichen Minusgraden breit gemacht. In vielen Teilen des Landes kam es zu Rutschpartien - leider auch auf den Straßen.,https://www.tagesspiegel.de/images/13206163/alternates/BASE_16_9_W1400/1739540370000/feldhase-im-oderbruch.jpeg,2025-02-14T13:39:30Z,,"Der plötzliche Schneefall hat weite Teile Brandenburgs in eine dicke Schneedecke gehüllt. Das Wetter lud zahlreiche Spaziergänger zu Ausflügen ein, Kinder fuhren auf Schlitten kleinere Hügel hinab, i… [+3505 chars]",,de,'Schnee'
https://www.stern.de/gesellschaft/regional/berlin-brandenburg/stoerungen-im-flugverkehr--viele-verspaetungen-wegen-schneemassen-am-berliner-flughafen-35466470.html,https://www.stern.de/gesellschaft/regional/berlin-brandenburg/stoerungen-im-flugverkehr--viele-verspaetungen-wegen-schneemassen-am-berliner-flughafen-35466470.html,0,www.stern.de,Störungen im Flugverkehr: Viele Verspätungen wegen Schneemassen am Berliner Flughafen,Berlin/Schönefeld (bb) - Nach kräftigen Schneefällen in der Nacht zu Freitag ist es am Berliner Flughafen zu erheblichen Verzögerungen im Flugverkehr,https://image.stern.de/35466472/t/Vx/v2/w1440/r1.7778/-/14--h32pvfaj6uv7axs2048jpeg---df59f4e83916715a.jpg,2025-02-14T13:56:34Z,,"Kopiere den aktuellen Link
Zur Merkliste hinzufügen
Stundenlang schneite es. Auf den Startbahnen lag ungewöhnlich viel Schnee - mit einer besonders schwierigen Konsistenz. Die Räumung brauchte Zeit… [+1356 chars]",,de,'Schnee'
https://www.stern.de/gesellschaft/regional/berlin-brandenburg/wetter--viel-freude-und-etwas-leid-durch-schnee-und-eis-in-berlin-35466796.html,https://www.stern.de/gesellschaft/regional/berlin-brandenburg/wetter--viel-freude-und-etwas-leid-durch-schnee-und-eis-in-berlin-35466796.html,0,www.stern.de,Wetter: Viel Freude und etwas Leid durch Schnee und Eis in Berlin,Starker Schneefall sorgte für echtes Wintergefühl in Berlin. Spaziergänger genossen die weiße Landschaft. Einige Autofahrer landeten auf Straßenbahnschienen.,https://image.stern.de/35468370/t/dZ/v1/w1440/r1.7778/-/14--c52o6b64brv1axs2048jpeg---941063b4ef77cd78.jpg,2025-02-14T14:05:44Z,,"Kopiere den aktuellen Link
Zur Merkliste hinzufügen
Starker Schneefall sorgte für echtes Wintergefühl in Berlin. Spaziergänger genossen die weiße Landschaft. Einige Autofahrer landeten auf Straßenb… [+3393 chars]",,de,'Schnee'
https://www.autobild.de/videos/armin-schwarz-rally-driving-experience-27876807.html,https://www.autobild.de/videos/armin-schwarz-rally-driving-experience-27876807.html,0,www.autobild.de,Rallye-Schule im Schnee,"Die Kontrolle auf Eis und Schnee behalten, Kurven gezielt im Drift nehmen. Das können Autofahrer bei den Rallye-Profis Armin und Fabio Schwarz lernen.",https://i.auto-bild.de/ir_img/3/8/9/8/5/7/3/yaris_gr-2f6a929b29a930e4.jpg?impolicy=og_images,2025-02-14T14:22:00Z,,"Neuzulassungen Januar 2025: Top Ten
Die zehn beliebtesten Autos im Januar",,de,'Schnee'
https://www.tagesspiegel.de/sport/toptorschutze-ist-rechtzeitig-fit-benedict-hollerbach-ist-mehr-als-nur-unions-nummer-eins-im-angriff-13205605.html,https://www.tagesspiegel.de/sport/toptorschutze-ist-rechtzeitig-fit-benedict-hollerbach-ist-mehr-als-nur-unions-nummer-eins-im-angriff-13205605.html,0,www.tagesspiegel.de,Toptorschütze ist rechtzeitig fit: Benedict Hollerbach ist mehr als nur Unions Nummer eins im Angriff,"Gegen Hoffenheim erzielte Hollerbach einen Doppelpack und verletzte sich leicht. Der Stürmer hat zwar weiterhin deutliche Schwächen, ist für den 1. FC Union Berlin aber unverzichtbar.",https://www.tagesspiegel.de/images/13205626/alternates/BASE_16_9_W1400/1739537316000/fussball-bundesliga-tsg-1899-hoffenheim-1-fc-union-berlin.jpeg,2025-02-14T15:21:15Z,http://archive.md/20250215113403/https://www.tagesspiegel.de/sport/toptorschutze-ist-rechtzeitig-fit-benedict-hollerbach-ist-mehr-als-nur-unions-nummer-eins-im-angriff-13205605.html,"Benedict Hollerbach war dick vermummt, stapfte aber fröhlich durch den Schnee. Am Donnerstag und Freitag konnte der Offensivspieler des 1. FC Union Berlin wieder mit seinen Kollegen trainieren und au… [+5976 chars]",,de,'Schnee'
https://www.stern.de/panorama/wetter--wintervergnuegen-in-der-hauptstadt-35468770.html,https://www.stern.de/panorama/wetter--wintervergnuegen-in-der-hauptstadt-35468770.html,0,www.stern.de,Wetter: Wintervergnügen in der Hauptstadt,Berlin - Zum ersten Mal in diesem Winter erlebt die Hauptstadt richtig viel Schnee. Weiß statt Wintergrau - das begeistert Kinder und Spaziergänger,https://image.stern.de/35468772/t/zn/v1/w1440/r1.7778/-/14--oleo4iaodpv5axs2048jpeg---dad2434cf04a6670.jpg,2025-02-14T15:42:13Z,,"Kopiere den aktuellen Link
Zur Merkliste hinzufügen
Selten ist Berlin so weiß wie an diesem Valentinstag. Starker Schneefall sorgt für echtes Wintergefühl.
Zum ersten Mal in diesem Winter erlebt d… [+968 chars]",,de,'Winter'
https://www.tagesspiegel.de/gesellschaft/panorama/wetter-wintervergnugen-in-der-hauptstadt-13207678.html,https://www.tagesspiegel.de/gesellschaft/panorama/wetter-wintervergnugen-in-der-hauptstadt-13207678.html,0,www.tagesspiegel.de,Wetter: Wintervergnügen in der Hauptstadt,Selten ist Berlin so weiß wie an diesem Valentinstag. Starker Schneefall sorgt für echtes Wintergefühl.,https://www.tagesspiegel.de/images/13207675/alternates/BASE_16_9_W1400/1739547793000/schnee-in-berlin.jpeg,2025-02-14T15:43:14Z,,Zum ersten Mal in diesem Winter erlebt die Hauptstadt richtig viel Schnee. Weiß statt Wintergrau - das begeistert Kinder und Spaziergänger gleichermaßen. Am östlichen Stadtrand wurden schon am Vormit… [+1570 chars],,de,'Schnee'
https://kaernten.orf.at/stories/3293349/,https://kaernten.orf.at/stories/3293349/,0,kaernten.orf.at,Viel zu wenig Niederschlag,"Der Schnee, der in den vergangenen Stunden in Kärnten gefallen ist, ändert nichts daran, dass der heurige Winter viel zu trocken war. Laut Messungen fehlen von Dezember bis Februar 50 Prozent der sonst üblichen Niederschläge, im November sogar 70 Prozent. Doc…",https://ibs.orf.at/ktn?image=https%3A%2F%2Foekastatic.orf.at%2Fmims%2F2025%2F07%2F35%2Fcrops%2Fw%3D1200%2Ch%3D627%2Cq%3D75%2F2521691_master_965935_20250214_120043.jpg%3Fs%3D9a013856f0709c5f613ca996613ca038ba38a8e9,2025-02-14T15:44:23Z,,"Es ist viel zu trocken in diesem Winter, sagen Experten. Der Schnee am Freitag war zu wenig, um die Statistik zu retten. Wie die aussieht, erklärt Paul Rainer von der GeoSphere Austria: Wir hatten in… [+1645 chars]",,de,'Schnee'
https://www.stern.de/kultur/timoth%C3%A9e-chalamet--wie-er-die-herzen-der-berlinale-eroberte-35469044.html,https://www.stern.de/kultur/timoth%C3%A9e-chalamet--wie-er-die-herzen-der-berlinale-eroberte-35469044.html,0,www.stern.de,Filmfestspiele Berlin: Liebesgrüße aus dem Schnee: Wie Timothée Chalamet die Herzen der Berlinale erobert,Hoher Berlinale-Besuch am Valentinstag: Hollywoods neuer Kronprinz Timothée Chalamet stellte seinen Bob-Dylan-Film vor. Und nahm sich viel Zeit für die bibbernden Fans.,https://image.stern.de/35468948/t/DC/v3/w1440/r1.7778/-/timoth%C3%A9e-chalamet-auf-der-berlinale.jpg,2025-02-14T18:03:00Z,,"Kopiere den aktuellen Link
Zur Merkliste hinzufügen
Hoher Berlinale-Besuch am Valentinstag: Hollywoods neuer Kronprinz Timothée Chalamet stellte seinen Bob-Dylan-Film vor. Und nahm sich viel Zeit f… [+478 chars]",,de,'Schnee'
