index,url,valid,domain,title,description,image,published,archive,content,quote,language,keyword
https://www.stern.de/gesellschaft/regional/baden-wuerttemberg/winter--feldberg-startet-puenktlich-in-die-skisaison--34248378.html,https://www.stern.de/gesellschaft/regional/baden-wuerttemberg/winter--feldberg-startet-puenktlich-in-die-skisaison--34248378.html,0,www.stern.de,Winter: Feldberg startet pünktlich in die Skisaison,Am 1493 Meter hohen Feldberg im Schwarzwald sollen wieder die Lifte rattern. Schnee gibt es genug. Auch an anderen Orten im Land kann Ski gefahren werden - und das Wetter soll erst einmal mitspielen.,https://image.stern.de/34248600/t/l0/v1/w1440/r1.7778/-/01--urnnewsmldpacom2009010123120199141082v3w800h600l640t425r1920b1275jpeg---4ac3cf567847b678.jpg,2023-12-01T04:13:03Z,https://web.archive.org/web/20231201043716/https://www.stern.de/gesellschaft/regional/baden-wuerttemberg/winter--feldberg-startet-puenktlich-in-die-skisaison--34248378.html,Am 1493 Meter hohen Feldberg im Schwarzwald sollen wieder die Lifte rattern. Schnee gibt es genug. Auch an anderen Orten im Land kann Ski gefahren werden - und das Wetter soll erst einmal mitspielen.… [+1779 chars],,de,'Schnee'
https://www.zeit.de/news/2023-12/01/im-harz-oeffnen-erste-ski-und-rodellifte,https://www.zeit.de/news/2023-12/01/im-harz-oeffnen-erste-ski-und-rodellifte,0,www.zeit.de,Wintersport: Im Harz öffnen erste Ski- und Rodellifte,Hier finden Sie Informationen zu dem Thema „Wintersport“. Lesen Sie jetzt „Im Harz öffnen erste Ski- und Rodellifte“.,https://img.zeit.de/news/2023-12/01/im-harz-oeffnen-erste-ski-und-rodellifte-image-group/wide__1300x731,2023-12-01T05:53:37Z,,Der Harz startet am Wochenende in die Wintersportsaison. Zeitgleich mit vielen Skigebieten in den Alpen sollen am Samstag vielerorts die ersten Lifte fahren. «Wir haben etwa 40 Zentimeter reinen Natu… [+2301 chars],,de,'Winter'
https://www.stern.de/gesellschaft/regional/niedersachsen-bremen/wintersport--im-harz-oeffnen-erste-ski--und-rodellifte--34248784.html,https://www.stern.de/gesellschaft/regional/niedersachsen-bremen/wintersport--im-harz-oeffnen-erste-ski--und-rodellifte--34248784.html,0,www.stern.de,Wintersport: Im Harz öffnen erste Ski- und Rodellifte,Braunlage (lni) - Der Harz startet am Wochenende in die Wintersportsaison. Zeitgleich mit vielen Skigebieten in den Alpen sollen am Samstag vielerorts die,https://image.stern.de/34248786/t/tN/v1/w1440/r1.7778/-/01--urnnewsmldpacom2009010123120199142108v3w800h600l640t425r1920b1278jpeg---a84872651c20fa4c.jpg,2023-12-01T05:53:37Z,https://web.archive.org/web/20231201065718/https://www.stern.de/gesellschaft/regional/niedersachsen-bremen/wintersport--im-harz-oeffnen-erste-ski--und-rodellifte--34248784.html,"Der Winter hat im Harz Einzug erhalten. Zum 1. Advent können Skifahrer und Rodler im Harz in die neue Schneesaison starten. Wo bereits Lifte laufen.
Der Harz startet am Wochenende in die Wintersport… [+1787 chars]",,de,'Winter'
https://www.n-tv.de/mediathek/videos/wetter/Wetter-bleibt-zum-Wochenausklang-gefaehrlich-fuer-Fahrer-article24569346.html,https://www.n-tv.de/mediathek/videos/wetter/Wetter-bleibt-zum-Wochenausklang-gefaehrlich-fuer-Fahrer-article24569346.html,0,www.n-tv.de,Weißes Adventswochenende voraus: Wetter bleibt zum Wochenausklang gefährlich für Fahrer,"Zum Start in den Dezember legt der Schnee zumindest in Mitteldeutschland eine kurze Pause ein, im Süden und an der Nordseeküste fallen weiter Flocken. Am Wochenende gibt es dann deutschlandweit reichlich Weiß, inklusive gefährlich glatten Straßen.",https://bilder1.n-tv.de/img/incoming/crop24570236/4961325009-cImg_16_9-w1200/436660900.jpg,2023-12-01T05:58:00Z,https://web.archive.org/web/20231201091701/https://www.n-tv.de/mediathek/videos/wetter/Wetter-bleibt-zum-Wochenausklang-gefaehrlich-fuer-Fahrer-article24569346.html,,,de,'Schnee'
https://www.morgenpost.de/berlin/article240691438/wetter-berlin-aktuell-heute-morgen-warnung-schnee-glaette-frost-0112.html,https://www.morgenpost.de/berlin/article240691438/wetter-berlin-aktuell-heute-morgen-warnung-schnee-glaette-frost-0112.html,0,www.morgenpost.de,"Wetter in Berlin: Warnung vor Frost, Schnee und Glätte",Am Freitagmorgen liegen die Temperaturen zwischen -5 und -8 Grad. Wie wird das Wetter heute und morgen? Die News im Wetter-Blog.,https://img.sparknews.funkemedien.de/240691348/240691348_1701411062_v4_3_800.jpeg,2023-12-01T06:00:00Z,https://web.archive.org/web/20231201153549/https://www.morgenpost.de/berlin/article240691438/wetter-berlin-aktuell-heute-morgen-warnung-schnee-glaette-frost-0112.html,"Am Freitagmorgen liegen die Temperaturen zwischen -5 und -8 Grad. Wie wird das Wetter heute und morgen? Die News im Wetter-Blog.
<ul><li>Frost, Schnee und glatte Straßen zum Dezemberstart</li><li>Au… [+16679 chars]",,de,'Schnee'
https://www.bild.de/regional/ruhrgebiet/ruhrgebiet-aktuell/winterberg-rauscht-ab-jetzt-machen-die-ersten-lifte-auf-86285940.bild.html,https://www.bild.de/regional/ruhrgebiet/ruhrgebiet-aktuell/winterberg-rauscht-ab-jetzt-machen-die-ersten-lifte-auf-86285940.bild.html,0,www.bild.de,Winterberg rauscht ab - Jetzt machen die ersten Lifte auf!,Jetzt also doch schon. Schneller als gedacht öffnen im Sauerland die ersten Lifte. Ab Freitag 9 Uhr rauscht Winterberg ab!,"https://images.bild.de/65697764f268d169c25647a8/dc1f8f060942017db0c44072c6feeb27,81681338?w=1280",2023-12-01T06:21:13Z,https://web.archive.org/web/20231201131821/https://www.bild.de/regional/ruhrgebiet/ruhrgebiet-aktuell/winterberg-rauscht-ab-jetzt-machen-die-ersten-lifte-auf-86285940.bild.html,"Winterberg (NRW) Jetzt also doch schon. Schneller als gedacht öffnen im Sauerland die ersten Lifte. Ab Freitag 9 Uhr rauscht Winterberg ab!
Nach dem frühen Wintereinbruch will das Skiliftkarussell W… [+992 chars]",,de,'Winter'
https://www.zeit.de/news/2023-12/01/schnee-und-glaette-zum-wochenendstart-in-thueringen,https://www.zeit.de/news/2023-12/01/schnee-und-glaette-zum-wochenendstart-in-thueringen,0,www.zeit.de,Wetter: Schnee und Glätte zum Wochenendstart in Thüringen,Hier finden Sie Informationen zu dem Thema „Wetter“. Lesen Sie jetzt „Schnee und Glätte zum Wochenendstart in Thüringen“.,https://img.zeit.de/news/2023-12/01/schnee-und-glaette-zum-wochenendstart-in-thueringen-image-group/wide__1300x731,2023-12-01T06:32:10Z,,"Schnee und Glätte erwartet die Menschen in Thüringen am Freitag. Es kommt besonders am Vormittag zu leichtem Schneefall, wie der Deutsche Wetterdienst (DWD) mitteilte. Ab Nachmittag schneit es demnac… [+1409 chars]",,de,'Schnee'
https://www.stern.de/gesellschaft/regional/thueringen/wetter--schnee-und-glaette-zum-wochenendstart-in-thueringen-34248856.html,https://www.stern.de/gesellschaft/regional/thueringen/wetter--schnee-und-glaette-zum-wochenendstart-in-thueringen-34248856.html,0,www.stern.de,Wetter: Schnee und Glätte zum Wochenendstart in Thüringen,"Schnee und Glätte erwartet die Menschen in Thüringen am Freitag. Es kommt besonders am Vormittag zu leichtem Schneefall, wie der Deutsche Wetterdienst (DWD) mitteilte. Ab Nachmittag schneit es demnach nur noch im Thüringer Vogtland. Es tritt Glätte auf, dabei…",https://image.stern.de/34248858/t/AG/v1/w1440/r1.7778/-/01--urnnewsmldpacom2009010123120199142571v3w800h600l640t412r1920b1236jpeg---d61ca7d4be5352ce.jpg,2023-12-01T06:32:10Z,https://web.archive.org/web/20231201171107/https://www.stern.de/gesellschaft/regional/thueringen/wetter--schnee-und-glaette-zum-wochenendstart-in-thueringen-34248856.html,"Schnee und Glätte erwartet die Menschen in Thüringen am Freitag. Es kommt besonders am Vormittag zu leichtem Schneefall, wie der Deutsche Wetterdienst (DWD) mitteilte. Ab Nachmittag schneit es demnac… [+1360 chars]",,de,'Schnee'
https://www.stern.de/gesellschaft/regional/berlin-brandenburg/wetter--frostiger-dezemberstart-in-berlin-und-brandenburg-34248906.html,https://www.stern.de/gesellschaft/regional/berlin-brandenburg/wetter--frostiger-dezemberstart-in-berlin-und-brandenburg-34248906.html,0,www.stern.de,Wetter: Frostiger Dezemberstart in Berlin und Brandenburg,"Zum Dezemberbeginn gibt es in Berlin und Brandenburg weiterhin Frost, Schnee und teilweise Glättegefahr. In den Freitagmorgenstunden liegen die Temperaturen zwischen minus 5 und minus 8 Grad, lokal sinken sie bis auf minus 12 Grad, wie der Deutsche Wetterdien…",https://image.stern.de/34248908/t/zE/v1/w1440/r1.7778/-/01--urnnewsmldpacom2009010123120199142713v3w800h600l640t423r1920b1269jpeg---d98fb630793055cb.jpg,2023-12-01T06:52:53Z,https://web.archive.org/web/20231201084207/https://www.stern.de/gesellschaft/regional/berlin-brandenburg/wetter--frostiger-dezemberstart-in-berlin-und-brandenburg-34248906.html,"Zum Dezemberbeginn gibt es in Berlin und Brandenburg weiterhin Frost, Schnee und teilweise Glättegefahr. In den Freitagmorgenstunden liegen die Temperaturen zwischen minus 5 und minus 8 Grad, lokal s… [+845 chars]",,de,'Schnee'
https://www.faz.net/aktuell/wirtschaft/wohnen/heizen-daemmen-sanieren-wie-sie-ihr-haus-auf-den-winter-vorbereiten-19276744.html,https://www.faz.net/aktuell/wirtschaft/wohnen/heizen-daemmen-sanieren-wie-sie-ihr-haus-auf-den-winter-vorbereiten-19276744.html,0,www.faz.net,"Heizen, dämmen, sanieren: Das Haus auf den Winter vorbereiten","Viele Wege führen zum Energiesparen. Oft sind die Investitionskosten hoch, aber es gibt auch Maßnahmen, die jeder ohne zusätzliche Kosten sofort umsetzen kann.",https://media1.faz.net/ppmedia/aktuell/wirtschaft/3150951040/1.9337885/facebook_teaser_fplus/heizung-aufdrehen-eine.jpg,2023-12-01T09:15:23Z,,"Der Tipp des Fachmanns ist einfach: Vorlauftemperaturen begrenzen, sagt Oliver Petri, Geschäftsführer des eigenen Betriebs Petri Heizung Sanitär in Mühlheim. Zu Hause kann jeder die Vorlauftemperatur… [+940 chars]",,de,'Winter'
https://www.zeit.de/news/2023-12/02/schnee-und-eis-legen-bahnverkehr-im-sueden-bayerns-lahm,https://www.zeit.de/news/2023-12/02/schnee-und-eis-legen-bahnverkehr-im-sueden-bayerns-lahm,0,www.zeit.de,Verkehr: Schnee und Eis legen Bahnverkehr im Süden Bayerns lahm,Hier finden Sie Informationen zu dem Thema „Verkehr“. Lesen Sie jetzt „Schnee und Eis legen Bahnverkehr im Süden Bayerns lahm“.,https://img.zeit.de/news/2023-12/02/schnee-und-eis-legen-bahnverkehr-im-sueden-bayerns-lahm-image-group/wide__1300x731,2023-12-02T02:49:34Z,https://web.archive.org/web/20231203052549/https://www.zeit.de/news/2023-12/02/schnee-und-eis-legen-bahnverkehr-im-sueden-bayerns-lahm,"Schnee und Eis haben auf den Straßen und bei der Bahn im Süden Bayerns für Chaos gesorgt. Zahlreiche Bahnstrecken rund um die Landeshauptstadt München mussten in der Nacht gesperrt werden, wie die De… [+2568 chars]",,de,'Schnee'
https://www.zeit.de/news/2023-12/02/winter-in-nrw-mit-wolken-temperaturen-um-den-gefrierpunkt,https://www.zeit.de/news/2023-12/02/winter-in-nrw-mit-wolken-temperaturen-um-den-gefrierpunkt,0,www.zeit.de,Wetter: Winter in NRW mit Wolken - Temperaturen um den Gefrierpunkt,Hier finden Sie Informationen zu dem Thema „Wetter“. Lesen Sie jetzt „Winter in NRW mit Wolken - Temperaturen um den Gefrierpunkt“.,https://img.zeit.de/news/2023-12/02/winter-in-nrw-mit-wolken-temperaturen-um-den-gefrierpunkt-image-group/wide__1300x731,2023-12-02T09:22:12Z,,Das Winterwetter in Nordrhein-Westfalen hält bis in die neue Woche an. Der Deutsche Wetterdienst (DWD) rechnet am Sonntag mit Tagestemperaturen zwischen null und plus drei Grad und wechselnd bis star… [+671 chars],,de,'Winter'
https://www.zeit.de/news/2023-12/02/bayerns-forstministerin-raet-von-aufenthalten-in-waeldern-ab,https://www.zeit.de/news/2023-12/02/bayerns-forstministerin-raet-von-aufenthalten-in-waeldern-ab,0,www.zeit.de,Schnee: Bayerns Forstministerin rät von Aufenthalten in Wäldern ab,Hier finden Sie Informationen zu dem Thema „Schnee“. Lesen Sie jetzt „Bayerns Forstministerin rät von Aufenthalten in Wäldern ab“.,https://img.zeit.de/news/2023-12/02/bayerns-forstministerin-raet-von-aufenthalten-in-waeldern-ab-image-group/wide__1300x731,2023-12-02T10:45:38Z,https://web.archive.org/web/20231205012653/https://www.zeit.de/news/2023-12/02/bayerns-forstministerin-raet-von-aufenthalten-in-waeldern-ab,Bayerns Forstministerin Michaela Kaniber (CSU) rät angesichts der starken Schneefälle insbesondere in Südostbayern vom Betreten der Wälder ab. Herabfallende Äste oder umstürzende Bäume seien eine Gef… [+451 chars],,de,'Schnee'
https://www.zeit.de/news/2023-12/03/dieb-hinterlaesst-spuren-im-schnee-und-wird-gestellt,https://www.zeit.de/news/2023-12/03/dieb-hinterlaesst-spuren-im-schnee-und-wird-gestellt,0,www.zeit.de,Zittau: Dieb hinterlässt Spuren im Schnee: Und wird gestellt,Hier finden Sie Informationen zu dem Thema „Zittau“. Lesen Sie jetzt „Dieb hinterlässt Spuren im Schnee: Und wird gestellt“.,https://img.zeit.de/news/2023-12/03/dieb-hinterlaesst-spuren-im-schnee-und-wird-gestellt-image-group/wide__1300x731,2023-12-03T12:47:07Z,,"Mithilfe seiner Schuhabdrücke im Schnee hat die Polizei in Zittau einen Dieb gefunden und gestellt. Der 41-Jährige war am Samstagabend in eine Grundschule im Landkreis Görlitz eingebrochen, wie die P… [+583 chars]",,de,'Schnee'
https://www.zeit.de/news/2023-12/03/schnee-und-leicht-steigende-temperaturen-in-sicht,https://www.zeit.de/news/2023-12/03/schnee-und-leicht-steigende-temperaturen-in-sicht,0,www.zeit.de,Wetter: Schnee und leicht steigende Temperaturen in Sicht,Hier finden Sie Informationen zu dem Thema „Wetter“. Lesen Sie jetzt „Schnee und leicht steigende Temperaturen in Sicht“.,https://img.zeit.de/news/2023-12/03/schnee-und-leicht-steigende-temperaturen-in-sicht-image-group/wide__1300x731,2023-12-03T15:53:34Z,,Die neue Woche bringt stellenweise Schnee und Regen sowie leicht steigende Temperaturen nach Rheinland-Pfalz und ins Saarland. Das teilte der Deutsche Wetterdienst (DWD) am Sonntag in Offenbach mit. … [+590 chars],,de,'Schnee'
