index,url,valid,domain,title,description,image,published,archive,content,quote,language,keyword
https://www.diepresse.com/6245555/gas-strom-und-diesel-der-winter-ist-geschafft,https://www.diepresse.com/6245555/gas-strom-und-diesel-der-winter-ist-geschafft,0,www.diepresse.com,"Gas, Strom und Diesel: Der Winter ist geschafft [premium]","Anders als vor einigen Monaten befürchtet, gibt es trotz Wintereinbruchs keine Engpässe bei der Energieversorgung. Warum die Situation entspannter ist und welche Auswirkungen das auf die Preise hat.",https://media.diepresse.com/social_diepresse_magazin_paid/images/uploads_1200/c/b/3/6245555/EE75829C-AFF4-4EA4-B0B9-3F8D2EF16924_v0_h.jpg,2023-02-01T04:32:00Z,,"Anders als vor einigen Monaten befürchtet, gibt es trotz Wintereinbruchs keine Engpässe bei der Energieversorgung. Warum die Situation entspannter ist und welche Auswirkungen das auf die Preise hat.… [+1288 chars]",,de,'Herbst'
https://vorarlberg.orf.at/stories/3192812/,https://vorarlberg.orf.at/stories/3192812/,0,vorarlberg.orf.at,Jagdberg-Gemeinden gründen gemeinsamen Kindergartenverband,"Ab Herbst müssen auch kleine Gemeinden einen ganztägigen Kindergarten anbieten. Weil das für kleine Kommunen besonders schwierig ist, wollen die sechs Jagdberg-Gemeinden jetzt bei der Kinderbetreuung zusammenarbeiten und einen gemeinsamen Ganztags-Kindergarte…",https://ibs.orf.at/vbg?image=https%3A%2F%2Foekastatic.orf.at%2Fmims%2F2020%2F08%2F82%2Fcrops%2Fw%3D1200%2Ch%3D627%2Cq%3D75%2F477825_master_160382_roens.jpg%3Fs%3D18ffeed425dbc8af77ca71dc91ce439601998ad4,2023-02-01T04:38:47Z,,"Am Montag hielten die sechs Jagdberg-gemeinden gleichzeitig am selben Ort in Schlins ihre Gemeindevertretungssitzungen ab. Dabei gaben sie ihre Zustimmung zum Zusammenschluss in einem Verband, um die… [+1388 chars]",,de,'Herbst'
https://www.welt.de/vermischtes/weltgeschehen/article243538259/Amtliche-Warnung-An-der-deutschen-Nordseekueste-droht-eine-Sturmflut.html,https://www.welt.de/vermischtes/weltgeschehen/article243538259/Amtliche-Warnung-An-der-deutschen-Nordseekueste-droht-eine-Sturmflut.html,0,www.welt.de,An der deutschen Nordseeküste droht eine Sturmflut,Das Bundesamt für Seeschifffahrt hat für die deutsche Nordseeküste eine Warnung herausgegeben. Es ist am Mittwoch mit Hochwasser und womöglich auch einer Sturmflut zu rechnen.,https://img.welt.de/img/vermischtes/weltgeschehen/mobile243538257/9331351677-ci16x9-w1200/70-Jahrestag-der-Jahrhundertsturmflut-der-Nordsee.jpg,2023-02-01T09:28:54Z,,"Für die deutsche Nordseeküste besteht am Mittwoch eine Gefahrenlage, auch eine Sturmflut könnte drohen. Wie das Bundesamt für Seeschifffahrt und Hydrographie (BSH) mitteilte, werde das Hochwasser am … [+1021 chars]",,de,'Hochwasser'
https://www.nzz.ch/schweiz/der-wandel-zum-skigebiet-ohne-schnee-ld.1723441,https://www.nzz.ch/schweiz/der-wandel-zum-skigebiet-ohne-schnee-ld.1723441,0,www.nzz.ch,Wenn sich der Schnee rarmacht,"Wegen des regelmässigen Schneemangels versucht das Skigebiet Sattel-Hochstuckli schon lange, seine Gäste mit anderen Angeboten auf den Berg zu locken. Mit Erfolg. Doch nicht alle können davon profitieren.","https://img.nzz.ch/2023/01/27/3f258719-dd5a-4d83-83ca-4bb919e8feaa.jpeg?width=1200&height=675&fit=bound&quality=75&auto=webp&crop=5568,3132,x0,y290&wmark=nzz",2023-02-02T10:30:00Z,http://archive.md/20230202111311/https://www.nzz.ch/schweiz/der-wandel-zum-skigebiet-ohne-schnee-ld.1723441,Über der Bergstation der Gondelbahn in Sattel-Hochstuckli scheint die Sonne. Einzig ein paar kleine Wolken sind an dem sonst blauen Himmel auszumachen. Trotzdem hängt eine neblige Schneewolke über de… [+8626 chars],,de,'Schnee'
https://www.stern.de/gesellschaft/regional/baden-wuerttemberg/bundesliga--streich-vor-wiedersehen-mit-schlotterbeck--wird-immer-besser-33162656.html,https://www.stern.de/gesellschaft/regional/baden-wuerttemberg/bundesliga--streich-vor-wiedersehen-mit-schlotterbeck--wird-immer-besser-33162656.html,0,www.stern.de,Bundesliga: Streich vor Wiedersehen mit Schlotterbeck: Wird immer besser,"Trainer Christian Streich vom SC Freiburg traut seinem früheren Schützling Nico Schlotterbeck bei Borussia Dortmund eine große Zukunft zu. ""Ich glaube, dass er die nächsten Jahre sukzessive noch mal besser wird. Und er ist ja schon sehr gut"", sagte der Coach …",https://image.stern.de/33162658/t/MQ/v1/w1440/r1.7778/-/03--urnnewsmldpacom2009010123020399458485v3w800h600l1085t304r1781b1149jpeg---e4ea21c8452519dd.jpg,2023-02-03T05:11:20Z,,"Trainer Christian Streich vom SC Freiburg traut seinem früheren Schützling Nico Schlotterbeck bei Borussia Dortmund eine große Zukunft zu. ""Ich glaube, dass er die nächsten Jahre sukzessive noch mal … [+1396 chars]",,de,'Laub'
https://www.stern.de/gesellschaft/regional/nordrhein-westfalen/verpflichtung---zu-100-prozent-borusse---gladbach-will-weigl-binden-33162744.html,https://www.stern.de/gesellschaft/regional/nordrhein-westfalen/verpflichtung---zu-100-prozent-borusse---gladbach-will-weigl-binden-33162744.html,0,www.stern.de,"Verpflichtung: ""Zu 100 Prozent Borusse"": Gladbach will Weigl binden","Borussia Mönchengladbachs Sportchef Roland Virkus sieht gute Chancen für eine feste Verpflichtung von Julian Weigl im Sommer. Aktuell ist der Mittelfeldspieler von Benfica Lissabon nur ausgeliehen. ""Wir werden mit Benfica reden. Da arbeiten wir dran. Das ist …",https://image.stern.de/33162746/t/en/v1/w1440/r1.7778/-/03--urnnewsmldpacom2009010123020399458690v3w800h600l839t17r1276b870jpeg---6cfce2ca2afa9b1e.jpg,2023-02-03T05:38:17Z,,"Borussia Mönchengladbachs Sportchef Roland Virkus sieht gute Chancen für eine feste Verpflichtung von Julian Weigl im Sommer. Aktuell ist der Mittelfeldspieler von Benfica Lissabon nur ausgeliehen. ""… [+1288 chars]",,de,'Sommer'
https://www.welt.de/reise/nah/article243568945/Mallorca-Til-Schweiger-und-andere-Prominente-eroeffnen-neue-Hotels.html,https://www.welt.de/reise/nah/article243568945/Mallorca-Til-Schweiger-und-andere-Prominente-eroeffnen-neue-Hotels.html,0,www.welt.de,Mallorcas prominente Hoteliers,Den Winter nutzen viele Hoteliers auf Mallorca für Umbauten und Renovierungen. Statt Schlager und Möwengeschrei kreischt in den Badeorten die Kreissäge. Zugleich wächst die Konkurrenz – dank prominenter Namen. Insel-Liebhaber Til Schweiger ist nur ein Beispie…,https://img.welt.de/img/reise/mobile243575649/8371350857-ci16x9-w1200/Barefoot-Hotel-Mallorca-Portocolom-Til-8.jpg,2023-02-03T06:25:35Z,,"Winter auf Mallorca, das bedeutet neben der Mandelblüte und wohltuenden Sonnentagen vor allem Renovierungen. Unterwegs in Colònia de Sant Jordi, Peguera, Cala Millor oder Sa Coma fällt auf, dass die … [+2901 chars]",,de,'Sommer'
https://www.welt.de/reise/Kreuzfahrt/article243554151/Kreuzfahrt-mit-Micky-Maus-Die-Disney-Dream-kommt-nach-Europa.html,https://www.welt.de/reise/Kreuzfahrt/article243554151/Kreuzfahrt-mit-Micky-Maus-Die-Disney-Dream-kommt-nach-Europa.html,0,www.welt.de,Auf einer Kreuzfahrt mit Micky Maus an Bord,"Die „Disney Dream“ kreuzt in diesem Sommer erstmals in Europa. Vor allem die großen Adults-Only-Bereiche, der Erwachsenenpool und eines der teuersten Essen auf See überraschen – neben den opulent ausgestatteten Kinderclubs. Wir haben das Schiff schon einmal g…",https://img.welt.de/img/reise/mobile243563483/9151352827-ci16x9-w1200/TRV-CRU-DISNEY-SOLO-1-FL.jpg,2023-02-03T06:34:01Z,,"Wer Prinzessin oder Pirat sein will, darf nicht schüchtern sein. Schon beim Betreten der Disney Dream steht ein Empfangskomitee Spalier, das die großen und kleinen Gäste per Mikrofon mit Namen und la… [+8056 chars]",,de,'Sommer'
https://www.n-tv.de/wirtschaft/Zinsexplosion-treibt-Hauskaeufer-in-die-Verzweiflung-article23889408.html,https://www.n-tv.de/wirtschaft/Zinsexplosion-treibt-Hauskaeufer-in-die-Verzweiflung-article23889408.html,0,www.n-tv.de,4 Prozent Leitzinsen im Sommer?: Zinsexplosion treibt Hauskäufer in die Verzweiflung,Die Zentralbanken erhöhen auf breiter Front die Zinsen. Für Hauskäufer rückt der Traum von den eigenen vier Wänden in immer weitere Ferne. Und auch wenn der Immobilienmarkt sich dreht: Zu viel Hoffnung auf rasch sinkende Preise sollten sich Käufer nicht mache…,https://bilder3.n-tv.de/img/incoming/crop23840554/5291322273-cImg_16_9-w1200/390869651.jpg,2023-02-03T07:27:21Z,,Die Zentralbanken erhöhen auf breiter Front die Zinsen. Für Hauskäufer rückt der Traum von den eigenen vier Wänden in immer weitere Ferne. Und auch wenn der Immobilienmarkt sich dreht: Zu viel Hoffnu… [+5553 chars],,de,'Sommer'
