index,url,valid,domain,title,description,image,published,archive,content,quote,language,keyword
https://www.welt.de/reise/nah/article247295034/Urlaub-im-Herbst-Von-Korsika-bis-Zypern-ab-auf-eine-Insel-im-Mittelmeer.html,https://www.welt.de/reise/nah/article247295034/Urlaub-im-Herbst-Von-Korsika-bis-Zypern-ab-auf-eine-Insel-im-Mittelmeer.html,0,www.welt.de,Auf diesen Inseln lässt sich der Sommer verlängern,"Wenn es zu Hause trüb und kalt wird, sehnen sich viele danach, noch einmal Sonne zu tanken, im Meer zu baden und abends entspannt im Freien zu sitzen. Wir geben sechs Tipps für reizvolle Inseln im Mittelmeer, die im Herbst mit angenehmen Luft- und Wassertempe…",https://img.welt.de/img/reise/mobile247300980/0461351007-ci16x9-w1200/GettyImages-149422653.jpg,2023-09-06T06:04:56Z,https://web.archive.org/web/20230906092249/https://www.welt.de/reise/nah/article247295034/Urlaub-im-Herbst-Von-Korsika-bis-Zypern-ab-auf-eine-Insel-im-Mittelmeer.html,"Es sind die landschaftlichen Gegensätze, die Korsika so faszinierend machen. Felsige Küsten und lange Sandstrände wechseln mit imposanten Ketten zahlloser 2000er-Gipfel und der immergrünen Macchia. E… [+5680 chars]",,de,'Herbst'
https://www.focus.de/panorama/wetter-aktuell/wetter-in-deutschland-der-sommer-bleibt-mit-temperaturen-ueber-30-grad_id_54933749.html,https://www.focus.de/panorama/wetter-aktuell/wetter-in-deutschland-der-sommer-bleibt-mit-temperaturen-ueber-30-grad_id_54933749.html,0,www.focus.de,Wetter im Ticker - Der Sommer bleibt mit Temperaturen über 30 Grad,Sommerliches Wetter kehrt nach Deutschland zurück. Nach mehreren Tagen mit schweren Unwettern in weiten Teilen Süddeutschlands folgt die ganze Woche noch einmal deutschlandweit der Spätsommer. Lesen Sie alle News im Ticker.,https://p6.focus.de/img/fotos/id_12492900/urn-newsml-dpa-com-20090101-201001-99-781682-large-4-3.jpg?im=Crop%3D%280%2C100%2C800%2C400%29%3BResize%3D%281200%2C627%29&impolicy=perceptual&quality=mediumHigh&hash=e9d732d97b045bf38dad7ea20cec4670bf3b635b584cc5d8e68077b429d3475a,2023-09-06T06:24:42Z,https://web.archive.org/web/20230906071759/https://www.focus.de/panorama/wetter-aktuell/wetter-in-deutschland-der-sommer-bleibt-mit-temperaturen-ueber-30-grad_id_54933749.html,Sommerliches Wetter kehrt nach Deutschland zurück. Nach mehreren Tagen mit schweren Unwettern in weiten Teilen Süddeutschlands folgt die ganze Woche noch einmal deutschlandweit der Spätsommer. Lesen … [+12557 chars],,de,'Hochwasser'
https://www.golem.de/sonstiges/zustimmung/auswahl.html?from=https://www.golem.de/news/headset-iphone-apps-laufen-direkt-auf-apples-vision-pro-2309-177417.html&referer=https://t.co/0693c77c94,https://www.golem.de/sonstiges/zustimmung/auswahl.html?from=https://www.golem.de/news/headset-iphone-apps-laufen-direkt-auf-apples-vision-pro-2309-177417.html&referer=https://t.co/0693c77c94,0,www.golem.de,Headset: iPhone-Apps laufen direkt auf Apples Vision Pro,"Im Herbst soll Apples Headset Vision Pro einen eigenen App Store bekommen - und iPhone-Apps ohne Änderungen abspielen können. (Vision Pro, Apple)",,2023-09-06T07:27:02Z,https://web.archive.org/web/20230909154702/https://www.golem.de/sonstiges/zustimmung/auswahl.html?from=https:%2F%2Fwww.golem.de%2Fnews%2Fheadset-iphone-apps-laufen-direkt-auf-apples-vision-pro-2309-177417.html&amp;referer=https:%2F%2Ft.co%2F0693c77c94,"Besuchen Sie Golem.de wie gewohnt mit Werbung und Tracking,
 indem Sie der Nutzung aller Cookies zustimmen.
 Details zum Tracking finden Sie im Privacy Center.
Skript wurde nicht geladen. Informat… [+607 chars]",,de,'Herbst'
https://orf.at/stories/3330136/,https://orf.at/stories/3330136/,0,orf.at,Apfelbauern befürchten Minus bei Ernte,,https://orf.at/mojo/1_4_1/storyserver//news/common/images/og-fallback-news.png,2023-09-06T07:52:57Z,https://web.archive.org/web/20230907164041/https://orf.at/stories/3330136/,Im Burgenland ist die Apfelernte bereits in vollem Gang. Nach einem witterungsbedingt schwierigen Frühjahr rechnen die Obstbauern und -bäuerinnen mit rund 20 Prozent weniger Äpfeln als im Vorjahr. Si… [+129 chars],,de,'Ernte'
https://www.zeit.de/news/2023-09/06/eu-klimawandeldienst-sommer-2023-war-so-heiss-wie-nie,https://www.zeit.de/news/2023-09/06/eu-klimawandeldienst-sommer-2023-war-so-heiss-wie-nie,0,www.zeit.de,Wissenschaft: EU-Klimawandeldienst: Sommer 2023 war so heiß wie nie,,,2023-09-06T08:01:56Z,,"When browsing with ads:
We collect personal data and also transmit it to third-party providers
 that help us improve and finance our digital content. Some of the information stored on your device, … [+821 chars]",,de,'Sommer'
https://www.zeit.de/wissen/2023-09/sommer-2023-heissester-seit-beginn-der-aufzeichnungen,https://www.zeit.de/wissen/2023-09/sommer-2023-heissester-seit-beginn-der-aufzeichnungen,0,www.zeit.de,Klima: Sommer 2023 heißester seit Beginn der Aufzeichnungen,"Der Sommer war dieses Jahr im weltweiten Durchschnitt so heiß wie nie. Auch die Meeresoberflächentemperatur ist laut EU-Klimawandeldienst ""rekordverdächtig"" gestiegen.",,2023-09-06T08:25:51Z,,"When browsing with ads:
We collect personal data and also transmit it to third-party providers
 that help us improve and finance our digital content. Some of the information stored on your device, … [+821 chars]",,de,'Sommer'
https://www.tagesschau.de/ausland/europa/eu-klimawandel-sommer-100.html,https://www.tagesschau.de/ausland/europa/eu-klimawandel-sommer-100.html,0,www.tagesschau.de,Sommer 2023 war der heißeste seit Aufzeichnungsbeginn,"Hitzewellen in Südeuropa, den USA oder auch China: Die Sommermonate Juni bis August waren weltweit die heißesten seit Beginn der Aufzeichnungen - und dem EU-Klimawandeldienst zufolge wird es in Zukunft noch häufiger Extremwetterereignisse geben.",https://images.tagesschau.de/image/68f2f7a9-95b4-49c3-bd37-7b7ac760df5e/AAABimm91jQ/AAABibBxqrQ/16x9-1280/thermometer-112.jpg,2023-09-06T09:36:31Z,,"Stand: 06.09.2023 11:36 Uhr
Hitzewellen in Südeuropa, den USA oder auch China: Die Sommermonate Juni bis August waren weltweit die heißesten seit Beginn der Aufzeichnungen - und dem EU-Klimawandeldi… [+4765 chars]",,de,'Sommer'
https://www.sueddeutsche.de/bayern/wald-wolf-klimakrise-naturschuetzer-berwaldprojekt-aufforstung-1.6199633,https://www.sueddeutsche.de/bayern/wald-wolf-klimakrise-naturschuetzer-berwaldprojekt-aufforstung-1.6199633,0,www.sueddeutsche.de,30 Jahre Bergwaldprojekt: Warum der Wald den Menschen und den Wolf braucht,"Die Klimakrise trifft die Wälder mit Wucht - Trockenstress, zu wenig Laub, Schädlinge. Zum Waldschutz gehört nicht nur die Aufforstung mit ursprünglichen Baumarten. Naturschützer drängen auch auf kleinere Maschinen und die Akzeptanz eines Räubers.",https://www.sueddeutsche.de/image/sz.1.6199634/1200x675?v=1693994313,2023-09-06T09:50:36Z,,"Die Klimakrise trifft die Wälder mit Wucht - Trockenstress, zu wenig Laub, Schädlinge. Zum Waldschutz gehört nicht nur die Aufforstung mit ursprünglichen Baumarten. Naturschützer drängen auch auf kle… [+4117 chars]",,de,'Laub'
https://www.brigitte.de/aktuell/gesellschaft/hitzewelle-im-september--so-lange-haelt-der-sommer-noch-an-13585356.html,https://www.brigitte.de/aktuell/gesellschaft/hitzewelle-im-september--so-lange-haelt-der-sommer-noch-an-13585356.html,0,www.brigitte.de,Bis zu 35 Grad: Erwartet uns eine Hitzewelle im September?,Kurz vor dem Herbstanfang steigen die Temperaturen noch mal so richtig an – auf bis zu 35 Grad! In den kommenden Tagen wird es in Deutschland heiß.,https://image.brigitte.de/13585420/t/8J/v2/w1440/r1.7778/-/erwartet-uns-eine-hitzewelle-im-september-.jpg,2023-09-06T10:00:00Z,https://web.archive.org/web/20230909145351/https://www.brigitte.de/aktuell/gesellschaft/hitzewelle-im-september--so-lange-haelt-der-sommer-noch-an-13585356.html,"Mal ehrlich, wer hätte gedacht, dass wir im September bis zu 35 Grad haben werden und an nichts anderes denken als Abkühlung? Der Herbst steht vor der Tür und mit ihm kommt eine heiße Hitzewelle. Unf… [+2274 chars]",,de,'Herbst'
https://www.focus.de/wissen/natur/meteorologie/unwetter-in-griechenland-omega-lage-stuerzt-europa-ins-chaos-wie-flutkatastrophe-und-sommerausbruch-zusammenhaengen_id_203863658.html,https://www.focus.de/wissen/natur/meteorologie/unwetter-in-griechenland-omega-lage-stuerzt-europa-ins-chaos-wie-flutkatastrophe-und-sommerausbruch-zusammenhaengen_id_203863658.html,0,www.focus.de,Unwetter in Griechenland - Omega-Lage stürzt Europa ins Chaos: Wie Flutkatastrophe und Sommerausbruch zusammenhängen,"In Deutschland herrscht wieder Sommer, während in Spanien und Griechenland ganze Landstriche im Regen untergehen. Doch diese beiden Extreme hängen zusammen. Das Omega-Hoch Patrizia bringt derzeit ein verheerend stabiles Wettermuster mit sich.",https://p6.focus.de/img/fotos/id_203863314/de-omega2.jpg?im=Crop%3D%280%2C60%2C1920%2C960%29%3BResize%3D%281200%2C627%29&impolicy=perceptual&quality=mediumHigh&hash=3ea43c8760960fd2e6ddda3df649725e0b2d446772d3af26154bffdc24038622,2023-09-06T10:08:20Z,https://web.archive.org/web/20230907202041/https://www.focus.de/wissen/natur/meteorologie/unwetter-in-griechenland-omega-lage-stuerzt-europa-ins-chaos-wie-flutkatastrophe-und-sommerausbruch-zusammenhaengen_id_203863658.html,"In Deutschland herrscht wieder Sommer, während in Spanien und Griechenland ganze Landstriche im Regen untergehen. Doch diese beiden Extreme hängen zusammen. Das Omega-Hoch Patrizia bringt derzeit ein… [+4140 chars]",,de,'Hochwasser'
https://www.stern.de/gesellschaft/regional/bayern/agrar--obstbauern-am-bodensee-rechnen-mit-ordentlicher-apfelernte--33800832.html,https://www.stern.de/gesellschaft/regional/bayern/agrar--obstbauern-am-bodensee-rechnen-mit-ordentlicher-apfelernte--33800832.html,0,www.stern.de,Agrar: Obstbauern am Bodensee rechnen mit ordentlicher Apfelernte,"Die Obstbauern vom Bodensee rechnen dieses Jahr mit einer guten, aber etwas unterdurchschnittlichen Apfelernte. Mit voraussichtlich 226 000 Tonnen werde die Menge etwas unter dem langjährigen Schnitt liegen, teilte die Obst vom Bodensee Marketing GmbH zur off…",https://image.stern.de/33800834/t/K4/v1/w1440/r1.7778/-/06--urnnewsmldpacom200901012309069993884v2w800h600l940t639r2821b1918jpeg---40586cc36c89dfb4.jpg,2023-09-06T10:16:31Z,,"Die Obstbauern vom Bodensee rechnen dieses Jahr mit einer guten, aber etwas unterdurchschnittlichen Apfelernte. Mit voraussichtlich 226 000 Tonnen werde die Menge etwas unter dem langjährigen Schnitt… [+2336 chars]",,de,'Ernte'
https://www.sueddeutsche.de/sport/basketball-wm-deutsche-basketball-nationalmannschaft-dennis-schroeder-franz-wagner-lettland-wm-viertelfinale-1.6200292,https://www.sueddeutsche.de/sport/basketball-wm-deutsche-basketball-nationalmannschaft-dennis-schroeder-franz-wagner-lettland-wm-viertelfinale-1.6200292,0,www.sueddeutsche.de,Deutschland bei der Basketball-WM: Mit Glück durch den Stinker,"Die Dürre von 21 Jahren hat ein Ende: Erstmals seit langer Zeit erreichen deutsche Basketballer wieder ein WM-Halbfinale. Dabei steht das DBB-Team gegen starke Letten am Rand einer Niederlage - vor allem, weil Dennis Schröder fast nichts gelingt.",https://www.sueddeutsche.de/image/sz.1.6200399/1200x675?v=1694006186,2023-09-06T13:09:30Z,,Die Dürre von 21 Jahren hat ein Ende: Erstmals seit langer Zeit erreichen deutsche Basketballer wieder ein WM-Halbfinale. Dabei steht das DBB-Team gegen starke Letten am Rand einer Niederlage - vor a… [+5522 chars],,de,'Dürre'
https://www.sueddeutsche.de/meinung/unwetter-klimawandel-hitze-griechenland-kommentar-1.6200519,https://www.sueddeutsche.de/meinung/unwetter-klimawandel-hitze-griechenland-kommentar-1.6200519,0,www.sueddeutsche.de,Unwetter: Es ist der Klimawandel,"Hitze, Dürre und Sturm hat es schon immer gegeben. Stimmt. Aber wenn man alle Ereignisse und Ursachen dafür wie Puzzleteile aneinanderlegt, ergibt sich ein anderes Bild.",https://www.sueddeutsche.de/image/sz.1.6200520/1200x675?v=1694013307,2023-09-06T14:17:11Z,,"6. September 2023, 16:17 Uhr
Der Sturm Daniel hat die Straßen im griechischen Volos in Flüsse verwandelt.
(Foto: Louisa Gouliamaki/Reuters)
Hitze, Dürre und Sturm hat es schon immer gegeben. Stimm… [+806 chars]",,de,'Dürre'
https://www.stern.de/panorama/wetter/unwetter-in-griechenland---ich-hatte-angst-um-mein-leben--33800922.html,https://www.stern.de/panorama/wetter/unwetter-in-griechenland---ich-hatte-angst-um-mein-leben--33800922.html,0,www.stern.de,"Sturmtief ""Daniel"": Augenzeugen über Unwetter in Griechenland: ""Ich hatte Angst um mein Leben""",Das Unwetter in Griechenland ist eine Katastrophe von historischem Ausmaß. In vielen Orten des Landes hat der Starkregen zu Hochwassern und Zerstörung geführt. Augenzeugen berichten von schockierenden Szenen.,https://image.stern.de/33801766/t/Dj/v2/w1440/r1.7778/-/griechenland-unwetter-volos.jpg,2023-09-06T14:37:00Z,https://web.archive.org/web/20230907201942/https://www.stern.de/panorama/wetter/unwetter-in-griechenland---ich-hatte-angst-um-mein-leben--33800922.html,"Das Sturmtief ""Daniel"" hat eine Schneise der Verwüstung in vielen Teilen Griechenlands ausgelöst. Der sich seit Montag ausbreitende Starkregen überflutete mehrere Regionen, in der Folge wurden Autos … [+3832 chars]",,de,'Hochwasser'
https://www.faz.net/aktuell/stil/essen-trinken/getraenke/wein-warum-rose-nicht-nur-im-sommer-der-perfekte-drink-ist-19126233.html,https://www.faz.net/aktuell/stil/essen-trinken/getraenke/wein-warum-rose-nicht-nur-im-sommer-der-perfekte-drink-ist-19126233.html,0,www.faz.net,Der Drink meines Lebens: Rosé,"Unsere Autorin hat ihre Liebe zum Rosé entdeckt – und ist der Überzeugung, dass er der perfekte Wein ist. Nicht nur für den Sommer.",https://media0.faz.net/ppmedia/aktuell/3513939150/1.9126294/facebook_teaser/der-rose-hat-von-allen-drei.jpg,2023-09-06T14:49:14Z,,"So richtig gefunkt hat es zwischen dem Rosé und mir bei einer Weinprobe im vergangenen Jahr. Nach einem Schaumwein und zwei Weißweinen wurde uns ein Schluck des trockenen Rosés ausgeschenkt, der für … [+2686 chars]",,de,'Sommer'
https://www.focus.de/wissen/natur/3-garten-to-dos-die-sie-im-september-unbedingt-noch-erledigen-sollten_id_203701740.html,https://www.focus.de/wissen/natur/3-garten-to-dos-die-sie-im-september-unbedingt-noch-erledigen-sollten_id_203701740.html,0,www.focus.de,Tipps für den Herbst - Das sollten Sie in Ihrem Garten jetzt unbedingt erledigen,"Ob Ernte, Rasenpflege oder Naturschutz: Im September stehen im Garten noch einige wichtige Handgriffe an. Drei Gartenarbeiten sind dabei besonders wichtig.",https://p6.focus.de/img/fotos/id_203777203/gettyimages-1350024408.jpg?im=Crop%3D%280%2C186%2C2121%2C1061%29%3BResize%3D%281200%2C627%29&impolicy=perceptual&quality=mediumHigh&hash=310d812a465f3402700ea60aa39481c88a7547b7612287b871daf75ea6a3545f,2023-09-06T17:34:50Z,https://web.archive.org/web/20230907092157/https://www.focus.de/wissen/natur/3-garten-to-dos-die-sie-im-september-unbedingt-noch-erledigen-sollten_id_203701740.html,"Ob Ernte, Rasenpflege oder Naturschutz: Im September stehen im Garten noch einige wichtige Handgriffe an. Drei Gartenarbeiten sind dabei besonders wichtig.Mit dem beginnenden September nehmen wir lan… [+3502 chars]",,de,'Herbst'
https://www.stern.de/gesellschaft/regional/bayern/agrar--weinlese-in-franken-beginnt-offiziell-33802824.html,https://www.stern.de/gesellschaft/regional/bayern/agrar--weinlese-in-franken-beginnt-offiziell-33802824.html,0,www.stern.de,Agrar: Weinlese in Franken beginnt offiziell,"Der Weinkonsum in Deutschland geht leicht zurück, doch in Unterfranken ist Wein allgegenwärtig. In den kommenden Wochen wird sich zeigen, wie der neue Jahrgang wird.",https://image.stern.de/33802826/t/Jy/v1/w1440/r1.7778/-/07--urnnewsmldpacom200901012309069998607v3w800h600l872t243r1931b1505jpeg---466ff604aad1f8b5.jpg,2023-09-06T19:48:44Z,https://web.archive.org/web/20230907013047/https://www.stern.de/gesellschaft/regional/bayern/agrar--weinlese-in-franken-beginnt-offiziell-33802824.html,"Der Weinkonsum in Deutschland geht leicht zurück, doch in Unterfranken ist Wein allgegenwärtig. In den kommenden Wochen wird sich zeigen, wie der neue Jahrgang wird.
Die fränkischen Winzerinnen und … [+727 chars]",,de,'Weinlese'
https://www.stern.de/gesellschaft/regional/niedersachsen-bremen/unternehmen--vor-der-kampagne--nordzucker-rechnet-mit-durchschnittsernte--33803152.html,https://www.stern.de/gesellschaft/regional/niedersachsen-bremen/unternehmen--vor-der-kampagne--nordzucker-rechnet-mit-durchschnittsernte--33803152.html,0,www.stern.de,Unternehmen: Vor der Kampagne: Nordzucker rechnet mit Durchschnittsernte,Das sonnige Wetter in diesen Tagen lässt Zuckerproduzenten wie Nordzucker noch auf bessere Erträge hoffen. Denn die kommenden Wochen mit Rübenernte und Verarbeitung sind entscheidend für das ganze Jahr.,https://image.stern.de/33803154/t/VW/v1/w1440/r1.7778/-/07--urnnewsmldpacom2009010123090799103034v3w800h600l640t348r1920b1047jpeg---9ce45d54f8faab7e.jpg,2023-09-07T04:42:41Z,https://web.archive.org/web/20230907083102/https://www.stern.de/gesellschaft/regional/niedersachsen-bremen/unternehmen--vor-der-kampagne--nordzucker-rechnet-mit-durchschnittsernte--33803152.html,Das sonnige Wetter in diesen Tagen lässt Zuckerproduzenten wie Nordzucker noch auf bessere Erträge hoffen. Denn die kommenden Wochen mit Rübenernte und Verarbeitung sind entscheidend für das ganze Ja… [+2183 chars],,de,'Ernte'
https://www.focus.de/politik/ausland/ukraine-krise/versorgungskrise-bahnt-sich-an-russlands-armee-zittert-jetzt-schon-vor-winter_id_203939494.html,https://www.focus.de/politik/ausland/ukraine-krise/versorgungskrise-bahnt-sich-an-russlands-armee-zittert-jetzt-schon-vor-winter_id_203939494.html,0,www.focus.de,Versorgungskrise bahnt sich an - Russlands Armee zittert jetzt schon vor Winter,"Die russischen Streitkräfte stehen vor massiven Versorgungsherausforderungen, während der Winter naht. Laut ISW fehlen Präzisionswaffen und Grundausstattung.",https://p6.focus.de/img/fotos/id_73097047/panzer.jpg?im=Crop%3D%280%2C29%2C948%2C474%29%3BResize%3D%281200%2C627%29&impolicy=perceptual&quality=mediumHigh&hash=14045391f58309a5d79f90c13d7a3aba27fce3e5fb8b9f3c4001e9b6ea8a8055,2023-09-07T05:23:34Z,,"Die russischen Streitkräfte stehen vor massiven Versorgungsherausforderungen, während der Winter naht. Laut ISW fehlen Präzisionswaffen und Grundausstattung. Die russischen Streitkräfte könnten bald … [+1405 chars]",,de,'Winter'
https://www.focus.de/wissen/natur/3-garten-to-dos-die-sie-jetzt-unbedingt-erledigen-sollten_id_203701740.html,https://www.focus.de/wissen/natur/3-garten-to-dos-die-sie-jetzt-unbedingt-erledigen-sollten_id_203701740.html,0,www.focus.de,Tipps für den Herbst - Das sollten Sie in Ihrem Garten jetzt unbedingt erledigen,"Spätsommer ist Gartenzeit. In Vorbereitung auf Herbst und Winter steht viel an: Ernte, Rasenpflege und Naturschutz sind dabei besonders wichtig.",https://p6.focus.de/img/fotos/id_203777203/gettyimages-1350024408.jpg?im=Crop%3D%280%2C186%2C2121%2C1061%29%3BResize%3D%281200%2C627%29&impolicy=perceptual&quality=mediumHigh&hash=310d812a465f3402700ea60aa39481c88a7547b7612287b871daf75ea6a3545f,2023-09-07T07:37:16Z,https://web.archive.org/web/20230907092151/https://www.focus.de/wissen/natur/3-garten-to-dos-die-sie-jetzt-unbedingt-erledigen-sollten_id_203701740.html,"Spätsommer ist Gartenzeit. In Vorbereitung auf Herbst und Winter steht viel an: Ernte, Rasenpflege und Naturschutz sind dabei besonders wichtig.Mit dem beginnenden September nehmen wir langsam Abschi… [+3491 chars]",,de,'Winter'
https://www.morgenpost.de/vermischtes/article239372427/dinosaurier-archaeologie-spuren-texas-abdruecke-duerre.html,https://www.morgenpost.de/vermischtes/article239372427/dinosaurier-archaeologie-spuren-texas-abdruecke-duerre.html,0,www.morgenpost.de,Ungewöhnliche Trockenheit: Dürre legt sensationelle Dinosaurier-Spuren in Texas frei,Ohne das Wasser offenbart ein Flussbett in Texas einen prähistorischen Schatz: versteinerte Dinosaurier-Abdrücke in perfektem Zustand.,https://img.morgenpost.de/img/frontpage/crop239386617/6482603179-w820-cv16_9-q85/AFP-32GY8EZ.jpg,2023-09-07T07:56:47Z,,"Die Spuren sehen frisch aus, so als ob gerade eben erst noch ein tonnenschwerer Koloss durch den Schlamm stampfte. Doch die Dinosaurier-Spuren, die jetzt durch eine Dürre in Texas zum Vorschein kamen… [+2805 chars]",,de,'Dürre'
https://orf.at/stories/3330304/,https://orf.at/stories/3330304/,0,orf.at,Brunner: Steuererleichterungen für Hochwasseropfer,,https://orf.at/mojo/1_4_1/storyserver//news/common/images/og-fallback-news.png,2023-09-07T09:43:50Z,,"Personen, die in den vergangenen Wochen von Unwettern betroffen waren, können Steuererleichterungen in Anspruch nehmen. Darauf hat Finanzminister Magnus Brunner (ÖVP) heute hingewiesen. So sind Koste… [+1333 chars]",,de,'Hochwasser'
https://www.zeit.de/news/2023-09/07/entspannung-nach-hochwasser-in-bulgarien,https://www.zeit.de/news/2023-09/07/entspannung-nach-hochwasser-in-bulgarien,0,www.zeit.de,Überschwemmungen: Entspannung nach Hochwasser in Bulgarien,,,2023-09-07T09:53:16Z,https://web.archive.org/web/20230909120716/https://www.zeit.de/news/2023-09/07/entspannung-nach-hochwasser-in-bulgarien,"When browsing with ads:
We collect personal data and also transmit it to third-party providers
 that help us improve and finance our digital content. Some of the information stored on your device, … [+821 chars]",,de,'Hochwasser'
https://www.morgenpost.de/vermischtes/article239388449/Entspannung-nach-Hochwasser-in-Bulgarien.html,https://www.morgenpost.de/vermischtes/article239388449/Entspannung-nach-Hochwasser-in-Bulgarien.html,0,www.morgenpost.de,Überschwemmungen: Entspannung nach Hochwasser in Bulgarien,Nach verheerenden Überschwemmungen an der  bulgarischen Schwarzmeerküste beruhigt sich die Lage langsam wieder. Das Ausmaß aller Schäden ist noch nicht geklärt.,https://img.morgenpost.de/img/vermischtes/crop239388447/7252601652-w820-cv16_9-q85/Starke-Unwetter.jpg,2023-09-07T09:53:16Z,https://web.archive.org/web/20230908020553/https://www.morgenpost.de/vermischtes/article239388449/Entspannung-nach-Hochwasser-in-Bulgarien.html,"Sofia. Die Lage an der bulgarischen Schwarzmeerküste hat sich nach dem verheerenden Hochwasser vom Dienstag entspannt. Die Situation in der von Überschwemmungen getroffenen Region normalisiert sich, … [+1469 chars]",,de,'Hochwasser'
https://www.n-tv.de/panorama/Deutschland-sonnt-sich-im-Zentrum-des-Omegas-article24379140.html,https://www.n-tv.de/panorama/Deutschland-sonnt-sich-im-Zentrum-des-Omegas-article24379140.html,0,www.n-tv.de,Sommerlich bis kommende Woche: Deutschland sonnt sich im Zentrum des Omegas,Die Strömung legt sich derzeit wie ein Omega über Europa: An den Enden - in Spanien und Griechenland - bringen stabile Tiefs Unheil in Form von Regen und Sturm. In der Mitte des griechischen Buchstaben hält sich dagegen ein Hoch - mit Sonne und sommerlichen T…,https://bilder1.n-tv.de/img/incoming/crop24379164/8151321958-cImg_16_9-w1200/1cff0f38b463c1fd0ed50c7e0195626e.jpg,2023-09-07T10:58:59Z,https://web.archive.org/web/20230908022529/https://www.n-tv.de/panorama/Deutschland-sonnt-sich-im-Zentrum-des-Omegas-article24379140.html,Die Strömung legt sich derzeit wie ein Omega über Europa: An den Enden - in Spanien und Griechenland - bringen stabile Tiefs Unheil in Form von Regen und Sturm. In der Mitte des griechischen Buchstab… [+5679 chars],,de,'Sommer'
https://www.stern.de/gesellschaft/regional/baden-wuerttemberg/agrar--erste-solaranlage-im-weinberg--schutz-vor-extremwetter--33804168.html,https://www.stern.de/gesellschaft/regional/baden-wuerttemberg/agrar--erste-solaranlage-im-weinberg--schutz-vor-extremwetter--33804168.html,0,www.stern.de,Agrar: Erste Solaranlage im Weinberg: Schutz vor Extremwetter,Fachleute sprechen von Agri-Photovoltaik - dabei geht es um Solaranlagen auf landwirtschaftlichen Flächen. Nun stehen Photovoltaikmodule in einem Weinberg. Wird nun später geerntet?,https://image.stern.de/33804262/t/JY/v2/w1440/r1.7778/-/07--urnnewsmldpacom2009010123090799107048v3w800h600l696t192r1755b1524jpeg---a2e07303f3eaa15a.jpg,2023-09-07T11:06:07Z,https://web.archive.org/web/20230909005731/https://www.stern.de/gesellschaft/regional/baden-wuerttemberg/agrar--erste-solaranlage-im-weinberg--schutz-vor-extremwetter--33804168.html,"Fachleute sprechen von Agri-Photovoltaik - dabei geht es um Solaranlagen auf landwirtschaftlichen Flächen. Nun stehen Photovoltaikmodule in einem Weinberg. Wird nun später geerntet?
Der Energieverso… [+2271 chars]",,de,'Weinlese'
https://www.faz.net/aktuell/technik-motor/technik/laub-im-kofferraum-neue-gartengeraete-von-gardena-19131720.html,https://www.faz.net/aktuell/technik-motor/technik/laub-im-kofferraum-neue-gartengeraete-von-gardena-19131720.html,0,www.faz.net,Laub im Kofferraum: Neue Gartengeräte von Gardena,"Der Hobbygärtner hat zu tun. Manchmal sind Regale leer. Aber bald wird alles besser, hofft Gardena. Schneidet und bürstet immer mehr mit Akku. Und macht den Abfallsack rechteckig.",https://media1.faz.net/ppmedia/aktuell/872706209/1.9144561/facebook_teaser/der-siegeszug-des-akkus-ist.jpg,2023-09-07T12:54:00Z,,"Das Wetter beschert dem professionellen Gärtner gerade einige Arbeit, der Hobbygärtner beginnt am munter sprießenden Unkraut ein wenig zu verzweifeln. Umso besser, man hat hilfreiches Werkzeug zur Ha… [+2604 chars]",,de,'Laub'
