index,url,valid,domain,title,description,image,published,archive,content,quote,language,keyword
https://www.focus.de/reisen/urlaubs-check/bikini-alarm-fuenf-reiseziele-die-jetzt-schon-mit-perfektem-badewetter-locken_id_192165011.html,https://www.focus.de/reisen/urlaubs-check/bikini-alarm-fuenf-reiseziele-die-jetzt-schon-mit-perfektem-badewetter-locken_id_192165011.html,0,www.focus.de,"Bikini- und Badehosen-Alarm! - Fünf Reiseziele, die im Mai schon mit perfektem Badewetter locken","Sonne, Strand und Sommerfeeling im Mai: Wer im Frühling bereits in den Badeurlaub fahren will, muss nicht mehr bis nach Hawaii, auf die Bahamas oder Seychellen fliegen. Denn etliche europanahe Destinationen warten schon mit perfekten Sommertemperaturen auf. W…",https://p6.focus.de/img/fotos/id_192167639/gettyimages-1368817444.jpg?im=Crop%3D%280%2C289%2C3463%2C1731%29%3BResize%3D%281200%2C627%29&hash=809b08cd2dbf8655cb99bc1fe7cfa902a94c44109a87fc60f9d13f78e24b5573,2023-05-03T07:19:49Z,https://web.archive.org/web/20230504081711/https://www.focus.de/reisen/urlaubs-check/bikini-alarm-fuenf-reiseziele-die-jetzt-schon-mit-perfektem-badewetter-locken_id_192165011.html,"<ul><li>
Kommentare</li><li>
E-Mail</li><li>
Teilen</li><li>
Mehr</li><li>
Twitter</li><li>
Drucken</li><li>
Feedback</li><li>
Fehler meldenSie haben einen Fehler gefunden?
Bitte markieren S… [+5470 chars]",,de,'Sommer'
https://www.focus.de/finanzen/news/guenstig-regional-lecker-wer-sparen-will-sollte-jetzt-im-supermarkt-dieses-obst-und-gemuese-kaufen_id_192586288.html,https://www.focus.de/finanzen/news/guenstig-regional-lecker-wer-sparen-will-sollte-jetzt-im-supermarkt-dieses-obst-und-gemuese-kaufen_id_192586288.html,0,www.focus.de,"Günstig, regional, lecker - Wer sparen will, sollte jetzt im Supermarkt dieses Obst und Gemüse kaufen",Mit dem Frühling kommt auch wieder eine Fülle an Obst und Gemüse aus der Region auf den Teller. Von knackigen Radieschen über aromatischen Kohlrabi bis zu köstlichem Blumenkohl: Entdecken Sie die Vielfalt frischer Zutaten.,https://p6.focus.de/img/fotos/id_192691881/gettyimages-647335421.jpg?im=Crop%3D%280%2C177%2C2121%2C1060%29%3BResize%3D%281200%2C627%29&hash=b0472b883035ff7f47e7f852060e9966aff63680ce08058910bd8943e9e4e90f,2023-05-03T07:44:11Z,,Mit dem Frühling kommt auch wieder eine Fülle an Obst und Gemüse aus der Region auf den Teller. Von knackigen Radieschen über aromatischen Kohlrabi bis zu köstlichem Blumenkohl: Entdecken Sie die Vie… [+3503 chars],,de,'Ernte'
https://www.focus.de/klima/analyse/aussergewoehnliche-duerresituation-endlich-genug-regen-in-deutschland-grundwasserpegel-sprechen-andere-sprache_id_192714159.html,https://www.focus.de/klima/analyse/aussergewoehnliche-duerresituation-endlich-genug-regen-in-deutschland-grundwasserpegel-sprechen-andere-sprache_id_192714159.html,0,www.focus.de,Feuchter Frühling - Dauerregen in Deutschland - haben wir gar kein Dürre-Problem mehr?,"Nach einem sehr trockenen Winter war der Frühling vor allem von Regen geprägt. Haben sich die geplagten Grundwasserstände also erholt? Leider nur zum Teil, sagen Expertinnen und Experten - denn das Problem geht tiefer, als wir denken.Von FOCUS-online-Redakteu…",https://p6.focus.de/img/fotos/id_192726852/imago0241143342h.jpg?im=Crop%3D%280%2C112%2C3579%2C1788%29%3BResize%3D%281200%2C627%29&hash=346b5ba7d1a31430db1e406b9f7ad958a0234e3c8bfa18880ed6bcfcfa787c3b,2023-05-03T08:43:56Z,https://web.archive.org/web/20230504074050/https://www.focus.de/klima/analyse/aussergewoehnliche-duerresituation-endlich-genug-regen-in-deutschland-grundwasserpegel-sprechen-andere-sprache_id_192714159.html,"Nach einem sehr trockenen Winter war der Frühling vor allem von Regen geprägt. Haben sich die geplagten Grundwasserstände also erholt? Leider nur zum Teil, sagen Expertinnen und Experten - denn das P… [+6532 chars]",,de,'Niedrigwasser'
https://vorarlberg.orf.at/stories/3205696/,https://vorarlberg.orf.at/stories/3205696/,0,vorarlberg.orf.at,Kuriose Funde bei Umwelt-Frühjahrsputz,Die Aktion „Saubere Umwelt braucht Dich“ ist für heuer vorüber. Dabei wurden im Frühling in den Vorarlberger Gemeinden 63.781 Kilogramm Abfall eingesammelt von rund 15.023 freiwilligen Helferinnen und Helfern. Darunter befanden sich auch heuer wieder kuriose …,https://ibs.orf.at/vbg?image=https%3A%2F%2Foekastatic.orf.at%2Fmims%2F2023%2F18%2F32%2Fcrops%2Fw%3D1200%2Ch%3D627%2Cq%3D75%2F1775315_master_659432_reinigung_duens.jpg%3Fs%3Dd40f29bc66b1f39d739f67d3ce26dbe153ef8af0,2023-05-03T09:57:22Z,https://web.archive.org/web/20230505115836/https://vorarlberg.orf.at/stories/3205696/,"Viele Gemeinden haben in den vergangenen Wochen zurückgemeldet, dass in ihrem Bereich auffallend weniger Abfall herumlag, als noch im Jahr zuvor, berichtet der Gemeindeverband. Dass bei den Landschaf… [+2116 chars]",,de,'Frühling'
https://www.tagesspiegel.de/berlin/ausflugtipps-fur-den-fruhling-in-berlin-im-reich-der-wildpflanzen-und-der-vielfaltigen-vogelwelt-9746210.html,https://www.tagesspiegel.de/berlin/ausflugtipps-fur-den-fruhling-in-berlin-im-reich-der-wildpflanzen-und-der-vielfaltigen-vogelwelt-9746210.html,0,www.tagesspiegel.de,Ausflugtipps für den Frühling in Berlin: Im Reich der Wildpflanzen und der vielfältigen Vogelwelt,"In Berlin gibt es viele weniger bekannte Naturparadiese, die ideal sind zur Entspannung. Die Naturpädagogin Susanne Herrmann hat sie in einem Buch aufgeschrieben.",https://www.tagesspiegel.de/berlin/images/eisvogel-ist-vogel-des-jahres-2009-4928/alternates/BASE_16_9_W1400/eisvogel-ist-vogel-des-jahres-2009-4928.jpeg,2023-05-03T10:07:49Z,https://web.archive.org/web/20230504083206/https://www.tagesspiegel.de/berlin/ausflugtipps-fur-den-fruhling-in-berlin-im-reich-der-wildpflanzen-und-der-vielfaltigen-vogelwelt-9746210.html,"Berlin bietet viele Möglichkeiten, Natur zu genießen, es müssen nicht immer spektakuläre Orte sein. Es gibt auch viele kleinere, nicht immer sehr bekannte Naturparadiese, die für Entspannung und Ents… [+126 chars]",,de,'Frühling'
https://www.basicthinking.de/blog/2023/05/03/smarte-gartenhelfer-tink/,https://www.basicthinking.de/blog/2023/05/03/smarte-gartenhelfer-tink/,0,www.basicthinking.de,Smarte Garten Angebote von tink: Hier gibt es bis zu 50% Rabatt (+ Gewinnspiel),"Der Frühling und die Gartensaison steht vor der Tür! Egal ob Rasenmähen, Bewässerung oder ein Sicherheitssystem – mit den Smarten Garten Angeboten von tink bekommst du einen smarten Garten. Wir stellen dir die besten Angebote vor. 1. Worx Landroid S300 + grat…",https://www.basicthinking.de/blog/wp-content/uploads/2023/04/smarte-gartenhelfer-tink-smart-home.png,2023-05-03T13:00:20Z,https://web.archive.org/web/20230503130200/https://www.basicthinking.de/blog/2023/05/03/smarte-gartenhelfer-tink/,"Der Frühling und die Gartensaison steht vor der Tür! Egal ob Rasenmähen, Bewässerung oder ein Sicherheitssystem mit den Smarten Garten Angeboten von tink bekommst du einen smarten Garten. Wir stellen… [+6005 chars]",,de,'Frühling'
https://www.nzz.ch/wissenschaft/geothermie-soll-von-neuer-bohrtechnik-mit-blitzen-profitieren-ld.1730202,https://www.nzz.ch/wissenschaft/geothermie-soll-von-neuer-bohrtechnik-mit-blitzen-profitieren-ld.1730202,0,www.nzz.ch,"Gewitter im Bohrloch: Eine neue Technik mit künstlichen Blitzen soll helfen, die Erdwärme als Energiequelle anzuzapfen","Methoden der Geothermie für grosse Tiefen bereiten Probleme, weil dort unten das Gestein so hart ist. Darum wird in der Schweiz eine neue Bohrmethode entwickelt.","https://img.nzz.ch/2023/04/28/7c32e921-aba4-4b2e-8125-e9b3e487b42f.png?width=1200&height=674&fit=bound&quality=75&auto=webp&crop=4090,2298,x261,y248&wmark=nzz",2023-05-04T03:30:00Z,https://web.archive.org/web/20230504213343/https://www.nzz.ch/wissenschaft/geothermie-soll-von-neuer-bohrtechnik-mit-blitzen-profitieren-ld.1730202,"Ein Marx-Generator erzeugt die Spannung für die künstlichen Blitze. Die Kugeln gehören zu den Kondensatoren, welche die Spannung aufbauen.
Die historischen Gebäude von CU Chemie Uetikon stehen direk… [+9216 chars]",,de,'Gewitter'
https://consent.google.com/ml?continue=https://news.google.com/rss/articles/CBMigAFodHRwczovL3d3dy5iaWxkLmRlL3VudGVyaGFsdHVuZy9sZXV0ZS9sZXV0ZS9sZW5pLWtsdW0taGF0LWdlYnVydHN0YWctc28tYWx0LXdpcmQtZGVyLW1vZGVsLXNwcm9lc3NsaW5nLWhldXRlLTgzNzc4MDA4LmJpbGQuaHRtbNIBAA?oc%3D5%26hl%3Den-CA%26gl%3DCA%26ceid%3DCA:en&gl=FR&hl=en-CA&cm=2&pc=n&src=1,https://consent.google.com/ml?continue=https://news.google.com/rss/articles/CBMigAFodHRwczovL3d3dy5iaWxkLmRlL3VudGVyaGFsdHVuZy9sZXV0ZS9sZXV0ZS9sZW5pLWtsdW0taGF0LWdlYnVydHN0YWctc28tYWx0LXdpcmQtZGVyLW1vZGVsLXNwcm9lc3NsaW5nLWhldXRlLTgzNzc4MDA4LmJpbGQuaHRtbNIBAA?oc%3D5%26hl%3Den-CA%26gl%3DCA%26ceid%3DCA:en&gl=FR&hl=en-CA&cm=2&pc=n&src=1,0,consent.google.com,Leni Klum hat Geburtstag: So alt wird der Model-Sprössling heute | Unterhaltung - BILD,"<ol><li>Leni Klum hat Geburtstag: So alt wird der Model-Sprössling heute | Unterhaltung  BILD
</li><li>Modetrends 2023: So trägt Topmodel Leni Klum die Must-haves für den Frühling  ProSieben
</li><li>Mehr zum Thema ansehen in Google News</li></ol>",,2023-05-04T06:30:16Z,,"We use cookies and data to<ul><li>Deliver and maintain Google services</li><li>Track outages and protect against spam, fraud, and abuse</li><li>Measure audience engagement and site statistics to unde… [+1131 chars]",,de,'Frühling'
https://www.stern.de/lifestyle/schwarze-sneaker-trends-2023--6-modelle-fuer-den-fruehling-32970772.html,https://www.stern.de/lifestyle/schwarze-sneaker-trends-2023--6-modelle-fuer-den-fruehling-32970772.html,0,www.stern.de,Schuhtrends 2023: Schwarze Sneaker für den Frühling: Diese Modelle liegen im Trend,"Auch in diesem Jahr dominieren Sneaker die Schuhtrends: Neben weißen Modellen sind es vor allem schwarze Turnschuhe, die zu den Must-haves 2023 zählen..",https://image.stern.de/33435026/t/kQ/v2/w1440/r1.7778/-/bild-sommer.jpg,2023-05-04T06:50:00Z,https://web.archive.org/web/20230504231146/https://www.stern.de/lifestyle/schwarze-sneaker-trends-2023--6-modelle-fuer-den-fruehling-32970772.html,Deutlich pflegeleichter als ihre hellen Pendants und mindestens genauso bequem sind schwarze Sneaker. Das ganze Jahr über schon dominieren die dunklen Treter unsere örtlichen Schuhregale  und das hat… [+2844 chars],,de,'Frühling'
https://www.laut.de/Freya-Ridings/Alben/Blood-Orange-120806,https://www.laut.de/Freya-Ridings/Alben/Blood-Orange-120806,0,www.laut.de,"""Blood Orange"" von Freya Ridings",Lässig beschwingt steckt zumindest hier drin ein Stück Frühling. (3/5),http://www.laut.de/Freya-Ridings/Alben/Blood-Orange-120806/freya-ridings-blood-orange-225689.jpg?1a0e01,2023-05-04T08:10:00Z,,"laut.de-Kritik
Lässig beschwingt steckt zumindest hier drin ein Stück Frühling.
Review von Philipp Kause
Partys sind nicht ihr Ding. Sie ist ""so fucking lonely"", keiner kann sie leiden. Das Alter … [+5002 chars]",,de,'Frühling'
https://www.stern.de/gesellschaft/duerre--wie-deutschlands-zweittrockenste-stadt-eine-wasserkrise-verhindern-will-33433406.html,https://www.stern.de/gesellschaft/duerre--wie-deutschlands-zweittrockenste-stadt-eine-wasserkrise-verhindern-will-33433406.html,0,www.stern.de,Quedlinburg: Zunehmende Dürre: Wie die zweittrockenste Stadt Deutschlands eine Wasserkrise abwenden will,"Die zunehmende Dürre betrifft auch Deutschland. Quedlinburg, die zweittrockenste Stadt des Landes, ist besorgt über die Trockenheit und will eine Wasserkrise abwenden. Dazu hat sie mehrere Ideen – und könnte zum Vorreiter für andere deutsche Städte werden.",https://image.stern.de/33435838/t/bk/v4/w1440/r1.7778/-/duerre-deutschland-trockenheit-quedlinburg.jpg,2023-05-04T11:40:00Z,https://web.archive.org/web/20230505040148/https://www.stern.de/gesellschaft/duerre--wie-deutschlands-zweittrockenste-stadt-eine-wasserkrise-verhindern-will-33433406.html,"Die zunehmende Dürre betrifft auch Deutschland. Quedlinburg, die zweittrockenste Stadt des Landes, ist besorgt über die Trockenheit und will eine Wasserkrise abwenden. Dazu hat sie mehrere Ideen und … [+1931 chars]",,de,'Dürre'
https://www.focus.de/reisen/camping/neues-ranking-die-zehn-besten-campingplaetze-in-deutschland_id_192175112.html,https://www.focus.de/reisen/camping/neues-ranking-die-zehn-besten-campingplaetze-in-deutschland_id_192175112.html,0,www.focus.de,Von der Nordsee bis nach Bayern - Die zehn beliebtesten Campingplätze in Deutschland,"Der Frühling ist da und die Campingsaison eröffnet. Wer für den nächsten Camping-Urlaub noch ein geeignetes Plätzchen sucht, kann sich hier inspirieren lassen. Wir stellen die zehn beliebtesten Campingplätze der Republik vor.",https://p6.focus.de/img/fotos/id_192818684/gettyimages-1372399182.jpg?im=Crop%3D%280%2C288%2C3464%2C1732%29%3BResize%3D%281200%2C627%29&hash=669ee05d7342545fc1da59f6d5fdf7e2ab42b577059487ef0053208db28c92a6,2023-05-04T12:43:25Z,https://web.archive.org/web/20230505081224/https://www.focus.de/reisen/camping/neues-ranking-die-zehn-besten-campingplaetze-in-deutschland_id_192175112.html,"<ul><li>
Kommentare</li><li>
E-Mail</li><li>
Teilen</li><li>
Mehr</li><li>
Twitter</li><li>
Drucken</li><li>
Feedback</li><li>
Fehler meldenSie haben einen Fehler gefunden?
Bitte markieren S… [+8984 chars]",,de,'Frühling'
https://www.tagesspiegel.de/tipps-fur-radfahrer-auf-zwei-reifen-in-den-fruhling-9766319.html,https://www.tagesspiegel.de/tipps-fur-radfahrer-auf-zwei-reifen-in-den-fruhling-9766319.html,0,www.tagesspiegel.de,Tipps für Radfahrer: Auf zwei Reifen in den Frühling,Tagesspiegel Unterwegs Radfahren hat viele Neuheiten zu Trends und Technik für Sie entdeckt. Außerdem: 16 Touren in Berlin und Umgebung mit Download aufs Smartphone.,https://www.tagesspiegel.de/images/1200x514radfahrenjpg/alternates/BASE_16_9_W1400/1200x514radfahrenjpg.jpeg,2023-05-04T14:29:31Z,https://web.archive.org/web/20230504151618/https://www.tagesspiegel.de/tipps-fur-radfahrer-auf-zwei-reifen-in-den-fruhling-9766319.html,"Rausfahren, dem Alltag entschwinden, Neues entdecken einfacher als mit einer Radtour geht das kaum. Die neue Ausgabe von Tagesspiegel unterwegs Radfahren bietet auf 124 Seiten Einblicke in die Fahrra… [+999 chars]",,de,'Frühling'
https://www.morgenpost.de/lifestyle/wohnen/article238310597/So-laeuft-die-Heizung-naechsten-Herbst-guenstiger.html,https://www.morgenpost.de/lifestyle/wohnen/article238310597/So-laeuft-die-Heizung-naechsten-Herbst-guenstiger.html,0,www.morgenpost.de,Jetzt vorbereiten: So läuft die Heizung nächsten Herbst günstiger,"Endlich Frühling, endlich eine Auszeit für die teuren Heizungen. Aber nicht für Sie. Denn mit ein wenig DIY und etwas Finetuning vom Handwerker kann Ihre Anlage ab Herbst günstiger laufen.",https://img.morgenpost.de/img/wohnen/crop238310585/2602606994-w820-cv16_9-q85/Heizkoerper-isolieren.jpg,2023-05-04T14:37:52Z,,"Berlin (dpa/tmn). Dieser Winter hat viele von uns kalt erwischt: Die Heizungen waren jahrelang nicht gewartet, geschweige denn optimal eingestellt worden. Ihr Betrieb war also teurer, als es sein müs… [+5755 chars]",,de,'Herbst'
https://www.diepresse.com/6283891/erinnerungen-an-nikolaus-harnoncourt,https://www.diepresse.com/6283891/erinnerungen-an-nikolaus-harnoncourt,0,www.diepresse.com,Erinnerungen an Nikolaus Harnoncourt,"Alljährlich im Frühling gedenkt man in St. Georgen im Attergau des bedeutenden Cellisten und Dirigenten Nikolaus Harnoncourt. Ein kleines Harnoncourt-Festival, ausgerichtet von Mechthild Bartolomey, beginnt am Freitag (5. Mai) wieder mit einer Aufführung des …",https://www.diepresse.com/assets_v2/images/diepresse_musiksalon.png,2023-05-04T15:17:00Z,https://web.archive.org/web/20230504221250/https://www.diepresse.com/6283891/erinnerungen-an-nikolaus-harnoncourt,"Alljährlich im Frühling gedenkt man in St. Georgen im Attergau des bedeutenden Cellisten und Dirigenten Nikolaus Harnoncourt. Ein kleines Harnoncourt-Festival, ausgerichtet von Mechthild Bartolomey, … [+1831 chars]",,de,'Frühling'
https://www.stern.de/lifestyle/mode/satin-bags--diese-taschen-sorgen-fuer-eleganz-im-fruehling-33438014.html,https://www.stern.de/lifestyle/mode/satin-bags--diese-taschen-sorgen-fuer-eleganz-im-fruehling-33438014.html,0,www.stern.de,Satin Bags: Diese Taschen sorgen für Eleganz im Frühling,Stars wie Katy Perry sind ihr verfallen - der angesagten Satin Bag. So kombiniert man die trendige Tasche im Frühling.,https://image.stern.de/33438018/t/35/v1/w1440/r1.7778/-/04--diese-taschen-sorgen-fuer-eleganz-im-fruehling---16-9---spoton-article-1043862.jpg,2023-05-04T20:15:00Z,,"Stars wie Katy Perry sind ihr verfallen - der angesagten Satin Bag. So kombiniert man die trendige Tasche im Frühling.
Zugegeben, besonders praktisch sind sie nicht, schließlich sind die derzeit eno… [+899 chars]",,de,'Frühling'
https://www.brigitte.de/aktuell/satin-bags--diese-taschen-sorgen-fuer-mehr-eleganz-im-fruehling-13522390.html,https://www.brigitte.de/aktuell/satin-bags--diese-taschen-sorgen-fuer-mehr-eleganz-im-fruehling-13522390.html,0,www.brigitte.de,Satin Bags: Diese Taschen sorgen für mehr Eleganz im Frühling,Stars wie Katy Perry sind ihr verfallen - der angesagten Satin Bag. So kombiniert man die trendige Tasche im Frühling.,https://image.brigitte.de/13522392/t/mg/v1/w1440/r1.7778/-/04--diese-taschen-sorgen-fuer-mehr-eleganz-im-fruehling---1-1---spoton-article-1043862.jpg,2023-05-04T20:24:00Z,https://web.archive.org/web/20230505031146/https://www.brigitte.de/aktuell/satin-bags--diese-taschen-sorgen-fuer-mehr-eleganz-im-fruehling-13522390.html,"Stars wie Katy Perry sind ihr verfallen - der angesagten Satin Bag. So kombiniert man die trendige Tasche im Frühling.
Zugegeben, besonders praktisch sind sie nicht, schließlich sind die derzeit eno… [+899 chars]",,de,'Frühling'
https://www.zeit.de/news/2023-05/05/regnerisches-wochenendwetter-teils-kraeftige-gewitter,https://www.zeit.de/news/2023-05/05/regnerisches-wochenendwetter-teils-kraeftige-gewitter,0,www.zeit.de,Wetter: Regnerisches Wochenendwetter: Teils kräftige Gewitter,,,2023-05-05T04:24:31Z,https://web.archive.org/web/20230505232831/https://www.zeit.de/news/2023-05/05/regnerisches-wochenendwetter-teils-kraeftige-gewitter,"When browsing with ads:
We collect personal data and also transmit it to third-party providers
 that help us improve and finance our digital content. Some of the information stored on your device, … [+732 chars]",,de,'Gewitter'
https://www.zeit.de/news/2023-05/05/nach-heiterem-start-faellt-regen-nachts-gewitter-moeglich,https://www.zeit.de/news/2023-05/05/nach-heiterem-start-faellt-regen-nachts-gewitter-moeglich,0,www.zeit.de,Wetter: Nach heiterem Start fällt Regen: Nachts Gewitter möglich,,,2023-05-05T04:35:35Z,https://web.archive.org/web/20230505232828/https://www.zeit.de/news/2023-05/05/nach-heiterem-start-faellt-regen-nachts-gewitter-moeglich,"When browsing with ads:
We collect personal data and also transmit it to third-party providers
 that help us improve and finance our digital content. Some of the information stored on your device, … [+732 chars]",,de,'Gewitter'
https://www.stern.de/gesellschaft/regional/sachsen/landwirtschaft--zu-viele-blueten--sachsens-obstbauern-gefordert-33439002.html,https://www.stern.de/gesellschaft/regional/sachsen/landwirtschaft--zu-viele-blueten--sachsens-obstbauern-gefordert-33439002.html,0,www.stern.de,Landwirtschaft: Zu viele Blüten: Sachsens Obstbauern gefordert,"Lang hat es gedauert, bis der Frühling in Schwung kam - nun ist er da, und die Obstbäume stehen in voller Blüte. Für die Bauern gibt es alle Hände voll zu tun.",https://image.stern.de/33439004/t/pZ/v1/w1440/r1.7778/-/05--urnnewsmldpacom2009010123050599568356v2w800h600l1240t953r3791b2548jpeg---555f44a2196996a9.jpg,2023-05-05T05:50:29Z,https://web.archive.org/web/20230505080319/https://www.stern.de/gesellschaft/regional/sachsen/landwirtschaft--zu-viele-blueten--sachsens-obstbauern-gefordert-33439002.html,"Lang hat es gedauert, bis der Frühling in Schwung kam - nun ist er da, und die Obstbäume stehen in voller Blüte. Für die Bauern gibt es alle Hände voll zu tun.
Die in voller Blüte stehenden Apfelbäu… [+1331 chars]",,de,'Frühling'
https://www.zeit.de/news/2023-05/05/unruhiges-wochenendwetter-teils-gewitter-und-sturmboeen,https://www.zeit.de/news/2023-05/05/unruhiges-wochenendwetter-teils-gewitter-und-sturmboeen,0,www.zeit.de,Wetter: Unruhiges Wochenendwetter: Teils Gewitter und Sturmböen,,,2023-05-05T05:51:18Z,https://web.archive.org/web/20230505232821/https://www.zeit.de/news/2023-05/05/unruhiges-wochenendwetter-teils-gewitter-und-sturmboeen,"When browsing with ads:
We collect personal data and also transmit it to third-party providers
 that help us improve and finance our digital content. Some of the information stored on your device, … [+732 chars]",,de,'Gewitter'
https://www.zeit.de/news/2023-05/05/gewitter-und-oertliche-unwettergefahr-in-hessen,https://www.zeit.de/news/2023-05/05/gewitter-und-oertliche-unwettergefahr-in-hessen,0,www.zeit.de,Wetter: Gewitter und örtliche Unwettergefahr in Hessen,,,2023-05-05T05:55:42Z,https://web.archive.org/web/20230505232821/https://www.zeit.de/news/2023-05/05/gewitter-und-oertliche-unwettergefahr-in-hessen,"When browsing with ads:
We collect personal data and also transmit it to third-party providers
 that help us improve and finance our digital content. Some of the information stored on your device, … [+732 chars]",,de,'Gewitter'
https://www.stern.de/gesellschaft/regional/sachsen-anhalt/wetter--schauer-und-gewitter-am-wochenende-in-sachsen-anhalt-33439218.html,https://www.stern.de/gesellschaft/regional/sachsen-anhalt/wetter--schauer-und-gewitter-am-wochenende-in-sachsen-anhalt-33439218.html,0,www.stern.de,Wetter: Schauer und Gewitter am Wochenende in Sachsen-Anhalt,"Schauer, Gewitter und teils Sturmböen erwartet die Menschen in Sachsen-Anhalt am Wochenende. Wie der Deutsche Wetterdienst (DWD) am Freitag mitteilte, startet der Tag mit einigen Wolken am Himmel, die sich im Tagesverlauf verdichten. Ab Mittag treten erste Sc…",https://image.stern.de/33439220/t/cr/v1/w1440/r1.7778/-/05--urnnewsmldpacom2009010123050599569343v2w800h600l1344t1162r3132b2349jpeg---8ef35fedaf43ca83.jpg,2023-05-05T07:11:33Z,,"Schauer, Gewitter und teils Sturmböen erwartet die Menschen in Sachsen-Anhalt am Wochenende. Wie der Deutsche Wetterdienst (DWD) am Freitag mitteilte, startet der Tag mit einigen Wolken am Himmel, di… [+1515 chars]",,de,'Gewitter'
https://www.zeit.de/news/2023-05/05/schauer-und-gewitter-am-wochenende-in-sachsen-anhalt,https://www.zeit.de/news/2023-05/05/schauer-und-gewitter-am-wochenende-in-sachsen-anhalt,0,www.zeit.de,Wetter: Schauer und Gewitter am Wochenende in Sachsen-Anhalt,,,2023-05-05T07:11:33Z,https://web.archive.org/web/20230505232800/https://www.zeit.de/news/2023-05/05/schauer-und-gewitter-am-wochenende-in-sachsen-anhalt,"When browsing with ads:
We collect personal data and also transmit it to third-party providers
 that help us improve and finance our digital content. Some of the information stored on your device, … [+732 chars]",,de,'Gewitter'
https://www.stern.de/lifestyle/mode/sneaker-trends-2023--diese-modelle-liegen-jetzt-im-trend-33439336.html,https://www.stern.de/lifestyle/mode/sneaker-trends-2023--diese-modelle-liegen-jetzt-im-trend-33439336.html,0,www.stern.de,Mode: Sneaker-Trends 2023: Fünf angesagte Modelle im Frühling,"Bunt oder einfarbig, auffällig oder clean: Welche Sneaker-Trends sind 2023 angesagt? Wir stellen die angesagtesten Modelle vor – und haben Styling-Tipps parat.",https://image.stern.de/30364838/t/Su/v12/w1440/r1.7778/-/sneaker-trends.jpg,2023-05-05T07:44:00Z,,"Sie sind gemütlich, vielseitig tragbar und kommen nie aus der Mode: Sneaker gehören einfach in jeden Schuhschrank. Aber welche Modelle sind derzeit besonders angesagt? Wir stellen die Sneaker-Trends … [+3942 chars]",,de,'Frühling'
https://www.brigitte.de/horoskop/wochen-horoskop-ab-8-5-2023--3-sternzeichen-haben-die-beste-woche-13522604.html,https://www.brigitte.de/horoskop/wochen-horoskop-ab-8-5-2023--3-sternzeichen-haben-die-beste-woche-13522604.html,0,www.brigitte.de,Wochen-Horoskop ab 8.5.2023: 3 Sternzeichen mit der besten Woche ab 8. Mai,"Mit der ersten vollen Maiwoche erwachen endlich die Frühlingsgefühle. Auf welche drei Sternzeichen laut Horoskop eine besonders tolle Woche wartet, erfährst du im Video.",https://image.brigitte.de/13522332/t/rk/v2/w1440/r1.7778/-/glueckspilz.jpg,2023-05-05T10:58:00Z,https://web.archive.org/web/20230506011637/https://www.brigitte.de/horoskop/wochen-horoskop-ab-8-5-2023--3-sternzeichen-haben-die-beste-woche-13522604.html,"Mit der ersten vollen Maiwoche erwachen endlich die Frühlingsgefühle. Auf welche drei Sternzeichen laut Horoskop eine besonders tolle Woche wartet, erfährst du im Video. 
Es ist Mai: Das bedeutet, d… [+753 chars]",,de,'Frühling'
