index,url,valid,domain,title,description,image,published,archive,content,quote,language,keyword
https://www.stern.de/gesellschaft/regional/baden-wuerttemberg/winter--feldberg-startet-puenktlich-in-die-skisaison--34248378.html,https://www.stern.de/gesellschaft/regional/baden-wuerttemberg/winter--feldberg-startet-puenktlich-in-die-skisaison--34248378.html,0,www.stern.de,Winter: Feldberg startet pünktlich in die Skisaison,Am 1493 Meter hohen Feldberg im Schwarzwald sollen wieder die Lifte rattern. Schnee gibt es genug. Auch an anderen Orten im Land kann Ski gefahren werden - und das Wetter soll erst einmal mitspielen.,https://image.stern.de/34248600/t/l0/v1/w1440/r1.7778/-/01--urnnewsmldpacom2009010123120199141082v3w800h600l640t425r1920b1275jpeg---4ac3cf567847b678.jpg,2023-12-01T04:13:03Z,https://web.archive.org/web/20231201043716/https://www.stern.de/gesellschaft/regional/baden-wuerttemberg/winter--feldberg-startet-puenktlich-in-die-skisaison--34248378.html,Am 1493 Meter hohen Feldberg im Schwarzwald sollen wieder die Lifte rattern. Schnee gibt es genug. Auch an anderen Orten im Land kann Ski gefahren werden - und das Wetter soll erst einmal mitspielen.… [+1779 chars],,de,'Schnee'
https://www.zeit.de/news/2023-12/01/im-harz-oeffnen-erste-ski-und-rodellifte,https://www.zeit.de/news/2023-12/01/im-harz-oeffnen-erste-ski-und-rodellifte,0,www.zeit.de,Wintersport: Im Harz öffnen erste Ski- und Rodellifte,Hier finden Sie Informationen zu dem Thema „Wintersport“. Lesen Sie jetzt „Im Harz öffnen erste Ski- und Rodellifte“.,https://img.zeit.de/news/2023-12/01/im-harz-oeffnen-erste-ski-und-rodellifte-image-group/wide__1300x731,2023-12-01T05:53:37Z,,Der Harz startet am Wochenende in die Wintersportsaison. Zeitgleich mit vielen Skigebieten in den Alpen sollen am Samstag vielerorts die ersten Lifte fahren. «Wir haben etwa 40 Zentimeter reinen Natu… [+2301 chars],,de,'Winter'
https://www.stern.de/gesellschaft/regional/niedersachsen-bremen/wintersport--im-harz-oeffnen-erste-ski--und-rodellifte--34248784.html,https://www.stern.de/gesellschaft/regional/niedersachsen-bremen/wintersport--im-harz-oeffnen-erste-ski--und-rodellifte--34248784.html,0,www.stern.de,Wintersport: Im Harz öffnen erste Ski- und Rodellifte,Braunlage (lni) - Der Harz startet am Wochenende in die Wintersportsaison. Zeitgleich mit vielen Skigebieten in den Alpen sollen am Samstag vielerorts die,https://image.stern.de/34248786/t/tN/v1/w1440/r1.7778/-/01--urnnewsmldpacom2009010123120199142108v3w800h600l640t425r1920b1278jpeg---a84872651c20fa4c.jpg,2023-12-01T05:53:37Z,https://web.archive.org/web/20231201065718/https://www.stern.de/gesellschaft/regional/niedersachsen-bremen/wintersport--im-harz-oeffnen-erste-ski--und-rodellifte--34248784.html,"Der Winter hat im Harz Einzug erhalten. Zum 1. Advent können Skifahrer und Rodler im Harz in die neue Schneesaison starten. Wo bereits Lifte laufen.
Der Harz startet am Wochenende in die Wintersport… [+1787 chars]",,de,'Winter'
https://www.n-tv.de/mediathek/videos/wetter/Wetter-bleibt-zum-Wochenausklang-gefaehrlich-fuer-Fahrer-article24569346.html,https://www.n-tv.de/mediathek/videos/wetter/Wetter-bleibt-zum-Wochenausklang-gefaehrlich-fuer-Fahrer-article24569346.html,0,www.n-tv.de,Weißes Adventswochenende voraus: Wetter bleibt zum Wochenausklang gefährlich für Fahrer,"Zum Start in den Dezember legt der Schnee zumindest in Mitteldeutschland eine kurze Pause ein, im Süden und an der Nordseeküste fallen weiter Flocken. Am Wochenende gibt es dann deutschlandweit reichlich Weiß, inklusive gefährlich glatten Straßen.",https://bilder1.n-tv.de/img/incoming/crop24570236/4961325009-cImg_16_9-w1200/436660900.jpg,2023-12-01T05:58:00Z,https://web.archive.org/web/20231201091701/https://www.n-tv.de/mediathek/videos/wetter/Wetter-bleibt-zum-Wochenausklang-gefaehrlich-fuer-Fahrer-article24569346.html,,,de,'Schnee'
https://www.morgenpost.de/berlin/article240691438/wetter-berlin-aktuell-heute-morgen-warnung-schnee-glaette-frost-0112.html,https://www.morgenpost.de/berlin/article240691438/wetter-berlin-aktuell-heute-morgen-warnung-schnee-glaette-frost-0112.html,0,www.morgenpost.de,"Wetter in Berlin: Warnung vor Frost, Schnee und Glätte",Am Freitagmorgen liegen die Temperaturen zwischen -5 und -8 Grad. Wie wird das Wetter heute und morgen? Die News im Wetter-Blog.,https://img.sparknews.funkemedien.de/240691348/240691348_1701411062_v4_3_800.jpeg,2023-12-01T06:00:00Z,https://web.archive.org/web/20231201153549/https://www.morgenpost.de/berlin/article240691438/wetter-berlin-aktuell-heute-morgen-warnung-schnee-glaette-frost-0112.html,"Am Freitagmorgen liegen die Temperaturen zwischen -5 und -8 Grad. Wie wird das Wetter heute und morgen? Die News im Wetter-Blog.
<ul><li>Frost, Schnee und glatte Straßen zum Dezemberstart</li><li>Au… [+16679 chars]",,de,'Schnee'
https://www.bild.de/regional/ruhrgebiet/ruhrgebiet-aktuell/winterberg-rauscht-ab-jetzt-machen-die-ersten-lifte-auf-86285940.bild.html,https://www.bild.de/regional/ruhrgebiet/ruhrgebiet-aktuell/winterberg-rauscht-ab-jetzt-machen-die-ersten-lifte-auf-86285940.bild.html,0,www.bild.de,Winterberg rauscht ab - Jetzt machen die ersten Lifte auf!,Jetzt also doch schon. Schneller als gedacht öffnen im Sauerland die ersten Lifte. Ab Freitag 9 Uhr rauscht Winterberg ab!,"https://images.bild.de/65697764f268d169c25647a8/dc1f8f060942017db0c44072c6feeb27,81681338?w=1280",2023-12-01T06:21:13Z,https://web.archive.org/web/20231201131821/https://www.bild.de/regional/ruhrgebiet/ruhrgebiet-aktuell/winterberg-rauscht-ab-jetzt-machen-die-ersten-lifte-auf-86285940.bild.html,"Winterberg (NRW) Jetzt also doch schon. Schneller als gedacht öffnen im Sauerland die ersten Lifte. Ab Freitag 9 Uhr rauscht Winterberg ab!
Nach dem frühen Wintereinbruch will das Skiliftkarussell W… [+992 chars]",,de,'Winter'
https://www.zeit.de/news/2023-12/01/schnee-und-glaette-zum-wochenendstart-in-thueringen,https://www.zeit.de/news/2023-12/01/schnee-und-glaette-zum-wochenendstart-in-thueringen,0,www.zeit.de,Wetter: Schnee und Glätte zum Wochenendstart in Thüringen,Hier finden Sie Informationen zu dem Thema „Wetter“. Lesen Sie jetzt „Schnee und Glätte zum Wochenendstart in Thüringen“.,https://img.zeit.de/news/2023-12/01/schnee-und-glaette-zum-wochenendstart-in-thueringen-image-group/wide__1300x731,2023-12-01T06:32:10Z,,"Schnee und Glätte erwartet die Menschen in Thüringen am Freitag. Es kommt besonders am Vormittag zu leichtem Schneefall, wie der Deutsche Wetterdienst (DWD) mitteilte. Ab Nachmittag schneit es demnac… [+1409 chars]",,de,'Schnee'
https://www.stern.de/gesellschaft/regional/thueringen/wetter--schnee-und-glaette-zum-wochenendstart-in-thueringen-34248856.html,https://www.stern.de/gesellschaft/regional/thueringen/wetter--schnee-und-glaette-zum-wochenendstart-in-thueringen-34248856.html,0,www.stern.de,Wetter: Schnee und Glätte zum Wochenendstart in Thüringen,"Schnee und Glätte erwartet die Menschen in Thüringen am Freitag. Es kommt besonders am Vormittag zu leichtem Schneefall, wie der Deutsche Wetterdienst (DWD) mitteilte. Ab Nachmittag schneit es demnach nur noch im Thüringer Vogtland. Es tritt Glätte auf, dabei…",https://image.stern.de/34248858/t/AG/v1/w1440/r1.7778/-/01--urnnewsmldpacom2009010123120199142571v3w800h600l640t412r1920b1236jpeg---d61ca7d4be5352ce.jpg,2023-12-01T06:32:10Z,https://web.archive.org/web/20231201171107/https://www.stern.de/gesellschaft/regional/thueringen/wetter--schnee-und-glaette-zum-wochenendstart-in-thueringen-34248856.html,"Schnee und Glätte erwartet die Menschen in Thüringen am Freitag. Es kommt besonders am Vormittag zu leichtem Schneefall, wie der Deutsche Wetterdienst (DWD) mitteilte. Ab Nachmittag schneit es demnac… [+1360 chars]",,de,'Schnee'
https://www.stern.de/gesellschaft/regional/berlin-brandenburg/wetter--frostiger-dezemberstart-in-berlin-und-brandenburg-34248906.html,https://www.stern.de/gesellschaft/regional/berlin-brandenburg/wetter--frostiger-dezemberstart-in-berlin-und-brandenburg-34248906.html,0,www.stern.de,Wetter: Frostiger Dezemberstart in Berlin und Brandenburg,"Zum Dezemberbeginn gibt es in Berlin und Brandenburg weiterhin Frost, Schnee und teilweise Glättegefahr. In den Freitagmorgenstunden liegen die Temperaturen zwischen minus 5 und minus 8 Grad, lokal sinken sie bis auf minus 12 Grad, wie der Deutsche Wetterdien…",https://image.stern.de/34248908/t/zE/v1/w1440/r1.7778/-/01--urnnewsmldpacom2009010123120199142713v3w800h600l640t423r1920b1269jpeg---d98fb630793055cb.jpg,2023-12-01T06:52:53Z,https://web.archive.org/web/20231201084207/https://www.stern.de/gesellschaft/regional/berlin-brandenburg/wetter--frostiger-dezemberstart-in-berlin-und-brandenburg-34248906.html,"Zum Dezemberbeginn gibt es in Berlin und Brandenburg weiterhin Frost, Schnee und teilweise Glättegefahr. In den Freitagmorgenstunden liegen die Temperaturen zwischen minus 5 und minus 8 Grad, lokal s… [+845 chars]",,de,'Schnee'
https://www.zeit.de/news/2023-12/01/leichter-schnee-und-wolken-winterlich-zum-wochenende,https://www.zeit.de/news/2023-12/01/leichter-schnee-und-wolken-winterlich-zum-wochenende,0,www.zeit.de,Wetter: Leichter Schnee und Wolken - winterlich zum Wochenende,Hier finden Sie Informationen zu dem Thema „Wetter“. Lesen Sie jetzt „Leichter Schnee und Wolken - winterlich zum Wochenende“.,https://img.zeit.de/news/2023-12/01/leichter-schnee-und-wolken-winterlich-zum-wochenende-image-group/wide__1300x731,2023-12-01T07:08:48Z,https://web.archive.org/web/20231202124617/https://www.zeit.de/news/2023-12/01/leichter-schnee-und-wolken-winterlich-zum-wochenende,"Leichter Schneefall und Wolken erwarten die Menschen in Sachsen-Anhalt am Freitag. Vor allem in der Früh kommt es zu Frost, wie der Deutsche Wetterdienst (DWD) mitteilte. Am Vormittag schneit es südl… [+1465 chars]",,de,'Winter'
https://www.faz.net/aktuell/wirtschaft/wohnen/heizen-daemmen-sanieren-wie-sie-ihr-haus-auf-den-winter-vorbereiten-19276744.html,https://www.faz.net/aktuell/wirtschaft/wohnen/heizen-daemmen-sanieren-wie-sie-ihr-haus-auf-den-winter-vorbereiten-19276744.html,0,www.faz.net,"Heizen, dämmen, sanieren: Das Haus auf den Winter vorbereiten","Viele Wege führen zum Energiesparen. Oft sind die Investitionskosten hoch, aber es gibt auch Maßnahmen, die jeder ohne zusätzliche Kosten sofort umsetzen kann.",https://media1.faz.net/ppmedia/aktuell/wirtschaft/3150951040/1.9337885/facebook_teaser_fplus/heizung-aufdrehen-eine.jpg,2023-12-01T09:15:23Z,,"Der Tipp des Fachmanns ist einfach: Vorlauftemperaturen begrenzen, sagt Oliver Petri, Geschäftsführer des eigenen Betriebs Petri Heizung Sanitär in Mühlheim. Zu Hause kann jeder die Vorlauftemperatur… [+940 chars]",,de,'Winter'
https://www.zeit.de/news/2023-12/01/warnung-vor-schneebeladenen-aesten-in-parks-und-gaerten,https://www.zeit.de/news/2023-12/01/warnung-vor-schneebeladenen-aesten-in-parks-und-gaerten,0,www.zeit.de,Wetter: Warnung vor schneebeladenen Ästen in Parks und Gärten,Hier finden Sie Informationen zu dem Thema „Wetter“. Lesen Sie jetzt „Warnung vor schneebeladenen Ästen in Parks und Gärten“.,https://img.zeit.de/news/2023-12/01/warnung-vor-schneebeladenen-aesten-in-parks-und-gaerten-image-group/wide__1300x731,2023-12-01T11:51:45Z,,"Das Winterwetter lädt zu Spaziergängen in Parks und Gärten ein. Doch das kann mitunter gefährlich werden, warnt die Stiftung Thüringer Schlösser und Gärten. Unter dem Gewicht des Schnees könnten Äste… [+426 chars]",,de,'Schnee'
https://www.zeit.de/2023-12/muenchen-flughafen-ausfaelle-winter-glaette-unfaelle,https://www.zeit.de/2023-12/muenchen-flughafen-ausfaelle-winter-glaette-unfaelle,0,www.zeit.de,Wintereinbruch: Schneefall sorgt für 150 Flugausfälle am Flughafen München,Glätte und Schnee treffen jetzt auch den Flugverkehr: In München bleiben hunderte Passagiere vorerst am Flughafen stecken. In Süddeutschland kam es zu Unfällen.,https://img.zeit.de/mobilitaet/2023-12/muenchen-flughafen-winter-bild/wide__1300x731,2023-12-01T17:48:23Z,https://web.archive.org/web/20231202030423/https://www.zeit.de/2023-12/muenchen-flughafen-ausfaelle-winter-glaette-unfaelle,"Am Flughafen München sind witterungsbedingt mehr als 150 Starts und Landungen abgesagt worden. Schneefall und niedrige Temperaturen würden dafür sorgen, dass voraussichtlich etwa 160 Flüge abgesagt w… [+1647 chars]",,de,'Schnee'
https://www.zeit.de/news/2023-12/02/schnee-und-eis-legen-bahnverkehr-im-sueden-bayerns-lahm,https://www.zeit.de/news/2023-12/02/schnee-und-eis-legen-bahnverkehr-im-sueden-bayerns-lahm,0,www.zeit.de,Verkehr: Schnee und Eis legen Bahnverkehr im Süden Bayerns lahm,Hier finden Sie Informationen zu dem Thema „Verkehr“. Lesen Sie jetzt „Schnee und Eis legen Bahnverkehr im Süden Bayerns lahm“.,https://img.zeit.de/news/2023-12/02/schnee-und-eis-legen-bahnverkehr-im-sueden-bayerns-lahm-image-group/wide__1300x731,2023-12-02T02:49:34Z,https://web.archive.org/web/20231203052549/https://www.zeit.de/news/2023-12/02/schnee-und-eis-legen-bahnverkehr-im-sueden-bayerns-lahm,"Schnee und Eis haben auf den Straßen und bei der Bahn im Süden Bayerns für Chaos gesorgt. Zahlreiche Bahnstrecken rund um die Landeshauptstadt München mussten in der Nacht gesperrt werden, wie die De… [+2568 chars]",,de,'Schnee'
https://www.zeit.de/news/2023-12/02/mehrheit-glaubt-nicht-an-ein-sommermaerchen-2-0-bei-der-em,https://www.zeit.de/news/2023-12/02/mehrheit-glaubt-nicht-an-ein-sommermaerchen-2-0-bei-der-em,0,www.zeit.de,Nationalmannschaft: Mehrheit glaubt nicht an ein Sommermärchen 2.0 bei der EM,Hier finden Sie Informationen zu dem Thema „Nationalmannschaft“. Lesen Sie jetzt „Mehrheit glaubt nicht an ein Sommermärchen 2.0 bei der EM“.,https://img.zeit.de/news/2023-12/02/mehrheit-glaubt-nicht-an-ein-sommermaerchen-2-0-bei-der-em-image-group/wide__1300x731,2023-12-02T06:05:19Z,,"Nur ein kleiner Teil der Deutschen glaubt an eine Wiederholung des Fußball-Sommermärchens von 2006 bei der Heim-Europameisterschaft im kommenden Sommer. 
Mehr Schlagzeilen
In einer repräsentativen … [+2908 chars]",,de,'Sommer'
https://www.zeit.de/mobilitaet/2023-12/bahn-bayern-wintereinbruch-schnee-zugausfaelle,https://www.zeit.de/mobilitaet/2023-12/bahn-bayern-wintereinbruch-schnee-zugausfaelle,0,www.zeit.de,Wintereinbruch: Schnee legt Bahnverkehr in Bayern lahm,"Im Großraum München fallen wegen Schnee und Eis zahlreiche Bahnverbindungen aus, Reisende mussten teilweise im Zug übernachten. Die Einschränkungen dürften andauern.",https://img.zeit.de/administratives/sharing/fallback-image/wide__1300x731,2023-12-02T06:29:38Z,https://web.archive.org/web/20231202091037/https://www.zeit.de/mobilitaet/2023-12/bahn-bayern-wintereinbruch-schnee-zugausfaelle,"Wegen des Wintereinbruchs ist der Bahnverkehr in Süddeutschland stark beeinträchtigt. Derzeit komme es zu Verspätungen und Zugausfällen, teilte eine Bahnsprecherin mit. Der Hauptbahnhof in München kö… [+1893 chars]",,de,'Winter'
https://www.zeit.de/news/2023-12/02/winter-in-nrw-mit-wolken-temperaturen-um-den-gefrierpunkt,https://www.zeit.de/news/2023-12/02/winter-in-nrw-mit-wolken-temperaturen-um-den-gefrierpunkt,0,www.zeit.de,Wetter: Winter in NRW mit Wolken - Temperaturen um den Gefrierpunkt,Hier finden Sie Informationen zu dem Thema „Wetter“. Lesen Sie jetzt „Winter in NRW mit Wolken - Temperaturen um den Gefrierpunkt“.,https://img.zeit.de/news/2023-12/02/winter-in-nrw-mit-wolken-temperaturen-um-den-gefrierpunkt-image-group/wide__1300x731,2023-12-02T09:22:12Z,,Das Winterwetter in Nordrhein-Westfalen hält bis in die neue Woche an. Der Deutsche Wetterdienst (DWD) rechnet am Sonntag mit Tagestemperaturen zwischen null und plus drei Grad und wechselnd bis star… [+671 chars],,de,'Winter'
https://www.zeit.de/news/2023-12/02/mehr-als-200-feuerwehreinsaetze-wegen-schnee-in-muenchen,https://www.zeit.de/news/2023-12/02/mehr-als-200-feuerwehreinsaetze-wegen-schnee-in-muenchen,0,www.zeit.de,Wetter: Mehr als 200 Feuerwehreinsätze wegen Schnee in München,Hier finden Sie Informationen zu dem Thema „Wetter“. Lesen Sie jetzt „Mehr als 200 Feuerwehreinsätze wegen Schnee in München“.,https://img.zeit.de/news/2023-12/02/mehr-als-200-feuerwehreinsaetze-wegen-schnee-in-muenchen-image-group/wide__1300x731,2023-12-02T09:25:12Z,https://web.archive.org/web/20231203181146/https://www.zeit.de/news/2023-12/02/mehr-als-200-feuerwehreinsaetze-wegen-schnee-in-muenchen,"Der starke Schneefall hat in München bereits zu 200 Einsätzen der Feuerwehr geführt. Die Feuerwehrleute kümmerten sich seit dem Freitagabend um durch die Schneelast herabfallende Äste, umgefallene Bä… [+1514 chars]",,de,'Schnee'
https://www.zeit.de/news/2023-12/02/bayerns-forstministerin-raet-von-aufenthalten-in-waeldern-ab,https://www.zeit.de/news/2023-12/02/bayerns-forstministerin-raet-von-aufenthalten-in-waeldern-ab,0,www.zeit.de,Schnee: Bayerns Forstministerin rät von Aufenthalten in Wäldern ab,Hier finden Sie Informationen zu dem Thema „Schnee“. Lesen Sie jetzt „Bayerns Forstministerin rät von Aufenthalten in Wäldern ab“.,https://img.zeit.de/news/2023-12/02/bayerns-forstministerin-raet-von-aufenthalten-in-waeldern-ab-image-group/wide__1300x731,2023-12-02T10:45:38Z,https://web.archive.org/web/20231205012653/https://www.zeit.de/news/2023-12/02/bayerns-forstministerin-raet-von-aufenthalten-in-waeldern-ab,Bayerns Forstministerin Michaela Kaniber (CSU) rät angesichts der starken Schneefälle insbesondere in Südostbayern vom Betreten der Wälder ab. Herabfallende Äste oder umstürzende Bäume seien eine Gef… [+451 chars],,de,'Schnee'
https://www.zeit.de/gesellschaft/2023-12/wintereinbruch-wetterlage-chaos-schnee-eis-fs,https://www.zeit.de/gesellschaft/2023-12/wintereinbruch-wetterlage-chaos-schnee-eis-fs,0,www.zeit.de,Wintereinbruch: Schönheit im Chaos,In Teilen Deutschlands ist viel Schnee gefallen. Zusammen mit eisigen Temperaturen legte er in München den Verkehr lahm. Es sieht aber auch bizarr schön aus. Die Bilder,https://img.zeit.de/gesellschaft/2023-12/wintereinbruch-wetterlage-chaos-schnee-eis-fs-bild/wide__1300x731,2023-12-02T10:47:33Z,https://web.archive.org/web/20231202110527/https://www.zeit.de/gesellschaft/2023-12/wintereinbruch-wetterlage-chaos-schnee-eis-fs,"In der Nacht fiel in manchen Regionen Deutschlands so viel Schnee, dass sich Städte und Landschaft völlig veränderten. Manche können den Anblick den Winterlandschaften genießen. Im Süden Bayerns führ… [+156 chars]",,de,'Winter'
https://www.zeit.de/news/2023-12/02/erstes-adventswochenende-mit-schnee-frost-und-glaette,https://www.zeit.de/news/2023-12/02/erstes-adventswochenende-mit-schnee-frost-und-glaette,0,www.zeit.de,"Wetter: Erstes Adventswochenende mit Schnee, Frost und Glätte","Hier finden Sie Informationen zu dem Thema „Wetter“. Lesen Sie jetzt „Erstes Adventswochenende mit Schnee, Frost und Glätte“.",https://img.zeit.de/news/2023-12/02/erstes-adventswochenende-mit-schnee-frost-und-glaette-image-group/wide__1300x731,2023-12-02T12:24:16Z,,Winterlich mit Frost und Glätte präsentiert sich das erste Adventswochenende in Rheinland-Pfalz und im Saarland. Am Sonntag wird es wechselnd bis stark bewölkt und dazu bleibt es überwiegend niedersc… [+1626 chars],,de,'Glatteis'
https://www.zeit.de/news/2023-12/02/augsburgs-spiel-gegen-frankfurt-soll-stattfinden,https://www.zeit.de/news/2023-12/02/augsburgs-spiel-gegen-frankfurt-soll-stattfinden,0,www.zeit.de,Schneefall: Augsburgs Spiel gegen Frankfurt soll stattfinden,Hier finden Sie Informationen zu dem Thema „Schneefall“. Lesen Sie jetzt „Augsburgs Spiel gegen Frankfurt soll stattfinden“.,https://img.zeit.de/news/2023-12/02/augsburgs-spiel-gegen-frankfurt-soll-stattfinden-image-group/wide__1300x731,2023-12-02T13:35:04Z,,"Der FC Augsburg geht trotz des heftigen Winter-Einbruchs im Süden Deutschlands davon aus, dass das Heimspiel an diesem Sonntag (19.30 Uhr/DAZN) gegen Eintracht Frankfurt wie geplant stattfinden kann.… [+525 chars]",,de,'Schnee'
https://www.zeit.de/news/2023-12/03/schnee-und-einstellige-temperaturen-in-nordrhein-westfalen,https://www.zeit.de/news/2023-12/03/schnee-und-einstellige-temperaturen-in-nordrhein-westfalen,0,www.zeit.de,Wetter: Schnee und einstellige Temperaturen in Nordrhein-Westfalen,Hier finden Sie Informationen zu dem Thema „Wetter“. Lesen Sie jetzt „Schnee und einstellige Temperaturen in Nordrhein-Westfalen“.,https://img.zeit.de/news/2023-12/03/schnee-und-einstellige-temperaturen-in-nordrhein-westfalen-image-group/wide__1300x731,2023-12-03T09:31:47Z,https://web.archive.org/web/20231204064439/https://www.zeit.de/news/2023-12/03/schnee-und-einstellige-temperaturen-in-nordrhein-westfalen,"In den kommenden Tagen müssen sich die Menschen in Nordrhein-Westfalen auf weiterhin niedrige Temperaturen und auch Schnee einstellen. Am Sonntag sei der Himmel zunächst wechselnd bewölkt, schrieb de… [+2115 chars]",,de,'Schnee'
https://www.zeit.de/news/2023-12/03/messe-muenchen-wieder-geoeffnet,https://www.zeit.de/news/2023-12/03/messe-muenchen-wieder-geoeffnet,0,www.zeit.de,Schnee-Chaos: Messe München wieder geöffnet,Hier finden Sie Informationen zu dem Thema „Schnee-Chaos“. Lesen Sie jetzt „Messe München wieder geöffnet“.,https://img.zeit.de/administratives/sharing/fallback-image/wide__1300x731,2023-12-03T10:07:46Z,https://web.archive.org/web/20231204053933/https://www.zeit.de/news/2023-12/03/messe-muenchen-wieder-geoeffnet,Die Handwerksmesse in München hat nach einer Zwangspause wegen starken Schneefalls am Sonntag wieder für Besucher geöffnet. Einer Sprecherin zufolge gilt das neben der Heim+Handwerk auch für die Mess… [+200 chars],,de,'Schnee'
https://www.zeit.de/news/2023-12/03/bahn-reisende-sollten-nicht-noetige-fahrten-verschieben,https://www.zeit.de/news/2023-12/03/bahn-reisende-sollten-nicht-noetige-fahrten-verschieben,0,www.zeit.de,Schnee-Chaos: Bahn: Reisende sollten nicht nötige Fahrten verschieben,Hier finden Sie Informationen zu dem Thema „Schnee-Chaos“. Lesen Sie jetzt „Bahn: Reisende sollten nicht nötige Fahrten verschieben“.,https://img.zeit.de/news/2023-12/03/bahn-reisende-sollten-nicht-noetige-fahrten-verschieben-image-group/wide__1300x731,2023-12-03T10:37:45Z,https://web.archive.org/web/20231204104953/https://www.zeit.de/news/2023-12/03/bahn-reisende-sollten-nicht-noetige-fahrten-verschieben,"Die Deutsche Bahn bittet Reisende wegen des heftigen Wintereinbruchs in Süddeutschland, auch am Montag nicht dringend notwendige Fahrten zu verschieben. Man werde auch zum Wochenstart nicht alle Verb… [+1205 chars]",,de,'Schnee'
https://www.zeit.de/news/2023-12/03/tierpark-hellabrunn-in-muenchen-und-zoo-augsburg-geschlossen,https://www.zeit.de/news/2023-12/03/tierpark-hellabrunn-in-muenchen-und-zoo-augsburg-geschlossen,0,www.zeit.de,Schnee-Chaos: Tierpark Hellabrunn in München und Zoo Augsburg geschlossen,Hier finden Sie Informationen zu dem Thema „Schnee-Chaos“. Lesen Sie jetzt „Tierpark Hellabrunn in München und Zoo Augsburg geschlossen“.,https://img.zeit.de/news/2023-12/03/tierpark-hellabrunn-in-muenchen-und-zoo-augsburg-geschlossen-image-group/wide__1300x731,2023-12-03T10:39:57Z,https://web.archive.org/web/20231204104400/https://www.zeit.de/news/2023-12/03/tierpark-hellabrunn-in-muenchen-und-zoo-augsburg-geschlossen,"Der Tierpark Hellabrunn in München und der Zoo Augsburg blieben nach dem starken Schneefall auch am Sonntag geschlossen. Die Sicherheit auf den Wegen sei wegen Schneebruchgefahr beeinträchtigt, hieß … [+41 chars]",,de,'Schnee'
https://www.zeit.de/news/2023-12/03/fc-bayern-schaut-bei-winter-transfers-auf-defensivbereich,https://www.zeit.de/news/2023-12/03/fc-bayern-schaut-bei-winter-transfers-auf-defensivbereich,0,www.zeit.de,Bundesliga: FC Bayern schaut bei Winter-Transfers auf Defensivbereich,Hier finden Sie Informationen zu dem Thema „Bundesliga“. Lesen Sie jetzt „FC Bayern schaut bei Winter-Transfers auf Defensivbereich“.,https://img.zeit.de/news/2023-12/03/fc-bayern-schaut-bei-winter-transfers-auf-defensivbereich-image-group/wide__1300x731,2023-12-03T10:41:02Z,,Vereinspräsident Herbert Hainer hat sich mit Blick auf die bevorstehende Wintertransfer-Periode zurückhaltend zu möglichen Aktivitäten des FC Bayern München geäußert. Trainer Thomas Tuchel sieht vor … [+2158 chars],,de,'Sommer'
https://www.zeit.de/news/2023-12/03/oesterreich-noch-20-000-haushalte-ohne-strom,https://www.zeit.de/news/2023-12/03/oesterreich-noch-20-000-haushalte-ohne-strom,0,www.zeit.de,Schnee-Chaos: Österreich: Noch 20.000 Haushalte ohne Strom,Hier finden Sie Informationen zu dem Thema „Schnee-Chaos“. Lesen Sie jetzt „Österreich: Noch 20.000 Haushalte ohne Strom“.,https://img.zeit.de/news/2023-12/03/oesterreich-noch-20-000-haushalte-ohne-strom-image-group/wide__1300x731,2023-12-03T10:45:44Z,https://web.archive.org/web/20231204090746/https://www.zeit.de/news/2023-12/03/oesterreich-noch-20-000-haushalte-ohne-strom,"Nach intensiven Schneefällen sind in Österreich laut Energieversorgern noch immer mindestens 20.000 Haushalte ohne Strom. In der Steiermark war ein Hochspannungsmast umgeknickt, was in Teilen des Bun… [+841 chars]",,de,'Schnee'
https://www.zeit.de/news/2023-12/03/dieb-hinterlaesst-spuren-im-schnee-und-wird-gestellt,https://www.zeit.de/news/2023-12/03/dieb-hinterlaesst-spuren-im-schnee-und-wird-gestellt,0,www.zeit.de,Zittau: Dieb hinterlässt Spuren im Schnee: Und wird gestellt,Hier finden Sie Informationen zu dem Thema „Zittau“. Lesen Sie jetzt „Dieb hinterlässt Spuren im Schnee: Und wird gestellt“.,https://img.zeit.de/news/2023-12/03/dieb-hinterlaesst-spuren-im-schnee-und-wird-gestellt-image-group/wide__1300x731,2023-12-03T12:47:07Z,,"Mithilfe seiner Schuhabdrücke im Schnee hat die Polizei in Zittau einen Dieb gefunden und gestellt. Der 41-Jährige war am Samstagabend in eine Grundschule im Landkreis Görlitz eingebrochen, wie die P… [+583 chars]",,de,'Schnee'
