index,url,valid,domain,title,description,image,published,archive,content,quote,language,keyword
https://www.stern.de/gesellschaft/regional/nordrhein-westfalen/hilfe-fuer-wiederaufbau--nach-hochwasser-katastrophe--4-1-milliarden-euro-bewilligt-34864600.html,https://www.stern.de/gesellschaft/regional/nordrhein-westfalen/hilfe-fuer-wiederaufbau--nach-hochwasser-katastrophe--4-1-milliarden-euro-bewilligt-34864600.html,0,www.stern.de,"Hilfe für Wiederaufbau: Nach Hochwasser-Katastrophe: 4,1 Milliarden Euro bewilligt","Das Jahrhundert-Hochwasser wirkt nach. Erst ein Teil des milliardenschweren Topfs für den Wiederaufbau ist ausgegeben. Wahrscheinlich wird der Betrag nicht komplett benötigt, sagt die Ministerin.",https://image.stern.de/34864602/t/cC/v1/w1440/r1.7778/-/09--whvq5vdkp3v17axw800h600jpeg---8e996ff87627256d.jpg,2024-07-09T04:00:38Z,,"Das Jahrhundert-Hochwasser wirkt nach. Erst ein Teil des milliardenschweren Topfs für den Wiederaufbau ist ausgegeben. Wahrscheinlich wird der Betrag nicht komplett benötigt, sagt die Ministerin.
Ru… [+1816 chars]",,de,'Hochwasser'
https://www.zeit.de/news/2024-07/09/nach-hochwasser-katastrophe-4-1-milliarden-euro-bewilligt,https://www.zeit.de/news/2024-07/09/nach-hochwasser-katastrophe-4-1-milliarden-euro-bewilligt,0,www.zeit.de,"Hilfe für Wiederaufbau: Nach Hochwasser-Katastrophe: 4,1 Milliarden Euro bewilligt","Hier finden Sie Informationen zu dem Thema „Hilfe für Wiederaufbau“. Lesen Sie jetzt „Nach Hochwasser-Katastrophe: 4,1 Milliarden Euro bewilligt“.",https://img.zeit.de/news/2024-07/09/nach-hochwasser-katastrophe-4-1-milliarden-euro-bewilligt-image-group/wide__1300x731,2024-07-09T04:00:38Z,,"Rund drei Jahre nach der Hochwasser-Katastrophe ist von den 12,3 Milliarden Euro für den Wiederaufbau rund ein Drittel für Hilfen zugesagt. Insgesamt rund 4,1 Milliarden Euro seien bewilligt worden, … [+2368 chars]",,de,'Hochwasser'
https://www.zeit.de/news/2024-07/09/sommerwetter-im-norden-bis-zu-30-grad-erwartet,https://www.zeit.de/news/2024-07/09/sommerwetter-im-norden-bis-zu-30-grad-erwartet,0,www.zeit.de,Wetter: Sommerwetter im Norden – bis zu 30 Grad erwartet,Hier finden Sie Informationen zu dem Thema „Wetter“. Lesen Sie jetzt „Sommerwetter im Norden – bis zu 30 Grad erwartet“.,https://img.zeit.de/news/2024-07/09/sommerwetter-im-norden-bis-zu-30-grad-erwartet-image-group/wide__1300x731,2024-07-09T05:18:52Z,,"Der Deutsche Wetterdienst (DWD) hat Sommerwetter für den Norden vorhergesagt. Am Dienstagmorgen sei noch mit Wolken und gelegentlichem Regen zu rechnen, ehe im weiteren Tagesverlauf Temperaturen von … [+432 chars]",,de,'Sommer'
https://www.focus.de/politik/deutschland/wer-nicht-erscheint-bekommt-weniger-erste-landkreise-kuerzen-arbeitsunwilligen-fluechtlingen-das-geld_id_260120513.html,https://www.focus.de/politik/deutschland/wer-nicht-erscheint-bekommt-weniger-erste-landkreise-kuerzen-arbeitsunwilligen-fluechtlingen-das-geld_id_260120513.html,0,www.focus.de,"Wer nicht erscheint, bekommt weniger - Erste Landkreise kürzen arbeitsunwilligen Flüchtlingen das Geld","Der Landrat von Mansfeld-Südharz macht Ernst. Hier wurden nach dem Hochwasser der Helme 64 Asylbewerber zum Aufräumen beordert. Und wer nicht kam, bekommt nun weniger Geld.",https://p6.focus.de/img/regional/berlin/id_260118679/die-berliner-cdu-fraktion-fordert-fuer-asylbewerber-eine-pflicht-zu-gemeinnnuetziger-arbeit.-archivbild-.jpg?im=Crop%3D%280%2C170%2C2048%2C1024%29%3BResize%3D%281200%2C627%29&impolicy=perceptual&quality=mediumHigh&hash=c9012793107403221a0a99609692751654fa38e4194b1e0c3bf6f722b6bd2ea3,2024-07-09T05:23:12Z,,"Der Landrat von Mansfeld-Südharz macht Ernst. Hier wurden nach dem Hochwasser der Helme 64 Asylbewerber zum Aufräumen beordert. Und wer nicht kam, bekommt nun weniger Geld.Für 80 Cent pro Stunde soll… [+743 chars]",,de,'Hochwasser'
https://www.zeit.de/news/2024-07/09/sommerlich-heiss-und-schwuel-zum-em-halbfinale,https://www.zeit.de/news/2024-07/09/sommerlich-heiss-und-schwuel-zum-em-halbfinale,0,www.zeit.de,Deutscher Wetterdienst: Sommerlich heiß und schwül zum EM-Halbfinale,Hier finden Sie Informationen zu dem Thema „Deutscher Wetterdienst“. Lesen Sie jetzt „Sommerlich heiß und schwül zum EM-Halbfinale“.,https://img.zeit.de/news/2024-07/09/sommerlich-heiss-und-schwuel-zum-em-halbfinale-image-group/wide__1300x731,2024-07-09T07:09:02Z,,Die Halbfinalspiele der Fußball-Europameisterschaft stehen an und die Menschen in Hessen können die Spiele im Freien schauen. Der Deutsche Wetterdienst (DWD) hat für den heutigen Tag hochsommerliche … [+882 chars],,de,'Gewitter'
https://www.stern.de/familie/johannisbeeren-schneiden--diese-triebe-sollten-im-juli-weg-34864828.html,https://www.stern.de/familie/johannisbeeren-schneiden--diese-triebe-sollten-im-juli-weg-34864828.html,0,www.stern.de,Gartentipps: Johannisbeeren schneiden: Damit Sie im nächsten Sommer wieder naschen können,"Obststräucher dürfen in keinem Garten fehlen. Besonders farbenfroh ist die Johannisbeere. Wer die roten, weißen oder schwarzen Früchtchen liebt, sollte sich jetzt um sie kümmern. Und so geht das.",https://image.stern.de/9408320/t/RH/v4/w1440/r1.7778/-/gartenarbeit---johannisbeeren-schneiden.jpg,2024-07-09T07:14:00Z,,"Sie sind kaum größer als eine Erbse, meist etwas säuerlich und als Marmelade auf jedem Sonntagsbrötchen der Hit. Johannisbeeren gehören zum beliebtesten, was der Obstgarten im Sommer zu bieten hat. E… [+5575 chars]",,de,'Sommer'
https://www.tagesspiegel.de/berlin/mehr-geld-fur-freiwillige-feuerwehr-in-berlin-entschadigung-steigt-auf-sechs-euro-pro-stunde-11985410.html,https://www.tagesspiegel.de/berlin/mehr-geld-fur-freiwillige-feuerwehr-in-berlin-entschadigung-steigt-auf-sechs-euro-pro-stunde-11985410.html,0,www.tagesspiegel.de,Mehr Geld für Freiwillige Feuerwehr in Berlin: Entschädigung steigt auf sechs Euro pro Stunde,Nach dem Großbrand in Grunewald im Sommer 2022 stand eine höhere Aufwandsentschädigung auf der Agenda des Senats. Nun kommt der Durchbruch für Ehrenamtliche bei der Freiwilligen Feuerwehr.,https://www.tagesspiegel.de/images/freiwillige-feuerwehr2/alternates/BASE_16_9_W1400/freiwillige-feuerwehr.jpeg,2024-07-09T08:32:10Z,,"Sie sind das Rückgrat der Feuerwehr, ohne bräche das Rettersystem zusammen: Nun hat sich der Berliner Senat hat auf eine höhere Dienst- und Aufwandsentschädigung für die ehrenamtlichen Mitglieder der… [+4101 chars]",,de,'Sommer'
https://www.focus.de/earth/report/schutz-vor-elb-hochwasser-der-sachse-der-sein-halbes-dorf-drei-meter-anheben-will_id_260119160.html,https://www.focus.de/earth/report/schutz-vor-elb-hochwasser-der-sachse-der-sein-halbes-dorf-drei-meter-anheben-will_id_260119160.html,0,www.focus.de,"„Alles muss hoch“ - Der Sachse, der sein halbes Dorf drei Meter anheben will","Seit einem Jahrzehnt arbeitet Olaf Lier unermüdlich daran, das sächsische Dorf Brockwitz vor dem nächsten Elb-Hochwasser zu schützen. Mit seinem Plan, das Dorf um drei Meter anzuheben, will er Brockwitz sicherer machen. Trotz Millionenförderung stockt das Pro…",https://p6.focus.de/img/fotos/id_260119111/g-hw-brockwitz-1.jpg?im=Crop%3D%280%2C105%2C750%2C375%29%3BResize%3D%281200%2C627%29&impolicy=perceptual&quality=mediumHigh&hash=6e0d27438e30cc86406956c993c6688a2bdf0b2a365f33f495957fab39d6dec3,2024-07-09T09:23:52Z,,"<ul><li>
Kommentare</li><li>
E-Mail</li><li>
Teilen</li><li>
Mehr</li><li>
Twitter</li><li>
Drucken</li><li>
Feedback</li><li>
Fehler meldenSie haben einen Fehler gefunden?
Bitte markieren S… [+9353 chars]",,de,'Hochwasser'
https://www.stern.de/gesellschaft/regional/mecklenburg-vorpommern/agrar--bauern-erwarten-mittlere-getreideernte---schaedlinge-im-raps-34865946.html,https://www.stern.de/gesellschaft/regional/mecklenburg-vorpommern/agrar--bauern-erwarten-mittlere-getreideernte---schaedlinge-im-raps-34865946.html,0,www.stern.de,Agrar: Bauern erwarten mittlere Getreideernte - Schädlinge im Raps,"Das unbeständige Wetter bringt die Ernte der Gerste derzeit immer wieder ins Stocken, berichten die Bauern. Den Kartoffeln wiederum tut der viele Regen gut.",https://image.stern.de/34865948/t/sh/v1/w1440/r1.7778/-/09--cj6ojrnsqnv15axw800h600jpeg---e1270b430e3fc313.jpg,2024-07-09T11:18:57Z,,"Das unbeständige Wetter bringt die Ernte der Gerste derzeit immer wieder ins Stocken, berichten die Bauern. Den Kartoffeln wiederum tut der viele Regen gut.
Die Bauern erwarten dieses Jahr eine durc… [+2462 chars]",,de,'Ernte'
https://www.zeit.de/news/2024-07/09/erhoehtes-unfallrisiko-in-der-erntezeit,https://www.zeit.de/news/2024-07/09/erhoehtes-unfallrisiko-in-der-erntezeit,0,www.zeit.de,Landwirtschaft: Erhöhtes Unfallrisiko in der Erntezeit,Hier finden Sie Informationen zu dem Thema „Landwirtschaft“. Lesen Sie jetzt „Erhöhtes Unfallrisiko in der Erntezeit“.,https://img.zeit.de/news/2024-07/09/erhoehtes-unfallrisiko-in-der-erntezeit-image-group/wide__1300x731,2024-07-09T14:41:54Z,,"Brandenburgs Landwirte sind in der Erntesaison, auf den Straßen sind deshalb deutlich häufiger als sonst Erntefahrzeuge unterwegs. Das erfordere gegenseitige Rücksichtnahme und besondere Vorsicht, ma… [+2125 chars]",,de,'Ernte'
https://www.stern.de/gesellschaft/regional/berlin-brandenburg/landwirtschaft--erhoehtes-unfallrisiko-in-der-erntezeit-34866876.html,https://www.stern.de/gesellschaft/regional/berlin-brandenburg/landwirtschaft--erhoehtes-unfallrisiko-in-der-erntezeit-34866876.html,0,www.stern.de,Landwirtschaft: Erhöhtes Unfallrisiko in der Erntezeit,In der Erntezeit haben Landwirte alle Hände voll zu tun. Sie sind auch deutlich häufiger als sonst auf den Straßen unterwegs. Autofahrer sollten Erntefahrzeugen mit Vorsicht begegnen.,https://image.stern.de/34866878/t/I0/v1/w1440/r1.7778/-/09--u5x3zirgy7v7axw800h600jpeg---4addb834c44466eb.jpg,2024-07-09T14:41:54Z,,"In der Erntezeit haben Landwirte alle Hände voll zu tun. Sie sind auch deutlich häufiger als sonst auf den Straßen unterwegs. Autofahrer sollten Erntefahrzeugen mit Vorsicht begegnen.
Brandenburgs L… [+1523 chars]",,de,'Ernte'
https://www.tagesspiegel.de/berlin/landwirtschaft-erhohtes-unfallrisiko-in-der-erntezeit-11991611.html,https://www.tagesspiegel.de/berlin/landwirtschaft-erhohtes-unfallrisiko-in-der-erntezeit-11991611.html,0,www.tagesspiegel.de,Landwirtschaft: Erhöhtes Unfallrisiko in der Erntezeit,In der Erntezeit haben Landwirte alle Hände voll zu tun. Sie sind auch deutlich häufiger als sonst auf den Straßen unterwegs. Autofahrer sollten Erntefahrzeugen mit Vorsicht begegnen.,https://www.tagesspiegel.de/berlin/images/ernte-wintergerste-in-brandenburg/alternates/BASE_16_9_W1400/ernte-wintergerste-in-brandenburg.jpeg,2024-07-09T14:42:52Z,,"Brandenburgs Landwirte sind in der Erntesaison, auf den Straßen sind deshalb deutlich häufiger als sonst Erntefahrzeuge unterwegs. Das erfordere gegenseitige Rücksichtnahme und besondere Vorsicht, ma… [+1425 chars]",,de,'Ernte'
https://burgenland.orf.at/stories/3264395/,https://burgenland.orf.at/stories/3264395/,0,burgenland.orf.at,Hochwasser: Einen Monat später,"Vor genau einem Monat hat ein Hochwasser weite Gebiete des Südburgenlands überflutet. Das Wasser hat Brücken mitgerissen, Autos zerstört, ist in Keller und Häuser eingedrungen. Fast 2.000 Schadensfälle sind dokumentiert. Die Hilfe des Landes wird nun ausbezah…",https://ibs.orf.at/bgl?image=https%3A%2F%2Foekastatic.orf.at%2Fmims%2F2024%2F28%2F99%2Fcrops%2Fw%3D1200%2Ch%3D627%2Cq%3D75%2F2272992_master_864599_unterschuetzen.jpg%3Fs%3Da2f4771afbade67fa845f158c7f3c5949cd7a6df,2024-07-09T17:01:07Z,,Die Gemeinde Wiesfleck (Bezirk Oberwart) hat das Hochwasser besonders getroffen. Aktuell sind nur noch an ein paar Stellen Spuren zu sehen. Vor einem Monat ist der Bach über die Ufer getreten. Besond… [+3228 chars],,de,'Hochwasser'
https://www.zeit.de/news/2024-07/10/hochwasser-bringt-saarland-in-finanznot,https://www.zeit.de/news/2024-07/10/hochwasser-bringt-saarland-in-finanznot,0,www.zeit.de,Hochwasser-Nachwirkungen: Hochwasser bringt Saarland in Finanznot,Hier finden Sie Informationen zu dem Thema „Hochwasser-Nachwirkungen“. Lesen Sie jetzt „Hochwasser bringt Saarland in Finanznot“.,https://img.zeit.de/news/2024-07/10/hochwasser-bringt-saarland-in-finanznot-image-group/wide__1300x731,2024-07-10T01:30:36Z,,Nach dem schweren Pfingsthochwasser will das Saarland Not-Kredite in Höhe von bis zu 94 Millionen Euro aufnehmen. Der Landtag in Saarbrücken wird daher heute bei seiner Plenarsitzung (Beginn: 9.00) o… [+1787 chars],,de,'Hochwasser'
https://www.stern.de/gesellschaft/regional/rheinland-pfalz-saarland/hochwasser-nachwirkungen--hochwasser-bringt-saarland-in-finanznot-34867744.html,https://www.stern.de/gesellschaft/regional/rheinland-pfalz-saarland/hochwasser-nachwirkungen--hochwasser-bringt-saarland-in-finanznot-34867744.html,0,www.stern.de,Hochwasser-Nachwirkungen: Hochwasser bringt Saarland in Finanznot,Ein schweres Hochwasser hat zu Pfingsten für Millionenschäden im Saarland gesorgt. Das Land will deshalb mehr Geld leihen können als die Schuldenbremse eigentlich erlaubt.,https://image.stern.de/34867746/t/Lq/v1/w1440/r1.7778/-/10--s7jjzhq2k6v8axw800h600jpeg---d708a61c9e972ecb.jpg,2024-07-10T01:30:36Z,,"Ein schweres Hochwasser hat zu Pfingsten für Millionenschäden im Saarland gesorgt. Das Land will deshalb mehr Geld leihen können als die Schuldenbremse eigentlich erlaubt.
Nach dem schweren Pfingsth… [+1362 chars]",,de,'Hochwasser'
https://www.stern.de/gesellschaft/regional/sachsen-anhalt/neues-foerderprogramm--kommunen-sollen-sich-besser-an-klimawandel-anpassen-34868404.html,https://www.stern.de/gesellschaft/regional/sachsen-anhalt/neues-foerderprogramm--kommunen-sollen-sich-besser-an-klimawandel-anpassen-34868404.html,0,www.stern.de,Neues Förderprogramm: Kommunen sollen sich besser an Klimawandel anpassen,"Starkregen, Hochwasser, Dürreperioden - der Klimawandel stellt Städte, Gemeinden und Landkreise vor Herausforderungen. Aus EU-Mitteln gibt es Unterstützung.",https://image.stern.de/34868406/t/ci/v1/w1440/r1.7778/-/10--2d2k2a4jniv13axw800h600jpeg---6ff13fbbcc446dc7.jpg,2024-07-10T08:00:36Z,,"Starkregen, Hochwasser, Dürreperioden - der Klimawandel stellt Städte, Gemeinden und Landkreise vor Herausforderungen. Aus EU-Mitteln gibt es Unterstützung.
Sachsen-Anhalts Kommunen werden bei der A… [+1355 chars]",,de,'Hochwasser'
https://www.morgenpost.de/berlin/article406765948/wetter-berlin-brandenburg-unwetter-warnung-gewitter-heute.html,https://www.morgenpost.de/berlin/article406765948/wetter-berlin-brandenburg-unwetter-warnung-gewitter-heute.html,0,www.morgenpost.de,Warnung vor schwerem Gewitter – Diese Gebiete sind betroffen,"Blitz, Donner und Regen: In Berlin und Brandenburg knallt es nach dem Hitze-Tag heftig. Was der Deutsche Wetterdienst erwartet.",https://img.sparknews.funkemedien.de/406430868/406430868_1716794415_v16_9_1600.jpeg,2024-07-10T08:59:31Z,,"Berlin. Blitz, Donner und Regen: In Berlin und Brandenburg knallt es nach dem Hitze-Tag heftig. Was der Deutsche Wetterdienst erwartet.
Nach dem Hitze-Tag am Dienstag wird es heute ungemütlich in Be… [+2615 chars]",,de,'Gewitter'
https://www.stern.de/gesellschaft/regional/rheinland-pfalz-saarland/haushalt--saarland-bereitet-sich-nach-hochwasser-auf-mehr-schulden-vor-34867744.html,https://www.stern.de/gesellschaft/regional/rheinland-pfalz-saarland/haushalt--saarland-bereitet-sich-nach-hochwasser-auf-mehr-schulden-vor-34867744.html,0,www.stern.de,Haushalt: Saarland bereitet sich nach Hochwasser auf mehr Schulden vor,Saarbrücken (lrs) - Das schwere Pfingsthochwasser bedeutet für das Saarland voraussichtlich zusätzliche Schulden in Höhe von bis zu 94 Millionen Euro. Der,https://image.stern.de/34868796/t/kM/v1/w1440/r1.7778/-/10--fczrdob4xpv5axw800h600jpeg---3eff278633fd3b2c.jpg,2024-07-10T09:23:50Z,,"Zu Pfingsten standen Teile des Saarlands unter Wasser. Das Land will jetzt neue Millionen-Schulden machen dürfen, um die Schäden zu beseitigen.
Das schwere Pfingsthochwasser bedeutet für das Saarlan… [+2025 chars]",,de,'Hochwasser'
https://www.stern.de/gesellschaft/regional/rheinland-pfalz-saarland/haushalt--saarland-rechnet-nach-hochwasser-mit-mehr-schulden-34867744.html,https://www.stern.de/gesellschaft/regional/rheinland-pfalz-saarland/haushalt--saarland-rechnet-nach-hochwasser-mit-mehr-schulden-34867744.html,0,www.stern.de,Haushalt: Saarland rechnet nach Hochwasser mit mehr Schulden,"Schon jetzt ist das Saarland hoch verschuldet. Nach einem schweren Hochwasser zu Pfingsten richtet sich das Land darauf ein, noch mehr Schulden machen zu müssen.",https://image.stern.de/34869142/t/Vw/v1/w1440/r1.7778/-/10--6escujoys7v1axw800h600jpeg---c76e66e3cf32c1be.jpg,2024-07-10T10:14:34Z,,"Schon jetzt ist das Saarland hoch verschuldet. Nach einem schweren Hochwasser zu Pfingsten richtet sich das Land darauf ein, noch mehr Schulden machen zu müssen.
Das schwere Pfingsthochwasser im Saa… [+4064 chars]",,de,'Hochwasser'
https://www.stern.de/gesellschaft/regional/niedersachsen-bremen/bauern--landwirte-koennen-hochwasserhilfen-beantragen-34869310.html,https://www.stern.de/gesellschaft/regional/niedersachsen-bremen/bauern--landwirte-koennen-hochwasserhilfen-beantragen-34869310.html,0,www.stern.de,Bauern: Landwirte können Hochwasserhilfen beantragen,"Vernichtete Ernten, geflutete Ställe: In Niedersachsen kämpfen Landwirte mit den Folgen des Hochwassers. Erst jetzt wird klar, wie groß die Schäden wirklich sind.",https://image.stern.de/34869312/t/-X/v1/w1440/r1.7778/-/10--2v4lvhs7lcv28axw800h600jpeg---1e13242bb3305163.jpg,2024-07-10T10:51:04Z,,"Vernichtete Ernten, geflutete Ställe: In Niedersachsen kämpfen Landwirte mit den Folgen des Hochwassers. Erst jetzt wird klar, wie groß die Schäden wirklich sind.
Vom Hochwasser betroffene Landwirte… [+989 chars]",,de,'Ernte'
https://www.telepolis.de/features/Ernte-2024-Weniger-Getreide-aber-noch-stabile-Preise-beim-Baecker-9796500.html,https://www.telepolis.de/features/Ernte-2024-Weniger-Getreide-aber-noch-stabile-Preise-beim-Baecker-9796500.html,0,www.telepolis.de,"Ernte 2024: Weniger Getreide, aber noch stabile Preise beim Bäcker",Starke Regenfälle beeinträchtigen Erntemengen. Bauern kämpfen mit Pilzbefall. Warum unsere Brötchen zunächst nicht teurer werden.,https://heise.cloudimg.io/bound/1200x1200/q85.png-lossy-85.webp-lossy-85.foil1/_www-heise-de_/imgs/18/4/6/3/1/2/4/4/11c90e9e85fd19ab.jpg,2024-07-10T14:30:00Z,,"Starke Regenfälle beeinträchtigen Erntemengen. Bauern kämpfen mit Pilzbefall. Warum unsere Brötchen zunächst nicht teurer werden.
Überdurchschnittlich viel Regen mit teilweise lokalen Überschwemmung… [+8881 chars]",,de,'Ernte'
https://www.telepolis.de/features/Ernte-2024-unter-Druck-Pestizid-Einsatz-explodiert-trotz-Oeko-Plaenen-9796500.html,https://www.telepolis.de/features/Ernte-2024-unter-Druck-Pestizid-Einsatz-explodiert-trotz-Oeko-Plaenen-9796500.html,0,www.telepolis.de,Ernte 2024 unter Druck: Pestizid-Einsatz explodiert trotz Öko-Plänen,Starke Regenfälle beeinträchtigen Erntemengen. Bauern kämpfen mit Pilzbefall. Warum unsere Brötchen zunächst nicht teurer werden.,https://heise.cloudimg.io/bound/1200x1200/q85.png-lossy-85.webp-lossy-85.foil1/_www-heise-de_/imgs/18/4/6/3/1/2/4/4/11c90e9e85fd19ab.jpg,2024-07-10T14:30:00Z,,"Starke Regenfälle beeinträchtigen Erntemengen. Bauern kämpfen mit Pilzbefall. Warum unsere Brötchen zunächst nicht teurer werden.
Überdurchschnittlich viel Regen mit teilweise lokalen Überschwemmung… [+8898 chars]",,de,'Ernte'
https://www.stern.de/gesellschaft/regional/hamburg-schleswig-holstein/agrar--landwirte-hoffen-fuer-ernte-auf-trockenes-wetter-34871568.html,https://www.stern.de/gesellschaft/regional/hamburg-schleswig-holstein/agrar--landwirte-hoffen-fuer-ernte-auf-trockenes-wetter-34871568.html,0,www.stern.de,Agrar: Landwirte hoffen für Ernte auf trockenes Wetter,"Was würde Urlauber und Bauern in Schleswig-Holstein gleichermaßen freuen? Eine Phase mit stabilem und trockenem Wetter. Die einen könnten die Sonne genießen, die anderen mit der Ernte beginnen.",https://image.stern.de/34871570/t/Sl/v1/w1440/r1.7778/-/11--gl7qccametv27axw800h600jpeg---43b18ff385c772d0.jpg,2024-07-11T04:00:36Z,,"Was würde Urlauber und Bauern in Schleswig-Holstein gleichermaßen freuen? Eine Phase mit stabilem und trockenem Wetter. Die einen könnten die Sonne genießen, die anderen mit der Ernte beginnen.
Die … [+1668 chars]",,de,'Ernte'
https://www.stern.de/gesellschaft/regional/bayern/landwirtschaft--bayerns-bauern-hoffen-auf-sonne-fuer-getreideernte-34873096.html,https://www.stern.de/gesellschaft/regional/bayern/landwirtschaft--bayerns-bauern-hoffen-auf-sonne-fuer-getreideernte-34873096.html,0,www.stern.de,Landwirtschaft: Bayerns Bauern hoffen auf Sonne für Getreideernte,Nässe macht es Landwirten in dieser Saison schwer: Bei der traditionellen Erntefahrt des Bayerischen Bauernverbandes informiert sich Agrarministerin Michaela Kaniber über die Situation.,https://image.stern.de/34873098/t/FO/v1/w1440/r1.7778/-/11--izy24nf66qv5axw800h600jpeg---264f621936651668.jpg,2024-07-11T12:20:57Z,,"Nässe macht es Landwirten in dieser Saison schwer: Bei der traditionellen Erntefahrt des Bayerischen Bauernverbandes informiert sich Agrarministerin Michaela Kaniber über die Situation.
Kaum ein Tag… [+2943 chars]",,de,'Aussaat'
https://www.sueddeutsche.de/bayern/bayern-bauern-erntefahrt-kaniber-lux.JWeq1nySTk2eYMsXq1eRJx,https://www.sueddeutsche.de/bayern/bayern-bauern-erntefahrt-kaniber-lux.JWeq1nySTk2eYMsXq1eRJx,0,www.sueddeutsche.de,Landwirtschaft: Bayerns Bauern hoffen auf Sonne für Getreideernte,Nässe macht es Landwirten in dieser Saison schwer: Bei der traditionellen Erntefahrt des Bayerischen Bauernverbandes informiert sich Agrarministerin Michaela Kaniber über die Situation.,https://www.sueddeutsche.de/2024/07/11/fe963834-c2c6-4435-a50b-fbe8254e0723.jpeg?q=60&fm=webp&width=1200&rect=0%2C0%2C3000%2C1688,2024-07-11T12:55:03Z,,Von Landwirt Josef Göttler lässt sich die Ministerin gemeinsam mit BBV-Vizepräsident Ely Eibisch Felder zeigen. Der Ackerboden ist nass und matschig. Nach Nieselregen kommt gerade die Sonne wieder du… [+2426 chars],,de,'Ernte'
https://www.tagesspiegel.de/potsdam/brandenburg/lavendel-in-brandenburg-hinter-prenzlau-werden-blutentraume-wahr-11996642.html,https://www.tagesspiegel.de/potsdam/brandenburg/lavendel-in-brandenburg-hinter-prenzlau-werden-blutentraume-wahr-11996642.html,0,www.tagesspiegel.de,Lavendel in Brandenburg: Hinter Prenzlau werden Blütenträume wahr,"Um die Brandenburger Provence zu erleben, führt der Weg in die Uckermark. Hier wächst der Lavendel. Wer mag, kann am Wochenende bei der Ernte helfen oder sich ein Plätzchen zum Dösen im Lavendelfeld suchen.",https://www.tagesspiegel.de/images/lavendel011-aus-der-uckermark/alternates/BASE_16_9_W1400/lavendel011-aus-der-uckermark.jpeg,2024-07-11T13:05:59Z,,"Wenn eine sanfte Brise über die lila blühenden Felder haucht, den lieblich-herben Duft verteilt, die Sonne die Haut erwärmt, dann ist man .... genau, in der Uckermark. Festina Lente das ist lateinisc… [+218 chars]",,de,'Ernte'
https://www.stern.de/gesellschaft/regional/rheinland-pfalz-saarland/flut-folgen--einziger-hopfenbauer-vor-erster-normaler-ernte-nach-flut-34874854.html,https://www.stern.de/gesellschaft/regional/rheinland-pfalz-saarland/flut-folgen--einziger-hopfenbauer-vor-erster-normaler-ernte-nach-flut-34874854.html,0,www.stern.de,Flut-Folgen: Einziger Hopfenbauer vor erster normaler Ernte nach Flut,Die Flutkatastrophe im Juli 2021 traf vor allem das Ahrtal. Aber auch Orte an der Kyll und in der Eifel wurden geflutet. Bei Hopfenbauer Andreas Dick ist seitdem alles anders.,https://image.stern.de/34874856/t/xH/v1/w1440/r1.7778/-/12--zybjhiuagxv10axw800h600jpeg---f08a34ac30f9c369.jpg,2024-07-12T03:00:36Z,,"Die Flutkatastrophe im Juli 2021 traf vor allem das Ahrtal. Aber auch Orte an der Kyll und in der Eifel wurden geflutet. Bei Hopfenbauer Andreas Dick ist seitdem alles anders.
Drei Jahre nach der Fl… [+4047 chars]",,de,'Ernte'
