index,url,valid,domain,title,description,image,published,archive,content,quote,language,keyword
https://www.stern.de/gesellschaft/regional/nordrhein-westfalen/wetter--sonne-und-wolken-am-sonntag---gewitter-zum-wochenstart-34880778.html,https://www.stern.de/gesellschaft/regional/nordrhein-westfalen/wetter--sonne-und-wolken-am-sonntag---gewitter-zum-wochenstart-34880778.html,0,www.stern.de,Wetter: Sonne und Wolken am Sonntag - Gewitter zum Wochenstart,Essen (lnw) - Das Wetter in Nordrhein-Westfalen bleibt wechselhaft. Der Prognose zufolge können sich die Menschen heute und zum Wochenstart auf Sonne und,https://image.stern.de/34880780/t/Ds/v1/w1440/r1.7778/-/14--g2f62r6y7iv8axw800h600jpeg---c2df569422ba1a17.jpg,2024-07-14T06:41:37Z,,"In NRW ist das Wetter am Sonntag wechselhaft. Zum Wochenstart können sich die Menschen auf Regen und Gewitter einstellen.
Das Wetter in Nordrhein-Westfalen bleibt wechselhaft. Der Prognose zufolge k… [+1316 chars]",,de,'Gewitter'
https://www.stern.de/gesellschaft/regional/berlin-brandenburg/klima--tourismusbranche-will-sich-auf-wetterextreme-einstellen-34880936.html,https://www.stern.de/gesellschaft/regional/berlin-brandenburg/klima--tourismusbranche-will-sich-auf-wetterextreme-einstellen-34880936.html,0,www.stern.de,Klima: Tourismusbranche will sich auf Wetterextreme einstellen,"Dürre und Wassermangel, Starkregen und Hochwasser - Wetterextreme nehmen laut Experten zu. Das hat auch Einfluss auf den Tourismus. Urlaubsregionen müssen sich darauf einstellen.",https://image.stern.de/34880938/t/G0/v1/w1440/r1.7778/-/14--a4d3hl3qulv10axw800h600jpeg---841a2435a6553ea1.jpg,2024-07-14T08:45:35Z,,"Dürre und Wassermangel, Starkregen und Hochwasser - Wetterextreme nehmen laut Experten zu. Das hat auch Einfluss auf den Tourismus. Urlaubsregionen müssen sich darauf einstellen.
Die brandenburgisch… [+1110 chars]",,de,'Dürre'
https://www.n-tv.de/panorama/15-Verletzte-nach-Unwettern-auf-Festival-article25086435.html,https://www.n-tv.de/panorama/15-Verletzte-nach-Unwettern-auf-Festival-article25086435.html,0,www.n-tv.de,Staatsanwaltschaft ermittelt: Riesenzelt begräbt Festivalbesucher - 15 Verletzte,30.000 Menschen feiern auf einem Elektro-Festival in der Slowakei. Auf einmal bricht das größte Zelt aufgrund heftiger Gewitter zusammen und verletzt zahlreiche Menschen. Die Staatsanwaltschaft ermittelt.,https://bilder2.n-tv.de/img/incoming/crop25086429/4901329391-cImg_16_9-w1200/472330189.jpg,2024-07-14T08:48:21Z,,30.000 Menschen feiern auf einem Elektro-Festival in der Slowakei. Auf einmal bricht das größte Zelt aufgrund heftiger Gewitter zusammen und verletzt zahlreiche Menschen. Die Staatsanwaltschaft ermit… [+2164 chars],,de,'Gewitter'
https://www.zeit.de/news/2024-07/14/urlaub-am-wasser-gefragt-branche-will-klimagutachten,https://www.zeit.de/news/2024-07/14/urlaub-am-wasser-gefragt-branche-will-klimagutachten,0,www.zeit.de,Tourismus: Urlaub am Wasser gefragt - Branche will Klimagutachten,Hier finden Sie Informationen zu dem Thema „Tourismus“. Lesen Sie jetzt „Urlaub am Wasser gefragt - Branche will Klimagutachten“.,https://img.zeit.de/news/2024-07/14/urlaub-am-wasser-gefragt-branche-will-klimagutachten-image-group/wide__1300x731,2024-07-14T09:45:36Z,,"Der Sommerurlaub am See, das Ferienhaus direkt am Wasser und im Grünen - solche Urlaubsziele sind in Brandenburg stark gefragt. Doch viele Menschen entscheiden sich erst kurzfristig. Wer noch für die… [+4180 chars]",,de,'Hochwasser'
https://www.zeit.de/news/2024-07/14/waermeres-wetter-aber-gewitter-und-starkregen-moeglich,https://www.zeit.de/news/2024-07/14/waermeres-wetter-aber-gewitter-und-starkregen-moeglich,0,www.zeit.de,"Vorhersage: Wärmeres Wetter, aber Gewitter und Starkregen möglich","Hier finden Sie Informationen zu dem Thema „Vorhersage“. Lesen Sie jetzt „Wärmeres Wetter, aber Gewitter und Starkregen möglich“.",https://img.zeit.de/news/2024-07/14/waermeres-wetter-aber-gewitter-und-starkregen-moeglich-image-group/wide__1300x731,2024-07-14T10:05:21Z,,"Zur neuen Woche wird es deutlich wärmer in Rheinland-Pfalz und dem Saarland. Dabei sind aber teils auch Gewitter, Starkregen und Sturmböen zu erwarten, wie der Deutsche Wetterdienst mitteilte. Am Mon… [+533 chars]",,de,'Gewitter'
https://www.stern.de/gesellschaft/regional/rheinland-pfalz-saarland/vorhersage--waermeres-wetter--aber-gewitter-und-starkregen-moeglich-34881092.html,https://www.stern.de/gesellschaft/regional/rheinland-pfalz-saarland/vorhersage--waermeres-wetter--aber-gewitter-und-starkregen-moeglich-34881092.html,0,www.stern.de,"Vorhersage: Wärmeres Wetter, aber Gewitter und Starkregen möglich","Offenbach (lrs) - Zur neuen Woche wird es deutlich wärmer in Rheinland-Pfalz und dem Saarland. Dabei sind aber teils auch Gewitter, Starkregen und",https://image.stern.de/34881094/t/l_/v1/w1440/r1.7778/-/14--fpozn3h277v14axw800h600jpeg---79684a9fe6e22529.jpg,2024-07-14T10:05:21Z,,"Die neue Woche beginnt wärmer und zunächst mit viel Sonne. Es sind aber auch Schauer und Gewitter in Sicht.
Zur neuen Woche wird es deutlich wärmer in Rheinland-Pfalz und dem Saarland. Dabei sind ab… [+652 chars]",,de,'Gewitter'
https://www.diepresse.com/18666006/es-bleibt-sommerlich-und-heiss-in-oesterreich,https://www.diepresse.com/18666006/es-bleibt-sommerlich-und-heiss-in-oesterreich,0,www.diepresse.com,Es bleibt sommerlich und heiß in Österreich,Eine Abkühlung im Osten ist vorerst nicht in Sicht. Zwischendurch kommt es in Teilen Österreichs zu Quellwolken und Gewittern.,https://img.diepresse.com/public/incoming/xbm2tf-imago-images-163044594/alternates/DPR_SOCIAL_NACHRICHTEN/imago%20images%20163044594,2024-07-14T10:24:44Z,,"Eine Abkühlung im Osten ist vorerst nicht in Sicht. Zwischendurch kommt es in Teilen Österreichs zu Quellwolken und Gewittern.
Das Wetter bleibt in der kommenden Woche in weiten Teilen des Landes we… [+2538 chars]",,de,'Sommer'
https://www.faz.net/aktuell/wissen/erde-klima/meteorologie-ist-dieser-sommer-noch-normal-19850629.html,https://www.faz.net/aktuell/wissen/erde-klima/meteorologie-ist-dieser-sommer-noch-normal-19850629.html,0,www.faz.net,Was ist nur mit dem Sommer los?,"Ein Gewitter jagt das nächste, auf strahlende Sonne folgen Starkregen und Hagel. Woran das liegt, fragen sich auch Meteorologen.",https://media0.faz.net/ppmedia/aktuell/2266593444/1.9851470/facebook_teaser/cumuluswolken-bauen-sich-in.jpg,2024-07-14T10:31:54Z,,Auch in dieser Woche gilt: Nach dem Starkregen ist vor dem Starkregen. Es blitzt und hagelt und schüttet im ganzen Land. Am Freitag ist ein weiteres Unwettertief durchs Bundesgebiet gezogen. In den A… [+13026 chars],,de,'Gewitter'
https://www.zeit.de/news/2024-07/14/sommerlich-warm-aber-wechselhaft-und-gewittrig,https://www.zeit.de/news/2024-07/14/sommerlich-warm-aber-wechselhaft-und-gewittrig,0,www.zeit.de,"Wettervorhersage: Sommerlich warm, aber wechselhaft und gewittrig","Hier finden Sie Informationen zu dem Thema „Wettervorhersage“. Lesen Sie jetzt „Sommerlich warm, aber wechselhaft und gewittrig“.",https://img.zeit.de/news/2024-07/14/sommerlich-warm-aber-wechselhaft-und-gewittrig-image-group/wide__1300x731,2024-07-14T10:45:26Z,,Die neue Woche beginnt in vielen Teilen Deutschlands mit viel Sonne. Im Osten und Süden können die Temperaturen laut Prognose des Deutschen Wetterdienstes (DWD) am Montag auf 30 Grad ansteigen. Im No… [+1782 chars],,de,'Sommer'
https://www.zeit.de/news/2024-07/14/wechselhaftes-wetter-zum-wochenstart-auch-gewitter-moeglich,https://www.zeit.de/news/2024-07/14/wechselhaftes-wetter-zum-wochenstart-auch-gewitter-moeglich,0,www.zeit.de,Vorhersage: Wechselhaftes Wetter zum Wochenstart - auch Gewitter möglich,Hier finden Sie Informationen zu dem Thema „Vorhersage“. Lesen Sie jetzt „Wechselhaftes Wetter zum Wochenstart - auch Gewitter möglich“.,https://img.zeit.de/administratives/sharing/fallback-image/wide__1300x731,2024-07-14T12:35:21Z,,"Es bleibt warm und wechselhaft im Freistaat. Einen Mix aus Sonne und Wolken, aber auch teils Gewitter erwartet der Deutsche Wetterdienst (DWD) in der kommenden Woche. Am Montag überwiegt sonniges Wet… [+509 chars]",,de,'Gewitter'
https://www.stern.de/gesellschaft/regional/sachsen-anhalt/weinbau-an-saale-und-unstrut--unsichere-wochen-fuer-winzer-34882314.html,https://www.stern.de/gesellschaft/regional/sachsen-anhalt/weinbau-an-saale-und-unstrut--unsichere-wochen-fuer-winzer-34882314.html,0,www.stern.de,Weinbau an Saale und Unstrut: Unsichere Wochen für Winzer,"Die erste Jahreshälfte war für viele Winzer in Sachsen-Anhalt keine erfreuliche. Bis zur Ernte müssen sie noch einige Unsicherheit aushalten. Erst dann zeigt sich, wie groß der Schaden ist.",https://image.stern.de/34882316/t/V1/v1/w1440/r1.7778/-/15--xpo4inz5omv24axw800h600jpeg---14ab1cad0cf66830.jpg,2024-07-15T02:00:39Z,,"Die erste Jahreshälfte war für viele Winzer in Sachsen-Anhalt keine erfreuliche. Bis zur Ernte müssen sie noch einige Unsicherheit aushalten. Erst dann zeigt sich, wie groß der Schaden ist.
Winzer i… [+1193 chars]",,de,'Ernte'
https://www.zeit.de/news/2024-07/15/nach-wechselhaftem-start-wird-es-in-nrw-heiter-bis-wolkig,https://www.zeit.de/news/2024-07/15/nach-wechselhaftem-start-wird-es-in-nrw-heiter-bis-wolkig,0,www.zeit.de,Sommer: Nach wechselhaftem Start wird es in NRW heiter bis wolkig,Hier finden Sie Informationen zu dem Thema „Sommer“. Lesen Sie jetzt „Nach wechselhaftem Start wird es in NRW heiter bis wolkig“.,https://img.zeit.de/news/2024-07/15/nach-wechselhaftem-start-wird-es-in-nrw-heiter-bis-wolkig-image-group/wide__1300x731,2024-07-15T05:02:48Z,,"In der neuen Woche müssen sich die Menschen in Nordrhein-Westfalen zunächst auf einen Mix aus Sonne, Wolken und Regen einstellen, ab Mitte der Woche gibt es nur noch ein geringes Risiko für Regen. Wi… [+515 chars]",,de,'Sommer'
https://www.zeit.de/news/2024-07/15/viel-sonne-und-gewitter-in-thueringen-erwartet,https://www.zeit.de/news/2024-07/15/viel-sonne-und-gewitter-in-thueringen-erwartet,0,www.zeit.de,Wetter: Viel Sonne und Gewitter in Thüringen erwartet,Hier finden Sie Informationen zu dem Thema „Wetter“. Lesen Sie jetzt „Viel Sonne und Gewitter in Thüringen erwartet“.,https://img.zeit.de/news/2024-07/15/viel-sonne-und-gewitter-in-thueringen-erwartet-image-group/wide__1300x731,2024-07-15T09:42:30Z,,"Die Menschen in Thüringen erwartet in dieser Woche sommerliches Wetter. Am Montag liegen die Höchstwerte bei viel Sonne zwischen 28 und 31 Grad, wie ein Sprecher des Deutschen Wetterdienstes (DWD) sa… [+1081 chars]",,de,'Gewitter'
https://www.zeit.de/news/2024-07/15/nach-sonne-kommt-gewitter-unwetter-moeglich,https://www.zeit.de/news/2024-07/15/nach-sonne-kommt-gewitter-unwetter-moeglich,0,www.zeit.de,Deutscher Wetterdienst: Nach Sonne kommt Gewitter - Unwetter möglich,Hier finden Sie Informationen zu dem Thema „Deutscher Wetterdienst“. Lesen Sie jetzt „Nach Sonne kommt Gewitter - Unwetter möglich“.,https://img.zeit.de/news/2024-07/15/nach-sonne-kommt-gewitter-unwetter-moeglich-image-group/wide__1300x731,2024-07-15T09:46:31Z,,Auf Sonne folgen zum Wochenstart in Baden-Württemberg teils schwere Gewitter. Nach einer Vorhersage des Deutschen Wetterdienstes (DWD) besteht insbesondere in der Nacht zum Dienstag das Potenzial lok… [+1151 chars],,de,'Gewitter'
https://www.zeit.de/news/2024-07/15/20-millionen-euro-schaeden-durch-hochwasser,https://www.zeit.de/news/2024-07/15/20-millionen-euro-schaeden-durch-hochwasser,0,www.zeit.de,Bayerischer Sport: 20 Millionen Euro Schäden durch Hochwasser,Hier finden Sie Informationen zu dem Thema „Bayerischer Sport“. Lesen Sie jetzt „20 Millionen Euro Schäden durch Hochwasser“.,https://img.zeit.de/news/2024-07/15/20-millionen-euro-schaeden-durch-hochwasser-image-group/wide__1300x731,2024-07-15T12:54:19Z,,Die Hochwasser-Katastrophe im Juni dieses Jahres kostet Bayerns Sport viel Geld. Nach ersten Hochrechnungen des Bayerischen Landes-Sportverbandes (BLSV) betragen die bezifferbaren Schäden rund 20 Mil… [+1812 chars],,de,'Hochwasser'
https://www.diepresse.com/18670377/worueber-man-bei-den-salzburger-festspielen-heuer-sprechen-wird,https://www.diepresse.com/18670377/worueber-man-bei-den-salzburger-festspielen-heuer-sprechen-wird,0,www.diepresse.com,Worüber man bei den Salzburger Festspielen heuer sprechen wird,"Ein neuer „Jedermann“, Currentzis, eine mögliche neue Star-Sopranistin und ein litauischer „Zauberberg“: Die Salzburger Festspiele bieten viel – und auch viel Stoff für Debatten. 10 Fragen, die uns diesen Sommer besonders beschäftigen werden.",https://img.diepresse.com/public/incoming/7t4z9a-DON-GIOVANNI/alternates/DPR_SOCIAL_MAGAZIN/DON%20GIOVANNI,2024-07-15T13:47:13Z,,"Ein neuer Jedermann, Currentzis, eine mögliche neue Star-Sopranistin und ein litauischer Zauberberg: Die Salzburger Festspiele bieten viel und auch viel Stoff für Debatten. 10 Fragen, die uns diesen … [+9989 chars]",,de,'Sommer'
https://www.sueddeutsche.de/kultur/bad-kissinger-sommer-festival-lux.2BoAR5RZqe618G9Aa9wQms,https://www.sueddeutsche.de/kultur/bad-kissinger-sommer-festival-lux.2BoAR5RZqe618G9Aa9wQms,0,www.sueddeutsche.de,Festival: Am Horizont erscheint Berlin,"Der „Bad Kissinger Sommer“ feiert die Musik und denkt an Reichskanzler Bismarck, der hier oft zur Kur kam und gleich beim ersten Mal von einem Attentäter angeschossen wurde.",https://www.sueddeutsche.de/2024/07/15/aeab1655-074a-4bdc-95ec-b599a9b50079.jpeg?q=60&fm=webp&width=1200&rect=0%2C0%2C3000%2C1688,2024-07-15T13:54:59Z,,"Der Bad Kissinger Sommer feiert die Musik und denkt an Reichskanzler Bismarck, der hier oft zur Kur kam und gleich beim ersten Mal von einem Attentäter angeschossen wurde.Man schreibt das Jahr 1876, … [+789 chars]",,de,'Sommer'
https://www.kino.de/serie/sturm-der-liebe/news/sturm-der-liebe-fans-duerfen-sich-nach-sommerpause-auf-zuwachs-freuen/,https://www.kino.de/serie/sturm-der-liebe/news/sturm-der-liebe-fans-duerfen-sich-nach-sommerpause-auf-zuwachs-freuen/,0,www.kino.de,„Sturm der Liebe“: Fans dürfen sich nach Sommerpause auf Zuwachs freuen,"""Sturm der Liebe"" befindet sich zwar derzeit noch in der Sommerpause, doch schon jetzt können sich die Fans auf neue Gesichter freuen...",https://crops.giga.de/db/90/26/878d8d7595c587122e64237a29_YyAzODQ4eDIxNjUrMTQzKzY5AnJlIDE5MjAgMTA4MANkMDhkNzU4MjYzMg==.jpg,2024-07-15T13:59:38Z,,"„Sturm der Liebe“ befindet sich zwar derzeit noch in der Sommerpause, doch schon jetzt können sich die Fans auf neue Gesichter freuen.
Seit dem 21. Mai befindet sich „Sturm der Liebe“ in der XXL-Som… [+3759 chars]",,de,'Sommer'
https://www.stern.de/kultur/taylor-swift-und-mehr--diese-megastars-kommen-nach-deutschland-34884482.html,https://www.stern.de/kultur/taylor-swift-und-mehr--diese-megastars-kommen-nach-deutschland-34884482.html,0,www.stern.de,Taylor Swift und mehr: Diese Megastars kommen nach Deutschland,Taylor Swift macht ab 17. Juli mit ihrer Tour in Deutschland Halt. Auch diese Megastars werden hierzulande in diesem Sommer Konzerte geben.,https://image.stern.de/34884486/t/6u/v1/w1440/r1.7778/-/15--diese-megastars-kommen-nach-deutschland---16-9---spoton-article-1069364.jpg,2024-07-15T14:11:00Z,,"Taylor Swift macht ab 17. Juli mit ihrer Tour in Deutschland Halt. Auch diese Megastars werden hierzulande in diesem Sommer Konzerte geben.
US-Popstar Taylor Swift (34) begeistert Europa derzeit mit… [+6335 chars]",,de,'Sommer'
https://www.brigitte.de/aktuell/taylor-swift-und-mehr--diese-konzert-highlights-stehen-im-sommer-noch-an-13845588.html,https://www.brigitte.de/aktuell/taylor-swift-und-mehr--diese-konzert-highlights-stehen-im-sommer-noch-an-13845588.html,0,www.brigitte.de,Taylor Swift und mehr: Diese Konzert-Highlights stehen im Sommer noch an,Taylor Swift macht ab 17. Juli mit ihrer Tour in Deutschland Halt. Auch diese Megastars werden hierzulande in diesem Sommer Konzerte geben.,https://image.brigitte.de/13845590/t/9p/v1/w1440/r1.7778/-/15--diese-konzert-highlights-stehen-im-sommer-noch-an---1-1---spoton-article-1069364.jpg,2024-07-15T14:12:00Z,,"Taylor Swift macht ab 17. Juli mit ihrer Tour in Deutschland Halt. Auch diese Megastars werden hierzulande in diesem Sommer Konzerte geben.
US-Popstar Taylor Swift (34) begeistert Europa derzeit mit… [+6344 chars]",,de,'Sommer'
https://www.golem.de/sonstiges/zustimmung/auswahl.html?from=https://www.golem.de/news/balkonkraftwerke-ein-verschenkter-sommer-2407-187077.html&referer=https://t.co/21caff9516,https://www.golem.de/sonstiges/zustimmung/auswahl.html?from=https://www.golem.de/news/balkonkraftwerke-ein-verschenkter-sommer-2407-187077.html&referer=https://t.co/21caff9516,0,www.golem.de,Balkonkraftwerke: Ein verschenkter Sommer,"Der Anspruch auf die Installation von Balkonkraftwerken verzögert sich um mehrere Monate. Das hätte die Ampelkoalition besser machen müssen. Ein IMHO von Friedhelm Greis (Balkonkraftwerk, GreenIT)",,2024-07-15T14:12:02Z,,"Besuchen Sie Golem.de wie gewohnt mit Werbung und Tracking,
 indem Sie der Nutzung aller Cookies zustimmen.
 Details zum Tracking finden Sie im Privacy Center.
Skript wurde nicht geladen. Informat… [+607 chars]",,de,'Sommer'
https://www.transfermarkt.de/1-fc-nurnberg-lasst-ex-klose-schutzling-jurcec-vorspielen-karafiat-vor-vertragsunterschrift/view/news/440714,https://www.transfermarkt.de/1-fc-nurnberg-lasst-ex-klose-schutzling-jurcec-vorspielen-karafiat-vor-vertragsunterschrift/view/news/440714,0,www.transfermarkt.de,1. FC Nürnberg lässt Ex-Klose-Schützling Jurcec vorspielen – Karafiat vor Vertragsunterschrift,Sieben Spieler verpflichtete der 1. FC Nürnberg bisher in diesem Sommer. Ein weiterer möglicher Neuzugang kann sich im Trainingslager am Walchsee für einen Vertrag...,https://tmssl.akamaized.net/images/foto/big/jan-jurcec-altach-2022-1667482981-95588.jpg?lm=1667482990,2024-07-15T14:19:54Z,,"Gemeinsame Zeit in Altach 
Sieben Spieler verpflichtete der 1. FC Nürnberg bisher in diesem Sommer. Ein weiterer möglicher Neuzugang kann sich im Trainingslager am Walchsee für einen Vertrag empfehl… [+1555 chars]",,de,'Sommer'
https://www.autobild.de/artikel/skoda-kamiq-sommer-sale-rabatt-neuwagen-carwow-tiefpreis-angebot-25198347.html,https://www.autobild.de/artikel/skoda-kamiq-sommer-sale-rabatt-neuwagen-carwow-tiefpreis-angebot-25198347.html,0,www.autobild.de,Skoda Kamiq: über 7000 Euro Rabatt aufs Top-Paket,Der Skoda Kamiq ist das kleinste SUV der Tschechen. Bei Carwow gibt's das Auto aktuell mit Mega-Rabatt im Sommer Sale. Alle Infos zum Angebot!,https://i.auto-bild.de/ir_img/3/5/4/2/4/5/9/Skoda_Kamiq_16_9-3433339d3e484506.jpg?impolicy=og_images,2024-07-15T15:00:00Z,,Skoda Kamiq: Lagerfahrzeuge,,de,'Sommer'
https://www.morgenpost.de/sport/article406804911/die-fussball-em-in-der-hauptstadt-ein-berliner-sommer.html,https://www.morgenpost.de/sport/article406804911/die-fussball-em-in-der-hauptstadt-ein-berliner-sommer.html,0,www.morgenpost.de,Die Fußball-EM in der Hauptstadt: Ein Berliner Sommer,"Morgenpost-Volontär Nelis Heidemann auf einem Streifzug durch Berlin, abseits der perfekt ausgeleuchteten Momente in den Stadien.",https://img.sparknews.funkemedien.de/406805196/406805196_1721055117_v16_9_1600.jpeg,2024-07-15T15:02:54Z,,"Berlin. Morgenpost-Volontär Nelis Heidemann auf einem Streifzug durch Berlin, abseits der perfekt ausgeleuchteten Momente in den Stadien.
Die Fußball-EM im eigenen Land hat sich in Berlin so verdich… [+848 chars]",,de,'Sommer'
https://www.brigitte.de/aktuell/shawn-mendes--mit-ex-camila-cabello-bei-copa-am%C3%A9rica-finale-13845638.html,https://www.brigitte.de/aktuell/shawn-mendes--mit-ex-camila-cabello-bei-copa-am%C3%A9rica-finale-13845638.html,0,www.brigitte.de,Shawn Mendes: Mit Ex Camila Cabello bei Copa-América-Finale,Im vergangenen Sommer scheiterte der zweite Beziehungsanlauf von Shawn Mendes und Camila Cabello. Jetzt wurden sie wieder zusammen gesehen.,https://image.brigitte.de/13845640/t/q9/v1/w1440/r1.7778/-/15--mit-ex-camila-cabello-bei-copa-am%C3%A9rica-finale---1-1---spoton-article-1070771.jpg,2024-07-15T15:05:00Z,,"Im vergangenen Sommer scheiterte der zweite Beziehungsanlauf von Shawn Mendes und Camila Cabello. Jetzt wurden sie wieder zusammen gesehen.
Shawn Mendes (25) und Camila Cabello (27) können scheinbar… [+1696 chars]",,de,'Sommer'
https://www.tagesschau.de/ausland/europa/griechenland-waldbraende-vorbereitung-100.html,https://www.tagesschau.de/ausland/europa/griechenland-waldbraende-vorbereitung-100.html,0,www.tagesschau.de,Waldbrände: Was Griechenland aus dem letzten Jahr gelernt hat,In Griechenland herrschen große Hitze und Trockenheit. Seit Sommerbeginn gab es bereits mehr als 2.000 Waldbrände. Ministerpräsident Mitsotakis verspricht eine bessere Prävention. Wie soll die aussehen? Von T. Kleinjung.,https://images.tagesschau.de/image/6e18d639-f71c-46e9-97f8-12265a670b86/AAABkLbUnpI/AAABjwnlFvA/16x9-1280/waldbrand-keratea-100.jpg,2024-07-15T15:05:15Z,,"Stand: 15.07.2024 17:05 Uhr
In Griechenland herrschen große Hitze und Trockenheit. Seit Sommerbeginn gab es bereits mehr als 2.000 Waldbrände. Ministerpräsident Mitsotakis verspricht eine bessere Pr… [+3365 chars]",,de,'Sommer'
https://www.stern.de/lifestyle/leute/shawn-mendes--gemeinsam-mit-ex-camila-cabello-im-stadion-34884778.html,https://www.stern.de/lifestyle/leute/shawn-mendes--gemeinsam-mit-ex-camila-cabello-im-stadion-34884778.html,0,www.stern.de,Shawn Mendes: Gemeinsam mit Ex Camila Cabello im Stadion,Im vergangenen Sommer scheiterte der zweite Beziehungsanlauf von Shawn Mendes und Camila Cabello. Jetzt wurden sie wieder zusammen gesehen.,https://image.stern.de/34884782/t/Nw/v1/w1440/r1.7778/-/15--gemeinsam-mit-ex-camila-cabello-im-stadion---16-9---spoton-article-1070771.jpg,2024-07-15T15:12:00Z,,"Im vergangenen Sommer scheiterte der zweite Beziehungsanlauf von Shawn Mendes und Camila Cabello. Jetzt wurden sie wieder zusammen gesehen.
Shawn Mendes (25) und Camila Cabello (27) können scheinbar… [+1695 chars]",,de,'Sommer'
https://www.zeit.de/news/2024-07/16/gewitter-ueber-saarland-viele-umgestuerzte-baeume,https://www.zeit.de/news/2024-07/16/gewitter-ueber-saarland-viele-umgestuerzte-baeume,0,www.zeit.de,Unwetter: Gewitter über Saarland - viele umgestürzte Bäume,Hier finden Sie Informationen zu dem Thema „Unwetter“. Lesen Sie jetzt „Gewitter über Saarland - viele umgestürzte Bäume“.,https://img.zeit.de/news/2024-07/16/gewitter-ueber-saarland-viele-umgestuerzte-baeume-image-group/wide__1300x731,2024-07-15T22:27:38Z,,"Ein Gewitter mit kräftigem Regen hat im Saarland Straßen überflutet und Bäume zu Fall gebracht. Es habe rund 80 unwetterbedingte Einsätze gegeben, überwiegend im Regionalverband Saarbrücken und im La… [+328 chars]",,de,'Gewitter'
https://www.n-tv.de/politik/18-46-Ukraine-droht-massiver-Einbruch-bei-Getreide-Ernte--article23143824.html,https://www.n-tv.de/politik/18-46-Ukraine-droht-massiver-Einbruch-bei-Getreide-Ernte--article23143824.html,0,www.n-tv.de,Ukraine-Krieg im Liveticker: +++ 18:46 Ukraine droht massiver Einbruch bei Getreide-Ernte +++,Lesen Sie alle aktuellen Entwicklungen und Nachrichten über den russischen Angriffskrieg auf die Ukraine im Liveticker von ntv.de.,https://bilder2.n-tv.de/img/incoming/crop23332537/9041326157-cImg_16_9-w1200/Liveticker1-grau-1-Kopie.jpg,2024-07-15T22:51:00Z,,"Die Getreideernte in der Ukraine könnte nach Einschätzung des wichtigsten Erzeugerverbands in diesem Jahr wegen extremer Hitze und Trockenheit deutlich sinken. ""Die Feuchtigkeitsreserven sind extrem … [+19152 chars]",,de,'Ernte'
https://www.zeit.de/news/2024-07/16/honigernte-faellt-unterdurchschnittlich-aus,https://www.zeit.de/news/2024-07/16/honigernte-faellt-unterdurchschnittlich-aus,0,www.zeit.de,Imkerei: Honigernte fällt unterdurchschnittlich aus,Hier finden Sie Informationen zu dem Thema „Imkerei“. Lesen Sie jetzt „Honigernte fällt unterdurchschnittlich aus“.,https://img.zeit.de/news/2024-07/16/honigernte-faellt-unterdurchschnittlich-aus-image-group/wide__1300x731,2024-07-16T02:00:40Z,,"Imker in Rheinland-Pfalz und im Saarland haben in diesem Frühjahr keine gute Honigernte eingefahren. «Das lag an dieser langen Schlechtwetterperiode», sagte der Leiter des Fachzentrums Bienen und Imk… [+2281 chars]",,de,'Ernte'
https://www.zeit.de/news/2024-07/16/blitz-schlaegt-in-einfamilienhaus-ein-dachstuhlbrand,https://www.zeit.de/news/2024-07/16/blitz-schlaegt-in-einfamilienhaus-ein-dachstuhlbrand,0,www.zeit.de,Gewitter: Blitz schlägt in Einfamilienhaus ein - Dachstuhlbrand,Hier finden Sie Informationen zu dem Thema „Gewitter“. Lesen Sie jetzt „Blitz schlägt in Einfamilienhaus ein - Dachstuhlbrand“.,https://img.zeit.de/news/2024-07/16/blitz-schlaegt-in-einfamilienhaus-ein-dachstuhlbrand-image-group/wide__1300x731,2024-07-16T04:13:30Z,,"Bei einem Gewitter in Niederbayern hat ein Blitzeinschlag einen Dachstuhlbrand verursacht. Die Polizei schätzte den Schaden auf etwa 100 000 Euro, wie sie mitteilte. Ob das Einfamilienhaus in Landau … [+238 chars]",,de,'Gewitter'
https://www.zeit.de/news/2024-07/16/erst-wind-und-gewitter-dann-sonne-wolken-mix-in-nrw,https://www.zeit.de/news/2024-07/16/erst-wind-und-gewitter-dann-sonne-wolken-mix-in-nrw,0,www.zeit.de,"Wetter: Erst Wind und Gewitter, dann Sonne-Wolken-Mix in NRW","Hier finden Sie Informationen zu dem Thema „Wetter“. Lesen Sie jetzt „Erst Wind und Gewitter, dann Sonne-Wolken-Mix in NRW“.",https://img.zeit.de/news/2024-07/16/erst-wind-und-gewitter-dann-sonne-wolken-mix-in-nrw-image-group/wide__1300x731,2024-07-16T05:24:43Z,,"Die Menschen können sich in Nordrhein-Westfalen bis zum Wochenende auf Sonnenschein freuen - heute wird es aber noch mal ungemütlich. Wie der Deutsche Wetterdienst (DWD) mitteilte, muss vor allem die… [+666 chars]",,de,'Gewitter'
