index,url,valid,domain,title,description,image,published,archive,content,quote,language,keyword
https://www.focus.de/panorama/wetter-aktuell/wetter-in-deutschland-im-ticker-wechselhaftes-wetter-zum-wochenstart-in-nrw_id_54933749.html,https://www.focus.de/panorama/wetter-aktuell/wetter-in-deutschland-im-ticker-wechselhaftes-wetter-zum-wochenstart-in-nrw_id_54933749.html,0,www.focus.de,Wetterlage im Ticker - Wechselhaftes Wetter zum Wochenstart in NRW,"Alles neu macht der Mai - ganz so ist es in diesem Jahr aber nicht. Mit Werten über 25 Grad startete der Monat sonnig, doch nun gibt es verstärkte Warnungen vor schweren Gewittern. Auch der Start in die kommende Woche bleibt wechselhaft. Die aktuellen News im…",https://p6.focus.de/img/regional/sachsen-anhalt/id_192951009/blitze-entladen-sich-waehrend-eines-gewitters..jpg?im=Crop%3D%280%2C169%2C2048%2C1024%29%3BResize%3D%281200%2C627%29&hash=01fae278e4ca932ec97408e46af5ebf37c3533f1b37940b7621d15e0fbcea0aa,2023-05-07T08:15:37Z,,"Alles neu macht der Mai - ganz so ist es in diesem Jahr aber nicht. Mit Werten über 25 Grad startete der Monat sonnig, doch nun gibt es verstärkte Warnungen vor schweren Gewittern. Auch der Start in … [+12824 chars]",,de,'Gewitter'
https://www.stern.de/gesellschaft/regional/hessen/wetter--hessen-startet-mit-wolken-und-regen-in-die-neue-woche--33444786.html,https://www.stern.de/gesellschaft/regional/hessen/wetter--hessen-startet-mit-wolken-und-regen-in-die-neue-woche--33444786.html,0,www.stern.de,Wetter: Hessen startet mit Wolken und Regen in die neue Woche,"Stark bewölkt und regnerisch startet das Wetter in Hessen in die neue Woche. Am Montag sind einzelne Gewitter mit Starkregen möglich, wie der Deutsche Wetterdienst (DWD) am Sonntag in Offenbach mitteilte. Bei Gewittern gibt es demnach starke Böen, sonst wird …",https://image.stern.de/33444788/t/DZ/v1/w1440/r1.7778/-/07--urnnewsmldpacom2009010123050799594847v3w800h600l122t372r2434b1734jpeg---0c28b0f24ddbdbe8.jpg,2023-05-07T09:42:18Z,https://web.archive.org/web/20230507102716/https://www.stern.de/gesellschaft/regional/hessen/wetter--hessen-startet-mit-wolken-und-regen-in-die-neue-woche--33444786.html,"Stark bewölkt und regnerisch startet das Wetter in Hessen in die neue Woche. Am Montag sind einzelne Gewitter mit Starkregen möglich, wie der Deutsche Wetterdienst (DWD) am Sonntag in Offenbach mitte… [+843 chars]",,de,'Gewitter'
https://www.stern.de/gesellschaft/regional/rheinland-pfalz-saarland/wetter--wolken--regen-und-einzelne-gewitter-zum-wochenstart--33444790.html,https://www.stern.de/gesellschaft/regional/rheinland-pfalz-saarland/wetter--wolken--regen-und-einzelne-gewitter-zum-wochenstart--33444790.html,0,www.stern.de,"Wetter: Wolken, Regen und einzelne Gewitter zum Wochenstart","Dichte Wolken und viel Regen bestimmen das Wetter zum Start in die neue Woche in Rheinland-Pfalz und dem Saarland. Der Montag beginnt stark bewölkt und zum Teil nebelig, wie der Deutsche Wetterdienst (DWD) am Sonntag in Offenbach mitteilte. Tagsüber sind demn…",https://image.stern.de/33444792/t/Q-/v1/w1440/r1.7778/-/07--urnnewsmldpacom2009010123050799594867v3w800h600l143t0r2416b1706jpeg---b227e1bc6419982b.jpg,2023-05-07T09:43:49Z,https://web.archive.org/web/20230507111745/https://www.stern.de/gesellschaft/regional/rheinland-pfalz-saarland/wetter--wolken--regen-und-einzelne-gewitter-zum-wochenstart--33444790.html,"Dichte Wolken und viel Regen bestimmen das Wetter zum Start in die neue Woche in Rheinland-Pfalz und dem Saarland. Der Montag beginnt stark bewölkt und zum Teil nebelig, wie der Deutsche Wetterdienst… [+1003 chars]",,de,'Gewitter'
https://www.zeit.de/news/2023-05/07/wolken-regen-und-einzelne-gewitter-zum-wochenstart,https://www.zeit.de/news/2023-05/07/wolken-regen-und-einzelne-gewitter-zum-wochenstart,0,www.zeit.de,"Wetter: Wolken, Regen und einzelne Gewitter zum Wochenstart",,,2023-05-07T09:43:49Z,,"When browsing with ads:
We collect personal data and also transmit it to third-party providers
 that help us improve and finance our digital content. Some of the information stored on your device, … [+732 chars]",,de,'Gewitter'
https://www.brigitte.de/gesund/wieso-allergiker-diese-heuschnupfen-saison-besonders-leiden-13523960.html,https://www.brigitte.de/gesund/wieso-allergiker-diese-heuschnupfen-saison-besonders-leiden-13523960.html,0,www.brigitte.de,"Früher, schlimmer, länger: Warum sich die Heuschnupfen-Saison nicht nur schlimmer anfühlt","Die Sonne hat das erste Mal so viel Kraft, dass man – trotzdem noch gut eingepackt – eine Zeit lang draußen sitzen kann. Doch dann fängt es an: das Kribbeln, dann das Naserümpfen, ein lautes „Hatschi!“. Der wunderschöne Frühling schleppt auch in diesem Jahr s…",https://image.brigitte.de/13523964/t/vi/v1/w1440/r1.7778/-/birke-von-unten.jpg,2023-05-08T14:00:00Z,,"Mittlerweile ist der Frühling in vollem Gang. Kalendarisch seit dem 20., meteorologisch schon seit dem 1. März. Und spätestens seitdem, aber eigentlich fast schon früher, ist ein Tag ohne zu niesen, … [+5545 chars]",,de,'Blüte'
https://www.brigitte.de/aktuell/eisheilige--welche-bedeutung-hat-der-spaetfrost-fuer-den-garten--13524278.html,https://www.brigitte.de/aktuell/eisheilige--welche-bedeutung-hat-der-spaetfrost-fuer-den-garten--13524278.html,0,www.brigitte.de,Eisheilige: Welche Bedeutung hat der Spätfrost für den Garten?,Sie sind bei Pflanzenfreunden gefürchtet: die Eisheiligen. So kommt der Garten unbeschadet durch die kühlen Tage im Mai.,https://image.brigitte.de/13524280/t/A-/v1/w1440/r1.7778/-/08--welche-bedeutung-hat-der-spaetfrost-fuer-den-garten----1-1---spoton-article-1043981.jpg,2023-05-08T19:37:00Z,,"Sie sind bei Pflanzenfreunden gefürchtet: die Eisheiligen. So kommt der Garten unbeschadet durch die kühlen Tage im Mai.
""Vor Nachtfrost du nie sicher bist, bis Sophie vorüber ist"", lautet eine beka… [+4048 chars]",,de,'Spätfrost'
https://www.morgenpost.de/lifestyle/wohnen/article229058667/eisheilige-2023-wann-bedeutung-wetter-kaelte-frost-bauernregel.html,https://www.morgenpost.de/lifestyle/wohnen/article229058667/eisheilige-2023-wann-bedeutung-wetter-kaelte-frost-bauernregel.html,0,www.morgenpost.de,Wetter: Kälte im Frühling: Was es mit den Eisheiligen auf sich hat,"""Orientiert euch an den Eisheiligen"" – diese alte Bauernregel gilt auch heute noch. Doch was genau bedeuten eigentlich die Eisheiligen?",https://img.morgenpost.de/img/frontpage/crop232237153/6992605054-w820-cv16_9-q85/eisheilige.jpg,2023-05-09T10:26:00Z,,"Berlin. <ul><li>Die Tage vom 11. bis zum 15. Mai werden als ""Eisheilige"" bezeichnet</li><li>Alten Bauernregeln zufolge finden in dieser Zeit die letzten Frostnächte des Frühjahrs statt</li><li>Doch i… [+4995 chars]",,de,'Frühling'
https://www.morgenpost.de/berlin/article238355655/Bauernverband-warnt-vor-giftigen-gelben-Kreuzkraeutern.html,https://www.morgenpost.de/berlin/article238355655/Bauernverband-warnt-vor-giftigen-gelben-Kreuzkraeutern.html,0,www.morgenpost.de,Umwelt: Bauernverband warnt vor giftigen gelben Kreuzkräutern,"Der Landesbauernverband in Brandenburg (LBV) warnt vor Kontakt mit den gelben Blüten des giftigen Frühlingskreuzkrauts. Die Pflanze sei derzeit zahlreich an Straßen- und Feldrändern zu sehen und breite sich auf die angrenzenden Wiesen und Weiden aus, hieß es …",https://img.morgenpost.de/img/berlin/crop238355653/002260569-w820-cv16_9-q85/Jakobs-Kreuzkraut.jpg,2023-05-09T15:00:58Z,,Potsdam (dpa/bb). Der Landesbauernverband in Brandenburg (LBV) warnt vor Kontakt mit den gelben Blüten des giftigen Frühlingskreuzkrauts. Die Pflanze sei derzeit zahlreich an Straßen- und Feldrändern… [+1321 chars],,de,'Frühling'
