index,published,keyword,domain,language,valid,title,description,url,image,archive,content,quote,de,en,la,added
c353c92c4ee347eb2ad54f42c6fc6821,2026-05-23T02:39:00Z,'Frost',www.prnewswire.com,de,0.9,MOVA von Frost & Sullivan nach Absatzvolumen bei Mährobotern mit KI-Dual-Vision weltweit als Nr. 1 ausgezeichnet,"Die ViAX-Serie von MOVA bietet dank KI-Dual-Vision-Technologie intelligentere Hindernisvermeidung, adaptive Kartierung und zuverlässigeres Mähen in realen Gärten BERLIN, 23. Mai 2026 /PRNewswire/ -- MOVA wurde von Frost & Sullivan nach Absatzvolumen bei Mähro…",https://www.prnewswire.com/news-releases/mova-von-frost--sullivan-nach-absatzvolumen-bei-mahrobotern-mit-ki-dual-vision-weltweit-als-nr-1-ausgezeichnet-302780579.html,https://mma.prnewswire.com/media/2986126/image1.jpg?p=facebook,http://web.archive.org/web/20260524031250/https://www.prnewswire.com/news-releases/mova-von-frost--sullivan-nach-absatzvolumen-bei-mahrobotern-mit-ki-dual-vision-weltweit-als-nr-1-ausgezeichnet-302780579.html,"Die ViAX-Serie von MOVA bietet dank KI-Dual-Vision-Technologie intelligentere Hindernisvermeidung, adaptive Kartierung und zuverlässigeres Mähen in realen Gärten
BERLIN, 23. Mai 2026 /PRNewswire/ --… [+4563 chars]",,"MOVA von Frost & Sullivan nach Absatzvolumen bei Mährobotern mit KI-Dual-Vision weltweit als Nr. 1 ausgezeichnet. Die ViAX-Serie von MOVA bietet dank KI-Dual-Vision-Technologie intelligentere Hindernisvermeidung, adaptive Kartierung und zuverlässigeres Mähen in realen Gärten BERLIN, 23. Mai 2026 /PRNewswire/ -- MOVA wurde von Frost & Sullivan nach Absatzvolumen bei Mähro…","MOVA named No. 1 in the world by sales volume for robotic lawnmowers with AI dual vision by Frost & Sullivan. MOVA's ViAX Series Delivers Smarter Obstacle Avoidance, Adaptive Mapping, and More Reliable Mowing in Real-World Gardens with AI Dual Vision Technology BERLIN, May 23, 2026 /PRNewswire/ -- MOVA has been named by Frost & Sullivan by mowing sales volume…","MOVA nomine No. 1 in mundo per volumen venditio pro advocatorum roboticorum cum AI duali visione Frost & Sullivan. MOVA's ViAX Series Delivers Smarter Obstacle Fugae, Adaptive Mapping, and More Reliable Mowing in Real-World Gardens with AI Dual Vision Technology BERLIN, May 23, 2026 /PRNewswire/ -- MOVA a Frost & Sullivan nominatus est a falcando venditionibus volumen…",2026-05-27 21:16:40+00:00
2485cd2ca31146a02b06ca64399c19a9,2026-05-23T05:00:00Z,'Frost',www.pcgames.de,de,0.9,Diablo 4 Lord of Hatred: Der Frost-Lich-Nekromant ist der faszinierendste Beschwörer-Build der Erweiterung,"Mit dem Frost-Lich-Build verwandelt sich der Totenbeschwörer in Diablo 4 Lord of Hatred in einen eiskalten Herrscher über Schatten, Eis und die Toten. Unser großes Special zerlegt den kompletten Beschwörer-Build, analysiert die neuen Erweiterungs…",https://www.pcgames.de/Diablo-4-Spiel-55956/Tipps/lord-of-hatred-frost-lich-totenbeschwoerer-build-1535913/,https://www.pcgames.de/screenshots/1280x1024/2026/05/d4-loh-necromancer-guide-bloodless-scream-drop-harbinger-of-hate-01-buffed.jpg,http://web.archive.org/web/20260524115220/https://www.pcgames.de/Diablo-4-Spiel-55956/Tipps/lord-of-hatred-frost-lich-totenbeschwoerer-build-1535913/,Das Bild ist vertraut: Ein Trupp Skelette klappert durch den dichten Mistralwald von Skovos. Irgendwo im Dickicht kracht ein riesiger Golem mit dumpfem Donnern in eine Horde Dämonen. Frostmagier lass… [+44128 chars],,"Diablo 4 Lord of Hatred: Der Frost-Lich-Nekromant ist der faszinierendste Beschwörer-Build der Erweiterung. Mit dem Frost-Lich-Build verwandelt sich der Totenbeschwörer in Diablo 4 Lord of Hatred in einen eiskalten Herrscher über Schatten, Eis und die Toten. Unser großes Special zerlegt den kompletten Beschwörer-Build, analysiert die neuen Erweiterungs…","Diablo 4 Lord of Hatred: The Frost Lich Necromancer is the expansion's most intriguing summoner build. With the Frost Lich build, the necromancer in Diablo 4 Lord of Hatred transforms into an ice-cold ruler of shadows, ice and the dead. Our big special breaks down the entire Summoner build, analyzes the new expansions...","Diablo 4 Dominus Odium: Frost Lich Evocator est expansio scriptoris perniciosissimi vocatoris constructi. Cum Frontinus Lich construit, necromanticus in Diablo 4 Dominus Odium in glaciem frigidam umbrarum, glaciei et mortuorum rectorem transformat. Noster magnus specialis deiecerit totum vocatorem aedificatum, novas expansiones effingit.",2026-05-27 21:16:40+00:00
2ae6f34c23c66da9b4dff965fe3a4143,2026-05-12T10:43:36Z,'Schnee',www.bild.de,de,0.9,Schnee im Mai - Wintereinbruch im Süden Deutschlands,Im Oberallgäu sorgt Schnee im Mai oberhalb von 800 Metern für mehrere Zentimeter und winterliche Bilder.,https://www.bild.de/news/inland/oberallgaeu-staunt-seltenes-winterwunder-schnee-im-mai-ab-800-metern-6a02faa8453b15e119075fcf,"https://images.bild.de/6a02faa8453b15e119075fcf/817873bb61858447d1aac530da6d8890,60924a58?w=1280",,"Mehr zum Video anzeigen 
Ungewöhnliche Bilder aus dem Oberallgäu. Hier fällt mitten im Mai tatsächlich noch einmal Schnee und das nicht zu wenig. Oberhalb von 800 Metern bleiben von der weißen Prach… [+134 chars]",,Schnee im Mai - Wintereinbruch im Süden Deutschlands. Im Oberallgäu sorgt Schnee im Mai oberhalb von 800 Metern für mehrere Zentimeter und winterliche Bilder.,"Snow in May - the onset of winter in southern Germany. In Oberallgäu, snow in May above 800 meters creates several centimeters and wintry images.","Nix in Maio - impetus hiemis in Germania meridionali. In Oberallgäu, nix mense Maio supra 800 metra complures centimetra et hiemales imagines gignit.",2026-05-29 06:35:50+00:00
1c58189d47a106934d013f8cdc6c72fe,2026-05-13T08:24:34Z,'Wintereinbruch',www.stern.de,de,0.9,Hafenlogistik: Winterwetter bremst HHLA-Geschäft,Ein starker Wintereinbruch hat den Containerumschlag der HHLA im ersten Quartal eingeschränkt. Wie sich das auf Gewinn und Geschäftsausblick auswirkt.,https://www.stern.de/gesellschaft/regional/hamburg-schleswig-holstein/hafenlogistik--winterwetter-bremst-hhla-geschaeft-37394590.html,https://image.stern.de/37394592/t/2e/v1/w1440/r1.7778/-/13--dcf7uuze5iv6axs2048jpeg---4b88b30ec7cd3871.jpg,,"Kopiere den aktuellen Link
Zur Merkliste hinzufügen
Ein starker Wintereinbruch hat den Containerumschlag der HHLA im ersten Quartal eingeschränkt. Wie sich das auf Gewinn und Geschäftsausblick ausw… [+1729 chars]",,Hafenlogistik: Winterwetter bremst HHLA-Geschäft. Ein starker Wintereinbruch hat den Containerumschlag der HHLA im ersten Quartal eingeschränkt. Wie sich das auf Gewinn und Geschäftsausblick auswirkt.,Port logistics: Winter weather slows HHLA business. A severe onset of winter restricted HHLA's container throughput in the first quarter. How this affects profits and business outlook.,Portus logistics: tempestas hiemalis negotium HHLA tardat. Impetus hiemis gravis HHLA continens per primam quartam restrictam. Quomodo hoc proficuum et negotium mentis afficiat.,2026-05-29 06:35:50+00:00
194f969da283a4c6214f1d78eca8662f,2026-05-15T06:37:39Z,'Wintereinbruch',tirol.orf.at,de,0.9,Wintereinbruch bremste Feuerwehreinsatz,"Am Donnerstag ist eine Almhütte im Zillertaler Stilluptal (Bezirk Schwaz) wegen eines Brandes schwer beschädigt worden. Die herbeigerufene Feuerwehr brauchte allerdings eine Stunde lang, um zum Brandort zu gelangen. Grund waren die winterlichen Verhältnisse a…",https://tirol.orf.at/stories/3354261/,https://ibs.orf.at/tir?image=https%3A%2F%2Foekastatic.orf.at%2Fmims%2F2026%2F20%2F34%2Fcrops%2Fw%3D1200%2Ch%3D627%2Cq%3D75%2F3037306_master_1175234_brandalmhuette5.jpg%3Fs%3D59615b9305c7f902408ed1dac8d9fbc2e4cd1df9,,"Das Feuer brach in der Nacht gegen 2.30 Uhr aus. Drei Männer aus Deutschland, die in der Hütte übernachtet hatten, wurden durch einen Rauchmelder wach. Sie versuchten noch selbst, das Feuer zu lösche… [+590 chars]",,"Wintereinbruch bremste Feuerwehreinsatz. Am Donnerstag ist eine Almhütte im Zillertaler Stilluptal (Bezirk Schwaz) wegen eines Brandes schwer beschädigt worden. Die herbeigerufene Feuerwehr brauchte allerdings eine Stunde lang, um zum Brandort zu gelangen. Grund waren die winterlichen Verhältnisse a…","The onset of winter slowed fire service operations. On Thursday, an alpine hut in the Zillertal Stilluptal (Schwaz district) was severely damaged due to a fire. However, it took the fire brigade that was called an hour to get to the scene of the fire. The reason was the winter conditions...","Impetus hiemis tardatus ignis operas attulit. Die Iovis, alpinum tugurium in Zillertal Stilluptal (Schwaz districtus) ob incendium graviter laesum est. LEGIO tamen ignis eam cepit, quae hora ut ad ignem vocaretur. Causa hiemalis erat...",2026-05-29 06:35:50+00:00
fb096dcad50143db9379f31000482938,2026-05-15T04:28:44Z,'Frost',www.stern.de,de,0.9,"Wetter: Regen, Wind und Frost - wo es Schneeflocken geben könnte","Stuttgart (lsw) - Vor dem Wochenende präsentiert sich das Wetter grau, nass und kühl bis kalt: Heute stark bewölkt mit Schauern, ab dem Nachmittag auch",https://www.stern.de/gesellschaft/regional/baden-wuerttemberg/wetter--regen--wind-und-frost---wo-es-schneeflocken-geben-koennte-37399026.html,https://image.stern.de/37399028/t/RA/v1/w1440/r1.7778/-/15--ttoyssuznbv4axs2048jpeg---a346828b05fa83b2.jpg,http://web.archive.org/web/20260515060648/https://www.stern.de/gesellschaft/regional/baden-wuerttemberg/wetter--regen--wind-und-frost---wo-es-schneeflocken-geben-koennte-37399026.html,"Kopiere den aktuellen Link
Zur Merkliste hinzufügen
Mitte Mai präsentiert sich das Wetter wenig frühlingshaft. Wie sich die Temperaturen entwickeln und wo es Schneeflocken geben könnte.
Vor dem Wo… [+1351 chars]",,"Wetter: Regen, Wind und Frost - wo es Schneeflocken geben könnte. Stuttgart (lsw) - Vor dem Wochenende präsentiert sich das Wetter grau, nass und kühl bis kalt: Heute stark bewölkt mit Schauern, ab dem Nachmittag auch","Weather: Rain, wind and frost - where there could be snowflakes. Stuttgart (lsw) - Before the weekend the weather is grey, wet and cool to cold: today very cloudy with showers, from the afternoon onwards too","Tempestas: Pluvia, ventus et gelu - ubi nivis esse potuerunt. Stuttgart (lsw) - Tempestas ante volutpat est griseus, humidus et frigidus ad frigus: hodie valde nubilus cum imbribus, post meridiem nimis",2026-05-30 20:19:10+00:00
