index,published,keyword,domain,language,valid,title,description,url,image,archive,content,quote,de,en,la,added
47c109a1ddb2c3996fe8834b465691e9,2026-05-01T05:33:47Z,'Schnee',orf.at,de,0.9,April verschärfte Trockenheit,"Obwohl von Schneefall über Spätfrost bis zu Sommertemperaturen und ersten heftigen Gewittern alles dabei war, kann man den eben zu Ende gegangenen April nicht als besonders „launisch“ bezeichnen. Zu stabil war dafür die Großwetterlage. Doch gab es im April in…",https://orf.at/stories/3428437/,https://ibs.orf.at/news?image=https%3A%2F%2Fassets.orf.at%2Fmims%2F2026%2F18%2F06%2Fcrops%2Fw%3D1200%2Ch%3D630%2Cq%3D75%2F3021229_master_1168806_wetter_klima_april_bilanz_trockenheit_ros.jpg%3Fs%3D0e471270c2c7b97fb301348dc623a1abee87960d,,Im Zuge des sich weiter beschleunigenden Klimawandels in den letzten Jahrzehnten hat sich der April stark erwärmt und bringt inzwischen verlässlich die ersten klimatologischen Sommertage mit Höchstwe… [+5052 chars],,"April verschärfte Trockenheit. Obwohl von Schneefall über Spätfrost bis zu Sommertemperaturen und ersten heftigen Gewittern alles dabei war, kann man den eben zu Ende gegangenen April nicht als besonders „launisch“ bezeichnen. Zu stabil war dafür die Großwetterlage. Doch gab es im April in…","April intensified drought. Although there was everything from snowfall to late frost to summer temperatures and the first heavy thunderstorms, the April that has just ended cannot be described as particularly “moody”. The general weather situation was too stable for that. But in April there was…","Aprilis intenditur sitis. Etsi omnia a nive ad serotinam pruinam ad temperaturas aestivas et primo procellis gravia facta sunt, Aprilis proxime finitus describi non potest peculiariter ""moody"". Locus communis tempestatis nimis stabilis erat. Sed mense Aprili erat…",2026-05-03 08:59:25+00:00
20b74ac8e27a91389d74a7a8d2669043,2026-05-05T11:14:52Z,'Schnee',www.welt.de,de,0.9,Hamburg zahlt zehn Millionen Euro extra für Schlaglöcher,"Schnee, Eis und Frost haben Hamburgs Straßen zugesetzt. Jetzt folgt die Rechnung: Der Senat will zehn Millionen Euro extra ausgeben, um Schlaglöcher zu reparieren und Winterschäden zu beseitigen. Das Geld soll schnell freigegeben werden.",https://www.welt.de/regionales/hamburg/article69f9c0a296fe1372395e9fb8/strassenschaeden-hamburg-zahlt-zehn-millionen-euro-extra-fuer-schlagloecher.html,https://images.welt.de/69f9c0a296fe1372395e9fb8/c4a41fd00ab5c11b9400de1bbaf07d4f-master/ci16x9-w1200/dpa-com-20090101-260125-911-002162-jpg,,Der harte Winter hat in Hamburg Spuren hinterlassen und kostet die Stadt nun zusätzliches Geld. Der Senat will im Jahr 2026 zehn Millionen Euro mehr für die Beseitigung von Winterschäden und Schlaglö… [+1863 chars],,"Hamburg zahlt zehn Millionen Euro extra für Schlaglöcher. Schnee, Eis und Frost haben Hamburgs Straßen zugesetzt. Jetzt folgt die Rechnung: Der Senat will zehn Millionen Euro extra ausgeben, um Schlaglöcher zu reparieren und Winterschäden zu beseitigen. Das Geld soll schnell freigegeben werden.","Hamburg pays ten million euros extra for potholes. Snow, ice and frost have clogged Hamburg's streets. Now comes the calculation: The Senate wants to spend an extra ten million euros to repair potholes and repair winter damage. The money should be released quickly.","Hamburg decem miliones nummis Europaeis extra potholis solvit. Nix, glacies et gelu viae Hamburgensis plus inhaerent. Iam calculus venit: Senatus extra decem miliones nummorum nummorum ad sartaginem reparandam et damna hiemalia reparanda vult expendere. Pecunia cito dimitti debet.",2026-05-08 15:04:15+00:00
f7ac06b5439b988adcc01dc0bd665834,2026-05-04T09:09:50Z,'Spätfrost',www.morgenpost.de,de,0.9,Eisheilige stehen bevor: Darauf sollten Gärtner unbedingt achten,"Bevor der Sommer richtig beginnt, drohen Pflanzen im Garten und auf dem Balkon noch Frostnächte. Welche Tipps schützen vor den Eisheiligen?",https://www.morgenpost.de/panorama/article401542814/eisheilige-2026-schafskaelte-garten-arbeit-gaertner-bauernregeln-tipps.html,https://img.sparknews.funkemedien.de/411730663/411730663_1776332254_v16_9_1600.jpeg,,"<ul><li>Auf das erste Frühlingshoch könnte in Deutschland ein Kälterückfall folgen</li><li>Eisheilige bringen Frostgefahr mit sich  Hobbygärtner müssen besonders aufpassen</li><li>Lesen Sie hier, wie… [+4365 chars]",,"Eisheilige stehen bevor: Darauf sollten Gärtner unbedingt achten. Bevor der Sommer richtig beginnt, drohen Pflanzen im Garten und auf dem Balkon noch Frostnächte. Welche Tipps schützen vor den Eisheiligen?","Ice saints are coming: Gardeners should definitely pay attention to this. Before summer really begins, plants in the garden and on the balcony are still threatened with frosty nights. What tips protect against the Ice Saints?","Glacies sancti veniunt: hortulani hoc certum attendere debent. Antequam aestas vere incipit, plantae in horto et in podio noctes pruinae adhuc imminent. Quos apices contra Sanctos glacies defendunt?",2026-05-09 20:04:15+00:00
53b4a0f7456504bc91cd46ff3c17bdb6,2026-05-07T06:00:00Z,'Frost',www.telepolis.de,de,0.9,"Erst Dürre, dann Frost: Warum der deutsche Frühling immer gefährlicher wird","Extremes Wetter im Frühling trifft Wälder, Felder und Ernten hart – und die Ursache dahinter ist komplexer als viele denken.",https://www.telepolis.de/article/Erst-Duerre-dann-Frost-Warum-der-deutsche-Fruehling-immer-gefaehrlicher-wird-11280675.html,https://heise.cloudimg.io/cdn/n/n/_www-heise-de_/imgs/18/5/0/7/5/7/3/0/aigner-01-8fddb8eca5766907.gif,,"Extremes Wetter im Frühling trifft Wälder, Felder und Ernten hart und die Ursache dahinter ist komplexer als viele denken.
Im April regnete es nur gut die Hälfte der Menge, die im langjährigen Mitte… [+9693 chars]",,"Erst Dürre, dann Frost: Warum der deutsche Frühling immer gefährlicher wird. Extremes Wetter im Frühling trifft Wälder, Felder und Ernten hart – und die Ursache dahinter ist komplexer als viele denken.","First drought, then frost: Why the German spring is becoming more and more dangerous. Extreme spring weather hits forests, fields and crops hard - and the cause is more complex than many think.","Primo siccitas, deinde pruina: quare in Germanicum ver magis ac periculosius est. Ver extrema tempestas silvas, agros et fruges duras - et causa multiplicior quam multi putant.",2026-05-09 20:04:15+00:00
88734d3eb9083a0a01a02c991a0263b3,2026-05-12T09:38:16Z,'Winterdienst',www.tagesschau.de,de,0.9,Die Eisheiligen bringen Schnee in Teilen Deutschlands,"Ob Brocken, Fichtelberg, Feldberg oder im Oberallgäu: Die Farbe weiß dominiert. Mitten im Frühling meldet sich in einigen Teilen Deutschlands der Winter zurück. Schon bald dürfte das Ganze aber Schnee von gestern sein.",https://www.tagesschau.de/inland/gesellschaft/schnee-mai-deutschland-100.html,https://images.tagesschau.de/image/54e84f67-3f27-4b12-afda-471f2e6452ec/AAABnhth11E/AAABnSSvrFg/16x9-big/feldberg-128.jpg?width=1280,,"Stand: 12.05.2026 11:38 Uhr
Ob Brocken, Fichtelberg, Feldberg oder im Oberallgäu: Die Farbe weiß dominiert. Mitten im Frühling meldet sich in einigen Teilen Deutschlands der Winter zurück. Schon bal… [+2509 chars]",,"Die Eisheiligen bringen Schnee in Teilen Deutschlands. Ob Brocken, Fichtelberg, Feldberg oder im Oberallgäu: Die Farbe weiß dominiert. Mitten im Frühling meldet sich in einigen Teilen Deutschlands der Winter zurück. Schon bald dürfte das Ganze aber Schnee von gestern sein.","The Ice Saints bring snow to parts of Germany. Whether Brocken, Fichtelberg, Feldberg or in Oberallgäu: the color white dominates. In the middle of spring, winter returns in some parts of Germany. But the whole thing will soon be a thing of the past.","Sancti glacies in Germaniae partibus nives afferunt. Utrum Brocken, Fichtelberg, Feldberg vel in Oberallgäu: color albus dominatur. Medio vere, hiems in nonnullis Germaniae partibus redit. Sed mox tota res praeteriti temporis erit.",2026-05-13 16:00:23+00:00
e42d8582ab20b3bfd852df4fec8c458e,2026-05-10T18:35:05Z,'Schnee',www.bild.de,de,0.9,Sogar Schnee möglich - Eisheilige bringen neue Kältewelle,"Rumms, da rutschen die Temperaturen runter! Es wird bibberkalt.",https://www.bild.de/news/wetter/eisheilige-bringen-neue-kaeltewelle-sogar-schnee-moeglich-6a00583e419773c332a83377,"https://images.bild.de/6a00583e419773c332a83377/3bed66b9cec88799f3e49ebc21780c13,f284528a?w=1280",,TTS-Player überspringenArtikel weiterlesenEs wird bibberkalt. Die Eisheiligen bescheren uns eine neue Kältewelle. Das Wetter macht bei den Temperaturen eine komplette Rolle rückwärts: Schluss mit Son… [+3209 chars],,"Sogar Schnee möglich - Eisheilige bringen neue Kältewelle. Rumms, da rutschen die Temperaturen runter! Es wird bibberkalt.","Even snow possible - Ice Saints bring a new wave of cold. Boom, the temperatures are slipping down! It's getting freezing cold.","Etiam nix fieri potest -- Ice Saints bring new wave of cold. BUTIO, temperaturae labuntur! Suus questus frigore.",2026-05-13 20:58:49+00:00
3b68005674c779c1cf74c49dda63e89a,2026-05-12T04:10:26Z,'Schneefallgrenze',www.stern.de,de,0.9,Wettervorhersage: Schnee im Mai,"Am Wochenende noch Sommer, jetzt wieder Winter: In Bayern rechnen Meteorologen - passend zu den Eisheiligen - tatsächlich noch einmal mit Schnee.",https://www.stern.de/gesellschaft/regional/bayern/wettervorhersage--schnee-im-mai-37390246.html,https://image.stern.de/37390248/t/UG/v1/w1440/r1.7778/-/12--zpfi7j2lm7v6axs2048jpeg---560d3457867065c3.jpg,,"Kopiere den aktuellen Link
Zur Merkliste hinzufügen
Am Wochenende noch Sommer, jetzt wieder Winter: In Bayern rechnen Meteorologen - passend zu den Eisheiligen - tatsächlich noch einmal mit Schnee.… [+1737 chars]",,"Wettervorhersage: Schnee im Mai. Am Wochenende noch Sommer, jetzt wieder Winter: In Bayern rechnen Meteorologen - passend zu den Eisheiligen - tatsächlich noch einmal mit Schnee.","Weather forecast: snow in May. Still summer at the weekend, now winter again: In Bavaria, meteorologists - in keeping with the ice saints - are actually expecting snow again.","Tempestas praenuntietur: nix mense Maio. Aestas adhuc in volutpat vestibulum, nunc hiems iterum: In Bavaria astrologi - secundum glaciem sanctorum - actu nivem exspectant iterum.",2026-05-13 20:58:49+00:00
5f10b3db95e8f89745385a65bc7a15b3,2026-05-12T04:10:26Z,'Schnee',www.zeit.de,de,0.9,Wettervorhersage: Schnee im Mai,Hier finden Sie Informationen zu dem Thema „Wettervorhersage“. Lesen Sie jetzt „Schnee im Mai“.,https://www.zeit.de/news/2026-05/12/schnee-im-mai,https://img.zeit.de/news/2026-05/12/schnee-im-mai-image-group/wide__1300x731,,"Es fühlte sich schon so nach Sommer an, doch jetzt kommt der Winter noch einmal zurück nach Bayern - und das Mitte Mai. Die Schneefallgrenze sinkt den Alpen laut Deutschem Wetterdienst auf 1.000 Mete… [+1575 chars]",,Wettervorhersage: Schnee im Mai. Hier finden Sie Informationen zu dem Thema „Wettervorhersage“. Lesen Sie jetzt „Schnee im Mai“.,Weather forecast: snow in May. Here you will find information on the subject of “weather forecast”. Read “Snow in May” now.,"Tempestas praenuntietur: nix mense Maio. Hic reperies informationes de re ""tempestatis praenuntientur"". Legere ""Nives in May"" nunc.",2026-05-13 20:58:49+00:00
0cc3e038615f23437993442392d8de46,2026-05-12T11:04:48Z,'Schneefallgrenze',www.stern.de,de,0.9,Wettervorhersage: Schnee im Mai - Mehrere Unfälle im Allgäu,"Am Wochenende noch Sommer, jetzt wieder Winter: In Bayern fällt - passend zu den Eisheiligen - tatsächlich noch einmal Schnee. Das macht sich auf den Straßen im Süden bemerkbar.",https://www.stern.de/gesellschaft/regional/bayern/wettervorhersage--schnee-im-mai---mehrere-unfaelle-im-allgaeu-37390246.html,https://image.stern.de/37391728/t/Cw/v1/w1440/r1.7778/-/12--dixthbrf5wv3axs2048jpeg---e04b495aa667bae6.jpg,,"Kopiere den aktuellen Link
Zur Merkliste hinzufügen
Am Wochenende noch Sommer, jetzt wieder Winter: In Bayern fällt - passend zu den Eisheiligen - tatsächlich noch einmal Schnee. Das macht sich auf… [+2858 chars]",,"Wettervorhersage: Schnee im Mai - Mehrere Unfälle im Allgäu. Am Wochenende noch Sommer, jetzt wieder Winter: In Bayern fällt - passend zu den Eisheiligen - tatsächlich noch einmal Schnee. Das macht sich auf den Straßen im Süden bemerkbar.","Weather forecast: Snow in May - Several accidents in the Allgäu. At the weekend it was still summer, now winter again: in Bavaria - in keeping with the Ice Saints - snow is actually falling again. This is noticeable on the streets in the south.","Tempestas praenuntietur: Nix in Maio - Varia accidentia in Allgäu. In volutpat vestibulum adhuc erat aestas, nunc iterum hiems: in Bavaria - secundum Sanctorum glacies - nix actu iterum cadit. Hoc notabile est in plateis ad meridiem.",2026-05-13 20:58:49+00:00
cfb10655a52d5c8b1d15e65ff16e1d99,2026-05-12T11:26:07Z,'Wintereinbruch',www.bild.de,de,0.9,Eisheilige bringen Wintereinbruch - Mitten im Mai in Deutschland plötzlich Schnee,Schnee im Mai sorgt für Überraschungen in den deutschen Mittelgebirgen. Meteorologen erklären die ungewöhnliche Kälte und wie lange das Winter-Comeback anhält.,https://www.bild.de/news/wetter/schnee-im-mai-eisheilige-bringen-wintereinbruch-in-deutschland-6a02d675453b15e119075b2b,"https://images.bild.de/6a02d675453b15e119075b2b/00523adc9405e86c3de84e8340de744b,924c51c7?w=1280",,"TTS-Player überspringenArtikel weiterlesenAllgäu Plötzlich ist der Winter zurück! Eben noch Sonne, Freibad, Frühlingsgefühle, jetzt Schneeflocken, Frost und bibberkalte Temperaturen. Von diesem Mai s… [+3033 chars]",,Eisheilige bringen Wintereinbruch - Mitten im Mai in Deutschland plötzlich Schnee. Schnee im Mai sorgt für Überraschungen in den deutschen Mittelgebirgen. Meteorologen erklären die ungewöhnliche Kälte und wie lange das Winter-Comeback anhält.,Ice saints bring the onset of winter - suddenly snow in Germany in the middle of May. Snow in May causes surprises in the German low mountain ranges. Meteorologists explain the unusual cold and how long the winter comeback will last.,Glacies sanctorum impetum hiemis afferunt - subito nix in Germania medio Maio. Nix in Maio miratur in montibus humilibus Germanorum. Astrologi insolitum frigus explicant et quousque hiemis regressus durabit.,2026-05-13 20:58:49+00:00
30b70d8b182db81383c25d994ee7718c,2026-05-11T11:07:05Z,'Bodenfrost',www.stern.de,de,0.9,Wetter: Typisch: Eisheilige mit Kälte und Regen nach den Sonnentagen,"Kälte, Regen und sogar Bodenfrost: Die sogenannten Eisheiligen zeigen sich von ihrer typischen Seite. Warum Hobbygärtner jetzt besonders auf ihre Pflanzen achten müssen.",https://www.stern.de/gesellschaft/regional/baden-wuerttemberg/wetter--typisch--eisheilige-mit-kaelte-und-regen-nach-den-sonnentagen-37386550.html,https://image.stern.de/37388180/t/4l/v1/w1440/r1.7778/-/11--tmjmt36hvqv3axs2048jpeg---2db2d5901ab79177.jpg,,"Kopiere den aktuellen Link
Zur Merkliste hinzufügen
Kälte, Regen und sogar Bodenfrost: Die sogenannten Eisheiligen zeigen sich von ihrer typischen Seite. Warum Hobbygärtner jetzt besonders auf ihre… [+2294 chars]",,"Wetter: Typisch: Eisheilige mit Kälte und Regen nach den Sonnentagen. Kälte, Regen und sogar Bodenfrost: Die sogenannten Eisheiligen zeigen sich von ihrer typischen Seite. Warum Hobbygärtner jetzt besonders auf ihre Pflanzen achten müssen.","Weather: Typical: Ice Saints with cold and rain after the sunny days. Cold, rain and even ground frost: the so-called ice saints show off their typical side. Why hobby gardeners now have to pay special attention to their plants.","Weather: Typical: Glacies Sanctorum cum frigore et pluvia post dies apricis. Frigus, pluvia, et etiam humus gelu: sic dicta glacies sanctorum ostentant partem typicam suam. Quare hortulani amabam nunc sedulo suas plantas habent.",2026-05-14 05:59:09+00:00
ff6f3f51aee8a8ec8305a4d5f595a570,2026-05-13T03:49:59Z,'Schnee',www.stern.de,de,0.9,Wettervorhersage: Wetter bleibt ungemütlich - auch am Feiertag,"Zuletzt noch Sommer, jetzt wieder Winter: Das Wetter bleibt in Bayern ungemütlich, mit Schnee in höheren Lagen. Der Feiertag fällt vielerorts ins Wasser - und nicht nur der.",https://www.stern.de/gesellschaft/regional/bayern/wettervorhersage--wetter-bleibt-ungemuetlich---auch-am-feiertag-37393882.html,https://image.stern.de/37393884/t/LV/v1/w1440/r1.7778/-/13--tius5wts43v3axs2048jpeg---ac11ce066f4dc31c.jpg,,"Kopiere den aktuellen Link
Zur Merkliste hinzufügen
Zuletzt noch Sommer, jetzt wieder Winter: Das Wetter bleibt in Bayern ungemütlich, mit Schnee in höheren Lagen. Der Feiertag fällt vielerorts ins… [+1007 chars]",,"Wettervorhersage: Wetter bleibt ungemütlich - auch am Feiertag. Zuletzt noch Sommer, jetzt wieder Winter: Das Wetter bleibt in Bayern ungemütlich, mit Schnee in höheren Lagen. Der Feiertag fällt vielerorts ins Wasser - und nicht nur der.","Weather forecast: The weather remains unpleasant - even on public holidays. Last summer, now winter again: The weather in Bavaria remains uncomfortable, with snow at higher altitudes. The holiday falls through in many places - and not just that.","Tempestas praenuntietur: Tempestas ingrata manet - etiam in festis publicis. Aestas proxima, nunc hiems iterum: Tempestas in Bavaria manet incommoda, cum nive in altioribus altitudinibus. Feriae in multis locis cadunt - neque id solum.",2026-05-14 09:42:32+00:00
f918ec2550ab16b24f4768fafbd0c928,2026-05-13T07:19:42Z,'Schneefallgrenze',www.sueddeutsche.de,de,0.9,Vorhersage für Bayern: Wetter bleibt ungemütlich – auch am Feiertag,"Das Wetter bleibt in Bayern ungemütlich, mit Schnee in höheren Lagen. Der Feiertag fällt vielerorts ins Wasser.",https://www.sueddeutsche.de/bayern/bayern-wetter-regen-kaelte-feiertag-christi-himmelfahrt-li.3482850,https://www.sueddeutsche.de/2026/04/10/df0421b3-52cb-43e5-9796-b45ebe67c1f3.jpg?q=60&fm=webp&width=1200&rect=0%2C209%2C4000%2C2250,,"Am Mittwoch soll es im Süden anfangs freundlich sein mit Sonne und Wolken, ansonsten bewölkt bis bedeckt. Von Nordwesten her sollen dann neue Schauer aufkommen. An Christi Himmelfahrt am Donnerstag s… [+461 chars]",,"Vorhersage für Bayern: Wetter bleibt ungemütlich – auch am Feiertag. Das Wetter bleibt in Bayern ungemütlich, mit Schnee in höheren Lagen. Der Feiertag fällt vielerorts ins Wasser.","Forecast for Bavaria: Weather remains unpleasant – even on public holidays. The weather remains uncomfortable in Bavaria, with snow at higher altitudes. The holiday falls through in many places.","Praedictio Bavariae: Tempestas ingrata manet — etiam in festis publicis. Tempestas in Bavaria incommodis manet, nive ad altiora altitudines. Festos in multis locis cadit.",2026-05-14 09:42:32+00:00
6b9bcd927328b6abadd9eec805dba255,2026-05-03T09:26:47Z,'Schnee',www.stern.de,de,0.9,Wetter: Sturm und Schnee statt Sonne – Griechenland friert im Mai,Griechenland erlebt den kältesten Mai-Beginn seit Jahrzehnten. Schnee und Sturm überraschen Einheimische und Touristen – doch für die Landwirtschaft bringt das Wetter auch Vorteile.,https://www.stern.de/panorama/wetter--sturm-und-schnee-statt-sonne---griechenland-friert-im-mai-37363858.html,https://image.stern.de/37363860/t/SQ/v1/w1440/r1.7778/-/03--wcukxzsakqv3axs2048jpeg---afdd2f47f7fdf73e.jpg,http://web.archive.org/web/20260504120031/https://www.stern.de/panorama/wetter--sturm-und-schnee-statt-sonne---griechenland-friert-im-mai-37363858.html,"Kopiere den aktuellen Link
Zur Merkliste hinzufügen
Griechenland erlebt den kältesten Mai-Beginn seit Jahrzehnten. Schnee und Sturm überraschen Einheimische und Touristen doch für die Landwirtschaf… [+1554 chars]",,Wetter: Sturm und Schnee statt Sonne – Griechenland friert im Mai. Griechenland erlebt den kältesten Mai-Beginn seit Jahrzehnten. Schnee und Sturm überraschen Einheimische und Touristen – doch für die Landwirtschaft bringt das Wetter auch Vorteile.,Weather: Storm and snow instead of sun – Greece is freezing in May. Greece is experiencing the coldest start to May in decades. Snow and storms surprise locals and tourists - but the weather also brings advantages for agriculture.,Tempestas: Tempestas et nix pro sole – Graecia mense Maio rigens est. Graecia frigidissima in decenniis Maii initium experitur. Nix et procellae incolis peregrinatoresque opprimunt - sed tempestas etiam commoda agriculturae adfert.,2026-05-15 20:37:13+00:00
aa71ab254d1d167ba40012b0431e36f8,2026-05-06T06:27:30Z,'Schnee',www.n-tv.de,de,0.9,Hohn für die Opfer: Aus ICE mach NICE: Trump kokettiert mit Behörden-Umbenennung,"Zu Jahresbeginn werden bei Einsätzen der Einwanderungsbehörde ICE im US-Bundesstaat Minnesota zwei US-Bürger getötet. Gegen Migranten gehen ICE-Mitarbeiter teilweise brutal vor. Für Präsident Trump ist das offenbar Schnee von gestern, er springt auf den Vorsc…",https://www.n-tv.de/politik/Aus-ICE-mach-NICE-Trump-kokettiert-mit-Behoerden-Umbenennung-id30790507.html,https://www.n-tv.de/img/30790522/1778052655/Img_16_9/1200/HHlKQODaQAAaEsy.jpg,http://web.archive.org/web/20260507054941/https://www.n-tv.de/politik/Aus-ICE-mach-NICE-Trump-kokettiert-mit-Behoerden-Umbenennung-id30790507.html,"Renee Good wurde im Frühjahr von einem ICE-Mitarbeiter getötet, Alex Pretti von Beamten des Grenzschutzes am Rande von Protesten gegen das Vorgehen von ICE. (Foto: picture alliance / Sipa USA)
Zu Ja… [+1855 chars]",,"Hohn für die Opfer: Aus ICE mach NICE: Trump kokettiert mit Behörden-Umbenennung. Zu Jahresbeginn werden bei Einsätzen der Einwanderungsbehörde ICE im US-Bundesstaat Minnesota zwei US-Bürger getötet. Gegen Migranten gehen ICE-Mitarbeiter teilweise brutal vor. Für Präsident Trump ist das offenbar Schnee von gestern, er springt auf den Vorsc…","Mockery for the victims: Turn ICE into NICE: Trump flirts with renaming the authorities. At the beginning of the year, two US citizens were killed during operations by the immigration agency ICE in the US state of Minnesota. ICE employees sometimes take brutal action against migrants. For President Trump, this is apparently a thing of the past, he is jumping on the...","Ludibrium pro victimis: Turn glaciem in LAETUS: Trump ridens renaming auctoritates. Ineunte anno duo cives US immigrationem intermedium glaciem in re publica Minnesota in operationibus US occisae sunt. ICE operarii interdum truculentam actionem contra migrantes accipiunt. Praeses Trump, hoc videtur esse res praeteritae, salit in ...",2026-05-15 20:37:13+00:00
60882ef39f46246645c94bb497cbb404,2026-05-12T05:40:48Z,'Schnee',www.stern.de,de,0.9,Wetter: Schnee in den Bergen,"Zu den Eisheiligen zeigt sich der Mai in Sachsen, Sachsen-Anhalt und Thüringen winterlich: In den Hochlagen ist Schnee gefallen, dazu gibt es Schauer und Gewitter.",https://www.stern.de/gesellschaft/regional/sachsen/wetter--schnee-in-den-bergen-37390342.html,https://image.stern.de/37390344/t/FG/v1/w1440/r1.7778/-/12--gmokaqy6qxv20axs2048jpeg---97d877b955843f2d.jpg,http://web.archive.org/web/20260512062854/https://www.stern.de/gesellschaft/regional/sachsen/wetter--schnee-in-den-bergen-37390342.html,"Kopiere den aktuellen Link
Zur Merkliste hinzufügen
Zu den Eisheiligen zeigt sich der Mai in Sachsen, Sachsen-Anhalt und Thüringen winterlich: In den Hochlagen ist Schnee gefallen, dazu gibt es Sch… [+1229 chars]",,"Wetter: Schnee in den Bergen. Zu den Eisheiligen zeigt sich der Mai in Sachsen, Sachsen-Anhalt und Thüringen winterlich: In den Hochlagen ist Schnee gefallen, dazu gibt es Schauer und Gewitter.","Weather: Snow in the mountains. During the Ice Saints, May looks wintry in Saxony, Saxony-Anhalt and Thuringia: snow has fallen in the high altitudes, and there are showers and thunderstorms.","Tempestas: Nix in montibus. Inter sanctos Ice, Maias in Saxonia, Saxonia-Anhalt et Thuringia brumalem spectat: nix in altis altitudinibus cecidit, et sunt imbres et tonitrua.",2026-05-15 20:37:13+00:00
8a001c85e400b98bd7e6f066ad265e14,2026-05-14T06:30:00Z,'Frosttage',www.stern.de,de,0.9,Spätfrost im Mai: Bauernregel auf dem Prüfstand: Haben die Eisheiligen ausgedient?,Laut der Bauernregel der Eisheiligen gibt es Mitte Mai die letzten Frosttage. Für viele Gärtner ist dies noch immer ein wichtiger Richtwert. Doch was ist am Volksglauben dran?,https://www.stern.de/panorama/spaetfrost-im-mai--haben-die-eisheiligen-ausgedient--37394840.html,https://image.stern.de/37396584/t/KH/v1/w1440/r1.7778/-/eisheilige.jpg,,"Zugang zu stern+statt 11,96 
 nur 1  
<ul><li>Alles von stern+ mit erstklassigen Inhalten von GEO und Capital</li><li>4 Wochen testen, dann 2,99  je Woche</li><li>jederzeit kündbar</li></ul>",,Spätfrost im Mai: Bauernregel auf dem Prüfstand: Haben die Eisheiligen ausgedient?. Laut der Bauernregel der Eisheiligen gibt es Mitte Mai die letzten Frosttage. Für viele Gärtner ist dies noch immer ein wichtiger Richtwert. Doch was ist am Volksglauben dran?,"Late frost in May: Farmer's rule put to the test: Have the Ice Saints had their day? According to the Ice Saints' farming rule, the last days of frost occur in mid-May. For many gardeners, this is still an important guideline. But what is the truth about popular belief?","Nuper gelu in Maio: regula agricolae experior: Habetne Sancti glacies diem suum? Iuxta regulam agriculturae Sanctorum glacies, postremi dies frigoris in medio Maio occurrunt. Multi hortulani, hoc est ratio magni momenti. Sed quae est vera opinio vulgi?",2026-05-16 20:09:05+00:00
