index,url,valid,domain,title,description,image,published,archive,content,quote,language,keyword
https://www.stern.de/gesellschaft/regional/hessen/honig--imker-erwarten-gute-erste-ernte-in-hessen-35771074.html,https://www.stern.de/gesellschaft/regional/hessen/honig--imker-erwarten-gute-erste-ernte-in-hessen-35771074.html,0,www.stern.de,Honig: Imker erwarten gute erste Ernte in Hessen,Kirchhain (lhe) - Nach einem milden Winter mit überdurchschnittlichen Verlusten bei Bienenvölkern blicken Hessens Imker auf ein bislang erfreuliches,https://image.stern.de/35771076/t/L0/v1/w1440/r1.7778/-/01--yhaqyx6vwpv3axs2048jpeg---a9b7a299acd5cb4c.jpg,2025-06-01T02:00:38Z,,"Kopiere den aktuellen Link
Zur Merkliste hinzufügen
Milde Temperaturen, frühe Blüte, reichlich Flugzeit: Hessens Imker melden eine gute Frühjahrssaison. Ob das so bleibt, entscheidet das Wetter.
N… [+1801 chars]",,de,'Winter'
https://www.zeit.de/news/2025-06/01/brandenburger-landpartie-besucher-koennen-bauernhoefe-erleben,https://www.zeit.de/news/2025-06/01/brandenburger-landpartie-besucher-koennen-bauernhoefe-erleben,0,www.zeit.de,Landwirtschaft: Brandenburger Landpartie: Besucher können Bauernhöfe erleben,Hier finden Sie Informationen zu dem Thema „Landwirtschaft“. Lesen Sie jetzt „Brandenburger Landpartie: Besucher können Bauernhöfe erleben“.,https://img.zeit.de/news/2025-06/01/brandenburger-landpartie-besucher-koennen-bauernhoefe-erleben-image-group/wide__1300x731,2025-06-01T04:00:40Z,,Wie wird Getreide geerntet und wie funktioniert ein Melkroboter? Bei der 30. Brandenburger Landpartie am 14. und 15. Juni geben Landwirtschaftsbetriebe Einblick in ihre Arbeit und die Produktion regi… [+939 chars],,de,'Erle'
https://www.tagesspiegel.de/berlin/landwirtschaft-brandenburger-landpartie-besucher-konnen-bauernhofe-erleben-13784047.html,https://www.tagesspiegel.de/berlin/landwirtschaft-brandenburger-landpartie-besucher-konnen-bauernhofe-erleben-13784047.html,0,www.tagesspiegel.de,Landwirtschaft: Brandenburger Landpartie: Besucher können Bauernhöfe erleben,Was passiert eigentlich auf dem Bauernhof? Die Brandenburger Landpartie will Einblick in die Produktion regionaler Lebensmittel geben. Bei Sanddorn und Sonnenblumen ist Brandenburg vorne mit dabei.,https://www.tagesspiegel.de/images/13784044/alternates/BASE_16_9_W1400/1748750540000/landwirtschaft-in-brandenburg.jpeg,2025-06-01T04:02:20Z,,Wie wird Getreide geerntet und wie funktioniert ein Melkroboter? Bei der 30. Brandenburger Landpartie am 14. und 15. Juni geben Landwirtschaftsbetriebe Einblick in ihre Arbeit und die Produktion regi… [+1660 chars],,de,'Ernte'
https://www.zeit.de/news/2025-06/01/ueber-100-einsaetze-fuer-polizei-und-feuerwehr-wegen-unwetter,https://www.zeit.de/news/2025-06/01/ueber-100-einsaetze-fuer-polizei-und-feuerwehr-wegen-unwetter,0,www.zeit.de,Starkregen und Gewitter: Über 100 Einsätze für Polizei und Feuerwehr wegen Unwetter,Hier finden Sie Informationen zu dem Thema „Starkregen und Gewitter“. Lesen Sie jetzt „Über 100 Einsätze für Polizei und Feuerwehr wegen Unwetter“.,https://img.zeit.de/news/2025-06/01/ueber-100-einsaetze-fuer-polizei-und-feuerwehr-wegen-unwetter-image-group/wide__1300x731,2025-06-01T06:49:17Z,,"Zu mehr als 100 Einsätzen sind Polizei und Feuerwehr wegen des Unwetters in Baden-Württemberg ausgerückt. Es war vor allem die Nordhälfte des Landes betroffen, wie die Polizeipräsidien mitteilten. Vi… [+855 chars]",,de,'Gewitter'
https://www.stern.de/lifestyle/gesellschaft--sind-das-die-sommertrends--sunscreen-lust-und-pornstar-drink-35771352.html,https://www.stern.de/lifestyle/gesellschaft--sind-das-die-sommertrends--sunscreen-lust-und-pornstar-drink-35771352.html,0,www.stern.de,Gesellschaft: Sind das die Sommertrends? Sunscreen-Lust und Pornstar-Drink,"Schlecken wir alle Himbeereis, tragen Tanktop, Bikerbrillen und reiben uns ständig mit LSF50-Sonnencreme ein? Zum meteorologischen Sommeranfang ein Blick auf mögliche Trends der kommenden Monate.",https://image.stern.de/35771354/t/Lg/v1/w1440/r1.7778/-/01--zyn5d3qoisv8axs2048jpeg---365812a9b6508188.jpg,2025-06-01T07:00:40Z,,"Kopiere den aktuellen Link
Zur Merkliste hinzufügen
Schlecken wir alle Himbeereis, tragen Tanktop, Bikerbrillen und reiben uns ständig mit LSF50-Sonnencreme ein? Zum meteorologischen Sommeranfang e… [+7586 chars]",,de,'Frühling'
https://www.zeit.de/news/2025-06/01/sind-das-die-sommertrends-sunscreen-lust-und-pornstar-drink,https://www.zeit.de/news/2025-06/01/sind-das-die-sommertrends-sunscreen-lust-und-pornstar-drink,0,www.zeit.de,Gesellschaft: Sind das die Sommertrends? Sunscreen-Lust und Pornstar-Drink,Hier finden Sie Informationen zu dem Thema „Gesellschaft“. Lesen Sie jetzt „Sind das die Sommertrends? Sunscreen-Lust und Pornstar-Drink“.,https://img.zeit.de/news/2025-06/01/sind-das-die-sommertrends-sunscreen-lust-und-pornstar-drink-image-group/wide__1300x731,2025-06-01T07:00:40Z,,Manche gewagten Prognosen deuten für 2025 auf einen der heißesten und trockensten Sommer seit Beginn der Wetteraufzeichnungen hin. Doch nichts Genaues weiß man nicht. Deshalb besser die Frage: Was wi… [+7375 chars],,de,'Sommer'
https://www.faz.net/aktuell/politik/ausland/wie-xi-jinping-mit-tee-politik-macht-110504749.html,https://www.faz.net/aktuell/politik/ausland/wie-xi-jinping-mit-tee-politik-macht-110504749.html,0,www.faz.net,"Ernte in Wuyishan: Xi, Oolong-Tee und eine Route nach Moskau",Tee wird in China schon seit mehreren tausend Jahren getrunken. Er brachte Wohlstand und Krieg. Mit Tee wird auch Politik gemacht.,https://media0.faz.net/ppmedia/aktuell/politik/580998766/1.10504744/facebook_teaser/xi-jinping-im-maerz-mit-zwei.jpg,2025-06-01T07:44:25Z,,"Die Hänge von Wuyi sind grün und voller Blätter. Ein Teebusch steht neben dem anderen. Sie wirken wie flauschige grüne Raupen. Es ist bedeckt, die Gipfel verschwinden im Nebel, und Frau Oh beeilt sic… [+15420 chars]",,de,'Ernte'
https://www.zeit.de/news/2025-06/01/einzelne-kraeftige-gewitter-in-hessen-erwartet,https://www.zeit.de/news/2025-06/01/einzelne-kraeftige-gewitter-in-hessen-erwartet,0,www.zeit.de,Wetter: Einzelne kräftige Gewitter in Hessen erwartet,Hier finden Sie Informationen zu dem Thema „Wetter“. Lesen Sie jetzt „Einzelne kräftige Gewitter in Hessen erwartet“.,https://img.zeit.de/news/2025-06/01/einzelne-kraeftige-gewitter-in-hessen-erwartet-image-group/wide__1300x731,2025-06-01T11:48:46Z,,"Zum Ende des Wochenendes werden in Hessen einzelne starke Gewitter erwartet. Begleitet werden sie dem Deutschen Wetterdienst (DWD) zufolge von Starkregen, Hagel und Sturmböen, wobei örtliche Unwetter… [+835 chars]",,de,'Gewitter'
https://www.n-tv.de/panorama/Es-bleibt-wechselhaft-und-das-ist-gut-so-article25805435.html,https://www.n-tv.de/panorama/Es-bleibt-wechselhaft-und-das-ist-gut-so-article25805435.html,0,www.n-tv.de,Wetterwoche im Schnellcheck: Es bleibt wechselhaft - und das ist gut so,"Der Mai ist der vierte Monat in Folge, der zu trocken endet. Das zeigt sich auch in der Frühlingsbilanz: Vielerorts fiel seit März kaum Regen. In der kommenden Woche betreibt das Wetter zumindest etwas Wiedergutmachung.",https://www.n-tv.de/img/incoming/crop25805500/2871326806-cImg_16_9-w1200/527011856.jpg,2025-06-01T12:41:26Z,,"Der Mai ist der vierte Monat in Folge, der zu trocken endet. Das zeigt sich auch in der Frühlingsbilanz: Vielerorts fiel seit März kaum Regen. In der kommenden Woche betreibt das Wetter zumindest etw… [+3373 chars]",,de,'Frühling'
https://www.zeit.de/news/2025-06/01/gewitter-mit-starkregen-unwetterwarnungen-fuer-sachsen,https://www.zeit.de/news/2025-06/01/gewitter-mit-starkregen-unwetterwarnungen-fuer-sachsen,0,www.zeit.de,Wetterkapriolen: Gewitter mit Starkregen - Unwetterwarnungen für Sachsen,Hier finden Sie Informationen zu dem Thema „Wetterkapriolen“. Lesen Sie jetzt „Gewitter mit Starkregen - Unwetterwarnungen für Sachsen“.,https://img.zeit.de/news/2025-06/01/gewitter-mit-starkregen-unwetterwarnungen-fuer-sachsen-image-group/wide__1300x731,2025-06-01T16:07:51Z,https://web.archive.org/web/20250602091326/https://www.zeit.de/news/2025-06/01/gewitter-mit-starkregen-unwetterwarnungen-fuer-sachsen,"Der Deutsche Wetterdienst (DWD) erwartet am Abend in großen Teilen Sachsens schwere und teils unwetterartige Gewitter. Es bestehe Gefahr durch Blitzschlag, umstürzende Bäume sowie herabfallende Gegen… [+365 chars]",,de,'Gewitter'
https://versicherungswirtschaft-heute.de/unternehmen-und-management/2025-06-02/naturgefahrenstatistik-hochwasserschaeden-mehr-als-verdoppelt/,https://versicherungswirtschaft-heute.de/unternehmen-und-management/2025-06-02/naturgefahrenstatistik-hochwasserschaeden-mehr-als-verdoppelt/,0,versicherungswirtschaft-heute.de,Naturgefahrenstatistik: Hochwasserschäden mehr als verdoppelt,"Im vergangenen Jahr sind zwar große Schäden durch Winter- und Herbststürme ausgeblieben, dafür verursachten Hochwasser – im Mai im Saarland und in Rheinland-Pfalz, im Juni in Baden-Württemberg und Bayern – erhebliche Überschwemmungsschäden. Insgesamt ermittel…",https://versicherungswirtschaft-heute.de/wp-60d20-content/uploads/2025/03/466193008-1200x748.jpg,2025-06-01T22:00:00Z,,"Bundeskanzler Olaf Scholz (1. Reihe 4.v.l., SPD), Bayerns Ministerpräsident Markus Söder (1. Reihe 3.v.l., CSU), Bundesinnenministerin Nancy Faeser (1. Reihe 2.v.l., SPD) stehen hinter einer Absperru… [+4160 chars]",,de,'Herbst'
https://www.stern.de/gesellschaft/regional/baden-wuerttemberg/katastrophe-und-wiederaufbau--ein-jahr-nach-dem-hochwasser--wie-rudersberg-wieder-aufsteht-35772730.html,https://www.stern.de/gesellschaft/regional/baden-wuerttemberg/katastrophe-und-wiederaufbau--ein-jahr-nach-dem-hochwasser--wie-rudersberg-wieder-aufsteht-35772730.html,0,www.stern.de,Katastrophe und Wiederaufbau: Ein Jahr nach dem Hochwasser: Wie Rudersberg wieder aufsteht,"Unterspülte Straßen, zerstörte Brücken und ungezählte überflutete Keller: Vor einem Jahr setzte Starkregen die Gemeinde Rudersberg unter Wasser. Was ist seitdem geschehen? Und welche Spuren bleiben?",https://image.stern.de/35772732/t/xp/v1/w1440/r1.7778/-/02--as6cxdwzvtv3axs2048jpeg---e60088d0f2e52258.jpg,2025-06-02T02:00:42Z,,"Kopiere den aktuellen Link
Zur Merkliste hinzufügen
Unterspülte Straßen, zerstörte Brücken und ungezählte überflutete Keller: Vor einem Jahr setzte Starkregen die Gemeinde Rudersberg unter Wasser. … [+5970 chars]",,de,'Hochwasser'
https://www.zeit.de/news/2025-06/02/regen-und-gewitter-in-rheinland-pfalz-und-dem-saarland,https://www.zeit.de/news/2025-06/02/regen-und-gewitter-in-rheinland-pfalz-und-dem-saarland,0,www.zeit.de,Nasser Wochenstart: Regen und Gewitter in Rheinland-Pfalz und dem Saarland,Hier finden Sie Informationen zu dem Thema „Nasser Wochenstart“. Lesen Sie jetzt „Regen und Gewitter in Rheinland-Pfalz und dem Saarland“.,https://img.zeit.de/news/2025-06/02/regen-und-gewitter-in-rheinland-pfalz-und-dem-saarland-image-group/wide__1300x731,2025-06-02T04:40:22Z,,"Das Wetter in Rheinland-Pfalz und im Saarland startet wechselhaft in die neue Woche. Am Montag zeigt sich der Himmel wechselhaft bewölkt und es bleibt zunächst weitgehend trocken, wie der Deutsche We… [+1285 chars]",,de,'Gewitter'
https://www.zeit.de/news/2025-06/02/teils-gewitter-und-hagel-am-montag,https://www.zeit.de/news/2025-06/02/teils-gewitter-und-hagel-am-montag,0,www.zeit.de,Wetter: Teils Gewitter und Hagel am Montag,Hier finden Sie Informationen zu dem Thema „Wetter“. Lesen Sie jetzt „Teils Gewitter und Hagel am Montag“.,https://img.zeit.de/news/2025-06/02/teils-gewitter-und-hagel-am-montag-image-group/wide__1300x731,2025-06-02T04:58:32Z,,"Ungemütlich beginnt die neue Woche in Berlin und Brandenburg. Der Deutsche Wetterdienst erwartet ab Montagnachmittag Schauer und einzelne, teils starke Gewitter in der Region. Mancherorts gibt es daz… [+697 chars]",,de,'Gewitter'
https://www.focus.de/panorama/heftige-unwetter-drohen-wo-es-am-wochenende-wann-gewittern-soll_25fc959f-789d-4c14-844c-a12134ad9ea1.html,https://www.focus.de/panorama/heftige-unwetter-drohen-wo-es-am-wochenende-wann-gewittern-soll_25fc959f-789d-4c14-844c-a12134ad9ea1.html,0,www.focus.de,Gewitter ziehen herauf! Hier können heute Starkregen und Hagel zuschlagen,Am Montag soll es laut Deutschem Wetterdienst morgens und am Vormittag im Süden Deutschlands und in Sachsen teils gewittrige Regenfälle geben. Örtlich kann dabei Starkregen mit bis zu 15 Litern pro Quadratmeter auftreten.,https://quadro.burda-forward.de/ctf/28980dcc-d95b-405f-ad41-96acd6168af1.17f83654-fe94-468c-8e1f-f4d3d2b9f764.png?im=RegionOfInterestCrop%3D%281200%2C630%29%2CregionOfInterest%3D%28455%2C366%29&hash=057df58ae2ccb83f585c34f9565fc335576011927718968c3cefc390d590791b,2025-06-02T05:13:10Z,,"Gewitter ziehen auf! Hier können heute Starkregen und Hagel zuschlagen
Später soll es dann im Süden, bevorzugt in dessen Mitte, sowie teilweise im Osten des Landes zu einzelnen, markanten Gewittern … [+20150 chars]",,de,'Hochwasser'
https://steiermark.orf.at/stories/3307883/,https://steiermark.orf.at/stories/3307883/,0,steiermark.orf.at,Erste Unwetter der Saison in der Steiermark,"Der meteorologische Sommerbeginn am Sonntag hat auch die ersten Unwetter in der Steiermark gebracht. Betroffen waren vor allem der Großraum Graz, Teile der Oststeiermark und Teile im Mürztal. Bäche traten über die Ufer, Keller wurden überflutet.",https://ibs.orf.at/stm?image=https%3A%2F%2Foekastatic.orf.at%2Fmims%2F2025%2F23%2F93%2Fcrops%2Fw%3D1200%2Ch%3D627%2Cq%3D75%2F2647901_master_1017593_muerz_tritt_in_neuberg_a._d._muerz_nach_unwetter_ueber_die_ufer_4.jpg%3Fs%3D029b8ede2e474d374ffe3cb99c5cc78a755d0395,2025-06-02T05:19:00Z,,Eine heftige Gewitterzelle zog Sonntagabend über Neuberg an der Mürz. Kurz nach 19.00 Uhr trat laut der Freiwilligen Feuerwehr die Mürz im Bereich der Raiffeisenbank Neuberg über die Ufer und übersch… [+2986 chars],,de,'Hochwasser'
https://www.stern.de/gesellschaft/regional/bayern/wetter--zurueckziehung---forggensee-erreicht-stauziel-nicht-35772798.html,https://www.stern.de/gesellschaft/regional/bayern/wetter--zurueckziehung---forggensee-erreicht-stauziel-nicht-35772798.html,0,www.stern.de,Wetter: ZURÜCKZIEHUNG - Forggensee erreicht Stauziel nicht,"Weil im Winter zu wenig Schnee gefallen ist und es im Frühling zu wenig geregnet hat, wird Deutschlands größter Stausee nicht zum geplanten Zeitpunkt voll. Das hat Auswirkungen auf die Schifffahrt.",https://image.stern.de/35773368/t/LY/v1/w1440/r1.7778/-/02--xi2esss3quv14axs2048jpeg---582d544d01066f92.jpg,2025-06-02T08:02:53Z,,"Kopiere den aktuellen Link
Zur Merkliste hinzufügen
Weil im Winter zu wenig Schnee gefallen ist und es im Frühling zu wenig geregnet hat, wird Deutschlands größter Stausee nicht zum geplanten Zeitp… [+1214 chars]",,de,'Winter'
https://www.stern.de/gesellschaft/regional/bayern/deutschlands-groesster-stausee--forggensee-erreicht-angepeilten-wasserstand-doch-noch-35773574.html,https://www.stern.de/gesellschaft/regional/bayern/deutschlands-groesster-stausee--forggensee-erreicht-angepeilten-wasserstand-doch-noch-35773574.html,0,www.stern.de,Deutschlands größter Stausee: Forggensee erreicht angepeilten Wasserstand doch noch,"Weil im Winter zu wenig Schnee gefallen ist und es im Frühling zu wenig geregnet hat, dauerte das Aufstauen des Sees unweit von Neuschwanstein lange. Die Schifffahrt kann nun starten - fast pünktlich.",https://image.stern.de/35773576/t/rE/v1/w1440/r1.7778/-/02--ttulis6kr7v4axs2048jpeg---c25177150e0635d8.jpg,2025-06-02T09:01:28Z,,"Kopiere den aktuellen Link
Zur Merkliste hinzufügen
Weil im Winter zu wenig Schnee gefallen ist und es im Frühling zu wenig geregnet hat, dauerte das Aufstauen des Sees unweit von Neuschwanstein la… [+1263 chars]",,de,'Schnee'
https://www.spektrum.de/kolumne/eulbergs-toenende-tierwelt-der-eichelhaeher/2265150,https://www.spektrum.de/kolumne/eulbergs-toenende-tierwelt-der-eichelhaeher/2265150,0,www.spektrum.de,Eulbergs tönende Tierwelt: Kluger Wächter des Waldes,"Ein erstaunliches Gedächtnis, ausgeprägte Selbstkontrolle und fast ein wenig Empathie: In mancher Hinsicht ist der intelligente Eichelhäher sogar mit Primaten vergleichbar.",https://static.spektrum.de/fm/912/f1920x1080/Eichelhaeher_Teaser_NikolasKuhlen.jpg,2025-06-02T10:10:27Z,https://web.archive.org/web/20250602101741/https://www.spektrum.de/kolumne/eulbergs-toenende-tierwelt-der-eichelhaeher/2265150,Der Ursprung des Wortes »Häher« ist lautmalerisch und ahmt den rauen Ruf des Vogels nach. Den Rest seines Namens verdankt der Eichelhäher seiner präferierten Nahrung: Bis zu zehn Eicheln kann er glei… [+2988 chars],,de,'Eicheln'
https://www.zeit.de/news/2025-06/02/mehrere-braende-nach-blitzeinschlaegen-im-suedwesten,https://www.zeit.de/news/2025-06/02/mehrere-braende-nach-blitzeinschlaegen-im-suedwesten,0,www.zeit.de,Gewitter: Mehrere Brände nach Blitzeinschlägen im Südwesten,Hier finden Sie Informationen zu dem Thema „Gewitter“. Lesen Sie jetzt „Mehrere Brände nach Blitzeinschlägen im Südwesten“.,https://img.zeit.de/news/2025-06/02/mehrere-braende-nach-blitzeinschlaegen-im-suedwesten-image-group/wide__1300x731,2025-06-02T10:53:16Z,https://web.archive.org/web/20250603092512/https://www.zeit.de/news/2025-06/02/mehrere-braende-nach-blitzeinschlaegen-im-suedwesten,Nach Blitzeinschlägen haben in der Nacht auf Montag mehrere Gebäude in Baden-Württemberg in Flammen gestanden. In Lörrach war am späten Sonntagabend der Dachstuhl eines Wohn- und Geschäftshauses in B… [+1214 chars],,de,'Gewitter'
https://tirol.orf.at/stories/3308035/,https://tirol.orf.at/stories/3308035/,0,tirol.orf.at,Arbeiten am Villgraterbach schreiten voran,Die Errichtung eines Hochwasserschutzes in Heinfels (Bezirk Lienz) kann bislang nach Plan umgesetzt werden. Nach dem erfolgreichen Abschluss des Hochwasserschutzprojekts an der Drau in Sillian sind nun auch in Heinfels die bisherigen Arbeiten gut sichtbar.,https://ibs.orf.at/tir?image=https%3A%2F%2Foekastatic.orf.at%2Fmims%2F2025%2F23%2F54%2Fcrops%2Fw%3D1200%2Ch%3D627%2Cq%3D75%2F2648711_master_1017954_hippo.jpg%3Fs%3Da09844c6b67ff32988eca42be98c6c05155a74af,2025-06-03T04:05:43Z,,Rund ein halbes Jahr nach dem Spatenstich im Herbst ist das zentrale Bauwerk die Wildholz- und Geschiebesperre inzwischen zur Hälfte errichtet. Das wasserbauliche Großprojekt schützt künftig rund 32 … [+2713 chars],,de,'Hochwasser'
https://www.fitforfun.de/news/fruehkartoffeln-bringen-feines-aroma-in-die-kueche-753276.html,https://www.fitforfun.de/news/fruehkartoffeln-bringen-feines-aroma-in-die-kueche-753276.html,0,www.fitforfun.de,Zeitig geerntet: Frühkartoffeln bringen feines Aroma in die Küche,Im Juni und Juli beginnt die Ernte der ersten Kartoffelknollen des Jahres. Aufgrund ihrer verkürzten Wachstumszeit weisen Frühkartoffeln einige besondere Eigenschaften auf. Hier sind wichtige Informationen über die kleineren „Frühchen“.,"https://www.fitforfun.de/files/images/202506/0/ein-kartoffelhaendler-haelt-fruehkartoffeln-in-den-haenden,753280_3x2_n.jpg",2025-06-03T06:56:00Z,,"Gerade erst gepflanzt und schon geerntet: Frühkartoffeln haben wegen ihrer kurzen Zeit unter der Erde eine dünnere Schale und ein feines, leicht süßliches bis nussiges Aroma. Zudem ist der Stärkegeha… [+395 chars]",,de,'Ernte'
https://orf.at/stories/3395670/,https://orf.at/stories/3395670/,0,orf.at,Monsun setzt Indiens Metropolen zu,"Der Sommermonsun hat Indien dieses Jahr früher als üblich erreicht, die Folgen sind für die Bewohnerinnen und Bewohner etwa von Mumbai aber keine Überraschung. Wie praktisch jedes Jahr stehen große Städte unter Wasser. Ursachen dafür gibt es eine ganze Reihe.…",https://ibs.orf.at/news?image=https%3A%2F%2Fassets.orf.at%2Fmims%2F2025%2F23%2F73%2Fcrops%2Fw%3D1200%2Ch%3D630%2Cq%3D75%2F2649339_master_1018173_indien_monsun_metropolen_aufmacher_afp.jpg%3Fs%3D64b7b10263c05c83d1eb9123c8063b7cc8134383,2025-06-04T04:06:56Z,,"Im Mai hatte es laut Bericht der Hindustan Times vom Dienstag in Mumbai so viel geregnet wie seit 1901 nicht mehr. Der Monat war laut der Zeitung kühler als in den letzten Jahren, wobei kühl mit Durc… [+5397 chars]",,de,'Sommer'
https://www.zeit.de/news/2025-06/04/gewitterfront-bringt-sturm-und-heftigen-regen,https://www.zeit.de/news/2025-06/04/gewitterfront-bringt-sturm-und-heftigen-regen,0,www.zeit.de,Wetter: Gewitterfront bringt Sturm und heftigen Regen,Hier finden Sie Informationen zu dem Thema „Wetter“. Lesen Sie jetzt „Gewitterfront bringt Sturm und heftigen Regen“.,https://img.zeit.de/news/2025-06/04/gewitterfront-bringt-sturm-und-heftigen-regen-image-group/wide__1300x731,2025-06-04T06:46:59Z,,Die Menschen in Thüringen müssen sich auf Unwetter mit Starkregen und Sturmböen einstellen. Dabei sind die Aussichten laut Deutschem Wetterdienst (DWD) bis zum Ende der Woche vor allem tagsüber ungem… [+927 chars],,de,'Gewitter'
https://ooe.orf.at/stories/3308261/,https://ooe.orf.at/stories/3308261/,0,ooe.orf.at,Neuer Caritas-Chef für Oberösterreich,Franz Kehrer übergibt die Leitung der Caritas Oberösterreich an Stefan Pimmingstorfer. Der langjährige Caritas-Chef wird im Sommer in Pension gehen. Sein Nachfolger sieht unter anderem die Pflege als große Herausforderung und fordert ein Zukunftspaket zur Sic…,https://ibs.orf.at/ooe?image=https%3A%2F%2Foekastatic.orf.at%2Fmims%2F2025%2F23%2F92%2Fcrops%2Fw%3D1200%2Ch%3D627%2Cq%3D75%2F2650829_master_1018792_250604_neuercaritaspraesident_orf00871_00_33_16_01.jpg%3Fs%3D363fdd6ae4d75295c1f3f19ec3e25e1ee2dd252d,2025-06-04T13:44:36Z,,"Franz Kehrer, der seit 12,5 Jahren die Caritas Oberösterreich leitet, wird im Sommer in den Ruhestand treten. Sein Nachfolger wird Stefan Pimmingstorfer, der die Leitung der kirchlichen Hilfsorganisa… [+3469 chars]",,de,'Sommer'
https://www.zeit.de/2025/24/bergsturz-blatten-klimawandel-gefahr-tourismus-schweiz,https://www.zeit.de/2025/24/bergsturz-blatten-klimawandel-gefahr-tourismus-schweiz,0,www.zeit.de,Bergsturz in Blatten: Da kommt was ins Rutschen,"Nach dem Bergsturz in Blatten fragen sich die Schweizer, wie sehr der Klimawandel in den Alpen Tourismus und Leben bedroht. Ein Forscher glaubt, die Antwort zu kennen.",https://img.zeit.de/2025/24/da-kommt-was-ins-rutschen-bild-1/wide__1300x731,2025-06-04T14:49:39Z,,"Schließen
Artikelzusammenfassung
Das Hotel Nest- und Bietschhorn im Walliser Lötschental musste seine 157. Sommersaison absagen, da es von einem riesigen Bergsturz zerstört wurde. Das Dorf Blatten … [+660 chars]",,de,'Hochwasser'
https://www.stern.de/familie/tomaten-giessen-im-juni--die-wichtigsten-faustregeln-und-haeufige-fehler-35782710.html,https://www.stern.de/familie/tomaten-giessen-im-juni--die-wichtigsten-faustregeln-und-haeufige-fehler-35782710.html,0,www.stern.de,"Gartentipps: Tomaten gießen, ist nicht schwer: Was beim Wässern im Juni wichtig ist","Wer beim Tomaten gießen kühlen Kopf bewahrt, kann auf eine reiche Ernte hoffen. Welche Faustregeln gelten und warum Wasser aus der Leitung den Pflanzen schadet.",https://image.stern.de/35785048/t/wo/v4/w1440/r1.7778/-/tomaten-giessen-aufmacher-juni-2025.jpg,2025-06-05T10:52:00Z,,"Kopiere den aktuellen Link
Zur Merkliste hinzufügen
Wer beim Tomaten gießen kühlen Kopf bewahrt, kann auf eine reiche Ernte hoffen. Welche Faustregeln gelten und warum Wasser aus der Leitung den Pf… [+4336 chars]",,de,'Ernte'
https://www.morgenpost.de/politik/article409193713/zwei-chinesen-in-usa-wegen-agroterrorismus-angeklagt.html,https://www.morgenpost.de/politik/article409193713/zwei-chinesen-in-usa-wegen-agroterrorismus-angeklagt.html,0,www.morgenpost.de,Zwei Chinesen in USA wegen „Agroterrorismus“ angeklagt,"Fusarium graminearum – das ist der Name eines Pilzes, der zu einer Waffe wird. Er zerstört Ernten und sorgt so für heftigen Schaden.",https://img.sparknews.funkemedien.de/409194438/409194438_1749125006_v16_9_1600.jpeg,2025-06-05T12:03:26Z,,"Berlin. Fusarium graminearum das ist der Name eines Pilzes, der zu einer Waffe wird. Er zerstört Ernten und sorgt so für heftigen Schaden.
Laut CNN werden in den USA zwei chinesische Forscher angekl… [+2865 chars]",,de,'Ernte'
https://www.stern.de/reise/deutschland/niedersachsen--heide--meer--saurier---neun-kurztrip-tipps-35706132.html,https://www.stern.de/reise/deutschland/niedersachsen--heide--meer--saurier---neun-kurztrip-tipps-35706132.html,0,www.stern.de,"Kurztrips: Heide, Meer, Saurier: Neun Zufluchten in Niedersachsen",Ein Tag oder ein Wochenende – hier sind die neun besten Kurzurlaube für Niedersachsen. Raus aus der Stadt oder rein? Ab in die Natur oder bloß weg?,https://image.stern.de/35706366/t/SK/v1/w1440/r1.7778/-/zufluchten-niedersachsen-geopark.jpg,2025-06-05T13:12:00Z,,"Kopiere den aktuellen Link
Zur Merkliste hinzufügen
Raus aus der Stadt oder rein? Ab in die Natur oder bloß weg? Wir haben die neun besten Kurztripziele in Niedersachsen für Sie zusammengestellt.
… [+7700 chars]",,de,'Frühling'
https://www.zeit.de/news/2025-06/05/fruehling-zu-trocken-bislang-125-waldbraende,https://www.zeit.de/news/2025-06/05/fruehling-zu-trocken-bislang-125-waldbraende,0,www.zeit.de,Waldbrandsaison: Frühling zu trocken - Bislang 125 Waldbrände,Hier finden Sie Informationen zu dem Thema „Waldbrandsaison“. Lesen Sie jetzt „Frühling zu trocken - Bislang 125 Waldbrände“.,https://img.zeit.de/news/2025-06/05/fruehling-zu-trocken-bislang-125-waldbraende-image-group/wide__1300x731,2025-06-05T13:37:59Z,,"In der aktuellen Waldbrandsaison sind die Feuerwehren in Brandenburg bis Ende Mai zu 125 Waldbränden ausgerückt. Das waren deutlich mehr Waldbrände als in dem Zeitraum des vergangenen Jahres, wie das… [+1469 chars]",,de,'Frühling'
