index,url,valid,domain,title,description,image,published,archive,content,quote,language,keyword
https://www.stern.de/wirtschaft/news/unternehmer--unternehmer-fordern-rhein-vertiefung-34842036.html,https://www.stern.de/wirtschaft/news/unternehmer--unternehmer-fordern-rhein-vertiefung-34842036.html,0,www.stern.de,Unternehmer: Unternehmer fordern Rhein-Vertiefung,Mit der zunehmenden Hitze und Trockenperioden droht auch wieder Niedrigwasser auf dem Rhein. Das bremst den Gütertransport auf dem Wasserweg für viele Unternehmen aus.,https://image.stern.de/34842038/t/2W/v1/w1440/r1.7778/-/01--gz3pwklc3zv9axw800h600jpeg---2aa4573cabd4b031.jpg,2024-07-01T02:00:38Z,,"Mit der zunehmenden Hitze und Trockenperioden droht auch wieder Niedrigwasser auf dem Rhein. Das bremst den Gütertransport auf dem Wasserweg für viele Unternehmen aus.
Die rheinland-pfälzischen Unte… [+2253 chars]",,de,'Niedrigwasser'
https://www.focus.de/finanzen/news/unternehmer-unternehmer-fordern-rhein-vertiefung_id_260096944.html,https://www.focus.de/finanzen/news/unternehmer-unternehmer-fordern-rhein-vertiefung_id_260096944.html,0,www.focus.de,Unternehmer - Unternehmer fordern Rhein-Vertiefung,Mit der zunehmenden Hitze und Trockenperioden droht auch wieder Niedrigwasser auf dem Rhein. Das bremst den Gütertransport auf dem Wasserweg für viele Unternehmen aus.,https://p6.focus.de/img/finanzen/news/id_260096943/fuer-die-unternehmer-dauert-die-debatte-ueber-die-rhein-vertiefung-schon-viel-zu-lange..jpg?im=Crop%3D%280%2C170%2C2048%2C1024%29%3BResize%3D%281200%2C627%29&impolicy=perceptual&quality=mediumHigh&hash=c02b3e9d58dfdeb1cd75031a6a14cc3e386cc06951ac06f2ee3601aeccf6c9d6,2024-07-01T02:05:04Z,,"Mainz (dpa/lrs) - Die rheinland-pfälzischen Unternehmer drängen auf einen Ausbau der Wasserstraßen im Land. Die Wirtschaft in Rheinland-Pfalz sei sehr exportorientiert, sagte Karsten Tacke, Hauptgesc… [+2119 chars]",,de,'Niedrigwasser'
https://www.nzz.ch/wissenschaft/ausloeser-fuer-die-sturzfluten-im-wallis-und-im-tessin-staut-sich-schwuele-luft-an-den-alpen-machen-die-gewitter-ueberstunden-ld.1837443,https://www.nzz.ch/wissenschaft/ausloeser-fuer-die-sturzfluten-im-wallis-und-im-tessin-staut-sich-schwuele-luft-an-den-alpen-machen-die-gewitter-ueberstunden-ld.1837443,0,www.nzz.ch,"Auslöser für die Sturzfluten im Wallis und im Tessin: Staut sich schwüle Luft an den Alpen, machen die Gewitter Überstunden","Schon Tage zuvor wiesen Meteorologen auf die Gefahr von Unwettern hin. Dass sich die gewittrigen Regenfälle in den Alpen derzeit häufen, liegt an der Grosswetterlage. Sie hält sich hartnäckig.","https://img.nzz.ch/2024/06/30/1eff31e7-f74a-4000-b896-d7c31ec1b60d.jpeg?width=1200&height=675&fit=bounds&quality=75&auto=webp&crop=3342,1880,x0,y87&wmark=nzz",2024-07-01T03:30:00Z,,"Tobende Bäche und Flüsse, unterspülte Strassen, donnernde Murgänge, von Gestein begrabene oder eingedrückte Gebäude die Bilder vom Wochenende aus dem Wallis und dem Tessin erwecken den Eindruck eines… [+3846 chars]",,de,'Schnee'
https://www.stern.de/gesellschaft/regional/rheinland-pfalz-saarland/wetter--sommer-zeigt-sich-von-seiner-kuehlen-seite-34842278.html,https://www.stern.de/gesellschaft/regional/rheinland-pfalz-saarland/wetter--sommer-zeigt-sich-von-seiner-kuehlen-seite-34842278.html,0,www.stern.de,Wetter: Sommer zeigt sich von seiner kühlen Seite,"Teils dichte Wolken, immer wieder Regen und höchstens 21 Grad: Die neue Woche startet unbeständig und kühl. Lichtblicke sind voraussichtlich Montagnachmittag möglich.",https://image.stern.de/34842280/t/P1/v1/w1440/r1.7778/-/01--42lok2by5tv10axw800h600jpeg---71c868d819aa30e7.jpg,2024-07-01T06:17:49Z,,"Teils dichte Wolken, immer wieder Regen und höchstens 21 Grad: Die neue Woche startet unbeständig und kühl. Lichtblicke sind voraussichtlich Montagnachmittag möglich.
Die neue Woche startet in Rhein… [+539 chars]",,de,'Sommer'
https://www.tagesschau.de/inland/gesellschaft/schwammwaelder-100.html,https://www.tagesschau.de/inland/gesellschaft/schwammwaelder-100.html,0,www.tagesschau.de,"Wie ""Schwammwälder"" gegen den Klimawandel helfen können","Heute tritt das Klimaanpassungsgesetz in Kraft. Es soll helfen, mit Hitzewellen und Hochwasser besser umzugehen. Eine wichtige Rolle können dabei auch Schwammwälder übernehmen - wie im Arnsberger Wald östlich von Dortmund. Von David Zajonz.",https://images.tagesschau.de/image/e7313da8-57b4-46f3-a471-57c967a553b5/AAABkADhP30/AAABjwnlFvA/16x9-1280/nadelwald-nebel-100.jpg,2024-07-01T06:50:08Z,,"Stand: 01.07.2024 08:50 Uhr
Heute tritt das Klimaanpassungsgesetz in Kraft. Es soll helfen, mit Hitzewellen und Hochwasser besser umzugehen. Eine wichtige Rolle können dabei auch Schwammwälder übern… [+2765 chars]",,de,'Hochwasser'
https://www.stern.de/panorama/wetter/unwetter-prognose-fuer-schauer-und-gewitter--karten-zeigen-wetterlage-34842396.html,https://www.stern.de/panorama/wetter/unwetter-prognose-fuer-schauer-und-gewitter--karten-zeigen-wetterlage-34842396.html,0,www.stern.de,Wetter in Deutschland: Schauer und Gewitter: Karten zeigen die Wetterlage,Nach den Unwettern vom Wochenende bleibt es erst einmal ungemütlich und regnerisch in Deutschland. Örtlich sind auch Gewitter möglich. Karten zeigen die Wetterlage,https://image.stern.de/34842504/t/xs/v1/w1440/r1.7778/-/unwetter-montag-karte.jpg,2024-07-01T08:12:00Z,,"Nach den Unwettern vom Wochenende bleibt es erst einmal ungemütlich und regnerisch in Deutschland. Örtlich sind auch Gewitter möglich. Karten zeigen die Wetterlage
Am Wochenende tobten einige Unwett… [+2106 chars]",,de,'Gewitter'
https://www.stern.de/gesellschaft/regional/sachsen-anhalt/notfaelle--mehrere-haushalte-in-sachsen-anhalt-kurzzeitig-ohne-strom-34842168.html,https://www.stern.de/gesellschaft/regional/sachsen-anhalt/notfaelle--mehrere-haushalte-in-sachsen-anhalt-kurzzeitig-ohne-strom-34842168.html,0,www.stern.de,Notfälle: Mehrere Haushalte in Sachsen-Anhalt kurzzeitig ohne Strom,Osterburg (sa) - Mehrere Gewitter haben in den vergangenen Tagen zu örtlichen Stromausfällen in Sachsen-Anhalt geführt. So waren mehrere Haushalte in,https://image.stern.de/34843430/t/dj/v1/w1440/r1.7778/-/01--24dlhokzruv1axw800h600jpeg---b5bf59c70f8bd531.jpg,2024-07-01T12:03:11Z,,"Blitzschläge in Teilen Sachsen-Anhalts führten in den vergangenen Tagen zu Stromausfällen. Besonders im Südharz waren viele Haushalte betroffen.
Mehrere Gewitter haben in den vergangenen Tagen zu ör… [+1444 chars]",,de,'Gewitter'
https://www.stern.de/gesellschaft/regional/niedersachsen-bremen/touristen-spektakel--bagger-vor-norderney-aus-watt-geborgen-34843526.html,https://www.stern.de/gesellschaft/regional/niedersachsen-bremen/touristen-spektakel--bagger-vor-norderney-aus-watt-geborgen-34843526.html,0,www.stern.de,Touristen-Spektakel: Bagger vor Norderney aus Watt geborgen,Norderney (lni) - Zahlreiche Urlauberinnen und Urlauber haben die Bergung des seit Tagen im Watt festgefahrenen Baggers am Strand der Insel Norderney,https://image.stern.de/34843528/t/Ve/v1/w1440/r1.7778/-/01--maidhv2ynqv11axw800h600jpeg---2692a399859455b6.jpg,2024-07-01T12:25:22Z,,"Von einem Spezialkran wird der umgekippte Bagger im Watt vor Norderney hochgezogen. Für viele Touristen ist es ein Spektakel.
Zahlreiche Urlauberinnen und Urlauber haben die Bergung des seit Tagen i… [+882 chars]",,de,'Laub'
https://www.bild.de/regional/nordsee/oelpest-gebannt-bagger-vor-norderney-aus-schlick-gezogen-6682a5217496b8156978235a,https://www.bild.de/regional/nordsee/oelpest-gebannt-bagger-vor-norderney-aus-schlick-gezogen-6682a5217496b8156978235a,0,www.bild.de,Ölpest gebannt - Bagger vor Norderney aus Schlick gezogen,"Norderney (Niedersachsen) – Watt ein Glück, er ist raus. Zahlreiche Urlauber haben die Bergung des seit Tagen im Watt festgefahrenen...Foto: Volker Bartels/dpa","https://images.bild.de/6682a5217496b8156978235a/fa4fd204fb76af9202659eeefd6bc721-landscape,df590e24?w=1280",2024-07-01T13:41:44Z,,"Norderney (Niedersachsen) Watt ein Glück, er ist raus. Zahlreiche Urlauber haben die Bergung des seit Tagen im Watt festgefahrenen Baggers am Strand der Insel Norderney verfolgt.
Bei Hochwasser wurd… [+730 chars]",,de,'Niedrigwasser'
https://www.zeit.de/mobilitaet/2024-07/deutsche-bahn-extremwetter-puenktlich-zugfahrt-tickets,https://www.zeit.de/mobilitaet/2024-07/deutsche-bahn-extremwetter-puenktlich-zugfahrt-tickets,0,www.zeit.de,Zugfahrt: Bahn wegen Extremwetter im Juni weniger pünktlich,"Nur 55 Prozent der Fernzüge waren im Juni pünktlich. Grund seien Starkregen und Hochwasser, teilte die Bahn mit. Sie spricht von einem ""massiven Pünktlichkeitsdämpfer"".",https://img.zeit.de/mobilitaet/2024-07/bahn-puenktlichkeit-extrem-wetter-ueberschwemmung/wide__1300x731,2024-07-01T14:14:10Z,,"Unwetter und Überflutungen haben im Juni für zusätzliche Verspätungen im deutschen Bahnverkehr
 gesorgt. Wegen der Extremwetterereignisse seien nur etwa 55 Prozent der Fernzüge im vergangenen Monat … [+2178 chars]",,de,'Hochwasser'
https://www.nzz.ch/wissenschaft/karten-zu-sturzfluten-und-geroelllawinen-weitere-ereignisse-im-sommer-moeglich-ld.1837504,https://www.nzz.ch/wissenschaft/karten-zu-sturzfluten-und-geroelllawinen-weitere-ereignisse-im-sommer-moeglich-ld.1837504,0,www.nzz.ch,Unwetter in den Alpen: In vielen Tälern könnten weitere Sturzfluten und Gerölllawinen folgen,Neue heftige Regengüsse sind in diesem Sommer nur eine Frage der Zeit. Wo genau würde es dann wieder gefährlich werden? Spezielle Karten liefern Hinweise.,"https://img.nzz.ch/2024/07/01/9ebbc97d-6643-4119-b254-7b044eae79b4.png?width=1200&height=675&fit=bounds&quality=75&auto=webp&crop=1200,675,x0,y0&wmark=nzz",2024-07-02T03:30:00Z,,"Hochwasser und Gerölllawinen haben in der Schweiz in den vergangenen Wochen mehrere Todesopfer gefordert und erhebliche Sachschäden angerichtet. Da die Grosswetterlage vorerst bestehen bleibt, muss m… [+2695 chars]",,de,'Sommer'
https://www.tagesschau.de/inland/gesellschaft/mueckenplage-bodensee-100.html,https://www.tagesschau.de/inland/gesellschaft/mueckenplage-bodensee-100.html,0,www.tagesschau.de,Einige Regionen in Süddeutschland von Mückenplage betroffen,"Nach dem Hochwasser im Juni in Baden-Württemberg und Bayern kämpfen einige Regionen Süddeutschlands mit einer massiven Mückenplage. Gastronomen fürchten Umsatzeinbußen, am Bodensee sorgt man sich um ausbleibende Touristen. Von Tim Diekmann.",https://images.tagesschau.de/image/93ede7bb-7ad5-4175-b66a-dd77dc544c83/AAABhnRv8Ek/AAABjwnlFvA/16x9-1280/muecke-115.jpg,2024-07-02T05:05:47Z,,"Stand: 02.07.2024 07:05 Uhr
Nach dem Hochwasser im Juni in Baden-Württemberg und Bayern kämpfen einige Regionen Süddeutschlands mit einer massiven Mückenplage. Gastronomen fürchten Umsatzeinbußen, a… [+3558 chars]",,de,'Hochwasser'
https://www.focus.de/wissen/natur/sommerliches-wetter-erwartet-hundstage-2024-wann-sie-starten-und-welche-bedeutung-sie-haben_id_260026181.html,https://www.focus.de/wissen/natur/sommerliches-wetter-erwartet-hundstage-2024-wann-sie-starten-und-welche-bedeutung-sie-haben_id_260026181.html,0,www.focus.de,Sommerliches Wetter erwartet - Hundstage 2024: Wann sie starten und welche Bedeutung sie haben,"Die Hundstage 2024 stehen vor der Tür. Doch was steckt eigentlich hinter dieser Redewendung? Mit Hunden hat das Wetterphänomen wenig zu tun. Lesen Sie hier, wann die Hundstage starten und was sie bedeuten.Von FOCUS-online-Autorin Kira Welling",https://p6.focus.de/img/fotos/id_260026233/wetter.jpg?im=Crop%3D%280%2C177%2C2121%2C1060%29%3BResize%3D%281200%2C627%29&impolicy=perceptual&quality=mediumHigh&hash=6502d73de737f166efe569eed683fb7e9f3dd6b0a51f63843346a9bf5b9f563c,2024-07-02T06:29:08Z,,"Die Hundstage 2024 stehen vor der Tür. Doch was steckt eigentlich hinter dieser Redewendung? Mit Hunden hat das Wetterphänomen wenig zu tun. Lesen Sie hier, wann die Hundstage starten und was sie bed… [+2670 chars]",,de,'Sommer'
https://www.focus.de/reisen/urlaub-mal-anders-deutschlands-kueste-lockt-mit-skurrilen-feriendomizilen_b1def960-3190-4741-b00f-d44a02e84237.html,https://www.focus.de/reisen/urlaub-mal-anders-deutschlands-kueste-lockt-mit-skurrilen-feriendomizilen_b1def960-3190-4741-b00f-d44a02e84237.html,0,www.focus.de,Urlaub mal anders - Deutschlands Küste lockt mit skurrilen Feriendomizilen,An der Nordsee findet man eine Vielfalt an außergewöhnlichen Übernachtungsmöglichkeiten. Allerdings eignen sich einige dieser Unterkünfte lediglich für einen Kurzaufenthalt.,https://quadro.burda-forward.de/ctf/7afeb05d-41d3-4c42-bfc5-67d6f6f6087b.83f645cc-4a5b-4e7c-9af2-15e5cceb6017.jpg?im=RegionOfInterestCrop%3D%281200%2C630%29%2CregionOfInterest%3D%282653%2C1164%29&hash=542be22989b898480bb60413c5d2f122fda46319054e93ee3fddcb4794b53cf3,2024-07-02T06:44:00Z,,"Es müssen nicht immer Hotel, Ferienwohnung oder Zelt sein: Wer an der niedersächsischen Küste oder auf den Ostfriesischen Inseln Ferien machen möchte, kann auch im Turm, auf dem Floß oder in einem sp… [+5736 chars]",,de,'Gewitter'
https://www.tagesspiegel.de/unwetter-gewitter-richtet-schaden-an-tornado-verdacht-in-cottbus-11941538.html,https://www.tagesspiegel.de/unwetter-gewitter-richtet-schaden-an-tornado-verdacht-in-cottbus-11941538.html,0,www.tagesspiegel.de,Unwetter: Gewitter richtet Schäden an - Tornado-Verdacht in Cottbus,Bäume krachen um. In einer heftigen Gewitterfront werden auch Häuser und Autos demoliert. Es besteht der Verdacht auf einen Tornado in Cottbus.,https://www.tagesspiegel.de/images/nach-unwetter-in-cottbus/alternates/BASE_16_9_W1400/nach-unwetter-in-cottbus.jpeg,2024-07-02T08:39:35Z,,"Cottbus (dpa/bb) - Umgestürzte Bäume, beschädigte Autos und Hausdächer - ein Unwetter hat in Cottbus Zerstörungen angerichtet. War es ein Tornado, der eine Spur der Verwüstung hinterließ? Eindeutig g… [+2045 chars]",,de,'Gewitter'
https://www.bild.de/regional/nordsee/norderney-drohne-findet-wolf-auf-urlaubsinsel-und-den-ersten-riss-6682a1cb669daa7445c8c986,https://www.bild.de/regional/nordsee/norderney-drohne-findet-wolf-auf-urlaubsinsel-und-den-ersten-riss-6682a1cb669daa7445c8c986,0,www.bild.de,Wolf auf Norderney - Drohne findet den Wolf auf der Urlaubsinsel,"Krisen-Runde zum Wolf mit Bürgermeister und Experten auf der Insel in der Nordsee.Foto: picture alliance / blickwinkel/Luftbild Bertram, privat, Jan Woitas/dpa","https://images.bild.de/6682a1cb669daa7445c8c986/1fd0ed73fe662377879622e6719f4ea4,600ba0ba?w=1280",2024-07-02T10:01:23Z,,"Norderney Eine kurze Stippvisite und der Spuk ist vorbei? Denkste! Die Hoffnungen von Bürgermeister und Kurverwaltung haben sich zerschlagen. 
Der Wolf von Norderney, der offenbar über das Watt bei … [+2247 chars]",,de,'Niedrigwasser'
https://tirol.orf.at/stories/3263514/,https://tirol.orf.at/stories/3263514/,0,tirol.orf.at,Preise für ASFINAG und Autobahnmeisterei,Für ihren Einsatz beim Schneechaos am 23. Februar ist die Autobahnmeisterei Plon am Dienstag mit dem Ö3-Verkehrsaward ausgezeichnet worden. Die ASFINAG wurde in der Kategorie „Idee des Jahres“ geehrt. Der Autobahnbetreiber verwendet bei der Sanierung von Tunn…,https://ibs.orf.at/tir?image=https%3A%2F%2Foekastatic.orf.at%2Fmims%2F2024%2F27%2F03%2Fcrops%2Fw%3D1200%2Ch%3D627%2Cq%3D75%2F2265250_master_861303_oe3_award_autobahnmeisterei_plon.jpg%3Fs%3Dcd4c6b95f92007b545e1e62bb6d36e1ff477beab,2024-07-02T11:09:02Z,,"Der Autobahnbetreiber ASFINAG verwendet neuerdings bei der Sanierung von Tunnel und Galerien einen rötlichen Farbton für den Asphalt. Der rote Asphalt sei eine gute Kombination, um Kosten und Nutzen … [+2633 chars]",,de,'Schnee'
https://www.stern.de/gesellschaft/regional/berlin-brandenburg/unwetter--gewitter-richtet-schaeden-an---tornado-verdacht-in-cottbus-34845588.html,https://www.stern.de/gesellschaft/regional/berlin-brandenburg/unwetter--gewitter-richtet-schaeden-an---tornado-verdacht-in-cottbus-34845588.html,0,www.stern.de,Unwetter: Gewitter richtet Schäden an - Tornado-Verdacht in Cottbus,"Cottbus (bb) - Umgestürzte Bäume, beschädigte Autos und Hausdächer - ein Unwetter hat in Cottbus Zerstörungen angerichtet. War es ein Tornado, der eine",https://image.stern.de/34846632/t/qh/v1/w1440/r1.7778/-/02--kktf5m4c37v2axw800h600jpeg---9454d2a3ce72e2c0.jpg,2024-07-02T12:05:51Z,,"Bäume krachen um. In einer heftigen Gewitterfront werden auch Häuser und Autos demoliert. Es besteht der Verdacht auf einen Tornado in Cottbus.
Umgestürzte Bäume, beschädigte Autos und Hausdächer - … [+2084 chars]",,de,'Gewitter'
https://www.stern.de/panorama/wetter/unwetter--karten-zeigen--wo-heute-dauerregen-droht-34842396.html,https://www.stern.de/panorama/wetter/unwetter--karten-zeigen--wo-heute-dauerregen-droht-34842396.html,0,www.stern.de,"Wetter in Deutschland: Schauer und Gewitter: Karten zeigen, wo Unwetter aufziehen",Nach den Unwettern am Wochenende bleibt es erst einmal ungemütlich und regnerisch in Deutschland. Örtlich sind auch Gewitter möglich. Karten zeigen die We...,https://image.stern.de/34842504/t/la/v2/w1440/r1.7778/-/unwetter-dienstag-karte.jpg,2024-07-02T13:18:00Z,,"Nach den Unwettern vom Wochenende bleibt es erst einmal ungemütlich und regnerisch in Deutschland. Karten zeigen die Wetterlage.
Der Sommer macht in Deutschland vielerorts noch ein paar Tage Pause. … [+1741 chars]",,de,'Gewitter'
https://www.zeit.de/news/2024-07/02/rudersberg-schaden-von-ueber-120-millionen-euro-nach-flut,https://www.zeit.de/news/2024-07/02/rudersberg-schaden-von-ueber-120-millionen-euro-nach-flut,0,www.zeit.de,Hochwasser: Rudersberg: Schaden von über 120 Millionen Euro nach Flut,Hier finden Sie Informationen zu dem Thema „Hochwasser“. Lesen Sie jetzt „Rudersberg: Schaden von über 120 Millionen Euro nach Flut“.,https://img.zeit.de/news/2024-07/02/rudersberg-schaden-von-ueber-120-millionen-euro-nach-flut-image-group/wide__1300x731,2024-07-02T13:19:05Z,,Rudersberg (dpa/lsw) - Das Hochwasser vor einem Monat in Rudersberg hat nach Einschätzung der Gemeinde Schaden in Höhe von mehr als 120 Millionen Euro verursacht. Darin seien Schäden an der öffentlic… [+4346 chars],,de,'Hochwasser'
https://www.faz.net/podcasts/f-a-z-finanzen-immobilien/risiko-eigenheim-elementarschadenversicherung-im-podcast-19828085.html,https://www.faz.net/podcasts/f-a-z-finanzen-immobilien/risiko-eigenheim-elementarschadenversicherung-im-podcast-19828085.html,0,www.faz.net,F.A.Z. Finanzen Podcast: Risiko Eigenheim – was bringt eine Versicherung gegen Elementarschäden?,Hauseigentümer müssen aufpassen: Hochwasser und Stürme richten immer öfter Schäden an. Die Frage nach einer Elementarschadenversicherung wird wichtiger.,https://media1.faz.net/ppmedia/aktuell/gesellschaft/2923519171/1.9828159/facebook_teaser_fplus/hochwasser-im-bayerischen.jpg,2024-07-02T13:58:08Z,,"Gesprächspartner in dieser Folge ist Jakob Thevis, Vizevorstand des Zentrums für Europäischen Verbraucherschutz (ZEV).
Sie können den Podcast ganz einfach bei Apple Podcasts,Spotify oder Deezer abon… [+355 chars]",,de,'Hochwasser'
https://www.stern.de/sport/tour-de-france--pogacar-stuermt-ins-gelbe-trikot---vingegaard-abgehaengt-34847676.html,https://www.stern.de/sport/tour-de-france--pogacar-stuermt-ins-gelbe-trikot---vingegaard-abgehaengt-34847676.html,0,www.stern.de,Tour de France: Pogacar gewinnt erste Bergetappe und ist wieder in Gelb,"Valloire - Tadej Pogacar klopfte sich stolz auf die Brust, nachdem er inmitten der meterhohen Schneewände auf dem Alpen-Riesen Col du Galibier seinem",https://image.stern.de/34847702/t/7D/v1/w1440/r1.7778/-/02--n2whkom3ivv1axw800h600jpeg---ecedbae2784c5927.jpg,2024-07-02T15:20:20Z,,"Am vierten Tag der 111. Frankreich-Rundfahrt kommt es am Col du Galibier zum großen Schlagabtausch - und dieses Mal lässt sich der slowenische Radstar nicht mehr einfangen.
Tadej Pogacar klopfte sic… [+4284 chars]",,de,'Schnee'
https://www.stern.de/gesellschaft/regional/bayern/obstanbau--miserable-kirschernte-in-bayern-34849024.html,https://www.stern.de/gesellschaft/regional/bayern/obstanbau--miserable-kirschernte-in-bayern-34849024.html,0,www.stern.de,Obstanbau: Miserable Kirschernte in Bayern,"Der Kirschanbau ist eine heikle Angelegenheit - in diesem Jahr machten Frost, Hagel und Starkregen den Obstbauern zu schaffen. Das Landesamt für Statistik veröffentlicht ernüchternde Zahlen.",https://image.stern.de/34849026/t/as/v1/w1440/r1.7778/-/03--6tsfeqtzgav3axw800h600jpeg---28f2e349f96e488c.jpg,2024-07-03T08:19:29Z,,"Der Kirschanbau ist eine heikle Angelegenheit - in diesem Jahr machten Frost, Hagel und Starkregen den Obstbauern zu schaffen. Das Landesamt für Statistik veröffentlicht ernüchternde Zahlen.
Die Kir… [+1466 chars]",,de,'Ernte'
https://www.tagesspiegel.de/berlin/agrar-weniger-getreide-in-brandenburg-ernteaussichten-verhalten-11952416.html,https://www.tagesspiegel.de/berlin/agrar-weniger-getreide-in-brandenburg-ernteaussichten-verhalten-11952416.html,0,www.tagesspiegel.de,Agrar: Weniger Getreide in Brandenburg - Ernteaussichten verhalten,Nasse Äcker machen Landwirten zu schaffen. Gutes Erntewetter sieht anders aus. Die Erwartungen des Bauernpräsidenten sind verhalten.,https://www.tagesspiegel.de/berlin/images/ernteauftakt-in-brandenburg/alternates/BASE_16_9_W1400/ernteauftakt-in-brandenburg.jpeg,2024-07-03T12:10:15Z,,Jetzt ist Hochsaison auf Brandenburgs Feldern - die Getreideernte steht an. Dabei trüben Starkregen und auch Spätfröste die Aussichten auf gute Erträge. Die Ernte wird in Summe leicht unterdurchschni… [+2539 chars],,de,'Ernte'
https://www.stern.de/gesellschaft/regional/rheinland-pfalz-saarland/pfingsthochwasser--3-2-millionen-euro-an-hochwasser-soforthilfen-ausgezahlt-34851094.html,https://www.stern.de/gesellschaft/regional/rheinland-pfalz-saarland/pfingsthochwasser--3-2-millionen-euro-an-hochwasser-soforthilfen-ausgezahlt-34851094.html,0,www.stern.de,"Pfingsthochwasser: 3,2 Millionen Euro an Hochwasser-Soforthilfen ausgezahlt","Saarbrücken (lrs) - Rund sechs Wochen nach dem Pfingsthochwasser im Saarland sind bereits mehr als 3,2 Millionen Euro an Soforthilfe an betroffene Bürger",https://image.stern.de/34851096/t/Uf/v1/w1440/r1.7778/-/03--a66du7o7ngv10axw800h600jpeg---722aec0bc82d768f.jpg,2024-07-03T14:53:32Z,,"Vor gut sechs Wochen hat ein Hochwasser im Saarland große Schäden angerichtet. Viele Soforthilfen sind bereits geflossen.
Rund sechs Wochen nach dem Pfingsthochwasser im Saarland sind bereits mehr a… [+1268 chars]",,de,'Hochwasser'
https://noe.orf.at/stories/3263691/,https://noe.orf.at/stories/3263691/,0,noe.orf.at,Gipfelsturm bei Premiere für „Ötscher Trail“,Einer der traditionsreichsten Bergläufe Niederösterreichs feiert im Herbst ein Comeback in neuem Gewand. Der Ötscher Marathon kehrt als „Ötscher Trail“ zurück in den Laufsport-Kalender. Elite-Athleten und Hobbysportler können dabei zu Gipfelstürmern werden.,https://ibs.orf.at/noe?image=https%3A%2F%2Foekastatic.orf.at%2Fmims%2F2024%2F27%2F82%2Fcrops%2Fw%3D1200%2Ch%3D627%2Cq%3D75%2F2266386_master_861782_oem2018_318.jpg%3Fs%3D77f0be06f5a68de83890f3baeb17e415a8669f85,2024-07-03T14:54:00Z,,Unter dem Motto Run to be a hero feiert der Ötscher Trail im kommenden Herbst von 27. bis 29. September seine Premiere. 27 Jahre nach der Erstaustragung des Ötscher Marathons freut sich Gründer Herbe… [+3477 chars],,de,'Herbst'
https://vorarlberg.orf.at/stories/3263706/,https://vorarlberg.orf.at/stories/3263706/,0,vorarlberg.orf.at,Landtagsperiode von Krisen geprägt,"Am Mittwoch hat im Landtag die zweitägige Debatte über den Rechnungsabschluss für das Jahr 2023 begonnen. Es ist zugleich die letzte Sitzung vor der Sommerpause und vor der Landtagswahl im Herbst. So wurde nicht nur auf das Vorjahr zurückgeschaut, sondern auf…",https://ibs.orf.at/vbg?image=https%3A%2F%2Foekastatic.orf.at%2Fmims%2F2024%2F27%2F60%2Fcrops%2Fw%3D1200%2Ch%3D627%2Cq%3D75%2F2266809_master_861960_lt2.jpg%3Fs%3Dc2c95d283f2fcf1858db8ec6ca82a038c11afe8f,2024-07-03T15:09:55Z,,"Landeshauptmann Markus Wallner (ÖVP) sagte, er habe als Politiker keine Phase erlebt, in der es so viele Kriseneinschläge so kurz nacheinander gegeben habe als die vergangenen Jahre. Keiner habe bei … [+4412 chars]",,de,'Herbst'
https://noe.orf.at/stories/3263756/,https://noe.orf.at/stories/3263756/,0,noe.orf.at,Kühler Sommer verlangsamt Marillenernte,In der Wachau steht die Marillen-Haupternte bevor. Kleinere Mengen sind bereits seit einigen Tagen verfügbar. Aufgrund der derzeit kühleren Temperaturen reifen die Marillen jedoch etwas langsamer.,https://ibs.orf.at/noe?image=https%3A%2F%2Foekastatic.orf.at%2Fmims%2F2021%2F03%2F46%2Fcrops%2Fw%3D1200%2Ch%3D627%2Cq%3D75%2F809462_master_282146_02_aut_filmstill_haselnusszistel_wachau_filmgut.jpg%3Fs%3Dd8054e36a349fdddf182ef6f12008fa07e4c3c0e,2024-07-03T17:20:24Z,,"Seit einigen Tagen werden in Aggstein (Bezirk Melk) die orangen Früchte gepflückt, in anderen Wachauer Regionen hat die Ernte schon etwas früher begonnen. Die Qualität sei sehr gut, sagte Franz Reisi… [+2171 chars]",,de,'Sommer'
https://www.apfelpage.de/news/ios-18-und-co-deutschsprachige-vorschauseiten-von-apple-sind-live/,https://www.apfelpage.de/news/ios-18-und-co-deutschsprachige-vorschauseiten-von-apple-sind-live/,0,www.apfelpage.de,iOS 18 und Co.: Deutschsprachige Vorschauseiten von Apple sind live,"Apple hat die deutschsprachige Fassung der Vorschauseiten von iOS 18 und Co. veröffentlicht. Die neuen Systeme werden im Herbst für alle Nutzer starten, derzeit läuft der Beta-Test. Die Preview geben einen Überblick darüber, welche […]
Der Beitrag iOS 18 und …",https://www.apfelpage.de/wp-content/uploads/2024/06/Bild.jpeg,2024-07-03T18:45:51Z,,"Apple hat die deutschsprachige Fassung der Vorschauseiten von iOS 18 und Co. veröffentlicht. Die neuen Systeme werden im Herbst für alle Nutzer starten, derzeit läuft der Beta-Test. Die Preview geben… [+1653 chars]",,de,'Herbst'
