index,url,valid,domain,title,description,image,published,archive,content,quote,language,keyword
https://www.stern.de/panorama/wetter/wetter--kaelte-und-schnee-in-deutschland-haelt-naechste-woche-an-34254680.html,https://www.stern.de/panorama/wetter/wetter--kaelte-und-schnee-in-deutschland-haelt-naechste-woche-an-34254680.html,0,www.stern.de,Winterwetter: Frost hält Deutschland weiter fest im Griff – bis zu minus 8 Grad in Bayern erwartet,Das Winterwetter in Deutschland hält laut Wettervorhersage auch in der neuen Woche an. Aber regional gibt es relativ große Unterschiede in Sachen Temperatur.,https://image.stern.de/34254720/t/M8/v1/w1440/r1.7778/-/schnee-in-garmisch-partenkirchen.jpg,2023-12-03T15:44:00Z,,"Das Winterwetter in Deutschland hält laut Wettervorhersage auch in der neuen Woche an. Aber regional gibt es relativ große Unterschiede in Sachen Temperatur.
Das winterliche Wetter setzt sich in Deu… [+1727 chars]",,de,'Winter'
https://www.zeit.de/news/2023-12/04/neue-woche-startet-mit-schnee-und-glaettegefahr,https://www.zeit.de/news/2023-12/04/neue-woche-startet-mit-schnee-und-glaettegefahr,0,www.zeit.de,Wetter: Neue Woche startet mit Schnee und Glättegefahr,Hier finden Sie Informationen zu dem Thema „Wetter“. Lesen Sie jetzt „Neue Woche startet mit Schnee und Glättegefahr“.,https://img.zeit.de/news/2023-12/04/neue-woche-startet-mit-schnee-und-glaettegefahr-image-group/wide__1300x731,2023-12-04T06:53:12Z,https://web.archive.org/web/20231204165559/https://www.zeit.de/news/2023-12/04/neue-woche-startet-mit-schnee-und-glaettegefahr,Der Deutsche Wetterdienst (DWD) warnt zum Start der Woche vor glatten Straßen in Hessen. Im Bergland kann es zudem stürmische Böen geben. Ab dem späteren Vormittag ziehe von Westen her Schneefall auf… [+1225 chars],,de,'Glatteis'
https://www.stern.de/gesellschaft/regional/rheinland-pfalz-saarland/wetter--schneefall-und-gebietsweise-glatte-strassen-zum-start-in-neue-woche-34255828.html,https://www.stern.de/gesellschaft/regional/rheinland-pfalz-saarland/wetter--schneefall-und-gebietsweise-glatte-strassen-zum-start-in-neue-woche-34255828.html,0,www.stern.de,Wetter: Schneefall und gebietsweise glatte Straßen zum Start in neue Woche,"Zum Start in die neue Woche warnt der Deutsche Wetterdienst (DWD) vor Schneefall und gebietsweise Glatteis in Rheinland-Pfalz und im Saarland. Im Lauf des Vormittags setze von Westen her Schneefall ein, die Straßen könnten glatt werden, teilte der DWD am Mont…",https://image.stern.de/34255830/t/Vu/v1/w1440/r1.7778/-/04--urnnewsmldpacom2009010123120499173408v2w800h600l718t441r2605b2771jpeg---bd26c7b5072f6e2a.jpg,2023-12-04T07:35:06Z,,Zum Start in die neue Woche warnt der Deutsche Wetterdienst (DWD) vor Schneefall und gebietsweise Glatteis in Rheinland-Pfalz und im Saarland. Im Lauf des Vormittags setze von Westen her Schneefall e… [+1113 chars],,de,'Glatteis'
https://www.zeit.de/news/2023-12/04/schneefall-und-gebietsweise-glatte-strassen-zum-start-in-neue-woche,https://www.zeit.de/news/2023-12/04/schneefall-und-gebietsweise-glatte-strassen-zum-start-in-neue-woche,0,www.zeit.de,Wetter: Schneefall und gebietsweise glatte Straßen zum Start in neue Woche,Hier finden Sie Informationen zu dem Thema „Wetter“. Lesen Sie jetzt „Schneefall und gebietsweise glatte Straßen zum Start in neue Woche“.,https://img.zeit.de/news/2023-12/04/schneefall-und-gebietsweise-glatte-strassen-zum-start-in-neue-woche-image-group/wide__1300x731,2023-12-04T07:35:06Z,,Zum Start in die neue Woche warnt der Deutsche Wetterdienst (DWD) vor Schneefall und gebietsweise Glatteis in Rheinland-Pfalz und im Saarland. Im Lauf des Vormittags setze von Westen her Schneefall e… [+616 chars],,de,'Schnee'
https://www.zeit.de/news/2023-12/04/wetterdienst-warnt-vor-strassenglaette-neuschnee-erwartet,https://www.zeit.de/news/2023-12/04/wetterdienst-warnt-vor-strassenglaette-neuschnee-erwartet,0,www.zeit.de,Wetter: Wetterdienst warnt vor Straßenglätte - Neuschnee erwartet,Hier finden Sie Informationen zu dem Thema „Wetter“. Lesen Sie jetzt „Wetterdienst warnt vor Straßenglätte - Neuschnee erwartet“.,https://img.zeit.de/news/2023-12/04/wetterdienst-warnt-vor-strassenglaette-neuschnee-erwartet-image-group/wide__1300x731,2023-12-04T07:36:51Z,,"Der Deutsche Wetterdienst hat für Montag vor Straßenglätte gewarnt. Am Montagvormittag sei in Nordrhein-Westfalen mit Schneefall zu rechnen, der von Westen kommt und bis zum Nachmittag auch den Nordo… [+773 chars]",,de,'Glatteis'
https://www.focus.de/auto/ratgeber/sicherheit/frist-endet-2024-ab-2024-greift-neue-winterreifen-regel-handeln-sie-rechtzeitig_id_250559049.html,https://www.focus.de/auto/ratgeber/sicherheit/frist-endet-2024-ab-2024-greift-neue-winterreifen-regel-handeln-sie-rechtzeitig_id_250559049.html,0,www.focus.de,Heftiger Schneefall erwartet - Wintereinbruch! Alte Reifen ab 2024 verboten - was Sie jetzt schon wissen müssen,"Der Wintereinbruch macht auf den Straßen wieder sichtbar wer Winterreifen benutzt und wer lieber auf Sommerreifen rutscht. Falls jedoch Ihre Winterreifen das erforderliche Symbol nicht tragen, wird es Ihnen ab der kommenden Saison untersagt sein, sie zu verwe…",https://p6.focus.de/img/fotos/id_225984919/assauto2.jpg?im=Crop%3D%280%2C408%2C3265%2C1632%29%3BResize%3D%281200%2C627%29&impolicy=perceptual&quality=mediumHigh&hash=9636259681ea6faa225b458da8beca18440b8ccf8bd488ae131e7e79ebb8d9be,2023-12-04T09:21:37Z,,"<ul><li>
Kommentare</li><li>
E-Mail</li><li>
Teilen</li><li>
Mehr</li><li>
Twitter</li><li>
Drucken</li><li>
Feedback</li><li>
Fehler meldenSie haben einen Fehler gefunden?
Bitte markieren S… [+3215 chars]",,de,'Winter'
https://www.kicker.de/ceferin-die-winter-wm-war-nicht-gut-fuer-den-fussball-982671/artikel,https://www.kicker.de/ceferin-die-winter-wm-war-nicht-gut-fuer-den-fussball-982671/artikel,0,www.kicker.de,"Ceferin: ""Die Winter-WM war nicht gut für den Fußball""","UEFA-Präsident Aleksander Ceferin vermeidet es, die Vergabe der WM 2034 nach Saudi-Arabien offen zu kritisieren. In einem Interview spricht er sich allerdings gegen eine Neuauflage der Winter-WM aus und lobt das transparente Bewerbungsverfahren bei der UEFA.","https://derivates.kicker.de/image/upload/w_4000,h_2250,c_fill,g_auto:subject/w_1200,q_auto/v1/2023/12/04/86e0581c-ea05-42f1-bd98-5cebc72f72e1.jpeg",2023-12-04T09:34:09Z,,"UEFA-Präsident Aleksander Ceferin vermeidet es, die Vergabe der WM 2034 nach Saudi-Arabien offen zu kritisieren. In einem Interview spricht er sich allerdings gegen eine Neuauflage der Winter-WM aus … [+2085 chars]",,de,'Winter'
https://www.kino.de/artikel/letzte-chance-bei-amazon--38qr3h4xgv,https://www.kino.de/artikel/letzte-chance-bei-amazon--38qr3h4xgv,0,www.kino.de,Letzte Chance bei Amazon: Allein der Anfang dieses Horror-Hits ist kaum zu ertragen,"Wer Sommer-Gefühle im Winter haben will, sollte sich diesen Horrorfilm nicht entgehen lassen. Aber seid schnell: Er ist bald nicht mehr bei Amazon verfügbar!",https://static.kino.de/b6/a0/85/cbb6b83c70be2e200ed247d2c6_A2IwYzYzMDIwZDdj_midsommar5863773.png#fp=80e66073ffff,2023-12-04T09:38:11Z,,"Wer Sommer-Gefühle im Winter haben will, sollte sich diesen Horrorfilm nicht entgehen lassen. Aber seid schnell: Er ist bald nicht mehr bei Amazon verfügbar!
Einer der verstörendsten Filme mit Flore… [+2685 chars]",,de,'Winter'
"https://feed.laut.de/Kora-Winter/Alben/Gott-Segne,-Gott-Bewahre-121942","https://feed.laut.de/Kora-Winter/Alben/Gott-Segne,-Gott-Bewahre-121942",0,feed.laut.de,"""Gott Segne, Gott Bewahre"" von Kora Winter",Man sucht sich wohl besser einen neuen Gott. (4/5),"https://www.laut.de/Kora-Winter/Alben/Gott-Segne,-Gott-Bewahre-121942/kora-winter-gott-segne-bewahre-231650.jpg?cb512d",2023-12-04T09:53:41Z,,"laut.de-Kritik
Man sucht sich wohl besser einen neuen Gott.
Review von Franz Mauerer
""Bewaffnet/ bis an die Zähne bewaffnet/ Du lachst mit/ solang der Finger nicht abdrückt"" ist das erste (nach de… [+4088 chars]",,de,'Winter'
https://www.fitforfun.de/news/unbekanntes-superfood-diese-power-nuss-solltest-du-im-winter-taeglich-snacken-508512.html,https://www.fitforfun.de/news/unbekanntes-superfood-diese-power-nuss-solltest-du-im-winter-taeglich-snacken-508512.html,0,www.fitforfun.de,Unbekanntes Superfood: Diese Power-Nuss solltest du im Winter täglich snacken,"Schon einmal von Erdmandeln gehört? Sie sind besonders in den Regionen des Mittelmeeres bekannt und sind super gesund. Höchste Zeit, dass du diese geniale Alternative zu klassischen Nüssen kennenlernst.","https://www.fitforfun.de/files/images/202308/1/echtes-superfood-diese-power-nuss-solltest-du-jeden-tag-essen-629353190,563150_3x2_n.jpg",2023-12-04T09:55:00Z,,"Die Knollen der Erdmandel-Pflanze erinnern in Form, Farbe und Geschmack an klassische Mandeln. Sie werden auch manchmal als Tiger- oder Chufa-Nüsse bezeichnet. Der Begriff Nuss ist in diesem Fall all… [+240 chars]",,de,'Winter'
https://www.bild.de/news/wetter/wetter/extremes-winter-wetter-schnee-und-eisregen-warnung-im-westen-86315480.bild.html,https://www.bild.de/news/wetter/wetter/extremes-winter-wetter-schnee-und-eisregen-warnung-im-westen-86315480.bild.html,0,www.bild.de,"Schnee und Eisregen-Warnung im Westen - Achtung, es wird glatt!",Es ist noch nicht vorbei: Das extreme Winter-Wetter setzt sich in Deutschland fort.Foto: Sven Hoppe/dpa,"https://images.bild.de/656d730ac389e63db3cb5105/e151edb33414872ef9dbe8d89dda8589,83290d1e?w=1280",2023-12-04T09:58:00Z,,"Es ist noch nicht vorbei: Das extreme Winter-Wetter setzt sich in Deutschland fort. Achtung, es wird glatt!
Am Montag gibt es, wie aktuell in Schleswig-Holstein, noch ein bisschen Schnee. Dann seien… [+4190 chars]",,de,'Winter'
https://www.focus.de/sport/fussball/bundesliga1/sky-experte-dietmar-hamann-tuchel-waere-es-lieber-wenn-mueller-nicht-mehr-da-ist_id_258237862.html,https://www.focus.de/sport/fussball/bundesliga1/sky-experte-dietmar-hamann-tuchel-waere-es-lieber-wenn-mueller-nicht-mehr-da-ist_id_258237862.html,0,www.focus.de,"Bleibt er bei den Bayern? - „Tuchel wäre es lieber, wenn Müller nicht mehr da ist“","Thomas Müller hat es unter Trainer Thomas Tuchel bei den Bayern nicht leicht. Der Vertrag des Offensiv-Stars läuft in München im Sommer aus. „Sky“-Experte Dietmar Hamann erklärt nun, dass Tuchel Müller bei den Bayern nicht mehr haben will.",https://p6.focus.de/img/fotos/id_258236488/imago1034693963h.jpg?im=Crop%3D%280%2C0%2C3200%2C1599%29%3BResize%3D%281200%2C627%29&impolicy=perceptual&quality=mediumHigh&hash=cd3b9622952e468f6ec9469be59805cec98a7a5d64810e240720abb7d68048f9,2023-12-04T10:01:54Z,,"Thomas Müller hat es unter Trainer Thomas Tuchel bei den Bayern nicht leicht. Der Vertrag des Offensiv-Stars läuft in München im Sommer aus. Sky-Experte Dietmar Hamann erklärt nun, dass Tuchel Müller… [+2031 chars]",,de,'Winter'
https://www.bild.de/sport/fussball/fussball/carl-zeiss-jena-schau-blaest-zum-angriff-auf-die-spitze-86316840.bild.html,https://www.bild.de/sport/fussball/fussball/carl-zeiss-jena-schau-blaest-zum-angriff-auf-die-spitze-86316840.bild.html,0,www.bild.de,Jenas Blick geht nach oben - Schau bläst zum Angriff auf die Spitze,Dieser Winter könnte für Carl Zeiss Jena ganz heiß werden! Die Thüringer gewannen vor 3806 Zuschauern im Ernst-Abbe-Sportfeld gegen den ZFC Meuselwitz 1:0.,"https://images.bild.de/656d93f623e90e7ab9b94cc0/5e806c964f9fece54e6928ec0bd3d16e,28504af?w=1280",2023-12-04T10:02:42Z,,"Dieser Winter könnte für Carl Zeiss Jena gaaaanz heiß werden!
Die Thüringer gewannen vor 3806 Zuschauern im Ernst-Abbe-Sportfeld gegen den ZFC Meuselwitz mit 1:0. Das Tor des Tages erzielte Elias Lö… [+1305 chars]",,de,'Winter'
https://www.stern.de/auto/autofahrtipps-fuer-den-winter---sicher-bei-eis-und-schnee-7783358.html,https://www.stern.de/auto/autofahrtipps-fuer-den-winter---sicher-bei-eis-und-schnee-7783358.html,0,www.stern.de,Eis und Schnee: Mit diesen Tipps beim Autofahren kommen Sie sicher durch den Winter,"Kälte, Eis und Schnee machen Autofahren im Winter besonders anspruchsvoll. Deswegen muss das Fahrverhalten an die Witterung angepasst werden. Mit diesen Tipps kommen Sie sicher durch den Winter.",https://image.stern.de/7783352/t/v1/v4/w1440/r1.7778/-/teaser.jpg,2023-12-04T10:24:00Z,,"Sehen Sie im Video: Mit diesen Tipps beim Autofahren kommen Sie sicher durch den Winter.Autofahren ist im Winter besonders anspruchsvoll. Fahrzeuge reagieren bei Kälte, Eis und Schnee anders als gewo… [+1344 chars]",,de,'Schnee'
https://www.stern.de/panorama/wetter/schnee-und-verkehrschaos--so-war-das-winter-wochenende-in-deutschland-34252218.html,https://www.stern.de/panorama/wetter/schnee-und-verkehrschaos--so-war-das-winter-wochenende-in-deutschland-34252218.html,0,www.stern.de,Eisige Temperaturen: Zwischen Winterwunderland und Verkehrschaos: So lief das erste Schnee-Wochenende in Deutschland,"Die Bahn steht still, der Flugbetrieb ist eingestellt und die Polizei rät von Autofahrten ab: Der Winter hat Süddeutschland fest im Griff. Vor allem die bayerische Landeshauptstadt München ist betroffen.",https://image.stern.de/34256194/t/zP/v1/w1440/r1.7778/-/wintersonne.jpg,2023-12-04T10:28:00Z,https://web.archive.org/web/20231204103915/https://www.stern.de/panorama/wetter/schnee-und-verkehrschaos--so-war-das-winter-wochenende-in-deutschland-34252218.html,Der starke Schneefall vom ersten Adventswochenende hinterlässt Spuren nicht nur als idyllisches Winterwunderland. Insbesondere Zugreisende in Bayern müssen sich weiter auf erhebliche Einschränkungen … [+2104 chars],,de,'Winter'
https://www.bild.de/video/clip/sport-videos/ein-spieler-wird-ganz-sicher-kommen-bayerns-transfer-plaene-fuer-den-winter-86318060.bild.html,https://www.bild.de/video/clip/sport-videos/ein-spieler-wird-ganz-sicher-kommen-bayerns-transfer-plaene-fuer-den-winter-86318060.bild.html,0,www.bild.de,EIN Spieler wird ganz sicher kommen - Bayerns Transfer-Pläne für den Winter!,Transfer-News! Experte Marcel Reif ist sich sicher: Der FC Bayern München legt in der Defensive im Winter nach. Auch Palhinha von Fulham ist weiterhin Thema,"https://images.bild.de/656da6b3409fe13e934e0d27/4b27534abfdddc58ce7725ac8a506873,2dc9ddd2?w=1280",2023-12-04T10:33:22Z,,"Mehr zum Video anzeigen
Transfer-News! Experte Marcel Reif ist sich sicher: Der FC Bayern München legt in der Defensive im Winter nach. Wunschspieler Palhinha spielt noch eine Rolle in den Planungen… [+40 chars]",,de,'Winter'
https://www.brigitte.de/aktuell/buzz/glatteis-winter-2023--mit-dem--pinguin-trick--rutschst-du-nie-wieder-aus-12265920.html,https://www.brigitte.de/aktuell/buzz/glatteis-winter-2023--mit-dem--pinguin-trick--rutschst-du-nie-wieder-aus-12265920.html,0,www.brigitte.de,"Glatteis-Winter 2023: Mit dem ""Pinguin-Trick"" rutscht ihr nie wieder aus","Bei Glatteis passieren selbst den Vorsichtigsten von uns schnell mal gefährliche Stürze - hier seht ihr, mit welchem einfachen Trick ihr standfest bleibt.",https://image.brigitte.de/11036426/t/OV/v4/w1440/r1.7778/-/eis-ausrutschen-trick.png,2023-12-04T10:47:00Z,,"Bei Glatteis passieren selbst den Vorsichtigsten von uns schnell mal gefährliche Stürze - hier seht ihr, mit welchem einfachen Trick ihr standfest bleibt.
Autsch! Auch wenn wir noch so vorsichtig si… [+772 chars]",,de,'Winter'
https://www.focus.de/auto/ratgeber/sicherheit/4x4-wissen-souveraen-durch-den-schnee-statt-rutschen-alles-was-sie-ueber-allradantrieb-wissen-muessen_id_258263574.html,https://www.focus.de/auto/ratgeber/sicherheit/4x4-wissen-souveraen-durch-den-schnee-statt-rutschen-alles-was-sie-ueber-allradantrieb-wissen-muessen_id_258263574.html,0,www.focus.de,4x4-Guide - Souverän durch den Schnee statt rutschen - Allrad-Wissen zum Angeben,"Der Süden Deutschlands versinkt im Schneechaos. Wohl dem, der neben guten Winterreifen noch Allradantrieb an Bord hat. Doch es gibt gute und weniger gute Systeme. FOCUS online führt sie durch den 4x4 Technik-Dschungel.Von FOCUS-online-Autor Jürgen Wolff",https://p6.focus.de/img/fotos/id_3271159/auto-ein-porsche-im-wintereinsatz-das-anfahren-auf-schnee-gelinge-mit-vier-angetriebenen-raedern-einfach-besser-sagt-rallye-legende-rauno-aaltonen.-foto-porsche.jpg?im=Crop%3D%280%2C100%2C800%2C400%29%3BResize%3D%281200%2C627%29&impolicy=perceptual&quality=mediumHigh&hash=08cd0f2e0a4b64f191b1a9ed72dabf99f7a099a1df1e39f3dd2b79e4cafa541b,2023-12-04T11:49:52Z,,"<ul><li>
Kommentare</li><li>
E-Mail</li><li>
Teilen</li><li>
Mehr</li><li>
Twitter</li><li>
Drucken</li><li>
Feedback</li><li>
Fehler meldenSie haben einen Fehler gefunden?
Bitte markieren S… [+8084 chars]",,de,'Schnee'
https://www.bild.de/video/clip/news/nach-der-winter-walze-wetterexperte-mit-horror-ausblick-86319248.bild.html,https://www.bild.de/video/clip/news/nach-der-winter-walze-wetterexperte-mit-horror-ausblick-86319248.bild.html,0,www.bild.de,Nach der Winter-Walze - Wetterexperte mit Horror-Ausblick,Vom Schneechaos zum gefrierenden Regen: Winterunwetter hält Deutschland weiterhin in Atem!,"https://images.bild.de/656db6f6409fe13e934e0d55/949d2bdc5e431ea343ac2e50b2cd76a5,56c2dfbb?w=1280",2023-12-04T11:52:17Z,,"Mehr zum Video anzeigen
Minus 20 Grad und ein halber Meter Schnee das ist kein Wetter für Nordeuropa, sondern die aktuelle Lage im Süden Deutschlands!
Quelle: Bild 04.12.2023 - 13:00 Uhr",,de,'Winter'
https://www.tagesspiegel.de/potsdam/landeshauptstadt/advent-advent-die-vier-phasen-des-wintereinbruchs-10876630.html,https://www.tagesspiegel.de/potsdam/landeshauptstadt/advent-advent-die-vier-phasen-des-wintereinbruchs-10876630.html,0,www.tagesspiegel.de,Advent Advent: Die vier Phasen des Wintereinbruchs,"In Weihnachtsstimmung zu kommen, ist nicht immer ein leichtes Geschäft. Manchmal kann man sich aber fast gar nicht dagegen wehren, hat unsere Autorin erfahren müssen.",https://www.tagesspiegel.de/images/best-off-der-potsdamer-weihnachtsmarkte/alternates/BASE_16_9_W1400/best-off-der-potsdamer-weihnachtsmaerkte.jpeg,2023-12-04T12:07:30Z,https://web.archive.org/web/20231205020956/https://www.tagesspiegel.de/potsdam/landeshauptstadt/advent-advent-die-vier-phasen-des-wintereinbruchs-10876630.html,"I : Der Winter kommt wie jedes Jahr überraschend. Was wir immer schon mal machen wollten: Mitten in der Nacht die komplett gefüllte Wassertonne lehren. Um im Garten keine Eisbahn zu riskieren, bilden… [+2040 chars]",,de,'Winter'
https://www.kicker.de/vitor-roque-im-winter-bei-barca-was-deco-sich-vom-toptalent-verspricht-982716/artikel,https://www.kicker.de/vitor-roque-im-winter-bei-barca-was-deco-sich-vom-toptalent-verspricht-982716/artikel,0,www.kicker.de,Vitor Roque im Winter bei Barça: Was Deco sich vom Toptalent verspricht,"Beim Abschied von Athletico Paranaense wurde Vitor Roque gefeiert, ab Winter wird der 18-Jährige für den FC Barcelona spielen. Das bestätigte nun auch Sportdirektor Deco.","https://derivates.kicker.de/image/upload/c_crop,x_0,y_87,w_3543,h_1993/w_1200,q_auto/v1/2023/12/04/d01d0083-5674-49e5-88b6-2fb5e8acbacc.jpeg",2023-12-04T12:28:04Z,,"Beim Abschied von Athletico Paranaense wurde Vitor Roque gefeiert, ab Winter wird der 18-Jährige für den FC Barcelona spielen. Das bestätigte nun auch Sportdirektor Deco. 
 Stehende Ovationen bei de… [+2630 chars]",,de,'Winter'
https://www.zeit.de/news/2023-12/04/einbrecher-durch-schuhspuren-im-schnee-ueberfuehrt,https://www.zeit.de/news/2023-12/04/einbrecher-durch-schuhspuren-im-schnee-ueberfuehrt,0,www.zeit.de,Ermittlungen: Einbrecher durch Schuhspuren im Schnee überführt,Hier finden Sie Informationen zu dem Thema „Ermittlungen“. Lesen Sie jetzt „Einbrecher durch Schuhspuren im Schnee überführt“.,https://img.zeit.de/news/2023-12/04/einbrecher-durch-schuhspuren-im-schnee-ueberfuehrt-image-group/wide__1300x731,2023-12-04T13:52:20Z,https://web.archive.org/web/20231204163641/https://www.zeit.de/news/2023-12/04/einbrecher-durch-schuhspuren-im-schnee-ueberfuehrt,"Durch Schuhspuren im Schnee sind mutmaßliche Einbrecher in der Oberpfalz überführt worden. Ein Mann hatte am Sonntag verdächtige Spuren, die rund um mehrere Häuser in Birgland (Landkreis Amberg-Sulzb… [+587 chars]",,de,'Schnee'
https://www.zeit.de/news/2023-12/05/schnee-schneeregen-und-regen-in-sachsen,https://www.zeit.de/news/2023-12/05/schnee-schneeregen-und-regen-in-sachsen,0,www.zeit.de,"Wetter: Schnee, Schneeregen und Regen in Sachsen","Hier finden Sie Informationen zu dem Thema „Wetter“. Lesen Sie jetzt „Schnee, Schneeregen und Regen in Sachsen“.",https://img.zeit.de/news/2023-12/05/schnee-schneeregen-und-regen-in-sachsen-image-group/wide__1300x731,2023-12-05T05:33:11Z,,"In den kommenden Tagen wird das Wetter in Sachsen wechselhaft. Der Dienstag beginnt bedeckt mit Schnee und Schneeregen, der von Westen nach Osten zieht, wie der Deutsche Wetterdienst (DWD) am Diensta… [+1973 chars]",,de,'Schnee'
https://www.zeit.de/news/2023-12/05/mehr-schnee-und-glaettegefahr-am-dienstag,https://www.zeit.de/news/2023-12/05/mehr-schnee-und-glaettegefahr-am-dienstag,0,www.zeit.de,Wetter: Mehr Schnee und Glättegefahr am Dienstag,Hier finden Sie Informationen zu dem Thema „Wetter“. Lesen Sie jetzt „Mehr Schnee und Glättegefahr am Dienstag“.,https://img.zeit.de/news/2023-12/05/mehr-schnee-und-glaettegefahr-am-dienstag-image-group/wide__1300x731,2023-12-05T05:35:19Z,,Mit Neuschnee und Frost ist am Dienstag in Berlin und Brandenburg zu rechnen. Am Morgen warnt der Deutsche Wetterdienst (DWD) örtlich vor Glätte und frostigen Temperaturen zwischen minus zwei und min… [+971 chars],,de,'Schnee'
https://www.zeit.de/news/2023-12/05/mehr-regen-als-schnee-in-nrw-bis-zu-sieben-grad-am-dienstag,https://www.zeit.de/news/2023-12/05/mehr-regen-als-schnee-in-nrw-bis-zu-sieben-grad-am-dienstag,0,www.zeit.de,Wetter: Mehr Regen als Schnee in NRW: Bis zu sieben Grad am Dienstag,Hier finden Sie Informationen zu dem Thema „Wetter“. Lesen Sie jetzt „Mehr Regen als Schnee in NRW: Bis zu sieben Grad am Dienstag“.,https://img.zeit.de/news/2023-12/05/mehr-regen-als-schnee-in-nrw-bis-zu-sieben-grad-am-dienstag-image-group/wide__1300x731,2023-12-05T05:53:28Z,https://web.archive.org/web/20231206060019/https://www.zeit.de/news/2023-12/05/mehr-regen-als-schnee-in-nrw-bis-zu-sieben-grad-am-dienstag,"In Nordrhein-Westfalen fällt in den kommenden Tagen mehr Regen als Schnee. Am Dienstag steigen die Temperaturen zudem auf zwei Grad in Ostwestfalen und bis zu sieben Grad im Rheinland, wie der Deutsc… [+500 chars]",,de,'Schnee'
https://www.zeit.de/news/2023-12/05/ueber-150-unfaelle-aufgrund-von-schnee-und-glaette,https://www.zeit.de/news/2023-12/05/ueber-150-unfaelle-aufgrund-von-schnee-und-glaette,0,www.zeit.de,Wetter: Über 150 Unfälle aufgrund von Schnee und Glätte,Hier finden Sie Informationen zu dem Thema „Wetter“. Lesen Sie jetzt „Über 150 Unfälle aufgrund von Schnee und Glätte“.,https://img.zeit.de/news/2023-12/05/ueber-150-unfaelle-aufgrund-von-schnee-und-glaette-image-group/wide__1300x731,2023-12-05T06:49:21Z,https://web.archive.org/web/20231206055621/https://www.zeit.de/news/2023-12/05/ueber-150-unfaelle-aufgrund-von-schnee-und-glaette,"Glatte Straßen haben in Mainz, Worms und einigen Landkreisen in Rheinland-Pfalz am Montag zwischen dem Mittag und Abend zu 179 Verkehrsunfällen geführt. Wie die Polizei mitteilte, wurden bei acht die… [+742 chars]",,de,'Schnee'
https://www.zeit.de/news/2023-12/05/frau-steckt-mit-rollstuhl-in-schnee-fest-feuerwehreinsatz,https://www.zeit.de/news/2023-12/05/frau-steckt-mit-rollstuhl-in-schnee-fest-feuerwehreinsatz,0,www.zeit.de,Notruf: Frau steckt mit Rollstuhl in Schnee fest: Feuerwehreinsatz,Hier finden Sie Informationen zu dem Thema „Notruf“. Lesen Sie jetzt „Frau steckt mit Rollstuhl in Schnee fest: Feuerwehreinsatz“.,https://img.zeit.de/news/2023-12/05/frau-steckt-mit-rollstuhl-in-schnee-fest-feuerwehreinsatz-image-group/wide__1300x731,2023-12-05T11:49:18Z,,Mit ihrem elektrischen Rollstuhl ist eine Frau in den Schneemassen im Münchner Olympiapark stecken geblieben und schließlich von der Feuerwehr nach Hause gezogen worden. Sie war in der Nacht zum Dien… [+1140 chars],,de,'Schnee'
https://www.zeit.de/news/2023-12/05/winterwunderland-mecklenburg-vorpommern-mehr-schnee-kommt,https://www.zeit.de/news/2023-12/05/winterwunderland-mecklenburg-vorpommern-mehr-schnee-kommt,0,www.zeit.de,Wetter: Winterwunderland Mecklenburg-Vorpommern: Mehr Schnee kommt,Hier finden Sie Informationen zu dem Thema „Wetter“. Lesen Sie jetzt „Winterwunderland Mecklenburg-Vorpommern: Mehr Schnee kommt“.,https://img.zeit.de/news/2023-12/05/winterwunderland-mecklenburg-vorpommern-mehr-schnee-kommt-image-group/wide__1300x731,2023-12-05T12:16:01Z,,"Seit einigen Tagen sind die Dächer, Straßen und Plätze von Mecklenburg-Vorpommern in Weiß gehüllt. Schnee-Fans können sich in den kommenden Tagen auf noch mehr Schneefall freuen.
Mehr Schlagzeilen
… [+901 chars]",,de,'Schnee'
