index,url,valid,domain,title,description,image,published,archive,content,quote,language,keyword
https://www.zeit.de/news/2024-07/06/zwetschgen-ernte-beginnt-mit-durchwachsenen-erwartungen,https://www.zeit.de/news/2024-07/06/zwetschgen-ernte-beginnt-mit-durchwachsenen-erwartungen,0,www.zeit.de,Obstanbau: Zwetschgen-Ernte beginnt mit durchwachsenen Erwartungen,Hier finden Sie Informationen zu dem Thema „Obstanbau“. Lesen Sie jetzt „Zwetschgen-Ernte beginnt mit durchwachsenen Erwartungen“.,https://img.zeit.de/news/2024-07/06/zwetschgen-ernte-beginnt-mit-durchwachsenen-erwartungen-image-group/wide__1300x731,2024-07-06T03:00:37Z,,Der späte Frost im April ist den Zwetschgen in Bayern nicht gut bekommen. Fachleute erwarten deshalb Einbußen bei der Ernte. Im Vergleich zu den Vorjahren würden es voraussichtlich 30 bis 40 Prozent … [+3383 chars],,de,'Ernte'
https://steiermark.orf.at/stories/3263900/,https://steiermark.orf.at/stories/3263900/,0,steiermark.orf.at,Pflegeheim Neudau weiterhin unbewohnbar,"Das Hochwasser in der Nacht vom 8. auf 9. Juni hat das gesamte Erdgeschoß des Pflegeheims in Neudau unbewohnbar gemacht – das Seniorenhaus Menda in Hartberg nahm die Bewohner auf. Bis Bewohner und Mitarbeiter wieder zurückkehren können, werden aber noch sechs…",https://ibs.orf.at/stm?image=https%3A%2F%2Foekastatic.orf.at%2Fmims%2F2023%2F41%2F80%2Fcrops%2Fw%3D1200%2Ch%3D627%2Cq%3D75%2F1967966_master_740680_9d059363-e0ea-4cf1-bcee-0e458831493f.jpg%3Fs%3D40e25cde1d50d4bef3c0334166619e23f8958b65,2024-07-06T05:31:00Z,,Fast ein Monat sind die 40 Bewohnerinnen und Bewohner des Volkshilfe-Pflegeheimes Neudau nun schon weg aus ihrem Zuhause. Das Pflegeheim lag im Zentrum der Überschwemmungen: Am 8. Juni wurde das Erdg… [+1862 chars],,de,'Hochwasser'
https://www.zeit.de/news/2024-07/06/schauer-und-gewitter-ziehen-ueber-hessen,https://www.zeit.de/news/2024-07/06/schauer-und-gewitter-ziehen-ueber-hessen,0,www.zeit.de,Wettervorhersage: Schauer und Gewitter ziehen über Hessen,Hier finden Sie Informationen zu dem Thema „Wettervorhersage“. Lesen Sie jetzt „Schauer und Gewitter ziehen über Hessen“.,https://img.zeit.de/news/2024-07/06/schauer-und-gewitter-ziehen-ueber-hessen-image-group/wide__1300x731,2024-07-06T07:50:12Z,,Das Wetter in Hessen wird am Wochenende noch durchmischt - zur neuen Woche warten höhere Temperaturen und Sonnenschein auf. Der Deutsche Wetterdienst (DWD) hat für Samstag starke Bewölkung mit schaue… [+749 chars],,de,'Gewitter'
https://www.zeit.de/news/2024-07/06/wind-und-gewitter-am-ersten-ferienwochenende-in-nrw,https://www.zeit.de/news/2024-07/06/wind-und-gewitter-am-ersten-ferienwochenende-in-nrw,0,www.zeit.de,Wetter: Wind und Gewitter am ersten Ferienwochenende in NRW,Hier finden Sie Informationen zu dem Thema „Wetter“. Lesen Sie jetzt „Wind und Gewitter am ersten Ferienwochenende in NRW“.,https://img.zeit.de/news/2024-07/06/wind-und-gewitter-am-ersten-ferienwochenende-in-nrw-image-group/wide__1300x731,2024-07-06T08:01:46Z,,"Am ersten Ferienwochenende in Nordrhein-Westfalen zeigt sich der Sommer noch etwas unentschlossen. Heute ziehen von Nordwesten gebietsweise schauerartiger Regen und teils starke Gewitter durch, wie d… [+559 chars]",,de,'Gewitter'
https://www.stern.de/panorama/wetter/unwetter--karten-zeigen--wo-es-heute-am-staerksten-stuermt--34858548.html,https://www.stern.de/panorama/wetter/unwetter--karten-zeigen--wo-es-heute-am-staerksten-stuermt--34858548.html,0,www.stern.de,"Wetter in Deutschland: Amtliche Warnung vor Sturm und Gewitter: Karten zeigen, wo heute Unwetter aufziehen","Auch am Samstag bleibt das Wetter wenig sommerlich, dafür wird es teilweise richtig ungemütlich. In Nordfriesland. werden starke Gewitter erwartet und auch im Süden Bayerns warnt der Wetterdienst vor schweren Gewittern mit heftigem Starkregen. Karten zeigen d…",https://image.stern.de/34858580/t/x1/v1/w1440/r1.7778/-/teaser-unwetter-wetter-samstag.jpg,2024-07-06T08:50:00Z,,"Auch am Samstag bleibt das Wetter wenig sommerlich, dafür wird es teilweise richtig ungemütlich. In Nordfriesland. werden starke Gewitter erwartet und auch im Süden Bayerns warnt der Wetterdienst vor… [+2705 chars]",,de,'Sommer'
https://www.stern.de/gesellschaft/regional/berlin-brandenburg/wetter--am-nachmittag-drohen-starkregen--hagel-und-sturmboeen-34858694.html,https://www.stern.de/gesellschaft/regional/berlin-brandenburg/wetter--am-nachmittag-drohen-starkregen--hagel-und-sturmboeen-34858694.html,0,www.stern.de,"Wetter: Am Nachmittag drohen Starkregen, Hagel und Sturmböen",Potsdam /dpa/bb) - Das sommerliche Wetter mit viel Sonne und 30 Grad wird am Nachmittag in Berlin und Brandenburg durch drohende Gewitter und teils heftigen,https://image.stern.de/34858696/t/Yu/v1/w1440/r1.7778/-/06--lsxa3oeytqv21axw800h600jpeg---56d7d2eb1694272d.jpg,2024-07-06T10:08:34Z,,"Das sonnige Sommerwetter lockt viele Menschen raus ins Grüne. Doch am Nachmittag wird es ungemütlich. Starkregen und Sturmböen kündigen sich an.
Potsdam /dpa/bb) - Das sommerliche Wetter mit viel So… [+972 chars]",,de,'Gewitter'
https://kaernten.orf.at/stories/3264096/,https://kaernten.orf.at/stories/3264096/,0,kaernten.orf.at,Altschneefelder gefährden Tourengeher,"Altschneefelder können im Sommer zu einer gefährlichen Hürde bei Bergtouren werden, eine Überquerung kann sogar tödlich enden. Erst zuletzt rutschte eine 57 Jahre alte tschechische Urlauberin auf dem Ankogel am Lassacher Kees 40 Meter ab und prallte gegen ein…",https://ibs.orf.at/ktn?image=https%3A%2F%2Foekastatic.orf.at%2Fmims%2F2024%2F25%2F81%2Fcrops%2Fw%3D1200%2Ch%3D627%2Cq%3D75%2F2246780_master_853581_kaprun1.jpg%3Fs%3D3893fed4c54668d1b0d4491346e218d9113a3a79,2024-07-06T10:56:43Z,,"In den Karnischen Alpen, den Karawanken und auch in den Tauern, hält sich der Schnee des Winters noch lange, meist in steilen sonnenabgewandten Rinnen. Mitunter trennen nur ein paar Meter ein sichere… [+1911 chars]",,de,'Laub'
https://www.n-tv.de/mediathek/videos/panorama/Spaniens-Duerre-treibt-Olivenoel-Preise-in-die-Hoehe-article25057568.html,https://www.n-tv.de/mediathek/videos/panorama/Spaniens-Duerre-treibt-Olivenoel-Preise-in-die-Hoehe-article25057568.html,0,www.n-tv.de,Schock für die mediterrane Küche: Spaniens Dürre treibt Olivenöl-Preise in die Höhe,"Eigentlich wachsen und gedeihen Olivenbäume bei sonniger Hitze, doch zuletzt scheint es der Pflanze in Spanien ein wenig zu heiß zu werden. Die Blüten vertrocknen, bevor überhaupt Oliven wachsen können, aus denen dann Olivenöl hergestellt wird. Das schlägt si…",https://bilder1.n-tv.de/img/incoming/crop25057828/31213298-cImg_16_9-w1200/ol.jpg,2024-07-06T13:51:36Z,,,,de,'Dürre'
https://vorarlberg.orf.at/stories/3264114/,https://vorarlberg.orf.at/stories/3264114/,0,vorarlberg.orf.at,Obst- und Gemüsebauern hadern mit Wetter,"So richtig in Schwung kommt der Sommer in Vorarlberg heuer nicht. Die ständigen Wetterwechsel stellen Gemüse- und Obstbauern vor große Herausforderungen. Während einige Pflanzen leiden, profitieren Weichtiere und Larven von den Bedingungen.",https://ibs.orf.at/vbg?image=https%3A%2F%2Foekastatic.orf.at%2Fmims%2F2024%2F27%2F48%2Fcrops%2Fw%3D1200%2Ch%3D627%2Cq%3D75%2F2269816_master_863248_downloadmedium.jpg%3Fs%3D8ca03988a894798cb20cbb7a54c53bf951f73deb,2024-07-06T17:10:32Z,,"Das Wetter wechselt im Minutentakt und bringt viele Pflanzen in Bedrängnis. Während Weichtiere und Larven sich über die Bedingungen freuen, haben Gemüse- und Obstbauern mit erheblichen Problemen zu k… [+1581 chars]",,de,'Sommer'
https://www.zeit.de/news/2024-07/06/sturmboeen-ueber-dresden-sonnenliege-haengt-in-telefonleitung,https://www.zeit.de/news/2024-07/06/sturmboeen-ueber-dresden-sonnenliege-haengt-in-telefonleitung,0,www.zeit.de,Gewitter: Sturmböen über Dresden: Sonnenliege hängt in Telefonleitung,Hier finden Sie Informationen zu dem Thema „Gewitter“. Lesen Sie jetzt „Sturmböen über Dresden: Sonnenliege hängt in Telefonleitung“.,https://img.zeit.de/news/2024-07/06/sturmboeen-ueber-dresden-sonnenliege-haengt-in-telefonleitung-image-group/wide__1300x731,2024-07-06T20:04:43Z,,Nach Gewitter und Sturmböen über Dresden ist die Feuerwehr zu mehr als einem Dutzend Einsätzen gerufen worden - darunter war auch ein kurioser. Der starke Sturm hatte wohl eine Sonnenliege weggetrage… [+324 chars],,de,'Gewitter'
https://www.zeit.de/news/2024-07/07/ungewoehnlicher-sommer-noch-freie-hotelbetten-am-bodensee,https://www.zeit.de/news/2024-07/07/ungewoehnlicher-sommer-noch-freie-hotelbetten-am-bodensee,0,www.zeit.de,Touri-Flaute am Bodensee: Ungewöhnlicher Sommer: Noch freie Hotelbetten am Bodensee,Hier finden Sie Informationen zu dem Thema „Touri-Flaute am Bodensee“. Lesen Sie jetzt „Ungewöhnlicher Sommer: Noch freie Hotelbetten am Bodensee“.,https://img.zeit.de/news/2024-07/07/ungewoehnlicher-sommer-noch-freie-hotelbetten-am-bodensee-image-group/wide__1300x731,2024-07-07T02:00:39Z,,"Touristen haben dieses Jahr gute Chancen, auch spontan am Bodensee noch ein Zimmer zu bekommen. Wegen der Berichte über Hochwasser und Mücken wurden stellenweise Buchungen storniert, auch Durchreisev… [+3368 chars]",,de,'Winter'
https://www.stern.de/gesellschaft/regional/baden-wuerttemberg/touri-flaute-am-bodensee--ungewoehnlicher-sommer--noch-freie-hotelbetten-am-bodensee-34859688.html,https://www.stern.de/gesellschaft/regional/baden-wuerttemberg/touri-flaute-am-bodensee--ungewoehnlicher-sommer--noch-freie-hotelbetten-am-bodensee-34859688.html,0,www.stern.de,Touri-Flaute am Bodensee: Ungewöhnlicher Sommer: Noch freie Hotelbetten am Bodensee,"Meersburg - Touristen haben dieses Jahr gute Chancen, auch spontan am Bodensee noch ein Zimmer zu bekommen. Wegen der Berichte über Hochwasser und",https://image.stern.de/34859690/t/HT/v1/w1440/r1.7778/-/07--b4tsxqburjv5axw800h600jpeg---7196a0ee5e3ac32f.jpg,2024-07-07T02:00:39Z,,"Nach Hochwasser und Mücken hofft die Tourismusbranche auf weitere Gäste. Kapazitäten gebe es genug.
Touristen haben dieses Jahr gute Chancen, auch spontan am Bodensee noch ein Zimmer zu bekommen. We… [+2812 chars]",,de,'Sommer'
https://www.stern.de/panorama/wetter/unwetter--karten-zeigen--wo-es-heute-gewitter--sturm-und-regen-gibt-34858548.html,https://www.stern.de/panorama/wetter/unwetter--karten-zeigen--wo-es-heute-gewitter--sturm-und-regen-gibt-34858548.html,0,www.stern.de,"Wetter in Deutschland: Karten zeigen, wo es heute Gewitter, Sturm und Regen gibt","Am Sonntag wird das Wetter größtenteils wieder sommerlicher, dafür wird es in einigen Teilen Deutschlands etwas ruppig und ungemütlich. Karten zeigen die Wetterlage.",https://image.stern.de/34858580/t/hH/v3/w1440/r1.7778/-/teaser-unwetter-wetter-sonntag.jpg,2024-07-07T06:24:00Z,,"Am Sonntag wird das Wetter größtenteils wieder sommerlicher, dafür wird es in einigen Teilen Deutschlands etwas ruppig und ungemütlich. Karten zeigen die Wetterlage.
Nachdem am Samstag einige Unwett… [+1990 chars]",,de,'Gewitter'
https://kaernten.orf.at/stories/3264152/,https://kaernten.orf.at/stories/3264152/,0,kaernten.orf.at,Wanderin über Altschneefeld abgerutscht,In den Hohen Tauern ist am Samstag eine 58 Jahre alte Wanderin aus Deutschland verunglückt. Die Frau wollte mit ihrer 20 Jahre alten Tochter zur Fraganter Hütte wandern. Im Bereich des Rotwandecks rutschte die 58-Jährige auf einem Altschneefeld aus und wurde …,https://ibs.orf.at/ktn?image=https%3A%2F%2Foekastatic.orf.at%2Fmojo%2F1_4_1%2Fstoryserver%2Foeka%2Fcommon%2Fimages%2Fog-fallback-ktn.png%3Fs%3Dd1ef40bef2ffd65644b4df37900c0e4d80e97249,2024-07-07T06:59:02Z,,Die Wanderung der beiden Frauen sollte vom Naturfreundehaus Kolm-Saigurn in Salzburg zur Fraganter Hütte in der Gemeinde Flattach (Bezirk Spittal an der Drau) führen. Der Weg führte die beiden über d… [+615 chars],,de,'Schnee'
https://www.diepresse.com/18629819/regen-bringt-in-der-arktis-tod,https://www.diepresse.com/18629819/regen-bringt-in-der-arktis-tod,0,www.diepresse.com,Regen bringt in der Arktis Tod [premium],"Niederschläge, die der Erwärmung wegen nicht als Schnee niedergehen, sondern als Regen in ihn, lassen Tausende Tiere verhungern.",https://img.diepresse.com/public/incoming/1rb9s8-1338378139/alternates/DPR_SOCIAL_MAGAZIN_PAID/1338378139,2024-07-07T09:24:00Z,,"Niederschläge, die der Erwärmung wegen nicht als Schnee niedergehen, sondern als Regen in ihn, lassen Tausende Tiere verhungern.
Nur in extremen Bedingungen der arktischen Region oder an den Grenzen… [+2449 chars]",,de,'Schnee'
https://www.zeit.de/news/2024-07/07/erst-gewitter-und-dann-wieder-sommerlich,https://www.zeit.de/news/2024-07/07/erst-gewitter-und-dann-wieder-sommerlich,0,www.zeit.de,Vorhersage Sachsen: Erst Gewitter - und dann wieder sommerlich,Hier finden Sie Informationen zu dem Thema „Vorhersage Sachsen“. Lesen Sie jetzt „Erst Gewitter - und dann wieder sommerlich“.,https://img.zeit.de/news/2024-07/07/erst-gewitter-und-dann-wieder-sommerlich-image-group/wide__1300x731,2024-07-07T09:40:31Z,,"Der Sommer in Sachsen bleibt wechselhaft. Nachdem am Samstag heftige Gewitter über Teile des Freistaates gezogen sind, sagt der Deutsche Wetterdienst (DWD) nun wieder ein paar sommerliche Tage voraus… [+2017 chars]",,de,'Gewitter'
https://www.zeit.de/news/2024-07/07/woche-startet-mit-sonnigem-sommerwetter-bis-28-grad,https://www.zeit.de/news/2024-07/07/woche-startet-mit-sonnigem-sommerwetter-bis-28-grad,0,www.zeit.de,Vorhersage Berlin/Brandenburg: Woche startet mit sonnigem Sommerwetter - bis 28 Grad,Hier finden Sie Informationen zu dem Thema „Vorhersage Berlin/Brandenburg“. Lesen Sie jetzt „Woche startet mit sonnigem Sommerwetter - bis 28 Grad“.,https://img.zeit.de/news/2024-07/07/woche-startet-mit-sonnigem-sommerwetter-bis-28-grad-image-group/wide__1300x731,2024-07-07T09:42:44Z,,Nach Gewittern und Sturm bringt die neue Woche zunächst ruhiges Sommerwetter in Berlin und Bandenburg. Die Temperaturen liegen am Montag nach der Vorhersage des Deutschen Wetterdienstes (DWD) zwische… [+379 chars],,de,'Gewitter'
https://www.sueddeutsche.de/bayern/bayern-zwetschgen-ernte-erwartungen-imagekampagne-lux.RADdq5LWvhpcPg7obBFx2r,https://www.sueddeutsche.de/bayern/bayern-zwetschgen-ernte-erwartungen-imagekampagne-lux.RADdq5LWvhpcPg7obBFx2r,0,www.sueddeutsche.de,Landwirtschaft in Bayern: Zwetschgen-Ernte beginnt mit durchwachsenen Erwartungen,Bald gibt es ihn wieder zu kaufen: Zwetschgenkuchen. Die Nachfrage nach den blauen Früchten selbst ist jedoch zurückgegangen. Eine Imagekampagne soll das nun ändern.,https://www.sueddeutsche.de/2024/07/07/94df4e6f-f0b2-4331-81a2-40f23cca8ff1.jpeg?q=60&fm=webp&width=1200&rect=0%2C19%2C3000%2C1688,2024-07-07T10:09:33Z,,Erste frühe Sorten haben die Anbauer in Franken bereits geerntet. Von Mitte Juli an wird nach Einschätzung von Zimmermann die Ernte der Hauptsorten beginnen. Diese seien wegen des milden Winters in d… [+1972 chars],,de,'Ernte'
https://www.stern.de/gesellschaft/regional/bayern/landwirtschaft--getreidebauern-hoffen-auf-gute-ernte---aussicht-fuer-obst-mau-34859652.html,https://www.stern.de/gesellschaft/regional/bayern/landwirtschaft--getreidebauern-hoffen-auf-gute-ernte---aussicht-fuer-obst-mau-34859652.html,0,www.stern.de,Landwirtschaft: Getreidebauern hoffen auf gute Ernte - Aussicht für Obst mau,"München (lby) - Gute Getreideernte in Sicht, eine eher schlechte bei den Zwetschgen: Die Aussichten der bayerischen Landwirtschaft sind in diesen Tagen",https://image.stern.de/34860296/t/kG/v1/w1440/r1.7778/-/07--xufcwc3wpuv1axw800h600jpeg---0672ebcdb4dd404e.jpg,2024-07-07T10:25:04Z,,"Die Getreideernte könnte in diesem Jahr gut ausfallen. Weniger hoffnungsvoll sind die Obstbauern.
Gute Getreideernte in Sicht, eine eher schlechte bei den Zwetschgen: Die Aussichten der bayerischen … [+4079 chars]",,de,'Ernte'
https://www.bild.de/regional/bayern/schueler-steckten-im-schnee-fest-raeder-rettung-in-alpen-kostet-4000-euro-668a4fbb18c33d086d7bc0c3,https://www.bild.de/regional/bayern/schueler-steckten-im-schnee-fest-raeder-rettung-in-alpen-kostet-4000-euro-668a4fbb18c33d086d7bc0c3,0,www.bild.de,Schüler stecken am Berg fest - Räder-Rettung in den Alpen kostet 4000 Euro,Bayerische Schüler steckten in den Alpen mit ihren Fahrrädern im Schnee fest. Sie mussten per Hubschrauber gerettet werden. Jetzt wurden ihre Räder geborgen,"https://images.bild.de/668a4fbb18c33d086d7bc0c3/5090e142de056257a35a851f7c81826d,1ba57771?w=1280",2024-07-07T11:21:01Z,,Innsbruck (Österreich) Bayerische Schüler steckten in den Alpen mit ihren Fahrrädern im Schnee fest. Sie mussten per Hubschrauber gerettet werden. Ihre Mountainbikes blieben auf dem Berg zurück und a… [+2399 chars],,de,'Schnee'
https://www.zeit.de/news/2024-07/07/sommerliches-wetter-ab-montag-regen-in-sicht,https://www.zeit.de/news/2024-07/07/sommerliches-wetter-ab-montag-regen-in-sicht,0,www.zeit.de,Wetter: Sommerliches Wetter ab Montag - Regen in Sicht,Hier finden Sie Informationen zu dem Thema „Wetter“. Lesen Sie jetzt „Sommerliches Wetter ab Montag - Regen in Sicht“.,https://img.zeit.de/news/2024-07/07/sommerliches-wetter-ab-montag-regen-in-sicht-image-group/wide__1300x731,2024-07-07T12:45:45Z,,Zum Wochenstart können sich die Menschen im Ländle vielerorts auf sonniges Wetter freuen - doch Regen ist schon wieder in Sicht. Am Montag sollen die Temperaturen auf Höchstwerte bis zu 27 Grad steig… [+731 chars],,de,'Sommer'
https://www.stern.de/gesellschaft/regional/baden-wuerttemberg/landwirtschaft--bauernverband-erwartet-normale-getreideernte-im-suedwesten-34861190.html,https://www.stern.de/gesellschaft/regional/baden-wuerttemberg/landwirtschaft--bauernverband-erwartet-normale-getreideernte-im-suedwesten-34861190.html,0,www.stern.de,Landwirtschaft: Bauernverband erwartet normale Getreideernte im Südwesten,Der Regen der vergangenen Wochen bleibt auch für die Landwirtschaft nicht ohne Folgen. Im Südwesten wird zwar eine weitgehend normale Ernte erwartet. Manchen Feldfrüchten setzt die Nässe aber zu.,https://image.stern.de/34861192/t/FZ/v1/w1440/r1.7778/-/08--ktqlmmquxiv8axw800h600jpeg---c598929cd0c9ae45.jpg,2024-07-08T01:45:36Z,,"Der Regen der vergangenen Wochen bleibt auch für die Landwirtschaft nicht ohne Folgen. Im Südwesten wird zwar eine weitgehend normale Ernte erwartet. Manchen Feldfrüchten setzt die Nässe aber zu.
Tr… [+2486 chars]",,de,'Ernte'
https://www.zeit.de/news/2024-07/08/bauernverband-erwartet-normale-getreideernte-im-suedwesten,https://www.zeit.de/news/2024-07/08/bauernverband-erwartet-normale-getreideernte-im-suedwesten,0,www.zeit.de,Landwirtschaft: Bauernverband erwartet normale Getreideernte im Südwesten,Hier finden Sie Informationen zu dem Thema „Landwirtschaft“. Lesen Sie jetzt „Bauernverband erwartet normale Getreideernte im Südwesten“.,https://img.zeit.de/news/2024-07/08/bauernverband-erwartet-normale-getreideernte-im-suedwesten-image-group/wide__1300x731,2024-07-08T01:45:36Z,,Trotz des Hochwassers im Juni rechnet der Landesbauernverband mit einer weitgehend normalen Getreideernte in Baden-Württemberg. Aktuell gehe man von einer durchschnittlichen bis leicht überdurchschni… [+2954 chars],,de,'Ernte'
https://www.stern.de/kultur/vorschau--tv-tipps-am-montag-34861350.html,https://www.stern.de/kultur/vorschau--tv-tipps-am-montag-34861350.html,0,www.stern.de,Vorschau: TV-Tipps am Montag,"20:15 Uhr, ZDF, Unter anderen Umständen: Dämonen, Krimi
 Jana Winter (Natalia Wörner) wird von Arne Brauner (Martin Brambach) zu einem Fall gerufen: Die Frau und die Tochter von Arnes Schulfreund Axel Schreiber (Johannes Zeiler), einem Kollegen aus dem Husume…",https://image.stern.de/34861354/t/JJ/v1/w1440/r1.7778/-/08--tv-tipps-am-montag---16-9---spoton-article-1069740.jpg,2024-07-08T04:00:00Z,,"20:15 Uhr, ZDF, Unter anderen Umständen: Dämonen, Krimi
Jana Winter (Natalia Wörner) wird von Arne Brauner (Martin Brambach) zu einem Fall gerufen: Die Frau und die Tochter von Arnes Schulfreund Axe… [+2605 chars]",,de,'Winter'
https://www.zeit.de/news/2024-07/08/viel-sonne-zum-wochenstart-ab-mitte-der-woche-wieder-regen,https://www.zeit.de/news/2024-07/08/viel-sonne-zum-wochenstart-ab-mitte-der-woche-wieder-regen,0,www.zeit.de,Sommerwetter: Viel Sonne zum Wochenstart - ab Mitte der Woche wieder Regen,Hier finden Sie Informationen zu dem Thema „Sommerwetter“. Lesen Sie jetzt „Viel Sonne zum Wochenstart - ab Mitte der Woche wieder Regen“.,https://img.zeit.de/news/2024-07/08/viel-sonne-zum-wochenstart-ab-mitte-der-woche-wieder-regen-image-group/wide__1300x731,2024-07-08T04:34:02Z,,"Die Menschen in Hessen sollten sich in der neuen Woche auf hochsommerliche Temperaturen bis 34 Grad einstellen. Zu Beginn der Woche gibt es viel Sonne, die verschwindet gegen Mitte der Woche immer wi… [+693 chars]",,de,'Sommer'
https://www.transfermarkt.de/trickserei-mit-nuamah-transfer-vollendet-olympique-lyon-auf-dem-weg-zu-rekordausgaben/view/news/440311,https://www.transfermarkt.de/trickserei-mit-nuamah-transfer-vollendet-olympique-lyon-auf-dem-weg-zu-rekordausgaben/view/news/440311,0,www.transfermarkt.de,Olympique Lyon: Trickserei mit Transfer von Ernest Nuamah vollendet,"Was im letzten Sommer jeder vermuten konnte, ist nun unter Dach und Fach: Olympique Lyon hat Ernest Nuamah fest verpflichtet und die Transfer-Trickserei mit Partnerklub RWD Molenbeek vollendet. Der...",https://tmssl.akamaized.net/images/foto/big/ernest-nuamah-olympique-lyonnais-2023-24-1696227912-118146.jpg?lm=1696227930,2024-07-08T05:09:30Z,,"Was im letzten Sommer jeder vermuten konnte, ist nun unter Dach und Fach: Olympique Lyon hat Ernest Nuamah fest verpflichtet und die Transfer-Trickserei mit Partnerklub RWD Molenbeek vollendet. Der g… [+2359 chars]",,de,'Sommer'
https://www.zeit.de/news/2024-07/08/sonniger-ferienstart-bis-mitte-der-woche-dann-wieder-regen,https://www.zeit.de/news/2024-07/08/sonniger-ferienstart-bis-mitte-der-woche-dann-wieder-regen,0,www.zeit.de,Sommer: Sonniger Ferienstart bis Mitte der Woche - dann wieder Regen,Hier finden Sie Informationen zu dem Thema „Sommer“. Lesen Sie jetzt „Sonniger Ferienstart bis Mitte der Woche - dann wieder Regen“.,https://img.zeit.de/news/2024-07/08/sonniger-ferienstart-bis-mitte-der-woche-dann-wieder-regen-image-group/wide__1300x731,2024-07-08T05:20:29Z,,Zum Sommerferienstart können sich die Menschen in NRW auf Sonne und Temperaturen bis 32 Grad einstellen - ab Dienstagabend sollen Regen und Gewitter aufziehen. Wie der Deutsche Wetterdienst (DWD) mit… [+646 chars],,de,'Gewitter'
https://www.zeit.de/news/2024-07/08/sommerlich-freundlicher-wochenstart,https://www.zeit.de/news/2024-07/08/sommerlich-freundlicher-wochenstart,0,www.zeit.de,Wetter: Sommerlich freundlicher Wochenstart,Hier finden Sie Informationen zu dem Thema „Wetter“. Lesen Sie jetzt „Sommerlich freundlicher Wochenstart“.,https://img.zeit.de/news/2024-07/08/sommerlich-freundlicher-wochenstart-image-group/wide__1300x731,2024-07-08T05:40:37Z,,Am Anfang der neuen Woche zeigt sich der Sommer in Berlin und Brandenburg von seiner besten Seite: Einen warmen und heiteren Montag erwartet der Deutsche Wetterdienst. Ein paar Wolken stehen am Himme… [+908 chars],,de,'Gewitter'
https://www.zeit.de/news/2024-07/08/neue-woche-erst-sonnig-ab-mittwoch-dann-regenwolken,https://www.zeit.de/news/2024-07/08/neue-woche-erst-sonnig-ab-mittwoch-dann-regenwolken,0,www.zeit.de,Sommerwetter: Neue Woche erst sonnig - ab Mittwoch dann Regenwolken,Hier finden Sie Informationen zu dem Thema „Sommerwetter“. Lesen Sie jetzt „Neue Woche erst sonnig - ab Mittwoch dann Regenwolken“.,https://img.zeit.de/news/2024-07/08/neue-woche-erst-sonnig-ab-mittwoch-dann-regenwolken-image-group/wide__1300x731,2024-07-08T06:13:02Z,,"Die Menschen in Rheinland-Pfalz und im Saarland sollten sich in der neuen Woche auf hochsommerliche Temperaturen bis 34 Grad einstellen. Zu Beginn der Woche gibt es viel Sonne, die verschwindet gegen… [+848 chars]",,de,'Gewitter'
https://www.zeit.de/news/2024-07/08/hochsommerliche-temperaturen-in-baden-wuerttemberg-erwartet,https://www.zeit.de/news/2024-07/08/hochsommerliche-temperaturen-in-baden-wuerttemberg-erwartet,0,www.zeit.de,Wetter: Hochsommerliche Temperaturen in Baden-Württemberg erwartet,Hier finden Sie Informationen zu dem Thema „Wetter“. Lesen Sie jetzt „Hochsommerliche Temperaturen in Baden-Württemberg erwartet“.,https://img.zeit.de/news/2024-07/08/hochsommerliche-temperaturen-in-baden-wuerttemberg-erwartet-image-group/wide__1300x731,2024-07-08T06:59:57Z,,"Bis Mitte der Woche können sich die Menschen in Baden-Württemberg auf freundlicheres Wetter freuen. In den kommenden Tagen bleibt es größtenteils trocken, wie der Deutsche Wetterdienst mitteilte. 
H… [+1529 chars]",,de,'Sommer'
https://www.focus.de/wissen/bauernregel-hundstage-verraten-es-wann-wird-es-diesen-sommer-richtig-heiss_id_260026181.html,https://www.focus.de/wissen/bauernregel-hundstage-verraten-es-wann-wird-es-diesen-sommer-richtig-heiss_id_260026181.html,0,www.focus.de,Bauernregel - Hundstage verraten es: Wann wird es diesen Sommer richtig heiß?,"Die Hundstage 2024 stehen vor der Tür. Doch was steckt eigentlich hinter dieser Redewendung? Mit Hunden hat das Wetterphänomen wenig zu tun. Lesen Sie hier, wann die Hundstage starten und was sie bedeuten.Von FOCUS-online-Autorin Kira Welling",https://p6.focus.de/img/fotos/id_260026233/wetter.jpg?im=Crop%3D%280%2C177%2C2121%2C1060%29%3BResize%3D%281200%2C627%29&impolicy=perceptual&quality=mediumHigh&hash=6502d73de737f166efe569eed683fb7e9f3dd6b0a51f63843346a9bf5b9f563c,2024-07-08T07:39:18Z,,"Die Hundstage 2024 stehen vor der Tür. Doch was steckt eigentlich hinter dieser Redewendung? Lesen Sie hier, wann die Hundstage starten und was sie bedeuten.Im Allgemeinen wird der Begriff Hundstage,… [+2609 chars]",,de,'Ernte'
