index,url,valid,domain,title,description,image,published,archive,content,quote,language,keyword
https://www.focus.de/earth/themenschwerpunkt-regenerative-landwirtschaft-experte-kartoffel-leidet-massiv-unter-dem-klimawandel_id_189569491.html,https://www.focus.de/earth/themenschwerpunkt-regenerative-landwirtschaft-experte-kartoffel-leidet-massiv-unter-dem-klimawandel_id_189569491.html,0,www.focus.de,„Sie leidet massiv“ - Pommes in Gefahr: Die Deutschen müssen die Kartoffel neu denken,"Das Lieblingsgemüse der Deutschen ist in Gefahr: Der Klimawandel setzt der Kartoffel zu. Dürre, Hitze und Überflutungen gefährden die Pflanze und die Ernte der Bauern. Um sich dem Klimawandel anzupassen, muss die Kartoffel neu gedacht werden.Von FOCUS-online-…",https://p6.focus.de/img/fotos/id_189641886/kartoffel-pommes-ciao.jpg?im=Crop%3D%2872%2C0%2C830%2C415%29%3BResize%3D%281200%2C627%29&impolicy=perceptual&quality=mediumHigh&hash=f1cb7a50464d0aab9b110f0da0cfcd9257889d8a63d5e5f1d79f1b0147ff4661,2024-09-13T12:34:28Z,https://web.archive.org/web/20240913132621/https://www.focus.de/earth/themenschwerpunkt-regenerative-landwirtschaft-experte-kartoffel-leidet-massiv-unter-dem-klimawandel_id_189569491.html,"Das Lieblingsgemüse der Deutschen ist in Gefahr: Der Klimawandel setzt der Kartoffel zu. Dürre, Hitze und Überflutungen gefährden die Pflanze und die Ernte der Landwirte. Um sich dem Klimawandel anzu… [+8631 chars]",,de,'Ernte'
https://www.sueddeutsche.de/muenchen/muenchen-u-bahnhof-max-weber-platz-vergewaltigung-polen-tourist-prozessauftakt-lux.hCmaPjWx2SUe53NyW6hdw,https://www.sueddeutsche.de/muenchen/muenchen-u-bahnhof-max-weber-platz-vergewaltigung-polen-tourist-prozessauftakt-lux.hCmaPjWx2SUe53NyW6hdw,0,www.sueddeutsche.de,Landgericht München I: Mutmaßlicher Vergewaltiger schweigt zum Prozessauftakt,Der heute 21-Jährige soll im vergangenen Sommer in einer U-Bahn-Station einen Touristen aus Polen vergewaltigt haben. Die polnische Regierung bestellte damals den deutschen Botschafter ein und warf Deutschland eine falsche Asylpolitik vor.,https://www.sueddeutsche.de/2024/09/13/d9024f4e-2204-4c61-b266-39d9e485490e.jpeg?q=60&fm=webp&width=1200&rect=0%2C151%2C3000%2C1688,2024-09-13T12:37:31Z,https://web.archive.org/web/20240913135217/https://www.sueddeutsche.de/muenchen/muenchen-u-bahnhof-max-weber-platz-vergewaltigung-polen-tourist-prozessauftakt-lux.hCmaPjWx2SUe53NyW6hdw,"Der deutsche Botschafter wurde einbestellt, die polnische Regierung wollte eigene Staatsanwälte in München ermitteln lassen. Nun hat vor dem Landgericht München I der Prozess gegen den vermuteten Ver… [+2943 chars]",,de,'Sommer'
https://www.diepresse.com/18859016/windhosen-und-schnee-zyklon-boris-beendet-sommer-an-der-adria-schlagartig,https://www.diepresse.com/18859016/windhosen-und-schnee-zyklon-boris-beendet-sommer-an-der-adria-schlagartig,0,www.diepresse.com,Windhosen und Schnee: Zyklon „Boris“ beendet Sommer an der Adria schlagartig,"Vor allem in Kroatien rechnen die Katastrophenschützer mit Starkregen, heftigem Wind und sogar Sturzfluten. Österreichs Nachbarländer im Osten bereiten sich auf Hochwasser vor.",https://img.diepresse.com/public/incoming/q9jj42-imago-images-0760758141/alternates/DPR_SOCIAL_NACHRICHTEN/imago%20images%200760758141,2024-09-13T12:41:08Z,https://web.archive.org/web/20240913140829/https://www.diepresse.com/18859016/windhosen-und-schnee-zyklon-boris-beendet-sommer-an-der-adria-schlagartig,"Vor allem in Kroatien rechnen die Katastrophenschützer mit Starkregen, heftigem Wind und sogar Sturzfluten. Österreichs Nachbarländer im Osten bereiten sich auf Hochwasser vor.
Der vorhergesagte Zyk… [+5778 chars]",,de,'Hochwasser'
https://www.kicker.de/walters-lockruf-widerstanden-meffert-verlaengert-beim-hsv-1050930/artikel,https://www.kicker.de/walters-lockruf-widerstanden-meffert-verlaengert-beim-hsv-1050930/artikel,0,www.kicker.de,Walters Lockruf widerstanden: Meffert verlängert beim HSV,Nach drei gemeinsamen Jahren drohten sich die Wege von Jonas Meffert und dem Hamburger SV in diesem Sommer zu trennen. Doch der Kapitän blieb den Rothosen treu - und verlängerte nun seinen auslaufenden Vertrag.,https://derivates.kicker.de/image/upload/c_crop%2Cx_0%2Cy_330%2Cw_4000%2Ch_2250/w_1200%2Cq_auto/v1/2024/09/13/3cca63c9-9fb2-41b6-a146-b29fb770f826.jpeg,2024-09-13T12:41:57Z,https://web.archive.org/web/20240913130806/https://www.kicker.de/walters-lockruf-widerstanden-meffert-verlaengert-beim-hsv-1050930/artikel,Nach drei gemeinsamen Jahren drohten sich die Wege von Jonas Meffert und dem Hamburger SV in diesem Sommer zu trennen. Doch der Kapitän blieb den Rothosen treu - und verlängerte nun seinen auslaufend… [+3143 chars],,de,'Sommer'
https://www.sueddeutsche.de/wissen/regenfaelle-hochwassergefahr-sueddeutschland-sachsen-lux.4ToPgZSjMGpZkUMEV1UCpf,https://www.sueddeutsche.de/wissen/regenfaelle-hochwassergefahr-sueddeutschland-sachsen-lux.4ToPgZSjMGpZkUMEV1UCpf,0,www.sueddeutsche.de,Wetter: Wie es zu dem Dauerregen kommt,"Vb-Tief „Anett“ bringt in den kommenden Tagen im Süden Bayerns und in Sachsen unwetterartige Niederschläge, viel Schnee und Hochwassergefahr. Wie Meteorologen die Lage erklären.",https://www.sueddeutsche.de/2024/09/13/42a6829f-5843-46e3-9da6-bed79e970cbf.jpeg?q=60&fm=webp&width=1200&rect=0%2C311%2C3000%2C1688,2024-09-13T12:48:53Z,http://archive.md/20240913131236/https://www.sueddeutsche.de/wissen/regenfaelle-hochwassergefahr-sueddeutschland-sachsen-lux.4ToPgZSjMGpZkUMEV1UCpf,"Das Muster ist dabei relativ typisch: Es beginnt damit, dass sich aktuell ein Höhentrog, also eine Tiefdruckzone in großer Höhe, über West- und Mitteleuropa befindet. An seinem Rand strömt die Luft e… [+3311 chars]",,de,'Hochwasser'
https://www.brigitte.de/aktuell/lina-larissa-strahl--diese-menschen-sind-ihre-wichtigste-energiequelle-13873318.html,https://www.brigitte.de/aktuell/lina-larissa-strahl--diese-menschen-sind-ihre-wichtigste-energiequelle-13873318.html,0,www.brigitte.de,Lina Larissa Strahl: Diese Menschen sind ihre wichtigste Energiequelle,"Lina Larissa Strahl lädt ihre Energie nicht nur im Urlaub auf. Hier verrät die Künstlerin, was ihr im Alltag Kraft schenkt.",https://image.brigitte.de/13873320/t/ig/v1/w1440/r1.7778/-/13--diese-menschen-sind-ihre-wichtigste-energiequelle---1-1---spoton-article-1075103.jpg,2024-09-13T12:55:00Z,https://web.archive.org/web/20240913134035/https://www.brigitte.de/aktuell/lina-larissa-strahl--diese-menschen-sind-ihre-wichtigste-energiequelle-13873318.html,"Lina Larissa Strahl lädt ihre Energie nicht nur im Urlaub auf. Hier verrät die Künstlerin, was ihr im Alltag Kraft schenkt.
Freunde und Familie sind die wichtigste Energiequelle für Lina Larissa Str… [+6192 chars]",,de,'Laub'
https://www.stern.de/lifestyle/leute/lina-larissa-strahl--das-sind-ihre-wichtigsten-energiequellen-35062322.html,https://www.stern.de/lifestyle/leute/lina-larissa-strahl--das-sind-ihre-wichtigsten-energiequellen-35062322.html,0,www.stern.de,Lina Larissa Strahl: Das sind ihre wichtigsten Energiequellen,"Lina Larissa Strahl lädt ihre Energie nicht nur im Urlaub auf. Hier verrät die Künstlerin, was ihr im Alltag Kraft schenkt.",https://image.stern.de/35062326/t/YZ/v1/w1440/r1.7778/-/13--das-sind-ihre-wichtigsten-energiequellen---16-9---spoton-article-1075103.jpg,2024-09-13T12:58:00Z,https://web.archive.org/web/20240913132655/https://www.stern.de/lifestyle/leute/lina-larissa-strahl--das-sind-ihre-wichtigsten-energiequellen-35062322.html,"Lina Larissa Strahl lädt ihre Energie nicht nur im Urlaub auf. Hier verrät die Künstlerin, was ihr im Alltag Kraft schenkt.
Freunde und Familie sind die wichtigste Energiequelle für Lina Larissa Str… [+6200 chars]",,de,'Laub'
https://www.transfermarkt.de/rakitic-im-interview-ich-hatte-gern-noch-mal-mit-manuel-neuer-gespielt-quot-/view/news/443761,https://www.transfermarkt.de/rakitic-im-interview-ich-hatte-gern-noch-mal-mit-manuel-neuer-gespielt-quot-/view/news/443761,0,www.transfermarkt.de,Rakitic im Interview: „Ich hätte gern noch mal mit Manuel Neuer gespielt“,"Bei Ivan Rakitic ist auch mit 36 Jahren noch kein Ende in Sicht. Der Mittelfeldspieler wechselte in diesem Sommer zu Hajduk Split und damit erstmals nach Kroatien, für das er 106...",https://tmssl.akamaized.net/images/foto/big/ivan-rakitic-schalke-2008-1726144567-147877.jpg?lm=1726144599,2024-09-13T13:00:00Z,https://web.archive.org/web/20240913131011/https://www.transfermarkt.de/rakitic-im-interview-ich-hatte-gern-noch-mal-mit-manuel-neuer-gespielt-quot-/view/news/443761,"Seit Sommer bei Hajduk Split 
Bei Ivan Rakitic ist auch mit 36 Jahren noch kein Ende in Sicht. Der Mittelfeldspieler wechselte in diesem Sommer zu Hajduk Split und damit erstmals nach Kroatien, für … [+11954 chars]",,de,'Sommer'
https://www.kicker.de/die-neue-dynamik-mit-pc-stroot-erklaert-seine-rolle-rueckwaerts-1050933/artikel,https://www.kicker.de/die-neue-dynamik-mit-pc-stroot-erklaert-seine-rolle-rueckwaerts-1050933/artikel,0,www.kicker.de,"Die neue Dynamik mit ""PC"": Stroot erklärt seine Rolle rückwärts",Eigentlich war alles klar: Tommy Stroot verlässt den VfL Wolfsburg im Sommer 2025 und wird zukünftig im Ausland arbeiten. Jetzt hat der Fußballlehrer eine Kehrtwende vollzogen. Und die hängt auch mit dem neuen VfL-Geschäftsführer zusammen.,https://derivates.kicker.de/image/upload/w_4000%2Ch_2250%2Cc_fill%2Cg_auto:subject/w_1200%2Cq_auto/v1/2024/09/13/d69f9744-f43c-45ae-9238-8274f496adee.jpeg,2024-09-13T13:04:47Z,https://web.archive.org/web/20240913181125/https://www.kicker.de/die-neue-dynamik-mit-pc-stroot-erklaert-seine-rolle-rueckwaerts-1050933/artikel,Eigentlich war alles klar: Tommy Stroot verlässt den VfL Wolfsburg im Sommer 2025 und wird zukünftig im Ausland arbeiten. Jetzt hat der Fußballlehrer eine Kehrtwende vollzogen. Und die hängt auch mit… [+4502 chars],,de,'Sommer'
https://www.stern.de/gesellschaft/regional/hessen/apfelwein--verband-verkuendet-beginn-der-hessischen-keltersaison-35062434.html,https://www.stern.de/gesellschaft/regional/hessen/apfelwein--verband-verkuendet-beginn-der-hessischen-keltersaison-35062434.html,0,www.stern.de,Apfelwein: Verband verkündet Beginn der hessischen Keltersaison,In Hessen heißt es: Äpfel ernten. Laut dem Verband der Hessischen Apfelwein- und Fruchtsaft-Keltereien hat die diesjährige Keltersaison begonnen. Man rechnet mit einer unterdurchschnittlichen Ernte.,https://image.stern.de/35062436/t/wr/v1/w1440/r1.7778/-/13--3btp2cu4agv10axw800h600jpeg---16b7e6f26e9e5c2a.jpg,2024-09-13T13:20:38Z,https://web.archive.org/web/20240913133941/https://www.stern.de/gesellschaft/regional/hessen/apfelwein--verband-verkuendet-beginn-der-hessischen-keltersaison-35062434.html,In Hessen heißt es: Äpfel ernten. Laut dem Verband der Hessischen Apfelwein- und Fruchtsaft-Keltereien hat die diesjährige Keltersaison begonnen. Man rechnet mit einer unterdurchschnittlichen Ernte.,,,
https://www.bild.de/regional/berlin/1-monat-fahrverbot-fuer-ein-menschenleben-todesfahrer-geht-in-berufung-66e2e86e41a2b933ba807e9d,https://www.bild.de/regional/berlin/1-monat-fahrverbot-fuer-ein-menschenleben-todesfahrer-geht-in-berufung-66e2e86e41a2b933ba807e9d,0,www.bild.de,Todesfahrer geht in Berufung - Ein Monat Fahrverbot für ein Menschenleben,Matthias T. wurde im Sommer 2022 in Berlin beim Radfahren getötet. Der Lkw-Fahrer bekam ein Monat Fahrverbot – und legte gegen das Urteil Berufung ein.,"https://images.bild.de/66e2e86e41a2b933ba807e9d/a15394899229e25009ed818c891d9ed8,dc7c8e95?w=1280",2024-09-13T13:39:51Z,https://web.archive.org/web/20240913140327/https://www.bild.de/regional/berlin/1-monat-fahrverbot-fuer-ein-menschenleben-todesfahrer-geht-in-berufung-66e2e86e41a2b933ba807e9d,"Berlin Die Bilder drängen sich Petra T. (52) immer wieder auf: Der Lkw erfasst ihren Mann Matthias (56). Die linken Vorderräder und Hinterräder überrollen ihn. Sie glaubt, seinen Todesschmerz zu spür… [+3962 chars]",,de,'Sommer'
https://www.sueddeutsche.de/panorama/hochwasser-aktuell-unwetterwarnung-deutschland-bayern-oesterreich-tschechien-elbe-lux.4cJAzo8kYHAcsTYFUVmjuE,https://www.sueddeutsche.de/panorama/hochwasser-aktuell-unwetterwarnung-deutschland-bayern-oesterreich-tschechien-elbe-lux.4cJAzo8kYHAcsTYFUVmjuE,0,www.sueddeutsche.de,Unwetter: Tagelanges Hochwasser an der Elbe erwartet,Teile Mittel- und Osteuropas wappnen sich für Dauerregen und Hochwasser. Warnungen gibt es auch für Bayern und Sachsen. In den Alpen warnen Experten vor viel Schnee.,https://www.sueddeutsche.de/2024/09/13/8b8a72c9-67a8-4c32-93bd-05af366d4dd7.jpeg?q=60&fm=webp&width=1200&rect=0%2C184%2C3000%2C1688,2024-09-13T13:55:58Z,https://web.archive.org/web/20240913152405/https://www.sueddeutsche.de/panorama/hochwasser-aktuell-unwetterwarnung-deutschland-bayern-oesterreich-tschechien-elbe-lux.4cJAzo8kYHAcsTYFUVmjuE,"Meteorologen blicken besorgt auf das Wetter der kommenden Tage. Der Deutsche Wetterdienst (DWD) sagt ""eine bis Sonntagfrüh anhaltende Dauerregensituation am Alpenrand"" mit teils Unwettern voraus, ver… [+1282 chars]",,de,'Hochwasser'
https://orf.at/stories/3369538/,https://orf.at/stories/3369538/,0,orf.at,Simbabwe will wegen Dürre 200 Elefanten töten,,https://orf.at/mojo/1_4_1/storyserver//news/common/images/og-fallback-news.png,2024-09-13T18:44:36Z,https://web.archive.org/web/20240913215448/https://orf.at/stories/3369538/,Simbabwe will angesichts einer beispiellosen Dürre und damit einhergehenden Lebensmittelengpässen 200 Elefanten töten. Zugleich handle es sich um eine Maßnahme gegen die stark wachsende Elefantenpopu… [+964 chars],,de,'Dürre'
https://www.diepresse.com/18860444/simbabwe-will-wegen-duerre-200-elefanten-toeten,https://www.diepresse.com/18860444/simbabwe-will-wegen-duerre-200-elefanten-toeten,0,www.diepresse.com,Simbabwe will wegen Dürre 200 Elefanten töten,Die Maßnahme soll sowohl Lebensmittelengpässen als auch einer stark wachsenden Population der Tiere entgegenwirken. Insgesamt leben rund 100.000 Elefanten in dem Land im Süden Afrikas.,https://img.diepresse.com/public/incoming/6242ho-NAMIBIA-DROUGHTCULLING/alternates/DPR_SOCIAL_NACHRICHTEN/NAMIBIA-DROUGHTCULLING,2024-09-13T19:18:24Z,https://web.archive.org/web/20240913213332/https://www.diepresse.com/18860444/simbabwe-will-wegen-duerre-200-elefanten-toeten,"Die Maßnahme soll sowohl Lebensmittelengpässen als auch einer stark wachsenden Population der Tiere entgegenwirken. Insgesamt leben rund 100.000 Elefanten in dem Land im Süden Afrikas.
Simbabwe will… [+1677 chars]",,de,'Dürre'
https://www.tagesschau.de/ausland/europa/wetter-warnungen-102.html,https://www.tagesschau.de/ausland/europa/wetter-warnungen-102.html,0,www.tagesschau.de,Unwetter: Erste Dörfer wegen Hochwassers evakuiert,"In Polen, Tschechien und Österreich bereiten sich die Menschen auf starkes Hochwasser vor. Erste Dörfer wurden evakuiert. Auch in Süd- und Ostdeutschland warnen Experten vor Starkregen und Überschwemmungen.",https://images.tagesschau.de/image/41cd60fe-9f6c-4002-a190-88c567bccae0/AAABke8Luh4/AAABkZLhkrw/16x9-1280/unwetter-tschechien-100.jpg,2024-09-14T06:27:34Z,,"Stand: 14.09.2024 08:27 Uhr
In Polen, Tschechien und Österreich bereiten sich die Menschen auf starkes Hochwasser vor. Erste Dörfer wurden evakuiert. Auch in Süd- und Ostdeutschland warnen Experten … [+5729 chars]",,de,'Schnee'
https://www.faz.net/aktuell/wissen/erde-klima/unwetter-schnee-im-september-19981956.html,https://www.faz.net/aktuell/wissen/erde-klima/unwetter-schnee-im-september-19981956.html,0,www.faz.net,Woher der viele Regen kommt und woher der frühe Schnee,Eine spezielle Unwetterlage sorgt in Osteuropa und den Alpen für extreme Niederschläge. Die Ursache ist ausgerechnet am warmen Mittelmeer zu finden.,https://media0.faz.net/ppmedia/aktuell/gesellschaft/3683978211/1.9981952/facebook_teaser_fplus/in-den-alpen-hat-es-in-diesem.jpg,2024-09-14T06:33:05Z,https://web.archive.org/web/20240914110232/https://www.faz.net/aktuell/wissen/erde-klima/unwetter-schnee-im-september-19981956.html,"Im September sollte sich der Sommer eigentlich langsam verabschieden. Ein paar goldene Tage noch, dann darf es langsam herbstlich werden. Aber in diesem Jahr gibt es keinen gemächlichen Jahreszeitenw… [+427 chars]",,de,'Winter'
https://www.welt.de/vermischtes/katastrophen/article253511116/Dauerregen-in-Mitteleuropa-Hochwasser-Alarm-in-Tschechien-Polen-evakuiert-Doerfer.html,https://www.welt.de/vermischtes/katastrophen/article253511116/Dauerregen-in-Mitteleuropa-Hochwasser-Alarm-in-Tschechien-Polen-evakuiert-Doerfer.html,0,www.welt.de,Hochwasser-Alarm in Tschechien – Polen evakuiert Dörfer,"Es regnet ohne Unterlass: Im Südosten des Landes sowie in Tschechien, Polen und Österreich steigen angesichts der Wassermassen die Flusspegel, Bäume stürzen wegen durchnässter Böden um. In Dresden gerät die Feuerwehr an der zerstörten Carolabrücke in Zeitnot.",https://img.welt.de/img/bildergalerien/mobile253511064/2137938477-ci16x9-w1200/Vorbereitung-auf-Hochwasser-in-Tschechien.jpg,2024-09-14T07:22:14Z,https://web.archive.org/web/20240914073054/https://www.welt.de/vermischtes/katastrophen/article253511116/Dauerregen-in-Mitteleuropa-Hochwasser-Alarm-in-Tschechien-Polen-evakuiert-Doerfer.html,In Deutschlands östlichen Nachbarländern Polen und Tschechien ist es nach Dauerregen in der Nacht zu Überschwemmungen gekommen. In Tschechen waren 60.000 Haushalte ohne Strom. Bereits am Freitag hatt… [+6654 chars],,de,'Schnee'
https://www.welt.de/vermischtes/katastrophen/article253511116/Dauerregen-in-Mitteleuropa-Hochwasser-Alarm-in-Bayern-Fuenf-Tote-in-Rumaenien.html,https://www.welt.de/vermischtes/katastrophen/article253511116/Dauerregen-in-Mitteleuropa-Hochwasser-Alarm-in-Bayern-Fuenf-Tote-in-Rumaenien.html,0,www.welt.de,Fünf Tote in Rumänien – Hochwasser-Alarm in Bayern,"Es regnet ohne Unterlass: Im Südosten des Landes sowie in Tschechien, Polen, Rumänien und Österreich steigen angesichts der Wassermassen die Flusspegel. Bäume stürzen wegen durchnässter Böden um. In Passau beginnen die Einsatzkräfte, Sandsäcke aufzutürmen.",https://img.welt.de/img/vermischtes/katastrophen/mobile253511774/3357936287-ci16x9-w1200/Hochwasser-in-Rumaenien.jpg,2024-09-14T09:29:00Z,https://web.archive.org/web/20240914102448/https://www.welt.de/vermischtes/katastrophen/article253511116/Dauerregen-in-Mitteleuropa-Hochwasser-Alarm-in-Bayern-Fuenf-Tote-in-Rumaenien.html,"Es regnet ohne Unterlass: Im Südosten des Landes sowie in Tschechien, Polen, Rumänien und Österreich steigen angesichts der Wassermassen die Flusspegel. Bäume stürzen wegen durchnässter Böden um. In … [+8480 chars]",,de,'Schnee'
https://www.focus.de/panorama/wetter-im-ticker-anspannung-im-sueden-erste-ueberschwemmungen-lage-koennte-sich-verschaerfen_id_260311411.html,https://www.focus.de/panorama/wetter-im-ticker-anspannung-im-sueden-erste-ueberschwemmungen-lage-koennte-sich-verschaerfen_id_260311411.html,0,www.focus.de,"Wetter im Ticker - Anspannung im Süden, erste Überschwemmungen - Lage könnte sich verschärfen",Starkregen sorgt in Osteuropa und dem östlichen Teil Deutschlands für Hochwasser-Gefahr und Überschwemmungen. In Rumänien sterben vier Menschen und auch in Deutschland verschärft sich die Wetterlage immer mehr. Alle News in unserem Ticker.,https://p6.focus.de/img/fotos/id_260311346/5fb25c00b62e92eb.jpg?im=Crop%3D%280%2C0%2C3464%2C1732%29%3BResize%3D%281200%2C627%29&impolicy=perceptual&quality=mediumHigh&hash=dba4f9d8b219cb9648f32be729fad132192cff3fbfc27b27553615746a635a8d,2024-09-14T14:30:56Z,https://web.archive.org/web/20240914154010/https://www.focus.de/panorama/wetter-im-ticker-anspannung-im-sueden-erste-ueberschwemmungen-lage-koennte-sich-verschaerfen_id_260311411.html,"Anspannung im Süden, erste Überschwemmungen - Lage könnte sich verschärfen
12.26 Uhr: Anhaltender Regen sorgt in Deutschland für eine angespannte Lage. Anders als in Tschechien, Polen und Österreich… [+5141 chars]",,de,'Hochwasser'
https://www.stern.de/news/pegelstaende-in-sachsen-und-bayern-steigen---hochwasser-aber-noch-moderat-35064256.html,https://www.stern.de/news/pegelstaende-in-sachsen-und-bayern-steigen---hochwasser-aber-noch-moderat-35064256.html,0,www.stern.de,Pegelstände in Sachsen und Bayern steigen - Hochwasser aber noch moderat,"Angesichts heftiger Regenfälle im Südosten Deutschlands sowie vor allem in den Nachbarländern Tschechien und Österreich sind die Pegelstände von Elbe, Donau und weiteren Flüssen am Samstag deutlich gestiegen. Die Hochwasserlage wurde in Deutschland aber gener…",https://image.stern.de/35064258/t/6n/v1/w1440/r1.7778/-/14--fruehere-ueberschwemmung-in-passau---54a23832b9e2ee9d.jpg,2024-09-14T14:35:21Z,https://web.archive.org/web/20240914150824/https://www.stern.de/news/pegelstaende-in-sachsen-und-bayern-steigen---hochwasser-aber-noch-moderat-35064256.html,"Angesichts heftiger Regenfälle im Südosten Deutschlands sowie vor allem in den Nachbarländern Tschechien und Österreich sind die Pegelstände von Elbe, Donau und weiteren Flüssen am Samstag deutlich g… [+3294 chars]",,de,'Schnee'
https://salzburg.orf.at/stories/3273074/,https://salzburg.orf.at/stories/3273074/,0,salzburg.orf.at,Erhöhte Lawinengefahr,Auf Salzburgs Bergen herrscht erhöhte Lawinengefahr. Die Salzburger Bergrettung warnt davor eine Skitour zu gehen oder vor Wanderungen im Neuschnee im Hochgebirge.,https://ibs.orf.at/sbg?image=https%3A%2F%2Foekastatic.orf.at%2Fmims%2F2023%2F48%2F96%2Fcrops%2Fw%3D1200%2Ch%3D627%2Cq%3D75%2F2027736_master_764396_skitour.jpg%3Fs%3D9a3699957c648079cfbc8754d6f687ff7d43cfa8,2024-09-14T15:11:52Z,https://web.archive.org/web/20240914165246/https://salzburg.orf.at/stories/3273074/,"Neben dem Starkregen hat sich auch der Schnee in Salzburg festgesetzt zumindest auf den Bergen: und dort ist Vorsicht geboten, warnt die Bergrettung. Wir raten dringend von Skitouren und Wanderungen … [+1321 chars]",,de,'Schnee'
https://www.zeit.de/2024/37/pilzesammeln-wald-natur-waldpilze-kochen,https://www.zeit.de/2024/37/pilzesammeln-wald-natur-waldpilze-kochen,0,www.zeit.de,"Pilzesammeln: Wer Pilze sucht, findet Geschichten","Die Äste knacken, das Laub raschelt, und dann entdeckst du einen Pfifferling.  Es gibt nichts Schöneres, schreibt die Hamburger Schriftstellerin Nefeli Kavouras.",https://img.zeit.de/2024/37/pilzesammeln-wald-natur-waldpilze-kochen-teaser/wide__1300x731,2024-09-14T15:29:51Z,,Vor einigen Jahren begannen viele Kinder und Jugendliche plötzlich aufmerksamer durch die Welt zu gehen. Das erfüllte mich mit Sorge. Sie spielten Pokémon Go und scannten mit ihren Handykameras die U… [+615 chars],,de,'Laub'
https://www.faz.net/aktuell/gesellschaft/ungluecke/hochwassergefahr-im-osten-von-sachsen-und-brandenburg-19984166.html,https://www.faz.net/aktuell/gesellschaft/ungluecke/hochwassergefahr-im-osten-von-sachsen-und-brandenburg-19984166.html,0,www.faz.net,Hochwassergefahr im Osten von Sachsen und Brandenburg,Bei Überschwemmungen in Rumänien sterben mindestens vier Menschen. Krakau kämpft mit Überschwemmungen. Österreich erklärt Dutzende Gemeinden zum Katastrophengebiet. Auch Sachsen und Brandenburg wappnen sich für den Ernstfall.,https://media0.faz.net/ppmedia/aktuell/gesellschaft/4188099253/1.9984940/facebook_teaser/dietmar-woidke-spd-l.jpg,2024-09-14T17:25:21Z,https://web.archive.org/web/20240914175530/https://www.faz.net/aktuell/gesellschaft/ungluecke/hochwassergefahr-im-osten-von-sachsen-und-brandenburg-19984166.html,Die heftigen Niederschläge östlich von Elbe und Spree lassen voraussichtlich auch die Wasserstände der Elbe anschwellen. Am Samstagnachmittag wurde am Pegel Schöna in Sachsen die Alarmstufe 1 erreich… [+8014 chars],,de,'Schnee'
https://orf.at/stories/3369606/,https://orf.at/stories/3369606/,0,orf.at,Pegel im Waldviertel steigen „massiv“,"Die Hochwasserlage in Niederösterreich hat sich in den Abendstunden teils stark zugespitzt.  „Besonders in Waldviertel sind derzeit massive Anstiege der Flüsse zu verzeichnen, vereinzelt bereits in Größenordnung eines hundertjährlichen Hochwasserereignisses“,…",https://ibs.orf.at/news?image=https%3A%2F%2Fassets.orf.at%2Fmims%2F2024%2F37%2F58%2Fcrops%2Fw%3D1200%2Ch%3D630%2Cq%3D75%2F2350396_master_896058_wetter_hochwasser_saab_a.jpg%3Fs%3D07f85b456c399a59df0c74dadfbba0beaba7662c,2024-09-14T17:43:09Z,https://web.archive.org/web/20240914182738/https://orf.at/stories/3369606/,In Niederösterreich sind am Samstag mehrere Gemeinden zum Katastrophengebiet erklärt worden. Auch am Kamp müsse mit solch einem Ausmaß gerechnet werden. Evakuierungen waren im Gange. Rund 4.750 Feuer… [+8151 chars],,de,'Schnee'
https://www.diepresse.com/18862330/hochwasser-sturm-katastrophenalarm-in-niederoesterreich,https://www.diepresse.com/18862330/hochwasser-sturm-katastrophenalarm-in-niederoesterreich,0,www.diepresse.com,"Hochwasser, Sturm: Katastrophenalarm in Niederösterreich","Regen, Sturm, Schnee machen fast dem ganzen Land zu schaffen. Lokal gibt es bereits Überschwemmungen, Teile Niederösterreichs sind zum Katastrophengebiet erklärt worden. Die Einsatzkräfte sind im Dauereinsatz.",https://img.diepresse.com/public/incoming/igf92i-AUSTRIA-WEATHER-FLOODING/alternates/DPR_SOCIAL_NACHRICHTEN/AUSTRIA-WEATHER-FLOODING,2024-09-14T17:59:38Z,https://web.archive.org/web/20240914193102/https://www.diepresse.com/18862330/hochwasser-sturm-katastrophenalarm-in-niederoesterreich,"Regen, Sturm, Schnee machen fast dem ganzen Land zu schaffen. Lokal gibt es bereits Überschwemmungen, Teile Niederösterreichs sind zum Katastrophengebiet erklärt worden. Die Einsatzkräfte sind im Dau… [+5505 chars]",,de,'Hochwasser'
