index,url,valid,domain,title,description,image,published,archive,content,quote,language,keyword
https://www.focus.de/wissen/natur/fruehblueher-5-beliebte-pflanzen-sind-giftig_cc5b9a8f-eb61-4820-ab9a-f6acfde3abc3.html,https://www.focus.de/wissen/natur/fruehblueher-5-beliebte-pflanzen-sind-giftig_cc5b9a8f-eb61-4820-ab9a-f6acfde3abc3.html,0,www.focus.de,Frühblüher - 5 beliebte Pflanzen sind giftig,"Frühblüher sind ein wunderschöner Blickfang im Garten, doch einige von ihnen können giftig sein. Leben kleine Kinder oder Haustiere im Haushalt, ist es wichtig, die möglichen Gefahren durch Pflanzengifte zu kennen und darauf zu achten.Von FOCUS-online-Autorin…",https://quadro.burda-forward.de/ctf/ee559794-9013-430f-9150-f8d76ecc3518.23b38913-5bff-4176-8a71-b12201d3ef72.jpg?im=RegionOfInterestCrop%3D%281200%2C630%29%2CregionOfInterest%3D%28250%2C95%29&hash=c2bb981cbba3b28eb626175548998567f179221dc11ee31845bca3996452d0f9,2025-02-08T05:11:00Z,https://web.archive.org/web/20250209150123/https://www.focus.de/wissen/natur/fruehblueher-5-beliebte-pflanzen-sind-giftig_cc5b9a8f-eb61-4820-ab9a-f6acfde3abc3.html,"Sobald es wärmer wird, bringen die FrühblüherFarbe in den Garten und kündigen den Frühling an. Doch so schön sie auch aussehen ganz harmlos sind die kleinen Blüten und Stängel nicht unbedingt. 
Vor … [+1463 chars]",,de,'Frühblüher'
https://www.zeit.de/news/2025-02/08/fruehling-schickt-kurzen-vorboten-nach-nrw,https://www.zeit.de/news/2025-02/08/fruehling-schickt-kurzen-vorboten-nach-nrw,0,www.zeit.de,Natur erwacht: Frühling schickt kurzen Vorboten nach NRW,Hier finden Sie Informationen zu dem Thema „Natur erwacht“. Lesen Sie jetzt „Frühling schickt kurzen Vorboten nach NRW“.,https://img.zeit.de/news/2025-02/08/fruehling-schickt-kurzen-vorboten-nach-nrw-image-group/wide__1300x731,2025-02-08T14:43:21Z,,Teils sehr milde Luft hat am Samstag NRW erreicht und ein kurzes Gastspiel des nahenden Frühlings zugelassen. Mit Temperaturen bis zu zehn Grad und viel Sonnenschein erlebten die Menschen vielerorts … [+364 chars],,de,'Frühling'
https://www.stern.de/gesellschaft/regional/nordrhein-westfalen/natur-erwacht--fruehling-schickt-kurzen-vorboten-nach-nrw-35450818.html,https://www.stern.de/gesellschaft/regional/nordrhein-westfalen/natur-erwacht--fruehling-schickt-kurzen-vorboten-nach-nrw-35450818.html,0,www.stern.de,Natur erwacht: Frühling schickt kurzen Vorboten nach NRW,Essen (lnw) - Teils sehr milde Luft hat am Samstag NRW erreicht und ein kurzes Gastspiel des nahenden Frühlings zugelassen. Mit Temperaturen bis zu zehn,https://image.stern.de/35450820/t/uy/v1/w1440/r1.7778/-/08--c7a6hvtc5tv17axs2048jpeg---9ac674d74e3d8e88.jpg,2025-02-08T14:43:21Z,,"Kopiere den aktuellen Link
Schneeglöckchen und Krokusse lassen die Natur bei milden Temperaturen und viel Sonnenschein erwachen. Doch Sonntag wird es schon wieder kälter.
Teils sehr milde Luft hat … [+497 chars]",,de,'Schneeglöckchen'
https://www.zeit.de/news/2025-02/09/an-der-kueste-auf-der-wiese-festivals-im-norden-gefragt,https://www.zeit.de/news/2025-02/09/an-der-kueste-auf-der-wiese-festivals-im-norden-gefragt,0,www.zeit.de,"Open-Air-Musik im Sommer: An der Küste, auf der Wiese: Festivals im Norden gefragt","Hier finden Sie Informationen zu dem Thema „Open-Air-Musik im Sommer“. Lesen Sie jetzt „An der Küste, auf der Wiese: Festivals im Norden gefragt“.",https://img.zeit.de/news/2025-02/09/an-der-kueste-auf-der-wiese-festivals-im-norden-gefragt-image-group/wide__1300x731,2025-02-09T05:00:37Z,https://web.archive.org/web/20250214202556/https://www.zeit.de/news/2025-02/09/an-der-kueste-auf-der-wiese-festivals-im-norden-gefragt,"Angesagte Musiker unter freiem Himmel erleben, zelten und Spaß haben: Die Musikfestivals im Norden begeistern jedes Jahr Zehntausende Besucherinnen und Besucher. Nach den schwierigen Corona-Jahren be… [+5120 chars]",,de,'Sommer'
https://www.bild.de/regional/thueringen/feuer-drama-in-weimar-mann-stirbt-bei-dachstuhlbrand-67a845f3334072169a3e3c77,https://www.bild.de/regional/thueringen/feuer-drama-in-weimar-mann-stirbt-bei-dachstuhlbrand-67a845f3334072169a3e3c77,0,www.bild.de,Tödlicher Brand in Weimar - Leiche in Feuer-Haus entdeckt,"In Weimar brannte der Dachstuhl eines Mehrfamilienhauses, dabei kam ein Mann ums Leben und eine Frau wurde verletzt. Die Brandursache wird ermittelt.","https://images.bild.de/67a845f3334072169a3e3c77/ebc29845268efd240724186efabd464c,56f1f848?w=1280",2025-02-09T08:05:52Z,https://web.archive.org/web/20250210025322/https://www.bild.de/regional/thueringen/feuer-drama-in-weimar-mann-stirbt-bei-dachstuhlbrand-67a845f3334072169a3e3c77,"Weimar (Thüringen) Feuer-Drama in Weimar! Kurz nach 23 Uhr brannte der Dachstuhl eines Mehrfamilienhauses lichterloh. Ein Mann kam ums Leben, eine weitere Person wurde verletzt.
Als die alarmierten … [+1127 chars]",,de,'Erle'
https://www.morgenpost.de/ratgeber-wissen/article401463624/corona-symtome-varianten-aktuell-2025-verlauf-anzeichen-infos.html,https://www.morgenpost.de/ratgeber-wissen/article401463624/corona-symtome-varianten-aktuell-2025-verlauf-anzeichen-infos.html,0,www.morgenpost.de,Corona im Winter 2025: Aktuelle Variante und Symptome,Auch im Winter 2025 bleibt Corona ein Thema. Welche Variante dominiert aktuell? Und was sind die Symptome? Der große Überblick.,https://img.sparknews.funkemedien.de/405089101/405089101_1698379567_v16_9_1600.jpeg,2025-02-09T09:56:36Z,,"Berlin. Auch im Winter 2025 bleibt Corona ein Thema. Welche Variante dominiert aktuell? Und was sind die Symptome? Der große Überblick.
<ul><li>Fünf Jahre nach Ausbruch der Corona-Pandemie ist das V… [+12491 chars]",,de,'Winter'
https://www.computerbase.de/news/gaming/als-virtuelles-brettspiel-civilization-7-erscheint-bald-auf-der-meta-quest-3-s.91342/,https://www.computerbase.de/news/gaming/als-virtuelles-brettspiel-civilization-7-erscheint-bald-auf-der-meta-quest-3-s.91342/,0,www.computerbase.de,Als virtuelles Brettspiel: Civilization 7 erscheint bald auf der Meta Quest 3(s),Civilization 7 startet trotz Review-Bombing positiv und soll noch diesen Frühling exklusiv für Meta Quest 3 und 3s erscheinen. Der Titel wird die spezielle Technik der Headsets nutzen und Civ 7 dank Mixed Reality virtuell auf den heimischen Wohnzimmertisch br…,https://pics.computerbase.de/1/1/6/0/1/9-1ad1fc8418ef55ff/article-1280x720.aafd05ae.jpg,2025-02-09T13:18:00Z,,Civilization 7 startet trotz Review-Bombing positiv und soll noch diesen Frühling exklusiv für Meta Quest 3 und 3s erscheinen. Der Titel wird die spezielle Technik der Headsets nutzen und Civ 7 dank … [+2610 chars],,de,'Frühling'
https://www.focus.de/sport/fussball/bundesliga1/im-sommer-bundesliga-rekordschiedsrichter-brych-tritt-zurueck_id_260707045.html,https://www.focus.de/sport/fussball/bundesliga1/im-sommer-bundesliga-rekordschiedsrichter-brych-tritt-zurueck_id_260707045.html,0,www.focus.de,Im Sommer - Bundesliga-Rekordschiedsrichter Brych tritt zurück,Felix Brych ist der vermutlich bekannteste deutsche Schiedsrichter. Nach fast 500 Spielen in der 1. und 2. Bundesliga hört er auf. Brychs Rekordspiel wird in Erinnerung bleiben.,https://p6.focus.de/img/regional/bayern/id_260707016/bundesliga-rekordschiedsrichter-felix-brych-tritt-zurueck..jpg?im=Crop%3D%280%2C51%2C2048%2C1024%29%3BResize%3D%281200%2C627%29&impolicy=perceptual&quality=mediumHigh&hash=4d65040b8645592331585476b7c8c487a390ec8d974e9159db179ac64630dade,2025-02-09T14:15:22Z,,Felix Brych ist der vermutlich bekannteste deutsche Schiedsrichter. Nach fast 500 Spielen in der 1. und 2. Bundesliga hört er auf. Brychs Rekordspiel wird in Erinnerung bleiben.Bundesliga-Rekordschie… [+1492 chars],,de,'Sommer'
https://www.n-tv.de/ratgeber/So-gelingt-der-Start-ins-Gartenjahr-article25545661.html,https://www.n-tv.de/ratgeber/So-gelingt-der-Start-ins-Gartenjahr-article25545661.html,0,www.n-tv.de,Der Frühling naht: So gelingt der Start ins Gartenjahr,"Die Gartensaison beginnt schon lange vor dem Frühjahr. Während die Pflanzen noch ruhen, können sich Hobbygärtner bereits ans Werk machen. Ein Experte gibt Tipps für die letzten Winterwochen.",https://www.n-tv.de/img/incoming/crop25545679/9141329553-cImg_16_9-w1200/imago262732131.jpg,2025-02-09T18:33:14Z,https://web.archive.org/web/20250210092448/https://www.n-tv.de/ratgeber/So-gelingt-der-Start-ins-Gartenjahr-article25545661.html,"Mancherorts ist der Boden noch gefroren und viele Pflanzen ruhen noch. Doch untätig müssen Hobbygärtner deswegen nicht sein.
Wer bereits weiß, welche Pflanzen er im Frühjahr anbauen will, ""kann jetz… [+2349 chars]",,de,'Aussaat'
https://www.faz.net/aktuell/politik/bundestagswahl/liveticker-zur-bundestagswahl-2025-scholz-greift-an-merz-bleibt-im-tv-duell-cool-faz-110093143.html,https://www.faz.net/aktuell/politik/bundestagswahl/liveticker-zur-bundestagswahl-2025-scholz-greift-an-merz-bleibt-im-tv-duell-cool-faz-110093143.html,0,www.faz.net,"Liveblog zur Bundestagswahl: Scholz greift an, aber Merz lässt sich nicht aufs Glatteis führen",Von „doof“ bis „lächerlich“: Kanzler geht seinen Herausforderer hart an +++ Mehr Streit über Wirtschaft als in den vergangenen zwei Wochen +++ Heftiger Schlagabtausch über Asyl und AfD +++ alle Entwicklungen im Liveblog,https://media0.faz.net/ppmedia/aktuell/politik/1649112687/1.10286418/facebook_teaser/scholz-und-merz-im-tv-duell.jpg,2025-02-09T21:01:38Z,https://web.archive.org/web/20250209210200/https://www.faz.net/aktuell/politik/bundestagswahl/liveticker-zur-bundestagswahl-2025-scholz-greift-an-merz-bleibt-im-tv-duell-cool-faz-110093143.html,"Frage: Wie hoch soll der Anteil für die Verteidigung am Bruttoinlandsprodukt sein? Scholz: Mindestens zwei Prozent für die nächsten vier Jahre (...), außerdem gibt es in der NATO gegenwärtig eine Dis… [+544 chars]",,de,'Glatteis'
https://www.nzz.ch/sponsored-content/alpenklaenge-einmal-anders-ld.1869898,https://www.nzz.ch/sponsored-content/alpenklaenge-einmal-anders-ld.1869898,0,www.nzz.ch,SPONSORED CONTENT - Alpenklänge einmal anders,"Andermatt Music hat alles, was es für Konzerte in den Bergen braucht: einen grandiosen Saal, ein eigenes Residenzorchester internationale Stars, heimische Grössen – und eine ideensprühende Intendantin. Das steht ab Frühling auf der Agenda.","https://img.nzz.ch/2025/02/06/270762fd-0521-477a-985c-c01b7438cb1d.jpeg?width=1200&height=675&fit=bounds&quality=75&auto=webp&crop=1280,720,x0,y133&wmark=nzz",2025-02-09T23:00:00Z,,"Die Schweizer Dirigentin Lena-Lisa Wüstendörfer mit dem 2018 von ihr gegründeten Swiss Orchestra in der Andermatt Konzerthalle.
Dieser Inhalt wurde von NZZ Content Creation im Auftrag von Andermatt … [+8581 chars]",,de,'Frühling'
https://www.focus.de/panorama/wetter-im-ticker-schnee-in-deutschland-wo-es-ab-mittwoch-besonders-winterlich-wird_id_54933749.html,https://www.focus.de/panorama/wetter-im-ticker-schnee-in-deutschland-wo-es-ab-mittwoch-besonders-winterlich-wird_id_54933749.html,0,www.focus.de,+++ Wetter im Ticker +++ - Schnee in Deutschland: Wo es ab Mittwoch besonders winterlich wird,"Ab Mittwoch sorgt ein Kaltlufttropfen für winterliches Wetter in Deutschland. Während im Süden zunächst noch milde Temperaturen herrschen, bringt das Tiefdruckgebiet in der Mitte und im Norden kräftigen Schneefall. Alle Wetter-Entwicklungen im Ticker.",https://p6.focus.de/img/fotos/id_260695381/glatteis-und-gefrierender-regen-sorgen-fuer-rutschige-strassen-in-vielen-regionen..jpg?im=Crop%3D%280%2C289%2C3463%2C1731%29%3BResize%3D%281200%2C627%29&impolicy=perceptual&quality=mediumHigh&hash=36980907e93edef8e855fbdb1fbda64ea599bb4545a74ef6be2d2af73a263d28,2025-02-10T11:17:27Z,https://web.archive.org/web/20250210125703/https://www.focus.de/panorama/wetter-im-ticker-schnee-in-deutschland-wo-es-ab-mittwoch-besonders-winterlich-wird_id_54933749.html,"<ul><li>
Kommentare</li><li>
E-Mail</li><li>
Teilen</li><li>
Mehr</li><li>
Twitter</li><li>
Drucken</li><li>
Feedback</li><li>
Fehler meldenSie haben einen Fehler gefunden?
Bitte markieren S… [+10680 chars]",,de,'Schnee'
https://www.stern.de/lifestyle/mode/trendfarbe-im-fruehling-2025--powder-pink-folgt-auf-burgunderrot-35455326.html,https://www.stern.de/lifestyle/mode/trendfarbe-im-fruehling-2025--powder-pink-folgt-auf-burgunderrot-35455326.html,0,www.stern.de,Trendfarbe im Frühling 2025: Powder Pink folgt auf Burgunderrot,Burgunderrot war gestern - im Frühling 2025 strahlt die Mode in sanftem Powder Pink! Die Farbe bringt feminine Eleganz in die Garderobe.,https://image.stern.de/35455330/t/dT/v1/w1440/r1.7778/-/10--powder-pink-folgt-auf-burgunderrot---16-9---spoton-article-1086293.jpg,2025-02-10T18:32:00Z,,"Kopiere den aktuellen Link
Burgunderrot war gestern - im Frühling 2025 strahlt die Mode in sanftem Powder Pink! Die Farbe bringt feminine Eleganz in die Garderobe.
Zartes Rosa statt schwerem Weinro… [+2641 chars]",,de,'Frühling'
https://www.zeit.de/news/2025-02/11/wetterdienst-warnt-vor-glatteis,https://www.zeit.de/news/2025-02/11/wetterdienst-warnt-vor-glatteis,0,www.zeit.de,Glatte Straßen: Wetterdienst warnt vor Glatteis,Hier finden Sie Informationen zu dem Thema „Glatte Straßen“. Lesen Sie jetzt „Wetterdienst warnt vor Glatteis“.,https://img.zeit.de/news/2025-02/11/wetterdienst-warnt-vor-glatteis-image-group/wide__1300x731,2025-02-11T05:38:15Z,https://web.archive.org/web/20250212064734/https://www.zeit.de/news/2025-02/11/wetterdienst-warnt-vor-glatteis,"Auf den Straßen in Sachsen, Sachsen-Anhalt und Thüringen kann es glatt werden. Der Deutsche Wetterdienst sprach aufgrund von Schneefall und gefrierenden Regens für alle drei Bundesländer Warnungen au… [+428 chars]",,de,'Glatteis'
https://www.stern.de/gesellschaft/regional/sachsen/glatte-strassen--wetterdienst-warnt-vor-glatteis-35455808.html,https://www.stern.de/gesellschaft/regional/sachsen/glatte-strassen--wetterdienst-warnt-vor-glatteis-35455808.html,0,www.stern.de,Glatte Straßen: Wetterdienst warnt vor Glatteis,"Dresden - Auf den Straßen in Sachsen, Sachsen-Anhalt und Thüringen kann es glatt werden. Der Deutsche Wetterdienst sprach aufgrund von Schneefall und",https://image.stern.de/35455810/t/Ch/v1/w1440/r1.7778/-/11--7tecdqnkfov6axs2048jpeg---2c4b4bd9515ea92e.jpg,2025-02-11T05:38:15Z,https://web.archive.org/web/20250212004739/https://www.stern.de/gesellschaft/regional/sachsen/glatte-strassen--wetterdienst-warnt-vor-glatteis-35455808.html,"Kopiere den aktuellen Link
Autofahrer sind zur Vorsicht angehalten. Bis zum Mittwoch besteht in Sachsen, Sachsen-Anhalt und Thüringen Glättegefahr.
Auf den Straßen in Sachsen, Sachsen-Anhalt und Th… [+538 chars]",,de,'Glatteis'
https://www.bild.de/news/wetter/wetter-schnee-und-gefrierender-regen-wetterdienst-warnt-vor-glatteis-67aaf0fe6da9a8373ed63c46,https://www.bild.de/news/wetter/wetter-schnee-und-gefrierender-regen-wetterdienst-warnt-vor-glatteis-67aaf0fe6da9a8373ed63c46,0,www.bild.de,Schnee und gefrierender Regen - Wetterdienst warnt vor Glatteis,"Achtung, es wird glatt! Gefrierender Regen und Schnee sorgen in mehreren Regionen Deutschlands für gefährlich glatte Straßen.","https://images.bild.de/67aaf0fe6da9a8373ed63c46/d52cce259d244d37a2ff1d87189a54f0,b1bb2d2e?w=1280",2025-02-11T07:41:02Z,https://web.archive.org/web/20250211184727/https://www.bild.de/news/wetter/wetter-schnee-und-gefrierender-regen-wetterdienst-warnt-vor-glatteis-67aaf0fe6da9a8373ed63c46,"Achtung, es wird glatt! Gefrierender Regen und Schnee sorgen in mehreren Regionen Deutschlands für gefährlich glatte Straßen. 
Für Niedersachsen rechnet der Deutsche Wetterdienst (DWD) mit Niedersch… [+2108 chars]",,de,'Schnee'
https://www.stern.de/gesellschaft/regional/niedersachsen-bremen/weiter-winterwetter--schneefall-sorgt-fuer-glatte-strassen-im-nordwesten-35455782.html,https://www.stern.de/gesellschaft/regional/niedersachsen-bremen/weiter-winterwetter--schneefall-sorgt-fuer-glatte-strassen-im-nordwesten-35455782.html,0,www.stern.de,Weiter Winterwetter: Schneefall sorgt für glatte Straßen im Nordwesten,"Viele Menschen sehnen den Frühling herbei, doch in Niedersachsen und Bremen soll es auch in den nächsten Tagen schneien. Das große Verkehrschaos auf den Straßen blieb aber aus.",https://image.stern.de/35457246/t/sL/v1/w1440/r1.7778/-/11--zre7uoh2fxv1axs2048jpeg---3aee10ddeb252dc0.jpg,2025-02-11T12:21:10Z,https://web.archive.org/web/20250211182051/https://www.stern.de/gesellschaft/regional/niedersachsen-bremen/weiter-winterwetter--schneefall-sorgt-fuer-glatte-strassen-im-nordwesten-35455782.html,"Kopiere den aktuellen Link
Viele Menschen sehnen den Frühling herbei, doch in Niedersachsen und Bremen soll es auch in den nächsten Tagen schneien. Das große Verkehrschaos auf den Straßen blieb aber… [+2557 chars]",,de,'Glatteis'
https://www.tagesspiegel.de/wissen/allergien-gemassigter-start-in-die-pollensaison-wegen-kalte-13182781.html,https://www.tagesspiegel.de/wissen/allergien-gemassigter-start-in-die-pollensaison-wegen-kalte-13182781.html,0,www.tagesspiegel.de,Allergien: Gemäßigter Start in die Pollensaison wegen Kälte,Bislang sind in Deutschland noch wenige Pollen in der Luft. Und auch für Apfelallergiker gibt es interessante Neuigkeiten.,https://www.tagesspiegel.de/images/13183288/alternates/BASE_16_9_W1400/1739280489000/haselnussstraucher-beginnen-zu-bluhen.jpeg,2025-02-11T12:32:05Z,https://web.archive.org/web/20250212030246/https://www.tagesspiegel.de/wissen/allergien-gemassigter-start-in-die-pollensaison-wegen-kalte-13182781.html,"Die Pollensaison in Deutschland hat begonnen. Wegen der niedrigen Temperaturen verläuft der Saisonstart aber deutlich gemäßigter als in den beiden Vorjahren, sagte Matthias Werchan von der Stiftung D… [+3970 chars]",,de,'Hasel'
https://www.stern.de/panorama/wissen/allergien--gemaessigter-start-in-die-pollensaison-wegen-kaelte-35457270.html,https://www.stern.de/panorama/wissen/allergien--gemaessigter-start-in-die-pollensaison-wegen-kaelte-35457270.html,0,www.stern.de,Allergien: Gemäßigter Start in die Pollensaison wegen Kälte,Berlin - Die Pollensaison in Deutschland hat begonnen. Wegen der niedrigen Temperaturen verläuft der Saisonstart aber deutlich gemäßigter als in den,https://image.stern.de/35457502/t/V-/v1/w1440/r1.7778/-/11--xdf37u352zv5axs2048jpeg---1bbe0e10604296e1.jpg,2025-02-11T13:26:47Z,https://web.archive.org/web/20250211194152/https://www.stern.de/panorama/wissen/allergien--gemaessigter-start-in-die-pollensaison-wegen-kaelte-35457270.html,"Kopiere den aktuellen Link
Bislang sind in Deutschland noch wenige Pollen in der Luft. Und auch für Apfelallergiker gibt es interessante Neuigkeiten.
Die Pollensaison in Deutschland hat begonnen. W… [+3364 chars]",,de,'Pollen'
https://www.stern.de/familie/rasen-duengen-im-fruehjahr--kleiner-snack-mit-grosser-wirkung-34457908.html,https://www.stern.de/familie/rasen-duengen-im-fruehjahr--kleiner-snack-mit-grosser-wirkung-34457908.html,0,www.stern.de,Gartentipps: Rasen düngen im Frühjahr: Sonst wird's nix mit dem satten Grün,"Wer im Sommer stolz seinen satt-grünen Rasen vorführen möchte, hat im Frühjahr einiges zu tun. Welche Pflegestufen wichtig sind und warum das Rasen düngen entscheidend ist.",https://image.stern.de/34464118/t/_j/v3/w1440/r1.7778/-/rasen-duengen-im-fruehjahr-aufmacher.jpg,2025-02-11T13:46:00Z,https://web.archive.org/web/20250212000334/https://www.stern.de/familie/rasen-duengen-im-fruehjahr--kleiner-snack-mit-grosser-wirkung-34457908.html,"Kopiere den aktuellen Link
Wer im Sommer stolz seinen satt-grünen Rasen vorführen möchte, hat im Frühjahr einiges zu tun. Welche Pflegestufen wichtig sind und warum das Rasen düngen entscheidend ist… [+4817 chars]",,de,'Sommer'
https://www.welt.de/gesundheit/article255403180/Pollensaison-Erle-und-Hasel-reizen-die-Nase-aber-es-gibt-auch-gute-Nachrichten-fuer-Allergiker.html,https://www.welt.de/gesundheit/article255403180/Pollensaison-Erle-und-Hasel-reizen-die-Nase-aber-es-gibt-auch-gute-Nachrichten-fuer-Allergiker.html,0,www.welt.de,Erle und Hasel reizen bereits die Nase,Kälte gewährt den Allergikern derzeit noch eine Schonfrist. Zwar wirbelt Blütenstaub von Hasel und Erle schon durch die Luft. Aber die Birke lässt noch auf sich warten. Und deutsche Apfelzüchter haben eine weitere gute Nachricht für Allergiker.,https://img.welt.de/img/gesundheit/mobile255403174/6967939607-ci16x9-w1200/Hazel-Catkins.jpg,2025-02-11T14:24:29Z,,Kälte gewährt den Allergikern derzeit noch eine Schonfrist. Zwar wirbelt Blütenstaub von Hasel und Erle schon durch die Luft. Aber die Birke lässt noch auf sich warten. Und deutsche Apfelzüchter habe… [+3842 chars],,de,'Apfel Blüte'
https://www.faz.net/aktuell/feuilleton/familie/eltern-kolumne-schlaflos/wie-man-zu-einem-verzweifelten-erziehungsoptimierer-wird-eltern-kolumne-schlaflos-110287414.html,https://www.faz.net/aktuell/feuilleton/familie/eltern-kolumne-schlaflos/wie-man-zu-einem-verzweifelten-erziehungsoptimierer-wird-eltern-kolumne-schlaflos-110287414.html,0,www.faz.net,Eltern-Kolumne „Schlaflos“: Wie man zu einem verzweifelten Erziehungsoptimierer wird,"Vergangene Woche beschrieb Lena Sommer, warum sie ihre Tochter in den Arm nahm, als das Zähneputzen mit ihrem Vater eskalierte. Der antwortet jetzt: über das gesunde Maß von Liebe und Konsequenz.",https://media1.faz.net/ppmedia/aktuell/1784395184/1.10289631/facebook_teaser_fplus/auch-eine-form-von-entlastung.jpg,2025-02-11T15:48:40Z,http://archive.md/20250211162516/https://www.faz.net/aktuell/feuilleton/familie/eltern-kolumne-schlaflos/wie-man-zu-einem-verzweifelten-erziehungsoptimierer-wird-eltern-kolumne-schlaflos-110287414.html,"NEIN! Nicht die blaue!, schallt es in meinem Rücken, als ich Milch ins Müsli gieße. Noch schlaftrunken drehe ich mich um und blicke in das wutverzerrte Gesicht meiner Tochter. Ich will die gelbe!
Wi… [+909 chars]",,de,'Sommer'
https://www.stern.de/gesellschaft/regional/niedersachsen-bremen/weiter-winterwetter--schnee-und-glaette-bereiten-probleme-auf-autobahnen-35455782.html,https://www.stern.de/gesellschaft/regional/niedersachsen-bremen/weiter-winterwetter--schnee-und-glaette-bereiten-probleme-auf-autobahnen-35455782.html,0,www.stern.de,Weiter Winterwetter: Schnee und Glätte bereiten Probleme auf Autobahnen,"Quergestellte Laster und Blechschäden: Schnee und Glätte haben für einige Unfälle gesorgt, besonders auf den Fernstraßen im Nordwesten. In Braunschweig hat das Winterwetter noch andere Folgen.",https://image.stern.de/35458354/t/tH/v1/w1440/r1.7778/-/11--uemoano6qev1axs2048jpeg---7b9b166ef51d45af.jpg,2025-02-11T16:19:06Z,,"Kopiere den aktuellen Link
Quergestellte Laster und Blechschäden: Schnee und Glätte haben für einige Unfälle gesorgt, besonders auf den Fernstraßen im Nordwesten. In Braunschweig hat das Winterwette… [+3546 chars]",,de,'Schnee'
https://www.bild.de/news/wetter/wetter-schnee-und-blitzeis-in-deutschland-67aaf0fe6da9a8373ed63c46,https://www.bild.de/news/wetter/wetter-schnee-und-blitzeis-in-deutschland-67aaf0fe6da9a8373ed63c46,0,www.bild.de,Wetterdienst warnt - Wetter bringt Schnee und Blitzeis in Deutschland,Der Winter ist zurück. Regen und Schnee sorgen in Deutschland für Kälte und Glatteis.,"https://images.bild.de/67aaf0fe6da9a8373ed63c46/d52cce259d244d37a2ff1d87189a54f0,199c5a0d?w=1280",2025-02-11T19:30:47Z,https://web.archive.org/web/20250211234845/https://www.bild.de/news/wetter/wetter-schnee-und-blitzeis-in-deutschland-67aaf0fe6da9a8373ed63c46,"Achtung, es wird glatt. Gefrierender Regen und Schnee sorgen in mehreren Regionen in Deutschland am heutigen Dienstag für gefährlich glatte Straßen und Eis-Wetter.
Gleich in mehreren Regionen ist de… [+2424 chars]",,de,'Glatteis'
https://www.stern.de/gesellschaft/regional/sachsen/wettervorhersage--glatte-strassen-in-sachsen-35459234.html,https://www.stern.de/gesellschaft/regional/sachsen/wettervorhersage--glatte-strassen-in-sachsen-35459234.html,0,www.stern.de,Wettervorhersage: Glatte Straßen in Sachsen,Frostiges Winterwetter mit vielen Wolken prägt die zweite Wochenhälfte in Sachsen. Dabei kann es glatt werden. Doch mit viel Schnee ist den Aussichten nach leider nicht zu rechnen.,https://image.stern.de/35459236/t/oU/v1/w1440/r1.7778/-/12--p34ctwpsquv5axs2048jpeg---809e93d3b2ceccfe.jpg,2025-02-12T06:04:51Z,https://web.archive.org/web/20250212080014/https://www.stern.de/gesellschaft/regional/sachsen/wettervorhersage--glatte-strassen-in-sachsen-35459234.html,"Kopiere den aktuellen Link
Frostiges Winterwetter mit vielen Wolken prägt die zweite Wochenhälfte in Sachsen. Dabei kann es glatt werden. Doch mit viel Schnee ist den Aussichten nach leider nicht zu… [+982 chars]",,de,'Glatteis'
https://www.diepresse.com/19356052/gefrierender-regen-glatteisgefahr-in-teilen-oesterreichs,https://www.diepresse.com/19356052/gefrierender-regen-glatteisgefahr-in-teilen-oesterreichs,0,www.diepresse.com,Gefrierender Regen: Glatteisgefahr in Teilen Österreichs,Im Norden und Osten kann es Donnerstagfrüh rutschig werden. Es empfehlen sich kleine Schritte.,https://img.diepresse.com/public/incoming/gb5arz-kein-Titel/alternates/DPR_SOCIAL_NACHRICHTEN/kein%20Titel,2025-02-12T10:05:22Z,,"Im Norden und Osten kann es Donnerstagfrüh rutschig werden. Es empfehlen sich kleine Schritte.
Am Donnerstag ist in der Früh und am Vormittag im Norden und Osten Österreichs Vorsicht geboten. Es bes… [+2234 chars]",,de,'Glatteis'
