index,published,keyword,domain,language,valid,title,description,url,image,archive,content,quote,de,en,la,added
1d26692fdc0328e78cbc1ff276bf12a3,2026-05-16T05:14:41Z,'Bodenfrost',www.zeit.de,de,0.9,Wettervorhersage: Kühles Wochenende - letzter Bodenfrost?,Hier finden Sie Informationen zu dem Thema „Wettervorhersage“. Lesen Sie jetzt „Kühles Wochenende - letzter Bodenfrost?“.,https://www.zeit.de/news/2026-05/16/kuehles-wochenende-letzter-bodenfrost,https://img.zeit.de/news/2026-05/16/kuehles-wochenende-letzter-bodenfrost-image-group/wide__1300x731,http://web.archive.org/web/20260517110330/https://www.zeit.de/news/2026-05/16/kuehles-wochenende-letzter-bodenfrost,"Bayern steht ein ungemütliches Wochenende mit Schauern, einzelnen Gewittern und Schnee in den Hochlagen bevor. Der Deutsche Wetterdienst erwartet kühle Temperaturen, am Sonntagmorgen könnte es gebiet… [+756 chars]",,Wettervorhersage: Kühles Wochenende - letzter Bodenfrost?. Hier finden Sie Informationen zu dem Thema „Wettervorhersage“. Lesen Sie jetzt „Kühles Wochenende - letzter Bodenfrost?“.,Weather forecast: Cool weekend - last ground frost? Here you will find information on the subject of “weather forecast”. Read “Cool weekend - last ground frost?” now.,"Tempestas praenuntiet: Frigus volutpat - ultima terra gelu? Hic invenies informationes de re ""tempestatis praenuntientur"". Legere ""Frigus weekend - Ultima terra gelu?"" nunc.",2026-05-18 16:35:30+00:00
1d8de81a3b8d7007238839c953e4beed,2026-05-17T05:25:06Z,'Bodenfrost',www.zeit.de,de,0.9,"Launisches Wetter: Wechselhaftes Wochenende: Sonne, Schauer, Bodenfrost","Hier finden Sie Informationen zu dem Thema „Launisches Wetter“. Lesen Sie jetzt „Wechselhaftes Wochenende: Sonne, Schauer, Bodenfrost“.",https://www.zeit.de/news/2026-05/17/wechselhaftes-wochenende-sonne-schauer-bodenfrost,https://img.zeit.de/news/2026-05/17/wechselhaftes-wochenende-sonne-schauer-bodenfrost-image-group/wide__1300x731,,Nach einem kühlem und unbeständigen Wochenendauftakt wird es heute etwas wärmer und auch die Sonne schaut gelegentlich vorbei. Die Regenjacke sollten Spaziergänger trotzdem dabei haben - nach Angaben… [+1500 chars],,"Launisches Wetter: Wechselhaftes Wochenende: Sonne, Schauer, Bodenfrost. Hier finden Sie Informationen zu dem Thema „Launisches Wetter“. Lesen Sie jetzt „Wechselhaftes Wochenende: Sonne, Schauer, Bodenfrost“.","Moody weather: Changeable weekend: sun, showers, ground frost. Here you will find information on the topic of “moody weather”. Read “Changeable weekend: sun, showers, ground frost” now.","Moody weather: Mutabilis volutpat: sol, imbres, humus gelu. Hic informationes invenies in argumento ""tempestatis tristis"". Lege ""Mutabilis volutpat: sol, imbres, humus gelu"" nunc.",2026-05-18 16:35:30+00:00
694e9f3c079490b50a2a957301b6b928,2026-05-16T05:14:41Z,'Bodenfrost',www.stern.de,de,0.9,Wettervorhersage: Kühles Wochenende - letzter Bodenfrost?,"München (lby) - Bayern steht ein ungemütliches Wochenende mit Schauern, einzelnen Gewittern und Schnee in den Hochlagen bevor. Der Deutsche Wetterdienst",https://www.stern.de/gesellschaft/regional/bayern/wettervorhersage--kuehles-wochenende---letzter-bodenfrost--37402176.html,https://image.stern.de/37402178/t/52/v1/w1440/r1.7778/-/16--pm6bhyxfj2v5axs2048jpeg---eac626714a514e3a.jpg,http://web.archive.org/web/20260516084913/https://www.stern.de/gesellschaft/regional/bayern/wettervorhersage--kuehles-wochenende---letzter-bodenfrost--37402176.html,"Kopiere den aktuellen Link
Zur Merkliste hinzufügen
Es ist ungemütlich. In den Alpen ist Schnee in Aussicht, und gebietsweise können die Temperaturen nachts unter den Gefrierpunkt sinken.
Bayern s… [+908 chars]",,"Wettervorhersage: Kühles Wochenende - letzter Bodenfrost?. München (lby) - Bayern steht ein ungemütliches Wochenende mit Schauern, einzelnen Gewittern und Schnee in den Hochlagen bevor. Der Deutsche Wetterdienst","Weather forecast: Cool weekend - last ground frost? Munich (lby) - Bavaria is facing an uncomfortable weekend with showers, isolated thunderstorms and snow in the high altitudes. The German Weather Service","Tempestas praenuntientur: Frigus volutpat - ultima terra gelu? Munich (lby) - Bavaria respicit volutpat incommoditas imbribus, tonitribus solitaria et nivis in altitu- dine altitudinis. Tempestas Service German",2026-05-19 06:31:08+00:00
aa95eba1822bc3c1ff65bbe4074e81c1,2026-05-16T05:20:21Z,'Bodenfrost',www.stern.de,de,0.9,"Sonne und Wärme pausieren: Schauer-Wochenende: Böen, Gewitterrisiko, Bergflocken",Von Bodenfrost bis Gewitter: Das Wochenende verlangt im Freien Nehmer-Qualitäten. Warum die Winterjacke etwa auf dem Feldberg eine gute Wahl ist und wo es am Sonntag aufklart.,https://www.stern.de/gesellschaft/regional/baden-wuerttemberg/sonne-und-waerme-pausieren--schauer-wochenende--boeen--gewitterrisiko--bergflocken-37402180.html,https://image.stern.de/37402182/t/-h/v1/w1440/r1.7778/-/16--76hchnujqwv7axs2048jpeg---4c6af5fce639ac21.jpg,http://web.archive.org/web/20260516090107/https://www.stern.de/gesellschaft/regional/baden-wuerttemberg/sonne-und-waerme-pausieren--schauer-wochenende--boeen--gewitterrisiko--bergflocken-37402180.html,"Kopiere den aktuellen Link
Zur Merkliste hinzufügen
Von Bodenfrost bis Gewitter: Das Wochenende verlangt im Freien Nehmer-Qualitäten. Warum die Winterjacke etwa auf dem Feldberg eine gute Wahl ist … [+1832 chars]",,"Sonne und Wärme pausieren: Schauer-Wochenende: Böen, Gewitterrisiko, Bergflocken. Von Bodenfrost bis Gewitter: Das Wochenende verlangt im Freien Nehmer-Qualitäten. Warum die Winterjacke etwa auf dem Feldberg eine gute Wahl ist und wo es am Sonntag aufklart.","Sun and warmth pause: Shower weekend: gusts, risk of thunderstorms, mountain flakes. From ground frost to thunderstorms: the weekend demands outdoor qualities. Why the winter jacket is a good choice on the Feldberg and where it will clear up on Sunday.","Sol et calor pausant: imbrem volutpat: procellae, periculum tonitribus: mons incanduit. A terra gelu ad tonitrua: volutpat petit qualitates velit. Quare iaccam hiemalem in Feldberg bene eligit et ubi die Dominico patebit.",2026-05-19 06:31:08+00:00
3b6e28d34ef1b5df3536dfd75f291ed6,2026-05-16T16:13:49Z,'Schnee',www.bild.de,de,0.9,Erneuter Wintereinbruch - Bis zu 30 Zentimeter Neuschnee in der Steiermark,Alles weiß! Auch in Deutschland hat es geschneit. Wo jetzt überall Neuschnee liegt und wo in der kommenden Nacht noch mehr Schnee fallen soll.,https://www.bild.de/news/wetter/wintereinbruch-bis-zu-30-zentimeter-neuschnee-in-der-steiermark-6a0836801bde982bd10fda9b,"https://images.bild.de/6a0836801bde982bd10fda9b/b1e6e54f013fdeedfa978bc0c6471cb2,9fccff0a?w=1280",,"TTS-Player überspringenArtikel weiterlesenSteiermark Im Mai denken viele an das erste kühle Getränk im Biergarten, der Sommer scheint greifbar nah. Doch in der Steiermark in Österreich sind bis zu 30… [+2818 chars]",,Erneuter Wintereinbruch - Bis zu 30 Zentimeter Neuschnee in der Steiermark. Alles weiß! Auch in Deutschland hat es geschneit. Wo jetzt überall Neuschnee liegt und wo in der kommenden Nacht noch mehr Schnee fallen soll.,Another onset of winter - up to 30 centimeters of fresh snow in Styria. Everything knows! It also snowed in Germany. Where there is fresh snow everywhere now and where even more snow is expected to fall next night.,Alius impetus hiemis - usque ad 30 centimetra nivis recentis in Styria. Omnia scit! Etiam in Germania nix. Ubi nunc nix ubique recens est et ubi etiam plus nix expectatur proximam noctem cadere.,2026-05-19 06:31:08+00:00
f2964d5444879da3040b2de7a07d57f7,2026-05-16T21:01:30Z,'Schnee',www.bild.de,de,0.9,30 Zentimeter liegen schon - In dieser Nacht soll es noch mal schneien,In mehreren Regionen in Deutschland und Österreich liegt wieder Schnee. Auch in dieser Nacht soll es schneien.,https://www.bild.de/news/wetter/in-dieser-nacht-soll-es-noch-mal-schneien-30-zentimeter-liegen-schon-6a0836801bde982bd10fda9b,"https://images.bild.de/6a0836801bde982bd10fda9b/b1e6e54f013fdeedfa978bc0c6471cb2,9fccff0a?w=1280",,"TTS-Player überspringenArtikel weiterlesenSteiermark Im Mai denken viele an das erste kühle Getränk im Biergarten, der Sommer scheint greifbar nah. Doch in der Steiermark in Österreich sind bis zu 30… [+2868 chars]",,30 Zentimeter liegen schon - In dieser Nacht soll es noch mal schneien. In mehreren Regionen in Deutschland und Österreich liegt wieder Schnee. Auch in dieser Nacht soll es schneien.,There are already 30 centimeters - it's supposed to snow again that night. There is snow again in several regions in Germany and Austria. It's supposed to snow that night too.,Iam 30 centimetra sunt — ea nocte iterum nives supponitur. In Germania et Austria in pluribus regionibus nives est. Suus 'supponitur nix noctem illam nimis.,2026-05-19 06:31:08+00:00
3bb1ee208765a89bc6310205665a7f9e,2026-05-17T17:05:41Z,'Schnee',vorarlberg.orf.at,de,0.9,Nach Schnee im Tal: Freibadsaison angelaufen,"Am Samstag hat es noch bis in die Täler geschneit, am Sonntag wurde in Bregenz die Freibadsaison eröffnet. Einen Massenansturm hat es im Seebad am ersten Tag zwar noch nicht gegeben, ein paar hartnäckige Badefans ließen sich von den niedrigen Temperaturen abe…",https://vorarlberg.orf.at/stories/3354552/,https://ibs.orf.at/vbg?image=https%3A%2F%2Foekastatic.orf.at%2Fmims%2F2026%2F21%2F28%2Fcrops%2Fw%3D1200%2Ch%3D627%2Cq%3D75%2F3040814_master_1176628_freibad.jpg%3Fs%3D8982f4ca9c9e59d8c4343578954b4429f11f6f87,,Noch gibt es für die Bademeisterinnen und Bademeister im Strandbad in Bregenz nicht viel zu tun. Nach dem Rechten sehen gehört ab Saisonbeginn aber dazu. Heute am ersten Tag ist das Wetter nicht so g… [+1247 chars],,"Nach Schnee im Tal: Freibadsaison angelaufen. Am Samstag hat es noch bis in die Täler geschneit, am Sonntag wurde in Bregenz die Freibadsaison eröffnet. Einen Massenansturm hat es im Seebad am ersten Tag zwar noch nicht gegeben, ein paar hartnäckige Badefans ließen sich von den niedrigen Temperaturen abe…","After snow in the valley: outdoor swimming season has started. On Saturday it snowed down to the valleys, and the outdoor swimming season opened in Bregenz on Sunday. There wasn't a mass rush to the seaside resort on the first day, but a few stubborn bathing fans were put off by the low temperatures...","Post nix in valle: tempus natandi velit incepit. Sabbato in valles ninxit et tempus velit lacus in Bregenz die Dominico aperuit. Massa non erat concursus ad mare primo die, sed paucae pervicacissimae alitulae balneae ab infimis temperaturis dimissae sunt.",2026-05-19 06:31:08+00:00
982a8ea79b359efab6963e733219479c,2026-05-18T05:23:00Z,'Schnee',steiermark.orf.at,de,0.9,Geschlägertes Holz verrottet in den Wäldern,"Nach Schnee- und Windbruch lagern große Mengen Holz in den steirischen Wäldern. Die Sägewerke können momentan keine zusätzlichen Mengen an Holz abnehmen und verarbeiten, denn die Holzindustrie bekommt die Flaute in der Baubranche ordentlich zu spüren.",https://steiermark.orf.at/stories/3353893/,https://ibs.orf.at/stm?image=https%3A%2F%2Foekastatic.orf.at%2Fmims%2F2024%2F23%2F02%2Fcrops%2Fw%3D1200%2Ch%3D627%2Cq%3D75%2F2234524_master_848502_dsc01617.jpg%3Fs%3D3f687f66cb8285651a8d36afa7683e9384dcb4be,http://web.archive.org/web/20260518074400/https://steiermark.orf.at/stories/3353893/,"Etwa 4,5 Millionen Festmeter Holz werden im Schnitt im Jahr in der Steiermark geerntet, gut 80 Prozent davon werden in der Steiermark verarbeitet. Viele steirische Waldbesitzer bleiben derzeit aber a… [+1721 chars]",,"Geschlägertes Holz verrottet in den Wäldern. Nach Schnee- und Windbruch lagern große Mengen Holz in den steirischen Wäldern. Die Sägewerke können momentan keine zusätzlichen Mengen an Holz abnehmen und verarbeiten, denn die Holzindustrie bekommt die Flaute in der Baubranche ordentlich zu spüren.","Felled wood rots in the forests. After snow and wind breaks, large amounts of wood are stored in the Styrian forests. The sawmills are currently unable to accept and process any additional quantities of wood because the wood industry is really feeling the effects of the downturn in the construction industry.","Lignum caesum putrescit in silvis. Postquam nix et ventus erumpit, magnae copiae lignorum in silvis Styriis reponuntur. In sawmillia nunc non possunt accipere et procedere aliquas quantitates additas lignorum, quia industria ligni vere sentiens effectibus adipiscing elit in constructione industriae.",2026-05-19 06:31:08+00:00
923d54e17fbae328026c154e5ec12f76,2026-05-03T09:26:47Z,'Schnee',www.zeit.de,de,0.9,Wetter: Sturm und Schnee statt Sonne – Griechenland friert im Mai,Hier finden Sie Informationen zu dem Thema „Wetter“. Lesen Sie jetzt „Sturm und Schnee statt Sonne – Griechenland friert im Mai“.,https://www.zeit.de/news/2026-05/03/sturm-und-schnee-statt-sonne-griechenland-friert-im-mai,https://img.zeit.de/news/2026-05/03/sturm-und-schnee-statt-sonne-griechenland-friert-im-mai-image-group/wide__1300x731,http://web.archive.org/web/20260503093057/https://www.zeit.de/news/2026-05/03/sturm-und-schnee-statt-sonne-griechenland-friert-im-mai,"Eine ungewöhnliche Kältewelle hat Griechenland Anfang Mai fest im Griff. Statt frühlingshafter Temperaturen sorgt eine «Kaltluft-Invasion», wie Meteorologen in griechischen Medien berichten, für ein … [+1457 chars]",,Wetter: Sturm und Schnee statt Sonne – Griechenland friert im Mai. Hier finden Sie Informationen zu dem Thema „Wetter“. Lesen Sie jetzt „Sturm und Schnee statt Sonne – Griechenland friert im Mai“.,Weather: Storm and snow instead of sun – Greece is freezing in May. Here you will find information on the topic of “weather”. Now read “Storm and snow instead of sun – Greece freezes in May”.,"Tempestas: Tempestas et nix pro sole – Graecia mense Maio rigens est. Hic informationes invenies in argumento ""tempestatis"". Nunc legitur ""Tempestas et nix pro sole - Graecia mense Maio concrescit"".",2026-05-19 10:46:46+00:00
a7d3f5ba8e3206fb25bdb11a488bf267,2026-05-10T13:22:27Z,'Schnee',www.zeit.de,de,0.9,Frost und Schnee möglich: Dem Frühling geht etwas die Puste aus,Hier finden Sie Informationen zu dem Thema „Frost und Schnee möglich“. Lesen Sie jetzt „Dem Frühling geht etwas die Puste aus“.,https://www.zeit.de/news/2026-05/10/dem-fruehling-geht-etwas-die-puste-aus,https://img.zeit.de/news/2026-05/10/dem-fruehling-geht-etwas-die-puste-aus-image-group/wide__1300x731,,"Noch einmal Sonne tanken, bevor der Frühling eine kleine Pause macht: Bei Temperaturen um 20 Grad haben viele Menschen in Nordrhein-Westfalen den Sonntag für einen Ausflug genutzt - etwa auf den Ausf… [+672 chars]",,Frost und Schnee möglich: Dem Frühling geht etwas die Puste aus. Hier finden Sie Informationen zu dem Thema „Frost und Schnee möglich“. Lesen Sie jetzt „Dem Frühling geht etwas die Puste aus“.,Frost and snow possible: Spring is running out of steam. Here you will find information on the topic “Frost and snow possible”. Read “Spring is running out of steam” now.,"Pruina et nix fieri potest: Ver e vapore currit. Hic informationes invenies in argumento ""Frest et nives fieri"". Legere ""Ver e vapore currit"" nunc.",2026-05-19 10:46:46+00:00
0d8c0a63823026a3dc3dc341b1b435d3,2026-05-12T05:40:48Z,'Schnee',www.zeit.de,de,0.9,Wetter: Schnee in den Bergen,Hier finden Sie Informationen zu dem Thema „Wetter“. Lesen Sie jetzt „Schnee in den Bergen“.,https://www.zeit.de/news/2026-05/12/schnee-in-den-bergen,https://img.zeit.de/news/2026-05/12/schnee-in-den-bergen-image-group/wide__1300x731,,"Winterliches Bild in den Bergen: In den Hochlagen in Sachsen, Sachsen-Anhalt und Thüringen ist Schnee gefallen. Eine matschige Schneedecke aus ein bis zwei Zentimetern ist am Morgen oberhalb von 600 … [+1049 chars]",,Wetter: Schnee in den Bergen. Hier finden Sie Informationen zu dem Thema „Wetter“. Lesen Sie jetzt „Schnee in den Bergen“.,Weather: Snow in the mountains. Here you will find information on the topic of “weather”. Read “Snow in the Mountains” now.,"Tempestas: Nix in montibus. Hic informationes invenies in argumento ""tempestatis"". Lege Nives in montibus nunc.",2026-05-19 10:46:46+00:00
6f3b67f02593d135ea719fb9079cef80,2026-05-15T04:28:44Z,'Schnee',www.zeit.de,de,0.9,"Wetter: Regen, Wind und Frost - wo es Schneeflocken geben könnte","Hier finden Sie Informationen zu dem Thema „Wetter“. Lesen Sie jetzt „Regen, Wind und Frost - wo es Schneeflocken geben könnte“.",https://www.zeit.de/news/2026-05/15/regen-wind-und-frost-wo-es-schneeflocken-geben-koennte,https://img.zeit.de/news/2026-05/15/regen-wind-und-frost-wo-es-schneeflocken-geben-koennte-image-group/wide__1300x731,,"Vor dem Wochenende präsentiert sich das Wetter grau, nass und kühl bis kalt: Heute stark bewölkt mit Schauern, ab dem Nachmittag auch kurzen Gewittern mit vereinzeltem Starkregen, Windböen und kleine… [+1201 chars]",,"Wetter: Regen, Wind und Frost - wo es Schneeflocken geben könnte. Hier finden Sie Informationen zu dem Thema „Wetter“. Lesen Sie jetzt „Regen, Wind und Frost - wo es Schneeflocken geben könnte“.","Weather: Rain, wind and frost - where there could be snowflakes. Here you will find information on the topic of “weather”. Now read “Rain, wind and frost - where there could be snowflakes”.","Tempestas: Pluvia, ventus et gelu - ubi nivis esse potuerunt. Hic informationes invenies in argumento ""tempestatis"". Nunc lege ""imber, ventus et gelu - ubi nives esse possunt"".",2026-05-19 10:46:46+00:00
d04f2f8fe3056d7a51966f49b762e978,2026-05-18T07:45:00Z,'Schnee',www.faz.net,de,0.9,Blachas Expedition Lhotse: Darum sind gute Wettervorhersagen so wichtig,"Höhenbergsteigerin Anja Blacha berichtet für die F.A.Z. von ihrer Expedition zum Lhotse. In der zwölften Tagebuch-Folge geht es um Stürme, Schnee, die Bedeutung des Luftdrucks und Vertrauen.",https://www.faz.net/aktuell/sport/mehr-sport/anja-blachas-expedition-lhotse-bergsteigerin-berichtet-fuer-faz-ueber-wetter-accg-200722892.html,https://media0.faz.net/image/w1200h627/0accea810681/w2252h1176x0y839o/202605/43601.0.2091625925/nicht-immer-ist-der-himmel.webp,,"Anja Blacha ist die erfolgreichste Höhenbergsteigerin Deutschlands. Die Fünfunddreißigjährige, geboren in Bielefeld, hat zwölf der 14 Achttausender erfolgreich ohne Flaschensauerstoff bestiegen. Zur … [+44165 chars]",,"Blachas Expedition Lhotse: Darum sind gute Wettervorhersagen so wichtig. Höhenbergsteigerin Anja Blacha berichtet für die F.A.Z. von ihrer Expedition zum Lhotse. In der zwölften Tagebuch-Folge geht es um Stürme, Schnee, die Bedeutung des Luftdrucks und Vertrauen.","Blachas Expedition Lhotse: That's why good weather forecasts are so important. High-altitude mountaineer Anja Blacha reports for the F.A.Z. from their expedition to Lhotse. The twelfth diary episode is about storms, snow, the importance of air pressure and trust.","Blachas Expeditio Lhotse: Ideo bona tempestatis praenuntiata tam magna sunt. Anja Blacha refert ad F.A.Z. ab expeditione Lhotse. Duodecimus eventus commentarius est de tempestatibus, nivis, de gravitate aeris et pressione et fiducia.",2026-05-19 10:46:46+00:00
7445177ea7f3c56fc2017eda28d512a0,2026-05-13T06:03:35Z,'Frost',steiermark.orf.at,de,0.9,Frost: Weinwirtschaft kann aufatmen,"Die Nacht auf Mittwoch hat in manchen Teilen der Steiermark Temperaturen rund um den Gefrierpunkt gebracht. Das bereitete vorab Sorgen in der Landwirtschaft. Frost im Mai hat in der Regel Ernteausfälle zur Folge. Die Nacht sei aber glimpflich ausgegangen, so …",https://steiermark.orf.at/stories/3354001/,https://ibs.orf.at/stm?image=https%3A%2F%2Foekastatic.orf.at%2Fmims%2F2026%2F20%2F78%2Fcrops%2Fw%3D1200%2Ch%3D627%2Cq%3D75%2F3035199_master_1174378_weinbluete_in_vollem_gange_.jpg%3Fs%3D29b39f95c4a836bf59a52a0587b4b51b593de942,http://web.archive.org/web/20260514020804/https://steiermark.orf.at/stories/3354001/,"Das Bangen hat ein Ende, großflächige Schäden seien ausgeblieben, erklärte Stefan Potzinger, der Obmann des steirischen Weinbaus: Ich habe mir in der Nacht immer wieder die Temperaturen durchlaufen l… [+1512 chars]",,"Frost: Weinwirtschaft kann aufatmen. Die Nacht auf Mittwoch hat in manchen Teilen der Steiermark Temperaturen rund um den Gefrierpunkt gebracht. Das bereitete vorab Sorgen in der Landwirtschaft. Frost im Mai hat in der Regel Ernteausfälle zur Folge. Die Nacht sei aber glimpflich ausgegangen, so …","Frost: The wine industry can breathe a sigh of relief. Wednesday night brought temperatures around freezing point in some parts of Styria. This initially caused concern in agriculture. Frost in May usually results in crop failures. But the night ended well, so...","Frontinus: Vinum industria suspirium subsidio respirare potest. Nocte Mercurii temperaturae circa rigentem in quibusdam Styriae partibus intulit. Hoc initio sollicitudinem in re rustica effecit. Pruina mense Maio plerumque in defectibus seges consequitur. Sed nox finita bene, sic...",2026-05-19 20:54:01+00:00
ee7fdbcf13fcae8ee580f74e94861ac5,2026-05-10T09:34:37Z,'Frost',www.stern.de,de,0.9,Wetteraussichten: Unwetter am Sonntagabend möglich - neue Woche startet kühl,Nach zum Teil sommerlichen Temperaturen der letzten Tage heißt es wieder wärmer anziehen: In den kommenden Tagen wird in Rheinland-Pfalz und dem Saarland örtlich sogar nachts Frost erwartet.,https://www.stern.de/gesellschaft/regional/rheinland-pfalz-saarland/wetteraussichten--unwetter-am-sonntagabend-moeglich---neue-woche-startet-kuehl-37385210.html,https://image.stern.de/37385212/t/OR/v1/w1440/r1.7778/-/10--72nlqzmcddv7axs2048jpeg---a710da002a1e5d11.jpg,,"Kopiere den aktuellen Link
Zur Merkliste hinzufügen
Nach zum Teil sommerlichen Temperaturen der letzten Tage heißt es wieder wärmer anziehen: In den kommenden Tagen wird in Rheinland-Pfalz und dem … [+1435 chars]",,Wetteraussichten: Unwetter am Sonntagabend möglich - neue Woche startet kühl. Nach zum Teil sommerlichen Temperaturen der letzten Tage heißt es wieder wärmer anziehen: In den kommenden Tagen wird in Rheinland-Pfalz und dem Saarland örtlich sogar nachts Frost erwartet.,"Weather outlook: Storms possible on Sunday evening - new week starts cool. After the partly summery temperatures of the last few days, it's time to dress warmer again: In the coming days, frost is expected locally in Rhineland-Palatinate and Saarland, even at night.","Tempestas prospectans: Tempestates possibilia sunt vespere dominicae - hebdomade nova incipit frigus. Post hos dies temperaturas partim aestivas, tempus est rursus calidiores vestire: In diebus proximis, pruina localiter exspectatur in Rheno-Palatinato et Saarland, etiam noctu.",2026-05-20 16:32:43+00:00
aa5e330905a5e14d8ccd808ef255e6eb,2026-05-10T09:36:39Z,'Frost',www.stern.de,de,0.9,Wetteraussichten: Kühler Wochenstart in Hessen - erhöhte Gewittergefahr,"Schauer, Gewitter, Starkregen, in Bergland sogar örtlich Schneeschauer - mit einem Temperatursturz startet Hessen turbulent in die neue Woche. So sind die Aussichten.",https://www.stern.de/gesellschaft/regional/hessen/wetteraussichten--kuehler-wochenstart-in-hessen---erhoehte-gewittergefahr-37385220.html,https://image.stern.de/37385222/t/FH/v1/w1440/r1.7778/-/10--clptgk7ieov3axs2048jpeg---cade9d70f3f2fb09.jpg,,"Kopiere den aktuellen Link
Zur Merkliste hinzufügen
Schauer, Gewitter, Starkregen, in Bergland sogar örtlich Schneeschauer - mit einem Temperatursturz startet Hessen turbulent in die neue Woche. So… [+1411 chars]",,"Wetteraussichten: Kühler Wochenstart in Hessen - erhöhte Gewittergefahr. Schauer, Gewitter, Starkregen, in Bergland sogar örtlich Schneeschauer - mit einem Temperatursturz startet Hessen turbulent in die neue Woche. So sind die Aussichten.","Weather outlook: Cool start to the week in Hesse - increased risk of thunderstorms. Showers, thunderstorms, heavy rain, even local snow showers in the mountains - Hesse is starting the new week turbulently with a drop in temperature. Such are the prospects.","Tempestas prospectans: Frigus initium septimanae in Hassia - periculum tonitruum augetur. Imbres, tonitrua, pluviae graves, etiam loci nives in montibus imbres - Hesse incipit nova septimana turbulente cum gutta in temperie. Haec sunt spes.",2026-05-20 16:32:43+00:00
93d78b4e0338195392003d4b3c89060e,2026-05-10T10:23:21Z,'Frost',www.stern.de,de,0.9,Wetteraussichten: Regen und örtliche Gewitter zum Start in die neue Woche,Nach teils sommerlicher Wärme folgt in der neuen Woche ein Temperatursturz auf örtlich einstellige Werte. Auch leichter Frost in den Alpen und im Mittelgebirge sind möglich.,https://www.stern.de/panorama/wetteraussichten--regen-und-oertliche-gewitter-zum-start-in-die-neue-woche-37385334.html,https://image.stern.de/37385336/t/FE/v1/w1440/r1.7778/-/10--y6pba4ypa2v8axs2048jpeg---6be68b2b4b7d2400.jpg,,"Kopiere den aktuellen Link
Zur Merkliste hinzufügen
Nach teils sommerlicher Wärme folgt in der neuen Woche ein Temperatursturz auf örtlich einstellige Werte. Auch leichter Frost in den Alpen und im… [+1585 chars]",,Wetteraussichten: Regen und örtliche Gewitter zum Start in die neue Woche. Nach teils sommerlicher Wärme folgt in der neuen Woche ein Temperatursturz auf örtlich einstellige Werte. Auch leichter Frost in den Alpen und im Mittelgebirge sind möglich.,"Weather outlook: Rain and local thunderstorms to start the new week. After some summer warmth, temperatures will drop to single-digit values ​​in some places in the new week. Light frost is also possible in the Alps and low mountain ranges.","Tempestas prospectans: Pluviae et loci tonitrua ut nova septimana incipiant. Post aliquot aestatis calefactionem, temperaturas ad valorem unius digiti in aliquibus locis in nova septimana decident. Frigore etiam potest in Alpibus et iugis infimis montibus.",2026-05-20 16:32:43+00:00
