index,published,keyword,domain,language,valid,title,description,url,image,archive,content,quote
4a1285c00e1fa1b2560f7c31bdffec18,2025-10-26T11:37:55Z,'Schnee',tirol.orf.at,de,1.0,Auto stürzt ab: Insassen unverletzt,"Glimpflich ist ein Fahrzeugabsturz am Samstag im Kaunertal ausgegangen. Das laut Polizei mit Sommerreifen ausgerüstete Auto geriet bei einsetzendem Schneefall über den Straßenrand hinaus. Der Lenker überstand den 50-Meter-Absturz unverletzt, der Beifahrer spr…",https://tirol.orf.at/stories/3327416/,https://ibs.orf.at/tir?image=https%3A%2F%2Foekastatic.orf.at%2Fmojo%2F1_4_1%2Fstoryserver%2Foeka%2Fcommon%2Fimages%2Fog-fallback-tir.png%3Fs%3D3061f8472e32c1cd7d82f69f7bcb03aa89dcb859,,Der 23-jährige Lenker fuhr gegen 23.00 Uhr auf der Gletscherstraße talauswärts. Aufgrund der bereits winterlichen Verhältnisse auf circa 2.500 Meter Seehöhe verlor er die Kontrolle über das Auto. Der… [+319 chars],
790346576a87646b2d560627d45d510d,2025-10-26T11:46:32Z,'Schnee',sport.orf.at,de,0.0,Schneefall verzögert zweiten Sölden-Durchgang,,https://sport.orf.at/stories/3147127/,https://sport.orf.at/mojo/1_4_1/storyserver//news/common/images/og-fallback-sport.png,,Wegen des aktuell starken Schneefalls ist der zweite Durchgang des Herren-Riesentorlaufs in Sölden um eine halbe Stunde auf 13.30 Uhr verschoben worden. Die Vorberichterstattung ist derzeit live in O… [+77 chars],
043032239aad1684dea52e2d18ab52f1,2025-10-26T13:37:44Z,'Schneefallgrenze',www.zeit.de,de,0.0,"Wetter in Bayern: Schnee, Sturm, Sonne: Bayern erlebt wechselhaftes Wetter","Hier finden Sie Informationen zu dem Thema „Wetter in Bayern“. Lesen Sie jetzt „Schnee, Sturm, Sonne: Bayern erlebt wechselhaftes Wetter“.",https://www.zeit.de/news/2025-10/26/schnee-sturm-sonne-bayern-erlebt-wechselhaftes-wetter,https://img.zeit.de/news/2025-10/26/schnee-sturm-sonne-bayern-erlebt-wechselhaftes-wetter-image-group/wide__1300x731,,"Das Wochenende klingt in Bayerns tieferen Lagen mit Regen und Schnee im Bergland aus. Oberhalb der 800 Meter könne es wenige Zentimeter schneien, oberhalb der 1.200 Meter bis zu fünf Zentimeter, teil… [+2081 chars]",
7d4972a55fb5a8fc348fc90b8a95f784,2025-10-26T13:51:06Z,'Schneefall',www.tagesspiegel.de,de,1.0,Weltcup-Start in Sölden: Ski-Star Odermatt gewinnt turbulenten Saisonauftakt,"Wind, Nebel, Schneefall: Beim Riesenslalom in Sölden ist alles dabei. Der Schweizer Topfavorit rast zum Sieg, ein Deutscher verpasst nur um Haaresbreite die Top Ten.",https://www.tagesspiegel.de/sport/weltcup-start-in-solden-ski-star-odermatt-gewinnt-turbulenten-saisonauftakt-14664515.html,https://www.tagesspiegel.de/images/14664512/alternates/BASE_16_9_W1400/1761486666000/ski-alpin-weltcup-in-solden.jpeg,,"Der Schweizer Ski-Star Marco Odermatt ist trotz Wetterkapriolen mit einem Sieg in die neue Saison gestartet - ein deutsches Trio raste in die Top 20. Odermatt, zuletzt viermal in Serie Gesamtweltcups… [+1357 chars]",
f81990e94e0d36f458978ba0340d4ac1,2025-10-26T15:40:36Z,'Schnee',www.stern.de,de,0.0,"Wintergruß: Erster Schnee der Saison - ""Kurzes Intermezzo""","Offenbach/Poppenhausen (lhe) - Der erste Schnee der Saison in Hessen: Ein Zentimeter Schnee ist auf dem höchsten Berg des Landes, der 950 Meter hohen",https://www.stern.de/gesellschaft/regional/hessen/wintergruss--erster-schnee-der-saison----kurzes-intermezzo--36163378.html,https://image.stern.de/36163380/t/eB/v1/w1440/r1.7778/-/26--jyrdhsxh5bv8axs2048jpeg---503975dfa85cb535.jpg,,"Kopiere den aktuellen Link
Zur Merkliste hinzufügen
Die Wasserkuppe zeigt sich gleich nach der Umstellung auf die Winterzeit weiß gezuckert. Allerdings nicht lange.
Der erste Schnee der Saison in … [+508 chars]",
09ce50d94ab17fdad0ca77b72b6c6913,2025-10-27T06:06:09Z,'Schnee',www.stern.de,de,0.0,"Wetterbericht: Neuschnee, Wind und Regen in Bayern erwartet","Im Freistaat fällt in den Bergen Schnee, sonst müssen sich die Menschen zunächst vor allem auf Regen einstellen. Wie sich das Wetter entwickelt und wo sich ab Mitte der Woche die Sonne zeigt.",https://www.stern.de/gesellschaft/regional/bayern/wetterbericht--neuschnee--wind-und-regen-in-bayern-erwartet-36164084.html,https://image.stern.de/36164086/t/ey/v1/w1440/r1.7778/-/27--6sc3iech4iv10axs2048jpeg---7a31bdce295a2517.jpg,,"Kopiere den aktuellen Link
Zur Merkliste hinzufügen
Im Freistaat fällt in den Bergen Schnee, sonst müssen sich die Menschen zunächst vor allem auf Regen einstellen. Wie sich das Wetter entwickelt u… [+1401 chars]",
ddc7441b660dd4fb7fd354f682cdf963,2025-10-27T06:06:09Z,'Schnee',www.zeit.de,de,0.0,"Wetterbericht: Neuschnee, Wind und Regen in Bayern erwartet","Hier finden Sie Informationen zu dem Thema „Wetterbericht“. Lesen Sie jetzt „Neuschnee, Wind und Regen in Bayern erwartet“.",https://www.zeit.de/news/2025-10/27/neuschnee-wind-und-regen-in-bayern-erwartet,https://img.zeit.de/news/2025-10/27/neuschnee-wind-und-regen-in-bayern-erwartet-image-group/wide__1300x731,,"In Bayern wird es windig, regnerisch und in den Bergen fällt Schnee. Der Deutsche Wetterdienst (DWD) rechnet oberhalb der 1.000-Meter-Marke mit bis zu 10 bis 20 Zentimetern Neuschnee, im Allgäuer Hoc… [+1194 chars]",
29517704e06c20b458a7799ae7a7ba29,2025-10-27T07:16:03Z,'Schnee',www.stern.de,de,0.0,Schneefall: Schnee in den Mittelgebirgen – Tauwetter folgt am Montag,"Leipzig - In den Höhenlagen in Sachsen, Sachsen, Anhalt und Thüringen ist erneut etwas Schnee gefallen. Oberhalb von 800 Meter seien einige wenige",https://www.stern.de/gesellschaft/regional/sachsen/schneefall--schnee-in-den-mittelgebirgen---tauwetter-folgt-am-montag-36164204.html,https://image.stern.de/36164206/t/Vs/v1/w1440/r1.7778/-/27--sbeoajqocmv5axs2048jpeg---d7108bbfaf4b7be6.jpg,,"Kopiere den aktuellen Link
Zur Merkliste hinzufügen
Winterlicher Gruß für Fichtelberg und Rennsteig: Doch das weiße Vergnügen ist schon am Montag wieder vorbei.
In den Höhenlagen in Sachsen, Sachs… [+585 chars]",
ac3ac6a03b499cc0b86150bada85f6fb,2025-10-27T07:16:03Z,'Schneefallgrenze',www.zeit.de,de,0.0,Schneefall: Schnee in den Mittelgebirgen – Tauwetter folgt am Montag,Hier finden Sie Informationen zu dem Thema „Schneefall“. Lesen Sie jetzt „Schnee in den Mittelgebirgen – Tauwetter folgt am Montag“.,https://www.zeit.de/news/2025-10/27/schnee-in-den-mittelgebirgen-tauwetter-folgt-am-montag,https://img.zeit.de/news/2025-10/27/schnee-in-den-mittelgebirgen-tauwetter-folgt-am-montag-image-group/wide__1300x731,,"In den Höhenlagen in Sachsen, Sachsen, Anhalt und Thüringen ist erneut etwas Schnee gefallen. Oberhalb von 800 Meter seien einige wenige Zentimeter gefallen, teilte der Deutsche Wetterdienst auf Anfr… [+461 chars]",
9e3ceb8399e06c6f66518a9f99cb5cba,2025-10-27T11:21:00Z,'Frost',www.stern.de,de,0.0,Vereiste Scheiben: Klare Sicht in Herbst und Winter: Wie man Autoscheiben schnell eisfrei bekommt,"Mit dem passenden Eisschaber, intelligenter Technik und entsprechender Vorbereitung besiegen Sie den Frost am Auto. Wir empfehlen die passenden Produkte dazu.",https://www.stern.de/auto/eiskratzer-fuers-auto--so-haben-sie-im-winter-immer-eine-freie-sicht-36164986.html,https://image.stern.de/36164988/t/hX/v1/w1440/r1.7778/-/eiskratzer-auto.jpg,,"Kopiere den aktuellen Link
Zur Merkliste hinzufügen
Mit dem passenden Eisschaber, intelligenter Technik und entsprechender Vorbereitung besiegen Sie den Frost am Auto. Wir empfehlen die passenden P… [+7598 chars]",
72fcaa71e2b6dd9065813978814888e3,2025-10-27T14:05:29Z,'Schnee',www.zeit.de,de,0.0,Sichere Straßen: Winterdienst ist auf Schnee und Eis vorbereitet,Hier finden Sie Informationen zu dem Thema „Sichere Straßen“. Lesen Sie jetzt „Winterdienst ist auf Schnee und Eis vorbereitet“.,https://www.zeit.de/news/2025-10/27/winterdienst-ist-auf-schnee-und-eis-vorbereitet,https://img.zeit.de/news/2025-10/27/winterdienst-ist-auf-schnee-und-eis-vorbereitet-image-group/wide__1300x731,,"Die Straßenmeistereien in Sachsen-Anhalt sehen sich gut vorbereitet. Rund 35.000 Tonnen Streusalz und 3.500 Tonnen Sole seien eingelagert, teilte das Ministerium für Infrastruktur und Digitales mit. … [+942 chars]",
5ed2b2b3ffb04484fc833c6c466f8251,2025-10-27T14:05:29Z,'Winterdienst',www.stern.de,de,0.0,Sichere Straßen: Winterdienst ist auf Schnee und Eis vorbereitet,Die ersten Flocken waren am Wochenende auf dem Brocken schon gefallen. Im Flachland wird es voraussichtlich noch etwas dauern. Die Straßenmeistereien sind aber schon jetzt vorbereitet.,https://www.stern.de/gesellschaft/regional/sachsen-anhalt/sichere-strassen--winterdienst-ist-auf-schnee-und-eis-vorbereitet-36165708.html,https://image.stern.de/36165710/t/Gz/v1/w1440/r1.7778/-/27--3j3ot2x3tvv4axs2048jpeg---74751919e4d37702.jpg,,"Kopiere den aktuellen Link
Zur Merkliste hinzufügen
Die ersten Flocken waren am Wochenende auf dem Brocken schon gefallen. Im Flachland wird es voraussichtlich noch etwas dauern. Die Straßenmeister… [+1142 chars]",
451f67a3ed6d9bb95073e39c5f72ba5a,2025-10-27T16:09:04Z,'Skigebiete',www.bild.de,de,0.0,Urlaubs-Express in den Schnee - Neue Züge fahren direkt in beliebte Skigebiete,Schnee- und Wintersport-Fans freuen sich auf den Start in die Skisaison – wenn da nicht die stressige Anfahrt vor der ersten Abfahrt wäre. Muss nicht sein.,https://www.bild.de/news/inland/neue-zuege-fahren-jetzt-direkt-in-beliebte-skigebiete-express-in-den-schnee-68ff4ee059e2e0975070cf4a,"https://images.bild.de/68ff4ee059e2e0975070cf4a/9d7ba50a4bf3343afde14ee02cabf2bf,3bca2857?w=1280",,"Schnee- und Wintersport-Fans freuen sich auf den Start in die Skisaison wenn da nicht die stressige Anfahrt vor der ersten Abfahrt wäre. Mit dem Auto unterwegs zu sein, bedeutet oftmals auch im Stau … [+2087 chars]",
e6cc9b339306de49abeac3534463a492,2025-10-27T18:59:50Z,'Schnee',tirol.orf.at,de,0.0,"Autoabsturz, Kettenpflicht und Sperren","Im dichten Schneetreiben ist Montagnachmittag ein  Wagen von der Hochfügenerstraße im Zillertal (Bezirk Schwaz) abgekommen und abgestürzt. Die Insassen, darunter eine schwangere Frau, wurden leicht verletzt. Im Westen Tirols fielen bis zu 50 Zentimeter Neusch…",https://tirol.orf.at/stories/3327563/,https://ibs.orf.at/tir?image=https%3A%2F%2Foekastatic.orf.at%2Fmims%2F2025%2F44%2F28%2Fcrops%2Fw%3D1200%2Ch%3D627%2Cq%3D75%2F2814410_master_1086128_vuabsturzhochfuegen1.jpg%3Fs%3Db1364e2af28a97ebe249531bfe80ee75fd8b6016,,Der erste Wintereinbruch in Tirols Bergen sorgte am Montag für eine Sperre der Hahntennjochstraße zwischen dem Hahntennjoch und Imst. Der Verkehr musste großräumig über Reutte ausweichen. Auch die Wi… [+810 chars],
b774a2d6fba6c8052b9ebc3fb8697a43,2025-10-28T05:30:11Z,'Glatteis',www.zeit.de,de,0.1,Partyschlager: Ende der Ballermann-Saison: Was macht der Sommer im Winter?,Hier finden Sie Informationen zu dem Thema „Partyschlager“. Lesen Sie jetzt „Ende der Ballermann-Saison: Was macht der Sommer im Winter?“.,https://www.zeit.de/news/2025-10/28/ende-der-ballermann-saison-was-macht-der-sommer-im-winter,https://img.zeit.de/news/2025-10/28/ende-der-ballermann-saison-was-macht-der-sommer-im-winter-image-group/wide__1300x731,,Mit dem letzten großen Partywochenende ist die Saison 2025 am berüchtigten Ballermann zu Ende gegangen. Die meisten Bars und Clubs an der Playa de Palma schließen über den Winter. Für die Stars der S… [+4222 chars],
1a9d310d6fc3857447378453c314869f,2025-10-28T05:30:11Z,'Schnee',www.stern.de,de,0.0,Partyschlager: Ende der Ballermann-Saison: Was macht der Sommer im Winter?,"Nach dem Saisonende am Ballermann kehrt für viele Partystars Ruhe ein – doch nicht alle legen die Füße hoch. Wer jetzt Schnee schippt, Konzerte plant oder Skier verleiht.",https://www.stern.de/lifestyle/partyschlager--ende-der-ballermann-saison--was-macht-der-sommer-im-winter--36167066.html,https://image.stern.de/36167068/t/Yv/v1/w1440/r1.7778/-/28--66oz5xk7a3v13axs2048jpeg---24367237ca86d0a5.jpg,,"Kopiere den aktuellen Link
Zur Merkliste hinzufügen
Nach dem Saisonende am Ballermann kehrt für viele Partystars Ruhe ein doch nicht alle legen die Füße hoch. Wer jetzt Schnee schippt, Konzerte pla… [+4307 chars]",
bdb5e00443500336d9503937a71c687b,2025-10-28T05:31:37Z,'Glatteis',www.tagesspiegel.de,de,0.0,Partyschlager: Ende der Ballermann-Saison: Was macht der Sommer im Winter?,"Nach dem Saisonende am Ballermann kehrt für viele Partystars Ruhe ein – doch nicht alle legen die Füße hoch. Wer jetzt Schnee schippt, Konzerte plant oder Skier verleiht.",https://www.tagesspiegel.de/gesellschaft/partyschlager-ende-der-ballermann-saison-was-macht-der-sommer-im-winter-14675720.html,https://www.tagesspiegel.de/images/14675717/alternates/BASE_16_9_W1400/1761629496000/julian-sommer.jpeg,,Mit dem letzten großen Partywochenende ist die Saison 2025 am berüchtigten Ballermann zu Ende gegangen. Die meisten Bars und Clubs an der Playa de Palma schließen über den Winter. Für die Stars der S… [+4135 chars],
d1d33fd1cc4d134c782b87bcacec570d,2025-10-28T08:27:00Z,'Schnee',www.stern.de,de,0.0,Weiße Einfahrt: So finden Sie den richtigen Schneeschieber für jeden Untergrund,"Vom ersten Schneefall bis zur letzten Räumaktion: Wie Sie den passenden Schneeschieber finden, effizient einsetzen und typische Anwendungsfehler vermeiden.",https://www.stern.de/familie/schneeschieber-kaufen--was-sie-bei-der-auswahl-beachten-sollten-36167236.html,https://image.stern.de/36167238/t/St/v2/w1440/r1.7778/-/schneeschieber.jpg,,"Kopiere den aktuellen Link
Zur Merkliste hinzufügen
Vom ersten Schneefall bis zur letzten Räumaktion: Wie Sie den passenden Schneeschieber finden, effizient einsetzen und typische Anwendungsfehler … [+5983 chars]",
c0c72bc0bff01dd83bda10530d5d5505,2025-10-28T10:46:40Z,'Schneefall',kaernten.orf.at,de,1.0,Jugendliche ohne Ausrüstung gerieten in Bergnot,"Die Bergretter von Mallnitz haben in der Nacht auf Dienstag zwei junge Villacher vom Auernig (Bezirk Spittal an der Drau) geborgen. Die beiden 14 und 15 Jahre alten Burschen waren unpassend angezogen in Schnee, Sturm und Nacht gekommen.",https://kaernten.orf.at/stories/3327654/,https://ibs.orf.at/ktn?image=https%3A%2F%2Foekastatic.orf.at%2Fmims%2F2025%2F44%2F76%2Fcrops%2Fw%3D1200%2Ch%3D627%2Cq%3D75%2F2814895_master_1086376_c9a0b14b-b3f3-4b28-b2ce-e93f64878eb8.jpeg%3Fs%3D56cee4aa6b8e2922908b0972ece21f40e647df36,,"Um 17.00 Uhr kam die Alarmierung von den Burschen selbst über die Notrufnummer. Einsatzleiter Gerhard Stranig und vier weitere Bergretter machten sich auf den Weg auf den Hausberg von Mallnitz, wo di… [+1221 chars]",
33881a3a9c45fe8ad2032e5c44a0bb6e,2025-10-28T12:37:11Z,'Glatteis',www.morgenpost.de,de,0.1,Von Berlin direkt ins Skigebiet? Neue Nachtzüge machen das möglich,"Ein Kölner Unternehmen hat neue Nachtzüge im Programm, die Berlin und beliebte Skiorte in Österreich miteinander verbinden – ohne Umstieg.",https://www.morgenpost.de/berlin/article410324236/von-berlin-direkt-ins-skigebiet-neue-nachtzuege-machen-das-moeglich.html,https://img.sparknews.funkemedien.de/410325473/410325473_1761655031_v16_9_1600.jpeg,,Über Nacht von der Hauptstadt auf die Skipiste: Das soll durch ein neues Zugangebot des Anbieters Train4you Realität werden. Der Urlaubs-Express (UEX) bietet erstmals Nachtzugverbindungen aus Deutsch… [+1815 chars],
5f42fcbd2dd96cf2a1f72c9b6b549e43,2025-10-28T15:17:59Z,'Wintereinbruch',www.bild.de,de,0.0,Wintereinbruch in den Alpen - Schnee türmt sich schon einen Meter hoch,Ein massiver Wintereinbruch hat am Montag die Alpen fest in den Griff genommen – und das schon Ende Oktober!,https://www.bild.de/news/ausland/wintereinbruch-in-den-alpen-schnee-tuermt-sich-einen-meter-hoch-69009f0d4876ac87d158c811,"https://images.bild.de/69009f0d4876ac87d158c811/237c7a183fd842fe409b2374ad12bd5a,14c10e4b?w=1280",,"Arlberg (Österreich) Ein massiver Wintereinbruch hat am Montag die Alpen fest in den Griff genommen: Es rieselte unaufhörlich vom Himmel ein Albtraum vor allem für Autofahrer, die von den Schneemasse… [+2118 chars]",
cf763a8d40c2d1e154e49b7905b2a082,2025-10-28T15:56:17Z,'Skigebiete',www.sueddeutsche.de,de,0.0,Ministerium streicht selten genutzte Zuschüsse: Bayern dreht den Schneekanonen den Geldhahn zu,Viele Skigebiete im Alpenraum setzen auf Kunstschnee gegen den Klimawandel. In Bayern soll es für Beschneiungsanlagen aber künftig keine staatlichen Zuschüsse mehr geben.,https://www.sueddeutsche.de/bayern/bayern-schneekanonen-geld-zuschuesse-wintersport-li.3330963,https://www.sueddeutsche.de/2023/12/04/9df1ca22-3b7b-43f6-93e1-14fa8034a1cc.jpeg?q=60&fm=webp&width=1200&rect=0%2C71%2C1349%2C759,,"Der grüne Landtagsabgeordnete Christian Zwanziger, dessen Fraktion schon seit vielen Jahren gegen diese Zuschüsse ankämpft, hat die Botschaft zuletzt sicherheitshalber noch in Frageform gekleidet. Is… [+4436 chars]",
a33881ca9b9b86ba951e8eb6b0d6a908,2025-10-29T13:27:50Z,'Schnee',www.n-tv.de,de,1.0,Erneut Bergsteiger eingeschneit: Heli verunglückt bei Rettungsversuch am Mount Everest,Ein Zyklon bringt heftigen Schneefall im Himalaja mit sich - und wieder sitzen Bergsteiger im Basislager am Mount Everest fest. Ein Hubschrauber soll sie retten. Doch bei der Landung kippt der Helikopter um. Der Pilot bleibt unversehrt.,https://www.n-tv.de/panorama/Heli-verunglueckt-bei-Rettungsversuch-am-Mount-Everest-article26128220.html,https://www.n-tv.de/img/incoming/crop26128251/5311328375-cImg_16_9-w1200/528087299.jpg,http://web.archive.org/web/20251030053933/https://www.n-tv.de/panorama/Heli-verunglueckt-bei-Rettungsversuch-am-Mount-Everest-article26128220.html,Ein Zyklon bringt heftigen Schneefall im Himalaja mit sich - und wieder sitzen Bergsteiger im Basislager am Mount Everest fest. Ein Hubschrauber soll sie retten. Doch bei der Landung kippt der Heliko… [+1236 chars],
b35fdcea12d1895b6828ca0c15d6cc49,2025-10-30T11:41:00Z,'Schnee',www.stern.de,de,0.0,"Ratgeber: Fünf Autos unter 15.000 Euro, die sich perfekt für den Winter eignen","Die kühlen Herbststürme sind durch und der erste Schnee der Saison ist gefallen. Wohl dem, der einen wintertauglichen Wagen hat, der einem das Wetter nicht übelnimmt.",https://www.stern.de/auto/fuenf-autos-unter-15-000-euro--die-sich-perfekt-fuer-den-winter-eignen-36159076.html,https://image.stern.de/36159094/t/dJ/v3/w1440/r1.7778/-/range-rover-evoque-1.jpg,,"Kopiere den aktuellen Link
Zur Merkliste hinzufügen
Die kühlen Herbststürme sind durch und der erste Schnee der Saison ist gefallen. Wohl dem, der einen wintertauglichen Wagen hat, der einem das We… [+679 chars]",
5967c15f9cbd5b61ca20cd0ca346cc0e,2025-10-30T12:15:15Z,'Glatteis',www.zeit.de,de,0.1,Schulen: Mehr Mitbestimmung: Was das neue Schulgesetz vorsieht,Hier finden Sie Informationen zu dem Thema „Schulen“. Lesen Sie jetzt „Mehr Mitbestimmung: Was das neue Schulgesetz vorsieht“.,https://www.zeit.de/news/2025-10/30/mehr-mitbestimmung-was-das-neue-schulgesetz-vorsieht,https://img.zeit.de/news/2025-10/30/mehr-mitbestimmung-was-das-neue-schulgesetz-vorsieht-image-group/wide__1300x731,,"Mehr Mitsprache für Schülerinnen und Schüler, mehr Freiraum für Schulen: Niedersachsens Kultusministerin Julia Willie Hamburg hat geplante Änderungen am Schulgesetz vorgestellt. Die Grünen-Politikeri… [+1905 chars]",
3d0454c0a23938470ac3f2f89b1e10e6,2025-10-30T12:15:15Z,'Glatteis',www.stern.de,de,0.1,Schulen: Mehr Mitbestimmung: Was das neue Schulgesetz vorsieht,Mitreden erwünscht: Niedersachsen will die Demokratie schon im Klassenzimmer üben – und Schulen mehr Freiraum geben. Ein Überblick über geplante Änderungen am Schulgesetz.,https://www.stern.de/gesellschaft/regional/niedersachsen-bremen/schulen--mehr-mitbestimmung--was-das-neue-schulgesetz-vorsieht-36175938.html,https://image.stern.de/36175940/t/P8/v1/w1440/r1.7778/-/30--i6wol6d5isv7axs2048jpeg---dd5362ff303dd1a9.jpg,,"Kopiere den aktuellen Link
Zur Merkliste hinzufügen
Mitreden erwünscht: Niedersachsen will die Demokratie schon im Klassenzimmer üben und Schulen mehr Freiraum geben. Ein Überblick über geplante Än… [+2090 chars]",
c80710a57ad22ed01cad4b9409bdaa69,2025-10-30T17:46:23Z,'Glatteis',www.n-tv.de,de,0.1,"RTL und ""Stern"" im Unterricht: Wie die AfD Lehrer und Schulleiter unter Druck setzt","Die Zahlen belegen: Rechtsextremistische Vorfälle an Schulen haben in den vergangenen Jahren enorm zugenommen. Gleichzeitig geraten jene, die sich für Vielfalt und Toleranz einsetzen, zunehmend unter Druck, wie Recherchen von RTL und ""Stern"" zeigen. Dabei spi…",https://www.n-tv.de/politik/Wie-die-AfD-Lehrer-und-Schulleiter-unter-Druck-setzt-article26129263.html,https://www.n-tv.de/img/incoming/crop26130167/6471325748-cImg_16_9-w1200/546218600.jpg,,"Die Zahlen belegen: Rechtsextremistische Vorfälle an Schulen haben in den vergangenen Jahren enorm zugenommen. Gleichzeitig geraten jene, die sich für Vielfalt und Toleranz einsetzen, zunehmend unter… [+8810 chars]",
5f24724d73e2fb192d32e30b144459a9,2025-10-31T09:00:39Z,'Frost',www.photoscala.de,de,0.0,"25 Tipps für Naturfotografie im Winter: zauberhafte Stimmung bei eisigen Temperaturen, Frost und Schnee","Naturfotografie im Winter hat ihren ganz besonderen Reiz und mit unseren Tipps gelingt jede Aufnahme – auch bei Frost und Schnee!
Der Beitrag 25 Tipps für Naturfotografie im Winter: zauberhafte Stimmung bei eisigen Temperaturen, Frost und Schnee erschien zuer…",https://www.photoscala.de/2025/10/31/tipps-fuer-naturfotografie-im-winter/,https://www.photoscala.de/wp-content/uploads/2025/10/nwildlife_aufmacher_iso-scaled.jpg,,"21 | Gehen Sie tiefer 
Wenn Sie auf gleicher Höhe mit dem Tier fotografieren, erhalten Sie eine intimere Perspektive. Wenn Sie vom Boden aus fotografieren, können Sie auch den Vorder- und Hintergrun… [+3135 chars]",
6b7574085229ce65e5ab456861621ee9,2025-10-31T14:03:00Z,'Glatteis',www.gamestar.de,de,0.1,"Deals: Halloween - Ich bereue es, dass ich diesen Horror-Hit nicht schon früher gespielt habe! [Anzeige]","Resident Evil und Silent Hill können für mich im Vergleich nicht mithalten: Dieses Horror-Adventure finde ich so viel besser – und wenn ihr es noch nicht gespielt habt, wird es jetzt höchste Zeit mit der Deluxe Edition!","https://www.gamestar.de/artikel/alan-wake-2-deluxe-edition-horror-meisterwerk-halloween-2025,3442223.html",https://images.cgames.de/images/gamestar/293/alan-wake-2-amazon-31102025-teaser_6383737.jpg,,"Ich dachte, ich hätte mit Survival-Horror à la Resident Evil und Dead Space schon die Spitze des Genres erlebt, aber falsch gedacht: Diese Horror-Perle hat, wenn es nach mir geht, den Thron beanspruc… [+4683 chars]",
5d47f323d82488e9f61a0bf3b7341f76,2025-10-31T23:00:33Z,'Streusalz',www.bild.de,de,1.0,Nur für BILDplus - Saubere Sache: 5 € Rabatt auf eine Autowäsche!,"Autofahrer aufgepasst! Schmutz, Regen, Streusalz – die kalte Jahreszeit ist eine echte Belastung für Lack und Sicht. Wer sein Auto jetzt schützen will, b...",https://www.bild.de/sonstiges/bildplus-gewinnspiele-aktionen/nur-fuer-bildplus-saubere-sache-5-rabatt-auf-eine-autowaesche-68f6252d9c193ceaa4c4e553,"https://images.bild.de/68f6252d9c193ceaa4c4e553/fdedf9b17bed8698bb77adcddc8077f3-landscape,88e2a66d?w=1280",,"Autofahrer aufgepasst! Schmutz, Regen, Streusalz die kalte Jahreszeit ist eine echte Belastung für Lack und Sicht. Wer sein Auto jetzt schützen will, bekommt bei IMO Car Wash exklusiv 5 Rabatt auf di… [+270 chars]",
