index,url,valid,domain,title,description,image,published,archive,content,quote,language,keyword
https://www.diepresse.com/16242408/wenn-der-henkel-reisst-ist-der-sommer-vorbei,https://www.diepresse.com/16242408/wenn-der-henkel-reisst-ist-der-sommer-vorbei,0,www.diepresse.com,"Wenn der Henkel reißt,
ist der Sommer vorbei","Die Blätter können schon im Sommer fallen, erst die Libelle sorgt für Klarheit.",https://www.diepresse.com/assets_v2/images/diepresse_meinung.png,2023-09-14T17:28:25Z,,"Die Blätter können schon im Sommer fallen, erst die Libelle sorgt für Klarheit.
Die Libelle war noch nicht da, der Herbst muss noch warten. Erst wenn sie über das Wasser fliegt, ist der Sommer vorbe… [+1691 chars]",,de,'Sommer'
https://noe.orf.at/stories/3224206/,https://noe.orf.at/stories/3224206/,0,noe.orf.at,Hagel zwingt Winzer zu Notlese,"Eine Hagelfront hat am Mittwoch in Lengenfeld (Bezirk Krems) im Weinbau schwere Schäden verursacht. Die Winzerinnen und Winzer standen kurz vor der Weinlese, die nun teilweise vorgezogen wird. Es gibt Ausfälle von mehr als 50 Prozent.",https://ibs.orf.at/noe?image=https%3A%2F%2Foekastatic.orf.at%2Fmims%2F2023%2F37%2F62%2Fcrops%2Fw%3D1200%2Ch%3D627%2Cq%3D75%2F1940042_master_729062_wein.jpg%3Fs%3Db85d1c684391fea76813dde0e75e9002653e8865,2023-09-14T17:40:13Z,,"Mehrere große Gewitterzellen zogen am Mittwoch über Niederösterreich. Die Folge waren Überflutungen, Vermurungen und eine Hagelfront. Letztere führte in der Gemeinde Lengenfeld zu schweren Schäden, W… [+2413 chars]",,de,'Weinlese'
https://orf.at/stories/3331216/,https://orf.at/stories/3331216/,0,orf.at,NÖ: Hagel zwingt Winzer zu Notlese,,https://orf.at/mojo/1_4_1/storyserver//news/common/images/og-fallback-news.png,2023-09-14T17:49:18Z,,"Eine Hagelfront hat gestern in Lengenfeld (Niederösterreich) im Weinbau schwere Schäden verursacht. Die Winzerinnen und Winzer standen kurz vor der Weinlese, die nun teilweise vorgezogen wird. Es gib… [+59 chars]",,de,'Weinlese'
https://www.zeit.de/news/2023-09/14/kanufahrer-vermisst-zwei-kanuten-kentern-bei-hochwasser,https://www.zeit.de/news/2023-09/14/kanufahrer-vermisst-zwei-kanuten-kentern-bei-hochwasser,0,www.zeit.de,Unwetter: Kanufahrer vermisst: Zwei Kanuten kentern bei Hochwasser,,,2023-09-14T18:18:50Z,,"When browsing with ads:
We collect personal data and also transmit it to third-party providers
 that help us improve and finance our digital content. Some of the information stored on your device, … [+821 chars]",,de,'Hochwasser'
https://www.zeit.de/news/2023-09/15/corona-experte-wendtner-optimistisch-fuer-diesen-winter,https://www.zeit.de/news/2023-09/15/corona-experte-wendtner-optimistisch-fuer-diesen-winter,0,www.zeit.de,Krankheiten: Corona-Experte Wendtner «optimistisch für diesen Winter»,,,2023-09-15T03:10:47Z,,"When browsing with ads:
We collect personal data and also transmit it to third-party providers
 that help us improve and finance our digital content. Some of the information stored on your device, … [+821 chars]",,de,'Winter'
https://www.zeit.de/news/2023-09/15/sommer-kehrt-am-wochenende-nach-sachsen-zurueck,https://www.zeit.de/news/2023-09/15/sommer-kehrt-am-wochenende-nach-sachsen-zurueck,0,www.zeit.de,Wetter: Sommer kehrt am Wochenende nach Sachsen zurück,,,2023-09-15T05:26:43Z,,"When browsing with ads:
We collect personal data and also transmit it to third-party providers
 that help us improve and finance our digital content. Some of the information stored on your device, … [+821 chars]",,de,'Sommer'
https://www.welt.de/wissenschaft/article247465962/Klimawandel-Apokalypse-Szenarien-der-Planetaren-Grenzen-stehen-auf-duerrem-Fundament.html,https://www.welt.de/wissenschaft/article247465962/Klimawandel-Apokalypse-Szenarien-der-Planetaren-Grenzen-stehen-auf-duerrem-Fundament.html,0,www.welt.de,Wie Wissenschaftler mit Apokalypse-Studien Karriere machen,"Medien warnen mit grellen Schlagzeilen, die Menschheit hätte ihre „Planetaren Grenzen“ überschritten. In Wahrheit steht die Theorie auf dürrem Fundament – auch bei einer neuen Studie. Sie dient vor allem als Machtinstrument.",https://img.welt.de/img/wissenschaft/mobile247471074/2981357307-ci16x9-w1200/Light-effect-similar-to-an-eclypse-on-sunset-sky-manipulated-image.jpg,2023-09-15T07:06:37Z,,"Wissenschaftler, die Machtinteressen verfolgen, stehen vor einem Problem: Aus wissenschaftlichen Ergebnissen folgen niemals Handlungsanweisungen das beschränkt den Einfluss der Wissenschaft. Ziel Mac… [+6494 chars]",,de,'Frühling'
https://www.focus.de/wissen/natur/schoener-garten-rosen-im-herbst-schneiden-ja-oder-nein_id_205902878.html,https://www.focus.de/wissen/natur/schoener-garten-rosen-im-herbst-schneiden-ja-oder-nein_id_205902878.html,0,www.focus.de,Schöner Garten - Rosen im Herbst schneiden – ja oder nein?,"Wer Rosen im Garten hat weiß: Im Frühjahr, wenn die Forsythien blühen, ist es Zeit für einen kräftigen Rückschnitt. Ob man Rosen auch im Herbst noch einmal schneiden soll, ist hingegen umstritten.",https://p6.focus.de/img/fotos/id_205901758/gettyimages-1272281860.jpg?im=Crop%3D%280%2C577%2C3464%2C1732%29%3BResize%3D%281200%2C627%29&impolicy=perceptual&quality=mediumHigh&hash=4c953b7e3b8f24a0ede57ce499489b1ca509146f8be856e6c35c43e41b10797d,2023-09-15T09:15:22Z,,"Wer Rosen im Garten hat weiß: Im Frühjahr, wenn die Forsythien blühen, ist es Zeit für einen kräftigen Rückschnitt. Ob man Rosen auch im Herbst noch einmal schneiden soll, ist hingegen umstritten. Ei… [+2799 chars]",,de,'Frühling'
https://www.stern.de/gesellschaft/regional/rheinland-pfalz-saarland/wein--winzerverband-sieht-geringere-weinernte-33828626.html,https://www.stern.de/gesellschaft/regional/rheinland-pfalz-saarland/wein--winzerverband-sieht-geringere-weinernte-33828626.html,0,www.stern.de,Wein: Winzerverband sieht geringere Weinernte,"Die Weinernte in Rheinhessen und der Pfalz wird nach Einschätzung des Bauern- und Winzerverbands deutlich geringer ausfallen als angenommen. Die bisherigen Erträge in den beiden größten deutschen Anbaugebieten seien ""eher ernüchternd"", teilte der Bauern- und …",https://image.stern.de/33828628/t/NU/v1/w1440/r1.7778/-/15--urnnewsmldpacom2009010123091599204453v3w800h600l535t0r2055b1239jpeg---db64879d8cf438f0.jpg,2023-09-15T09:23:23Z,,Die Weinernte in Rheinhessen und der Pfalz wird nach Einschätzung des Bauern- und Winzerverbands deutlich geringer ausfallen als angenommen. Die bisherigen Erträge in den beiden größten deutschen Anb… [+1283 chars],,de,'Ernte'
https://www.stern.de/familie/frostspanner-bekaempfen--so-schuetzen-sie-ihre-obstbaeume-33825178.html,https://www.stern.de/familie/frostspanner-bekaempfen--so-schuetzen-sie-ihre-obstbaeume-33825178.html,0,www.stern.de,Paarungszeit im Spätherbst: Nimmersatte Raupen: So schützen Sie Ihre Obstbäume vor dem Frostspanner,"Noch bevor die Temperaturen unter null Grad sinken, verfallen die meisten Schmetterlinge in eine Winterstarre. Nicht jedoch der Frostspanner: Die Puppen des Falters schlüpfen zwischen Oktober und November, meist nach dem ersten Frost, und paaren sich. Im dara…",https://image.stern.de/33825188/t/yn/v6/w1440/r1.7778/-/frostspanner-raupe.jpg,2023-09-15T10:47:00Z,,"Der Name des Frostspanners setzt sich aus dem Umstand zusammen, dass die Puppen bei niedrigen Temperaturen schlüpfen, und der Fresstechnik: Um bei ihrem Mahl nicht gestört zu werden, spinnen sich die… [+4176 chars]",,de,'Winter'
https://www.dw.com/de/die-landwirtschaft-als-klimaretter/a-66533044,https://www.dw.com/de/die-landwirtschaft-als-klimaretter/a-66533044,0,www.dw.com,Die Landwirtschaft als Klimaretter?,"Die Landwirtschaft ist einer der Treiber des Klimawandels und leidet unter den Folgen wie Dürren und Starkregen. Um das zu ändern, experimentiert der Brandenburger Landwirt Benedikt Bösel mit neuen ""alten"" Ansätzen.",https://static.dw.com/image/66558402_6.jpg,2023-09-15T11:48:00Z,,"Wenn man sich in Deutschland irgendeinen Ort aussuchen kann, um dort Landwirtschaft zu betreiben, dann steht man in Brandenburg sicherlich vor den größten Herausforderungen. Die Böden sind nährstoffa… [+9386 chars]",,de,'Dürre'
https://www.stern.de/digital/technik/formula-1-felgenbaum-bei-ebay-im-angebot--ein-guter-deal--33827932.html,https://www.stern.de/digital/technik/formula-1-felgenbaum-bei-ebay-im-angebot--ein-guter-deal--33827932.html,0,www.stern.de,eBay-Deal im Check: Formula-1-Felgenbaum für unter 30 Euro: Bereit für den Reifenwechsel?,Spätestens im Oktober steht für Autobesitzer der nächste Reifenwechsel an. Aber wohin mit den Sommerreifen? Ein Felgenbaum leistet hier gute Dienste. Aktuell gibt es bei eBay einen Felgenbaum von Formula 1 mit sattem Rabatt. Wie gut ist der Deal?,https://image.stern.de/33827946/t/zZ/v3/w1440/r1.7778/-/reifenwechsel-felgenbaum.jpg,2023-09-15T12:05:00Z,,Spätestens im Oktober steht für Autobesitzer der nächste Reifenwechsel an. Aber wohin mit den Sommerreifen? Ein Felgenbaum leistet hier gute Dienste. Aktuell gibt es bei eBay einen Felgenbaum von For… [+2985 chars],,de,'Sommer'
https://www.welt.de/wirtschaft/article247442056/Landwirtschaft-Die-Zukunft-der-Bauern-wird-immer-mehr-zur-Glueckssache.html,https://www.welt.de/wirtschaft/article247442056/Landwirtschaft-Die-Zukunft-der-Bauern-wird-immer-mehr-zur-Glueckssache.html,0,www.welt.de,Die Zukunft der deutschen Bauern wird immer mehr zur Glückssache,"Zu nass, zu trocken, dann wieder zu verregnet: Immer öfter wird das Wetter zu Ernte-Ausfällen sorgen, prognostizieren Politiker und Landwirte. Experten sehen für die Zukunft der Branche deshalb dringenden Handlungsbedarf.",https://img.welt.de/img/wirtschaft/mobile247442824/6711352087-ci16x9-w1200/Combine-harvester-harvests-barley-endless-cornfield-with-cumulus.jpg,2023-09-15T12:53:31Z,,"Zahlreiche Klischees kursieren über Landwirte. Eines ist, dass sie ständig über das Wetter jammern. Egal, ob es regnet oder die Sonne scheint, ob es warm, heiß, kalt, frostig oder neblig ist immer he… [+3347 chars]",,de,'Ernte'
https://www.diepresse.com/16427982/oesv-asse-trainierten-in-ushuaia-mit-odermatt,https://www.diepresse.com/16427982/oesv-asse-trainierten-in-ushuaia-mit-odermatt,0,www.diepresse.com,ÖSV-Asse trainierten in Ushuaia mit Odermatt,"Während die Speed-Spezialisten bereits wieder in der Heimat sind, weilt eine Techniker-Abteilung des heimischen Skiverbandes dieser Tage noch am unteren Zipfel Südamerikas. In Ushuaia. Neuschnee und Wind waren Wegbegleiter, das Tiefschnee-Fahren im Argentinie…",https://img.diepresse.com/public/incoming/2n71fb-imago0239934464h.jpg/alternates/DPR_SOCIAL_NACHRICHTEN/imago0239934464h.jpg,2023-09-15T14:00:37Z,,"Während die Speed-Spezialisten bereits wieder in der Heimat sind, weilt eine Techniker-Abteilung des heimischen Skiverbandes dieser Tage noch am unteren Zipfel Südamerikas. In Ushuaia. Neuschnee und … [+3065 chars]",,de,'Schnee'
https://www.nzz.ch/zuerich/news-aus-zuerich-die-zhaw-in-winterthur-will-ausbauen-ld.1751637,https://www.nzz.ch/zuerich/news-aus-zuerich-die-zhaw-in-winterthur-will-ausbauen-ld.1751637,0,www.nzz.ch,KURZMELDUNGEN - News aus Zürich: Die ZHAW will in Winterthur ausbauen,"NZZ Nachrichten, Hintergründe, Meinungen aus der Schweiz, International, Sport, Digital, Wirtschaft, Auto & mehr. Fundierte Berichterstattung rund um die Uhr.","https://img.nzz.ch/2023/09/15/a5697519-3367-46d2-a0a1-17f7c3ba36fc.jpeg?width=1200&height=674&fit=bound&quality=75&auto=webp&crop=4297,2414,x297,y335&wmark=nzz",2023-09-15T14:50:42Z,,"Die ZHAW will in Winterthur ausbauen
Die Hauptbibliothek der ZHAW in Winterthur.
bai. Mit dem Bevölkerungswachstum im Kanton Zürich sind auch die Studierendenzahlen an der Zürcher Hochschule für An… [+32368 chars]",,de,'Winter'
https://www.focus.de/panorama/wetter-aktuell/wetter-in-deutschland-sonniger-spaetsommer-am-wochenende_id_54933749.html,https://www.focus.de/panorama/wetter-aktuell/wetter-in-deutschland-sonniger-spaetsommer-am-wochenende_id_54933749.html,0,www.focus.de,Wetter im Ticker - Sonniger Spätsommer am Wochenende,Nach der Unwetterfront erwartet uns am Wochenenden in weiten Teilen des Landes wieder die Sonne und Temperaturen bis 28 Grad. Der Spätsommer zieht über Deutschland ein. Lesen Sie alle wichtigen Wetter-News im Ticker.,https://p6.focus.de/img/regional/bayern/id_201792758/zahlreiche-blitze-sind-ueber-einem-wohnhaus-zu-sehen..jpg?im=Crop%3D%280%2C231%2C2048%2C1024%29%3BResize%3D%281200%2C627%29&impolicy=perceptual&quality=mediumHigh&hash=9dd107aae738472a95a1c7ab0c5989ab2feed07811607e0166da62ae2ccb0944,2023-09-16T07:52:46Z,,Nach der Unwetterfront erwartet uns am Wochenenden in weiten Teilen des Landes wieder die Sonne und Temperaturen bis 28 Grad. Der Spätsommer zieht über Deutschland ein. Lesen Sie alle wichtigen Wette… [+9022 chars],,de,'Sommer'
https://www.zeit.de/news/2023-09/16/angenehme-temperaturen-am-wochenende-gewitter-moeglich,https://www.zeit.de/news/2023-09/16/angenehme-temperaturen-am-wochenende-gewitter-moeglich,0,www.zeit.de,Wetter: Angenehme Temperaturen am Wochenende: Gewitter möglich,,,2023-09-16T08:59:23Z,,"When browsing with ads:
We collect personal data and also transmit it to third-party providers
 that help us improve and finance our digital content. Some of the information stored on your device, … [+821 chars]",,de,'Gewitter'
https://www.stern.de/gesellschaft/regional/nordrhein-westfalen/wetter--angenehme-temperaturen-am-wochenende--gewitter-moeglich-33831660.html,https://www.stern.de/gesellschaft/regional/nordrhein-westfalen/wetter--angenehme-temperaturen-am-wochenende--gewitter-moeglich-33831660.html,0,www.stern.de,Wetter: Angenehme Temperaturen am Wochenende: Gewitter möglich,"Die Menschen in Nordrhein-Westfalen erwartet ein Sommerwochenende mit angenehmen Temperaturen. Diese liegen nach Angaben des Deutschen Wetterdienstes (DWD) am Samstag und Sonntag zwischen 24 und 28 Grad, auch die Sonne zeige sich vielerorts.",https://image.stern.de/33831662/t/_L/v1/w1440/r1.7778/-/16--urnnewsmldpacom2009010123091699215584v3w800h600l665t94r1937b1582jpeg---97dceb9ff6e9a5e0.jpg,2023-09-16T08:59:23Z,,Die Menschen in Nordrhein-Westfalen erwartet ein Sommerwochenende mit angenehmen Temperaturen. Diese liegen nach Angaben des Deutschen Wetterdienstes (DWD) am Samstag und Sonntag zwischen 24 und 28 G… [+548 chars],,de,'Gewitter'
https://www.stern.de/gesellschaft/regional/hessen/spaetsommer--schauer-und-gewitter-zum-wochenstart-in-hessen-erwartet-33831826.html,https://www.stern.de/gesellschaft/regional/hessen/spaetsommer--schauer-und-gewitter-zum-wochenstart-in-hessen-erwartet-33831826.html,0,www.stern.de,Spätsommer: Schauer und Gewitter zum Wochenstart in Hessen erwartet,"Nach einem Spätsommerwochenende in Hessen bringt die neue Woche einen Wetterumschwung mit sich. Am Sonntag soll es wechselnd bewölkt, teils auch heiter werden, wie der Deutsche Wetterdienst (DWD) am Samstag mitteilte. Maximal steigen die Temperaturen auf 25 b…",https://image.stern.de/33831828/t/mB/v1/w1440/r1.7778/-/16--urnnewsmldpacom2009010123091699215903v3w800h600l143t0r2416b1706jpeg---327865c64e495d6f.jpg,2023-09-16T09:53:30Z,,"Nach einem Spätsommerwochenende in Hessen bringt die neue Woche einen Wetterumschwung mit sich. Am Sonntag soll es wechselnd bewölkt, teils auch heiter werden, wie der Deutsche Wetterdienst (DWD) am … [+849 chars]",,de,'Gewitter'
https://www.zeit.de/news/2023-09/16/schauer-und-gewitter-zum-wochenstart-in-hessen-erwartet,https://www.zeit.de/news/2023-09/16/schauer-und-gewitter-zum-wochenstart-in-hessen-erwartet,0,www.zeit.de,Spätsommer: Schauer und Gewitter zum Wochenstart in Hessen erwartet,,,2023-09-16T09:53:30Z,,"When browsing with ads:
We collect personal data and also transmit it to third-party providers
 that help us improve and finance our digital content. Some of the information stored on your device, … [+821 chars]",,de,'Gewitter'
https://www.zeit.de/news/2023-09/16/sonnenschein-und-gewitter-wechselhaftes-wetter-im-suedwesten,https://www.zeit.de/news/2023-09/16/sonnenschein-und-gewitter-wechselhaftes-wetter-im-suedwesten,0,www.zeit.de,Spätsommer: Sonnenschein und Gewitter: Wechselhaftes Wetter im Südwesten,,,2023-09-16T10:00:51Z,,"When browsing with ads:
We collect personal data and also transmit it to third-party providers
 that help us improve and finance our digital content. Some of the information stored on your device, … [+821 chars]",,de,'Gewitter'
https://www.stern.de/gesellschaft/regional/baden-wuerttemberg/spaetsommer--sonnenschein-und-gewitter--wechselhaftes-wetter-im-suedwesten-33831856.html,https://www.stern.de/gesellschaft/regional/baden-wuerttemberg/spaetsommer--sonnenschein-und-gewitter--wechselhaftes-wetter-im-suedwesten-33831856.html,0,www.stern.de,Spätsommer: Sonnenschein und Gewitter: Wechselhaftes Wetter im Südwesten,"Das Wochenendwetter in Baden-Württemberg zeigt sich wechselhaft. Der Samstag beginnt nebelig, dann steigen die Temperaturen im Südwesten bis auf 29 Grad Celsius. Laut Vorhersage des Deutschen Wetterdienstes (DWD) werden ab dem Abend von Westen her starke Gewi…",https://image.stern.de/33831858/t/41/v1/w1440/r1.7778/-/16--urnnewsmldpacom2009010123091699215934v3w800h600l143t0r2416b1706jpeg---746176261bd2f2cb.jpg,2023-09-16T10:00:51Z,,"Das Wochenendwetter in Baden-Württemberg zeigt sich wechselhaft. Der Samstag beginnt nebelig, dann steigen die Temperaturen im Südwesten bis auf 29 Grad Celsius. Laut Vorhersage des Deutschen Wetterd… [+1023 chars]",,de,'Gewitter'
https://www.faz.net/aktuell/sport/fussball/hans-joachim-watzkes-kritik-an-kinderfussball-reform-verlierer-sollt-ihr-sein-19176207.html,https://www.faz.net/aktuell/sport/fussball/hans-joachim-watzkes-kritik-an-kinderfussball-reform-verlierer-sollt-ihr-sein-19176207.html,0,www.faz.net,Strittige Kinderfußball-Reform: Verlierer sollt ihr sein,"Hans-Joachim Watzke steht im Machtzentrum des deutschen Fußballs. Längst nicht mehr alle glauben, dass er noch auf der Höhe der Zeit ist. Seine Kritik an der Kinderfußball-Reform schreckt den DFB auf.",https://media0.faz.net/ppmedia/aktuell/sport/3619693455/1.9176202/facebook_teaser/manche-wollen-gar-nicht-mehr.jpg,2023-09-16T11:00:32Z,,"Die Bedeutung eines Menschen lässt sich mitunter auch an dessen Reiseroute erkennen. Hans-Joachim Watzke, genannt Aki, wurde während der vergangenen Tage in seiner Funktion als Vizepräsident des Deut… [+3023 chars]",,de,'Herbst'
https://www.zeit.de/news/2023-09/16/sonne-am-sonntag-schauer-und-gewitter-zum-wochenstart,https://www.zeit.de/news/2023-09/16/sonne-am-sonntag-schauer-und-gewitter-zum-wochenstart,0,www.zeit.de,Wetter: Sonne am Sonntag: Schauer und Gewitter zum Wochenstart,,,2023-09-16T11:48:19Z,,"When browsing with ads:
We collect personal data and also transmit it to third-party providers
 that help us improve and finance our digital content. Some of the information stored on your device, … [+821 chars]",,de,'Gewitter'
https://www.stern.de/gesellschaft/regional/rheinland-pfalz-saarland/wetter--sonne-am-sonntag--schauer-und-gewitter-zum-wochenstart--33832076.html,https://www.stern.de/gesellschaft/regional/rheinland-pfalz-saarland/wetter--sonne-am-sonntag--schauer-und-gewitter-zum-wochenstart--33832076.html,0,www.stern.de,Wetter: Sonne am Sonntag: Schauer und Gewitter zum Wochenstart,"Auf ein vielerorts sonniges Wochenende in Rheinland-Pfalz und dem Saarland folgt ein Wetterumschwung mit Schauern und Gewittern. Am Sonntag sei ein Mix aus Sonne und Wolken zu erwarten, teilte der Deutsche Wetterdienst (DWD) am Samstag mit. Am Morgen kann es …",https://image.stern.de/33832078/t/lL/v1/w1440/r1.7778/-/16--urnnewsmldpacom2009010123091699216666v3w800h600l145t0r2413b1703jpeg---4d9b445644feaa91.jpg,2023-09-16T11:48:19Z,,"Auf ein vielerorts sonniges Wochenende in Rheinland-Pfalz und dem Saarland folgt ein Wetterumschwung mit Schauern und Gewittern. Am Sonntag sei ein Mix aus Sonne und Wolken zu erwarten, teilte der De… [+1103 chars]",,de,'Gewitter'
https://www.faz.net/aktuell/rhein-main/region-und-hessen/duerre-setzt-organische-substanzen-aus-regenwaldboden-frei-19150446.html,https://www.faz.net/aktuell/rhein-main/region-und-hessen/duerre-setzt-organische-substanzen-aus-regenwaldboden-frei-19150446.html,0,www.faz.net,Effekt auf Klima möglich: Dürre setzt organische Substanzen frei,"Auch Regenwälder wie am Amazonas werden künftig öfter von Trockenheit betroffen sein. Das verändert die Funktion des Bodens und könnte Folgen für das Klima haben, wie Forscher aus Mainz vermuten.",https://media1.faz.net/ppmedia/aktuell/gesellschaft/2644292033/1.9150445/facebook_teaser/dreifach-maltraetiert-der.jpg,2023-09-16T11:55:44Z,,"Lange Trockenheit in Regenwäldern führt dazu, dass aus dem Boden flüchtige organische Substanzen freigesetzt werden. Das hat ein Forscherteam herausgefunden, zu dem Wissenschaftler des Mainzer Max-Pl… [+1322 chars]",,de,'Dürre'
https://www.telepolis.de/features/Meereis-im-Klimawandel-Neuer-Negativ-Rekord-am-Suedpol-9307381.html,https://www.telepolis.de/features/Meereis-im-Klimawandel-Neuer-Negativ-Rekord-am-Suedpol-9307381.html,0,www.telepolis.de,Meereis im Klimawandel: Neuer Negativ-Rekord am Südpol,Bilanz des Arktischen Sommers: Bislang galt die rückläufige Meereis-Bedeckung am Nordpol als bedrohlich. Was sich gerade ändert.,https://heise.cloudimg.io/bound/1200x1200/q85.png-lossy-85.webp-lossy-85.foil1/_www-heise-de_/imgs/18/4/3/0/3/9/2/7/1280px-Diatoms_through_the_microscope-11d12653384173ab.jpeg,2023-09-16T12:00:00Z,,"Bilanz des Arktischen Sommers: Bislang galt die rückläufige Meereis-Bedeckung am Nordpol als bedrohlich. Was sich gerade ändert.
Was der Eisbär am Nordpol ist, sind die Pinguine auf der Gegenseite: … [+8135 chars]",,de,'Sommer'
https://www.n-tv.de/mediathek/videos/wetter/Erste-Gewitter-Vorboten-troepfeln-in-den-warmen-Sonntag-article24399672.html,https://www.n-tv.de/mediathek/videos/wetter/Erste-Gewitter-Vorboten-troepfeln-in-den-warmen-Sonntag-article24399672.html,0,www.n-tv.de,Sonnenwetter zum Wochenabschluss: Erste Gewitter-Vorboten tröpfeln in den warmen Sonntag,"Wer am Sonntag nicht arbeiten muss, der sollte den Tag auf jeden Fall draußen verbringen. Das angenehme Spätsommerwetter wird nur hier und da durch einige Regenfälle gestört. Ab Montag schwingt die Witterung um, es sind flächendeckend teils schwere Gewitter z…",https://bilder3.n-tv.de/img/incoming/crop24401294/6291326206-cImg_16_9-w1200/417788128.jpg,2023-09-16T14:54:00Z,,,,de,'Gewitter'
https://orf.at/stories/3331430/,https://orf.at/stories/3331430/,0,orf.at,Tod von Österreichern bestätigt,Nach dem Hochwasser in Griechenland sind zwei geborgene Todesopfer als die seit mehr als einer Woche vermissten Österreicher identifiziert worden. Das teilte das Außenministerium Samstagabend mit. „Unser tief empfundenes Beileid gilt in diesen schweren Stunde…,https://ibs.orf.at/news?image=https%3A%2F%2Fassets.orf.at%2Fmims%2F2023%2F37%2F82%2Fcrops%2Fw%3D1200%2Ch%3D630%2Cq%3D75%2F1942329_master_729982_griechenland_oesterreichisches_paar_identifiziert_r.jpg%3Fs%3D5e3bcfe7a223e7d5ddec7b94ec4c1b9d76290484,2023-09-16T16:59:53Z,,"Die nunmehr vorliegenden Ergebnisse der DNA-Abgleiche haben bestätigt, dass es sich um die beiden seit den schweren Überschwemmungen Vermissten handelt, hieß es in einer Stellungnahme. Das Team der ö… [+1977 chars]",,de,'Hochwasser'
https://www.morgenpost.de/berlin/article239592495/wetter-berlin-aktuell-heute-morgen-gewitter-unwetter.html,https://www.morgenpost.de/berlin/article239592495/wetter-berlin-aktuell-heute-morgen-gewitter-unwetter.html,0,www.morgenpost.de,Wetter in Berlin: Neue Gewitter in Berlin – Temperaturen sinken drastisch,Noch verwöhnt der Spätsommer. Aber damit ist es bald vorbei: Neue Gewitter rollen heran. Wann treffen sie Berlin? Die aktuelle Vorhersage.,https://img.morgenpost.de/img/incoming/crop239592491/5142604909-w820-cv16_9-q85/213889174.jpg,2023-09-16T19:50:27Z,,Berlin. Der Sommer dreht noch einmal auf: Das Wetter zeigt sich in Berlin und Brandenburg an diesem Wochenende von seiner prachtvollen Seite. Bei Temperaturen an die 30 Grad kann man leicht vergessen… [+2390 chars],,de,'Gewitter'
https://www.n-tv.de/mediathek/videos/wetter/Vor-den-neuen-Gewittern-dreht-die-Sonne-nochmal-auf-article24401091.html,https://www.n-tv.de/mediathek/videos/wetter/Vor-den-neuen-Gewittern-dreht-die-Sonne-nochmal-auf-article24401091.html,0,www.n-tv.de,Vielerorts Werte um die 30 Grad: Vor den neuen Gewittern dreht die Sonne nochmal auf,"Nach morgendlicher Nebelauflösung macht dieser Sonntag seinem Namen alle Ehre und lädt zu einem ausgiebigen Spaziergang nach Draußen. Lediglich im Nordwesten fällt hier und da Regen. Das sieht zum Start in die neue Woche anders aus, denn da sind wieder landes…",https://bilder3.n-tv.de/img/incoming/crop24401134/562132717-cImg_16_9-w1200/425926285.jpg,2023-09-17T05:11:00Z,,,,de,'Gewitter'
https://www.bild.de/ratgeber/2023/ratgeber/zeichen-des-klimawandels-urwaldkaefer-bei-berlin-entdeckt-85424330.bild.html,https://www.bild.de/ratgeber/2023/ratgeber/zeichen-des-klimawandels-urwaldkaefer-bei-berlin-entdeckt-85424330.bild.html,0,www.bild.de,Zeichen des Klimawandels - Urwaldkäfer bei Berlin entdeckt,Der Plattnasen-Holzrüssler ernährt sich von absterbenden Eichen. Durch den Klimawandel und Dürre hat er sich so bis in den Norden Deutschlands ausgebreitet.,"https://images.bild.de/65048bdaaadcfa6659ed60d1/05d7f3e7134051c44bf63e8ca9973930,490b48ce?w=1280",2023-09-17T08:07:56Z,,"In Brandenburg, kurz hinter Berlin-Spandau ist ein außergewöhnlicher Fund gelungen: Unter den uralten Eichen der Döberitzer Heide wurde ein Plattnasen-Holzrüssler entdeckt.
Der Biologe Dr. Jörg Müll… [+1484 chars]",,de,'Dürre'
