index,url,valid,domain,title,description,image,published,archive,content,quote,language,keyword
https://www.dw.com/de/deutschland-verliert-wirtschaftliche-potenz/a-65236464,https://www.dw.com/de/deutschland-verliert-wirtschaftliche-potenz/a-65236464,0,www.dw.com,Deutschland verliert wirtschaftliche Potenz,"Gerade mal 0,3 Prozent Wachstum sagen führende Wirtschaftsforschungsinstitute der deutschen Wirtschaft für 2023 voraus. Das ist bescheiden, dürfte in Zukunft aber die Regel werden. Der Winter war mild, der Energieverbrauch geringer als befürchtet. Die erwarte…",https://static.dw.com/image/60494819_6.jpg,2023-04-05T13:23:00Z,,"Der Winter war mild, der Energieverbrauch geringer als befürchtet. Die erwartete Rezession bleibt absehbar aus, statt dessen gibt esein kleines Konjukturplus von 0,3 Prozent. ""Der konjunkturelle Rück… [+7100 chars]",,de,'Winter'
https://www.sueddeutsche.de/muenchen/iaa-mobility-muenchen-vda-1.5782475,https://www.sueddeutsche.de/muenchen/iaa-mobility-muenchen-vda-1.5782475,0,www.sueddeutsche.de,Verkehrsmesse in München: IAA verspricht mehr Möglichkeiten für Testfahrten,"Die Verkehrsmesse im Herbst rückt näher. Trotz Kritik soll die Umweltspur Blue Lane erhalten bleiben - und das Auto dürfte auch diesmal ""als wesentlicher Bestandteil von Mobilität"" im Zentrum stehen, wie der Veranstalter ankündigte.",https://www.sueddeutsche.de/image/sz.1.5777799/1200x675?v=1680701747,2023-04-05T13:23:28Z,https://web.archive.org/web/20230405210954/https://www.sueddeutsche.de/muenchen/iaa-mobility-muenchen-vda-1.5782475,"Die Verkehrsmesse im Herbst rückt näher. Trotz Kritik soll die Umweltspur Blue Lane erhalten bleiben - und das Auto dürfte auch diesmal ""als wesentlicher Bestandteil von Mobilität"" im Zentrum stehen,… [+4023 chars]",,de,'Herbst'
https://stadt-bremerhaven.de/geruecht-diese-ipads-und-iphones-sollen-kein-ipados-ios-17-mehr-bekommen/,https://stadt-bremerhaven.de/geruecht-diese-ipads-und-iphones-sollen-kein-ipados-ios-17-mehr-bekommen/,0,stadt-bremerhaven.de,Gerücht: Diese iPads und iPhones sollen kein iPadOS / iOS 17 mehr bekommen,"Irgendwann fallen Geräte aus dem Support. Manche früher, manche später. Gerüchte von Leakern auf Twitter, die auch in der Vergangenheit richtig lagen, sprechen nun von den iPhones, die im Herbst nicht mehr mit iOS 17 bedacht werden sollen. Bedeutet: Keine...Z…",https://stadt-bremerhaven.de/wp-content/uploads/2023/04/iPhone-8_.jpg,2023-04-05T13:30:21Z,https://web.archive.org/web/20230405194246/https://stadt-bremerhaven.de/geruecht-diese-ipads-und-iphones-sollen-kein-ipados-ios-17-mehr-bekommen/,"Irgendwann fallen Geräte aus dem Support. Manche früher, manche später. Gerüchte von Leakern auf Twitter, die auch in der Vergangenheit richtig lagen, sprechen nun von den iPhones, die im Herbst nich… [+980 chars]",,de,'Herbst'
https://www.tagesspiegel.de/politik/stromuberschusse-im-winter-war-der-akw-streckbetrieb-unnotig-9615218.html,https://www.tagesspiegel.de/politik/stromuberschusse-im-winter-war-der-akw-streckbetrieb-unnotig-9615218.html,0,www.tagesspiegel.de,Stromüberschüsse im Winter: War der AKW-Streckbetrieb unnötig?,"Monatelang stritt die Ampel über den Streckbetrieb der drei Atomkraftwerke. Daten zeigen nun, dass Deutschland im Winter viel mehr Strom hatte als nötig.",https://www.tagesspiegel.de/images/kernkraftwerk-isar-2-in-essenbach-bei-landshut-abendhimmel-30-august-2022-deutschland-essenbach-ortsteil-unterahra/alternates/BASE_16_9_W1400/kernkraftwerk-isar-2-in-essenbach-bei-landshut-abendhimmel-30-august-2022-deutschland-essenbach-ortsteil-unterahra.jpeg,2023-04-05T13:54:09Z,https://web.archive.org/web/20230406090600/https://www.tagesspiegel.de/politik/stromuberschusse-im-winter-war-der-akw-streckbetrieb-unnotig-9615218.html,Olaf Scholz wurde ungewohnt deutlich in dem Brief an seine Kabinettsmitglieder. Ich habe als Bundeskanzler entsprechend Paragraph 1 der Geschäftsführung der Bundesregierung die nachfolgende Entscheid… [+4909 chars],,de,'Winter'
https://www.stern.de/wirtschaft/news/konjunktur--rezession-bleibt-aus---entspannung-bei-inflation-erst-2024-33350370.html,https://www.stern.de/wirtschaft/news/konjunktur--rezession-bleibt-aus---entspannung-bei-inflation-erst-2024-33350370.html,0,www.stern.de,Konjunktur: Rezession bleibt aus - Entspannung bei Inflation erst 2024,"Die Rezession bleibt aus. Einen Frühlingsaufschwung aber gibt es nicht. Was führende Wirtschaftsforschungsinstitute von einem neuen ""Wirtschaftswunder"" halten und warum sie von einer Postkutsche sprechen.",https://image.stern.de/33350372/t/4f/v2/w1440/r1.7778/-/05--urnnewsmldpacom2009010123040599217698v2w800h600l1053t590r4636b3036jpeg---3971dd25cfa5b0c4.jpg,2023-04-05T14:44:56Z,,"Die Rezession bleibt aus. Einen Frühlingsaufschwung aber gibt es nicht. Was führende Wirtschaftsforschungsinstitute von einem neuen ""Wirtschaftswunder"" halten und warum sie von einer Postkutsche spre… [+4766 chars]",,de,'Frühling'
https://www.stern.de/panorama/weltgeschehen/kopfueber-im-schnee--skifahrer-rettet-snowboarder-in-not-33350386.html,https://www.stern.de/panorama/weltgeschehen/kopfueber-im-schnee--skifahrer-rettet-snowboarder-in-not-33350386.html,0,www.stern.de,Mount Baker: Kopfüber im Schnee: Skifahrer rettet Snowboarder in Not – durch einen glücklichen Zufall,Nach einem Sturz steckte ein Snowboarder am Mount Baker im US-Bundesstaat Washington kopfüber im Tiefschnee fest. Nur durch Zufall konnte der Mann gerettet werden.,https://image.stern.de/33350398/t/WC/v2/w1440/r1.7778/-/ski-snowboard-rettung.jpg,2023-04-05T14:55:00Z,https://web.archive.org/web/20230405153731/https://www.stern.de/panorama/weltgeschehen/kopfueber-im-schnee--skifahrer-rettet-snowboarder-in-not-33350386.html,"Zugang zu allen STERN PLUS-Inhalten und Artikeln aus dem Print-Magazin
werbefrei &amp; jederzeit kündbar
Bereits registriert?
Hier anmelden",,de,'Schnee'
https://www.tagesspiegel.de/berlin/bezirke/neukollner-maientage-fallen-aus-volksfest-zu-spaterem-zeitpunkt-im-gesprach-9621785.html,https://www.tagesspiegel.de/berlin/bezirke/neukollner-maientage-fallen-aus-volksfest-zu-spaterem-zeitpunkt-im-gesprach-9621785.html,0,www.tagesspiegel.de,Neuköllner Maientage fallen aus: Volksfest zu späterem Zeitpunkt im Gespräch,"Der beliebte Rummel kann in der Hasenheide nicht mehr stattfinden, auch ein Termin im Frühjahr ist nicht mehr möglich. Aber es soll womöglich eine Art Ersatz-Volksfest im Herbst oder Winter geben.",https://www.tagesspiegel.de/images/fruhlingsdate-01-05-2018-berlin-deutschland-ger-neukollner-maientage-im-volkspark-hasenheide-achterbahn-0/alternates/BASE_16_9_W1400/fruehlingsdate-01-05-2018-berlin-deutschland-ger-neukoellner-maientage-im-volkspark-hasenheide-achterbahn--0.jpeg,2023-04-05T14:56:34Z,,"Die Neuköllner Maientage fallen in diesem Jahr aus. Allerdings gibt es womöglich zu einem späteren Zeitpunkt im Jahr eine Art Ersatz-Volksfest. Das kündigte Christian Berg, Sprecher des Neuköllner Be… [+2449 chars]",,de,'Herbst'
https://kaernten.orf.at/stories/3201869/,https://kaernten.orf.at/stories/3201869/,0,kaernten.orf.at,Neuer Anlauf für zweite Eishalle in Villach,"Seit Jahren wird in Villach der Bau einer zweiten Eishalle neben der Stadthalle diskutiert. Heuer könnte es für das Projekt tatsächlich ernst werden, wenn der Gemeinderat im Juni seine Zustimmung erteilt. Bereits im Sommer könnten die Abrissarbeiten auf dem A…",https://ibs.orf.at/ktn?image=https%3A%2F%2Foekastatic.orf.at%2Fmims%2F2023%2F14%2F45%2Fcrops%2Fw%3D1200%2Ch%3D627%2Cq%3D75%2F1741940_master_645445_vsv_eishalle.jpg%3Fs%3De8209bf6de3da10c4184a156f98b3d0f83ee2723,2023-04-05T15:48:54Z,https://web.archive.org/web/20230405191940/https://kaernten.orf.at/stories/3201869/,Bereits seit 1997 verfügt der KAC mit der Sepp-Puschnig-Halle in Klagenfurt über eine zweite Eishalle. Jetzt soll auch Villach eine bekommen. Der Spatenstich hätte ursprünglich bereits 2021 erfolgen … [+1364 chars],,de,'Sommer'
https://www.sueddeutsche.de/muenchen/dawonia-gbw-patrizia-iaa-verkehrsmesse-mobilitaet-1.5782690,https://www.sueddeutsche.de/muenchen/dawonia-gbw-patrizia-iaa-verkehrsmesse-mobilitaet-1.5782690,0,www.sueddeutsche.de,News-Überblick: Das sind die Nachrichten des Tages aus München,"Aktuelle News aus München: Zehn Jahre Dawonia-Patrizia-Deal, was die IAA für die herbstliche Verkehrsmesse plant und mehr.",https://www.sueddeutsche.de/image/sz.1.5566091/1200x675?v=1680713006,2023-04-05T16:43:37Z,,"Zehn Jahre Dawonia-Patrizia-Deal, was die IAA für die herbstliche Verkehrsmesse plant und mehr.DER TAG IN MÜNCHEN
Vom Wohnungsretter zum Großvermieter Als die Gemeinnützige Bayerische Wohnungsgesell… [+1795 chars]",,de,'Herbst'
https://www.stern.de/gesellschaft/regional/bayern/wetter--regnerische-feiertage-und-schnee-in-den-bayerischen-alpen-33354314.html,https://www.stern.de/gesellschaft/regional/bayern/wetter--regnerische-feiertage-und-schnee-in-den-bayerischen-alpen-33354314.html,0,www.stern.de,Wetter: Regnerische Feiertage und Schnee in den bayerischen Alpen,"Das verlängerte Osterwochenende wird in den meisten Teilen Bayerns bewölkt und regnerisch. Oberhalb von 1000 Metern Höhe soll es bis zum Sonntag immer wieder zeitweise schneien, wie der Deutsche Wetterdienst (DWD) am Donnerstag mitteilte.",https://image.stern.de/33354316/t/BE/v1/w1440/r1.7778/-/06--urnnewsmldpacom2009010123040699232208v2w800h600l664t286r1552b1084jpeg---03d8a1ebbb7dc5db.jpg,2023-04-06T09:53:30Z,https://web.archive.org/web/20230406134556/https://www.stern.de/gesellschaft/regional/bayern/wetter--regnerische-feiertage-und-schnee-in-den-bayerischen-alpen-33354314.html,"Das verlängerte Osterwochenende wird in den meisten Teilen Bayerns bewölkt und regnerisch. Oberhalb von 1000 Metern Höhe soll es bis zum Sonntag immer wieder zeitweise schneien, wie der Deutsche Wett… [+1047 chars]",,de,'Schnee'
https://www.stern.de/panorama/video-naturschauspiel-in-toronto-33354916.html,https://www.stern.de/panorama/video-naturschauspiel-in-toronto-33354916.html,0,www.stern.de,Video: Naturschauspiel in Toronto,Heftige Gewitter zogen am Mittwoch über Kanada hinweg. Hunderttausende Haushalte waren Medienangaben zufolge zeitweise ohne Strom.,https://image.stern.de/33354918/t/ze/v1/w1440/r1.7778/-/06-naturschauspiel-in-toronto-6324080547112-1.jpg,2023-04-06T12:26:08Z,,"Zugang zu allen STERN PLUS-Inhalten und Artikeln aus dem Print-Magazin
werbefrei &amp; jederzeit kündbar
Bereits registriert?
Hier anmelden",,de,'Gewitter'
https://www.sueddeutsche.de/panorama/naturschauspiel-in-toronto-1.5783716,https://www.sueddeutsche.de/panorama/naturschauspiel-in-toronto-1.5783716,0,www.sueddeutsche.de,: Naturschauspiel in Toronto,Heftige Gewitter zogen am Mittwoch über Kanada hinweg. Hunderttausende Haushalte waren Medienangaben zufolge zeitweise ohne Strom.,https://www.sueddeutsche.de/image/sz.1.5783717/1200x675?v=1680791656000,2023-04-06T14:34:16Z,,"6. April 2023, 14:34
 "",""authorTextHtml"":""Direkt aus dem Reuters-Videokanal"",""mainTheme"":""Video"",""durationInSeconds"":""00:46"",""tags"":[""Video""],""autoListing"":true,""seoData"":{""seoTitle"":"""",""seoDescript… [+8176 chars]",,de,'Gewitter'
