index,url,valid,domain,title,description,image,published,archive,content,quote,language,keyword
https://consent.google.com/ml?continue=https://news.google.com/rss/articles/CBMilgFodHRwczovL3d3dy5uZHIuZGUvbmFjaHJpY2h0ZW4vbmllZGVyc2FjaHNlbi9oYW5ub3Zlcl93ZXNlci1sZWluZWdlYmlldC9VbndldHRlci1pbi1OaWVkZXJzYWNoc2VuLUhldXRlLWRyb2hlbi1HZXdpdHRlci11bmQtU3RhcmtyZWdlbix3ZXR0ZXI3Mjc2Lmh0bWzSAQA?oc%3D5&gl=FR&hl=en-US&cm=2&pc=n&src=1,https://consent.google.com/ml?continue=https://news.google.com/rss/articles/CBMilgFodHRwczovL3d3dy5uZHIuZGUvbmFjaHJpY2h0ZW4vbmllZGVyc2FjaHNlbi9oYW5ub3Zlcl93ZXNlci1sZWluZWdlYmlldC9VbndldHRlci1pbi1OaWVkZXJzYWNoc2VuLUhldXRlLWRyb2hlbi1HZXdpdHRlci11bmQtU3RhcmtyZWdlbix3ZXR0ZXI3Mjc2Lmh0bWzSAQA?oc%3D5&gl=FR&hl=en-US&cm=2&pc=n&src=1,0,consent.google.com,Unwetter in Niedersachsen: Heute drohen Gewitter und Starkregen - NDR.de,"<ol><li>Unwetter in Niedersachsen: Heute drohen Gewitter und Starkregen  NDR.de
</li><li>Alarmstufe Rot droht! Sommerwetter zum Wochenende lässt es krachen  FOCUS Online
</li><li>Wetter: Heftige Gewitter mit Starkregen, Hagel und Sturmböen am Wochenende  t-…",,2023-05-05T11:11:00Z,,"We use cookies and data to<ul><li>Deliver and maintain Google services</li><li>Track outages and protect against spam, fraud, and abuse</li><li>Measure audience engagement and site statistics to unde… [+1131 chars]",,de,'Gewitter'
https://www.focus.de/wissen/natur/meteorologie/aussichten-fuer-deutschland-sommerausblick-wie-die-hitze-in-spanien-jetzt-unser-wetter-beeinflusst_id_192972206.html,https://www.focus.de/wissen/natur/meteorologie/aussichten-fuer-deutschland-sommerausblick-wie-die-hitze-in-spanien-jetzt-unser-wetter-beeinflusst_id_192972206.html,0,www.focus.de,Aussichten für Deutschland - Sommerausblick: Wie die Hitze in Spanien jetzt unser Wetter beeinflusst,"Kommt ein neuer Hitzesommer auf Deutschland zu? Einiges spricht dafür: Fast 40 Grad im April in Spanien sind ein deutliches Zeichen, dass Hitze wieder ein Thema sein wird. Aber die globalen Faktoren ändern sich.",https://p6.focus.de/img/fotos/id_192970903/de-sommer2-2023.jpg?im=Crop%3D%280%2C60%2C1920%2C960%29%3BResize%3D%281200%2C627%29&hash=5c7c04cbfad6245f3e205ff634f94805086e2ae17db1bfd55197427b2ecb3a2d,2023-05-05T12:43:42Z,https://web.archive.org/web/20230506012057/https://www.focus.de/wissen/natur/meteorologie/aussichten-fuer-deutschland-sommerausblick-wie-die-hitze-in-spanien-jetzt-unser-wetter-beeinflusst_id_192972206.html,"Kommt ein neuer Hitzesommer auf Deutschland zu? Einiges spricht dafür: Fast 40 Grad im April in Spanien sind ein deutliches Zeichen, dass Hitze wieder ein Thema sein wird. Aber die globalen Faktoren … [+3821 chars]",,de,'Sommer'
https://www.zeit.de/2023/19/bluetezeit-pflanzen-klimawandel,https://www.zeit.de/2023/19/bluetezeit-pflanzen-klimawandel,0,www.zeit.de,Blütezeit von Pflanzen: Immer-früher-Blüher (1/5) Die Hasel wartet nicht,Er lässt Allergiker leiden und läutet den Frühling ein: der Haselnussstrauch. Warum er ein Hinweisgeber des Klimawandels ist. Teil eins unserer neuen Fotokolumne,,2023-05-05T12:47:14Z,https://web.archive.org/web/20230504213957/https://www.zeit.de/2023/19/bluetezeit-pflanzen-klimawandel,"When browsing with ads:
We collect personal data and also transmit it to third-party providers
 that help us improve and finance our digital content. Some of the information stored on your device, … [+732 chars]",,de,'Frühling'
https://consent.google.com/ml?continue=https://news.google.com/rss/articles/CBMib2h0dHBzOi8vd3d3LmhuYS5kZS9rYXNzZWwvd2V0dGVyLXdhcm51bmctaGVzc2VuLW5vcmRoZXNzZW4tYWxhcm1zdHVmZS1yb3Qta2Fzc2VsLWV4cGVydGUtZ2V3aXR0ZXItOTIyNTY1NzUuaHRtbNIBAA?oc%3D5&gl=FR&hl=en-US&cm=2&pc=n&src=1,https://consent.google.com/ml?continue=https://news.google.com/rss/articles/CBMib2h0dHBzOi8vd3d3LmhuYS5kZS9rYXNzZWwvd2V0dGVyLXdhcm51bmctaGVzc2VuLW5vcmRoZXNzZW4tYWxhcm1zdHVmZS1yb3Qta2Fzc2VsLWV4cGVydGUtZ2V3aXR0ZXItOTIyNTY1NzUuaHRtbNIBAA?oc%3D5&gl=FR&hl=en-US&cm=2&pc=n&src=1,0,consent.google.com,„Alarmstufe Rot“: Gewitterzellen nehmen Kurs auf Kassel und Nordhessen - DWD-Warnung vor Unwetter - hna.de,"<ol><li>„Alarmstufe Rot“: Gewitterzellen nehmen Kurs auf Kassel und Nordhessen - DWD-Warnung vor Unwetter  hna.de
</li><li>Alarmstufe Rot droht! Sommerwetter zum Wochenende lässt es krachen  FOCUS Online
</li><li>Wetter: Heftige Gewitter mit Starkregen, Hag…",,2023-05-05T13:48:00Z,,"We use cookies and data to<ul><li>Deliver and maintain Google services</li><li>Track outages and protect against spam, fraud, and abuse</li><li>Measure audience engagement and site statistics to unde… [+1131 chars]",,de,'Gewitter'
https://www.n-tv.de/mediathek/videos/wetter/Deutschland-steht-Dauerregen-ins-Haus-article24099189.html,https://www.n-tv.de/mediathek/videos/wetter/Deutschland-steht-Dauerregen-ins-Haus-article24099189.html,0,www.n-tv.de,Bei warmen Temperaturen: Deutschland steht Dauerregen ins Haus,"In den nächsten Tagen braucht es Regenschirm und festes Schuhwerk, denn zahlreiche Schauer und Gewitter ziehen über Deutschland hinweg. Schon in der Nacht zum Samstag bleibt kaum ein Fleck trocken, und auch am Tag gibt es nur kurze Unterbrechungen vom Dauerna…",https://bilder4.n-tv.de/img/incoming/crop24102323/9161324263-cImg_16_9-w1200/407104630.jpg,2023-05-05T14:41:00Z,https://web.archive.org/web/20230505215035/https://www.n-tv.de/mediathek/videos/wetter/Deutschland-steht-Dauerregen-ins-Haus-article24099189.html,,,de,'Gewitter'
https://www.tagesspiegel.de/potsdam/rbb-untersuchungsausschuss-in-potsdam-anstellungsverhaltnisse-der-intendanten-waren-nie-thema-der-rechtsaufsicht-9773699.html,https://www.tagesspiegel.de/potsdam/rbb-untersuchungsausschuss-in-potsdam-anstellungsverhaltnisse-der-intendanten-waren-nie-thema-der-rechtsaufsicht-9773699.html,0,www.tagesspiegel.de,RBB-Untersuchungsausschuss in Potsdam: „Anstellungsverhältnisse der Intendanten waren nie Thema der Rechtsaufsicht“,Im RBB-Untersuchungsausschuss im Brandenburger Landtag sagt ein ehemaliger Spitzenbeamter aus. Aufs Glatteis führen können die Abgeordneten ihn nicht.,https://www.tagesspiegel.de/images/rundfunk-berlin-brandenburg-rbb16/alternates/BASE_16_9_W1400/rundfunk-berlin-brandenburg-rbb.jpeg,2023-05-05T14:55:35Z,,"In der Potsdamer Staatskanzlei gehörte er Jahrzehnte lang zum innersten Machtzirkel: Sascha Bakarinow, 67 Jahre alt, heute Rechtsanwalt in Kleinmachnow. Doch vor seiner Pensionierung war der Jurist z… [+5402 chars]",,de,'Glatteis'
https://taz.de/Klimawandel-im-Mittelmeerraum/!5929928/,https://taz.de/Klimawandel-im-Mittelmeerraum/!5929928/,0,taz.de,Klimawandel im Mittelmeerraum: 40 Grad im Frühling,Der Mittelmeerraum kämpft mit Hitze und Dürre. For­sche­r:in­nen haben die Ursache für die hohen Temperaturen untersucht. Die ist nicht nur natürlich.,https://taz.de/picture/6248258/948/32749160-1.jpeg,2023-05-05T16:45:00Z,https://web.archive.org/web/20230505170117/https://taz.de/Klimawandel-im-Mittelmeerraum/!5929928/,"Der Mittelmeerraum kämpft mit Hitze und Dürre. For­sche­r:in­nen haben die Ursache für die hohen Temperaturen untersucht. Die ist nicht nur natürlich.
Olivenernte in Sevilla im Oktober 2022: Weniger… [+4472 chars]",,de,'Frühling'
https://www.sueddeutsche.de/medien/hoerspiel-im-fruehling-sterben-rothmann-1.5841208,https://www.sueddeutsche.de/medien/hoerspiel-im-fruehling-sterben-rothmann-1.5841208,0,www.sueddeutsche.de,"Hörspiel ""Im Frühling sterben"": Der Untergang","Ein dreiteiliges Hörspiel erzählt von zwei Teenagern, denen in den letzten Wochen des Zweiten Weltkriegs mutwillig ihre Jugend geraubt wird.",https://www.sueddeutsche.de/image/sz.1.5399727/1200x675?v=1683301309,2023-05-05T16:55:55Z,http://archive.md/20230505204516/https://www.sueddeutsche.de/medien/hoerspiel-im-fruehling-sterben-rothmann-1.5841208,"Ralf Rothmanns Hörspiel erzählt von zwei Teenagern, denen in den letzten Wochen des Zweiten Weltkriegs mutwillig ihre Jugend geraubt wird.Wie beendet man einen Krieg? Diese Frage ist wieder drängend … [+631 chars]",,de,'Frühling'
https://www.bild.de/ratgeber/2023/ratgeber/vollmond-wie-sehr-beeinflusst-er-uns-wirklich-8-mythen-im-check-83642232.bild.html,https://www.bild.de/ratgeber/2023/ratgeber/vollmond-wie-sehr-beeinflusst-er-uns-wirklich-8-mythen-im-check-83642232.bild.html,0,www.bild.de,Heute ist er wieder kugelrund - Nimmt man bei Vollmond wirklich schneller ab?,Schlechter Schlaf? Bessere Aussaat? Probleme beim Abnehmen? Komplikationen bei OPs? Acht Mond-Mythen im BILD-Check.,"https://images.bild.de/6437d401f842731d2b15b523/f22aa88b1a158dc3bbd1aac110e52dba,434e2926?w=1280",2023-05-05T17:18:21Z,https://web.archive.org/web/20230505173433/https://www.bild.de/ratgeber/2023/ratgeber/vollmond-wie-sehr-beeinflusst-er-uns-wirklich-8-mythen-im-check-83642232.bild.html,"Ganz selbstverständlich zieht er seine Bahnen um die Erdkugel. Manchmal kaum zu erkennen, an einigen Tagen strahlend hell am Himmel: der Mond. Gerade der Vollmond fasziniert seit Urzeiten die Menschh… [+3861 chars]",,de,'Aussaat'
https://www.faz.net/aktuell/wirtschaft/unternehmen/im-panamakanal-fehlt-wegen-einer-duerre-viel-wasser-18872691.html,https://www.faz.net/aktuell/wirtschaft/unternehmen/im-panamakanal-fehlt-wegen-einer-duerre-viel-wasser-18872691.html,0,www.faz.net,Im Panamakanal fehlt wegen einer Dürre viel Wasser,"Wegen Niedrigwasser können Frachtschiffe weniger laden, wenn sie durch den Panamakanal fahren wollen. Das beeinträchtigt die internationalen Lieferketten.",https://media0.faz.net/ppmedia/aktuell/wirtschaft/2748448008/1.8873358/facebook_teaser/duerre-in-panama-wegen-einem.jpg,2023-05-05T18:19:15Z,https://web.archive.org/web/20230506032119/http://www.faz.net/aktuell/wirtschaft/unternehmen/im-panamakanal-fehlt-wegen-einer-duerre-viel-wasser-18872691.html,"Eine Dürre in Panama wird zur Belastung für den internationalen Seehandel, weil Schiffe den wichtigen Panamakanal zwischen dem Pazifik und der Karibik wegen des niedrigeren Wassers nur noch mit wenig… [+2156 chars]",,de,'Dürre'
https://www.n-tv.de/mediathek/videos/wetter/Wochenende-beginnt-im-Norden-trueb-und-nass-article24101889.html,https://www.n-tv.de/mediathek/videos/wetter/Wochenende-beginnt-im-Norden-trueb-und-nass-article24101889.html,0,www.n-tv.de,Frühlingshaft warme Temperaturen: Wochenende beginnt im Norden trüb und nass,"Zum Start des Wochenendes blickt die Küstenregion auf dicke Wolken und in Regenpfützen. In Mitteldeutschland sieht es zunächst freundlicher aus, im Laufe des Tages ziehen dort aber Schauer und Gewitter auf, die am Sonntag auch den Süden erreichen.",https://bilder2.n-tv.de/img/incoming/crop24102137/8651328098-cImg_16_9-w1200/imago0246715205h.jpg,2023-05-06T05:03:00Z,https://web.archive.org/web/20230506052601/https://www.n-tv.de/mediathek/videos/wetter/Wochenende-beginnt-im-Norden-trueb-und-nass-article24101889.html,,,de,'Gewitter'
https://www.zeit.de/green/2023-05/nachhaltiges-gaertnern-samen-1qm-gruen,https://www.zeit.de/green/2023-05/nachhaltiges-gaertnern-samen-1qm-gruen,0,www.zeit.de,"Nachhaltiges Gärtnern: Tütchen, Möhren und perfekte Tarnung",Die Samen sind los! Diese Woche mit keimenden Fragen zum Kompost und dem Freud und Leid der Aussaat,,2023-05-06T06:02:14Z,,"When browsing with ads:
We collect personal data and also transmit it to third-party providers
 that help us improve and finance our digital content. Some of the information stored on your device, … [+732 chars]",,de,'Aussaat'
https://consent.google.com/ml?continue=https://news.google.com/rss/articles/CBMib2h0dHBzOi8vd3d3LmhuYS5kZS9rYXNzZWwvZ2V3aXR0ZXItd2V0dGVyLXdhcm51bmctaGVzc2VuLW5vcmRoZXNzZW4tYWxhcm1zdHVmZS1yb3Qta2Fzc2VsLWV4cGVydGUtOTIyNTY1NzUuaHRtbNIBAA?oc%3D5&gl=FR&hl=en-US&cm=2&pc=n&src=1,https://consent.google.com/ml?continue=https://news.google.com/rss/articles/CBMib2h0dHBzOi8vd3d3LmhuYS5kZS9rYXNzZWwvZ2V3aXR0ZXItd2V0dGVyLXdhcm51bmctaGVzc2VuLW5vcmRoZXNzZW4tYWxhcm1zdHVmZS1yb3Qta2Fzc2VsLWV4cGVydGUtOTIyNTY1NzUuaHRtbNIBAA?oc%3D5&gl=FR&hl=en-US&cm=2&pc=n&src=1,0,consent.google.com,„Alarmstufe Rot“: Gewitterzellen mit Kurs auf Kassel und Nordhessen - DWD-Warnung vor Unwetter - hna.de,"<ol><li>„Alarmstufe Rot“: Gewitterzellen mit Kurs auf Kassel und Nordhessen - DWD-Warnung vor Unwetter  hna.de
</li><li>Heftige Gewitter am Wochenende: Diese Regionen sind betroffen  t-online
</li><li>Unwetterwarnung für NRW: Heftiger Starkregen und Gewitte…",,2023-05-06T06:40:00Z,,"We use cookies and data to<ul><li>Deliver and maintain Google services</li><li>Track outages and protect against spam, fraud, and abuse</li><li>Measure audience engagement and site statistics to unde… [+1131 chars]",,de,'Gewitter'
https://www.focus.de/panorama/wetter-aktuell/wetter-in-deutschland-im-ticker-schwimmen-unter-freiem-himmel-weitere-freibaeder-oeffnen_id_54933749.html,https://www.focus.de/panorama/wetter-aktuell/wetter-in-deutschland-im-ticker-schwimmen-unter-freiem-himmel-weitere-freibaeder-oeffnen_id_54933749.html,0,www.focus.de,Wetterlage im Ticker - Schwere Gewitter und heftiger Starkregen - Alarmstufe Rot in 7 Kreisen,"Alles neu macht der Mai - ganz so ist es in diesem Jahr aber nicht. Mit Werten über 25 Grad startete der Monat sonnig, doch nun gibt es verstärkte Warnungen vor schweren Gewittern. Die News im Wetter-Ticker.",https://p6.focus.de/img/regional/sachsen-anhalt/id_192951009/blitze-entladen-sich-waehrend-eines-gewitters..jpg?im=Crop%3D%280%2C169%2C2048%2C1024%29%3BResize%3D%281200%2C627%29&hash=01fae278e4ca932ec97408e46af5ebf37c3533f1b37940b7621d15e0fbcea0aa,2023-05-06T07:55:41Z,,"Alles neu macht der Mai - ganz so ist es in diesem Jahr aber nicht. Mit Werten über 25 Grad startete der Monat sonnig, doch nun gibt es verstärkte Warnungen vor schweren Gewittern. Die News im Wetter… [+11940 chars]",,de,'Gewitter'
https://www.faz.net/aktuell/wissen/leben-gene/co-evolution-wie-kakteen-es-schaffen-fledermaeuse-zur-bestaeubung-anzulocken-18861560.html,https://www.faz.net/aktuell/wissen/leben-gene/co-evolution-wie-kakteen-es-schaffen-fledermaeuse-zur-bestaeubung-anzulocken-18861560.html,0,www.faz.net,Ein akustischer Schallschutz für Blüten,"Kakteen locken Fledermäuse an, damit diese sie bestäuben. In der Evolution ist dazu eine ungewöhnliche akustische Bühne entstanden.",https://media1.faz.net/ppmedia/aktuell/2328968156/1.8861557/facebook_teaser/akustisch-angerichtet-blueten.jpg,2023-05-06T08:00:41Z,https://web.archive.org/web/20230506104814/http://www.faz.net/aktuell/wissen/leben-gene/co-evolution-wie-kakteen-es-schaffen-fledermaeuse-zur-bestaeubung-anzulocken-18861560.html,Die meisten blühenden Pflanzen sind für Allergiker harmlos: Sie lassen ihren Blütenstaub nicht vom Wind davontragen und belästigen somit auch niemandes Schleimhäute. Stattdessen benutzen sie Insekten… [+4691 chars],,de,'Blüte'
https://www.stern.de/gesellschaft/regional/nordrhein-westfalen/wetter--wechselhaftes-wetter--gewitter--starkregen-und-hagel-moeglich-33442658.html,https://www.stern.de/gesellschaft/regional/nordrhein-westfalen/wetter--wechselhaftes-wetter--gewitter--starkregen-und-hagel-moeglich-33442658.html,0,www.stern.de,"Wetter: Wechselhaftes Wetter: Gewitter, Starkregen und Hagel möglich",Am Wochenende überwiegt wechselhaftes Wetter in Nordrhein-Westfalen. Nach einem nebligen und teils auch sonnigen Start ziehen laut Prognose des Deutschen Wetterdienstes (DWD) ab Samstagmittag vom Bergland ausgehend Schauer und auch einzelne Gewitter mit Stark…,https://image.stern.de/33442660/t/0K/v1/w1440/r1.7778/-/06--urnnewsmldpacom2009010123050699582429v3w800h600l638t432r1916b1296jpeg---c9f1cb2e2ed91c7e.jpg,2023-05-06T08:35:03Z,https://web.archive.org/web/20230506145935/https://www.stern.de/gesellschaft/regional/nordrhein-westfalen/wetter--wechselhaftes-wetter--gewitter--starkregen-und-hagel-moeglich-33442658.html,Am Wochenende überwiegt wechselhaftes Wetter in Nordrhein-Westfalen. Nach einem nebligen und teils auch sonnigen Start ziehen laut Prognose des Deutschen Wetterdienstes (DWD) ab Samstagmittag vom Ber… [+964 chars],,de,'Gewitter'
https://www.zeit.de/news/2023-05/06/wechselhaftes-wetter-gewitter-starkregen-und-hagel-moeglich,https://www.zeit.de/news/2023-05/06/wechselhaftes-wetter-gewitter-starkregen-und-hagel-moeglich,0,www.zeit.de,"Wetter: Wechselhaftes Wetter: Gewitter, Starkregen und Hagel möglich",,,2023-05-06T08:35:03Z,,"When browsing with ads:
We collect personal data and also transmit it to third-party providers
 that help us improve and finance our digital content. Some of the information stored on your device, … [+732 chars]",,de,'Gewitter'
https://www.stern.de/gesellschaft/regional/bayern/wetter--starkregen--hagel-und-sturmboeen-bei-gewittern-in-bayern-33442724.html,https://www.stern.de/gesellschaft/regional/bayern/wetter--starkregen--hagel-und-sturmboeen-bei-gewittern-in-bayern-33442724.html,0,www.stern.de,"Wetter: Starkregen, Hagel und Sturmböen bei Gewittern in Bayern","In Bayern kam es am Freitagabend zu mehreren Gewittern mit stürmischen Böen und einer hohen Blitzaktivität. Teilweise fielen Hagelkörner mit einem Durchmesser zwischen drei und vier Zentimetern vom Himmel, wie ein Meteorologe des Deutschen Wetterdienstes (DWD…",https://image.stern.de/33442726/t/Nh/v1/w1440/r1.7778/-/06--urnnewsmldpacom2009010123050699582565v3w800h600l640t394r1920b1183jpeg---e302258a9a9b32ef.jpg,2023-05-06T08:48:20Z,https://web.archive.org/web/20230506111610/https://www.stern.de/gesellschaft/regional/bayern/wetter--starkregen--hagel-und-sturmboeen-bei-gewittern-in-bayern-33442724.html,In Bayern kam es am Freitagabend zu mehreren Gewittern mit stürmischen Böen und einer hohen Blitzaktivität. Teilweise fielen Hagelkörner mit einem Durchmesser zwischen drei und vier Zentimetern vom H… [+1243 chars],,de,'Gewitter'
https://www.bild.de/regional/muenchen/muenchen-aktuell/am-freitagabend-heftige-gewitter-ueber-bayern-83820220.bild.html,https://www.bild.de/regional/muenchen/muenchen-aktuell/am-freitagabend-heftige-gewitter-ueber-bayern-83820220.bild.html,0,www.bild.de,Am Freitagabend - Heftige Gewitter über Bayern,In Bayern kam es am Freitagabend zu heftigen Gewittern mit Sturm-Böen und einer hohen Blitzaktivität.,"https://images.bild.de/645614c2b4bbbf208814ecd8/5b07692bd66024388efcfd2acbe22f49,5d5ff167?w=1280",2023-05-06T09:04:09Z,https://web.archive.org/web/20230506091029/https://www.bild.de/regional/muenchen/muenchen-aktuell/am-freitagabend-heftige-gewitter-ueber-bayern-83820220.bild.html,"München Grelle Blitze in schwarzen Regenwolken! 
In Bayern kam es am Freitagabend zu heftigen Gewittern mit Sturm-Böen und einer hohen Blitzaktivität. 
Teilweise fielen Hagelkörner mit einem Durchm… [+899 chars]",,de,'Gewitter'
https://www.stern.de/gesellschaft/regional/hessen/wetter--hessenwetter-warm-und-gewittrig-33442806.html,https://www.stern.de/gesellschaft/regional/hessen/wetter--hessenwetter-warm-und-gewittrig-33442806.html,0,www.stern.de,Wetter: Hessenwetter warm und gewittrig,"In Hessen drohen an diesem Sonntag erneut Unwetter und Starkregen. Im Tagesverlauf ziehen bei Höchsttemperaturen von 18 bis 24 Grad immer mehr Wolken auf, wie der Deutsche Wetterdienst am Samstag mitteilte. Aus dem Südwesten kommen Schauer, Gewitter mit Stark…",https://image.stern.de/33442808/t/bE/v1/w1440/r1.7778/-/06--urnnewsmldpacom2009010123050699583212v2w800h600l1462t243r2853b1905jpeg---e7521d00a6de1c9c.jpg,2023-05-06T09:36:58Z,,"In Hessen drohen an diesem Sonntag erneut Unwetter und Starkregen. Im Tagesverlauf ziehen bei Höchsttemperaturen von 18 bis 24 Grad immer mehr Wolken auf, wie der Deutsche Wetterdienst am Samstag mit… [+867 chars]",,de,'Gewitter'
https://www.morgenpost.de/vermischtes/article238322749/Wetter-in-Deutschland-zweigeteilt.html,https://www.morgenpost.de/vermischtes/article238322749/Wetter-in-Deutschland-zweigeteilt.html,0,www.morgenpost.de,Aussichten: Wetter in Deutschland zweigeteilt,Dem Westen und Südwesten stehen am Sonntag sommerliche Temperaturen bevor. Im Norden und Osten bleibt es deutlich kühler. Wie es danach weitergeht.,https://img.morgenpost.de/img/vermischtes/crop238322747/0262606073-w820-cv16_9-q85/Wetter-in-Baden-Wuerttemberg.jpg,2023-05-06T09:56:42Z,,"Offenbach. Das Wetter in Deutschland präsentiert sich an diesem Sonntag zweigeteilt. Im Westen und Südwesten klettern die Temperaturen auf 20 bis 24 Grad, örtlich sind sogar 25 Grad und damit ein wei… [+668 chars]",,de,'Gewitter'
https://consent.google.com/ml?continue=https://news.google.com/rss/articles/CBMiV2h0dHBzOi8vd3d3LnN3ci5kZS9zd3Jha3R1ZWxsL3JoZWlubGFuZC1wZmFsei91bndldHRlcmdlZmFoci1hbS1zb25udGFnLWluLXJscC0xMDAuaHRtbNIBAA?oc%3D5&gl=FR&hl=en-US&cm=2&pc=n&src=1,https://consent.google.com/ml?continue=https://news.google.com/rss/articles/CBMiV2h0dHBzOi8vd3d3LnN3ci5kZS9zd3Jha3R1ZWxsL3JoZWlubGFuZC1wZmFsei91bndldHRlcmdlZmFoci1hbS1zb25udGFnLWluLXJscC0xMDAuaHRtbNIBAA?oc%3D5&gl=FR&hl=en-US&cm=2&pc=n&src=1,0,consent.google.com,"Unwettergefahr am Sonntag in RLP: Gewitter, Sturmböen, Starkregen - SWR Aktuell","<ol><li>Unwettergefahr am Sonntag in RLP: Gewitter, Sturmböen, Starkregen  SWR Aktuell
</li><li>„Alarmstufe Rot“: Gewitterzellen mit Kurs auf Kassel und Nordhessen - DWD-Warnung vor Unwetter  hna.de
</li><li>Wetter NRW fürs Wochenende: Gewitter & Starkregen…",,2023-05-06T13:30:00Z,,"We use cookies and data to<ul><li>Deliver and maintain Google services</li><li>Track outages and protect against spam, fraud, and abuse</li><li>Measure audience engagement and site statistics to unde… [+1131 chars]",,de,'Gewitter'
https://www.telepolis.de/features/Klimakatastrophe-Rekordhitze-Duerre-und-leere-Stauseen-8989284.html,https://www.telepolis.de/features/Klimakatastrophe-Rekordhitze-Duerre-und-leere-Stauseen-8989284.html,0,www.telepolis.de,"Klimakatastrophe: Rekordhitze, Dürre und leere Stauseen",Iberische Halbinsel: Die erste Hitzewelle mit fast 40 Grad gab es schon im April. Es steht ein heißer Dürre-Sommer bevor. Doch die Wasserreserven sind aufgebraucht.,https://heise.cloudimg.io/bound/1200x1200/q85.png-lossy-85.webp-lossy-85.foil1/_www-heise-de_/imgs/18/4/1/5/5/0/3/9/d1aeabb762b72ac6.jpeg,2023-05-06T22:00:00Z,https://web.archive.org/web/20230507012817/https://www.telepolis.de/features/Klimakatastrophe-Rekordhitze-Duerre-und-leere-Stauseen-8989284.html,"Stausee Siurana im Mai 2023. Foto: Ralf Streck
Iberische Halbinsel: Die erste Hitzewelle mit fast 40 Grad gab es schon im April. Es steht ein heißer Dürre-Sommer bevor. Doch die Wasserreserven sind … [+6177 chars]",,de,'Dürre'
https://www.n-tv.de/mediathek/videos/wetter/Kraeftige-Gewitter-draengen-in-den-Sonntag-article24103832.html,https://www.n-tv.de/mediathek/videos/wetter/Kraeftige-Gewitter-draengen-in-den-Sonntag-article24103832.html,0,www.n-tv.de,Ganz im Osten freundlicher: Kräftige Gewitter drängen in den Sonntag,Der Sonntag lockt zunächst mit reichlich Sonne und frühlingshaften Temperaturen zum Spazierengehen. Doch Obacht: Später ziehen von Westen neue Gewitter und teils kräftige Schauer auf. Im Osten bleibt es hingegen freundlich.,https://bilder1.n-tv.de/img/incoming/crop24104160/0301325468-cImg_16_9-w1200/392411114.jpg,2023-05-07T05:21:00Z,https://web.archive.org/web/20230507093439/https://www.n-tv.de/mediathek/videos/wetter/Kraeftige-Gewitter-draengen-in-den-Sonntag-article24103832.html,,,de,'Gewitter'
https://www.diepresse.com/6284757/trockenheit-landwirte-setzen-auf-hitzeresistente-pflanzen,https://www.diepresse.com/6284757/trockenheit-landwirte-setzen-auf-hitzeresistente-pflanzen,0,www.diepresse.com,Trockenheit: Landwirte setzen auf hitzeresistente Pflanzen,In Trockengebieten im Osten Österreichs verzeichnen Landwirte Ernteeinbußen von bis zu 50 Prozent. Die Anbaugebiete der Sommergerste sind auf ein Viertel geschrumpft.,https://media.diepresse.com/social_diepresse_nachrichten/images/uploads_1200/5/d/5/6284757/E8706390-A6E9-4A0A-84A0-40CCFEC4C244_v0_h.jpg,2023-05-07T05:32:00Z,https://web.archive.org/web/20230507171405/https://www.diepresse.com/6284757/trockenheit-landwirte-setzen-auf-hitzeresistente-pflanzen,"In Trockengebieten im Osten Österreichs verzeichnen Landwirte Ernteeinbußen von bis zu 50 Prozent. Die Anbaugebiete der Sommergerste sind auf ein Viertel geschrumpft.
Der Klimawandel und die damit e… [+5448 chars]",,de,'Sommer'
https://www.stern.de/gesellschaft/regional/nordrhein-westfalen/dwd-prognose--wechselhaftes-wetter-zum-wochenstart-in-nrw-33444464.html,https://www.stern.de/gesellschaft/regional/nordrhein-westfalen/dwd-prognose--wechselhaftes-wetter-zum-wochenstart-in-nrw-33444464.html,0,www.stern.de,DWD-Prognose: Wechselhaftes Wetter zum Wochenstart in NRW,"Das wechselhafte Wetter mit Regenschauern und Gewittern hält in Nordrhein-Westfalen auch zum Start in die neue Woche an. Verantwortlich ist nach Angaben des Deutschen Wetterdienstes (DWD) feuchtwarme Luft, die aus Südwesten ins Land zieht. Bei Temperaturen vo…",https://image.stern.de/33444466/t/jI/v1/w1440/r1.7778/-/07--urnnewsmldpacom2009010123050799593973v3w800h600l143t517r2416b1704jpeg---5db9c560327d24e4.jpg,2023-05-07T07:47:25Z,https://web.archive.org/web/20230507085736/https://www.stern.de/gesellschaft/regional/nordrhein-westfalen/dwd-prognose--wechselhaftes-wetter-zum-wochenstart-in-nrw-33444464.html,Das wechselhafte Wetter mit Regenschauern und Gewittern hält in Nordrhein-Westfalen auch zum Start in die neue Woche an. Verantwortlich ist nach Angaben des Deutschen Wetterdienstes (DWD) feuchtwarme… [+1287 chars],,de,'Gewitter'
