index,url,valid,domain,title,description,image,published,archive,content,quote,language,keyword
https://www.stern.de/panorama/bodensee-region--oesterreichs-parlament-billigt-hochwasser-projekt-am-rhein-34851514.html,https://www.stern.de/panorama/bodensee-region--oesterreichs-parlament-billigt-hochwasser-projekt-am-rhein-34851514.html,0,www.stern.de,Bodensee-Region: Österreichs Parlament billigt Hochwasser-Projekt am Rhein,Der Fluss soll für noch größere Hochwasser-Ereignisse gerüstet werden. Für das Wasser und für die Natur wird mehr Raum geschaffen. Dafür sind enorme Mengen an Geld und Zeit nötig.,https://image.stern.de/34851516/t/Io/v1/w1440/r1.7778/-/03--zitdutyiodv19axw800h600jpeg---7459edae4e340005.jpg,2024-07-03T19:01:18Z,,"Der Fluss soll für noch größere Hochwasser-Ereignisse gerüstet werden. Für das Wasser und für die Natur wird mehr Raum geschaffen. Dafür sind enorme Mengen an Geld und Zeit nötig.
Österreich und die… [+1197 chars]",,de,'Hochwasser'
https://www.tagesspiegel.de/gesellschaft/panorama/bodensee-region-osterreichs-parlament-billigt-hochwasser-projekt-am-rhein-11955848.html,https://www.tagesspiegel.de/gesellschaft/panorama/bodensee-region-osterreichs-parlament-billigt-hochwasser-projekt-am-rhein-11955848.html,0,www.tagesspiegel.de,Bodensee-Region: Österreichs Parlament billigt Hochwasser-Projekt am Rhein,Der Fluss soll für noch größere Hochwasser-Ereignisse gerüstet werden. Für das Wasser und für die Natur wird mehr Raum geschaffen. Dafür sind enorme Mengen an Geld und Zeit nötig.,https://www.tagesspiegel.de/gesellschaft/panorama/images/verbesserung-des-hochwasserschutzes-am-rhein/alternates/BASE_16_9_W1400/verbesserung-des-hochwasserschutzes-am-rhein.jpeg,2024-07-03T19:02:37Z,,"Österreich und die Schweiz wollen 2,1 Milliarden Euro zur Verbesserung des Hochwasserschutzes am Rhein investieren. Das österreichische Parlament hat einstimmig einen Staatsvertrag abgesegnet, mit de… [+1101 chars]",,de,'Hochwasser'
https://www.nzz.ch/schweiz/hydrologe-nach-den-unwettern-angesichts-der-drohenden-gefahren-muessen-wir-den-alpenraum-neu-denken-ld.1837898,https://www.nzz.ch/schweiz/hydrologe-nach-den-unwettern-angesichts-der-drohenden-gefahren-muessen-wir-den-alpenraum-neu-denken-ld.1837898,0,www.nzz.ch,Hydrologe nach den Unwettern: «Angesichts der drohenden Gefahren müssen wir den Alpenraum neu denken»,"Hochwasser-Experte Rolf Weingartner meint warnend, dass mit der Klimaveränderung plötzlich Siedlungen und Weiler gefährdet seien, die zuvor über Jahrhunderte sicher waren. Möglicherweise müssten einzelne von ihnen aufgegeben werden.","https://img.nzz.ch/2024/07/01/3c8f64e2-50f4-4125-a636-39491398d440.jpeg?width=1200&height=675&fit=bounds&quality=75&auto=webp&crop=3102,1745,x266,y582&wmark=nzz",2024-07-04T03:30:00Z,,"«Plötzlich gelangen Teile von Siedlungen und Weilern in Gefahrenzonen, die zuvor über Jahrhunderte sicher waren»: zerstörte Häuser in Fontana im Maggiatal.
Herr Weingartner, die vergangenen Wochen w… [+9897 chars]",,de,'Hochwasser'
https://www.welt.de/sport/fussball/em/article251964666/EM-2024-Nicht-ganz-auf-Hoehe-Deutsche-Bahn-raeumt-Probleme-ein.html,https://www.welt.de/sport/fussball/em/article251964666/EM-2024-Nicht-ganz-auf-Hoehe-Deutsche-Bahn-raeumt-Probleme-ein.html,0,www.welt.de,„Nicht ganz auf Höhe“ – Deutsche Bahn räumt EM-Probleme ein,Die Deutsche Bahn erntet während der Fußball-EM gerade von ausländischen Gästen und Medien viel Kritik. Nun bezieht die Unternehmens-Sprecherin Stellung. Außerdem: Der deutsche Endspiel-Kommentator steht fest. Alle News im EM-Ticker.,https://img.welt.de/img/sport/fussball/em/mobile252339126/7071355427-ci16x9-w1200/Bahn-waehrend-der-EM.jpg,2024-07-04T07:15:00Z,,Nach deutlicher Kritik von Fußballfans hat die Deutsche Bahn Defizite im Fernverkehr während der EM unter anderem mit Mängeln an der Infrastruktur erklärt. Wir sind in der Tat nicht ganz auf Höhe gew… [+8881 chars],,de,'Hochwasser'
https://www.stern.de/panorama/hochwasser-in-suedasien--monsun-in-indien--bislang-mehr-als-50-tote-34852796.html,https://www.stern.de/panorama/hochwasser-in-suedasien--monsun-in-indien--bislang-mehr-als-50-tote-34852796.html,0,www.stern.de,Hochwasser in Südasien: Monsun in Indien: Bislang mehr als 50 Tote,Neu-Delhi - Seit Beginn der Monsun-Zeit im Juni sind in Indien bereits mehr als 50 Menschen bei Überschwemmungen ums Leben gekommen. Die meisten Toten,https://image.stern.de/34852798/t/d4/v1/w1440/r1.7778/-/04--p5mvd3pz3mv8axw800h600jpeg---29bee169e2c80eaf.jpg,2024-07-04T10:03:57Z,,"Der Monsun ist da - und damit auch tödliche Überschwemmungen. Hoffnung auf abklingende Niederschläge gibt es bislang nicht.
Seit Beginn der Monsun-Zeit im Juni sind in Indien bereits mehr als 50 Men… [+1047 chars]",,de,'Hochwasser'
https://www.zeit.de/news/2024-07/04/monsun-in-indien-bislang-mehr-als-50-tote,https://www.zeit.de/news/2024-07/04/monsun-in-indien-bislang-mehr-als-50-tote,0,www.zeit.de,Hochwasser in Südasien: Monsun in Indien: Bislang mehr als 50 Tote,Hier finden Sie Informationen zu dem Thema „Hochwasser in Südasien“. Lesen Sie jetzt „Monsun in Indien: Bislang mehr als 50 Tote“.,https://img.zeit.de/news/2024-07/04/monsun-in-indien-bislang-mehr-als-50-tote-image-group/wide__1300x731,2024-07-04T10:03:57Z,,Seit Beginn der Monsun-Zeit im Juni sind in Indien bereits mehr als 50 Menschen bei Überschwemmungen ums Leben gekommen. Die meisten Toten seien im Bundesstaat Assam im Nordosten des Landes zu beklag… [+1031 chars],,de,'Hochwasser'
https://www.tagesspiegel.de/gesellschaft/panorama/hochwasser-in-sudasien-monsun-in-indien-bislang-mehr-als-50-tote-11958908.html,https://www.tagesspiegel.de/gesellschaft/panorama/hochwasser-in-sudasien-monsun-in-indien-bislang-mehr-als-50-tote-11958908.html,0,www.tagesspiegel.de,Hochwasser in Südasien: Monsun in Indien: Bislang mehr als 50 Tote,Der Monsun ist da - und damit auch tödliche Überschwemmungen. Hoffnung auf abklingende Niederschläge gibt es bislang nicht.,https://www.tagesspiegel.de/gesellschaft/panorama/images/uberschwemmungen-in-indien2/alternates/BASE_16_9_W1400/ueberschwemmungen-in-indien.jpeg,2024-07-04T10:05:53Z,,Seit Beginn der Monsun-Zeit im Juni sind in Indien bereits mehr als 50 Menschen bei Überschwemmungen ums Leben gekommen. Die meisten Toten seien im Bundesstaat Assam im Nordosten des Landes zu beklag… [+1655 chars],,de,'Hochwasser'
https://www.tagesschau.de/wissen/klima/moore-hochwasserschutz-100.html,https://www.tagesschau.de/wissen/klima/moore-hochwasserschutz-100.html,0,www.tagesschau.de,So können Moore beim Hochwasserschutz helfen,"Moore speichern nicht nur große Mengen CO2 - sie können auch zum Hochwasserschutz beitragen, sagen Naturschützer. Denn bei extremen Regenfällen entlasten sie Bäche und Flüsse. Von Stefanie Peyk.",https://images.tagesschau.de/image/0e097b03-de64-4526-b4d1-21d471d4348d/AAABkHOWzNY/AAABjwnlFvA/16x9-1280/moorlandschaft-102.jpg,2024-07-04T12:15:40Z,,"Stand: 04.07.2024 14:15 Uhr
Moore speichern nicht nur große Mengen CO2 - sie können auch zum Hochwasserschutz beitragen, sagen Naturschützer. Denn bei extremen Regenfällen entlasten sie Bäche und Fl… [+7081 chars]",,de,'Hochwasser'
https://www.zeit.de/news/2024-07/04/keine-gute-getreideernte-regen-macht-bauern-zu-schaffen,https://www.zeit.de/news/2024-07/04/keine-gute-getreideernte-regen-macht-bauern-zu-schaffen,0,www.zeit.de,Agrar: Keine gute Getreideernte: Regen macht Bauern zu schaffen,Hier finden Sie Informationen zu dem Thema „Agrar“. Lesen Sie jetzt „Keine gute Getreideernte: Regen macht Bauern zu schaffen“.,https://img.zeit.de/news/2024-07/04/keine-gute-getreideernte-regen-macht-bauern-zu-schaffen-image-group/wide__1300x731,2024-07-04T12:26:17Z,,"Der Regen droht Nordrhein-Westfalens Bauern die Ernte zu vermasseln. Die Prognose für dieses Jahr sei verhalten, der Ertrag von bereits geernteten Flächen sei unterdurchschnittlich, teilt die Landwir… [+835 chars]",,de,'Ernte'
https://www.focus.de/wissen/einfache-bauernregel-hundstage-verraten-es-ab-wann-wird-es-diesen-sommer-richtig-heiss_id_260026181.html,https://www.focus.de/wissen/einfache-bauernregel-hundstage-verraten-es-ab-wann-wird-es-diesen-sommer-richtig-heiss_id_260026181.html,0,www.focus.de,Bauernregel - Hundstage verraten es: Ab wann wird es diesen Sommer richtig heiß?,"Die Hundstage 2024 stehen vor der Tür. Doch was steckt eigentlich hinter dieser Redewendung? Mit Hunden hat das Wetterphänomen wenig zu tun. Lesen Sie hier, wann die Hundstage starten und was sie bedeuten.Von FOCUS-online-Autorin Kira Welling",https://p6.focus.de/img/fotos/id_260026233/wetter.jpg?im=Crop%3D%280%2C177%2C2121%2C1060%29%3BResize%3D%281200%2C627%29&impolicy=perceptual&quality=mediumHigh&hash=6502d73de737f166efe569eed683fb7e9f3dd6b0a51f63843346a9bf5b9f563c,2024-07-04T13:43:39Z,,"Die Hundstage 2024 stehen vor der Tür. Doch was steckt eigentlich hinter dieser Redewendung? Lesen Sie hier, wann die Hundstage starten und was sie bedeuten.Im Allgemeinen wird der Begriff Hundstage,… [+2609 chars]",,de,'Sommer'
https://www.zeit.de/news/2024-07/05/erst-regen-dann-sonne-zum-sommerferienstart-in-nrw,https://www.zeit.de/news/2024-07/05/erst-regen-dann-sonne-zum-sommerferienstart-in-nrw,0,www.zeit.de,"Wetter: Erst Regen, dann Sonne zum Sommerferienstart in NRW","Hier finden Sie Informationen zu dem Thema „Wetter“. Lesen Sie jetzt „Erst Regen, dann Sonne zum Sommerferienstart in NRW“.",https://img.zeit.de/news/2024-07/05/erst-regen-dann-sonne-zum-sommerferienstart-in-nrw-image-group/wide__1300x731,2024-07-05T05:46:08Z,,Ausgerechnet zum Beginn der Sommerferien kommt auf Nordrhein-Westfalen ein regnerischer Start ins Wochenende zu. Im Westen kommt am Freitagmittag Regen auf und breitet sich bis zum Abend ins Münsterl… [+938 chars],,de,'Sommer'
https://taz.de/Nacktschnecken-im-Garten/!6021352/,https://taz.de/Nacktschnecken-im-Garten/!6021352/,0,taz.de,Nacktschnecken im Garten: Eine Armada des Schleims,Nach dem Ende der Dürrejahre melden sich die Wegschnecken zurück. Sehr zum Leidwesen Berliner HobbygärtnerInnen. Ein Bericht aus der Kampfzone.,https://taz.de/picture/7101586/948/35722623-1.jpeg,2024-07-05T07:00:00Z,,"Nach dem Ende der Dürrejahre melden sich die Wegschnecken zurück. Sehr zum Leidwesen Berliner HobbygärtnerInnen. Ein Bericht aus der Kampfzone.
Raspelzunge im Einsatz: Eine Wegschnecke bei der Arbei… [+9042 chars]",,de,'Dürre'
https://www.diepresse.com/18637366/schuelergruppe-per-hubschrauber-aus-bergnot-in-tirol-gerettet,https://www.diepresse.com/18637366/schuelergruppe-per-hubschrauber-aus-bergnot-in-tirol-gerettet,0,www.diepresse.com,Schülergruppe per Hubschrauber aus Bergnot in Tirol gerettet,"Die elf Schüler und sieben Erwachsene überquerten die Alpen mit Fahrrädern und gerieten in Bergnot. Weil ein halber Meter Schnee lag, mussten sie diese tragen und schließlich erschöpft einen Notruf absetzen.",https://img.diepresse.com/public/panorama/7ofvgi-Polizeihubschrauber.jpg/alternates/DPR_SOCIAL_NACHRICHTEN/Polizeihubschrauber.jpg,2024-07-05T08:22:44Z,,"Die elf Schüler und sieben Erwachsene überquerten die Alpen mit Fahrrädern und gerieten in Bergnot. Weil ein halber Meter Schnee lag, mussten sie diese tragen und schließlich erschöpft einen Notruf a… [+976 chars]",,de,'Schnee'
https://www.focus.de/gesundheit/ratgeber/kann-ich-hautkrebs-bekommen-wenn-ich-noch-nie-einen-sonnenbrand-hatte_1034cc39-0a5c-4542-a820-8592b2701649.html,https://www.focus.de/gesundheit/ratgeber/kann-ich-hautkrebs-bekommen-wenn-ich-noch-nie-einen-sonnenbrand-hatte_1034cc39-0a5c-4542-a820-8592b2701649.html,0,www.focus.de,Sonnenschutz ist Pflicht - Hautkrebs ohne Sonnenbrand? Das sollten Sie wissen,"Viele Menschen glauben, dass nur wiederholte Sonnenbrände zu Hautkrebs führen können. Doch stimmt das wirklich? Wir klären auf und geben Ihnen wertvolle Tipps zur Vorbeugung und Früherkennung von Hautkrebs – auch wenn Sie bisher keinen einzigen Sonnenbrand ha…",https://quadro.burda-forward.de/ctf/304348c9-9192-42a1-bf28-095eaa8368f6.00679202-67c5-4a30-914c-0f879173e4d0.jpg?im=RegionOfInterestCrop%3D%281200%2C630%29%2CregionOfInterest%3D%282383%2C1633%29&hash=9256ec118cf749160cc7aa0576a3bc9795c91154b2dfc9508ce3c37e34533c3b,2024-07-05T08:28:00Z,,"Hautkrebs nur mit Sonnenbrand?
Es ist ein weit verbreiteter Irrglaube, dass nur Menschen, die regelmäßig Sonnenbrände erleiden, ein erhöhtes Risiko haben, an Hautkrebs zu erkranken. Tatsächlich kann… [+8089 chars]",,de,'Laub'
https://www.focus.de/wissen/natur/tomaten-richtig-giessen-der-optimale-zeitpunkt-fuer-eine-reiche-ernte_id_259845143.html,https://www.focus.de/wissen/natur/tomaten-richtig-giessen-der-optimale-zeitpunkt-fuer-eine-reiche-ernte_id_259845143.html,0,www.focus.de,Tomaten richtig gießen: Der optimale Zeitpunkt für eine reiche Ernte - Tomaten richtig gießen: Der optimale Zeitpunkt für eine reiche Ernte,"Viele Gärtner wissen es: Tomatenpflanzen brauchen sehr viel Wasser. Allerdings wissen nur wenige Menschen, dass auch der richtige Zeitpunkt zum Gießen entscheidend sein kann.",https://p6.focus.de/img/fotos/id_259845093/tomaten-brauchen-viel-wasser-das-ist-der-beste-zeitpunkt-um-sie-zu-giessen.jpg?im=Crop%3D%280%2C177%2C2121%2C1060%29%3BResize%3D%281200%2C627%29&impolicy=perceptual&quality=mediumHigh&hash=1165fcbfeeb6f61e1c4f5715d026c176e8c28072e0b7e1514628c164281b8f2b,2024-07-05T08:48:12Z,,"Viele Gärtner wissen es: Tomatenpflanzen brauchen sehr viel Wasser. Allerdings wissen nur wenige Menschen, dass auch der richtige Zeitpunkt zum Gießen entscheidend sein kann.Wer kein Gewächshaus hat,… [+1856 chars]",,de,'Ernte'
https://www.bild.de/news/ausland/alpen-deutsche-schueler-bleiben-im-schnee-stecken-heli-rettung-66878dfd18c33d086d7ba944,https://www.bild.de/news/ausland/alpen-deutsche-schueler-bleiben-im-schnee-stecken-heli-rettung-66878dfd18c33d086d7ba944,0,www.bild.de,Im Schnee stecken geblieben - Deutsche Schüler mit Heli aus Alpen gerettet,Hier hat mal der Lehrer seine Hausaufgaben nicht gemacht! Eine deutsche Schülergruppe aus Bayern blieb mitten im Schnee stecken und musste gerettet werden.,"https://images.bild.de/66878dfd18c33d086d7ba944/2a6c85d20dd115bd0e66c2b54a904b95,73af9df0?w=1280",2024-07-05T11:41:54Z,,Innsbruck (Österreich) Hier hat offenbar der Lehrer seine Hausaufgaben nicht gemacht! Eine deutsche Schülergruppe aus Bayern blieb im Schnee stecken und musste aus den Alpen gerettet werden. Denn die… [+2633 chars],,de,'Schnee'
https://www.sueddeutsche.de/wirtschaft/ernte-gemuese-lux.QXhhXRRPmXEZB6Qf8knuQR,https://www.sueddeutsche.de/wirtschaft/ernte-gemuese-lux.QXhhXRRPmXEZB6Qf8knuQR,0,www.sueddeutsche.de,Ernte: Keine Zeit für die saure Gurke,"Die Cucumis sativus ist ein sensibles Wesen. Sie mag es warm, aber nicht zu heiß und hat auch gewisse Ansprüche an die Nacht. 2024 ist jedenfalls ein schweres Jahr für die saure Gurke.",https://www.sueddeutsche.de/2024/07/05/fdf3030d-c8ec-40d0-aa04-78e8f4631cfb.jpeg?q=60&fm=webp&width=1200&rect=0%2C66%2C3000%2C1688,2024-07-05T12:02:51Z,,"Dabei sind in Sachsen, Sachsen-Anhalt, Niedersachsen und anderen Bundesländern längst Sommerferien. Das bevölkerungsreiche Nordrhein-Westfalen hat jetzt auch noch nachgezogen. Millionen Menschen sind… [+3194 chars]",,de,'Ernte'
https://www.stern.de/panorama/rad-tour--deutsche-schueler-geraten-beim-radeln-ueber-die-alpen-in-not-34857386.html,https://www.stern.de/panorama/rad-tour--deutsche-schueler-geraten-beim-radeln-ueber-die-alpen-in-not-34857386.html,0,www.stern.de,Rad-Tour: Deutsche Schüler geraten beim Radeln über die Alpen in Not,Vom bayerischen Fürth bis an die Adria soll die ambitionierte Tour von Schülern und Lehrern gehen. Auf über 2.000 Metern geht es wegen der Schneelage aber nicht mehr weiter. Ein Notruf wird abgesetzt.,https://image.stern.de/34857388/t/a-/v1/w1440/r1.7778/-/05--467axdj72qv10axw800h600jpeg---d4c9af70f462d3ff.jpg,2024-07-05T14:37:00Z,,Vom bayerischen Fürth bis an die Adria soll die ambitionierte Tour von Schülern und Lehrern gehen. Auf über 2.000 Metern geht es wegen der Schneelage aber nicht mehr weiter. Ein Notruf wird abgesetzt… [+1227 chars],,de,'Schnee'
https://www.tagesspiegel.de/gesellschaft/panorama/rad-tour-deutsche-schuler-geraten-beim-radeln-uber-die-alpen-in-not-11971190.html,https://www.tagesspiegel.de/gesellschaft/panorama/rad-tour-deutsche-schuler-geraten-beim-radeln-uber-die-alpen-in-not-11971190.html,0,www.tagesspiegel.de,Rad-Tour: Deutsche Schüler geraten beim Radeln über die Alpen in Not,Vom bayerischen Fürth bis an die Adria soll die ambitionierte Tour von Schülern und Lehrern gehen. Auf über 2.000 Metern geht es wegen der Schneelage aber nicht mehr weiter. Ein Notruf wird abgesetzt.,https://www.tagesspiegel.de/gesellschaft/panorama/images/zillertal1/alternates/BASE_16_9_W1400/zillertal.jpeg,2024-07-05T14:38:01Z,,"Eine bayerische Schülergruppe ist bei einer Rad-Überquerung der Alpen in gefrorenen Schnee geraten und mit einem Helikopter gerettet worden. Wie die österreichische Polizei mitteilte, waren die elf S… [+1110 chars]",,de,'Schnee'
https://www.morgenpost.de/panorama/article406732859/schuelergruppe-bleibt-bei-alpenueberquerung-im-schnee-stecken.html,https://www.morgenpost.de/panorama/article406732859/schuelergruppe-bleibt-bei-alpenueberquerung-im-schnee-stecken.html,0,www.morgenpost.de,Schülergruppe bleibt bei Alpenüberquerung im Schnee stecken,Sie wollten mit den Fahrrädern bis nach Italien. Doch mitten in den Alpen spitze sich die Situation zu – und eine dramatische Rettungsaktion beginnt.,https://img.sparknews.funkemedien.de/406733743/406733743_1720190894_v16_9_1600.jpeg,2024-07-05T14:56:43Z,,"Berlin. Sie wollten mit den Fahrrädern bis nach Italien. Doch mitten in den Alpen war Schluss und eine dramatische Rettungsaktion beginnt.
Bis ins italienische Jesolo an der Adriaküste wollte eine G… [+2717 chars]",,de,'Schnee'
https://www.nzz.ch/schweiz/jetzt-muessen-wir-vorwaerts-machen-der-walliser-staatsrat-franz-ruppen-zur-rhonekorrektion-ld.1838268,https://www.nzz.ch/schweiz/jetzt-muessen-wir-vorwaerts-machen-der-walliser-staatsrat-franz-ruppen-zur-rhonekorrektion-ld.1838268,0,www.nzz.ch,«Jetzt müssen wir vorwärts machen»: Der Walliser Staatsrat Franz Ruppen zur Rhonekorrektion,Einige Wochen vor dem Hochwasser im Wallis kommt eine Analyse zum Schluss: Das Projekt zur dritten Rhonekorrektion sei unverhältnismässig und teuer. Nun nimmt Staatsrat Franz Ruppen Stellung.,"https://img.nzz.ch/2024/07/05/8e9cb576-5d25-4e56-9141-3e6f258c2961.jpeg?width=1200&height=675&fit=bounds&quality=75&auto=webp&crop=8192,4608,x0,y428&wmark=nzz",2024-07-05T16:07:47Z,,"Der Walliser Regierungsrat Franz Ruppen musste sich in den letzten Tagen den kritischen Fragen der Medien stellen.
Bereuen Sie den Entscheid, die dritte Rhonekorrektion zu redimensionieren?
Es gab … [+5675 chars]",,de,'Hochwasser'
https://www.n-tv.de/panorama/Hubschrauber-rettet-Schuelergruppe-aus-Alpen-article25067097.html,https://www.n-tv.de/panorama/Hubschrauber-rettet-Schuelergruppe-aus-Alpen-article25067097.html,0,www.n-tv.de,Radtour scheitert am Schnee: Hubschrauber rettet Schülergruppe aus Alpen,Im Rahmen einer Benefizaktion will eine Gruppe Schüler mit dem Rad die Alpen überqueren. Doch die ambitionierte Tour endet auf 2000 Metern Höhe. Ein Helikopter der Bergrettung muss anrücken.,https://bilder3.n-tv.de/img/incoming/crop25067126/8991323914-cImg_16_9-w1200/426912961.jpg,2024-07-05T16:25:42Z,,"Im Rahmen einer Benefizaktion will eine Gruppe Schüler mit dem Rad die Alpen überqueren. Doch die ambitionierte Tour endet auf 2000 Metern Höhe. Ein Helikopter der Bergrettung muss anrücken. 
Eine b… [+1818 chars]",,de,'Schnee'
https://www.sueddeutsche.de/bayern/furth-zillertal-schueler-fahrradtour-notfall-lux.6k7vNrGWt42d7b46HVZnBP,https://www.sueddeutsche.de/bayern/furth-zillertal-schueler-fahrradtour-notfall-lux.6k7vNrGWt42d7b46HVZnBP,0,www.sueddeutsche.de,Radtour nach Italien: Schüler aus Furth geraten bei Alpenüberquerung in Not,Vom bayerischen Furth bis an die Adria soll die ambitionierte Fahrrad-Tour von Schülern und Lehrern gehen. Doch auf dem Heilig-Geist-Jöchl ist Schluss – der Schnee macht ihnen einen Strich durch die Rechnung.,https://www.sueddeutsche.de/2024/07/05/4cf5fa27-ed20-4be9-b166-3ed7445f6b1b.jpeg?q=60&fm=webp&width=1200&rect=0%2C249%2C3000%2C1688,2024-07-05T17:14:52Z,,"Begleitet von sieben Erwachsenen, darunter eine Lehrerin und ein Lehrer, wollten die Jugendlichen am Donnerstag über das knapp 2700 Meter hohe Heilig-Geist-Jöchl von Österreich nach Italien gelangen.… [+644 chars]",,de,'Schnee'
https://www.stern.de/gesellschaft/regional/bayern/obstanbau--zwetschgen-ernte-beginnt-mit-durchwachsenen-erwartungen-34858324.html,https://www.stern.de/gesellschaft/regional/bayern/obstanbau--zwetschgen-ernte-beginnt-mit-durchwachsenen-erwartungen-34858324.html,0,www.stern.de,Obstanbau: Zwetschgen-Ernte beginnt mit durchwachsenen Erwartungen,Bald gibt es ihn wieder zu kaufen: Zwetschgenkuchen. Die Nachfrage nach den blauen Früchten selbst ist jedoch zurückgegangen. Eine Imagekampagne soll das nun ändern.,https://image.stern.de/34858326/t/Wu/v1/w1440/r1.7778/-/06--zsinynqfybv24axw800h600jpeg---68e1fd675fe71d9d.jpg,2024-07-06T03:00:37Z,,"Bald gibt es ihn wieder zu kaufen: Zwetschgenkuchen. Die Nachfrage nach den blauen Früchten selbst ist jedoch zurückgegangen. Eine Imagekampagne soll das nun ändern.
Der späte Frost im April ist den… [+2729 chars]",,de,'Ernte'
https://www.zeit.de/news/2024-07/06/zwetschgen-ernte-beginnt-mit-durchwachsenen-erwartungen,https://www.zeit.de/news/2024-07/06/zwetschgen-ernte-beginnt-mit-durchwachsenen-erwartungen,0,www.zeit.de,Obstanbau: Zwetschgen-Ernte beginnt mit durchwachsenen Erwartungen,Hier finden Sie Informationen zu dem Thema „Obstanbau“. Lesen Sie jetzt „Zwetschgen-Ernte beginnt mit durchwachsenen Erwartungen“.,https://img.zeit.de/news/2024-07/06/zwetschgen-ernte-beginnt-mit-durchwachsenen-erwartungen-image-group/wide__1300x731,2024-07-06T03:00:37Z,,Der späte Frost im April ist den Zwetschgen in Bayern nicht gut bekommen. Fachleute erwarten deshalb Einbußen bei der Ernte. Im Vergleich zu den Vorjahren würden es voraussichtlich 30 bis 40 Prozent … [+3383 chars],,de,'Ernte'
https://steiermark.orf.at/stories/3263900/,https://steiermark.orf.at/stories/3263900/,0,steiermark.orf.at,Pflegeheim Neudau weiterhin unbewohnbar,"Das Hochwasser in der Nacht vom 8. auf 9. Juni hat das gesamte Erdgeschoß des Pflegeheims in Neudau unbewohnbar gemacht – das Seniorenhaus Menda in Hartberg nahm die Bewohner auf. Bis Bewohner und Mitarbeiter wieder zurückkehren können, werden aber noch sechs…",https://ibs.orf.at/stm?image=https%3A%2F%2Foekastatic.orf.at%2Fmims%2F2023%2F41%2F80%2Fcrops%2Fw%3D1200%2Ch%3D627%2Cq%3D75%2F1967966_master_740680_9d059363-e0ea-4cf1-bcee-0e458831493f.jpg%3Fs%3D40e25cde1d50d4bef3c0334166619e23f8958b65,2024-07-06T05:31:00Z,,Fast ein Monat sind die 40 Bewohnerinnen und Bewohner des Volkshilfe-Pflegeheimes Neudau nun schon weg aus ihrem Zuhause. Das Pflegeheim lag im Zentrum der Überschwemmungen: Am 8. Juni wurde das Erdg… [+1862 chars],,de,'Hochwasser'
https://www.stern.de/panorama/wetter/unwetter--karten-zeigen--wo-es-heute-am-staerksten-stuermt--34858548.html,https://www.stern.de/panorama/wetter/unwetter--karten-zeigen--wo-es-heute-am-staerksten-stuermt--34858548.html,0,www.stern.de,"Wetter in Deutschland: Amtliche Warnung vor Sturm und Gewitter: Karten zeigen, wo heute Unwetter aufziehen","Auch am Samstag bleibt das Wetter wenig sommerlich, dafür wird es teilweise richtig ungemütlich. In Nordfriesland. werden starke Gewitter erwartet und auch im Süden Bayerns warnt der Wetterdienst vor schweren Gewittern mit heftigem Starkregen. Karten zeigen d…",https://image.stern.de/34858580/t/x1/v1/w1440/r1.7778/-/teaser-unwetter-wetter-samstag.jpg,2024-07-06T08:50:00Z,,"Auch am Samstag bleibt das Wetter wenig sommerlich, dafür wird es teilweise richtig ungemütlich. In Nordfriesland. werden starke Gewitter erwartet und auch im Süden Bayerns warnt der Wetterdienst vor… [+2705 chars]",,de,'Sommer'
https://kaernten.orf.at/stories/3264096/,https://kaernten.orf.at/stories/3264096/,0,kaernten.orf.at,Altschneefelder gefährden Tourengeher,"Altschneefelder können im Sommer zu einer gefährlichen Hürde bei Bergtouren werden, eine Überquerung kann sogar tödlich enden. Erst zuletzt rutschte eine 57 Jahre alte tschechische Urlauberin auf dem Ankogel am Lassacher Kees 40 Meter ab und prallte gegen ein…",https://ibs.orf.at/ktn?image=https%3A%2F%2Foekastatic.orf.at%2Fmims%2F2024%2F25%2F81%2Fcrops%2Fw%3D1200%2Ch%3D627%2Cq%3D75%2F2246780_master_853581_kaprun1.jpg%3Fs%3D3893fed4c54668d1b0d4491346e218d9113a3a79,2024-07-06T10:56:43Z,,"In den Karnischen Alpen, den Karawanken und auch in den Tauern, hält sich der Schnee des Winters noch lange, meist in steilen sonnenabgewandten Rinnen. Mitunter trennen nur ein paar Meter ein sichere… [+1911 chars]",,de,'Laub'
https://www.n-tv.de/mediathek/videos/panorama/Spaniens-Duerre-treibt-Olivenoel-Preise-in-die-Hoehe-article25057568.html,https://www.n-tv.de/mediathek/videos/panorama/Spaniens-Duerre-treibt-Olivenoel-Preise-in-die-Hoehe-article25057568.html,0,www.n-tv.de,Schock für die mediterrane Küche: Spaniens Dürre treibt Olivenöl-Preise in die Höhe,"Eigentlich wachsen und gedeihen Olivenbäume bei sonniger Hitze, doch zuletzt scheint es der Pflanze in Spanien ein wenig zu heiß zu werden. Die Blüten vertrocknen, bevor überhaupt Oliven wachsen können, aus denen dann Olivenöl hergestellt wird. Das schlägt si…",https://bilder1.n-tv.de/img/incoming/crop25057828/31213298-cImg_16_9-w1200/ol.jpg,2024-07-06T13:51:36Z,,,,de,'Dürre'
