index,url,valid,domain,title,description,image,published,archive,content,quote,language,keyword
https://www.zeit.de/news/2024-05/01/bericht-union-und-trainer-bjelica-trennen-sich-im-sommer,https://www.zeit.de/news/2024-05/01/bericht-union-und-trainer-bjelica-trennen-sich-im-sommer,0,www.zeit.de,Bundesliga: Bericht: Union und Trainer Bjelica trennen sich im Sommer,Hier finden Sie Informationen zu dem Thema „Bundesliga“. Lesen Sie jetzt „Bericht: Union und Trainer Bjelica trennen sich im Sommer“.,https://img.zeit.de/news/2024-05/01/bericht-union-und-trainer-bjelica-trennen-sich-im-sommer-image-group/wide__1300x731,2024-05-01T08:38:03Z,,"Der 1. FC Union Berlin und Trainer Nenad Bjelica gehen nach Informationen des «Kicker» ab Sommer wieder getrennte Wege.
Mehr Schlagzeilen
Der 52 Jahre alte Kroate hatte erst im November das Amt von… [+2375 chars]",,de,'Sommer'
https://www.welt.de/sport/fussball/bundesliga/article251309614/Bundesliga-Union-Berlin-und-Trainer-Bjelica-trennen-sich-wohl-im-Sommer.html,https://www.welt.de/sport/fussball/bundesliga/article251309614/Bundesliga-Union-Berlin-und-Trainer-Bjelica-trennen-sich-wohl-im-Sommer.html,0,www.welt.de,Union Berlin und Trainer Bjelica trennen sich im Sommer,Die Zusammenarbeit zwischen Union Berlin und Nenad Bjelica soll einem Medienbericht zufolge nach dieser Saison enden. Auch eine frühere Trennung sei diskutiert worden. Neben der sportlich enttäuschenden Saison gäbe es auch einige andere Gründe.,https://img.welt.de/img/sport/fussball/bundesliga/mobile251309658/9821359057-ci16x9-w1200/Fuenf-Fakten-zum-Spiel-des-1-FC-Union-Berlin.jpg,2024-05-01T09:18:15Z,,Der 1. FC Union Berlin und Trainer Nenad Bjelica gehen nach Informationen des Fachmagazins Kicker ab Sommer wieder getrennte Wege. Der 52 Jahre alte Kroate hatte erst im vergangenen November das Amt … [+1599 chars],,de,'Sommer'
https://www.diepresse.com/18424541/sommerurlaub-reiselust-gross-budget-kleiner,https://www.diepresse.com/18424541/sommerurlaub-reiselust-gross-budget-kleiner,0,www.diepresse.com,"Sommerurlaub: Reiselust groß, Budget klein(er)","Die Reiselust ist groß. Das zeigt eine aktuelle ÖAMTC-Umfrage. 95 Prozent wollen im Sommer verreisen, doch das Budget ist kleiner als in den Jahren zuvor.",https://img.diepresse.com/public/incoming/yew95o-imago-images-0442263988/alternates/DPR_SOCIAL_NACHRICHTEN/imago%20images%200442263988,2024-05-02T04:58:02Z,,"Die Reiselust ist groß. Das zeigt eine aktuelle ÖAMTC-Umfrage. 95 Prozent wollen im Sommer verreisen, doch das Budget ist kleiner als in den Jahren zuvor. 
Corona ist nur mehr eine dunkle Erinnerung… [+2344 chars]",,de,'Laub'
https://www.focus.de/politik/ausland/ukraine-krise/bombenangriffe-auf-millionenstadt-charkiw-in-der-ukraine-warum-putin-dort-ein-exempel-statuieren-will_id_259901989.html,https://www.focus.de/politik/ausland/ukraine-krise/bombenangriffe-auf-millionenstadt-charkiw-in-der-ukraine-warum-putin-dort-ein-exempel-statuieren-will_id_259901989.html,0,www.focus.de,Bombenangriffe auf Millionenstadt - Charkiw in der Ukraine – warum Putin dort ein Exempel statuieren will,"Russland will offenbar im Sommer eine Großoffensive auf die ukrainische Millionenstadt Charkiw starten. Das deutete Außenminister Sergei Lawrow an. Doch warum rückt die Stadt gerade jetzt in den Fokus der Russen? Und wären sie überhaupt in der Lage, einen sol…",https://p6.focus.de/img/fotos/id_259902361/ukraine-krieg-charkiw.jpg?im=Crop%3D%280%2C252%2C3360%2C1680%29%3BResize%3D%281200%2C627%29&impolicy=perceptual&quality=mediumHigh&hash=61f50c7e093c1e2a4433019007eddbf513ddbc56c169ed1adfa27393c19bdb5a,2024-05-02T05:17:39Z,,Russland will offenbar im Sommer eine Großoffensive auf die ukrainische Millionenstadt Charkiw starten. Das deutete Außenminister Sergei Lawrow an. Doch warum rückt die Stadt gerade jetzt in den Foku… [+4733 chars],,de,'Sommer'
https://www.stern.de/lifestyle/coole-gadgets-trends-2024--10-ideen-zum-abkuehlen-im-sommer-8767878.html,https://www.stern.de/lifestyle/coole-gadgets-trends-2024--10-ideen-zum-abkuehlen-im-sommer-8767878.html,0,www.stern.de,Erfrischung gefällig?: Abkühlung im Sommer: Mit diesen Gadgets trotzen Sie der Hitze,"Wenn die Temperaturen in die Höhe schnellen, wird der Alltag in nicht klimatisierten Räumen zur Qual. Damit Sie nicht zu sehr ins Schwitzen geraten, stellen wir Ihnen zehn kühlende Gadgets vor.",https://image.stern.de/8767912/t/Lh/v6/w1440/r1.7778/-/abkuehlung-im-sommer-2023.jpg,2024-05-02T05:48:00Z,,"1. Kühlendes Gelkissen
Die Hitzewelle besonders heftig zu spüren bekommen vor allem jene Menschen, die in einer Dachgeschosswohnung leben. Die Räume heizen sich tagsüber dermaßen auf, dass sie auch … [+4902 chars]",,de,'Sommer'
https://www.tagesspiegel.de/berlin/bezirke/klein-kuhl-und-gekachelt-drei-freibad-tipps-im-berliner-westen-11604317.html,https://www.tagesspiegel.de/berlin/bezirke/klein-kuhl-und-gekachelt-drei-freibad-tipps-im-berliner-westen-11604317.html,0,www.tagesspiegel.de,"Klein, kühl und gekachelt: Drei Freibad-Tipps im Berliner Westen","Das große Freibad von Spandau lockt 100.000 Gäste an, bleibt aber im Sommer 2024 geschlossen. Was nun? Es gibt drei Alternativen - und zwei sind bereits geöffnet.",https://www.tagesspiegel.de/images/freibad-sommerbad-staaken-west-berlin-spandau-foto-andre-gorke-foto-berliner-baderbetriebe-mit-spielenden-kindern5/alternates/BASE_16_9_W1400/freibad-sommerbad-staaken-west-berlin-spandau-foto-andr-goerke--foto-berliner-baederbetriebe-mit-spielenden-kindern.jpeg,2024-05-02T06:42:45Z,http://archive.md/20240502081919/https://www.tagesspiegel.de/berlin/bezirke/klein-kuhl-und-gekachelt-drei-freibad-tipps-im-berliner-westen-11604317.html,"Was für ein Sommerwetter! Doch erst in, schwitz!, 30 Tagen gibts die passende Erfrischung für Berlin-Spandau: Die Bäderbetriebe um Johannes Kleinsorg öffnen das kleine Freibad Staaken-West am 1. Juni… [+267 chars]",,de,'Sommer'
https://www.morgenpost.de/vermischtes/article242238892/Gewitter-und-Starkregen-in-Teilen-Deutschlands-moeglich.html,https://www.morgenpost.de/vermischtes/article242238892/Gewitter-und-Starkregen-in-Teilen-Deutschlands-moeglich.html,0,www.morgenpost.de,Gewitter und Starkregen in Teilen Deutschlands möglich,"Vor allem im Südwesten und in der Mitte Deutschlands kann es bis in den Freitag hinein sehr ungemütlich werden - laut Wetterdienst sind lokale Gewitter mit Starkregen, Hagel und Sturmböen möglich.",https://img.sparknews.funkemedien.de/242238890/242238890_1714662637_v16_9_1600.jpeg,2024-05-02T15:08:00Z,,"Offenbach. Vor allem im Südwesten und in der Mitte Deutschlands kann es bis in den Freitag hinein sehr ungemütlich werden - laut Wetterdienst sind lokale Gewitter mit Starkregen, Hagel und Sturmböen … [+1275 chars]",,de,'Gewitter'
https://www.focus.de/panorama/wetter-in-deutschland-schwere-gewitter-und-starkregen-ueber-nrw-fluege-verzoegern-sich_id_54933749.html,https://www.focus.de/panorama/wetter-in-deutschland-schwere-gewitter-und-starkregen-ueber-nrw-fluege-verzoegern-sich_id_54933749.html,0,www.focus.de,Wetter im Ticker - Schwere Gewitter und Starkregen über NRW - Flüge verzögern sich,Die Kälte ist vorbei: Der Tag der Arbeit brachte viel Sonne und sommerliche Temperaturen. Doch schon heute soll es wieder krachen. Wo Sie heute mit heftigen Gewittern und Regen rechnen müssen. Lesen Sie alles Wichtige im Wetter-Ticker.,https://p6.focus.de/img/fotos/id_259909392/schwere-gewitter-und-starkregen-ueber-nordrhein-westfalen.jpg?im=Crop%3D%280%2C0%2C3464%2C1732%29%3BResize%3D%281200%2C627%29&impolicy=perceptual&quality=mediumHigh&hash=6701d164adf764b313feb69da3c771d972c3a7172e014e551f05f377d094cb01,2024-05-02T16:46:46Z,,Die Kälte ist vorbei: Der Tag der Arbeit brachte viel Sonne und sommerliche Temperaturen. Doch schon heute soll es wieder krachen. Wo Sie heute mit heftigen Gewittern und Regen rechnen müssen. Lesen … [+19608 chars],,de,'Gewitter'
https://www.focus.de/panorama/wetter-in-deutschland-ein-evakuiertes-altenheim-und-alarm-im-ahrtal-unwetter-wuetete-ueber-deutschland_id_54933749.html,https://www.focus.de/panorama/wetter-in-deutschland-ein-evakuiertes-altenheim-und-alarm-im-ahrtal-unwetter-wuetete-ueber-deutschland_id_54933749.html,0,www.focus.de,Wetter im Ticker - Ein evakuiertes Altenheim und Alarm im Ahrtal - Unwetter wütete über Deutschland,"Wasser in Kellern, auf Straßen, Blitzeinschläge, Zugausfälle: Vor allem im Westen und der Mitte des Landes sorgten Gewitter und Starkregen am Donnerstag für Probleme. In der Nacht beruhigt sich die Lage wieder. Lesen Sie alles Wichtige im Wetter-Ticker.",https://p6.focus.de/img/regional/baden-wuerttemberg/id_259909655/steine-wurden-bei-einer-ueberflutung-in-der-gemeinde-bisingen-herausgerissen..jpg?im=Crop%3D%280%2C169%2C2048%2C1024%29%3BResize%3D%281200%2C627%29&impolicy=perceptual&quality=mediumHigh&hash=9370d4e79f19e44b9b1956c672b818ac70299f41c8ec9c0687839d1325e9b9b2,2024-05-02T16:46:46Z,,"Wasser in Kellern, auf Straßen, Blitzeinschläge, Zugausfälle: Vor allem im Westen und der Mitte des Landes sorgten Gewitter und Starkregen am Donnerstag für Probleme. In der Nacht beruhigt sich die L… [+27146 chars]",,de,'Gewitter'
https://www.stern.de/gesellschaft/regional/hessen/wetter--gewitter-ziehen-ueber-hessen-hinweg-34677544.html,https://www.stern.de/gesellschaft/regional/hessen/wetter--gewitter-ziehen-ueber-hessen-hinweg-34677544.html,0,www.stern.de,Wetter: Gewitter ziehen über Hessen hinweg,"Eine Gewitterfront bringt Blitz, Donner und Regenschauer nach Hessen. Die Auswirkungen halten sich zunächst in Grenzen. In der Nacht sollte die Gewittergefahr zurückgehen.",https://image.stern.de/34677546/t/eD/v3/w1440/r1.7778/-/02--urnnewsmldpacom2009010124050299886549v2w800h600l1015t107r2116b1343jpeg---06aa607e7525c3c6.jpg,2024-05-02T17:12:24Z,,"Eine Gewitterfront bringt Blitz, Donner und Regenschauer nach Hessen. Die Auswirkungen halten sich zunächst in Grenzen. In der Nacht sollte die Gewittergefahr zurückgehen.
Eine Gewitterfront ist am … [+1323 chars]",,de,'Gewitter'
https://www.bild.de/regional/nordrhein-westfalen/unwetter-im-westen-strassen-ueberflutet-felder-mit-hagel-bedeckt-6633baef9065ba469e7a9450,https://www.bild.de/regional/nordrhein-westfalen/unwetter-im-westen-strassen-ueberflutet-felder-mit-hagel-bedeckt-6633baef9065ba469e7a9450,0,www.bild.de,"Unwetter über dem Westen - Straßen überflutet, Felder mit Hagel bedeckt","Daumendicke Hagelkörner, überspülte Straßen, Sturmböen! Die Gewitterfront hat den Westen erreicht und lokal Schäden angerichtet.","https://images.bild.de/6633baef9065ba469e7a9450/02c526700b549e4e903b79490f4040f2,255d91e4?w=1280",2024-05-02T17:24:59Z,http://archive.md/20240502195905/https://www.bild.de/regional/nordrhein-westfalen/unwetter-im-westen-strassen-ueberflutet-felder-mit-hagel-bedeckt-6633baef9065ba469e7a9450,"Essen/Offenbach Daumendicke Hagelkörner, überspülte Straßen, Sturmböen! Die Gewitterfront hat den Westen erreicht und vor allem die Eifel getroffen. Polizei und Feuerwehr berichten lokal von umgestür… [+3940 chars]",,de,'Gewitter'
https://www.stern.de/panorama/wetter/unwetter--heftige-gewitter-ziehen-ueber-teile-deutschlands-34679818.html,https://www.stern.de/panorama/wetter/unwetter--heftige-gewitter-ziehen-ueber-teile-deutschlands-34679818.html,0,www.stern.de,"Unwetterwarnung: Starkregen, Hagel, Sturmböen: Heftige Gewitter ziehen über Teile Deutschlands","Nach dem schönen Start in den Mai dürfte es in den nächsten Tagen ungemütlich werden. Unwetter drohen vor allem im Südwesten und in der Mitte Deutschlands. Laut Wetterdienst sind Gewitter mit Starkregen, Hagel und Sturmböen möglich.",https://image.stern.de/34679820/t/TU/v1/w1440/r1.7778/-/unwetter-duisburg.jpg,2024-05-02T17:53:00Z,,Nach dem schönen Start in den Mai dürfte es in den nächsten Tagen ungemütlich werden. Unwetter drohen vor allem im Südwesten und in der Mitte Deutschlands. Laut Wetterdienst sind Gewitter mit Starkre… [+2678 chars],,de,'Gewitter'
https://www.welt.de/vermischtes/article251335440/Unwetter-Schwere-Gewitter-in-NRW-Ort-in-Baden-Wuerttemberg-teils-ueberflutet.html,https://www.welt.de/vermischtes/article251335440/Unwetter-Schwere-Gewitter-in-NRW-Ort-in-Baden-Wuerttemberg-teils-ueberflutet.html,0,www.welt.de,Schwere Gewitter in NRW – Ort in Baden-Württemberg teils überflutet,"Im Südwesten und in Hessen kann es bis Freitag ungemütlich werden. Über Nordrhein-Westfalen entlud sich am Donnerstag ein erstes Gewitter, in Frankfurt drang Wasser in den Intensivbereich einer Klinik ein. Besonders hart traf es Bisingen in Baden-Württemberg.",https://img.welt.de/img/vermischtes/mobile251335442/6731351797-ci16x9-w1200/Schwere-Gewitter-und-Starkregen-ueber-Nordrhein-Westfalen.jpg,2024-05-02T18:01:54Z,,In einem Streifen vom Südwesten Deutschlands bis in die Mitte des Landes warnt der Deutsche Wetterdienst (DWD) vor möglichen lokalen Gewittern mit Starkregen. Von Donnerstagnachmittag bis in die Nach… [+3769 chars],,de,'Gewitter'
https://www.welt.de/vermischtes/article251335440/Unwetter-Schwere-Gewitter-in-NRW-Deutscher-Wetterdienst-warnt-vor-Starkregen.html,https://www.welt.de/vermischtes/article251335440/Unwetter-Schwere-Gewitter-in-NRW-Deutscher-Wetterdienst-warnt-vor-Starkregen.html,0,www.welt.de,Schwere Gewitter in NRW – Deutscher Wetterdienst warnt vor Starkregen,"Vor allem im Südwesten und in Hessen kann es bis Freitag ungemütlich werden. Über Nordrhein-Westfalen entlud sich am Donnerstag ein erstes Gewitter, in Frankfurt drang Wasser in den Intensivbereich einer Klinik ein. Die Feuerwehr konnte den Schaden aber eingr…",https://img.welt.de/img/vermischtes/mobile251335442/6731351797-ci16x9-w1200/Schwere-Gewitter-und-Starkregen-ueber-Nordrhein-Westfalen.jpg,2024-05-02T18:01:54Z,,In einem Streifen vom Südwesten Deutschlands bis in die Mitte des Landes warnt der Deutsche Wetterdienst (DWD) vor möglichen lokalen Gewittern mit Starkregen. Von Donnerstagnachmittag bis in die Nach… [+2826 chars],,de,'Gewitter'
https://www.n-tv.de/panorama/Erste-Unwetter-im-Sueden-Starkregen-und-Gewitter-article24916942.html,https://www.n-tv.de/panorama/Erste-Unwetter-im-Sueden-Starkregen-und-Gewitter-article24916942.html,0,www.n-tv.de,"Geflutete Straßen, volle Keller: Erste Unwetter im Süden - Starkregen und Gewitter",Nach der Hitze die Unwetter - im Süden hat der Wetterwechsel begonnen. Rheinland-Pfalz und Hessen melden teils heftige Gewitter. Lokal werden Straßen überflutet. Am Flughafen Frankfurt ruht kurzzeitig der Verkehr. Vom Deutschen Wetterdienst gibt es für zahlre…,https://bilder4.n-tv.de/img/incoming/crop24916943/2221321665-cImg_16_9-w1200/6b40eed129fa6126f4e85f7a8bf5576d.jpg,2024-05-02T18:14:37Z,,Nach der Hitze die Unwetter - im Süden hat der Wetterwechsel begonnen. Rheinland-Pfalz und Hessen melden teils heftige Gewitter. Lokal werden Straßen überflutet. Am Flughafen Frankfurt ruht kurzzeiti… [+2175 chars],,de,'Gewitter'
https://www.n-tv.de/panorama/Heftige-Unwetter-im-Sueden-Fruehsommer-endet-mit-Starkregen-und-Gewittern-article24916942.html,https://www.n-tv.de/panorama/Heftige-Unwetter-im-Sueden-Fruehsommer-endet-mit-Starkregen-und-Gewittern-article24916942.html,0,www.n-tv.de,"Geflutete Straßen, volle Keller: Heftige Unwetter im Süden - Frühsommer endet mit Starkregen und Gewittern",Nach der Hitze die Unwetter - im Süden hat der Wetterwechsel begonnen. Mehrere Bundesländer melden teils heftige Gewitter. Lokal werden Straßen überflutet. Am Flughafen Frankfurt ruht kurzzeitig der Verkehr. Vom Deutschen Wetterdienst gibt es für zahlreiche K…,https://bilder3.n-tv.de/img/incoming/crop24917022/1241326902-cImg_16_9-w1200/54770f712d27c1fa0d0e4929ae87f5a2.jpg,2024-05-02T18:14:37Z,,Nach der Hitze die Unwetter - im Süden hat der Wetterwechsel begonnen. Mehrere Bundesländer melden teils heftige Gewitter. Lokal werden Straßen überflutet. Am Flughafen Frankfurt ruht kurzzeitig der … [+4065 chars],,de,'Gewitter'
https://www.tagesschau.de/inland/deutschland-unwetter-starkregen-100.html,https://www.tagesschau.de/inland/deutschland-unwetter-starkregen-100.html,0,www.tagesschau.de,Unwetter zieht mit kräftigen Regenfällen über Westdeutschland,Der Deutsche Wetterdienst warnt vor kräftigen Gewittern vom Südwesten bis in die Mitte Deutschlands. In Nordrhein-Westfalen kam es bereits zu starkem Niederschlag - größere Schäden sind bislang aber nicht bekannt.,https://images.tagesschau.de/image/5da5a227-039d-4059-8571-099202b86946/AAABjzpSwqk/AAABjwnlFvA/16x9-1280/unwetter-duisburg-100.jpg,2024-05-02T18:26:08Z,,"Stand: 02.05.2024 20:26 Uhr
Der Deutsche Wetterdienst warnt vor kräftigen Gewittern vom Südwesten bis in die Mitte Deutschlands. In Nordrhein-Westfalen kam es bereits zu starkem Niederschlag - größe… [+2510 chars]",,de,'Gewitter'
https://www.stern.de/gesellschaft/regional/baden-wuerttemberg/unwetter--ueberflutete-strassen-und-keller-nach-gewitter-und-starkregen-34680004.html,https://www.stern.de/gesellschaft/regional/baden-wuerttemberg/unwetter--ueberflutete-strassen-und-keller-nach-gewitter-und-starkregen-34680004.html,0,www.stern.de,Unwetter: Überflutete Straßen und Keller nach Gewitter und Starkregen,"Gewitter und Starkregen haben im Südwesten teils Bäche anschwellen lassen, Straßen wurden überflutet und Keller liefen voll. Besonders hart traf es Bisingen im Zollernalbkreis, wo laut Polizei am frühen Donnerstagabend Keller und Straßen unter Wasser standen.…",https://image.stern.de/34680006/t/aU/v1/w1440/r1.7778/-/02--urnnewsmldpacom2009010124050299894928v3w800h600l640t422r1920b1272jpeg---7e98b2787f3195f0.jpg,2024-05-02T19:22:32Z,,"Gewitter und Starkregen haben im Südwesten teils Bäche anschwellen lassen, Straßen wurden überflutet und Keller liefen voll. Besonders hart traf es Bisingen im Zollernalbkreis, wo laut Polizei am frü… [+1764 chars]",,de,'Gewitter'
https://www.zeit.de/news/2024-05/02/ueberflutete-strassen-und-keller-nach-gewitter-und-starkregen,https://www.zeit.de/news/2024-05/02/ueberflutete-strassen-und-keller-nach-gewitter-und-starkregen,0,www.zeit.de,Unwetter: Überflutete Straßen und Keller nach Gewitter und Starkregen,Hier finden Sie Informationen zu dem Thema „Unwetter“. Lesen Sie jetzt „Überflutete Straßen und Keller nach Gewitter und Starkregen“.,https://img.zeit.de/news/2024-05/02/ueberflutete-strassen-und-keller-nach-gewitter-und-starkregen-image-group/wide__1300x731,2024-05-02T19:22:32Z,,"Gewitter und Starkregen haben im Südwesten teils Bäche anschwellen lassen, Straßen wurden überflutet und Keller liefen voll. Besonders hart traf es Bisingen im Zollernalbkreis, wo laut Polizei am frü… [+2080 chars]",,de,'Gewitter'
https://www.stern.de/panorama/wetter--schaeden-nach-starkregen-und-gewittern-34679728.html,https://www.stern.de/panorama/wetter--schaeden-nach-starkregen-und-gewittern-34679728.html,0,www.stern.de,Wetter: Schäden nach Starkregen und Gewittern,"Wasser in Kellern und auf Straßen, Blitzeinschläge, Zugausfälle: Vor allem im Westen Deutschlands sorgen Gewitter und Starkregen für Schwierigkeiten.",https://image.stern.de/34679816/t/uZ/v4/w1440/r1.7778/-/02--urnnewsmldpacom2009010124050299892734v4w800h600l773t153r2150b1031jpeg---0befc54460b1dc1f.jpg,2024-05-02T19:26:44Z,,"Wasser in Kellern und auf Straßen, Blitzeinschläge, Zugausfälle: Vor allem im Westen Deutschlands sorgen Gewitter und Starkregen für Schwierigkeiten.
Gewitter und Starkregen haben in einigen Regione… [+4155 chars]",,de,'Gewitter'
https://www.zeit.de/news/2024-05/02/gewitter-ueber-nrw-feuerwehr-nichts-dramatisches,https://www.zeit.de/news/2024-05/02/gewitter-ueber-nrw-feuerwehr-nichts-dramatisches,0,www.zeit.de,Unwetter: Gewitter über NRW - Feuerwehr: «Nichts Dramatisches»,"Hier finden Sie Informationen zu dem Thema „Unwetter“. Lesen Sie jetzt „Gewitter über NRW - Feuerwehr: ""Nichts Dramatisches""“.",https://img.zeit.de/news/2024-05/02/gewitter-ueber-nrw-feuerwehr-nichts-dramatisches-image-group/wide__1300x731,2024-05-02T19:38:22Z,,"Das schlechte Wetter ist zurück: Starke Gewitter mit viel Regen sind am Donnerstag über Nordrhein-Westfalen hinweggezogen. Der Deutsche Wetterdienst hatte vor Hagel und stürmischen Böen gewarnt, und … [+1995 chars]",,de,'Gewitter'
https://www.stern.de/gesellschaft/regional/nordrhein-westfalen/unwetter--gewitter-ueber-nrw---feuerwehr---nichts-dramatisches--34680056.html,https://www.stern.de/gesellschaft/regional/nordrhein-westfalen/unwetter--gewitter-ueber-nrw---feuerwehr---nichts-dramatisches--34680056.html,0,www.stern.de,"Unwetter: Gewitter über NRW - Feuerwehr: ""Nichts Dramatisches""","Das T-Shirt-Wetter ist vorerst vorbei, Pullis könnten wieder nötig werden: Nach zwei sonnigen Tagen sind dunkle Wolken am Himmel Nordrhein-Westfalens erschienen. Wer Pech hatte, wurde klitschnass.",https://image.stern.de/34680058/t/ei/v1/w1440/r1.7778/-/02--urnnewsmldpacom2009010124050299895150v3w800h600l640t322r1920b969jpeg---f02cea0f996e3463.jpg,2024-05-02T19:38:22Z,,"Das T-Shirt-Wetter ist vorerst vorbei, Pullis könnten wieder nötig werden: Nach zwei sonnigen Tagen sind dunkle Wolken am Himmel Nordrhein-Westfalens erschienen. Wer Pech hatte, wurde klitschnass.
D… [+1542 chars]",,de,'Gewitter'
https://www.stern.de/gesellschaft/regional/baden-wuerttemberg/unwetter--polizei-nach-ueberflutungen-in-bisingen--lage-entspannt-sich-34680114.html,https://www.stern.de/gesellschaft/regional/baden-wuerttemberg/unwetter--polizei-nach-ueberflutungen-in-bisingen--lage-entspannt-sich-34680114.html,0,www.stern.de,Unwetter: Polizei nach Überflutungen in Bisingen: Lage entspannt sich,"Gewitter und Starkregen treffen Bisingen im Zollernalbkreis schwer: Geschäfte und Keller stehen unter Wasser, Straßen sind überflutet .Am Abend gibt die Polizei aber vorsichtige Entwarnung.",https://image.stern.de/34680116/t/4_/v1/w1440/r1.7778/-/02--urnnewsmldpacom2009010124050299895573v3w800h600l381t422r1661b1272jpeg---5225404f44b6b690.jpg,2024-05-02T20:17:18Z,,"Gewitter und Starkregen treffen Bisingen im Zollernalbkreis schwer: Geschäfte und Keller stehen unter Wasser, Straßen sind überflutet .Am Abend gibt die Polizei aber vorsichtige Entwarnung.
Nach Gew… [+921 chars]",,de,'Gewitter'
